title,summary,link,published
เซ็นทรัล จัดเทศกาลเจรับเทรนด์ใหม่ เจาะกลุ่ม Gen Z ตั้งเป้าทราฟฟิคคึกคัก โต 15-20%,"ดร. ณัฐกิตติ์ ตั้งพูลสินธนา ผู้ช่วยกรรมการผู้จัดการใหญ่ […]
The post เซ็นทรัล จัดเทศกาลเจรับเทรนด์ใหม่ เจาะกลุ่ม Gen Z ตั้งเป้าทราฟฟิคคึกคัก โต 15-20% appeared first on มติชนออนไลน์.",https://www.matichon.co.th/news-monitor/news_2963948,29_09_2021
จีซู เมมเบอร์วง BLACKPINK นั่งฟรอนต์โรว์ ปารีส แฟชั่น วีค ชมโชว์แบรนด์ดัง DIOR,"จีซู เมมเบอร์วง BLACKPINK นั่งฟรอนต์โรว์ ปารีส แฟชั่น ว […]
The post จีซู เมมเบอร์วง BLACKPINK นั่งฟรอนต์โรว์ ปารีส แฟชั่น วีค ชมโชว์แบรนด์ดัง DIOR appeared first on มติชนออนไลน์.",https://www.matichon.co.th/entertainment/news_2963946,29_09_2021
‘ชิรูด์’ รับพรีเมียร์ลีกหนักเกินรับไหว จนต้องย้ายไปอิตาลี,"‘ชิรูด์’ รับพรีเมียร์ลีกหนักเกินรับไหว จนต้ […]
The post ‘ชิรูด์’ รับพรีเมียร์ลีกหนักเกินรับไหว จนต้องย้ายไปอิตาลี appeared first on มติชนออนไลน์.",https://www.matichon.co.th/sport-slide/news_2962526,29_09_2021
ไซมิส แอสเสท เล็งขยายฐานลูกค้า New Gen ซื้อบ้าน-คอนโด ด้วยเงินดิจิทัล ผ่าน Bitkub ได้,"นายขจรศิษฐ์ สิ่งสรรเสริญ ประธานเจ้าหน้าที่บริหาร บริษัท […]
The post ไซมิส แอสเสท เล็งขยายฐานลูกค้า New Gen ซื้อบ้าน-คอนโด ด้วยเงินดิจิทัล ผ่าน Bitkub ได้ appeared first on มติชนออนไลน์.",https://www.matichon.co.th/news-monitor/news_2963959,29_09_2021
‘แม็คโคร’ ขอมติผู้ถือหุ้น รับโอนกิจการกลุ่มโลตัสส์ ไทย-เมเลย์ เล็งออกหุ้นเพิ่มทุนเสนอรายย่อย ไม่ต่ำกว่า 15%,"นางสุชาดา อิทธิจารุกุล ประธานเจ้าหน้าที่บริหาร –  […]
The post ‘แม็คโคร’ ขอมติผู้ถือหุ้น รับโอนกิจการกลุ่มโลตัสส์ ไทย-เมเลย์ เล็งออกหุ้นเพิ่มทุนเสนอรายย่อย ไม่ต่ำกว่า 15% appeared first on มติชนออนไลน์.",https://www.matichon.co.th/news-monitor/news_2963963,29_09_2021
JP เปิดแบรนด์ “สุภาพโอสถ” ปั้นพืชน้ำวูฟเฟียเชิงพาณิชย์ รับเทรนด์สุขภาพ “อลงกรณ์” ชี้รัฐส่งเสริม ทั่วโลกนิยม Plant-based Food,"นายอลงกรณ์ พลบุตร ที่ปรึกษารัฐมนตรีว่าการกระทรวงเกษตรแล […]
The post JP เปิดแบรนด์ “สุภาพโอสถ” ปั้นพืชน้ำวูฟเฟียเชิงพาณิชย์ รับเทรนด์สุขภาพ “อลงกรณ์” ชี้รัฐส่งเสริม ทั่วโลกนิยม Plant-based Food appeared first on มติชนออนไลน์.",https://www.matichon.co.th/news-monitor/news_2963969,29_09_2021
หลักทรัพย์บัวหลวง แนะสร้างโอกาสลงทุน “กลุ่ม Healthcare” ตลาดสหรัฐฯ รับเทรนด์สังคมผู้สูงวัย,"นายรัฐศรัณย์ ธนไพศาลกิจ ผู้อำนวยการ ฝ่ายหลักทรัพย์ต่างป […]
The post หลักทรัพย์บัวหลวง แนะสร้างโอกาสลงทุน “กลุ่ม Healthcare” ตลาดสหรัฐฯ รับเทรนด์สังคมผู้สูงวัย appeared first on มติชนออนไลน์.",https://www.matichon.co.th/news-monitor/news_2963972,29_09_2021
ไฟต์ล้างแค้นภาค 3! ‘พีพีทีวี’ ยิงสดมวยโลก ‘ฟิวรี่’ ตะบัน ‘ไวล์เดอร์’ วันที่ 10 ต.ค.นี้,"ไฟต์ล้างแค้นภาค 3! ‘พีพีทีวี’ ยิงสดมวยโลก & […]
The post ไฟต์ล้างแค้นภาค 3! ‘พีพีทีวี’ ยิงสดมวยโลก ‘ฟิวรี่’ ตะบัน ‘ไวล์เดอร์’ วันที่ 10 ต.ค.นี้ appeared first on มติชนออนไลน์.",https://www.matichon.co.th/sport/boxing/news_2962459,29_09_2021
คอลัมน์ แกะรอยต่างแดน : 20 ปีผ่านไป กับ “กราวด์ ซีโร่” ที่ยังไม่เสร็จสมบูรณ์,"คอลัมน์ แกะรอยต่างแดน : 20 ปีผ่านไป กับ “กราวด์ ซ […]
The post คอลัมน์ แกะรอยต่างแดน : 20 ปีผ่านไป กับ “กราวด์ ซีโร่” ที่ยังไม่เสร็จสมบูรณ์ appeared first on มติชนออนไลน์.",https://www.matichon.co.th/foreign/indepth/news_2962882,29_09_2021
