title,summary,link,published
เอพี X อิเกีย เปิดตัวต้นแบบคอนโดฯอนาคต แก้โจทย์ยากพื้นที่จำกัดคอนโดฯ ยุคหลังโควิด,เอพีฯ ผนึก อิเกีย ประเทศไทย เปิดต้นแบบสเปซ ‘Multi-Functional Future’ ดีไซน์ยุคใหม่แก้โจทย์ข้อจำกัดการใช้ชีวิตในคอนโดตรงจุด เจาะลูกค้าอนาคต นำร่องแฟล็กชิพคอนโดแบรนด์ ‘ASPIRE’,https://www.posttoday.com/property/666027,2021_10_20
"ด่วน!! ศาลวินิฉัย""ไพบูลย์""ไม่พ้นสส.ปมยุบพรรคตัวเอง","ศาลรธน.วินิจฉัย""ไพบูลย์""รอด ปมยุบพรรคประชาชนปฏิรูปก่อนย้ายไปพปชร. เหตุเป็นสส.อยู่แล้ว",https://www.posttoday.com/politic/news/666026,2021_10_20
มท.เร่งพัฒนาคลองแม่ข่าเป็นต้นแบบการฟื้นฟูชุมชนเมืองภาคเหนือ,ปลัดมหาดไทยประชุมติดตามการพัฒนาคลองแม่ข่า จ.เชียงใหม่เพื่อเป็นต้นแบบฟื้นฟูแม่น้ำลำคลองและชีวิตความเป็นอยู่ สิ่งแวดล้อมชุมชนเมืองให้มีสภาวะที่ดีของภาคเหนือ,https://www.posttoday.com/social/local/666030,2021_10_20
กนอ.โชว์ 4 กลยุทธ์ Smart Eco อุตสาหกรรมยั่งยืน,กนอ.เดินหน้านำ BCG Economy พัฒนาเมืองอุตสาหกรรมเชิงนิเวศน์ ชู 4 ปัจจัยสำคัญ ปรับเทคโนโลยีลดใช้พลังงาน ตั้งเป้าลดก๊าซเรือนกระจก,https://www.posttoday.com/economy/news/666029,2021_10_20
“ศักดิ์สยาม”ลุยตรวจ2สนามบินเตรียมเปิดประเทศ1พ.ย.64,"""ศักดิ์สยาม""ตรวจความพร้อมสนามบินดอนเมือง-สุวรรณภูมิ รับเปิดประเทศ 1พ.ย.64 ดึงบทเรียนภูเก็ตแซนด์บ็อกซ์แก้ไข อำนวยความสะดวก-สร้างความปลอดภัยของนักท่องเที่ยว",https://www.posttoday.com/social/general/666036,2021_10_20
"ทีเอ็มบีธนชาต มีกำไรสุทธิ 2,359 ล้านบาท","ทีเอ็มบีธนชาต มีกำไรสุทธิ 2,359 ล้านบาท ในไตรมาส 3 ปี 2564 เพิ่มขึ้น 46% เมื่อเทียบกับไตรมาส 3 ปีก่อนหน้า",https://www.posttoday.com/finance-stock/news/666034,2021_10_20
อย่าเพิ่งวางใจโควิด! ประเทศที่คิดว่าจะรอดยังไม่รอด,ขณะนี้บางประเทศที่ทำท่าว่าจะคุม Covid-19 อยู่และเริ่มกลับไปใช้ชีวิตตามปกติต้องกลับมาเจอการระบาดหนักอีกครั้ง,https://www.posttoday.com/world/666032,2021_10_20
ธุรกิจฟื้นตัว บสย. ค้ำทะลุ 2 แสนล้านบาท,ธุรกิจฟื้นตัว บสย. ค้ำทะลุ 2 แสนล้านบาท หนุนจ้างงานกว่า 2 ล้านราย ลุยโค้งสุดท้าย เติมทุน SMEs Restart กิจการ,https://www.posttoday.com/finance-stock/news/666038,2021_10_20
แก้ไขแบบสัญญาในส่วนการคืนหลักประกันการรับเงินค่าพัสดุล่วงหน้า,กรมบัญชีกลางแก้ไขแบบสัญญาในส่วนการคืนหลักประกันการรับเงินค่าพัสดุล่วงหน้า เพื่อลดภาระให้ผู้ประกอบการสามารถนำหลักประกันไปบริหารเงินทุนได้คล่องตัวมากขึ้น,https://www.posttoday.com/finance-stock/news/666037,2021_10_20
โคราชเร่งขุดขยายคลองยังไม่มีจระเข้หลุดจากฟาร์ม,นครราชสีมา-ขอให้ไว้วางใจไม่มีจระเข้หลุดจากฟาร์ม ผู้ว่าฯโคราชประสานรถแบคโฮ 3 คันขุดขยายคลอง เร่งระบายน้ำท่วมออกจากพื้นที่,https://www.posttoday.com/social/local/666041,2021_10_20
"“กรุงไทย”กำไรสุทธิช่วง 9 เดือน 16,645 ล้านบาท","“กรุงไทย” ประกาศผลดำเนินงานช่วง 9 เดือนปี 2564 มีกำไรสุทธิ 16,645 ล้านบาท เพิ่มขึ้น 25.3%",https://www.posttoday.com/finance-stock/news/666046,2021_10_20
เอกชนชี้มาตรการลดค่าครองชีพภาครัฐ ดันเงินหมุนเข้าระบบศก.9.5 หมื่นลบ.,หอการค้าฯ คาด 4 โครงการลดค่าครองชีพของรัฐ กระตุ้นจีดีพีไตรมาส4 โต 1.0-1.5% หวัง 2 เดือนสุดท้ายกำลังซื้อจะกลับมา,https://www.posttoday.com/economy/news/666044,2021_10_20
“สงกรานต์ เตชะณรงค์” เผยเคล็ดลับการปั้นหุ่นปัง กล้ามเนื้อแน่นปั๊กๆ,“สงกรานต์ เตชะณรงค์” มาเผยเคล็ดลับการปั้นหุ่นให้ได้กล้ามเนื้อสุดแน่น ปังมาก!,https://www.posttoday.com/ent/news/666042,2021_10_20
สหรัฐปลูกถ่ายไตหมูในมนุษย์สำเร็จครั้งแรกของโลก,แพทย์สหรัฐปลูกถ่ายไตหมูในมนุษย์สำเร็จเป็นครั้งแรกของโลก ปูทางสู่การปลูกถ่ายอวัยวะที่ใช้ชิ้นส่วนจากสัตว์,https://www.posttoday.com/world/666043,2021_10_20
อังกฤษก่อภัยอดอยากที่ฆ่าชาวอินเดียนับล้าน,ย้อนรอยวิกฤตความอดอยากในอินเดียภายใต้การปกครองของอังกฤษ,https://www.posttoday.com/world/666045,2021_10_20
ตำรวจตามแกะรอยแก๊งดูดเงิน ผู้เสียหายทุกรายได้คืนแน่,"ตร.จับมือแบงก์ชาติหาเส้นทางแก๊งดูดเงิน พบ 132 ล้าน มี 17,500 ผู้เสียหายขอคืนเงินแล้ว สมาคมธนาคารไทยย้ำทุกรายได้เงินคืนแน่นอน",https://www.posttoday.com/social/general/666049,2021_10_20
"""ประยุทธ์""เยี่ยมให้กำลังน้ำท่วมสิงห์บุรีเปิดตัวโดรนส่งกล่องยา",นายกรัฐมนตรีนำคณะลงพื้นที่เยี่ยมเยียนให้กำลังใจผู้ประสบอุทกภัยน้ำท่วมพื้นที่จ.สิงห์บุรี พร้อมเปิดตัวโดรนส่งกล่องยาไปยังบ้านผู้ประสบอุทกภัยไม่สามารถเดินทางออกจากบ้านพักได้,https://www.posttoday.com/politic/news/666051,2021_10_20
พระเร่งสร้างสะพานไม้หนีน้ำท่วมรับโยมทำบุญออกพรรษา,พระนครศรีอยุธยา-พระเร่งสร้างสะพานไม้ ทางเดินหนีน้ำท่วม รอบ 2 ในช่วง 1 เดือนให้ทันกำหนดทำบุญออกพรรษา 21-22 ตุลาคมนี้,https://www.posttoday.com/social/local/666055,2021_10_20
"""หญิงหน่อย""อ้อนขอคะแนนคนอีสาน เปิดตัวผู้สมัคร ส.ส.ขอนแก่นเขต 1","“สุดารัตน์”นำทีมไทยสร้างไทย อ้อนขอคะแนนคนอีสาน เปิดตัวทายาทนายกเทศมนตรีเมืองเก่า เป็นผู้สมัคร ส.ส.ขอนแก่นเขต 1 ชูนโยบาย “บำนาญประชาชน 3,000 บาท”",https://www.posttoday.com/politic/news/666054,2021_10_20
"จีนกับข้อหากลืนชาติ ด้วยกลยุทธ์ ""หนอนไหมเขมือบ""","ข้อกล่าวหาต่อจีนมีตั้งแต่การใช้หนี้เป็นกับดักเพื่อจับประเทศลูกหนี้เป็นตัวประกัน ไปจนถึงกลาวข้อกล่าวหาว่าค่อยๆ กลืนแผ่นดินอื่นด้วยกลยุทธ์ ""หนอนไหมกลืนใบหม่อน"" ที่น่าสังเกตคือข้อกล่าวหาเรื่อง Debt-trap และ Salami slicing tactics มาจากอินเดียซึ่งเป็น ""คู่กรณี"" กับจีน",https://www.posttoday.com/world/666047,2021_10_20
พิสูจน์กลิ่นไม้เช็ดก้นพระร่วงเหม็นสมคำร่ำลือ,สุโขทัย-นักข่าวลุยพิสูจน์กลิ่น “ไม้เช็ดก้นพระร่วง” ยันเหม็นขมคอ-ฉุนแรงทะลุแมสก์ สมคำร่ำลือ,https://www.posttoday.com/social/local/666052,2021_10_20
"กรุงศรีเผยผลกำไรสุทธิ 9 เดือน 27,409 ล้านบาท","กรุงศรีเผยผลกำไรสุทธิ 9 เดือนแรกปี 2564 จำนวน 27,409 ล้านบาท ดันสินเชื่อพาณิชย์โตต่อเนื่อง หนุนสภาพคล่องลูกค้า ฟื้นธุรกิจ",https://www.posttoday.com/finance-stock/news/666056,2021_10_20
