title,summary,link,published
เชิดชูมรดกภูมิปัญญานวดไทย สมุนไพร และท่องเที่ยวเชิงสุขภาพสร้างโอกาสทางเศรษฐกิจ,29 ตุลาคม วันภูมิปัญญาการแพทย์แผนไทยแห่งชาติ กระทรวงสาธารณสุข กระทรวงวัฒนธรรม กระทรวงท่องเที่ยวและกีฬา ร่วมกับสมาพันธ์โลกนวดไทยและสปา ที่มีสมาชิกกว่า 57 ประเทศทั่วโลก และไอคอนสยาม ร่วมแถลงความร่วมมือใน “โครงการแลนด์มาร์คนวดไทย” เพื่อเฉลิมพระเกียรติพระบาทสมเด็จพระนั่งเกล้าเจ้าอยู่หัว “พระบิดาแห่งการแพทย์แผนไทย” แสดงศักยภาพ ความพร้อม ในการร่วมสืบสาน ต่อยอด ภูมิปัญญานวดไทย สมุนไพรไทย และการท่องเที่ยวเชิงสุขภาพ สร้างโอกาสทางเศรษฐกิจ บรรเทาผลกระทบให้กับผู้ประกอบการ และร่วมกันร่วมผลักดันและยกระดับมาตรฐานให้ประเทศไทย เป็น ศูนย์กลางสุขภาพนานาชาติ (MEDICAL HUB) นายอิทธิพล คุณปลื้ม รัฐมนตรีว่าการกระทรวงวัฒนธรรม กล่าวว่าผลกระทบจากโควิด19 ได้สร้างจุดเปลี่ยนให้ผู้บริโภคใส่ใจในการดูแลสุขภาพทั้งตัวเองและคนรอบข้างมากขึ้น นับเป็นโอกาสของการประชาสัมพันธ์ส่งเสริมนำมรดกภูมิปัญญาวัฒนธรรม “นวดไทย” ศาสตร์บำบัดและรักษาโรคแขนงหนึ่งของการแพทย์แผนไทย ให้เป็นส่วนหนึ่งในการดูแลและฟื้นฟูสุขภาพทั่วโลก ภูมิปัญญาการนวดไทย เป็นศาสตร์และศิลป์มรดกภูมิปัญญาที่ได้รับการสืบทอดกันมาจากรุ่นสู่รุ่น ปัจจุบันมีองค์กรต่างๆ ที่ส่งเสริมและพัฒนาการนวดไทย กว่า ๕๐ องค์กร รวมไปถึงองค์กรภาควิชาชีพ สถาบันการเรียนการสอน และสถานประกอบการเพื่อสุขภาพทั่วประเทศ อีกทั้งเครือข่ายความร่วมมือจากสมาพันธ์โลกนวดไทยและสปาที่มีสมาชิกกว่า 57 ประเทศทั่วโลก โครงการ “แลนด์มาร์คนวดไทย” จึงเป็นโครงการที่จะจัดขึ้นเพื่อเฉลิมฉลองในโอกาสที่องค์การศึกษาวิทยาศาสตร์และวัฒนธรรมแห่งสหประชาชาติ (UNESCO) ได้ประกาศขึ้นทะเบียนนวดไทย มรดกวัฒนธรรมอันล้ำค่าของไทย […] The post เชิดชูมรดกภูมิปัญญานวดไทย สมุนไพร และท่องเที่ยวเชิงสุขภาพสร้างโอกาสทางเศรษฐกิจ first appeared on สำนักข่าว บางกอก ทูเดย์.,https://bangkok-today.com/%e0%b9%80%e0%b8%8a%e0%b8%b4%e0%b8%94%e0%b8%8a%e0%b8%b9%e0%b8%a1%e0%b8%a3%e0%b8%94%e0%b8%81%e0%b8%a0%e0%b8%b9%e0%b8%a1%e0%b8%b4%e0%b8%9b%e0%b8%b1%e0%b8%8d%e0%b8%8d%e0%b8%b2%e0%b8%99%e0%b8%a7%e0%b8%94/?utm_source=rss&utm_medium=rss&utm_campaign=%25e0%25b9%2580%25e0%25b8%258a%25e0%25b8%25b4%25e0%25b8%2594%25e0%25b8%258a%25e0%25b8%25b9%25e0%25b8%25a1%25e0%25b8%25a3%25e0%25b8%2594%25e0%25b8%2581%25e0%25b8%25a0%25e0%25b8%25b9%25e0%25b8%25a1%25e0%25b8%25b4%25e0%25b8%259b%25e0%25b8%25b1%25e0%25b8%258d%25e0%25b8%258d%25e0%25b8%25b2%25e0%25b8%2599%25e0%25b8%25a7%25e0%25b8%2594,2021_10_29
โรงงานไพ่ กรมสรรพสามิต วางพวงมาลาถวายสักการะ เนื่องในวันปิยมหาราช,"อาคม เติมพิทยาไพสิฐ รัฐมนตรีว่าการกระทรวงการคลัง , สันติ พร้อมพัฒน์ รัฐมนตรีช่วยว่าการกระทรวงการคลัง , กฤษฎา จีนะวิจารณะ ปลัดกระทรวงการคลัง พร้อมด้วยคณะผู้บริหารระดับสูง กระทรวงการคลัง และผู้แทนหน่วยงานรัฐวิสาหกิจ เข้าร่วมพิธีวางพวงมาลาถวายสักการะพระบรมราชานุสาวรีย์พระบาทสมเด็จพระจุลจอมเกล้าเจ้าอยู่หัว (รัชกาลที่ 5) ประจำปี 2564 เพื่อน้อมรำลึกถึงพระมหากรุณาธิคุณ เนื่องในวันปิยมหาราช ณ ลานหน้าพระบรมราชานุสาวรีย์ รัชกาลที่ 5 ณ กระทรวงการคลัง อีกทั้ง ในวันเดียวกันนั้น ลวรณ แสงสนิท อธิบดีกรมสรรพสามิต ได้เป็นประธานในพิธีวางพวงมาลาถวายสักการะพระบรมราชานุสาวรีย์พระบาทสมเด็จพระจุลจอมเกล้าเจ้าอยู่หัว เนื่องในวันคล้ายวันสวรรคตพระบาทสมเด็จพระปรมินทรมหาจุฬาลงกรณ์ พระจุลจอมเกล้าเจ้าอยู่หัว (รัชกาลที่ 5) ณ กรมสรรพสามิต โดยมีคณะผู้บริหาร ข้าราชการ และเจ้าหน้าที่กรมสรรพสามิต พร้อมด้วยผู้บริหารหน่วยงานรัฐวิสาหกิจในสังกัดกรมสรรพสามิต เข้าร่วมพิธีดังกล่าวด้วย The post โรงงานไพ่ กรมสรรพสามิต วางพวงมาลาถวายสักการะ เนื่องในวันปิยมหาราช first appeared on สำนักข่าว บางกอก ทูเดย์.",https://bangkok-today.com/%e0%b9%82%e0%b8%a3%e0%b8%87%e0%b8%87%e0%b8%b2%e0%b8%99%e0%b9%84%e0%b8%9e%e0%b9%88-%e0%b8%81%e0%b8%a3%e0%b8%a1%e0%b8%aa%e0%b8%a3%e0%b8%a3%e0%b8%9e%e0%b8%aa%e0%b8%b2%e0%b8%a1%e0%b8%b4%e0%b8%95-%e0%b8%a7/?utm_source=rss&utm_medium=rss&utm_campaign=%25e0%25b9%2582%25e0%25b8%25a3%25e0%25b8%2587%25e0%25b8%2587%25e0%25b8%25b2%25e0%25b8%2599%25e0%25b9%2584%25e0%25b8%259e%25e0%25b9%2588-%25e0%25b8%2581%25e0%25b8%25a3%25e0%25b8%25a1%25e0%25b8%25aa%25e0%25b8%25a3%25e0%25b8%25a3%25e0%25b8%259e%25e0%25b8%25aa%25e0%25b8%25b2%25e0%25b8%25a1%25e0%25b8%25b4%25e0%25b8%2595-%25e0%25b8%25a7,2021_10_29
ก.ล.ต. ร่วมกับ คณะนิติศาสตร์ จุฬาลงกรณ์มหาวิทยาลัย และหน่วยงานพันธมิตร จัดงานสัมมนาออนไลน์ธุรกิจกับสิทธิมนุษยชนในตลาดทุนไทย,สำนักงานคณะกรรมการกำกับหลักทรัพย์และตลาดหลักทรัพย์ (ก.ล.ต.) ร่วมกับ คณะนิติศาสตร์ จุฬาลงกรณ์มหาวิทยาลัย สำนักงานคณะกรรมการสิทธิมนุษยชนแห่งชาติ (กสม.) โครงการพัฒนาแห่งสหประชาชาติประจำประเทศไทย (UNDP) และสมาคมเครือข่ายโกลบอลคอมแพ็กแห่งประเทศไทย (GCNT) จัดงานสัมมนาออนไลน์ “ธุรกิจกับสิทธิมนุษยชนในตลาดทุนไทย เนื่องในโอกาสครบรอบ 10 ปี หลักการชี้แนะของสหประชาชาติว่าด้วยธุรกิจกับสิทธิมนุษยชน (UNGPs)” เพื่อส่งเสริมให้บริษัทจดทะเบียน ผู้ประกอบธุรกิจและผู้เกี่ยวข้อง เห็นถึงความสำคัญของประเด็นสิทธิมนุษยชน โดยนำหลักการ UNGPs ไปใช้และเน้นความมุ่งมั่นในเชิงนโยบายจากคณะกรรมการและผู้บริหารของกิจการ (tone from the top) นำไปสู่วัฒนธรรมองค์กรและส่งผลให้มีการปฏิบัติตามนโยบายที่สนับสนุนเรื่องดังกล่าวตลอดจนห่วงโซ่คุณค่าได้โดยสำเร็จ เมื่อวันที่ 28 ตุลาคม 2564 โดยได้รับเกียรติจาก ศาสตราจารย์ ดร. วิษณุ เครืองาม รองนายกรัฐมนตรี เป็นประธานเปิดการสัมมนาและปาฐกถาพิเศษในหัวข้อ “นโยบายรัฐบาลในการขับเคลื่อนหลักการชี้แนะของสหประชาชาติว่าด้วยธุรกิจกับสิทธิมนุษยชน” รวมทั้งมีการบรรยายและปาฐกถาพิเศษจากวิทยากรผู้ทรงคุณวุฒิ พร้อมทั้งเวทีแบ่งปันมุมมอง (CEO Panel Discussion) จากผู้บริหารระดับสูงที่มาร่วมแชร์มุมมองและประสบการณ์การบริหารธุรกิจตามหลักสิทธิมนุษยชนอย่างใกล้ชิด ศาสตราจารย์ ดร. วิษณุ เครืองาม รองนายกรัฐมนตรี กล่าวว่า “การขับเคลื่อนแผนปฏิบัติการระดับชาติว่าด้วยธุรกิจกับสิทธิมนุษยชน หรือแผน […] The post ก.ล.ต. ร่วมกับ คณะนิติศาสตร์ จุฬาลงกรณ์มหาวิทยาลัย และหน่วยงานพันธมิตร จัดงานสัมมนาออนไลน์ธุรกิจกับสิทธิมนุษยชนในตลาดทุนไทย first appeared on สำนักข่าว บางกอก ทูเดย์.,https://bangkok-today.com/%e0%b8%81-%e0%b8%a5-%e0%b8%95-%e0%b8%a3%e0%b9%88%e0%b8%a7%e0%b8%a1%e0%b8%81%e0%b8%b1%e0%b8%9a-%e0%b8%84%e0%b8%93%e0%b8%b0%e0%b8%99%e0%b8%b4%e0%b8%95%e0%b8%b4%e0%b8%a8%e0%b8%b2%e0%b8%aa%e0%b8%95/?utm_source=rss&utm_medium=rss&utm_campaign=%25e0%25b8%2581-%25e0%25b8%25a5-%25e0%25b8%2595-%25e0%25b8%25a3%25e0%25b9%2588%25e0%25b8%25a7%25e0%25b8%25a1%25e0%25b8%2581%25e0%25b8%25b1%25e0%25b8%259a-%25e0%25b8%2584%25e0%25b8%2593%25e0%25b8%25b0%25e0%25b8%2599%25e0%25b8%25b4%25e0%25b8%2595%25e0%25b8%25b4%25e0%25b8%25a8%25e0%25b8%25b2%25e0%25b8%25aa%25e0%25b8%2595,2021_10_29
“พล.ต.ท.อัคราเดช” ผบช.ภ.6 พร้อมด้วยประธานชมรมแม่บ้านตำรวจ ภ.6 มอบเครื่องอุปโภคบริโภคให้กับข้าราชการตำรวจ บก.อก.ภ.6 ประจำปี 2564,"พล.ต.ท.อัคราเดช พิมลศรี ผบช.ภ.6 และ นางภคมน พิมลศรี ประธานชมรมแม่บ้านตำรวจภูธรภาค 6 เป็นประธานจัดกิจกรรมมอบเครื่องอุปโภคบริโภคให้กับข้าราชการตำรวจ บก.อก. ภ.6 ประจำปี 2564 ประกอบด้วย ข้าวขาวหอมมะลิ และบะหมี่กึ่งสำเร็จรูป จำนวน 209 ชุด โดยมี พล.ต.ต.สิทธิชัย โล่กันภัย รอง ผบช.ภ.6,พล.ต.ต.เอกรักษ์ ลิ้มสังกาศ รอง ผบช.ภ.6,พล.ต.ต.ระวีพรรษ อมรมุนีพงศ์ รอง ผบช.ภ.6,รอง ผบก.อก.ภ.6, รอง ผบก.สส.ภ.6,ผกก. ฝอ. 1–6 บก.อก.ภ.6, รวมทั้งรองประธานชมรมแม่บ้านตำรวจภูธรภาค 6, คณะแม่บ้านฯ และข้าราชการตำรวจในสังกัด บก.อก.ภ.6 เข้าร่วมกิจกรรมดังกล่าว The post “พล.ต.ท.อัคราเดช” ผบช.ภ.6 พร้อมด้วยประธานชมรมแม่บ้านตำรวจ ภ.6 มอบเครื่องอุปโภคบริโภคให้กับข้าราชการตำรวจ บก.อก.ภ.6 ประจำปี 2564 first appeared on สำนักข่าว บางกอก ทูเดย์.",https://bangkok-today.com/%e0%b8%9e%e0%b8%a5-%e0%b8%95-%e0%b8%97-%e0%b8%ad%e0%b8%b1%e0%b8%84%e0%b8%a3%e0%b8%b2%e0%b9%80%e0%b8%94%e0%b8%8a-%e0%b8%9c%e0%b8%9a%e0%b8%8a-%e0%b8%a0-6-%e0%b8%9e%e0%b8%a3%e0%b9%89%e0%b8%ad/?utm_source=rss&utm_medium=rss&utm_campaign=%25e0%25b8%259e%25e0%25b8%25a5-%25e0%25b8%2595-%25e0%25b8%2597-%25e0%25b8%25ad%25e0%25b8%25b1%25e0%25b8%2584%25e0%25b8%25a3%25e0%25b8%25b2%25e0%25b9%2580%25e0%25b8%2594%25e0%25b8%258a-%25e0%25b8%259c%25e0%25b8%259a%25e0%25b8%258a-%25e0%25b8%25a0-6-%25e0%25b8%259e%25e0%25b8%25a3%25e0%25b9%2589%25e0%25b8%25ad,2021_10_29
“ดร.หิมาลัย ผิวพรรณ” นำคณะผู้บริหารแถลงสรุปผลการดำเนินงานศูนย์ดูแลผู้ติดเชื้อโควิด-19 ร.พ.สนามท่าเรือคลองเตย,"ณ ลานสเตเดียม การท่าเรือแห่งประเทศไทย ที่ตั้งโรงพยาบาลสนามท่าเรือคลองเตย และศูนย์ดูแลผู้ติดเชื้อโควิด-19 ได้จัดแถลงผลการดำเนินงานที่ผ่านมา โดยมี ดร.หิมาลัย ผิวพรรณ ประธานคณะกรรมการอำนวยการ โรงพยาบาลสนามท่าเรือคลองเตย ประธานพิธีฯ พร้อมด้วยครูประทีป อึ้งทรงธรรม ฮาตะ เลขาธิการมูลนิธิดวงประทีป /กรรมการผู้ก่อตั้ง/ผอ.โรงพยาบาลสนามฯ เป็นผู้กล่าวรายงาน และคุณกันตพร หาญพาณิชย์ ประธานเจ้าหน้าที่บริหาร ฝ่ายการตลาด บริษัท บางกอก เชน ฮอสปีทอล จำกัด (มหาชน) หรือ BCH ได้กล่าวถึงผลการดำเนินงานด้านการแพทย์ ร.พ.สนามท่าเรือคลองเตย นอกจากนี้ยังได้รับเกียรติจาก คุณเดชา นุชพุ่ม รองผู้อำนวยการฝ่ายพัฒนาธุรกิจและการตลาด การท่าเรือแห่งประเทศไทย, คุณศรินทร สนธิศิริกฤตย์ รองผู้อำนวยการ ด้านการแพทย์, ตัวแทนจากกระทรวงการพัฒนาสังคมและความมั่นคงของมนุษย์, คุณสุชัย พงษ์เพียรชอบ ที่ปรึกษาผู้ว่าราชการกรุงเทพมหานคร, น.ส.ปียธิดา นิยม ผู้อำนวยการเขตคลองเตย, คุณพรเทพ กอบเกียรติศิริ ตัวแทนมูลนิธิมาดามแป้ง และ บริษัท เมืองไทยประกันภัย จำกัด […] The post “ดร.หิมาลัย ผิวพรรณ” นำคณะผู้บริหารแถลงสรุปผลการดำเนินงานศูนย์ดูแลผู้ติดเชื้อโควิด-19 ร.พ.สนามท่าเรือคลองเตย first appeared on สำนักข่าว บางกอก ทูเดย์.",https://bangkok-today.com/%e0%b8%94%e0%b8%a3-%e0%b8%ab%e0%b8%b4%e0%b8%a1%e0%b8%b2%e0%b8%a5%e0%b8%b1%e0%b8%a2-%e0%b8%9c%e0%b8%b4%e0%b8%a7%e0%b8%9e%e0%b8%a3%e0%b8%a3%e0%b8%93-%e0%b8%99%e0%b8%b3%e0%b8%84%e0%b8%93%e0%b8%b0-2/?utm_source=rss&utm_medium=rss&utm_campaign=%25e0%25b8%2594%25e0%25b8%25a3-%25e0%25b8%25ab%25e0%25b8%25b4%25e0%25b8%25a1%25e0%25b8%25b2%25e0%25b8%25a5%25e0%25b8%25b1%25e0%25b8%25a2-%25e0%25b8%259c%25e0%25b8%25b4%25e0%25b8%25a7%25e0%25b8%259e%25e0%25b8%25a3%25e0%25b8%25a3%25e0%25b8%2593-%25e0%25b8%2599%25e0%25b8%25b3%25e0%25b8%2584%25e0%25b8%2593%25e0%25b8%25b0-2,2021_10_29
ประธานชมรมแม่บ้านตำรวจ ภ.6 และคณะแม่บ้านฯห่วงใย นำสิ่งของไปสนับสนุนให้ คณะแพทย์ พยาบาล และประชาชนผู้มารับการฉีดวัคซีน,"ภคมน พิมลศรี ประธานชมรมแม่บ้านตำรวจภูธรภาค 6 พร้อมด้วย ฉัตรดาว ธนะศรีสืบวงศ์ รองประธานชมรมแม่บ้านตำรวจภูธรภาค 6 และคณะแม่บ้านฯ มีความห่วงใย พร้อมนำสิ่งของไปสนับสนุนให้กับ คณะแพทย์, พยาบาล และประชาชนผู้มารับการฉีดวัคซีน ณ ศาลาประชาคม ศาลากลางจังหวัดพิษณุโลก อ.เมืองพิษณุโลก จ.พิษณุโลก โดยมีรายการสิ่งของที่นำไปมอบดังนี้ 1. นมกล่อง 480 กล่อง 2. ขนมร้านสุพัตรา 50 ชุด 3. หมี่กรอบ 15 กล่อง 4. กรอบเค็ม 15 กล่อง ( หมี่กรอบและ กรอบเค็ม เป็นสินค้าจากแม่บ้านตำรวจจังหวัดสุโขทัย) 5. เค้กกล้วยหอม 60 ชิ้น 6. ถั่วตัดโคราช 6 ถุง 7. ส้ม 2 ลัง 8. น้ำดื่ม […] The post ประธานชมรมแม่บ้านตำรวจ ภ.6 และคณะแม่บ้านฯห่วงใย นำสิ่งของไปสนับสนุนให้ คณะแพทย์ พยาบาล และประชาชนผู้มารับการฉีดวัคซีน first appeared on สำนักข่าว บางกอก ทูเดย์.",https://bangkok-today.com/%e0%b8%9b%e0%b8%a3%e0%b8%b0%e0%b8%98%e0%b8%b2%e0%b8%99%e0%b8%8a%e0%b8%a1%e0%b8%a3%e0%b8%a1%e0%b9%81%e0%b8%a1%e0%b9%88%e0%b8%9a%e0%b9%89%e0%b8%b2%e0%b8%99%e0%b8%95%e0%b8%b3%e0%b8%a3%e0%b8%a7%e0%b8%88/?utm_source=rss&utm_medium=rss&utm_campaign=%25e0%25b8%259b%25e0%25b8%25a3%25e0%25b8%25b0%25e0%25b8%2598%25e0%25b8%25b2%25e0%25b8%2599%25e0%25b8%258a%25e0%25b8%25a1%25e0%25b8%25a3%25e0%25b8%25a1%25e0%25b9%2581%25e0%25b8%25a1%25e0%25b9%2588%25e0%25b8%259a%25e0%25b9%2589%25e0%25b8%25b2%25e0%25b8%2599%25e0%25b8%2595%25e0%25b8%25b3%25e0%25b8%25a3%25e0%25b8%25a7%25e0%25b8%2588,2021_10_29
“พล.ต.ท.อัคราเดช” ผบช.ภ.6 เข้าเยี่ยม ผวจ.นครสวรรค์​ เนื่องในโอกาสรับตำแหน่งใหม่​ เพื่อหารือแลกเปลี่ยนข้อราชการ​,พล.ต.ท.อัคราเดช พิมลศรี ผบช. ภ.6 พร้อมด้วย พ.ต.อ.ธนานันท์วิชญ์ ศรีบุญเรือง รอง ผบก.ภ.จว.นครสวรรค์ และคณะ ได้เข้าเยี่ยมพบปะ นายชยันต์ ศิริมาศ ผู้ว่าราชการจังหวัดนครสวรรค์​ เนื่องในโอกาสรับตำแหน่งใหม่​ เพื่อหารือแลกเปลี่ยนข้อราชการ​ พร้อมมอบของที่ระลึก ณ ศาลากลางจังหวัดนครสวรรค์​ ต.ปากน้ำโพ​ อ.เมือง​ จ.นครสวรรค์ The post “พล.ต.ท.อัคราเดช” ผบช.ภ.6 เข้าเยี่ยม ผวจ.นครสวรรค์​ เนื่องในโอกาสรับตำแหน่งใหม่​ เพื่อหารือแลกเปลี่ยนข้อราชการ​ first appeared on สำนักข่าว บางกอก ทูเดย์.,https://bangkok-today.com/%e0%b8%9e%e0%b8%a5-%e0%b8%95-%e0%b8%97-%e0%b8%ad%e0%b8%b1%e0%b8%84%e0%b8%a3%e0%b8%b2%e0%b9%80%e0%b8%94%e0%b8%8a-%e0%b8%9c%e0%b8%9a%e0%b8%8a-%e0%b8%a0-6-%e0%b9%80%e0%b8%82%e0%b9%89%e0%b8%b2/?utm_source=rss&utm_medium=rss&utm_campaign=%25e0%25b8%259e%25e0%25b8%25a5-%25e0%25b8%2595-%25e0%25b8%2597-%25e0%25b8%25ad%25e0%25b8%25b1%25e0%25b8%2584%25e0%25b8%25a3%25e0%25b8%25b2%25e0%25b9%2580%25e0%25b8%2594%25e0%25b8%258a-%25e0%25b8%259c%25e0%25b8%259a%25e0%25b8%258a-%25e0%25b8%25a0-6-%25e0%25b9%2580%25e0%25b8%2582%25e0%25b9%2589%25e0%25b8%25b2,2021_10_29
