title,summary,link,published
รับใช้อำนาจการเมือง,ประเด็นร้อน องค์การบริหารสโมสรนิสิตจุฬาลงกรณ์มหาวิทยาลัย (อบจ.) มีมติ 29 ต่อ 0 ยกเลิกกิจกรรมขบวนอัญเชิญพระเกี้ยว ในงานฟุตบอลประเพณีจุฬาฯ-ธรรมศาสตร์ ที่ก่อให้เกิดวิวาทะตามมามากมายนั้น ช่างเป็นภาพสะท้อนถึงการเถียงกันได้ทุกเรื่องในสังคมไทยจริงๆ โดยเฉพาะในสังคมโซเชี่ยล ยุคที่มีคนชื่อประยุทธ์ จันทร์โอชา นั่งเอ้เตบริหารประเทศ และปล่อยให้เกิดขบวนการไอโอเกิดขึ้นอย่างมากมาย โดยไม่คิดที่จะทำอะไรเลย ยิ่งกับพวกไอโอ หรือเพจชะเลียทั้งหลาย จริงๆในแถลงการณ์ของ อบจ. ก็ชัดเจนว่าไม่เห็นด้วยในเรื่องของการเอานิสิตมาแบกหามเสลี่ยงเข้าสนามฟุตบอล โดยตั้งข้อสังเกตในเรื่องของการบีบให้นิสิตหอในยอมทำหน้าที่ ดังนั้นประเด็นจึงควรจะอยู่แค่ที่ว่า ในการอัญเชิญพระเกี้ยว จำเป็นต้องทำในรูปแบบของการแบกเสลี่ยง และมีการเกณฑ์นิสิตให้มาแบกเสลี่ยงจริงหรือไม่ โดยเฉพาะเรื่องการบีบให้นิสิตหอในต้องทำ แม้ว่าไม่อยากจะทำ เพื่อแลกกับการได้อยู่ในหอในจริงหรือไม่ ถ้าจริงนี่คือการใช้สิทธิประโยชน์แลกกับการที่ต้องจำยอมกระทำ ที่ไม่สมควรมี ไม่สมควรปลูกฝัง หากกรอบวิวาทะมีเพียงแค่นี้ คงไม่ขยายวง แต่เพราะสไตล์ไอโอ สไตล์สลิ่ม สไตล์โหนสถาบัน ทำให้เรื่องนี้ใช้พลอตเดิมๆมาโจมตีด้วยข้อกล่าวหาที่เกิดขึ้นมาโดยตลอด ล้มเจ้า ล้มสถาบัน หลายคนฉวยโอกาสออกมาทันที ซ้ำร้ายบางคนกาลเวลาหรือแม้แต่กระทั่งสีผมที่เห็นในกระจก ไม่ได้ช่วยให้คำพูดคำจาอยู่ในกรอบของความสุภาพ เพื่อไม่ให้สังคมไทยตกต่ำในเรื่องของการแสดงออกที่กักขฬะ ต่ำตม และต้องการที่จะทำลายล้างกลุ่มนิสิตจุฬาฯที่มีหัวก้าวหน้าเป็นคนรุ่นใหม่อย่างชัดเจน บรรยงค์ พงษ์พานิช คนยุคเบบี้บูม แต่ยอมรับในการเปลี่ยนแปลง อุตส่าห์ออกมาวิเคราะห์ให้เหตุผลโดยสุภาพ ที่ควรรับฟัง และไตร่ตรอง กลับโดนกระหน่ำ […] The post รับใช้อำนาจการเมือง first appeared on สำนักข่าว บางกอก ทูเดย์.,https://bangkok-today.com/%e0%b8%a3%e0%b8%b1%e0%b8%9a%e0%b9%83%e0%b8%8a%e0%b9%89%e0%b8%ad%e0%b8%b3%e0%b8%99%e0%b8%b2%e0%b8%88%e0%b8%81%e0%b8%b2%e0%b8%a3%e0%b9%80%e0%b8%a1%e0%b8%b7%e0%b8%ad%e0%b8%87/?utm_source=rss&utm_medium=rss&utm_campaign=%25e0%25b8%25a3%25e0%25b8%25b1%25e0%25b8%259a%25e0%25b9%2583%25e0%25b8%258a%25e0%25b9%2589%25e0%25b8%25ad%25e0%25b8%25b3%25e0%25b8%2599%25e0%25b8%25b2%25e0%25b8%2588%25e0%25b8%2581%25e0%25b8%25b2%25e0%25b8%25a3%25e0%25b9%2580%25e0%25b8%25a1%25e0%25b8%25b7%25e0%25b8%25ad%25e0%25b8%2587,2021_10_29
62 ปี วช. ยกงานวิจัย “นวัตกรรมเซนเซอร์ฉลาดสำหรับตรวจวัดสารปนเปื้อนในอาหารและสิ่งแวดล้อม” มาโชว์,วันที่ 28 ตุลาคม 2564 สำนักงานการวิจัยแห่งชาติ (วช.) กระทรวงการอุดมศึกษา วิทยาศาสตร์ วิจัยและนวัตกรรม (อว.) จัดแถลงข่าว “NRCT Talk: 62 ปี วช. นวัตกรรมรักษ์โลก” โชว์ “นวัตกรรมเซนเซอร์ฉลาดสำหรับตรวจวัดสารปนเปื้อนในอาหารและสิ่งแวดล้อม” หนึ่งในนวัตกรรมที่ได้รับรางวัลการวิจัยแห่งชาติ : รางวัลผลงานประดิษฐ์คิดค้น ระดับรางวัลประกาศเกียรติคุณ ประจำปี 2564 โดยมี ศาสตราจารย์ กิตติคุณ นายแพทย์สุทธิพร จิตต์มิตรภาพ ประธานกรรมการส่งเสริมวิทยาศาสตร์ วิจัยและนวัตกรรม ให้เกียรติเป็นประธานเปิดงาน พร้อมกับ ดร.วิภารัตน์ ดีอ่อง ผู้อำนวยการสำนักงานการวิจัยแห่งชาติ ศาสตราจารย์ กิตติคุณ นายแพทย์สุทธิพร จิตต์มิตรภาพ ประธานกรรมการส่งเสริมวิทยาศาสตร์ วิจัยและนวัตกรรม กล่าวว่า สิ่งที่นักวิจัยถูกวิจารณ์ คือ การอยู่บนหอคอยงาช้าง งานวิจัยไม่มีช่องทางการสื่อสารมากเพียงพอ NRCT Talk ถือเป็นเวทีให้กับนักวิจัยเพื่อสื่อสารงานวิจัยไปยังสาธารณะ ในรูปแบบที่เข้าใจง่าย ไม่ซับซ้อนเกินไป เป็นการสร้างปัญญาให้กับประเทศ ให้ประชาชนสามารถหยิบยกไปใช้ประโยชน์ในชีวิตได้ […] The post 62 ปี วช. ยกงานวิจัย “นวัตกรรมเซนเซอร์ฉลาดสำหรับตรวจวัดสารปนเปื้อนในอาหารและสิ่งแวดล้อม” มาโชว์ first appeared on สำนักข่าว บางกอก ทูเดย์.,https://bangkok-today.com/62-%e0%b8%9b%e0%b8%b5-%e0%b8%a7%e0%b8%8a-%e0%b8%a2%e0%b8%81%e0%b8%87%e0%b8%b2%e0%b8%99%e0%b8%a7%e0%b8%b4%e0%b8%88%e0%b8%b1%e0%b8%a2-%e0%b8%99%e0%b8%a7%e0%b8%b1%e0%b8%95%e0%b8%81%e0%b8%a3/?utm_source=rss&utm_medium=rss&utm_campaign=62-%25e0%25b8%259b%25e0%25b8%25b5-%25e0%25b8%25a7%25e0%25b8%258a-%25e0%25b8%25a2%25e0%25b8%2581%25e0%25b8%2587%25e0%25b8%25b2%25e0%25b8%2599%25e0%25b8%25a7%25e0%25b8%25b4%25e0%25b8%2588%25e0%25b8%25b1%25e0%25b8%25a2-%25e0%25b8%2599%25e0%25b8%25a7%25e0%25b8%25b1%25e0%25b8%2595%25e0%25b8%2581%25e0%25b8%25a3,2021_10_29
62 ปี วช. เปิดตัว เด็กเก่ง คิดค้น “ถุงตอนกิ่งสำหรับมะม่วงน้ำดอกไม้สีทอง” รักษ์โลก คว้ารางวัลสิ่งประดิษฐ์ ระดับนานาชาติ มาครอง,"วันที่ 28 ตุลาคม 2564 สำนักงานการวิจัยแห่งชาติ (วช.) กระทรวงการอุดมศึกษา วิทยาศาสตร์ วิจัยและนวัตกรรม จัดแถลงข่าว “NRCT Talk: 62 ปี วช. เปิดตัวผลงานสิ่งประดิษฐ์ “ถุงตอนกิ่งสำหรับมะม่วงน้ำดอกไม้สีทอง” ที่นำขยะทางการเกษตรมาพัฒนาเป็นถุงเพาะชำที่ให้ธาตุกับต้นไม้ได้ หนึ่งในสิ่งประดิษฐ์ที่เข้าร่วมประกวดในเวทีนานาชาติงาน “The Innovation Week in Africa (IWA 2021) ณ ประเทศโมร็อกโก” นายสมปรารถนา สุขทวี รองผู้อำนวยการสำนักงานการวิจัยแห่งชาติ กล่าวว่า วช.ได้ส่งเสริมและสนับสนุนนักวิจัยและนักประดิษฐ์ไทยในการนำผลงานที่มีคุณภาพและมีศักยภาพด้านการวิจัยและด้านการประดิษฐ์คิดค้น เข้าร่วมแสดงนิทรรศการและประกวดผลงานในเวทีระดับนานาชาติ นั้น ทำให้ผลงานวิจัย สิ่งประดิษฐ์ และนวัตกรรมของคนไทยที่ไปเผยแพร่ เป็นที่รู้จักสามารถนำไปสู่การพัฒนาต่อยอดผลงานให้ได้มาตรฐานเกิดการยอมรับในทางการตลาดและก้าวสู่เชิงพาณิชย์ต่อไป ในครั้งนี้ วช. ได้สนับสนุนผลงานสิ่งประดิษฐ์ “ถุงตอนกิ่งสำหรับมะม่วงน้ำดอกไม้สีทอง” ของ นายพรหมพิริยะ ขัตติยวงษ์,นายนรากรณ์ ธนิกกุล, นายจิราวัฒน์ ศรีศิลป์โสภณ, นายอชิตพล จินดาพรรณ นักเรียนชั้นมัธยมศึกษาปีที่ 5, และนายขุนทอง คล้ายทอง […] The post 62 ปี วช. เปิดตัว เด็กเก่ง คิดค้น “ถุงตอนกิ่งสำหรับมะม่วงน้ำดอกไม้สีทอง” รักษ์โลก คว้ารางวัลสิ่งประดิษฐ์ ระดับนานาชาติ มาครอง first appeared on สำนักข่าว บางกอก ทูเดย์.",https://bangkok-today.com/62-%e0%b8%9b%e0%b8%b5-%e0%b8%a7%e0%b8%8a-%e0%b9%80%e0%b8%9b%e0%b8%b4%e0%b8%94%e0%b8%95%e0%b8%b1%e0%b8%a7-%e0%b9%80%e0%b8%94%e0%b9%87%e0%b8%81%e0%b9%80%e0%b8%81%e0%b9%88%e0%b8%87-%e0%b8%84%e0%b8%b4/?utm_source=rss&utm_medium=rss&utm_campaign=62-%25e0%25b8%259b%25e0%25b8%25b5-%25e0%25b8%25a7%25e0%25b8%258a-%25e0%25b9%2580%25e0%25b8%259b%25e0%25b8%25b4%25e0%25b8%2594%25e0%25b8%2595%25e0%25b8%25b1%25e0%25b8%25a7-%25e0%25b9%2580%25e0%25b8%2594%25e0%25b9%2587%25e0%25b8%2581%25e0%25b9%2580%25e0%25b8%2581%25e0%25b9%2588%25e0%25b8%2587-%25e0%25b8%2584%25e0%25b8%25b4,2021_10_29
อินเด็กซ์ ครีเอทีฟ วิลเลจ และ คีรีมายา รีสอร์ต ร่วมกับ ททท. ทุ่มจัดงานเทศกาลประดับไฟครั้งยิ่งใหญ่สุดตระการตา “Forest of Illumination at Kirimaya” กระตุ้นความสําคัญของป่าและการท่องเที่ยว,บริษัท อินเด็กซ์ ครีเอทีฟ วิลเลจ จํากัด (มหาชน) และ บริษัท คีรีมายา จํากัด ร่วมกับการท่องเที่ยวแห่ง ประเทศไทย ทุ่มจัดงานเทศกาลประดับไฟครั้งยิ่งใหญ่สุดตระการตา “Forest of Illumination at Kirimaya” พร้อมเปิด 7 เส้นทางเดินป่าสุดอัศจรรย์ เพื่อกระตุ้นความสําคัญของผืนป่าแห่งเขาใหญ่จังหวัดนครราชสีมา และ เป็นการต้อนรับเทศกาลท่องเที่ยวในช่วงระหว่างวันที่ 5 พฤศจิกายน 2564 – 29 มกราคม 2565 พร้อมด้วยมาตรการ ป้องกันโควิด-19อย่างเข้มงวดมั่นใจวา่จะประสบความสําเร็จและได้รับกระแสตอบรับเป็นอย่างดี วันที่ 27 ตุลาคม 2564 ณ คีรีมายา เขาใหญ่ จังหวัดนครราชสีมา คุณกิตติ ธนากิจอํานวย ประธานบริษัท คีรี มายา จํากัด คุณเกรียงกานต์ กาญจนะโภคิน ประธานเจ้าหน้าที่บริหารร่วม บริษัท อินเด็กซ์ ครีเอทีฟ วิลเลจ จํากัด […] The post อินเด็กซ์ ครีเอทีฟ วิลเลจ และ คีรีมายา รีสอร์ต ร่วมกับ ททท. ทุ่มจัดงานเทศกาลประดับไฟครั้งยิ่งใหญ่สุดตระการตา “Forest of Illumination at Kirimaya” กระตุ้นความสําคัญของป่าและการท่องเที่ยว first appeared on สำนักข่าว บางกอก ทูเดย์.,https://bangkok-today.com/%e0%b8%ad%e0%b8%b4%e0%b8%99%e0%b9%80%e0%b8%94%e0%b9%87%e0%b8%81%e0%b8%8b%e0%b9%8c-%e0%b8%84%e0%b8%a3%e0%b8%b5%e0%b9%80%e0%b8%ad%e0%b8%97%e0%b8%b5%e0%b8%9f-%e0%b8%a7%e0%b8%b4%e0%b8%a5%e0%b9%80%e0%b8%a5/?utm_source=rss&utm_medium=rss&utm_campaign=%25e0%25b8%25ad%25e0%25b8%25b4%25e0%25b8%2599%25e0%25b9%2580%25e0%25b8%2594%25e0%25b9%2587%25e0%25b8%2581%25e0%25b8%258b%25e0%25b9%258c-%25e0%25b8%2584%25e0%25b8%25a3%25e0%25b8%25b5%25e0%25b9%2580%25e0%25b8%25ad%25e0%25b8%2597%25e0%25b8%25b5%25e0%25b8%259f-%25e0%25b8%25a7%25e0%25b8%25b4%25e0%25b8%25a5%25e0%25b9%2580%25e0%25b8%25a5,2021_10_29
เลิกเคลมรพ.ปากพนัง !!! “สัณหพจน์” ชี้หากจริงใจ ขอเร่งดำเนินคดีผู้รับเหมา จัดกำลังหมอ-พยาบาลเสริม,ส.ส.พปชร. นครศรีฯ ซัดกรณี รมช.สธ. ตรวจเยี่ยม “รพ.ปากพนัง” 10ปี ไม่เคยเห็นหน้า พอใกล้เสร็จลงพื้นที่ตรวจเยี่ยม ชี้หากมีความจริงใจ ขอสธ.เร่งดำเนินคดีผู้รับเหมาทิ้งงาน พร้อมจัดสรรบุคลากรทางการแพทย์เสริม ช่วยยกระดับการบริการพี่น้องประชาชน ดร.สัณหพจน์ สุขศรีเมือง ส.ส.เขต 2 จ.นครศรีธรรมราช พรรคพลังประชารัฐ เปิดเผยถึงกรณีที่ นายสาธิต ปิตุเตชะ รัฐมนตรีช่วยว่าการกระทรวงสาธารณสุข ตรวจเยี่ยมความคืบหน้าการก่อสร้าง โรงพยาบาลปากพนัง อ.ปากพนัง จ.นครศรีธรรมราช ว่า ที่ผ่านมาการก่อสร้างโรงพยาบาลปากพนังมีปัญหามาเป็น 10 ปี จากเรื่องของผู้รับเหมาทิ้งงาน ทั้งนี้เมื่อวันที่ 15 พ.ค.63 ที่ผ่านมา ตนได้ลงพื้นที่เพื่อตรวจสอบข้อเท็จจริง พร้อมกับเสนอเป็นข้อหารือวาระเร่งด่วนต่อสภาฯ จนกระทั่งปัจจุบันการก่อสร้างได้ดำเนินการต่อจนใกล้แล้วเสร็จ ซึ่งคาดว่าในเดือน พ.ย.64 นี้ พี่น้องประชาชนอ.ปากพนัง และพื้นที่ลุ่มน้ำปากพนัง จะมีโรงพยาบาลที่ให้บริการได้เต็มศักยภาพ ในส่วนของปัญหาผู้รับเหมาที่ทิ้งงานนั้น มีถึง 2 รายด้วยกัน รายแรก บ.วงศ์พรหม วิศวกรรม จำกัด เริ่มสัญญาก่อสร้างกับสาธารณสุขจังหวัดนครศรีธรรมราช (สสจ.) […] The post เลิกเคลมรพ.ปากพนัง !!! “สัณหพจน์” ชี้หากจริงใจ ขอเร่งดำเนินคดีผู้รับเหมา จัดกำลังหมอ-พยาบาลเสริม first appeared on สำนักข่าว บางกอก ทูเดย์.,https://bangkok-today.com/%e0%b9%80%e0%b8%a5%e0%b8%b4%e0%b8%81%e0%b9%80%e0%b8%84%e0%b8%a5%e0%b8%a1%e0%b8%a3%e0%b8%9e-%e0%b8%9b%e0%b8%b2%e0%b8%81%e0%b8%9e%e0%b8%99%e0%b8%b1%e0%b8%87-%e0%b8%aa%e0%b8%b1%e0%b8%93/?utm_source=rss&utm_medium=rss&utm_campaign=%25e0%25b9%2580%25e0%25b8%25a5%25e0%25b8%25b4%25e0%25b8%2581%25e0%25b9%2580%25e0%25b8%2584%25e0%25b8%25a5%25e0%25b8%25a1%25e0%25b8%25a3%25e0%25b8%259e-%25e0%25b8%259b%25e0%25b8%25b2%25e0%25b8%2581%25e0%25b8%259e%25e0%25b8%2599%25e0%25b8%25b1%25e0%25b8%2587-%25e0%25b8%25aa%25e0%25b8%25b1%25e0%25b8%2593,2021_10_29
“เฉลิมชัย” ดันร่างพ.ร.บ.ปฏิรูปที่ดินฯ เร่งเครื่องงาน4 กรมต่อจาก“ธรรมนัส”,ภายหลัง “ผู้กองนัส” ร.อ.ธรรมนัส พรหมเผ่า พ้นจากตำแหน่งรัฐมนตรีช่วยว่าการกระทรวงเกษตรและสหกรณ์เมื่อวันที่ 9 กันยาบน 2564 การกำกับดูแลงาน 4 กรมได้เปลี่ยนมือไปอยู่กับ เฉลิมชัย ศรีอ่อน รัฐมนตรีว่าการกระทรวงเกษตรฯ ประกอบด้วย ​กรมพัฒนาที่ดิน กรมฝนหลวงและการบินเกษตร สำนักงานการปฏิรูปที่ดินเพื่อเกษตรกรรม (ส.ป.ก.) และองค์การตลาดเพื่อเกษตรกร (อ.ต.ก.) ​ผู้ที่ต้องกำกับดูแลอีกชั้นหนึ่งที่เหนือขึ้นไปแม้จะปรับเปลี่ยนจากพล.อ.ประวิตร วงษ์สุวรรณรองนายกรัฐมนตรี ตามคำสั่งเดิมของพล.อ.ประยุทธ์ จันทร์โอชา นายกรัฐมนตรีที่เคยมอบหมาย มาเป็น จุรินทร์ ลักษณะวิศิษฏ์ รองนายกฯและรัฐมนตรีว่าการกระทรวงพาณิชย์ ก็มิได้ทำให้งานที่ผู้กองนัสเคยริเริ่มและผลักดันในเชิงนโยบายต้องสะดุดหยุดลง ​เนื่องเพราะ“เฉลิมชัย”ไม่เพียงแต่รับรู้มาโดยตลอดในฐานะเป็นเจ้ากระทรวงที่ต้องพูดคุยหารือกับรัฐมนตรีช่วยฯ หากแต่ยังให้เกียรติผู้กองนัสซึ่งเป็นผู้มีบทบาทสำคัญในพรรคพลังประชารัฐและต่อมาได้เลื่อนขึ้นเป็นเลขาธิการพรรค ​ประการสำคัญ งานหลายอย่างที่ผู้กองนัสเริ่มไว้และดำเนินต่อเนื่องมาตลอด 2 ปีนั้น ล้วนเป็นประ โยชน์ต่อประชาชนทั้งสิ้น ​โดยเฉพาะอย่างยิ่ง สำนักงาน ส.ป.ก. อดีตรมช.ธรรมนัสได้ขับเคลื่อนนโยบาย อาทิเช่น เรียกคืนการถือครองที่ดินทร่ผิดกฎหมายนำมาจัดสรรให้เกษตรกร การจัดระเบียบที่ดินที่ไม่เอื้อต่อการทำเกษตรกรรมโดยนำมาทำกิจการอื่นๆที่เกิดประโยชน์มากกว่า เช่น รีสอร์ท แหล่งชุมชน เหมืองแร่ ด้วยการปรับให้เป็นพื้นที่เช่า นำเงินเข้ากองทุนปฏิรูปที่ดินเพื่อเกษตรกรรม เป็นต้น ​ขณะเดียวกัน […] The post “เฉลิมชัย” ดันร่างพ.ร.บ.ปฏิรูปที่ดินฯ เร่งเครื่องงาน4 กรมต่อจาก“ธรรมนัส” first appeared on สำนักข่าว บางกอก ทูเดย์.,https://bangkok-today.com/%e0%b9%80%e0%b8%89%e0%b8%a5%e0%b8%b4%e0%b8%a1%e0%b8%8a%e0%b8%b1%e0%b8%a2-%e0%b8%94%e0%b8%b1%e0%b8%99%e0%b8%a3%e0%b9%88%e0%b8%b2%e0%b8%87%e0%b8%9e-%e0%b8%a3-%e0%b8%9a-%e0%b8%9b/?utm_source=rss&utm_medium=rss&utm_campaign=%25e0%25b9%2580%25e0%25b8%2589%25e0%25b8%25a5%25e0%25b8%25b4%25e0%25b8%25a1%25e0%25b8%258a%25e0%25b8%25b1%25e0%25b8%25a2-%25e0%25b8%2594%25e0%25b8%25b1%25e0%25b8%2599%25e0%25b8%25a3%25e0%25b9%2588%25e0%25b8%25b2%25e0%25b8%2587%25e0%25b8%259e-%25e0%25b8%25a3-%25e0%25b8%259a-%25e0%25b8%259b,2021_10_29
