title,summary,link,published
“กรมการแพทย์แผนไทยและการแพทย์ทางเลือก” สืบสานจัดพิธีไหว้ครู รำลึกพระคุณครู ส่งต่อความรู้สู่คนรุ่นใหม่,อธิบดีกรมการแพทย์แผนไทยและการแพทย์ทางเลือก ร่วมพิธีไหว้ครูแพทย์แผนไทย และพิธีครอบ เจิม จากครูบาอาจารย์ผู้อาวุโสแพทย์แผนไทยเนื่องใน “วันภูมิปัญญาการแพทย์แผนไทยแห่งชาติ” ประจำปีพุทธศักราช 2564 น้อมรำลึกถึงพระคุณครูแพทย์แผนไทยผู้ส่งต่อวิชาความรู้ด้านการแพทย์ให้คนรุ่นใหม่ พร้อมแนะเกษตรกรและรัฐวิสาหกิจ ปลูกกัญชา สร้างช่อดอก ผลิตเป็นยา ผลตอบแทนคุ้ม ณ ศาลาพระบิดาแห่งการแพทย์แผนไทย บนเรือนอาคารพิพิธภัณฑ์การแพทย์แผนไทย กระทรวงสาธารณสุข จังหวัดนนทบุรี นายแพทย์ยงยศ ธรรมวุฒิ อธิบดีกรมการแพทย์แผนไทยและการแพทย์ทางเลือก ประธานในพิธีไหว้ครูแพทย์แผนไทย กล่าวว่า พิธีไหว้ครูเป็นกิจกรรมที่คนไทยรู้จักกันมานาน และเป็นพิธีสำคัญที่จัดขึ้นทุกปี เพื่อน้อมรำลึกถึงพระคุณครูแพทย์แผนไทยทั้งหลายซึ่งสืบทอดกันมาอย่างยาวนาน เป็นวัฒนธรรมที่ลึกซึ้งในทุกมิติ และสืบทอดกันมาอย่างยาวนาน สำหรับแพทย์แผนไทยการศึกษาด้านการนวด เป็นการใช้ศิลปะหลายแขนงมาผสมผสานกัน ผู้เรียนจึงต้องมีจิตใจที่มุ่งมั่นทำดีทั้งต่อตัวเอง และผู้ป่วย ดังนั้น การรำลึกถึงพระคุณครูที่ได้ประสาทวิชามาจึงเป็นสิ่งสำคัญ ซึ่งครูทางแพทย์แผนไทยไม่มีเพียงคนเดียว การมาไหว้ครูร่วมกันจึงเป็นการรวมจิตใจให้เป็นหนึ่งเดียวกันรำลึกถึงครูที่ประสาทวิชามา สิ่งเหล่านี้จะรวบรวมและถูกถ่ายทอดไปผู้ป่วย หรือผู้มารับบริการแพทย์แผนไทยด้วย “พิธีในวันนี้เราจัดเป็นรูปแบบพิธีโบราณ ซึ่งเราได้ศึกษาแล้วว่าในพิธีโบราณจะต้องมีองค์ประกอบการอะไรบ้าง ซึ่งสมบูรณ์แบบครบถ้วน แต่หากปีหน้าเราค้นคว้าได้ว่ามีอะไรที่ต้องเพิ่มเติมอีก ก็จะเสริมเข้ามาในปีหน้า และเราจะสืบทอดพิธีไหว้ครูนี้ต่อไป” นายแพทย์ยงยศ ยังได้กล่าวถึงทิศทางการปลูกกัญชา ว่า “กระแสการปลูกกัญชาปัจจุบันมีการตื่นตัวกันมาก เกษตรกรและรัฐวิสาหกิจชุมชนสนใจเข้ามาขออนุญาตปลูกกันมาก ซึ่งวันนี้เราจะมีการเสวนาเกี่ยวกับทิศทางการปลูกกัญชาสำหรับทางการแพทย์ และสร้างรายได้ให้กับเขาได้อย่างไร เพื่อไขข้อสงสัยในเรื่องนี้” สำหรับกัญชาที่สามารถนำมาผลิตทางการแพทย์ได้นั้น […] The post “กรมการแพทย์แผนไทยและการแพทย์ทางเลือก” สืบสานจัดพิธีไหว้ครู รำลึกพระคุณครู ส่งต่อความรู้สู่คนรุ่นใหม่ first appeared on สำนักข่าว บางกอก ทูเดย์.,https://bangkok-today.com/%e0%b8%81%e0%b8%a3%e0%b8%a1%e0%b8%81%e0%b8%b2%e0%b8%a3%e0%b9%81%e0%b8%9e%e0%b8%97%e0%b8%a2%e0%b9%8c%e0%b9%81%e0%b8%9c%e0%b8%99%e0%b9%84%e0%b8%97%e0%b8%a2%e0%b9%81%e0%b8%a5%e0%b8%b0%e0%b8%81%e0%b8%b2/?utm_source=rss&utm_medium=rss&utm_campaign=%25e0%25b8%2581%25e0%25b8%25a3%25e0%25b8%25a1%25e0%25b8%2581%25e0%25b8%25b2%25e0%25b8%25a3%25e0%25b9%2581%25e0%25b8%259e%25e0%25b8%2597%25e0%25b8%25a2%25e0%25b9%258c%25e0%25b9%2581%25e0%25b8%259c%25e0%25b8%2599%25e0%25b9%2584%25e0%25b8%2597%25e0%25b8%25a2%25e0%25b9%2581%25e0%25b8%25a5%25e0%25b8%25b0%25e0%25b8%2581%25e0%25b8%25b2,2021_10_29
“ม.ร.ว.จิราคม กิติยากร” ประธานมหากฐินบุญใหญ่ สร้างฌาปนสถาน วัดวังตูม อ เขาพระ จ.นครนายก,"“หม่อมราชวงศ์จิราคม กิติยากร” เป็นประธานมหากฐินบุญใหญ่ สร้างฌาปนสถาน วัดวังตูม อ เขาพระ จ.นครนายก ยอดรวมกฐิน สายสมาคมศรัทธาธรรมาภิบาล 215,634 บาท (สองแสนหนึ่งหมื่นห้าพันหกร้อยสามสิบสี่บาท) โดยมีมูลนิธิผู้นำธุรกิจเพื่อสังคม,สมาคมศรัทธาธรรมาภิบาล,วิสาหกิจชุมชนวรดิถี พร้อมด้วย ศ.พิเศษ ดร.เพียงฤทัย วรดิถี , พลอากาศตรีนายแพทย์ไกรสร วรดิถี คุณเงินวสวัตติ์ ลิ่มทวีกุล ,คุณกฤชวัฒน์ จิตวโรภาสกูล (คุง) ,คุณธงรบ ด่านอำไพ ,คุณวิชัย จันทร์วิเมลือง ,คุณรัตนา จงถาวรวาสนา,ศ.ดาโต๊ะ สรี,ดร.สัมพันธ์ รัฐแพทย์ ,พระบุญแต่ง เหรียญทอง ,คุณสุภา ตรีทิพย์มาส ,คุณส่องศรี แสงด้วง,ดร.สิทธิศักดิ์ เจียวพงษ์พิพัฒน์ ,คุณแขไข สุขกล่ำ, พ.อ.(พิเศษ)รศ.สฤษดิ์ ห เพียรเจริญ ,คุณสุภาพร เลิศสินธนากร ,คุณอรจิรา ผาดเกิด ,คุณดุษฏี วรธรรมดุษฏี ,คุณประเสริฐ บุญท้าว,คุณอภิรักษ์ชัยชนะ ปันยารชุน,ดร.ธัญมน […] The post “ม.ร.ว.จิราคม กิติยากร” ประธานมหากฐินบุญใหญ่ สร้างฌาปนสถาน วัดวังตูม อ เขาพระ จ.นครนายก first appeared on สำนักข่าว บางกอก ทูเดย์.",https://bangkok-today.com/%e0%b8%a1-%e0%b8%a3-%e0%b8%a7-%e0%b8%88%e0%b8%b4%e0%b8%a3%e0%b8%b2%e0%b8%84%e0%b8%a1-%e0%b8%81%e0%b8%b4%e0%b8%95%e0%b8%b4%e0%b8%a2%e0%b8%b2%e0%b8%81%e0%b8%a3-%e0%b8%9b%e0%b8%a3%e0%b8%b0%e0%b8%98/?utm_source=rss&utm_medium=rss&utm_campaign=%25e0%25b8%25a1-%25e0%25b8%25a3-%25e0%25b8%25a7-%25e0%25b8%2588%25e0%25b8%25b4%25e0%25b8%25a3%25e0%25b8%25b2%25e0%25b8%2584%25e0%25b8%25a1-%25e0%25b8%2581%25e0%25b8%25b4%25e0%25b8%2595%25e0%25b8%25b4%25e0%25b8%25a2%25e0%25b8%25b2%25e0%25b8%2581%25e0%25b8%25a3-%25e0%25b8%259b%25e0%25b8%25a3%25e0%25b8%25b0%25e0%25b8%2598,2021_10_29
“ม.ร.ว.จิราคม กิติยากร” ประธานมหากฐินบุญใหญ่ สร้างฌาปนสถาน วัดวังตูม อ.เขาพระ จ.นครนายก,"“หม่อมราชวงศ์จิราคม กิติยากร” เป็นประธานมหากฐินบุญใหญ่ สร้างฌาปนสถาน วัดวังตูม อ.เขาพระ จ.นครนายก ยอดรวมกฐิน สายสมาคมศรัทธาธรรมาภิบาล 215,634 บาท (สองแสนหนึ่งหมื่นห้าพันหกร้อยสามสิบสี่บาท) โดยมีมูลนิธิผู้นำธุรกิจเพื่อสังคม,สมาคมศรัทธาธรรมาภิบาล,วิสาหกิจชุมชนวรดิถี พร้อมด้วย ศ.พิเศษ ดร.เพียงฤทัย วรดิถี , พลอากาศตรีนายแพทย์ไกรสร วรดิถี คุณเงินวสวัตติ์ ลิ่มทวีกุล ,คุณกฤชวัฒน์ จิตวโรภาสกูล (คุง) ,คุณธงรบ ด่านอำไพ ,คุณวิชัย จันทร์วิเมลือง ,คุณรัตนา จงถาวรวาสนา,ศ.ดาโต๊ะ สรี,ดร.สัมพันธ์ รัฐแพทย์ ,พระบุญแต่ง เหรียญทอง ,คุณสุภา ตรีทิพย์มาส ,คุณส่องศรี แสงด้วง,ดร.สิทธิศักดิ์ เจียวพงษ์พิพัฒน์ ,คุณแขไข สุขกล่ำ, พ.อ.(พิเศษ)รศ.สฤษดิ์ ห เพียรเจริญ ,คุณสุภาพร เลิศสินธนากร ,คุณอรจิรา ผาดเกิด ,คุณดุษฏี วรธรรมดุษฏี ,คุณประเสริฐ บุญท้าว,คุณอภิรักษ์ชัยชนะ ปันยารชุน,ดร.ธัญมน อรรจนพจนีย์ […] The post “ม.ร.ว.จิราคม กิติยากร” ประธานมหากฐินบุญใหญ่ สร้างฌาปนสถาน วัดวังตูม อ.เขาพระ จ.นครนายก first appeared on สำนักข่าว บางกอก ทูเดย์.",https://bangkok-today.com/%e0%b8%a1-%e0%b8%a3-%e0%b8%a7-%e0%b8%88%e0%b8%b4%e0%b8%a3%e0%b8%b2%e0%b8%84%e0%b8%a1-%e0%b8%81%e0%b8%b4%e0%b8%95%e0%b8%b4%e0%b8%a2%e0%b8%b2%e0%b8%81%e0%b8%a3-%e0%b8%9b%e0%b8%a3%e0%b8%b0%e0%b8%98/?utm_source=rss&utm_medium=rss&utm_campaign=%25e0%25b8%25a1-%25e0%25b8%25a3-%25e0%25b8%25a7-%25e0%25b8%2588%25e0%25b8%25b4%25e0%25b8%25a3%25e0%25b8%25b2%25e0%25b8%2584%25e0%25b8%25a1-%25e0%25b8%2581%25e0%25b8%25b4%25e0%25b8%2595%25e0%25b8%25b4%25e0%25b8%25a2%25e0%25b8%25b2%25e0%25b8%2581%25e0%25b8%25a3-%25e0%25b8%259b%25e0%25b8%25a3%25e0%25b8%25b0%25e0%25b8%2598,2021_10_29
Tiger don’t cry,กลายเป็นคำถามคาใจคอการเมืองใน 2 ประเด็นหลัก ที่กำลังดังสนั่นอยู่ในเวลานี้ คำถามแรกคือ พล.อ.ประยุทธ์ จันทร์โอชา แค้นอะไร ร.อ.ธรรมนัส พรหมเผ่า ถึงได้ตามล้างตามเช็ดอย่างออกหน้าออกตาเช่นนี้ แค่ปลดออกจากรัฐมนตรีช่วยว่าการประทรวงเกษตรฯ แล้วยังไม่พอ ต้องการที่จะให้กระเด็นจากเก้าอี้ เลขาธิการพรรค พลังประชารัฐให้ได้ ชนิดที่ไม่แคร์ภาพลักษณ์ ว่าอาจจะถูกมองว่าเป็นถึง พล.อ. เป็นถึงนายกฯ แต่ลงมาท้ารบกับระดับ ร.อ. อย่างนั้นหรือ และคำถามที่ 2 ก็คือ ตกลงแล้ว พรรคพลังประชารัฐเป็น พรรคการเมืองของใครกันแน่??? อ่านต่อได้ในฉบับ The post Tiger don’t cry first appeared on สำนักข่าว บางกอก ทูเดย์.,https://bangkok-today.com/tiger-dont-cry/?utm_source=rss&utm_medium=rss&utm_campaign=tiger-dont-cry,2021_10_29
ความรับผิดชอบต่ำ,1 พฤศจิกายน คือ วันเริ่มต้นของการเปิดประเทศให้นักท่องเที่ยวจาก 45 ประเทศ 1 เขตบริหารพิเศษฮ่องกง สามารถมาไทยได้โดยไม่มีการกักตัว โดยหลักการและความจำเป็นในการที่ต้องเปิดประเทศ เชื่อว่าไม่มีใครคัดค้าน โดยเฉพาะอย่างยิ่งหากมองในแง่ของการฟื้นฟูสถานการณ์เศรษฐกิจที่ได้รับผลกระทบจากมาตรการล็อกดาวน์ของรัฐบาล การเปิดประเทศคือความหวังของภาคธุรกิจ ของแรงงาน ของประชาชน แต่การยอมรับในหลักการและความจำเป็น ไม่ใช่สิ่งที่จะช่วยให้รัฐบาลละเลย หรือหย่อนยานในเรื่องของขั้นตอนการตรวจสอบ ขั้นตอนการระมัดระวัง เพื่อที่จะได้ไม่เกิดการระบาดรอบ 4 ให้กลายเป็นฝันร้ายอีกครั้ง หลักการตรงกันหมด เพราะไม่มีใครอยากเจอกับฝันร้ายด้านเศรษฐกิจ ธุรกิจเจ๊ง ตกงาน รายได้ลด หนี้สินท่วมล้นพ้นตัว สิ่งที่อยากเห็นคือความรัดกุมรอบคอบของรัฐบาล ของกระทรวงสาธณสุข กระทรวงต่างประเทศ สำนักงานตรวจคนเข้าเมือง และหน่วยงานที่เกี่ยวข้อง แต่สิ่งที่เห็นคือความดันทุรังของทางกระทรวงการต่างประเทศ และกระทรวงดีอีเอส เกี่ยวกับระบบการตรวจสอบนักท่องเที่ยวต่างชาติ ไม่เพียงดันทุรังกับการไม่มี Vaccine and Covid Test Validation แต่ยังตีมึนหลอกลวงไม่พูดความจริง จนอยากจะถามว่า หากมีการแพร่ระบาดเกิดขึ้น ปลัดกระทรวงการต่างประเทศ และปลัดกระทรวงดีอีเอส จะลาออกหรือไม่ หรือจะใช้ประโยคที่คนชื่อ ประยุทธ์ จันทร์โอชา ปกป้องตัวเองเอาไว้ล่วงหน้าแล้วว่า การเปิดประเทศครั้งนี้ เมื่อทุกคนขอมาธุรกิจเอกชนขอมาก็ทำให้ ดังนั้นความรับผิดชอบจึงเป็นของทุกคน […] The post ความรับผิดชอบต่ำ first appeared on สำนักข่าว บางกอก ทูเดย์.,https://bangkok-today.com/%e0%b8%84%e0%b8%a7%e0%b8%b2%e0%b8%a1%e0%b8%a3%e0%b8%b1%e0%b8%9a%e0%b8%9c%e0%b8%b4%e0%b8%94%e0%b8%8a%e0%b8%ad%e0%b8%9a%e0%b8%95%e0%b9%88%e0%b8%b3/?utm_source=rss&utm_medium=rss&utm_campaign=%25e0%25b8%2584%25e0%25b8%25a7%25e0%25b8%25b2%25e0%25b8%25a1%25e0%25b8%25a3%25e0%25b8%25b1%25e0%25b8%259a%25e0%25b8%259c%25e0%25b8%25b4%25e0%25b8%2594%25e0%25b8%258a%25e0%25b8%25ad%25e0%25b8%259a%25e0%25b8%2595%25e0%25b9%2588%25e0%25b8%25b3,2021_10_29
๖๘ปีแห่งความตกต่ำ.. “ความยุติธรรม” เพิ่งได้กลับคืน,“ต่อสู้เพื่อคนทั้งชาติ” “จิตร ภูมิศักดิ์” ที่ถูกกระทำการ “โยนบก” ฐานะอดีตศิษย์เก่า เมื่อ ๖๘ ปีก่อน เพื่อให้หลุดพ้นจากความ-เป็นทาส ทั้งที่ทำความดี “ฝากไว้กับแผ่นดินมากมาย” กลับกลายมีการใช้ “ความอยุติธรรม” ของอดีต “นิสิตคณะวิศวกรรมศาสตร์จุฬา” ลงมาจาก “หอประชุมจุฬาลงกรณ์มหาวิทยาลัย” “กรรมการนิสิตวิศวกรรมศาสตร์” หรือ “กวศ” ออกแถลงการณ์ด่วน “ขอโทษ-จิตร ภูมิศักดิ์” เพราะละเมิด “ความเป็นมนุษย์” ไม่มีใครที่ควรได้รับความรุนแรงเช่นนี้ “กวศ” เห็นการกระทำเมื่อ ๖๘ ปี รุนแรงและไม่เป็นธรรม “คนรุ่นใหม่” ออกมาสะสาง..เพื่อไม่ให้เกิด “เยี่ยงอย่าง” แห่งความ-ตกต่ำ ๐๐๐๐๐๐๐๐๐๐๐๐๐๐๐ “คืนความเป็นธรรม จิตร ภูมิศักดิ์ สมศักดิ์ศรี” นี่ก้อเป็น “คนไทย”… ที่ “ประชาชน” รักมากเพราะสร้าง “ผลงาน” ไว้อย่างเต็มที่ ต้องมีสักวัน ที่ “ทักษิณ ชินวัตร” และ “ยิ่งลักษณ์ ชินวัตร” […] The post ๖๘ปีแห่งความตกต่ำ.. “ความยุติธรรม” เพิ่งได้กลับคืน first appeared on สำนักข่าว บางกอก ทูเดย์.,https://bangkok-today.com/%e0%b9%96%e0%b9%98%e0%b8%9b%e0%b8%b5%e0%b9%81%e0%b8%ab%e0%b9%88%e0%b8%87%e0%b8%84%e0%b8%a7%e0%b8%b2%e0%b8%a1%e0%b8%95%e0%b8%81%e0%b8%95%e0%b9%88%e0%b8%b3-%e0%b8%84%e0%b8%a7%e0%b8%b2/?utm_source=rss&utm_medium=rss&utm_campaign=%25e0%25b9%2596%25e0%25b9%2598%25e0%25b8%259b%25e0%25b8%25b5%25e0%25b9%2581%25e0%25b8%25ab%25e0%25b9%2588%25e0%25b8%2587%25e0%25b8%2584%25e0%25b8%25a7%25e0%25b8%25b2%25e0%25b8%25a1%25e0%25b8%2595%25e0%25b8%2581%25e0%25b8%2595%25e0%25b9%2588%25e0%25b8%25b3-%25e0%25b8%2584%25e0%25b8%25a7%25e0%25b8%25b2,2021_10_29
