title,summary,link,published
เปิดแล้ว! “เซ็นทรัล ศรีราชา” ต้นแบบโครงการมิกซ์ยูสแห่งอนาคตใหญ่และครบครันที่สุดในภาคตะวันออก,"เปิดแล้ว! “เซ็นทรัล ศรีราชา” ต้นแบบโครงการมิกซ์ยูสแห่งอนาคตใหญ่และครบครันที่สุดในภาคตะวันออก ด้วยมูลค่าโครงการกว่า 4,200 ล้าน • ยก Success Model จากเซ็นทรัล อีสต์วิลล์มาไว้ที่ศรีราชา ด้วยศูนย์การค้ารูปแบบ Semi-Outdoor & Pet-Friendly สร้างคอมมูนิตี้คนรักสัตว์แห่งใหม่ • ข่าวประชาสัมพันธ์และรูปภาพ ครั้งแรกในศรีราชากับ Digitalised Experience สุขล้ำทั่วทั้งศูนย์ฯ ผ่านมือถือเพียงเครื่องเดียว และ Co-Working Space รองรับสตาร์ทอัพรุ่นใหม่ • ศูนย์การค้าแห่งอนาคตกับพันธกิจ Carbon Neutral & Zero Waste ต้นแบบศูนย์การค้า สีเขียว Eco-friendly Mall ที่ใส่ใจสิ่งแวดล้อม • อากาศ สะอาด มั่นใจ ด้วย Smart & Healthy Building ครั้งแรกกับนวัตกรรมระบบปรับและกรองอากาศให้สะอาดในศูนย์การค้า และมาตรการเซ็นทรัล สะอาด มั่นใจ SAFE […] The post เปิดแล้ว! “เซ็นทรัล ศรีราชา” ต้นแบบโครงการมิกซ์ยูสแห่งอนาคตใหญ่และครบครันที่สุดในภาคตะวันออก first appeared on สำนักข่าว บางกอก ทูเดย์.",https://bangkok-today.com/%e0%b9%80%e0%b8%9b%e0%b8%b4%e0%b8%94%e0%b9%81%e0%b8%a5%e0%b9%89%e0%b8%a7-%e0%b9%80%e0%b8%8b%e0%b9%87%e0%b8%99%e0%b8%97%e0%b8%a3%e0%b8%b1%e0%b8%a5-%e0%b8%a8%e0%b8%a3%e0%b8%b5%e0%b8%a3/?utm_source=rss&utm_medium=rss&utm_campaign=%25e0%25b9%2580%25e0%25b8%259b%25e0%25b8%25b4%25e0%25b8%2594%25e0%25b9%2581%25e0%25b8%25a5%25e0%25b9%2589%25e0%25b8%25a7-%25e0%25b9%2580%25e0%25b8%258b%25e0%25b9%2587%25e0%25b8%2599%25e0%25b8%2597%25e0%25b8%25a3%25e0%25b8%25b1%25e0%25b8%25a5-%25e0%25b8%25a8%25e0%25b8%25a3%25e0%25b8%25b5%25e0%25b8%25a3,2021_10_29
เปิดแล้ว! “เซ็นทรัล ศรีราชา” ต้นแบบโครงการมิกซ์ยูสแห่งอนาคตใหญ่และครบครันที่สุดในภาคตะวันออก,"เปิดแล้ว! “เซ็นทรัล ศรีราชา” ต้นแบบโครงการมิกซ์ยูสแห่งอนาคตใหญ่และครบครันที่สุดในภาคตะวันออก ด้วยมูลค่าโครงการกว่า 4,200 ล้าน • ยก Success Model จากเซ็นทรัล อีสต์วิลล์มาไว้ที่ศรีราชา ด้วยศูนย์การค้ารูปแบบ Semi-Outdoor & Pet-Friendly สร้างคอมมูนิตี้คนรักสัตว์แห่งใหม่ •ครั้งแรกในศรีราชากับ Digitalised Experience สุขล้ำทั่วทั้งศูนย์ฯ ผ่านมือถือเพียงเครื่องเดียว และ Co-Working Space รองรับสตาร์ทอัพรุ่นใหม่ • ศูนย์การค้าแห่งอนาคตกับพันธกิจ Carbon Neutral & Zero Waste ต้นแบบศูนย์การค้า สีเขียว Eco-friendly Mall ที่ใส่ใจสิ่งแวดล้อม • อากาศ สะอาด มั่นใจ ด้วย Smart & Healthy Building ครั้งแรกกับนวัตกรรมระบบปรับและกรองอากาศให้สะอาดในศูนย์การค้า และมาตรการเซ็นทรัล สะอาด มั่นใจ SAFE PLUS+ พนักงานฉีดวัคซีนครบแล้ว […] The post เปิดแล้ว! “เซ็นทรัล ศรีราชา” ต้นแบบโครงการมิกซ์ยูสแห่งอนาคตใหญ่และครบครันที่สุดในภาคตะวันออก first appeared on สำนักข่าว บางกอก ทูเดย์.",https://bangkok-today.com/%e0%b9%80%e0%b8%9b%e0%b8%b4%e0%b8%94%e0%b9%81%e0%b8%a5%e0%b9%89%e0%b8%a7-%e0%b9%80%e0%b8%8b%e0%b9%87%e0%b8%99%e0%b8%97%e0%b8%a3%e0%b8%b1%e0%b8%a5-%e0%b8%a8%e0%b8%a3%e0%b8%b5%e0%b8%a3/?utm_source=rss&utm_medium=rss&utm_campaign=%25e0%25b9%2580%25e0%25b8%259b%25e0%25b8%25b4%25e0%25b8%2594%25e0%25b9%2581%25e0%25b8%25a5%25e0%25b9%2589%25e0%25b8%25a7-%25e0%25b9%2580%25e0%25b8%258b%25e0%25b9%2587%25e0%25b8%2599%25e0%25b8%2597%25e0%25b8%25a3%25e0%25b8%25b1%25e0%25b8%25a5-%25e0%25b8%25a8%25e0%25b8%25a3%25e0%25b8%25b5%25e0%25b8%25a3,2021_10_29
“ปาปา “หมี่ปู (ปูม้าเกรดพรีเมียม),ร้านบะหมี่ปูเปิดใหม่ บนถนนบอนด์สตรีท เมืองทองธานี จ.นนทบุรี โดยพนักงานบริษัทที่อยากเริ่มต้นธุรกิจเล็กๆ ตอบโจทย์การใช้ชีวิตหลังการเป็นพนักงานกินเงินเดือนในอนาคต ด้วยแรงบันดาลใจเล็ก ๆ จากการเป็นเด็กต่างจังหวัด ที่ชอบกินบะหมี่เส้นเล็ก ๆ ใส่หมูสับ อวลกลิ่นหอมกรุ่นของกระเทียมเจียวของร้านดังที่อยู่ในตัวเมืองของจังหวัดที่เขาไปเป็นประจำ จากนั้นเมื่อเข้าเรียนระดับมหาวิทยาลัยในกรุงเทพฯ ก็มีโอกาสได้กินบะหมี่ปูร้านดังอยู่หลายครั้ง และสังเกตเห็นภาพของลูกเจ้าของร้านที่ฝาผนัง ก็คิดว่าเขาน่าจะขายดีจนมีเงินส่งลูกเรียนต่างประเทศได้ จนเมื่อได้ทำงานและเดินทางไปต่างประเทศบ่อย ๆ โดยเฉพาะฮ่องกง ทุกครั้งที่ไป ก็แวะกินบะหมี่ฮ่องกงเสมอ ทั้งหมดจึงเป็นที่มาของการเปิดร้านปาปา บะหมี่ปู (ปูม้าเกรดพรีเมี่ยม) เล็ก ๆ ของตัวเอง โดยคัดสรรวัตถุดิบหลัก คุณภาพดี อย่างเส้นบะหมี่ไข่เส้นเล็ก ๆ ที่มีความหอมและเหนียวนุ่ม เนื้อปูม้าที่เป็นกรรเชียงปูก้อนคัดพิเศษอย่างดี ระดับเดียวกับภัตตาคาร เพื่อให้ลูกค้าได้รับรสความหวานของเนื้อปูอย่างเต็มคำ พร้อมด้วยน้ำซุปสูตรพิเศษของทางร้านที่มีรสกลมกล่อมเข้ากันได้อย่างดี อีกทั้งเมนูข้าวไข่ทอร์นาโดปูก้อน ที่ใช้วิธีทอดไข่ให้ม้วนเกลียวเหมือนพายุ โรยด้วยกรรเชียงปูก้อนและส่วนผสมอื่นๆอย่างครบเครื่อง นอกจากนี้ยังมีก๋วยเตี๋ยวไก่ที่ใช้ชื่อว่า ก๋วยเตี๋ยวไก่อุทัยธานี เพราะรับสูตรต้นตำรับจากคุณอา ร้านดังของอุทัยธานี แล้วนำมาพัฒนาให้ถูกปากคนกรุงเทพฯ มีรสชาติจัดจ้านไม่เหมือนใคร อร่อยครบรส มีทั้งน่องไก่ และไก่ชิ้นให้เลือกตามใจชอบ สำหรับการตกแต่งร้าน ก็จะอาร์ต ๆ หน่อย เพราะมีเพื่อนเป็นศิลปิน ช่วยวาดภาพน่ารักๆในร้าน สร้างบรรยากาศออกมาในสไตล์คาเฟ่ นั่งสบายๆ หรือสั่งผ่าน Robinhood และ Lineman […] The post “ปาปา “หมี่ปู (ปูม้าเกรดพรีเมียม) first appeared on สำนักข่าว บางกอก ทูเดย์.,https://bangkok-today.com/%e0%b8%9b%e0%b8%b2%e0%b8%9b%e0%b8%b2-%e0%b8%ab%e0%b8%a1%e0%b8%b5%e0%b9%88%e0%b8%9b%e0%b8%b9-%e0%b8%9b%e0%b8%b9%e0%b8%a1%e0%b9%89%e0%b8%b2%e0%b9%80%e0%b8%81%e0%b8%a3%e0%b8%94%e0%b8%9e%e0%b8%a3/?utm_source=rss&utm_medium=rss&utm_campaign=%25e0%25b8%259b%25e0%25b8%25b2%25e0%25b8%259b%25e0%25b8%25b2-%25e0%25b8%25ab%25e0%25b8%25a1%25e0%25b8%25b5%25e0%25b9%2588%25e0%25b8%259b%25e0%25b8%25b9-%25e0%25b8%259b%25e0%25b8%25b9%25e0%25b8%25a1%25e0%25b9%2589%25e0%25b8%25b2%25e0%25b9%2580%25e0%25b8%2581%25e0%25b8%25a3%25e0%25b8%2594%25e0%25b8%259e%25e0%25b8%25a3,2021_10_29
ข้อเสนอที่เอเจนซี่รับทำ “Social Media” ควรมีให้ลูกค้า,"ปัจจุบันผู้คนจะใช้เวลาหมดไปกับการใช้ Social Media มากกว่าการเข้าสังคมโดยใช้วิธีการอื่น และมีแนวโน้มจะใช้เวลากับ Social Media เพิ่มขึ้นทุกปี โดยที่ไม่มีแนวโน้มที่จะลดลงแต่อย่างใด ดังนั้นจึงจำเป็นอย่างยิ่งที่ธุรกิจต้องอาศัยพลังของ Social Media ในการเข้าถึงกลุ่มเป้าหมาย สิ่งนี้สร้างโอกาสที่ดีแก่เอเจนซี่ที่บริการรับทำ Social Media บริการรับทำ Social Media ที่เกี่ยวกับแพลตฟอร์ม เอเจนซี่ที่ให้บริการรับทำ Social Media ต้องพิจารณาว่าช่องทาง Social Media ใดที่คุ้มค่า และจำเป็นต้องรู้ว่าเว็บไซต์และแอปพลิเคชันใดที่มีผู้ใช้งานจำนวนมาก รวมทั้งที่เป็นที่ต้องการมากที่สุดจากลูกค้าหรือผู้มีโอกาสเป็นลูกค้า เช่น Facebook มักจะเป็นจุดสนใจจากการมีผู้ใช้มากกว่าหนึ่งพันล้านคน ทำให้เป็นเครือข่ายที่ได้รับความนิยมสูงสุด เครือข่ายที่สำคัญอื่นๆ มีตั้งแต่ Line, Instagram ไปจนถึง Google+, LinkedIn หรือแม้แต่ Snapchat เอเจนซี่จำเป็นต้องรู้ว่าลูกค้าสนใจใช้เครือข่ายใด หากพวกเขายังไม่รู้ว่าพวกเขากำลังมองหาอะไร ให้เตรียมรายการคำแนะนำไว้ อีกอย่างที่เอเจนซี่ที่ให้บริการรับทำ Social Media ต้องให้ความสำคัญคือ การวางแผนกลยุทธ์ การมีกลยุทธ์ที่มั่นคงสำหรับ Social Media มีความสำคัญต่อทุกแบรนด์ การสร้างกลยุทธ์ด้านเนื้อหาสำหรับแบรนด์ช่วยให้มั่นใจว่าลูกค้ามีแผนที่กำหนดไว้และแนวคิดที่ดีว่าสิ่งใดจะได้ผลสำหรับพวกเขา […] The post ข้อเสนอที่เอเจนซี่รับทำ “Social Media” ควรมีให้ลูกค้า first appeared on สำนักข่าว บางกอก ทูเดย์.",https://bangkok-today.com/%e0%b8%82%e0%b9%89%e0%b8%ad%e0%b9%80%e0%b8%aa%e0%b8%99%e0%b8%ad%e0%b8%97%e0%b8%b5%e0%b9%88%e0%b9%80%e0%b8%ad%e0%b9%80%e0%b8%88%e0%b8%99%e0%b8%8b%e0%b8%b5%e0%b9%88%e0%b8%a3%e0%b8%b1%e0%b8%9a%e0%b8%97/?utm_source=rss&utm_medium=rss&utm_campaign=%25e0%25b8%2582%25e0%25b9%2589%25e0%25b8%25ad%25e0%25b9%2580%25e0%25b8%25aa%25e0%25b8%2599%25e0%25b8%25ad%25e0%25b8%2597%25e0%25b8%25b5%25e0%25b9%2588%25e0%25b9%2580%25e0%25b8%25ad%25e0%25b9%2580%25e0%25b8%2588%25e0%25b8%2599%25e0%25b8%258b%25e0%25b8%25b5%25e0%25b9%2588%25e0%25b8%25a3%25e0%25b8%25b1%25e0%25b8%259a%25e0%25b8%2597,2021_10_29
โอเลย์ ผนึก ช้อปปี้ ปูพรมกลยุทธ์ออนไลน์เต็มสูบ รับเทรนด์ Digital Beauty,"โอเลย์ (Olay) แบรนด์ผลิตภัณฑ์ดูแลผิวชั้นนำในประเทศไทย ในเครือพีแอนด์จี (P&G) ติดสปีดปั้นกลยุทธ์ Digital Beauty รับกระแสการช้อปปิ้งสินค้าสกินแคร์ที่เติบโตบนโลกออนไลน์อย่างต่อเนื่อง เดินหน้าผนึกกำลัง ช้อปปี้ ผู้นำแพลตฟอร์มอีคอมเมิร์ซในภูมิภาคเอเชียตะวันออกเฉียงใต้และไต้หวัน ยกระดับความเข้มข้นบนช่องทางอีคอมเมิร์ซ ด้วยการขยายการรับรู้ผ่านกิจกรรมการตลาดออนไลน์ครบวงจร พร้อมอัดโปรแรงกระตุ้นยอดขายอย่างต่อเนื่องในช่วงมหกรรมช้อปปิ้งที่ใหญ่ที่สุดแห่งปี Shopee 11.11 Big Sale Shivam Chopra, Olay Brand Director กล่าวว่า “จากสถานการณ์การแพร่ระบาด ที่ส่งผลกระทบให้ภาคธุรกิจต่าง ๆ ไม่สามารถดำเนินการได้ตามปกติ นับเป็นหนึ่งในกลไกสำคัญที่กระตุ้นให้ผู้บริโภคที่ไม่เคยเปิดประสบการณ์บนโลกออนไลน์ กล้าและเริ่มเปิดใจทดลองซื้อสินค้าจากช่องทางออนไลน์มากยิ่งขึ้น โดยเฉพาะอย่างยิ่งกับภูมิภาคเอเชียตะวันออกเฉียงใต้ รวมถึงประเทศไทย ที่ตลาดสินค้าความงามและผลิตภัณฑ์ดูแลส่วนบุคคลยังมีแนวโน้มและโอกาสอีกมากสำหรับการเติบโต ฉะนั้นการทำความเข้าใจในเส้นทางและความต้องการของกลุ่มผู้บริโภคดิจิทัลบิวตี้ที่เปลี่ยนแปลงไป จึงมีความสำคัญอย่างมากต่อการดำเนินธุรกิจ เพื่อที่จะสามารถออกแบบกลยุทธ์ได้อย่างตรงใจ และชดเชยประสบการณ์ที่ขาดหายจากการจับจ่ายในช่องทางออฟไลน์” โอเลย์ จึงเดินหน้าปั้นกลยุทธ์สู่การเป็น Digital Beauty อย่างเต็มกำลัง เพื่อที่จะให้แบรนด์สามารถสร้างการเติบโตให้สอดรับกับเทรนด์ของผู้บริโภคดิจิทัลบิวตี้ ฉะนั้น โอเลย์ จึงได้ร่วมมือกับ ช้อปปี้ พันธมิตรอีคอมเมิร์ซชั้นนำที่มีความชำนาญ และความเพียบพร้อมด้านระบบนิเวศที่ครบวงจรอย่างต่อเนื่อง ผ่านการทำแคมเปญการตลาดแบบเอ็กซ์คลูซีฟคอลาบอเรชัน เพื่อร่วมปลุกความตื่นเต้นให้และสร้างประสบการณ์กันช้อปปิ้งที่แตกต่างให้แก่ผู้บริโภคบนช่องทางออนไลน์ จนทำให้ร้านค้า Olay Official Store […] The post โอเลย์ ผนึก ช้อปปี้ ปูพรมกลยุทธ์ออนไลน์เต็มสูบ รับเทรนด์ Digital Beauty first appeared on สำนักข่าว บางกอก ทูเดย์.",https://bangkok-today.com/%e0%b9%82%e0%b8%ad%e0%b9%80%e0%b8%a5%e0%b8%a2%e0%b9%8c-%e0%b8%9c%e0%b8%99%e0%b8%b6%e0%b8%81-%e0%b8%8a%e0%b9%89%e0%b8%ad%e0%b8%9b%e0%b8%9b%e0%b8%b5%e0%b9%89-%e0%b8%9b%e0%b8%b9%e0%b8%9e%e0%b8%a3/?utm_source=rss&utm_medium=rss&utm_campaign=%25e0%25b9%2582%25e0%25b8%25ad%25e0%25b9%2580%25e0%25b8%25a5%25e0%25b8%25a2%25e0%25b9%258c-%25e0%25b8%259c%25e0%25b8%2599%25e0%25b8%25b6%25e0%25b8%2581-%25e0%25b8%258a%25e0%25b9%2589%25e0%25b8%25ad%25e0%25b8%259b%25e0%25b8%259b%25e0%25b8%25b5%25e0%25b9%2589-%25e0%25b8%259b%25e0%25b8%25b9%25e0%25b8%259e%25e0%25b8%25a3,2021_10_29
“ยูดี ทาวน์” ทุ่ม 500 ล้านบาทเนรมิต “HOTEL MOCO” ธุรกิจโรงแรมพรีเมี่ยมบูทีค  สไตล์โมเดิร์นโคโลเนียล,กรุงเทพฯ “HOTEL MOCO” หนึ่งในแลนด์มาร์คแห่งใหม่ ใจกลางเมืองอุดรธานี ที่ตอบโจทย์นักเดินทาง ทุกไลฟ์สไตล์ ทั้งในภาคธุรกิจ การท่องเที่ยว นักช้อป นักแสวงบุญ ด้วยศักยภาพของทำเลที่ตั้งบนถนนทองใหญ่ แวดล้อมด้วยสิ่งอำนวยความสะดวกครบวงจร ทั้งศูนย์การค้า ยูดี ทาวน์ และศูนย์ประชุมระดับประเทศ มลฑาทิพย์ ฮอลล์ ภายใต้การบริหารของสองผู้บริหารรุ่นใหม่ ไฟแรง มากความสามารถแห่งกลุ่มธุรกิจ “ยูดี ทาวน์” โดย ภาสกร วีรชาติยานุกูล กรรมการผู้จัดการ บริษัท ธนาทิพย์ 456 จำกัด บริหาร HOTEL MOCO รวมถึงศูนย์ประชุมมลฑาทิพย์ฮอลล์ และ อภิชา วีรชาติยานุกูล กรรมการผู้จัดการ บริษัท อุดรพลาซ่า จำกัด บริหารศูนย์การค้ายูดี ทาวน์ เจ้าของร้าน Brunch & Munch และร้านอาหาร “Par” (พา) ทุ่มงบกว่า 500 ล้านบาท เปิดตัวโรงแรมพรีเมี่ยมบูทีค โฮเทล สไตล์โมเดิร์นโคโลเนียล HOTEL MOCO ที่โดดเด่นด้วยการผสมผสานวัฒนธรรมท้องถิ่นอย่างลงตัว พร้อมเปิดร้านอาหารฟิวชั่นมาตรฐานระดับสากล “Par” (พา) ไว้รองรับนักท่องเที่ยว ทั้งชาวไทยและชาวต่างชาติ เพื่อตอกย้ำการเป็นศูนย์รวมพื้นที่เศรษฐกิจของเมืองอุดร ภาสกร วีรชาติยานุกูล กรรมการผู้จัดการ บริษัท ธนาทิพย์ […] The post “ยูดี ทาวน์” ทุ่ม 500 ล้านบาทเนรมิต “HOTEL MOCO” ธุรกิจโรงแรมพรีเมี่ยมบูทีค สไตล์โมเดิร์นโคโลเนียล first appeared on สำนักข่าว บางกอก ทูเดย์.,https://bangkok-today.com/%e0%b8%a2%e0%b8%b9%e0%b8%94%e0%b8%b5-%e0%b8%97%e0%b8%b2%e0%b8%a7%e0%b8%99%e0%b9%8c-%e0%b8%97%e0%b8%b8%e0%b9%88%e0%b8%a1-500-%e0%b8%a5%e0%b9%89%e0%b8%b2%e0%b8%99%e0%b8%9a%e0%b8%b2/?utm_source=rss&utm_medium=rss&utm_campaign=%25e0%25b8%25a2%25e0%25b8%25b9%25e0%25b8%2594%25e0%25b8%25b5-%25e0%25b8%2597%25e0%25b8%25b2%25e0%25b8%25a7%25e0%25b8%2599%25e0%25b9%258c-%25e0%25b8%2597%25e0%25b8%25b8%25e0%25b9%2588%25e0%25b8%25a1-500-%25e0%25b8%25a5%25e0%25b9%2589%25e0%25b8%25b2%25e0%25b8%2599%25e0%25b8%259a%25e0%25b8%25b2,2021_10_29
