title,summary,link,published
"แนะ""ประยุทธ์""ลอกการบ้านรัฐบาลยิ่งลักษณ์ใช้แก้ปัญหาน้ำท่วม",โฆษกเพื่อไทยชี้นายกฯไร้วิสัยทัศน์จัดการเยียวยาน้ำท่วม แนะลอกการบ้านรัฐบาลเพื่อไทย เย้ยอย่าแผ่นเสียงตกร่องโยนบาปภัยธรรมชาติทั้งที่บริหารงานไม่เป็นอยู่ต่ออีก 5 ปีประเทศพังแน่,https://www.posttoday.com/politic/news/665214,"Sun, 10 Oct 2021 10:49:00 +0700"
ออสเตรเลียเล็งเอาผิดโซเชียลมีเดียรับผิดชอบโพสต์หมิ่นประมาท,ในระยะหลังออสเตรเลียมีมาตรการหลายๆ อย่างเพื่อกำจัดการผูกขาดและการลอยตัวของบริษัทเหล่านี้ต่อภาคธุรกิจในประเทศโดยเฉพาะประเด็นเรื่องสื่อ,https://www.posttoday.com/world/665215,"Sun, 10 Oct 2021 10:47:00 +0700"
"ปภ.เผยพิษพายุเตี้ยนหมู่ยังมีน้ำท่วมขัง16จังหวัด316,831 ครัวเรือนกระทบ","กรมป้องกันและบรรเทาสาธารณภัยรายงานยังคงมีพื้นที่ประสบอุทกภัย 17 จังหวัดคลี่คลายแล้ว16 จังหวัด ประชาชนได้รับผลกระทบ 316,831 ครัวเรือน มีผู้เสียชีวิต 9 ราย",https://www.posttoday.com/social/general/665217,"Sun, 10 Oct 2021 11:15:00 +0700"
สมุยปรับมาตรการเข้าเกาะ ฉีดวัคซีนครบโดส/มีผลตรวจATK เริ่ม15ต.ค.นี้,เกาะสมุย ปรับมาตรการนักท่องเที่ยวในประเทศที่จะเดินทางเข้าพื้นที่ ให้แสดงหลักฐานการฉีดวัคซีนครบโดส หรือมีผลตรวจATKเป็นลบภายใน7วัน รองรับเที่ยวด้วยกันเฟส 3 เริ่ม 15 ต.ค.นี้,https://www.posttoday.com/social/local/665216,"Sun, 10 Oct 2021 11:02:00 +0700"
Mr Goxx แฮมสเตอร์นักลงทุนคริปโตที่เหนือกว่าวอร์เรน บัฟเฟต,นักลงทุนรายนี้ไม่ใช่คน แต่เป็นแฮมสเตอร์และมีทวิตเตอร์ให้คอยติดตามด้วย ที่สำคัญมันมือขึ้่นกว่านักลงทุนที่เป็นคนเสียอีก,https://www.posttoday.com/world/665219,"Sun, 10 Oct 2021 11:34:00 +0700"
“แป้ง อรจิรา” อุ้มท้องถ่ายแฟชั่นว่าที่คุณแม่ สวยและปังมากทุกลุค,โอ้โหวมาก! “แป้ง อรจิรา” อุ้มท้องถ่ายแฟชั่นว่าที่คุณแม่ ปังมากทุกลุคจริงๆ,https://www.posttoday.com/ent/news/665213,"Sun, 10 Oct 2021 11:30:00 +0700"
"ผู้ป่วยโควิดอาการหนัก2,985รายต้องใส่เครื่องช่วยหายใจ689คน","ศบค.รายงานมีผู้ติดเชื้อโควิดรายใหม่ 10,817 ราย เสียชีวิตเพิ่ม 84 ศพ มีอาการหนัก 2,985 ราย ต้องใส่เครื่องช่วยหายใจ 689 ราย",https://www.posttoday.com/social/general/665223,"Sun, 10 Oct 2021 12:35:00 +0700"
“เพลง” ไม่ห่าง! เกาะขอบสนาม เชียร์ “เป๊ก” ขี่ม้าข้ามเครื่องกีดขวาง,“เพลง” เกาะขอบสนามส่งกำลังใจให้ “เป๊ก” ขี่ม้ากระโดดข้ามเครื่องกีดขวาง,https://www.posttoday.com/ent/news/665220,"Sun, 10 Oct 2021 12:30:00 +0700"
ข่าวดี!น้ำโขงลดต่ำต่อเนื่องในรอบ 5 ปีไม่หวั่นพายุเข้า,นครพนม-ระดับน้ำในแม่น้ำโขงลดต่ำในรอบ 5 ปียังรับน้ำได้อีกมากแม้จะเกิดพายุต่อเนื่อง ขณะที่ลำน้ำสาขามีปริมาณน้อย ชลประทานเร่งกักน้ำหวั่นฝนทิ้งช่วงเกิดปัญหาภัยแล้ง,https://www.posttoday.com/social/local/665221,"Sun, 10 Oct 2021 12:20:00 +0700"
"กทม.แชมป์ตลอดกาลยอดติดเชื้อโควิดรายวันสูงสุด1,185ราย","ศบค.เผยยอดผู้ติดเชื้อโควิดสูงสุด 10 จังหวัด 1 กทม.ยังนำตลอด 1,185 ราย ขณะที่มีข่าวดี 4 หวัด ยโสธร นครพนม น่าน และ ลำปาง วันนี้ไม่พบผู้ติดเชื้อรายใหม่",https://www.posttoday.com/social/general/665226,"Sun, 10 Oct 2021 12:56:00 +0700"
ยิ่งลด ยิ่งอ้วน?,ไขข้อสงสัย ทำไมยิ่งลดน้ำหนักถึงยิ่งอ้วน โดย พญ.น้ำทิพย์ พันธ์ทิพทวี,https://www.posttoday.com/life/healthy/665224,"Sun, 10 Oct 2021 12:50:00 +0700"
“สุพัฒนพงษ์” นำทีมผู้บริหารกระทรวงฯและปตท. ลงพื้นที่ จ.สระบุรี,"“สุพัฒนพงษ์” เดินสายติดตามสถานการณ์น้ำท่วมต่อเนื่อง วันนี้นำถุงยังชีพ 1,000 ชุดมอบให้ผู้ประสบภัยในจังหวัดสระบุรี",https://www.posttoday.com/social/general/665222,"Sun, 10 Oct 2021 13:09:00 +0700"
จีนพบสุสานประจำตระกูล ขุนนางระดับสูงสมัยราชวงศ์โจวเหนือ,จีนพบ ‘สุสานประจำตระกูล’ ขุนนางระดับสูง เรียงหลุมตามความอาวุโส (ภาพหลัก - ภาพจากสถาบันโบราณคดีมณฑลส่านซี : ส่วนบนของป้ายหลุมศพของโต้วหลูเอินที่ขุดพบ),https://www.posttoday.com/world/665231,"Sun, 10 Oct 2021 13:33:00 +0700"
ดวงรอบสัปดาห์ทำนายระหว่างวันที่ 11-17 ต.ค.64,โดย...หมอพลอย สวนผึ้ง,https://www.posttoday.com/life/horo/665232,"Sun, 10 Oct 2021 13:26:00 +0700"
นายกฯหวั่นพายุ2ลูกซ้ำชาวบ้าน สั่งกองทัพเฝ้าระวังพื้นที่เสี่ยง,นายกฯหวั่นผลกระทบจากพายุ 2 ลูก สั่งกองทัพเฝ้าระวังพื้นที่เสี่ยง เสริมและกระจายกำลังลงช่วยลดอันตรายและความเสียหาย,https://www.posttoday.com/politic/news/665233,"Sun, 10 Oct 2021 13:43:00 +0700"
“มอร์ มอร์กะจาย” น่าเป็นห่วง! ติดเชื้อโควิด-19 ตอนนี้ลามกินปอดไปกว่า 60%,“มอร์ มอร์กะจาย” อาการหนัก! ถูกเชื้อโควิด-19 กินปอดกว่า 60% ออกซิเจนในเลือดต่ำ,https://www.posttoday.com/ent/news/665225,"Sun, 10 Oct 2021 14:00:00 +0700"
"""อัศวิน""รายงานน้ำเหนือไหลผ่านเจ้าพระยายังไม่กระทบพื้นที่กทม.","ผู้ว่าฯกทม.รายงานสภาพน้ำเหนือไหลผ่านแม่น้ำเจ้าพระยาเฉลี่ย 2,960 ลบ.ม./วินาที ต่ำกว่าคันกั้นน้ำ 1.08 ม. ยังไม่ส่งผลกระทบพื้นที่กทม.",https://www.posttoday.com/social/general/665234,"Sun, 10 Oct 2021 14:22:00 +0700"
ดูจะจะถนนทรงวาดท่าน้ำราชวงศ์แม่น้ำเจ้าพระยาเอ่อเข้าท่วมแล้ว,ถนนทรงวาดท่าน้ำราชวงศ์เริ่มได้รับผลกระทบจากน้ำท่วม หลังจากน้ำในแม่น้ำเจ้าพระยาเพิ่มสูงขึ้นเอ่อเข้าท่วมตรอกซอกซอยทำให้การสัญจรไปมาลำบากบางจุดต้องปิดถนน,https://www.posttoday.com/social/general/665237,"Sun, 10 Oct 2021 14:55:00 +0700"
ประยุทธ์เตือนการ์ดอย่าตก หลังพบรวมกลุ่มสังสรรค์มากขึ้น,"โฆษกรัฐบาล เผย ""นายกฯ"" เตือนประชาชน ""การ์ดอย่าตก"" ยึดหลัก ""ดูแลตัวเองแบบครอบจักรวาล"" คุมเข้มการแพร่ระบาด ป้องกันไม่ให้เกิดคลัสเตอร์ใหม่",https://www.posttoday.com/politic/news/665236,"Sun, 10 Oct 2021 14:48:00 +0700"
ตร.พบระเบิดแสวงเครื่อง จับ7ผู้ต้องสงสัยม็อบเผายาง-ขว้างประทัดที่ผ่านฟ้า,บช.น.แถลงคุมผู้ต้องสงสัย 7 คน พบระเบิดแสวงเครื่อง 1 ลูก จากเหตุมวลชนไม่ทราบฝ่ายชุมนุมเผายางรถยนต์ ขว้างประทัดที่สะพานผ่านฟ้าเมื่อวันที่ 9 ต.ค.ที่ผ่านมา,https://www.posttoday.com/politic/news/665241,"Sun, 10 Oct 2021 15:50:00 +0700"
"เกษตรฯสั่งลุย""5ยุทธศาสตร์เฉลิมชัย""ครองแชมป์โลกยางพารา",“อลงกรณ์”ปักหมุด 7 กลยุทธ์รุกตลาดน้ำยาง 5 หมื่นล้านเพิ่มรายได้เกษตรกร อัพเกรด”กยท.”เป็นองค์กรระดับโลก ดึงศูนย์เทคโนโลยีเกษตรและสภาอุตสาหกรรมร่วมขับเคลื่อน,https://www.posttoday.com/economy/news/665239,"Sun, 10 Oct 2021 15:37:00 +0700"
ลูกจ้างร้องให้การลาป่วยรักษาโควิดเป็นวันลากรณีพิเศษ,ลูกจ้างเรียกร้องให้ลาป่วย กรณีโควิด เป็นวันลากรณีพิเศษ ไม่นับวันลาป่วยทั่วไป ที่กฏหมายคุ้มครองให้ลาป่วยได้ 30 วัน โดยได้รับค่าจ้าง,https://www.posttoday.com/social/general/665238,"Sun, 10 Oct 2021 15:18:00 +0700"
"""ศรีริต้า” สุดเป๊ะ! ในชุดเสื้อสูทตัวใหญ่ของคุณสามี อวดเรียวขางามๆ","ทุกที่ของแม่คือรันเวย์! ""ศรีริต้า” ปังมากในชุดเสื้อสูทตัวใหญ่ของคุณสามี",https://www.posttoday.com/ent/news/665218,"Sun, 10 Oct 2021 16:00:00 +0700"
ตร.โชว์จับคดีเด็กแว้นนับ1ล้านรายทำทัณฑ์บนผู้ปกครองกว่า4หมื่นคน,"รองผบ.ตร.แถลงปราบปรามแก๊งแข่งรถจับกุมดำเนินคดีแล้วกว่า 1 ล้านราย ขณะที่ดำเนินคดีกับพ่อแม่และผู้ปกครองตาม พ.ร.บ.คุ้มครองเด็กทำทัณฑ์บนกว่า 40,000 ราย",https://www.posttoday.com/social/general/665243,"Sun, 10 Oct 2021 16:31:00 +0700"
ปิดตลาดฉัตร์ชัยหัวหินพบเป็นคลัสเตอร์ใหม่ติดโควิดแล้ว30ราย,ประจวบคีรีขันธ์ขเทศบาลเมืองหัวหินสั่งปิดตลาดฉัตรไชย 3 วัน หลังพบเป็นคัตเตอร์ใหม่ของการแพร่ระบาดโควิดพบผู้ติดเชื้อแล้วกว่า 30 คน,https://www.posttoday.com/social/local/665244,"Sun, 10 Oct 2021 17:10:00 +0700"
สธ.เผยสถานการณ์โควิดทรงตัว บางพื้นที่ยังพบระบาดเป็นกลุ่มก้อน,สธ.เผย สถานการณ์โควิด 19 ในประเทศแนวโน้มยังทรงตัว บางพื้นที่ยังพบการระบาดเป็นกลุ่มก้อน ขณะที่บางพื้นที่สถานการณ์เริ่มดีขึ้น เตรียมเปิดกิจการ กิจกรรม เปิดพื้นที่รับนักท่องเที่ยว,https://www.posttoday.com/social/general/665245,"Sun, 10 Oct 2021 17:03:00 +0700"
พรุ่งนี้ค่อยแวะปั๊ม ดีเซลB7-ดีเซล พรีเมี่ยมลดราคา 2 บาท,ผู้ค้าน้ำมันเตรียมปรับลดราคาดีเซลB7-ดีเซล พรีเมี่ยม ลง ลิตรละ 2 บาท ส่วนกลุ่มเบนซิน-โซฮอล์คงเดิม,https://www.posttoday.com/economy/news/665246,"Sun, 10 Oct 2021 17:25:00 +0700"
ขู่ตัดสิทธิโรงแรมฉวยโอกาสขึ้นราคาในโครงการเราเที่ยวด้วยกัน,รัฐบาลเตือนโรงแรม-ที่พักเข้าร่วมโครงการเราเที่ยวด้วยกัน อย่าฉวยโอกาสขึ้นราคา หากตรวจพบถูกตัดสิทธิเข้าร่วมโครงการทันที,https://www.posttoday.com/politic/news/665247,"Sun, 10 Oct 2021 18:08:00 +0700"
หมดลุ้น!แม่เพนกวินสาวสวนสัตว์สงขลาออกไข่ไม่ติดลูก,สงขลา-แม่นกเพนกวินสายพันธุ์ฮัมโบลด์สวนสัตว์สงขลาชวดได้ลูกน้อยหลังจากไข่ 3 ฟองที่นำไปกกครบ 60 วันไม่มีตัวอ่อนอยู่ภายในตามที่ลุ้นกัน,https://www.posttoday.com/social/local/665248,"Sun, 10 Oct 2021 18:20:00 +0700"
กทม.สำรวจแนวป้องกันน้ำท่วมริมสองฝั่งเจ้าพระยารับมือน้ำเหนือ,รองผู้ว่าฯกทม.ตรวจแนวป้องกันน้ำท่วมริมสองฝั่งเจ้าพระยา และจุดเรียงกระสอบทรายแนวฟันหลอจากฝั่งพระนครถึงฝั่งธน,https://www.posttoday.com/social/general/665249,"Sun, 10 Oct 2021 18:55:00 +0700"
"""คณะก้าวหน้า""มั่นใจชนะเลือกตั้งอบต.หลายพื้นที่",คณะก้าวหน้ามั่นใจเลือกตั้งอบต. มีหวังคว้าชัยชนะหลายพื้นที่โดยเฉพาะเมืองใหญ่ที่ประชากรเป็นคนหนุ่มสาว ชี้คนเห็นผลงานเทศบาลก้าวหน้ามาแล้ว,https://www.posttoday.com/politic/news/665250,"Sun, 10 Oct 2021 18:44:00 +0700"
"""พิธา""เดินสายพบเอกชนภาคตะวันออกลั่น""ก้าวไกล""พร้อมสู้",ตราด-หัวหน้าพรรคก้าวไกลเดินสายเจอภาคเอกชนขายไอเดียวพัฒนาจังหวัดภาคตะวันออก ลั่นไม่สนกติกาใหม่รัฐธรรมนูญใหม่ เดินหน้าต่อสู้พิสูจน์ภาวะผู้นำทำพรรคเป็นสถาบันการเมือง,https://www.posttoday.com/politic/news/665252,"Sun, 10 Oct 2021 19:55:00 +0700"
หยวนซื่อข่าย นักฉวยโอกาสปฏิวัติผู้หวังเป็น 'เจ้า' เสียเอง,วันที่ 10 เดือน 10 ปี 2011 เป็นวันครบรอบ 110 ปีของการปฏิวัติซินไฮ่ที่โค่นล้มราชวงศ์ชิงและเริ่มต้นระบอบสาธารณรัฐของจีน แต่จักรพรรดิองค์สุดท้ายของจีนไม่ใช่ปูยี เขาคือบุคคลที่โค่นปูยีแล้วเป็นประธานาธิบดีเพื่อจะก้าวสู่ตำแหน่งจักรพรรดิในเวลาต่อมา,https://www.posttoday.com/world/665251,"Sun, 10 Oct 2021 20:05:00 +0700"
‘บางจาก’ ยันโรงกลั่นน้ำมันเดินเครื่องตามปกติหลังเกิดระบบไฟฟ้าขัดข้อง,บางจาก ชี้แจงกรณีโรงกลั่นน้ำมันเกิดกลุ่มควันเมื่อช่วงเย็น ผลจากระบบไฟฟ้าขัดข้อง ล่าสุดเหตุการณ์ปกติแล้ว,https://www.posttoday.com/economy/news/665254,"Sun, 10 Oct 2021 20:30:00 +0700"
"""ไพบูลย์""เผยแก้กม.ลูก4ประเด็นย้ำไม่มีส.ส.ปัดเศษอีกแล้ว",รองหัวหน้าพรรคพลังประชารัฐเผยร่างแก้ไขกฎหมายลูกเสร็จเรียบร้อยแล้วรอประธานวิปรัฐบาลหารือ  3 ฝ่ายเนื้อหายึดแนวโมเดลยุครัฐบาลอภิสิทธิ์มาใช้ ระบุชัดแก้ไขครั้งนี้จะไม่มี ส.ส.ปัดเศษแล้ว,https://www.posttoday.com/politic/news/665253,"Sun, 10 Oct 2021 20:40:00 +0700"
"""สิระ"" อัด ""นิด้าโพล"" จี้ยุบสภาชี้ 2 ปีกว่าผลงานเพียบ","""สิระ"" อัด ""นิด้าโพล"" ไม่น่าเชื่อถือ หลังระบุควรยุบสภาโดยเร็ว ชี้ 2 ปีกว่า สภาฯผลงานเพียบ",https://www.posttoday.com/politic/news/665363,"Tue, 12 Oct 2021 08:51:00 +0700"
นายกฯ สั่ง มท.-ผู้ว่าฯรับมือน้ำท่วมเหนือ-อีสาน เตรียมไปอุบลฯ ศุกร์นี้,โฆษกรัฐบาลเผย “นายก” กำชับมท. ผู้ว่าฯรับมือสถานการณ์ฝนตกหนักน้ำท่วมเหนือ-อีสาน เตรียมนำคณะลงพื้นที่อุบลฯ ติดตามการบริหารจัดการน้ำ อุบลราชธานี – โขงเจียม 15 ต.ค.นี้,https://www.posttoday.com/politic/news/665359,"Tue, 12 Oct 2021 08:08:00 +0700"
ตำรวจล่าโจรขาเทียมทิ้งไม้เท้าค้ำยันดัดแปลงเป็นปืนแก๊ป,ขอนแก่น-โจรขาเทียมปั่นจักรยานเข้าไปลักทรัพย์ในรีสอร์ทญาตินักตะกร้อทีมชาติไทย ทิ้งไม้ค้ำยันถูกดัดแปลงสภาพเป็นปืนแก๊ป,https://www.posttoday.com/social/local/665362,"Tue, 12 Oct 2021 08:04:00 +0700"
"ยอดต่ำหมื่น!โควิดวันนี้ติดเชื้อ 9,445 ดับ 84 ราย","ศบค. เผย ยอดติดเชื้อโควิด-19 วันนี้ เพิ่มขึ้น 9,445 ราย เสียชีวิตอีก 84 ราย หายป่วยกลับบ้าน11,452ราย เหลือกำลังรักษา 108,174 ราย",https://www.posttoday.com/social/general/665361,"Tue, 12 Oct 2021 07:44:00 +0700"
ทช.อัพเดตพื้นที่น้ำท่วม ถนน 22 เส้นทางไม่สามารถสัญจรผ่านได้,กรมทางหลวงชนบท รายงานถนน 22 เส้นทางใน 10 จังหวัด  ยังได้รับผลกระทบจากอุทกภัย  ไม่สามารถสัญจรผ่านได้ มี 16 เส้นทาง น้ำท่วมสูง อีก 6 เส้นทาง ทางขาด โครงสร้างทางชำรุด,https://www.posttoday.com/social/general/665360,"Tue, 12 Oct 2021 07:19:00 +0700"
ดาวโจนส์ปิดร่วง/น้ำมันพุ่งแรง/ทองลง,หุ้นดาวโจนส์ปิดร่วง 250.9 จุด ด้านราคาน้ำมันพุ่ง 1.17 ดอลลาร์ขณะที่ทองคำลง 1.70 ดอลลาร์,https://www.posttoday.com/finance-stock/news/665358,"Tue, 12 Oct 2021 06:59:00 +0700"
"""ชลบุรี""คลัสเตอร์เพียบ เจอติดโควิดอีก 511 ราย ดับ 3",ชลบุรี- พบผู้ติดเชื้อโควิด-19 รายใหม่ อีก 511 ราย โยง คลัสเตอร์พื้นที่ทหาร -สถานประกอบการ83 แห่ง ตลาด 5 แห่ง แคมป์คนงานก่อสร้าง 10 แห่ง ชุมชน 4 แห่ง เสียชีวิตเพิ่ม 3 ราย,https://www.posttoday.com/social/local/665357,"Tue, 12 Oct 2021 06:38:00 +0700"
