title,summary,link,published
ส.ส.ก้าวไกล ยื่นขอประกันแกนนำ พร้อมจม.เปิดผนึกร้องให้คืนสิทธิ์ประกันตัว,ส.ส.ก้าวไกล พร้อมแกนนำกลุ่มราษฎร มาศาลยื่นประกันตัว เพนกวิน ไมค์ ไผ่ และเบญจา และยื่น จม.เปิดผนึกถึง ปธ.ศาลฎีกา ขอร้องให้คืนสิทธิ์ประกันตัวผู้ต้องหาการเมือง สมยศ เผยมีจัดชุมนุมใหญ่ 31 ต.ค.,https://www.thairath.co.th/news/politic/2227970,"Tue, 26 Oct 2021 14:30:48 +0700"
"โควิดวันนี้ รวมรักษาตัวใน รพ. 98,150 ราย ติดเชื้อ 7,706 พบ ATK 1,928 ราย","ศบค. รายงานสถานการณ์โควิดวันนี้ 26 ต.ค. 64 มีผู้ติดเชื้อ 7,706 รายใหม่ เสียชีวิต 66 ศพ อาการหนัก 2,414 ราย รักษาหายเพิ่ม 9,532 ราย ตรวจ ATK พบเข้าข่ายอีก 1,928 ราย",https://www.thairath.co.th/news/politic/2227921,"Tue, 26 Oct 2021 14:30:00 +0700"
รมช.สธ.ขออย่าตื่นตระหนก หลังพบคนไทย ติด &quot;เดลตา พลัส&quot; สายพันธุ์ AY.4.2,รมช.สธ. ขอประชาชน อย่าตื่นตระหนกเกินไป ย้ำ โปร่งใส ไม่มีการปกปิดข้อมูล หลังพบคนไทย 1 ราย ติดโควิด &quot;เดลตา พลัส&quot; สายพันธุ์ AY.4.2 ยืนยัน ความพร้อมมาตรการ สธ.เปิดประเทศ รับนักท่องเที่ยว 1 พ.ย.,https://www.thairath.co.th/news/politic/2227961,"Tue, 26 Oct 2021 14:20:00 +0700"
สธ. ย้ำ ไทยยังไม่พบ เดลตาพลัส สายพันธุ์ AY.4.2 ที่ระบาดและหลบภูมิในอังกฤษ,&quot;นพ.ศุภกิจ&quot; ยืนยัน ไทยยังไม่พบ เดลตาพลัส สายพันธุ์ AY.4.2 ที่มีการแพร่ระบาดที่อังกฤษ แต่พบ อัลฟาพลัส จำนวน 18 ราย พบ เดลตkพลัส ชนิด AY.1 จำนวน 1 ราย แต่ยังไม่พบปัญหาใด,https://www.thairath.co.th/news/local/2227966,"Tue, 26 Oct 2021 14:07:00 +0700"
Squid Game สะท้อนวิกฤติหนี้เกาหลีใต้ เมื่อ ปชช.ต้องดิ้นรนเอาชีวิตรอด,ซีรีส์ สควิดเกม ดังเป็นพลุแตกไปทั่วโลก นอกจากจะมีเนื้อเรื่องที่ชวนลุ้น แต่ซีรีส์ยังสะท้อนให้เห็นสังคมเกาหลีใต้ในช่วงที่ต้องเผชิญกับวิกฤติหนี้ ขณะที่ตัวเลขล้มละลายสูงเป็นประวัติการณ์,https://www.thairath.co.th/news/foreign/2227630,"Tue, 26 Oct 2021 14:06:51 +0700"
ถอดรหัส ฝันว่ามีอะไรกับผู้ชาย หมายถึงอะไร?,ฝันว่ามีอะไรกับผู้ชาย หมายถึงอะไร ทำนายความฝันมีอะไรกับผู้ชายหมายถึงอะไร เรามีคำตอบให้,https://www.thairath.co.th/horoscope/belief/2225532,"Tue, 26 Oct 2021 13:57:00 +0700"
รัศมีแข ได้บทเรียนจากการสูญเสีย เปลี่ยนตัวเองใหม่ลดซื้อแบรนด์เนม,หลังนักแสดง รัศมีแข ฟ้าเกื้อล้น ต้องเจอกับเหตุการณ์การสูญเสียคุณพ่อที่เพิ่งตามหาเจอ,https://www.thairath.co.th/entertain/news/2228876,"Wed, 27 Oct 2021 15:33:45 +0700"
“ชัยวุฒิ” ร่วม ตร.ไซเบอร์ ล่าตัวแฮกเกอร์หลอกลูกค้าโรงแรมโอนเงิน สูญ 1.5 ล้านบาท,รมว.ดีอีเอส ร่วมกับ กองบัญชาการตำรวจไซเบอร์ รับหนังสือร้องเรียนจากกลุ่มผู้ประกอบการโรงแรมกักตัว (AQ) ประกาศล่าตัวแฮกเกอร์สวมรอยหลอกลูกค้าโรงแรมโอนเงิน ความเสียหายเบื้องต้น 1.5 ล้านบาท,https://www.thairath.co.th/news/politic/2228947,"Wed, 27 Oct 2021 15:23:00 +0700"
&quot;ศรีสุววรณ&quot; บุก กกต. จี้สอบ &quot;บิ๊กตู่&quot; ครอบงำพรรคพลังประชารัฐหรือไม่แล้ว,&quot;ศรีสุวรรณ จรรยา&quot; ไม่เชื่อ &quot;พล.อ.ประยุทธ์&quot; เรียก 6 รัฐมนตรีเข้าพบ ไม่มีเลศนัย หลังทางพรรคพลังประชารัฐรับลูกเตรียมรื้อโครงสร้าง จี้ กกต. สอบครอบงำพรรคหรือไม่,https://www.thairath.co.th/news/politic/2228931,"Wed, 27 Oct 2021 15:18:00 +0700"
เปิดกรุ 13 หนังผีน่ากลัว คอหนังสยองขวัญไม่ควรพลาด!,&quot;หนังผี&quot; ก็ยังคงเป็นประเภทหนังที่มีความคลาสสิก สร้างความกลัวและความตื่นเต้นให้ผู้ชมผ่านเนื้อหาหลอนๆ อยู่เสมอ ไม่ว่าจะเป็นหนังผีไทย หรือหนังฝรั่ง ก็น่ากลัวไม่แพ้กัน,https://www.thairath.co.th/lifestyle/life/2051819,"Wed, 27 Oct 2021 15:15:00 +0700"
ป้าฝันงูใหญ่เลื้อยเข้าบ้าน ก่อนเจอต้นมะพร้าวคล้ายพญานาค ไม่พลาด จุดธูปขอเลขเด็ด,ป้าวัย 73 ฝันเห็นงูใหญ่เลื้อยเข้าบ้าน ก่อนเช้ามาเจอต้นมะพร้าวน้ำหอมที่ปลูกไว้ มีลักษณะคล้ายพญานาค ไม่พลาด จุดธูป ทาแป้ง ขอเลขเด็ด เสี่ยงโชคงวด 1/11/64,https://www.thairath.co.th/lottery/news/2228926,"Wed, 27 Oct 2021 15:07:28 +0700"
กมธ.วิสามัญฯ แก้ไขปัญหาช้างป่า ลุยพื้นที่ จ.สระแก้ว ผลักดันแก้ปัญหาช้างป่า,คณะกรรมาธิการวิสามัญพิจารณาศึกษาและแก้ไขปัญหาช้างป่า สภาผู้แทนราษฎร ลงพื้นที่รับฟังและผลักดันสร้างแนวกั้นช้างหนีออกนอกเขตอนุรักษ์ในจังหวัดสระแก้ว,https://www.thairath.co.th/news/politic/2228885,"Wed, 27 Oct 2021 15:03:00 +0700"
Sony เปิดตัว Xperia Pro-I ชูเซนเซอร์กล้องขนาด 1 นิ้ว สารพัดประโยชน์ทั้งภาพนิ่งและวิดีโอ,โซนี่ (Sony) เรียกเสียงฮือฮาอีกครั้ง ด้วยการแนะนำสมาร์ทโฟนรุ่นใหม่ Xperia Pro-I โดยเน้นหนักเรื่องกล้อง ทั้งภาพนิ่งและวิดีโอ,https://www.thairath.co.th/news/tech/2228917,"Wed, 27 Oct 2021 15:02:22 +0700"
หาชมยาก &quot;พญากระรอกดำ&quot; โผล่โชว์ตัวนักท่องเที่ยว ที่อ่าวไร่เลย์ (คลิป),หาชมยาก &quot;พญากระรอกดำ&quot; หรือ &quot;พะแมว&quot; โผล่โชว์ตัวนักท่องเที่ยว ที่อ่าวไร่เลย์ ซึ่งพบได้ค่อนข้างยากในป่าธรรมชาติ,https://www.thairath.co.th/news/local/south/2228922,"Wed, 27 Oct 2021 15:02:00 +0700"
นักข่าวค่ายดัง แนะ &quot;ไรซ์&quot; อย่าย้ายซบ แมนยูฯ ชี้ข้อเสียเป็นร้อยส่วนข้อดีมีน้อย,นักข่าวจากสื่อดังในอังกฤษ ออกโรงแนะนำให้ ดีแคลน ไรซ์ รีบปฏิเสธข้อเสนอจาก แมนยูฯ ในทันที โดยชี้ว่าไม่มีอะไรดีเลย ยกเว้นเรื่องการจ่ายค่าเหนื่อย,https://www.thairath.co.th/sport/eurofootball/premierleague/2228775,"Wed, 27 Oct 2021 14:57:16 +0700"
เจ้าหญิงมาโกะยอมรับเครียด 'ข่าวลบ'ของคนรักถาโถม ชาวญี่ปุ่นค้านแต่ง,เจ้าหญิงมาโกะ เปิดใจในวันแต่งงานกับเคโอะ โคมุโระ เผยกระแสข่าวแง่ลบของคนรักมากมายถาโถมหลังหมั้นจนทำให้เสียใจและเครียด แม้แต่ในวันสมรส ยังมีชาวญี่ปุ่นชุมนุมคัดค้านการแต่งงานกับโคมุโระ,https://www.thairath.co.th/news/foreign/2228766,"Wed, 27 Oct 2021 14:51:08 +0700"
&quot;มาดามแป้ง&quot; ขอโทษต้นสังกัด ยันดูแล &quot;วันชาติ&quot; เต็มที่ อัดฉีด 1 เกมบู๊ลาว,&quot;มาดามแป้ง&quot; รับสุดเสียดาย &quot;วันชาติ ชูสงค์&quot; บาดเจ็บหนัก ยืนยันดูแลอย่างดีจนกว่าจะหายเจ็บ พร้อมประกาศอัดฉีดอีก 1 ล้านบาทในเกมพบกับ สปป.ลาว วันพฤหัสบดีนี้,https://www.thairath.co.th/sport/thaifootball/changsuek/2228905,"Wed, 27 Oct 2021 14:50:00 +0700"
โควิดโหดพรากลมหายใจสาวกระบี่ ตายตามพ่อกับแม่ ที่ติดเชื้อดับไปก่อนหน้า,เรื่องเศร้าจากกระบี่ น่าสลดใจสาวกระบี่วัย 40 ป่วยโควิด-19 เสียชีวิตที่ รพ.พบเรื่องเศร้าครอบครัวนี้ สูญเสียพ่อ-แม่ ที่ติดเชื้อตายก่อนหน้าไม่นาน ทำให้ต้องสูญเสีย 3 ชีวิตจากการติดเชื้อ,https://www.thairath.co.th/news/local/south/2228907,"Wed, 27 Oct 2021 14:45:48 +0700"
&quot;เกียรติภูมิ&quot; กำชับสถานบริการสาธารณสุขใน 37 จังหวัด เฝ้าระวังน้ำท่วม,ปลัดกระทรวงสาธารณสุข กำชับสถานบริการสาธารณสุขใน 37 จังหวัดเสี่ยงน้ำหลาก ดินถล่ม ส่วนพายุ &quot;หมาเหล่า&quot; ไม่มีผลกระทบต่อประเทศไทย,https://www.thairath.co.th/news/local/2228911,"Wed, 27 Oct 2021 14:45:00 +0700"
ม็อบ บุกสภาฯ ร้อง กมธ.กฎหมายฯ แก้ ม.112 มวลชน ทาสีเเดง คลานหน้าประตู,&quot;ครช.-ทะลุฟ้า&quot; บุกสภาฯ ยื่นหนังสือ ร้อง กมธ.กฎหมาย แก้ไข ม.112 &quot;โรม&quot; โดดรับลูก ยัน ก้าวไกล เห็นปัญหา แต่ยอมรับไม่ง่ายที่จะผลักดัน ด้านมวลชน ทาสีเเดง คลานหน้าประตูสภา,https://www.thairath.co.th/news/politic/2228906,"Wed, 27 Oct 2021 14:38:00 +0700"
&quot;ทัพไทย&quot; ออก 3 บทเพลงเทิดทูนสถาบัน แผ่นดินไทย ทหารทำเพื่อไทยทั้งชาติ,&quot;บิ๊กแก้ว&quot; ปลื้ม สำนักสวัสดิการทหาร ประพันธ์ 3 บทเพลง เทิดทูน และน้อมรำลึกถึงพระมหากรุณาธิคุณ ของสถาบันกษัตริย์ ที่มีคุณต่อแผ่นดินไทย รวมถึงความรักของ &quot;กองทัพไทย&quot; ที่จะอยู่เคียงพี่น้อง,https://www.thairath.co.th/news/politic/2228812,"Wed, 27 Oct 2021 14:36:00 +0700"
ศบค.เผยยอดฉีดวัคซีนไทย สะสมแล้ว 72 ล้านโดส ยอดเข็ม 2 รวม 40.4% ของประชากรแล้ว,"แพทย์หญิงสุมนี เผย ยอดฉีดวัคซีน สะสมแล้ว 72,049,529 โดส วานนี้เพิ่ม 812,009 โดส ส่วน เข็มที่ 2 สะสม 29,115,651 ราย คิดเป็น 40.4% ของประชากรแล้ว",https://www.thairath.co.th/news/local/2228897,"Wed, 27 Oct 2021 14:34:00 +0700"
ศบค.ขอพื้นที่สีฟ้ารีบฉีดวัคซีนรับเปิดประเทศ-ครู ต้องฉีด 2 เข็ม ถึงเปิดเรียน On site,ศบค. สั่ง บุคลากรทางการศึกษาพื้นที่สีแดง-แดงเข้ม ต้องฉีดวัคซีนครบ 2 เข็ม เพื่อเปิดเรียน On Site ขอพื้นที่สีฟ้าเร่งฉีดเตรียมพร้อมเปิดประเทศ คนได้ครบ 2 เข็ม เข้าฉีดกระตุ้นหน่วยก่อนหน้าได้ทันที,https://www.thairath.co.th/news/politic/2228870,"Wed, 27 Oct 2021 14:29:00 +0700"
ขอหมายจับโจรเจาะฝ้าบุกชิงทอง 378 บาท ผบช.ภ.8 จ่อแถลงละเอียด 28 ต.ค.,ยื่นศาลภูเก็ตขอออกหมายจับโจรเจาะฝ้าเพดานเข้าไปกวาดทองหนัก 378 บาทแล้ว หลัง ตร.ภูเก็ตคุมตัวผู้ต้องสงสัยมาสอบ เป็นหนุ่มเมียนมา เบื้องต้นรับสารภาพทำจริง พร้อมยึดของกลางทั้งเงินสดและทองมาตรวจสอบ,https://www.thairath.co.th/news/crime/2228890,"Wed, 27 Oct 2021 14:27:31 +0700"
ประกาศ &quot;จุฬาฯ&quot; พร้อมสอบข้อเท็จจริง หากนิสิตแสดงออก ขัดระเบียบ และกฎหมาย,จุฬาฯ พร้อมสอบข้อเท็จจริง ฟันวินัย หากนิสิตแสดงออก ขัดต่อระเบียบ และกฎหมาย พร้อมย้ำไม่มีวัตถุประสงค์เพื่อลิดรอน หรือจำกัดเสรีภาพทางความคิด,https://www.thairath.co.th/news/society/2228892,"Wed, 27 Oct 2021 14:27:12 +0700"
คอหวยส่อง &quot;เลขเด็ด&quot; ปลายประทัด &quot;ไอ้ไข่&quot; วัดสนามชัย หลังเคยได้โชคก้อนโต,คนดวงเฮงมาแก้บน &quot;ไอ้ไข่&quot; วัดสนามชัย หลังได้โชคลาภก้อนโต ด้านนักเสี่ยงโชคไม่พลาดส่อง &quot;เลขเด็ด&quot; ปลายประทัด,https://www.thairath.co.th/lottery/news/2228860,"Wed, 27 Oct 2021 14:20:00 +0700"
&quot;จะเด็จ&quot; ย้ำเด็กวัยเรียนรู้ สัมผัสร่างกายเพื่อแสดงความรัก อาจทำให้เด็กสับสน,ผู้อำนวยการมูลนิธิหญิงชายก้าวไกล เผยเด็กที่โต อยู่ในวัยเรียนรู้ การสัมผัสร่างกายเพื่อแสดงความรัก อาจทำให้เด็กสับสน ซึ่งเป็นเรื่องที่ควรระวัง,https://www.thairath.co.th/news/society/2228830,"Wed, 27 Oct 2021 13:32:14 +0700"
อัลฟาพลัส (Alpha Plus) โควิดกลายพันธุ์ หลบภูมิ-อาการรุนแรงกว่าเดิม,อัลฟาพลัส (Alpha Plus) เป็นสายพันธุ์โควิดกลายพันธุ์จากสายพันธุ์หลักคือ สายพันธุ์อัลฟา B.1.1.7 บวกกับการกลายพันธุ์ตำแหน่ง E484K โดยการกลายพันธุ์ตำแหน่งนี้พบครั้งแรกในสายพันธุ์ ..,https://www.thairath.co.th/lifestyle/health-and-beauty/2228622,"Wed, 27 Oct 2021 13:32:06 +0700"
&quot;คูมัน&quot; ยันไม่เคยถือสาแฟนบาร์ซา แก๊งทุบตีรถ ชี้น่ามีปัญหาด้านการศึกษา,กุนซือบาร์ซา ยืนยันไม่เคยคิดถือสาแฟนบาร์เซโลนา ที่ไปรุมทุบตีรถของเขาขณะออกจากสนามหลังเกมพ่าย มาดริด ชี้คนเหล่านี้อาจมีปัญหาเรื่องการศึกษา,https://www.thairath.co.th/sport/eurofootball/otherleague/2228562,"Wed, 27 Oct 2021 13:28:45 +0700"
ผบช.ก. แจงปมถุงมือยางรู้แล้ว ผู้ต้องหามะกันหลบหนีจากไทยไปให้ข่าว CNN,&quot;บิ๊กก้อง&quot; ชี้แจงปมถุงมือยางไม่ได้มาตรฐาน ที่สื่อต่างประเทศนำเสนอถูกส่งไปจากประเทศไทย เป็นผู้ต้องหาชาวมะกันที่อุ้มชาวไต้หวันยังมีคดีในไทย และได้หลบหนีไป นำเรื่องไปให้ CNN จึงแยกเป็น 2 คดี,https://www.thairath.co.th/news/crime/2228786,"Wed, 27 Oct 2021 13:22:00 +0700"
ตร.เผยคดีดูดเงินบัตรเดบิต-เครดิต เหยื่อเกินแสนราย ธนาคารทยอยคืนเงินแล้ว,ตำรวจ PCT รวบม้ากดเงิน แก๊งคอลเซ็นเตอร์ หลอกลวงเสียหายกว่า 13 ล้านบาท ขณะที่ คดีดูดเงินจากบัตรเดบิตและบัตรเครดิต มีเหยื่อกว่าแสนราย โดยทางธนาคารได้คืนเงินแก่ผู้เสียหายแล้ว,https://www.thairath.co.th/news/crime/2228802,"Wed, 27 Oct 2021 13:18:39 +0700"
ชาวบ้านแตกตื่น ประตูระบายน้ำเจ้าเจ็ดบานประตูชำรุด ทำระบายได้แค่ 60 ลบ.ม. (คลิป),กรณีมีชาวบ้านแตกตื่นถึงประตู ระบายเจ้าเจ็ดชำรุด พบประตูระบายน้ำทรุดจมน้ำ ทำให้น้ำไหลผ่านประตูเหลือแค่ 60 ลบ.ม./วินาที จากเดิม 300 ลบ.ม./วินาที ฝั่งตรงข้ามที่ห่วงน้ำท่วม พบน้ำสูงขึ้น 1-2 ซม.,https://www.thairath.co.th/news/local/central/2228736,"Wed, 27 Oct 2021 13:12:00 +0700"
นายกฯ ย้ำ พร้อมขับเคลื่อนความสัมพันธ์ อาเซียน-ญี่ปุ่น แบบ “ใจถึงใจ”,นายกฯ ย้ำไทย ในฐานะประเทศผู้ประสานงานความสัมพันธ์ อาเซียน-ญี่ปุ่น พร้อมขับเคลื่อนความสัมพันธ์อาเซียน-ญี่ปุ่น แบบ “ใจถึงใจ” และ “ความเป็นหุ้นส่วนที่เท่าเทียมกัน” รวมทั้งยังเป็น “มิตรแท้”,https://www.thairath.co.th/news/politic/2228721,"Wed, 27 Oct 2021 13:08:00 +0700"
เกาะสมุยเร่งฉีดวัคซีนป้องกันโควิด เตรียมพร้อมเปิดรับนักท่องเที่ยว 1 พ.ย.,เกาะสมุยเร่งฉีดวัคซีนป้องกันโควิด-19 เตรียมเปิดรับนักท่องเที่ยว 1 พ.ย. ขณะที่ทางผู้ประกอบการเองเห็นด้วย ในการที่จะเปิดรับนักท่องเที่ยวทำให้ธุรกิจเดินหน้าต่อไปได้ แต่ขอให้เข้มมาตรการป้องกัน,https://www.thairath.co.th/news/local/south/2228780,"Wed, 27 Oct 2021 13:07:31 +0700"
&quot;วิดมาร์&quot; ชี้เกม &quot;เอฟเอ คัพ&quot; อันตรายเสมอ ย้ำทีมมุ่งมั่นเพื่อคว้าชัย,&quot;ออเรลิโอ วิดมาร์&quot; กุนซือ &quot;บีจี ปทุม ยูไนเต็ด&quot; ชี้เกม &quot;เอฟเอ คัพ&quot; อันตรายเสมอ แต่ย้ำทีมมาด้วยทัศนคติแบบมืออาชีพเพื่อคว้าชัย,https://www.thairath.co.th/sport/thaifootball/thaipremierleague/2228797,"Wed, 27 Oct 2021 13:00:00 +0700"
