title,summary,link,published
รวบคาม่านรูด &quot;ตั้ม สบตุ๋ย&quot; พ่อค้ายาบ้า พลาดท่าเพราะผู้หญิง,ล้ำไปอีกขั้นตำรวจหลอก &quot;ตั้ม สบตุ๋ย&quot; พ่อค้ายาที่ลำปาง ใช้สายลับหญิง ผิวขาว หน้าตาดี เป็นนกต่อ นัดเสพยาบ้าแลกมีเพศสัมพันธ์ สุดท้ายตั้มพลาด ถูกรวบคาม่านรูด รับคาดไม่ถึงจริงๆ,https://www.thairath.co.th/news/crime/2224830,"Thu, 21 Oct 2021 21:30:19 +0700"
&quot;ซุปเปอร์บอน&quot; หมายตา &quot;แม็คเกรเกอร์&quot; ลงศึกลูกผสม &quot;มวยไทย-MMA&quot;,&quot;ซุปเปอร์บอน&quot; หลังดับซ่า &quot;เปโตรเซียน&quot; และผงาดขึ้นเป็นแชมป์โลก ONE คิกบ็อกซิ่ง รุ่นเฟเธอร์เวต ในศึก ONE: FIRST STRIKE เมื่อ 15 ต.ค.64,https://www.thairath.co.th/sport/fightsport/mma/2224805,"Thu, 21 Oct 2021 21:29:00 +0700"
เพลิงนรกไหม้โกดังวัสดุก่อสร้าง ร้านดังราชบุรี คาดผลาญวอดเกิน 10 ล้าน,ไฟไหม้โกดังเก็บของห้างจำหน่ายวัสดุก่อสร้างดัง เมืองราชบุรี เปลวเพลิงลุกลามเผาวอดเกือบทั้งหลัง ยังไม่ทราบสาเหตุแน่ชัด พนง.เห็นเพลิงลุกลามมาจากบริเวณเก็บกระเบื้องปูพื้น เบื้องคาดความเสียหายเกิ,https://www.thairath.co.th/news/local/central/2225015,"Fri, 22 Oct 2021 02:07:00 +0700"
มูรินโญช็อก &quot;โรมา&quot; โดนคู่แข่งถล่มยับ-สเปอร์ส พ่ายหวิว สรุปผลคอนเฟอเรนซ์ลีก,โรมา ของ โชเซ มูรินโญ พลาดท่าบุกไปแพ้คู่แข่งยับเยิน ขณะที่ ทอตแนม ฮอตสเปอร์ ก็ปราชัยให้กับ วิเทสส์ เช่นกัน สรุปผลฟุตบอลยูโรปา คอนเฟอเรนซ์ ลีก เมื่อคืนที่ผ่านมา,https://www.thairath.co.th/sport/eurofootball/otherleague/2225007,"Fri, 22 Oct 2021 01:50:00 +0700"
&quot;จักรกริช&quot; สุดดีใจ ติดทีมชาติไทยครั้งแรก หวังพาช้างศึกยู-23 ลิ่วรอบสุดท้าย,จักรกริช พาละพล แนวรุกจากขอนแก่น ยุไนเต็ด เปิดใจหลังถูกเรียกติดทีมชาติไทยเป็นครั้งแรกในศึกยู-23 ชิงแชมป์เอเชีย รอบคัดเลือก,https://www.thairath.co.th/sport/thaifootball/changsuek/2225002,"Fri, 22 Oct 2021 00:57:00 +0700"
หมอคนโพสต์ คีบเห็บหมาจากเปลือกตาเด็ก เตือน ห้ามเอาออกเอง,เจ้าของเพชรบูรณ์คลินิก ตรวจรักษาหู คอ จมูก ผู้โพสต์คลิปคีบเห็บหมาออกจากเปลือกตาเด็กลงในโซเชียล เตือนเจอเห็บเกาะที่ไหนอย่าคีบออกเอง เพราะเขี้ยวเห็บอาจหักคา ทำให้แผลอักเสบนานเป็นปี,https://www.thairath.co.th/news/local/north/2224821,"Thu, 21 Oct 2021 21:12:00 +0700"
สู้ๆ นะ &quot;โซลชาร์&quot; ให้กำลังใจ &quot;ฟาน เดอ เบค&quot; หลังโดนดองอยู่ในสำรอง แมนยูฯ,กุนซือ ปิศาจแดง ออกมาให้กำลังใจลูกทีมสายเลือดดัตช์ของเขาหลังตกเป็นตัวสำรองในทีม,https://www.thairath.co.th/sport/eurofootball/premierleague/2224771,"Thu, 21 Oct 2021 21:09:32 +0700"
ละลายพฤติกรรม &quot;มาดามแป้ง&quot; สานสัมพันธ์ช้างศึกยู-23 แจกไอโฟนนักเตะ,“มาดามแป้ง” ผู้จัดการทีมช้างศึกยู-23 เร่งเครื่องปรับจูนความสัมพันธ์ภายในทีม ด้วยการจัดกิจกรรมคลายเครียด แจกไอโฟน 12 เรียกเสียงฮาก่อนนอน,https://www.thairath.co.th/sport/thaifootball/changsuek/2224811,"Thu, 21 Oct 2021 20:50:00 +0700"
จีนสั่งยกเลิกเที่ยวบินหลายร้อยเที่ยวทันที เจอโควิดหวนระบาดรอบใหม่,จีนเผชิญโควิดหวนกลับมาระบาดรอบใหม่ สั่งยกเลิกเที่ยวบินหลายร้อยเที่ยว ปิดโรงเรียน หลังสองสามีภรรยาสูงวัยติดโควิด-19 เดินทางท่องเที่ยวไปหลายมณฑล,https://www.thairath.co.th/news/foreign/2224776,"Thu, 21 Oct 2021 20:03:00 +0700"
&quot;อาร์เตตา&quot; เผยจุดเปลี่ยนอาจจับ &quot;ลากาแซตต์&quot; ต่อสัญญากับ &quot;อาร์เซนอล&quot;,กุนซือ ปืนใหญ่ตอบโต้หลังมีข่าวว่าปิดกั้นการต่อสัญญาของสโมสร กับ ลากาแซตต์ แถมลั่นอีกว่า อาจจะมีการต่อสัญญากันในเร็วๆ นี้,https://www.thairath.co.th/sport/eurofootball/premierleague/2224540,"Thu, 21 Oct 2021 20:02:37 +0700"
ก่อนแมนยูฯ บู๊ลิเวอร์พูล &quot;บรูโน&quot; เผยความเชื่อที่ต้องทำในคืนก่อนแข่ง (คลิป),บรูโน เฟอร์นันเดส เผยกับ เจสซี ลินการ์ด ถึงเบื้องหลังที่ทำให้มีพลังวิ่งในสนามตลอดทั้งเกม ก่อนศึกแดงเดือดพรีเมียร์ลีก อาทิตย์นี้,https://www.thairath.co.th/sport/eurofootball/premierleague/2225202,"Fri, 22 Oct 2021 12:03:00 +0700"
ปริม เอเอฟ10 ขอปกป้องสิทธิ์ หลังถูกแจ้งความขโมยเพลงขอแค่ได้รัก (คลิป),หลังจากที่ น้องป่าน ได้หอบหลักฐานเอกสารการเป็นเจ้าของเพลงที่เป็นผู้แต่งขึ้น,https://www.thairath.co.th/entertain/news/2225197,"Fri, 22 Oct 2021 12:00:22 +0700"
เพื่อนร่วมคอนโดฯ &quot;เจ๊หงส์ พิตบูล&quot; เชื่อไม่มีนิสัยลักขโมย พม.เตรียมหาทางช่วย,สาวสวมชุดชิสุกะ ย่องเข้าบ้านหยิบไอโฟน คือ &quot;เจ๊หงส์ พิตบูล&quot; ด้านเพื่อนร่วมคอนโดฯ ไม่เชื่อว่าจะมีนิสัยลักขโมย ขณะที่เจ้าหน้าที่ พม. เตรียมหาทางช่วยเหลือ ประเมินอาการ,https://www.thairath.co.th/news/society/2225222,"Fri, 22 Oct 2021 11:50:31 +0700"
ทำนายฝันว่าฝนตก ฝนตกหนัก ฝนตกน้ำท่วม สื่อถึงอะไร?,การฝันว่าฝนตก หรือฝันเห็นฝนตก สามารถนำไปทำนายฝันได้ตามความเชื่อของคนไทย ส่วนจะมีความหมายดี-ร้าย ก็ขึ้นอยู่กับลักษณะของความฝัน,https://www.thairath.co.th/horoscope/belief/2225137,"Fri, 22 Oct 2021 11:45:10 +0700"
#Sxygirl พุ่งติดเทรนด์ หลัง DJ Snake ปล่อยเพลง SG &quot;ลิซ่า&quot; แดนซ์จัดเต็ม,"DJ Snake ปล่อย MV เพลงใหม่ SG ร่วมกับ Lisa BLACKPINK, Ozuna, Megan Thee Stallion ทำแฮชแท็ก #Sxygirl พุ่งติดเทรนด์ทวิตเตอร์",https://www.thairath.co.th/news/society/2225207,"Fri, 22 Oct 2021 11:44:00 +0700"
สลด ไฟไหม้บ้านคลอกเด็ก 6 ขวบดับ แม่เศร้าเห็นลูกร้องแต่ช่วยไม่ทัน,สลด ไฟไหม้บ้านเพิงพักชั้นเดียวคลอกเด็ก 6 ขวบดับ โดยที่แม่ที่กำลังแยกของเก่าได้ยินเสียงร้อง แต่ด้วยเปลวเพลิงที่แรง จึงช่วยไม่ทัน พร้อมตั้งข้อสงสัยบ้านไม่มีไฟฟ้า ไม่ได้จุดยากันยุง ตะเกียง,https://www.thairath.co.th/news/local/bangkok/2225190,"Fri, 22 Oct 2021 11:35:00 +0700"
มิว ศุภศิษฏ์ เปิดแผง อวดกล้ามอกแน่นๆ ทำแฟนคลับใจบางกันทั้งโลก,ใครไหวไปก่อนเลยจ้า เมื่อ มิว ศุภศิษฏ์ อวดกล้ามอกแน่นๆ ลงโซเชียล งานนี้ทำเอาแฟนคลับใจบางกันทั้งโลก,https://www.thairath.co.th/entertain/news/2225165,"Fri, 22 Oct 2021 11:26:59 +0700"
รวมความหมาย &quot;ฝันเห็นอุจจาระ&quot; พร้อมคำทำนายฝัน,ทุกๆ คนต่างมีความฝัน และบางครั้งความฝันที่เสมือนจริงก็ทำให้เราคิดว่ามันน่าจะมีความหมาย ฝันเห็นขี้ก็เป็นสิ่งหนึ่งที่คนทั่วโลกหาคำตอบ มาดูกันว่าความฝันแบบนี้มีความหมายว่าอย่างไรได้บ้าง,https://www.thairath.co.th/horoscope/belief/2224652,"Fri, 22 Oct 2021 11:23:41 +0700"
ฟังเสียงผู้ประกอบการขนส่ง น้ำมันแพงซ้ำเติมโควิด น้ำตาอาบแก้ม เจ็บสาหัส,ราคาน้ำมันมีแนวโน้มแพงต่อเนื่องโดยเฉพาะดีเซล ทำให้ผู้ประกอบการขนส่ง มีภาระต้นทุนเพิ่มสูงขึ้น ซ้ำเติมวิกฤติโควิด เพราะก่อนหน้านั้นการบริการขนส่งได้หยุดชะงักไปกว่า 40% จากการล็อกดาวน์,https://www.thairath.co.th/scoop/theissue/2224820,"Fri, 22 Oct 2021 11:20:00 +0700"
เพื่อไทย ปล่อยคลิป &quot;เพื่อไทยถามอะไรตอบได้&quot; ดึง ส.ส. ตอบคำค้นหา &quot;กูเกิล&quot;,เพื่อไทย ลุยรีแบรนดิ้งต่อ ปล่อยคลิป “เพื่อไทยถามอะไรตอบได้” ดึง ส.ส. ตอบคำค้นหากูเกิล ก่อนประชุมใหญ่ปลายเดือนนี้ ยัน แม้เป็นฝ่ายค้านแต่ก็ไม่ได้ค้านทุกเรื่อง,https://www.thairath.co.th/news/politic/2225156,"Fri, 22 Oct 2021 11:20:00 +0700"
มาตรการใหม่ Apple พนักงานที่ยังไม่ได้รับวัคซีนต้องตรวจ ATK ทุกวัน,เผยมาตรการใหม่ของแอปเปิล (Apple) สำหรับพนักงานที่ยังไม่ได้รับวัคซีน จะต้องตรวจผลด้วย ATK ทุกครั้งที่เข้าออฟฟิศ ขณะที่พนักงานที่ได้รับวัคซีนครบแล้ว ตรวจด้วย ATK สัปดาห์ละครั้ง,https://www.thairath.co.th/news/tech/2225185,"Fri, 22 Oct 2021 11:17:20 +0700"
แก้ม กวินตรา ไม่รู้ตัวตั้งท้อง เผยข่าวดีได้ลูกชาย สมใจคุณพ่อนักเตะ,กลายเป็นว่าที่คุณแม่อีกคนของวงการบันเทิง สำหรับนักแสดงสาว แก้ม กวินตรา,https://www.thairath.co.th/entertain/news/2225180,"Fri, 22 Oct 2021 11:14:41 +0700"
22 ตุลาคม 64 ชดเชย &quot;วันปิยมหาราช&quot; วันหยุดราชการ วันหยุดธนาคาร,ย้ำอีกครั้ง 22 ตุลาคม 2564 หยุดชดเชย &quot;วันปิยมหาราช&quot; วันหยุดราชการ วันหยุดธนาคาร,https://www.thairath.co.th/news/society/2225192,"Fri, 22 Oct 2021 11:14:19 +0700"
เชื่อ &quot;แฟนคลับ&quot; จัดให้  ภาพ &quot;บิ๊กตู่&quot; สวัสดี ครบ 7 วัน ว่อนโซเชียลฯ,ว่อนโซเชียลฯ เชื่อ &quot;แฟนคลับ&quot; จัดให้ ตัดต่อภาพ &quot;บิ๊กตู่&quot; &quot;สวัสดี&quot; ครบทั้ง 7 วัน พร้อมแคปชั่นเด็ด คุ้นหู! อาทิ &quot;ไม่ทิ้งใครไว้ข้างหลัง&quot; หรือ &quot;ร่วมกันพลิกโฉมประเทศไทย&quot;,https://www.thairath.co.th/news/politic/2225176,"Fri, 22 Oct 2021 11:14:00 +0700"
ถอดบทเรียนความเสี่ยงปี 64 เพราะภัยอยู่รอบบ้าน การประกันบ้านจึงสำคัญ,ปฏิเสธไม่ได้เลยว่า “2564” คือปีที่หนักหนาและท้าทายอย่างมากสำหรับคนไทย ไม่ใช่แค่เพียงเรื่องของโรคระบาดเท่านั้น แต่เมื่อเรามองย้อนกลับไป จะพบว่ามีเหตุ “ภัยพิบัติ” จำนวนมากที่คุกคามคนไทย,https://www.thairath.co.th/news/local/2225135,"Fri, 22 Oct 2021 11:12:00 +0700"
Viatris จัดแคมเปญ “เรื่องเข่า ต้องให้ “ไว” ในวันโรคข้อสากล,Viatris (เวียร์ทริศ) บริษัทชั้นนำด้านสุขภาพของโลกจัดแคมเปญ “เรื่องเข่า ต้องให้ “ไว” อันมีวัตถุประสงค์เพื่อสร้างความตระหนักรู้ และวิธีการป้องกันโรคข้อเข่าให้แก่ผู้สูงอายุ,https://www.thairath.co.th/lifestyle/life/2224367,"Fri, 22 Oct 2021 10:56:00 +0700"
หนุ่ม กรรชัย ย้อนเล่าคดีรถมินิ ขนาดไม่มีโซเชียลยังต้องหนีไปอยู่เยอรมนี,หนุ่ม กรรชัย เล่าประสบการณ์ตัวเองเมื่อสมัยตกเป็นข่าวดังเรื่อง รถมินิ บอกขนาดไม่มีโซเชียล ยังเป็นข่าวหน้าหนึ่งหนังสือพิมพ์ทุก 10 วัน จนต้องหนีไปอยู่เยอรมนี แต่ถ้ามีโซเชียลคงต้องหนีไปนรกแน่ๆ,https://www.thairath.co.th/entertain/news/2225162,"Fri, 22 Oct 2021 10:54:54 +0700"
หมอธีระ เตือนหลังเปิดรับ 46 ประเทศ เสี่ยงโควิดระบาด แนะ &quot;อัตตาหิ อัตตโน นาโถ&quot;,รศ.นพ.ธีระ เตือนหลังมีนโยบายเตรียมเปิดรับ 46 ประเทศ เสี่ยงโควิดระบาด แนะคนในประเทศ &quot;อัตตาหิ อัตตโน นาโถ&quot;,https://www.thairath.co.th/news/society/2225166,"Fri, 22 Oct 2021 10:53:17 +0700"
เฮ &quot;ดอยอินทนนท์&quot; พร้อมเปิดรับ นทท. ขึ้นชมทะเลหมอก รับลมหนาว 10 พ.ย.นี้,พร้อมแล้ว &quot;ดอยอินทนนท์&quot; เปิดรับ นทท. 10 พ.ย.นี้ เตรียมแพ็กกระเป๋าแล้วแอ่วดอย ขึ้นสัมผัสธรรมชาติชมพระอาทิตย์ยามเช้า ทะเลหมอก แถมอากาศลดฮวบ เช้านี้เย็น 11 องศา,https://www.thairath.co.th/news/local/north/2225151,"Fri, 22 Oct 2021 10:51:00 +0700"
พิงกี้ สาวิกา แจงข่าวเลิกรับละคร เตรียมเป็นแม่ค้าออนไลน์เพราะรายได้ดี,หลังจากที่นักแสดงสาวมากความสามารถอย่าง พิงกี้ สาวิกา ไชยเดช ได้ให้สัมภาษณ์ผ่านทางรายการแฉว่า,https://www.thairath.co.th/entertain/news/2225157,"Fri, 22 Oct 2021 10:39:00 +0700"
นุ่น วรนุช โพสต์ภาพแซ่บพร้อมประกาศโสดกลางไอจี,นุ่น วรนุช โพสต์ภาพแซ่บเบาๆ พร้อมประกาศโสดกลางไอจี งานนี้คุณสามี ต๊อด ปิติ อาจมีหึงได้,https://www.thairath.co.th/entertain/news/2225226,"Fri, 22 Oct 2021 12:58:52 +0700"
&quot;จาย&quot; คว้าอันดับ 8 ของรายการคีรินชิงแชมป์โลก,&quot;จาย อังค์สุธาสาวิทย์&quot; คว้าอันดับ 8 ของโลกในการแข่งขันรายการคีริน ศึกจักรยานประเภทลู่ชิงแชมป์โลก 2021 ที่ประเทศฝรั่งเศส,https://www.thairath.co.th/sport/worldsport/2225256,"Fri, 22 Oct 2021 12:30:00 +0700"
แม่มา มาแรง &quot;ธิดาวานร&quot; ปังสมการรอคอย &quot;ปิ่น ชรินพร&quot; แฮปปี้ เรตติ้งเปิดตัว 5.1,แม่มา มาจริง ๆ แถมแรงทีเดียว ออกสตาร์ตเปิดตัวปังสมการรอคอย สำหรับ “ธิดาวานร” ละครแนวคอมเมดี้ผจญภัย ทางช่อง 7HD หลังออกอากาศตอนแรก กำเนิดเมงกาเลีย ก็สร้างปรากฏการณ์ทำเรตติ้งสูงถึง 5.1,https://www.thairath.co.th/novel/news/2225232,"Fri, 22 Oct 2021 12:30:00 +0700"
แอ๊ว อำภา ลุคใหม่สุดปังในวัย 61 ชาวเน็ตถึงกับต้องขยี้ตารัวๆ,หลังจากที่ก่อนหน้านี้ นักแสดงรุ่นใหญ่ แอ๊ว อำภา ภูษิต ที่อายุ 61 ปี,https://www.thairath.co.th/entertain/news/2225245,"Fri, 22 Oct 2021 12:29:59 +0700"
นายกฯ เร่งเครื่องเปิดประเทศ รับ 46 ชาติ เสี่ยงต่ำเข้าไทย ขออย่า&quot;การ์ดตก&quot;,โฆษกรัฐบาล เผย นายกฯ เร่งเครื่องเตรียมพร้อมเปิดประเทศ รับนักท่องเที่ยว 46 ประเทศ ความเสี่ยงต่ำกลุ่มแรก เดินทางเข้าไทยได้ โดยไม่ต้องกักตัว หวังดึงนักท่องเที่ยวสร้างรายได้พลิกโฉมประเทศ,https://www.thairath.co.th/news/politic/2225241,"Fri, 22 Oct 2021 12:26:00 +0700"
โตโน่ ร้องไห้หนักนั่งกอดหลุมศพสุดยอดเพื่อนรัก ขอให้หลับให้สบาย,โตโน่ ร่ำไห้หนัก นั่งกอดหลุมศพ ไอ้เขี้ยวเงิน น้องหมาแสนรัก ยกให้เป็นสุดยอดหมาและช่วยเป็นกำลังใจดีๆ ในวันที่เหนื่อย บอกให้หลับให้สบาย ไม่ต้องห่วงอะไร,https://www.thairath.co.th/entertain/news/2225217,"Fri, 22 Oct 2021 12:24:15 +0700"
เพื่อไทย ห่วง “บิ๊กตู่” ตามอาชญากรรมไซเบอร์ไม่ทัน คนเดือดร้อนถูกลอบถอนเงิน,เพื่อไทย ห่วง “บิ๊กตู่” ตามอาชญากรรมไซเบอร์ไม่ทัน ประชาชนเดือดร้อนจากการถูกลอบถอนเงิน ชี้ เคยเตือนแล้วสมัย &quot;พร้อมเพย์&quot; แนะ &quot;ดีอีเอส&quot; ควรให้ความสำคัญเรื่องนี้มากกว่าจับแต่เฟกนิวส์,https://www.thairath.co.th/news/politic/2225230,"Fri, 22 Oct 2021 12:19:00 +0700"
เดนคุกเมายาฆ่าอาบัง เตะก้านคอ ทำร้ายบ้าคลั่ง ยกมือไหว้ยังไม่ยอม,อาบังชาวอินเดีย ที่ถูกหนุ่มคลั่งทำร้ายบนถนนที่นางรอง บุรีรัมย์ เสียชีวิตแล้ว พบคนร้ายเป็นอดีตขาใหญ่ในคุก อ้างมองหน้าแล้วเกิดเขม่น ก่อนจยย. เกี่ยวกัน เลยลงไปกระทืบนับสิบครั้ง,https://www.thairath.co.th/news/crime/2225401,"Fri, 22 Oct 2021 14:38:00 +0700"
