title,summary,link,published
iFixit ชำแหละผ้าเช็ดหน้าจอ Polishing Cloth สุดนวัตกรรมจาก Apple,หนึ่งในสินค้าที่เรียกเสียงฮือฮาได้มากที่สุดครั้งหนึ่งของแอปเปิล (Apple) ในปี 2021 คงหนีไม่พ้นผ้าเช็ดหน้าจอ Polishing Cloth ซึ่งมีราคาจำหน่าย 19 ดอลลาร์สหรัฐ ก่อนที่จะถูก iFixit ชำแหละ,https://www.thairath.co.th/news/tech/2233329,"Mon, 01 Nov 2021 15:11:19 +0700"
“เฉลิมชัย” สั่งกรมปศุสัตว์ดันไทยรักษาสถานะปลอดโรคอหิวาต์แอฟริกาในสุกร (ASF),“เฉลิมชัย” สั่งกรมปศุสัตว์ดันไทยรักษาสถานะปลอดโรคอหิวาต์แอฟริกาในสุกร (ASF) หนึ่งเดียวในอาเซียน คุมเข้มการเคลื่อนย้ายสุกร หมูป่าหรือซากสุกร ซากหมูป่าในเขตเฝ้าระวังโรค,https://www.thairath.co.th/news/local/2233328,"Mon, 01 Nov 2021 15:01:00 +0700"
ศบค.ห่วง งานเทศกาลทำติดเชื้อโควิดพุ่ง-เร่งฉีดวัคซีน 17 จังหวัดสีฟ้า,ศบค.ขอประชาชน แม้เปิดประเทศแล้ว ยังต้องป้องกันตัวเองขั้นสูงสุด Universal prevention ชี้ เปิดเรียนไม่จำเป็นตรวจ ATK นักเรียนทุกคน เน้นกลุ่มเสี่ยง ย้ำ ห่วงงานเทศกาลทำติดเชื้อโควิดพุ่ง,https://www.thairath.co.th/news/politic/2233284,"Mon, 01 Nov 2021 15:00:00 +0700"
เลขาฯสมช. ลงใต้เดินหน้าร่วมขับเคลื่อน แก้ไขปัญหา จชต. สู่สันติสุข,&quot;เลขาฯสมช.&quot; ลงพื้นที่จังหวัดชายแดนใต้ มอบ กองทัพภาคที่ 4 ตำรวจภาค 9 เดินหน้าสร้างความเข้าใจร่วมกัน พร้อมขับเคลื่อนการแก้ไขปัญหาในพื้นที่ 3 มิติ เพื่อนำไปสู่สันติสุข รวมทั้งการตั้ง ศบค.,https://www.thairath.co.th/news/local/south/2233314,"Mon, 01 Nov 2021 14:56:00 +0700"
&quot;บิ๊กตู่&quot; ปลื้ม เปิดประเทศ เป็นไปได้ด้วยดี หลังบินถึง &quot;สหราชอาณาจักร&quot;,&quot;บิ๊กตู่&quot; ปลื้ม เปิดประเทศวันแรก เป็นไปได้ด้วยดี นักท่องเที่ยวแห่ชื่นชม ให้กำลังใจทุกภาคส่วน หลังบินถึง เมืองกลาสโกว์ สหราชอาณาจักร เข้าร่วมประชุม COP26 ว่าด้วยการเปลี่ยนแปลงสภาพภูมิอากาศ,https://www.thairath.co.th/news/politic/2233310,"Mon, 01 Nov 2021 14:55:00 +0700"
ศุลกากรท่าเรือกรุงเทพ ติวเข้มเจ้าหน้าที่รองรับการเปิดประเทศ 1 พ.ย.64,ศุลกากรท่าเรือกรุงเทพ ติวเข้มเจ้าหน้าที่ รองรับการขยายตัวทางเศรษฐกิจหลังรัฐบาลเปิดประเทศ 1 พ.ย. 64,https://www.thairath.co.th/business/economics/2233288,"Mon, 01 Nov 2021 14:26:00 +0700"
ลุ้นไปบอลโลกสมัย 3 &quot;ชบาแก้ว&quot; รายงานตัวเตรียมลุยศึกชิงแชมป์เอเชีย รอบสุดท้าย,ทีมฟุตบอลหญิงทีมชาติไทยรายงานตัวก่อนเข้าแคมป์เตรียมลุยศึกชิงแชมป์เอเชีย รอบสุดท้าย ที่อินเดีย ลุ้นตั๋วไปฟุตบอลโลกสมัยที่ 3,https://www.thairath.co.th/sport/thaifootball/changsuek/2233318,"Mon, 01 Nov 2021 14:25:00 +0700"
'ฮั่งเส็ง' ดิ่งสวนทางหุ้นญี่ปุ่นที่ปรับตัวขึ้นหลังการเลือกตั้ง,'ฮั่งเส็ง' ดิ่งต่อเนื่อง ต่ำสุดในรอบ 3 สัปดาห์ สวนทางดัชนี 'นิคเคอิ' ที่ปรับตัวขึ้น 2.2 เปอร์เซ็นต์ ตอบรับผลการเลือกตั้งญี่ปุ่น,https://www.thairath.co.th/news/foreign/2233264,"Mon, 01 Nov 2021 14:23:25 +0700"
สมาคมประชาคมคนตาบอดไทย ช่วยผู้ประสบภัยน้ำท่วมและโควิด-19,นายพัฒน์ธนชัย สระกวี นายกสมาคมประชาคมคนตาบอดไทย พร้อมด้วยทีมงาน เร่งลงพื้นที่น้ำท่วม เพื่อจัดตั้งโรงครัวประกอบอาหารเลี้ยงชาวบ้านในจังหวัดสิงห์บุรี ที่ประสบภัยน้ำท่วมใน 3 อำเภอ,https://www.thairath.co.th/news/local/2233306,"Mon, 01 Nov 2021 14:20:00 +0700"
&quot;โชคดีรับเบญจเพส&quot; สาวโพธารามสุดเฮง ถูกรางวัลที่ 1 รับ 6 ล้านบาท,สาวโพธาราม วัยเบญจเพสดวงเฮง ซื้อลอตเตอรี่ 2 ใบ แบ่งคนละใบกับพ่อ หวยออกเฮลั่น รับโชค 6 ล้านบาท เจ้าตัวเชื่อเป็นเพราะดวง เตรียมนำเงินแบ่งพ่อแม่-ใช้หนี้-เก็บไว้เป็นทุนชีวิต,https://www.thairath.co.th/news/local/central/2233700,"Tue, 02 Nov 2021 01:49:00 +0700"
กมธ.ดีอีเอส ช่วยชาวดอย-เช็กความพร้อมโครงสร้างดิจิทัล รองรับเปิดประเทศ,กมธ.ดีอีเอส ลงพื้นที่ อ.เวียงป่าเป้า จ.เชียงราย ช่วยชาวบ้านบนดอยห่างไกล ไม่มีสัญญาณโทรศัพท์ต่อต่อสื่อสาร พร้อมตรวจความพร้อมโครงสร้างดิจิทัล รองรับเปิดประเทศ ต้อนรับนักท่องเที่ยว 1 พ.ย.นี้,https://www.thairath.co.th/news/local/bangkok/2233696,"Tue, 02 Nov 2021 01:25:00 +0700"
นักโทษเฮ เปิดเยี่ยมญาติ 12 พ.ย.นี้ กำชับทุกเรือนจำเร่งฉีดวัคซีนเข็ม 2,รมว.ยุติธรรม เผยเปิดเยี่ยมญาติวันแรก 12 พ.ย.นี้ เตรียมลงพื้นที่ จ.น่าน แจก N95 ทุกเรือนจำบริการประชาชนหลังเอกชนบริจาค 2 ล้านชิ้น กำชับทุกแห่งเร่งฉีดวัคซีนเข็มสองให้ครบ,https://www.thairath.co.th/news/local/2233692,"Tue, 02 Nov 2021 01:04:00 +0700"
รมว.คมนาคม พอใจเปิด ปท.วันแรก คาดผู้โดยสารเข้าไทยทั้งเดือนกว่า 7 แสนคน,&quot;ศักดิ์สยาม&quot; พอใจมาตรการคัดกรองผู้เดินทางเข้าประเทศ ตามนโยบายนายกฯ ในการเปิดประเทศ คาดผู้โดยสารเข้าไทยทั้งเดือน กว่า7 แสนคน,https://www.thairath.co.th/news/local/central/2233688,"Tue, 02 Nov 2021 00:22:00 +0700"
หวังตามรอยปืนโต &quot;มาเน&quot; หวังพาลิเวอร์พูล คว้าแชมป์ลีกแบบไร้พ่าย,แนวรุกคนสำคัญของทีมหงส์แดง ประกาศชัดต้องการพาต้นสังกัดตามรอยพลพรรคปืนโต ด้วยการคว้าแชมป์แบบไร้พ่ายในฤดูกาลนี้,https://www.thairath.co.th/sport/eurofootball/premierleague/2233610,"Mon, 01 Nov 2021 23:50:00 +0700"
ไทยมั่นใจพร้อม &quot;เปิดประเทศ&quot; ไม่ผวาคลัสเตอร์ ตจว. จับตาโควิดฯ 6 จังหวัด,1 พ.ย. 2564 &quot;เปิดประเทศ&quot; ไทยมั่นใจพร้อม นายกฯ กำชับทุกหน่วยงานดูแล ขอประชาชนทุกคนต้องมีส่วนร่วมปฏิบัติตามมาตรการป้องกันโควิดฯ เคร่งครัด,https://www.thairath.co.th/news/local/2233125,"Mon, 01 Nov 2021 23:42:00 +0700"
แฟนเกรมิโอหัวร้อนพัง VAR ระบายอารมณ์ หลังทีมรักส่อตกชั้น (คลิป),ชมคลิปแฟนบอลทีมดังในลีกแดนแซมบ้า หัวร้อนแบบหยุดไม่อยู่ หลังพ่ายคู่ปรับสำคัญคาบ้าน ทำให้มีโอกาสตกชั้นค่อนข้างสูง,https://www.thairath.co.th/sport/eurofootball/otherleague/2233685,"Mon, 01 Nov 2021 23:10:00 +0700"
กกต.ประกาศผลการเลือกตั้งสมาชิกสภาเทศบาล (ส.อบต.) แทนตำแหน่งที่ว่าง,กกต.ประกาศผลการเลือกตั้งสมาชิกสภาเทศบาล ส.อบต. นาตาล่วง อ.เมือง จ.ตรัง นายธนกร ยี่สิ้น และ นายนิคม นุ่มคุ้ม ส.อบต.หลักห้า อ.บ้านแพ้ว จ.สมุทรสาคร แทนตําแหน่งที่ว่าง,https://www.thairath.co.th/news/politic/2233676,"Mon, 01 Nov 2021 22:55:00 +0700"
สีสันแสบตา ไนกี้เปิดตัวลูกบอล &quot;พรีเมียร์ลีก&quot; หน้าหนาวดีไซน์ใหม่,“ไนกี้” เปิดตัวลูกฟุตบอลดีไซน์ใหม่ ที่จะใช้ในการแข่งขันศึกพรีเมียร์ลีก ซีซั่น 2021-22 ช่วงหน้าหนาวที่จะถึงนี้ ซึ่งยังคงคอนเซปต์สีสันสะดุดตาเช่นเดิม,https://www.thairath.co.th/sport/eurofootball/premierleague/2233664,"Mon, 01 Nov 2021 22:50:00 +0700"
ให้อสม.เป็น ผู้สมัคร-ผู้ช่วยหาเสียง งดปฏิบัติหน้าที่ ขณะหาเสียงเลือกตั้ง,กกต.ออกประกาศ ขอความร่วมมือไปยัง สธ.ขอให้ผู้สมัครหรือผู้ช่วยหาเสียง ที่เป็น อสม.งดการปฏิบัติหน้าที่ อสม. ขณะทําการหาเสียงเลือกตั้ง ส.อบต.-นายกอบต. เพื่อความสุจริตและเที่ยงธรรม,https://www.thairath.co.th/news/politic/2233681,"Mon, 01 Nov 2021 22:47:00 +0700"
สธ.ย้ำ ติดตาม 6 จังหวัดใกล้ชิด หลังตัวเลข ติดเชื้อเป็นกลุ่มก้อน พุ่ง!,สธ.ย้ำ ติดตาม 6 จังหวัดใกล้ชิด หลังติดเชื้อ เป็นกลุ่มก้อนพุ่ง ยัน เปิดประเทศต้องปลอดภัย เน้นหลัก 4 ประการ สถานการณ์โดยรวม ไทยแนวโน้มติดเชื้อโควิดลดลง ขอประชาชนร่วมมือ,https://www.thairath.co.th/news/local/2233673,"Mon, 01 Nov 2021 22:42:00 +0700"
&quot;ฮาเมส&quot; เดือดจ่อวางมวยผู้ตัดสินลีกกาตาร์หลังเป่าไม่ถูกใจก่อนถูกไล่ออก (คลิป),อดีตสตาร์ของ เรอัล มาดริด หัวร้อนหนักเกือบจะมีเรื่องกับผู้ตัดสินในลีกกาตาร์ จากเหตุไม่พอใจคำตัดสินก่อนถูกไล่ออกจากสนามในทันที,https://www.thairath.co.th/sport/eurofootball/otherleague/2233537,"Mon, 01 Nov 2021 22:09:55 +0700"
อตาลันตา เปิดบ้านรอล้างแค้น แมนยูฯ โปรแกรม ยูฟ่า แชมเปียนส์ลีก 2 พ.ย. 64,โปรแกรมการแข่งขันฟุตบอล ยูฟ่า แชมเปียนส์ลีก ประจำคืนวันอังคารที่ 2 พฤศจิกายน 2564 คู่เอกของคืนนี้ แมนเชสเตอร์ ยูไนเต็ด จะบุกไปเยือน อตาลันตา,https://www.thairath.co.th/sport/eurofootball/uefa/2233514,"Mon, 01 Nov 2021 22:01:59 +0700"
แถวนี้มันเถื่อน โค้ชลีกอาร์เจนฯ สุดซวย โดนยิงระหว่างคุมทีม (คลิป),โค้ชฟุตบอลในลีกล่างของแดนฟ้าขาวสุดซวย โดนลูกหลงจากเหตุแฟนบอลยิงกันข้างสนาม จนทำให้ได้รับบาดเจ็บที่บริเวณหัวไหล่,https://www.thairath.co.th/sport/eurofootball/otherleague/2233600,"Mon, 01 Nov 2021 22:00:00 +0700"
ส่ง &quot;ร่างทรง&quot; ชิงภาพยนตร์ต่างประเทศยอดเยี่ยม ออสการ์ ครั้งที่ 94,สมาพันธ์สมาคมภาพยนตร์แห่งชาติ มีมติเลือก &quot;ร่างทรง&quot; ชิงภาพยนตร์ต่างประเทศยอดเยี่ยม ในงานออสการ์ ครั้งที่ 94,https://www.thairath.co.th/news/society/2233640,"Mon, 01 Nov 2021 21:51:43 +0700"
TikTok พารวย แม่ค้าข้าวมันไก่จุดธูป 16 ดอก อธิษฐานขอถูกหวย รับ 12 ล้าน,แม่ค้าข้าวมันไก่ อ.ขุนหาญ อธิษฐานขอให้ถูกหวย จุดธูป 16 ดอก ตามคำแนะนำในคลิป TikTok โชคดีถูกลอตเตอรี่รางวัลที่ 1 จำนวน 2 ใบ รับเงิน 12 ล้าน เตรียมนำเงินไปใช้หนี้ และทำบุญ,https://www.thairath.co.th/news/local/northeast/2233612,"Mon, 01 Nov 2021 21:48:00 +0700"
เปิดตัวเลขค่าฉีกสัญญาของ &quot;รามอส&quot; ทำบอร์ดเปแอสเช ทำใจจ่ายไม่ไหว,เปิดจำนวนตัวเลขค่าฉีกสัญญาระหว่าง รามอส กับ เปแอสเช จนเป็นเหตุให้สโมสรอาจทำใจจ่ายให้ไม่ไหว และเก็บนักเตะไว้ในม้านั่งสำรอง,https://www.thairath.co.th/sport/eurofootball/otherleague/2233464,"Mon, 01 Nov 2021 21:45:11 +0700"
ระยอง 2 แม่ค้า ต่างอำเภอ พร้อมใจถูกที่ 1 รับเงินรวม 18 ล้านบาท,คนรวยอยู่ระยอง ถูกรางวัลที่ 1 พร้อมกัน 2 อำเภอ เป็นแม่ค้าทั้งคู่ รายแรกขายขนมปัง เฮงถูก 2 ใบ รับ 12 ล้าน เผยซื้อจากเพื่อน 6 ใบ แบบไม่คิด เพราะเสี่ยงดวงเป็นประจำทุกงวด เลยกลายเป็นเศรษฐินี,https://www.thairath.co.th/news/local/east/2233589,"Mon, 01 Nov 2021 21:12:00 +0700"
&quot;โรมาโน&quot; ยันเอง สเปอร์ส ใกล้ปิดดีลดึง &quot;คอนเต&quot; นั่งกุนซือแทน &quot;นูโน&quot;,สายข่าวดังจากอิตาลี รายงานว่า สเปอร์ส ใกล้จะบรรลุข้อตกลงกับ อันโตนิโอ คอนเต ว่าที่กุนซือใหม่ของทีม โดยเหลืออีกไม่กี่ขั้นตอนก็จะแล้วเสร็จ,https://www.thairath.co.th/sport/eurofootball/premierleague/2233582,"Mon, 01 Nov 2021 20:51:34 +0700"
หลานหยิบแม่น แม่ค้าข้าวจี่รับโชคถูก 6 ล้าน ทั้งที่ยังค้างค่าลอตเตอรี่,หลานสาววัย 7 เดือน หยิบสลากกินแบ่งให้แม่ค้าข้าวจี่รับโชคใหญ่ ถูกลอตเตอรี่รางวัลที่ 1 รับเงิน 6 ล้าน ทั้งที่ยังค้างค่าหวยที่ซื้ออยู่ จากนี้คงนำเงินที่ได้ไปใช้หนี้สิน และทำบุญ พร้อมจะทำข้าวจี่,https://www.thairath.co.th/news/local/northeast/2233581,"Mon, 01 Nov 2021 20:38:00 +0700"
แม่ค้าลูกชิ้นบุรีรัมย์เฮง อยากซื้อ 37 ถูกที่ 1 สมใจรับเงิน 6 ล้าน,แม่ค้าขายส่งลูกชิ้นยืนกิน บุรีรัมย์ ดวงดี อยากซื้อเลข 37 มีพ่อค้ามาขาย เลยจัด 4 ใบ ปรากฏว่าถูกรางวัลที่ 1 จำนวน 1 ใบ รับเงิน 6 ล้าน เจ้าตัวเผยมีแรงบันดาลใจว่าอยากซื้อเลขนี้ เตรียมนำเงินมาใช้,https://www.thairath.co.th/news/local/northeast/2233562,"Mon, 01 Nov 2021 20:29:00 +0700"
&quot;อุทาหรณ์&quot; หนุ่มดวงกุด ควบ จยย.ย้อนศร ประสานงาแท็กซี่ดับ หน้า สน.พญาไท,หนุ่ม 29 ควบ จยย.ประสานงานแท็กซี่กระเด็นดับคาที่ บน ถ.ศรีอยุธยาขาเข้า หน้า สน.พญาไท โซเฟอร์แท็กซี่ เผย จยย.ขับย้อนศรพุ่งมาอย่างเร็ว เบรกไม่ทันระยะกระชั้นชิด,https://www.thairath.co.th/news/local/bangkok/2233705,"Tue, 02 Nov 2021 04:07:00 +0700"
6 ล้อผวา ขนยาเข้ากรุง แจ้ง ตร.ค้น เจอยาบ้าเกือบ 8 ล้านเม็ด ซุกลังไม้,6 ล้อผวา รับจ้างขนของจากแพร่เข้ากรุง โดยไม่รู้สินค้าเป็นอะไร-ถูกคนจ้างกำชับอย่ายุ่งกับของ ตัดสินใจจอดรถกลางทาง เปิดลังไม้ดู-พบภายในบรรจุห่อมัดสีเหลืองจำนวนมาก จึงสงสัยเป็น &quot;ยาเสพติด&quot; รีบโทรแ,https://www.thairath.co.th/news/crime/2233702,"Tue, 02 Nov 2021 03:34:00 +0700"
ลุงป่วยโรคสมอง คิดสั้นคว้าปืนเป่าหัวตัวดับ คาบ้านพักที่ปราจีนฯ,ลุง 68 ป่วยทางสมอง ใช้ปืนยาวยิงหัวตัวดับ คาบ้านพักที่ปราจีนบุรี เมียเผยผู้ตายเคยบ่นอยากตาย ต้องคอยปลอบใจระวังตลอด แต่สุดท้ายก็มาคิดสั้นจนได้,https://www.thairath.co.th/news/local/east/2233701,"Tue, 02 Nov 2021 02:50:00 +0700"
นายกฯ หวังโรงเรียนกลับมาเปิด On Site ให้มากที่สุด รัฐบาลโวผู้ปกครองมั่นใจ,โฆษกรัฐบาล เผย ผู้ปกครองมั่นใจส่งบุตรหลานไปโรงเรียนเปิดเทอม แถมนักเรียนมีความสุข “บิ๊กตู่” กำชับสถานศึกษาปฏิบัติตามมาตรการ 6-6-7 คาดหวังให้โรงเรียนกลับมาเปิด On Site ให้มากที่สุด,https://www.thairath.co.th/news/politic/2233990,"Tue, 02 Nov 2021 13:48:00 +0700"
ทำนายฝันเห็นสิงโตตัวใหญ่ สิงโตหลายตัว การงานจะก้าวหน้าจริงหรือไม่?,ความฝันเกี่ยวกับสิงโต ฝันว่าได้ขี่หลังสิงโต ฝันเห็นสิงโตวิ่งไล่กัด มักถูกเชื่อมโยงกับความก้าวหน้าด้านหน้าที่การงาน ส่วนคำทำนายจะร้ายหรือดีนั้น ก็ต้องพิจารณาจากลักษณะของความฝัน,https://www.thairath.co.th/horoscope/belief/2233080,"Tue, 02 Nov 2021 13:45:24 +0700"
ยอดฉีดวัคซีนวันนี้สะสม 76.2 ล้านโดส ยอดเข็ม 2 พุ่ง 43.4% ของประชากรแล้ว,"ศบค. เผย ยอดฉีดวัคซีนรวม 247 วัน 76,226,116 โดส ยอดเข็มที่ 2 อยู่ที่ 31,244,587 ราย คิดเป็น 43.4% ของประชากร วานนี้ฉีดได้ 515,839 โดส ส่วนเข็ม 3 ฉีดกระตุ้นไปแล้วกว่า 2.4 ล้านราย",https://www.thairath.co.th/news/politic/2233989,"Tue, 02 Nov 2021 13:42:00 +0700"
