title,summary,link,published
“ORZON Ventures” ชูจุดแข็งจาก 500 TukTuks เปลี่ยน ‘คนตัวเล็ก’ ให้เป็นสตาร์ทอัพแห่ง SEA,"“ORZON Ventures"" ชูจุดแข็งจาก 500 TukTuks เปลี่ยน ‘คนตัวเล็ก’ ให้เป็นสตาร์ทอัพแห่ง SEA",https://thaipublica.org/2021/10/orzon-ventures-native-ad-19-10-2564/,2021_10_20
เกียรตินาคินภัทรมอบ ‘Gallery of Trees’แก่ห้องสมุดออนไลน์และประชาชน-ปล่อยภาพต้นไม้ดาวน์โหลดฟรี,เกียรตินาคินภัทร เดินหน้าภารกิจสีเขียว มอบหนังสือ ‘Gallery of Trees’ ห้องแสดงความงามแห่งมวลไม้ใหญ่ พร้อมปล่อยภาพต้นไม้ให้ดาวน์โหลดฟรี,https://thaipublica.org/2021/10/kkp-gallery-of-trees-pr/,2021_10_20
Krungthai COMPASS ชี้ IMF มองศก.โลกปีนี้ฟื้นตัวใกล้เคียงกับที่คาด ท่ามกลางความไม่แน่นอนของเงินเฟ้อ,IMF ปรับลดคาดการณ์เศรษฐกิจโลกปี 2021 ขยายตัวที่ 5.9% ต่ำกว่าประมาณการครั้งก่อนเล็กน้อย ท่ามกลางความไม่แน่นอนของเงินเฟ้อ และการฟื้นตัวในอัตราที่ต่างกันของแต่ละกลุ่มประเทศ,https://thaipublica.org/2021/10/krungthai-compass34/,2021_10_20
โลกร้อน : “30 ปีแห่งวาทะที่ไร้สาระของผู้นำโลก”,การเปลี่ยนแปลงสภาพภูมิอากาศไม่ใช่เป็นแต่เพียงภัยคุกคามเท่านั้น แต่เป็นโอกาสที่จะทำให้โลกของเรามีความสมบูรณ์มากขึ้น สะอาดขึ้น และมีความเขียวกว่าเดิม ซึ่งจะเป็นประโยชน์กับพวกเราทุกคน เราต้องมองเห็นโอกาสเหล่านี้,https://thaipublica.org/2021/10/thai-climate-justice-for-all12/,2021_10_20
BKI ขานรับ คปภ. ยินดีร่วมโครงการช่วยเหลือลูกค้าเอเชียประกันภัยที่ได้รับผลกระทบ,กรุงเทพประกันภัยพร้อมยินดีให้ความช่วยเหลือดูแลลูกค้าของเอเชียประกันภัย ที่ได้รับผลกระทบจากกรณีการเพิกถอนใบอนุญาต เพื่อบรรเทาความเดือดร้อนให้แก่ผู้เอาประกันภัย,https://thaipublica.org/2021/10/bki-pr-20-10-2564/,2021_10_20
บสย. ค้ำทะลุ 2 แสนล้านบาท หนุนจ้างงานกว่า 2 ล้านราย ลุยเติมทุน SMEs ฟื้นกิจการ,ธุรกิจฟื้นตัว! บสย. ค้ำทะลุ 2 แสนล้านบาท หนุนจ้างงานกว่า 2 ล้านราย ลุยโค้งสุดท้าย เติมทุน SMEs Restart กิจการ,https://thaipublica.org/2021/10/tcg-pr-20-10-2564/,2021_10_20
พีทีที สเตชั่น-พีทีที ลูบริแคนท์ส-คาเฟ่ อเมซอน คว้ารางวัลแบรนด์ยอดนิยม 10 ปีซ้อน,พีทีที สเตชั่น พีทีที ลูบริแคนท์ส และ คาเฟ่ อเมซอน คว้ารางวัล Marketeer No.1 Brand Thailand 2020 - 2021 แบรนด์ยอดนิยม 10 ปีซ้อน,https://thaipublica.org/2021/10/ptt-atation-or-pr-20-10-2564/,2021_10_20
Squid Game กระแสตอบกลับของทั่วโลก,ซีรีส์ชื่อดังจากเกาหลี “Squid Game” หลายประเทศกลับนำกระแสในเกมมาทำส่งเสริมในด้านการค้า หรือการสร้างวีดีโอเกม ได้กระแสตอบรับจากทั่วโลกในแง่ดีทั้งบทละคร และนักแสดง แต่ไทยมองว่าเป็นซีรีส์ที่ส่งเสริมความรุนแรง อาจทำให้เด็กและเยาวชนเลียนแบบพฤติกรรมได้,https://thaipublica.org/2021/10/squid-game-global-response/,2021_10_20
"“สุพัฒนพงษ์” ควักเงินกองทุนฯเดือนละ 5,000 ล้าน – กู้ 2 หมื่นล้าน ตรึงดีเซล 30 บาท ไม่พอลดภาษี","“สุพัฒนพงษ์” เดินหน้าใช้เงินกองทุนน้ำมันเดือนละ 5,000 ล้านบาท - กู้อีก 20,000 ล้านบาท ตรึงราคาดีเซลลิตรละ 30 บาท หากยังไม่พอลดภาษีสรรพสามิตต่อไป มติ กบง.ยกเลิกดีเซล B6 กลับไปใช้สูตรเดิม “B7-B10-B20” ค่าการตลาดไม่เกินลิตรละ 1.40 บาท เริ่ม 1 พ.ย.นี้",https://thaipublica.org/2021/10/freeze-price-diesel-fuel-30-baht-per-liter/,2021_10_20
"“กรุงไทย” กำไรสุทธิช่วง 9 เดือน 16,645 ล้านบาท","“กรุงไทย” ประกาศผลดำเนินงานช่วง 9 เดือนปี 2564 มีกำไรสุทธิ 16,645 ล้านบาท เพิ่มขึ้นร้อยละ 25.3 จากช่วงเดียวกันของปีก่อน ตั้งสำรอง 24,291 ล้านบาท",https://thaipublica.org/2021/10/ktb-performance-9-months-2021-pr/,2021_10_20
"ทีเอ็มบีธนชาต กำไรสุทธิ 2,359 ล้านบาท ไตรมาส 3 ปี 2564 เพิ่ม 46%","ข่าวประชาสัมพันธ์ ทีเอ็มบีธนชาต มีกำไรสุทธิ 2,359 ล้านบ […]",https://thaipublica.org/2021/10/tmbthanachart-reported-net-profit-in-3q21/,2021_10_20
ข้อมูลจำเพาะล่าสุด ของ “รถไฟลาว-จีน”,เป็นเวลากว่า 1 สัปดาห์ ที่คนลาวต่างตื่นตัวต้อนรับการมาถึงของรถไฟขบวน “ล้านช้าง” รถไฟขนส่งผู้โดยสารขบวนแรกของบริษัททางรถไฟลาว-จีน,https://thaipublica.org/2021/10/pundop51/,2021_10_20
“อาคม” ชี้กองทุนประกันฯมีสภาพคล่อง แม้จ่ายเคลมให้เอเชียประกันภัย,รมว.คลัง ชี้กองทุนประกันวินาศภัยมีสภาพคล่อง แม้จ่ายเคลม […] อ่านข่าวต้นฉบับ: “อาคม” ชี้กองทุนประกันฯมีสภาพคล่อง แม้จ่ายเคลมให้เอเชียประกันภัย,https://www.prachachat.net/finance/news-785384,2021_10_20
กรังด์ปรีซ์จับมือ “ฮอนด้า” บูมซิตี้แฮตช์แบ็กวันเมคเรซ,“จีพีไอ มอเตอร์สปอร์ต” จับมือ “ฮอนด้า” ระเบิดความมันส์ร […] อ่านข่าวต้นฉบับ: กรังด์ปรีซ์จับมือ “ฮอนด้า” บูมซิตี้แฮตช์แบ็กวันเมคเรซ,https://www.prachachat.net/motoring/news-785147,2021_10_20
"ศบค.พบผู้ติดเชื้อโควิดวันนี้(20 ต.ค.) ลดเหลือ 8,918 เสียชีวิตเพิ่ม 79 ราย","ศบค.พบผู้ติดเชื้อโควิดรายใหม่วันนี้ (20 ต.ค.) เพิ่ม 8,9 […] อ่านข่าวต้นฉบับ: ศบค.พบผู้ติดเชื้อโควิดวันนี้(20 ต.ค.) ลดเหลือ 8,918 เสียชีวิตเพิ่ม 79 ราย",https://www.prachachat.net/general/news-785408,2021_10_20
รู้จักอาหารแช่แข็ง กินอย่างถูกวิธี ดีต่อสุขภาพ,แนวโน้มความต้องการของผู้บริโภคเปลี่ยนแปลงไปตามยุคสมัย ส […] อ่านข่าวต้นฉบับ: รู้จักอาหารแช่แข็ง กินอย่างถูกวิธี ดีต่อสุขภาพ,https://www.prachachat.net/hilight-prachachat/news-783000,2021_10_20
ราคาน้ำมันวันนี้ (20 ต.ค.) เช็กราคาดีเซล-แก๊สโซฮอล์ล่าสุด,ราคาน้ำมันวันนี้ (20 ต.ค.) ตามข้อมูลจากบางจาก แก๊สโซฮอล […] อ่านข่าวต้นฉบับ: ราคาน้ำมันวันนี้ (20 ต.ค.) เช็กราคาดีเซล-แก๊สโซฮอล์ล่าสุด,https://www.prachachat.net/economy/news-785416,2021_10_20
"ราคาบิตคอยน์วันนี้ (20 ต.ค.) ขยับขึ้น 3.46% อยู่ที่ 64,027.80 เหรียญสหรัฐ","ผู้สื่อข่าวรายงานว่า ราคาบิตคอยน์วันนี้ (20 ต.ค.) ขยับข […] อ่านข่าวต้นฉบับ: ราคาบิตคอยน์วันนี้ (20 ต.ค.) ขยับขึ้น 3.46% อยู่ที่ 64,027.80 เหรียญสหรัฐ",https://www.prachachat.net/finance/news-785414,2021_10_20
“ไพบูลย์” เสี่ยงถูกสอย พ้น ส.ส. วัดบารมี “บิ๊กป้อม” ปัดเป่าคดีการเมือง,20 ตุลาคม 2564 เป็นวันที่ศาลรัฐธรรมนูญชี้ชะตาการเป็น ส. […] อ่านข่าวต้นฉบับ: “ไพบูลย์” เสี่ยงถูกสอย พ้น ส.ส. วัดบารมี “บิ๊กป้อม” ปัดเป่าคดีการเมือง,https://www.prachachat.net/politics/news-784711,2021_10_20
แทบทุกภาคฝนลด ยกเว้น 8 จังหวัดภาคใต้ กทม.วันนี้มีฝน 10% ของพื้นที่,กรมอุตุนิยมวิทยาเผยแทบทุกภาคฝนลดลงเหลือร้อยละ 10-30% ขอ […] อ่านข่าวต้นฉบับ: แทบทุกภาคฝนลด ยกเว้น 8 จังหวัดภาคใต้ กทม.วันนี้มีฝน 10% ของพื้นที่,https://www.prachachat.net/general/news-785423,2021_10_20
ราคาน้ำมันดิบปรับเพิ่ม หลังความต้องการใช้พลังงานของจีนสูงขึ้น,ราคาน้ำมันดิบปรับเพิ่ม หลังความต้องการใช้พลังงานของจีนส […] อ่านข่าวต้นฉบับ: ราคาน้ำมันดิบปรับเพิ่ม หลังความต้องการใช้พลังงานของจีนสูงขึ้น,https://www.prachachat.net/finance/news-785431,2021_10_20
แก้สัญญาแอร์พอร์ตลิงก์เชื่อมไฮสปีด,ครม.ไฟเขียวแก้สัญญาบริษัทเอเชีย เอราวัณ ขยายเวลาชำระค่า […] อ่านข่าวต้นฉบับ: แก้สัญญาแอร์พอร์ตลิงก์เชื่อมไฮสปีด,https://www.prachachat.net/property/news-785344,2021_10_20
จับตา “สุพัฒนพงษ์” ประชุม กบง.วันนี้ รับลูก “ประยุทธ์” กู้วิกฤตราคาน้ำมัน,จับตา “สุพัฒนพงษ์ “ ประชุม กบง.วันนี้ รับลูก “ประยุทธ์” […] อ่านข่าวต้นฉบับ: จับตา “สุพัฒนพงษ์” ประชุม กบง.วันนี้ รับลูก “ประยุทธ์” กู้วิกฤตราคาน้ำมัน,https://www.prachachat.net/economy/news-785446,2021_10_20
กทม.ชงศบค. แผนเปิด Bangkok Sandbox คนกรุงฉีดวัคซีนเข็ม 2 จ่อ 80%,กทม.เตรียมชงศบค. เคาะแผนเปิดกรุงเทพมหานครตามแผน Bangkok […] อ่านข่าวต้นฉบับ: กทม.ชงศบค. แผนเปิด Bangkok Sandbox คนกรุงฉีดวัคซีนเข็ม 2 จ่อ 80%,https://www.prachachat.net/general/news-785438,2021_10_20
"ราคาทองวันนี้ (20 ต.ค.) คงที่ รูปพรรณบาทละ 28,550 บาท","ผู้สื่อข่าวรายงานว่า ราคาทองคำวันนี้ (20 ต.ค.) คงที่ เม […] อ่านข่าวต้นฉบับ: ราคาทองวันนี้ (20 ต.ค.) คงที่ รูปพรรณบาทละ 28,550 บาท",https://www.prachachat.net/finance/news-785439,2021_10_20
บทวิเคราะห์ราคาทองคำวันนี้ (20 ต.ค.) โดย YLG Bullion,บริษัท วายแอลจี บูลเลี่ยน อินเตอร์เนชั่นแนล จำกัด รายงา […] อ่านข่าวต้นฉบับ: บทวิเคราะห์ราคาทองคำวันนี้ (20 ต.ค.) โดย YLG Bullion,https://www.prachachat.net/finance/news-785444,2021_10_20
ค่าเงินบาทวันนี้ (20 ต.ค.) อ่อนค่าที่ 33.38 บาท บทวิเคราะห์ล่าสุด,ค่าเงินบาทวันนี้ (20 ต.ค.) อ่อนค่าที่ 33.38 บาท โดยกรอบ […] อ่านข่าวต้นฉบับ: ค่าเงินบาทวันนี้ (20 ต.ค.) อ่อนค่าที่ 33.38 บาท บทวิเคราะห์ล่าสุด,https://www.prachachat.net/finance/news-785463,2021_10_20
การบินไทย อัดโปรฯ Hello World Fares ตั๋วโดยสารราคาพิเศษสู่ 28 จุดบินทั่วโลก,“การบินไทย” จัดหนักรับการกลับมาบินอีกครั้ง อัดโปรโมชั่น […] อ่านข่าวต้นฉบับ: การบินไทย อัดโปรฯ Hello World Fares ตั๋วโดยสารราคาพิเศษสู่ 28 จุดบินทั่วโลก,https://www.prachachat.net/tourism/news-785456,2021_10_20
ประยุทธ์ ไปสิงห์บุรี นั่งเรือท้องแบนตรวจสถานการณ์น้ำ วันนี้ (20 ต.ค.),ประยุทธ์ ลงพื้นที่ติดตามสถานการณ์น้ำ รวมถึงแนวทางช่วยเห […] อ่านข่าวต้นฉบับ: ประยุทธ์ ไปสิงห์บุรี นั่งเรือท้องแบนตรวจสถานการณ์น้ำ วันนี้ (20 ต.ค.),https://www.prachachat.net/politics/news-785469,2021_10_20
"หุ้นไทยวันนี้ (20 ต.ค.) เปิดตลาด +2.92 จุด ดัชนีอยู่ที่ 1,633 จุด","ตลาดหุ้นไทยเช้านี้ (20 ต.ค.) ดัชนี SET Index เปิดตลาด อ […] อ่านข่าวต้นฉบับ: หุ้นไทยวันนี้ (20 ต.ค.) เปิดตลาด +2.92 จุด ดัชนีอยู่ที่ 1,633 จุด",https://www.prachachat.net/finance/news-785476,2021_10_20
หุ้นไทยรีบาวนด์เชิงเทคนิค แรงหนุนมาตรการกระตุ้นใช้จ่าย-ลงทุนต่างชาติ,"ตลาดหุ้นไทยคาดเริ่มแกว่งตัวออกข้างในกรอบระหว่าง 1,620-1 […] อ่านข่าวต้นฉบับ: หุ้นไทยรีบาวนด์เชิงเทคนิค แรงหนุนมาตรการกระตุ้นใช้จ่าย-ลงทุนต่างชาติ",https://www.prachachat.net/finance/news-785471,2021_10_20
คิมซอนโฮ ออกแถลงการณ์ “ขอโทษที่ทำให้ทุกคนผิดหวัง” กรณีอดีตแฟนเก่า,คิมซอนโฮ ออกแถลงการณ์ “ขอโทษที่ทำให้ทุกคนผิดหวัง& […] อ่านข่าวต้นฉบับ: คิมซอนโฮ ออกแถลงการณ์ “ขอโทษที่ทำให้ทุกคนผิดหวัง” กรณีอดีตแฟนเก่า,https://www.prachachat.net/spinoff/entertainment/news-785447,2021_10_20
ปภ. ประกาศเตือนภัยพื้นที่เฝ้าระวัง น้ำล้นตลิ่ง-ท่วมขัง (20 ต.ค.),กรมป้องกันและบรรเทาสาธารณภัย รายงานพื้นที่เฝ้าระวังน้ำล […] อ่านข่าวต้นฉบับ: ปภ. ประกาศเตือนภัยพื้นที่เฝ้าระวัง น้ำล้นตลิ่ง-ท่วมขัง (20 ต.ค.),https://www.prachachat.net/general/news-785488,2021_10_20
รพ.บางใหญ่ เปิดวอล์กอินฉีดวัคซีนโควิด วันละ 500 คน,โรงพยาบาลบางใหญ่ เปิดวอล์กอินฉีดวัคซีนสูตรไขว้ซิโนแวค-แ […] อ่านข่าวต้นฉบับ: รพ.บางใหญ่ เปิดวอล์กอินฉีดวัคซีนโควิด วันละ 500 คน,https://www.prachachat.net/marketing/news-785492,2021_10_20
กรุงเทพมหานคร รับสมัครงานในหลายหน่วยงาน เช็กตำแหน่ง-เงินเดือน,หน่วยงานของกรุงเทพมหานครเปิดรับสมัครงานหลายอัตรา เช็กตำ […] อ่านข่าวต้นฉบับ: กรุงเทพมหานคร รับสมัครงานในหลายหน่วยงาน เช็กตำแหน่ง-เงินเดือน,https://www.prachachat.net/general/news-785480,2021_10_20
ศธ.ยันไม่เลื่อนเปิดเทอม 1 พ.ย. ให้ทยอยเปิด-ยกเลิกสุ่มตรวจ ATK,ศธ.ยันไม่เลื่อนเปิดเทอม on site 1 พ.ย. ให้ทยอยเปิดแต่ละ […] อ่านข่าวต้นฉบับ: ศธ.ยันไม่เลื่อนเปิดเทอม 1 พ.ย. ให้ทยอยเปิด-ยกเลิกสุ่มตรวจ ATK,https://www.prachachat.net/education/news-785504,2021_10_20
ออมสินเปิดลงทะเบียนรับ “กระปุก” ฝากขั้นต่ำ 500 บาท ถึง 28 ต.ค.,ธนาคารออมสิน รับฝากเงิน 500 บาทขึ้นไป รับกระปุกออมสิน 1 […] อ่านข่าวต้นฉบับ: ออมสินเปิดลงทะเบียนรับ “กระปุก” ฝากขั้นต่ำ 500 บาท ถึง 28 ต.ค.,https://www.prachachat.net/finance/news-785451,2021_10_20
ไทยพาณิชย์-ฮั่วเซ่งเฮง ส่งแอปฯ GOLD NOW ซื้อขายทองคำเรียลไทม์,ไทยพาณิชย์ จับมือ “ฮั่วเซ่งเฮง” ส่งแอปพลิเค […] อ่านข่าวต้นฉบับ: ไทยพาณิชย์-ฮั่วเซ่งเฮง ส่งแอปฯ GOLD NOW ซื้อขายทองคำเรียลไทม์,https://www.prachachat.net/finance/news-785509,2021_10_20
ม.ร.ว. ดิศนัดดา ดิศกุล ผู้ปิดทองหลังพระ ภารกิจนำศาสตร์พระราชาสู่ SDGs,ต้องยอมรับว่ามูลนิธิปิดทองหลังพระ สืบสานแนวพระราชดำริคื […] อ่านข่าวต้นฉบับ: ม.ร.ว. ดิศนัดดา ดิศกุล ผู้ปิดทองหลังพระ ภารกิจนำศาสตร์พระราชาสู่ SDGs,https://www.prachachat.net/csr-hr/news-785304,2021_10_20
ไทยแห่ใช้สิทธิ FTA-GSP 8 เดือนโต 36.46% หลังจีน อาเซียน สหรัฐ เศรษฐกิจฟื้น,พาณิชย์เผยภาพรวมการใช้สิทธิประโยชน์ทางการค้าภายใต้ FTA […] อ่านข่าวต้นฉบับ: ไทยแห่ใช้สิทธิ FTA-GSP 8 เดือนโต 36.46% หลังจีน อาเซียน สหรัฐ เศรษฐกิจฟื้น,https://www.prachachat.net/economy/news-785518,2021_10_20
กต.ยันยกเลิกใบ COE เข้าประเทศ 1 พ.ย.นี้ วงในชี้ Thailand Pass ไม่ตอบโจทย์,อุตฯท่องเที่ยวเตรียมเฮ ! ก.ต่างประเทศยันยกเลิกระบบขอ CO […] อ่านข่าวต้นฉบับ: กต.ยันยกเลิกใบ COE เข้าประเทศ 1 พ.ย.นี้ วงในชี้ Thailand Pass ไม่ตอบโจทย์,https://www.prachachat.net/tourism/news-785139,2021_10_20
น้ำท่วมโคราช เร่งย้ายผู้ป่วย รพ.มหาราชนครราชสีมา เขื่อนลำตะคองยังไม่ระบายน้ำ,น้ำท่วมตัวเมืองโคราช เร่งย้ายผู้ป่วย รพ.มหาราชนครราชสีม […] อ่านข่าวต้นฉบับ: น้ำท่วมโคราช เร่งย้ายผู้ป่วย รพ.มหาราชนครราชสีมา เขื่อนลำตะคองยังไม่ระบายน้ำ,https://www.prachachat.net/local-economy/news-785526,2021_10_20
