title,summary,link,published
โฆษกรัฐบาล ห่วงฝ่ายค้านคาดการณ์คำตัดสินกรณีเหมืองอัคราสร้างความสับสน,นายธนกร วังบุญคงชนะ โฆษกประจำสำนักนายกรัฐมนตรี กล่าวถึงการที่พรรคเพื่อไทยแถลงกรณีเหมืองอัครา โดยคาดการณ์คำตัดสินของอนุญาโตตุลาการ ระหว่างบริษัท คิงส์เกต คอนโซลิเดท จำกัด ประเทศออสเตรเลีย ผู้ถือหุ้นใหญ่บริษัท อัครา รีซอร์สเซส จำกัด และรัฐบาลไทยว่า ปัจจุบันยังไม่มีคำพิพากษาชี้ขาดออกมา ทั้งสองฝ่ายยังอยู่ระหว่างการเจรจาเพื่อหาข้อยุติร่วมกัน ซึ่งเป็นกระบวนการปกติที่ดำเนินการคู่ขนานไปกับกระบวนการอนุญาโตตุลาการ ทั้งนี้ ประเทศไทยต่อสู้คดีในชั้นอนุญาโตตุลาการด้วยความรอบคอบรัดกุม ยึดถือประโยชน์สูงสุดของประเทศเป็นหลัก ในส่วนที่ทั้งสองฝ่ายเข้าสู่กระบวนการเจรจาเพื่อระงับข้อพิพาท ไม่ได้หมายความว่า รัฐบาลเชื่อว่าจะแพ้คดีในชั้นอนุญาโตตุลาการ แต่เป็นกระบวนการที่ดำเนินการเพื่อประโยชน์สูงสุดของคู่พิพาททั้งสองฝ่าย ขอให้ฝ่ายค้านรอการตัดสินชี้ขาดของคณะอนุญาโตตุลาการ ไม่ควรรีบออกมาคาดเดาเหตุการณ์ในอนาคต สร้างความสับสนให้กับประชาชนและสังคม นายธรกร กล่าวอีกว่า ตามคำสั่งหัวหน้าคณะรักษาความสงบแห่งชาติ ที่ 72/2559 ลงวันที่ 13 ธ.ค.59 เรื่อง การแก้ไขปัญหาผลกระทบจากการประกอบกิจการเหมืองแร่ทองคำ ให้ผู้ประกอบการที่ได้รับประทานบัตรและใบอนุญาตที่เกี่ยวข้องกับการประกอบกิจการเหมืองแร่ทองคำ ระงับการประกอบกิจการไว้ตั้งแต่วันที่ 1 ม.ค.60 เป็นต้นไป เพื่อฟื้นฟูพื้นที่ตามมาตรการป้องกันและแก้ไขผลกระทบสิ่งแวดล้อม ที่ไม่ว่าพื้นที่ประทานบัตรจะอยู่ในความรับผิดชอบของหน่วยงานใดก็ตาม เป็นการคุ้มครองและป้องกันไว้ก่อนเพื่อไม่ไห้ประชาชนในพื้นที่ได้รับผลกระทบเฉพาะหน้าด้านสุขอนามัยและสิ่งแวดล้อมปนเปื้อนอย่างทันท่วงที และคำสั่งดังกล่าวเป็นไปด้วยความรอบคอบระมัดระวัง พอสมควรแก่เหตุ โดยให้ยุติการประกอบกิจการเหมืองแร่ทองคำปิดเหมืองทองทั่วประเทศชั่วคราว โดยไม่เลือกปฏิบัติ “รัฐบาลยืนยันต่อสู้ตามกติกาสากล และคดีดังกล่าวก็อยู่ระหว่างการดำเนินการในอนุญาโตตุลาการ ซึ่งนายกรัฐมนตรีก็เคยชี้แจงในการประชุมรัฐสภาเกี่ยวกับประเด็นเหมืองทองอัครา ปฏิเสธไม่ได้ใช้ ม.44 […] The post โฆษกรัฐบาล ห่วงฝ่ายค้านคาดการณ์คำตัดสินกรณีเหมืองอัคราสร้างความสับสน appeared first on สำนักข่าวอินโฟเควสท์.,https://www.infoquest.co.th/2021/137644,2021_10_20
บิ๊กป้อม ลงพื้นที่เมืองกาญจน์เร่งขับเคลื่อนโครงการผันน้ำเขื่อนศรีนครินทร์,พล.อ.ประวิตร วงษ์สุวรรณ รองนายกรัฐมนตรี ในฐานะผู้อำนวยการกองอำนวยการน้ำแห่งชาติ (กอนช.) เปิดเผยหลังลงพื้นที่ติดตามการบริหารจัดการน้ำเขื่อนแม่กลอง และเขื่อนศรีนครินทร์ จังหวัดกาญจนบุรี ว่า ได้สั่งการให้หน่วยงานเกี่ยวข้องบูรณาการความร่วมมือเฝ้าระวังพื้นที่เสี่ยงน้ำหลาก หรือน้ำป่าไหลหลาก และดำเนินการตามแผนเผชิญเหตุอย่างเคร่งครัด รวมถึงแผนการช่วยเหลือเยียวยาหรือฟื้นฟูให้กลับมาสู่สภาพเดิมโดยเร็วที่สุด โดยให้ครอบคลุมทุกด้านและทั่วถึงทุกกลุ่มประชาชนที่ได้รับผลกระทบ รวมทั้งให้อนุกรรมการทรัพยากรน้ำจังหวัด โดยจังหวัดกาญจนบุรี และสำนักงานทรัพยากรน้ำแห่งชาติ (สทนช.) เร่งรัดการจัดทำแผนหลักแบบบูรณาการเพื่อการบรรเทาอุทกภัยและภัยแล้ง โดยเสนอผ่านคณะกรรมการลุ่มน้ำ และให้ สทนช. รวบรวมเสนอกองอำนวยการน้ำแห่งชาติ (กนช.) ให้เห็นชอบโดยเร็ว รวมทั้งให้กำหนดหน่วยงานปฏิบัติที่ได้รับมอบหมายเสนอเข้าแผนงาน และเน้นย้ำการวางแผนกักเก็บน้ำสำรองทุกแหล่ง ทั้งผิวดินและใต้ดิน ไว้รองรับในช่วงฤดูแล้งหน้าด้วย ทั้งนี้ สทนช. ร่วมกับกรมชลประทาน และการไฟฟ้าฝ่ายผลิตแห่งประเทศไทย (กฟผ.) พิจารณากำหนดแผนการจัดสรรน้ำของอ่างเก็บน้ำเขื่อนศรีนครินทร์ เขื่อนวชิราลงกรณ และเขื่อนแม่กลอง ซึ่งต้องคำนึงถึงการใช้น้ำทุกภาคส่วน โดยเฉพาะการสนับสนุนน้ำเพื่อการอุปโภคบริโภคให้กับพื้นที่ลุ่มน้ำเจ้าพระยา โดยการประปานครหลวง ในช่วงฤดูแล้งที่จะถึงนี้ให้ทั่วถึงอย่างเท่าเทียม และมีประสิทธิภาพสูงสุด ซึ่งต้องบริหารจัดการทรัพยากรน้ำให้สอดคล้องกับกฎหมายน้ำด้วย “แม้ลุ่มน้ำแม่กลองจะเป็นลุ่มน้ำที่มีศักยภาพเก็บกักน้ำได้มาก และสามารถส่งน้ำไปช่วยเหลือลุ่มน้ำข้างเคียงได้ก็ตาม แต่จังหวัดกาญจนบุรี ยังมีพื้นที่ภัยแล้งที่เสี่ยงต่อการขาดแคลนน้ำที่เรียกว่า “อีสานของจังหวัดกาญจนบุรี” ครอบคลุม 5 อำเภอในจังหวัดกาญจนบุรี ได้แก่ อ.บ่อพลอย อ.หนองปรือ อ.ห้วยกระเจา […] The post บิ๊กป้อม ลงพื้นที่เมืองกาญจน์เร่งขับเคลื่อนโครงการผันน้ำเขื่อนศรีนครินทร์ appeared first on สำนักข่าวอินโฟเควสท์.,https://www.infoquest.co.th/2021/137638,2021_10_20
TTB เผยกำไรสุทธิ Q3/64 โตพุ่ง 46% หลังตั้งสำรองลดลงแม้ยังสูงกว่าภาวะปกติ,"นายปิติ ตัณฑเกษม ประธานเจ้าหน้าที่บริหาร บมจ.ธนาคารทหารไทยธนชาต (TTB) เปิดเผยว่า ผลประกอบการไตรมาส 3/64 ธนาคารมีกำไรสุทธิ 2,359 ล้านบาท เพิ่มขึ้น 46% จากช่วงเดียวกันของปีก่อน เป็นผลจากนโยบายการเตรียมความพร้อมล่วงหน้าที่ได้ทำในปีที่แล้ว ซึ่งธนาคารได้ตั้งสำรองฯ เพิ่มขึ้นอย่างมีนัยสำคัญไปในไตรมาส 3/63 เพื่อเตรียมรับมือกับปี 64 แม้ว่าในปีนี้จะยังคงตั้งสำรองฯ สูงกว่าปกติ แต่ก็ลดลงเมื่อเทียบกับปีที่แล้ว จึงทำให้กำไรสุทธิปรับตัวดีขึ้น แต่เมื่อเทียบกับไตรมาสก่อนหน้ากำไรสุทธิ ลดลง 6.9% จากการตั้งสำรองฯ ดังกล่าว ขณะที่ธนาคารมีรายได้จากการดำเนินงานอยู่ที่ 15,663 ล้านบาท ลดลง 3.4% จากช่วงเดียวกันของปีก่อน และลดลง 1.5% จากไตรมาสก่อนหน้า ทั้งจากรายได้ดอกเบี้ยและรายได้ที่มิใช่ดอกเบี้ย อย่างไรก็ดี รายได้ค่าธรรมเนียมปรับตัวดีขึ้นเล็กน้อย ส่วนหนึ่งเป็นผลจากการปรับกลยุทธ์การนำเสนอผลิตภัณฑ์และบริการ รวมถึงช่องทางการให้บริการในช่วงที่ผ่านมา ด้านค่าใช้จ่ายยังสามารถบริหารจัดการได้ตามเป้าหมาย โดยค่าใช้จ่ายจากการดำเนินงานมีจำนวน 7,268 ล้านบาท ลดลง 1.8% เป็นผลจากการรับรู้ประโยชน์ด้านต้นทุนจากการรวมกิจการ การมีวินัยด้านค่าใช้จ่าย รวมถึงค่าใช้จ่ายการดำเนินงานที่ลดลงตามปริมาณธุรกรรมที่ลดลงในช่วงล็อกดาวน์ ส่งผลให้อัตราส่วนต้นทุนต่อรายได้ทรงตัวอยู่ที่ 46% และจากสถานการณ์โควิด-19 […] The post TTB เผยกำไรสุทธิ Q3/64 โตพุ่ง 46% หลังตั้งสำรองลดลงแม้ยังสูงกว่าภาวะปกติ appeared first on สำนักข่าวอินโฟเควสท์.",https://www.infoquest.co.th/2021/137658,2021_10_20
กลุ่ม G20 เตรียมถกภาวะโลกร้อน-เยียวยาโควิด ในการประชุมที่กรุงโรมปลายต.ค.นี้,นายมาริโอ ดรากี นายกรัฐมนตรีอิตาลีเปิดเผยว่า การประชุมสุดยอดกลุ่ม G20 ที่กรุงโรมซึ่งจะจัดขึ้นปลายเดือนต.ค.นี้ จะมุ่งเน้นไปที่การรับมือปัญหาการเปลี่ยนแปลงด้านสภาพภูมิอากาศ การแพร่ระบาดของโควิด-19 รวมถึงมาตรการที่จำเป็นในการฟื้นฟูเยียวยาโลกหลังการระบาด “หากปราศจากการมีส่วนร่วมของประเทศเศรษฐกิจขนาดใหญ่ เราจะไม่สามารถดำเนินการได้ตามข้อตกลงปารีสและไม่อาจสกัดปัญหาภาวะโลกร้อนได้” นายดรากีกล่าวในที่ประชุมวุฒิสภาก่อนที่การประชุมของคณะมนตรียุโรปจะเปิดฉากขึ้นในสัปดาห์นี้ ทั้งนี้ การประชุมสุดยอดกลุ่ม G20 ที่กรุงโรมนั้นถูกจับตามองเป็นพิเศษ โดยเฉพาะประเทศสมาชิก G20 ที่มีบทบาทสำคัญเป็นอย่างยิ่งในเวทีโลก ก่อนที่การประชุมสหประชาชาติ (UN) ว่าด้วยการเปลี่ยนแปลงสภาพภูมิอากาศครั้งที่ 26 (COP26) จะเปิดฉากขึ้นที่เมืองกลาสโกว์ ประเทศสกอตแลนด์ ในวันที่ 31 ต.ค. – 12 พ.ย. โดย สำนักข่าวอินโฟเควสท์ (20 ต.ค. 64) The post กลุ่ม G20 เตรียมถกภาวะโลกร้อน-เยียวยาโควิด ในการประชุมที่กรุงโรมปลายต.ค.นี้ appeared first on สำนักข่าวอินโฟเควสท์.,https://www.infoquest.co.th/2021/137661,2021_10_20
ผู้เชี่ยวชาญอังกฤษคาดสายพันธุ์ “เดลตาพลัส” ไม่กระทบสถานการณ์โควิด-19,ดร.แอนดรูว์ โพลลาร์ด หัวหน้ากลุ่ม Oxford Vaccine Group เปิดเผยกับสถานีบีบีซี เรดิโอ ในวันนี้ว่า เดลตาพลัส (Delta Plus) ซึ่งเป็นสายพันธุ์ย่อยของเชื้อไวรัสโควิด-19 สายพันธุ์เดลตา ไม่น่าจะทำให้สถานการณ์โควิดเปลี่ยนไป หน่วยงานความมั่นคงด้านสุขภาพของสหราชอาณาจักร เปิดเผยข้อมูลเมื่อสัปดาห์ที่แล้วว่า มีผู้ติดเชื้อเดลตาพลัสหรือที่เรียกว่าสายพันธุ์ AY.4.2 ในอังกฤษเพิ่มขึ้น โดยคิดเป็น 6% ของยอดผู้ติดเชื้อทั้งหมด แต่ยังไม่เข้าเกณฑ์ที่ต้องได้รับสอบสวนหรือเป็นสายพันธุ์ที่น่ากังวล “เมื่อมีการค้นพบสายพันธุ์ใหม่ แน่นอนว่าเราควรเฝ้าระวัง แต่ก็ไม่มีอะไรบ่งชี้ว่าสายพันธุ์ใหม่นั้นจะมาแทนที่เดลตา” ดร.โพลลาร์ดเผย “ต่อให้สายพันธุ์ใหม่นี้เข้ามาแทนที่จริง ๆ เดลตาก็แพร่กระจายในกลุ่มประชาชนที่ฉีดวัคซีนแล้วได้ดีมาก และสายพันธุ์ใหม่อาจจะแพร่กระจายได้ง่ายกว่าเล็กน้อย แต่ก็ไม่น่าจะทำให้สถานการณ์ในปัจจุบันเปลี่ยนไปอย่างเห็นได้ชัด” ดร.โพลลาร์ดระบุ ความเห็นดังกล่าวเปิดเผยออกมา ขณะที่ระบบบริการสุขภาพแห่งชาติอังกฤษ (NHS) ใกล้ถึงขีดจำกัดในหลายพื้นที่ ท่ามกลางแรงกดดันที่เพิ่มขึ้นจากฤดูหนาวที่กำลังจะมาถึง โดย สำนักข่าวอินโฟเควสท์ (20 ต.ค. 64) The post ผู้เชี่ยวชาญอังกฤษคาดสายพันธุ์ “เดลตาพลัส” ไม่กระทบสถานการณ์โควิด-19 appeared first on สำนักข่าวอินโฟเควสท์.,https://www.infoquest.co.th/2021/137664,2021_10_20
หุ้นไทยปิดบวก 7.16 จุด รีบาวด์ตามแรงซื้อกลับหุ้น Big Cap-ตลาด ตปท.ดีดขึ้น,"SET ปิดวันนี้ที่ระดับ 1,637.55 จุด เพิ่มขึ้น 7.16 จุด (+0.44%) มูลค่าการซื้อขาย 67,918.45 ล้านบาท นักวิเคราะห์ เผยตลาดหุ้นไทยวันนี้รีบาวด์ขึ้นมาได้หลังปรับตัวลงแรงเมื่อวาน โดยมีแรงซื้อกลับหุ้น Big Cap และเป็นการปรับขึ้นตามทิศทางตลาดต่างประเทศ แม้ยังไม่มีปัจจัยใหม่ แนวโน้มพรุ่งนี้คาดแกว่งออกด้านข้างก่อนเข้าวันหยุดยาว แนะติดตามงบไตรมาส 3/64 ให้แนวรับ 1,630 จุด แนวต้าน 1,650 จุด ตลาดหลักทรัพย์ ปิดวันนี้ที่ระดับ 1,637.55 จุด เพิ่มขึ้น 7.16 จุด (+0.44%) มูลค่าการซื้อขาย 67,918.45 ล้านบาท การซื้อขายหุ้นวันนี้ ดัชนีหุ้นไทยแกว่งในแดนบวกตลอดวันกรอบแคบ โดยดัชนีทำระดับสูงสุด 1,639.41 จุด และระดับต่ำสุด 1,632.62 จุด ส่วนหลักทรัพย์เปลี่ยนแปลงวันนี้ เพิ่มขึ้น 857 หลักทรัพย์ ลดลง 728 หลักทรัพย์ และไม่เปลี่ยนแปลง 677 […] The post หุ้นไทยปิดบวก 7.16 จุด รีบาวด์ตามแรงซื้อกลับหุ้น Big Cap-ตลาด ตปท.ดีดขึ้น appeared first on สำนักข่าวอินโฟเควสท์.",https://www.infoquest.co.th/2021/137667,2021_10_20
