title,summary,link,published
‘ผู้นำคิม’ ปฏิเสธคำขอเจรจาของสหรัฐฯ แต่ยินดีกระชับสัมพันธ์เกาหลีใต้,ผู้นำเกาหลีเหนือ คิม จอง อึน ปฏิเสธข้อเสนอของสหรัฐฯ ที่ต้องการกลับสู่การเจรจากับเกาหลีเหนือเพื่อหาทางยุติโครงการนิวเคลียร์ แต่ยืนยันว่ายินดียกระดับความสัมพันธ์กับเกาหลีใต้ สื่อของทางการเกาหลีเหนือ Korean Central News Agency (KCNA) รายงานคำแถลงของผู้นำคิมในวันพฤหัสบดี ซึ่งระบุว่า ความตั้งใจของสหรัฐฯ ที่ต้องการเจรจากับเกาหลีเหนือนั้นเป็นแค่ “การแสดง” เพื่อปกปิดนโยบายที่เป็นปรปักษ์ของรัฐบาลกรุงวอชิงตัน “ไม่มีการเปลี่ยนแปลงใด ๆ ต่อนโยบายที่เป็นศัตรูของสหรัฐฯ ต่อเกาหลีเหนือ มีแต่ความหลอกลวงและวิธีการที่เจ้าเล่ห์เพิ่มขึ้นเท่านั้น” ผู้นำคิมกล่าวกับสื่อ KCNA ที่ผ่านมา รัฐบาลประธานาธิบดีโจ ไบเดน พยายามขอให้เกาหลีเหนือกลับสู่การเจรจาว่าด้วยโครงการนิวเคลียร์ของกรุงเปียงยาง ซึ่งชะงักงันมาตั้งแต่ปี ค.ศ. 2019 ทางด้านกระทรวงการต่างประเทศสหรัฐฯ เน้นย้ำในอีเมล์ที่ส่งถึงวีโอเอว่า สหรัฐฯ ไม่มีนโยบายที่เป็นปรปักษ์ต่อเกาหลีเหนือ และขอให้เกาหลีเหนือเปิดรับการดำเนินการทางการทูตเพื่อสร้างความมั่นคงปลอดภัยต่อสหรัฐฯ และพันธมิตร โดยสหรัฐฯ ยินดีพบเจรจากับผู้แทนของเกาหลีเหนือโดยไม่มีเงื่อนไขใด ๆ ทั้งนี้ คำกล่าวของผู้นำคิม จอง อึน มีขึ้นในวันเดียวกับที่เกาหลีเหนือเปิดเผยรายละเอียดขีปนาวุธที่ทำการทดสอบครั้งล่าสุดเมื่อวันอังคาร รวมถึงขีปนาวุธความเร็วเหนือเสียงรุ่นใหม่ล่าสุดที่ถูกออกแบบมาเพื่อหลบเลี่ยงระบบป้องกันขีปนาวุธของสหรัฐฯ เฉพาะในเดือนกันยายน เกาหลีเหนือทดสอบขีปนาวุธไปแล้วถึงสามครั้ง ผู้นำคิมยังเน้นย้ำด้วยว่า ตนยินดีกลับมาพิจารณาเปิดโทรศัพท์สายด่วนข้ามพรมแดนกับเกาหลีใต้อีกครั้งในเดือนตุลาคมนี้ หลังจากสายด่วนดังกล่าวเคยถูกเปิดใช้เมื่อเดือนกรกฎาคมและยกเลิกไปในอีกสองสัปดาห์ต่อมาเพื่อตอบโต้การซ้อมรบระหว่างสหรัฐฯ กับเกาหลีใต้ เมื่อต้นสัปดาห์นี้ คิม โย จอง น้องสาวของผู้นำคิม จอง อึน กล่าวว่า เกาหลีเหนือยินดีจัดการประชุมสุดยอดกับเกาหลีใต้อีกครั้ง รวมทั้งพิจารณาประกาศยุติสงครามเกาหลีอย่างเป็นทางการด้วย,https://www.voathai.com/a/%e0%b8%9c%e0%b8%b9%e0%b9%89%e0%b8%99%e0%b8%b3%e0%b8%84%e0%b8%b4%e0%b8%a1-%e0%b8%9b%e0%b8%8f%e0%b8%b4%e0%b9%80%e0%b8%aa%e0%b8%98%e0%b8%84%e0%b8%b3%e0%b8%82%e0%b8%ad%e0%b9%80%e0%b8%88%e0%b8%a3%e0%b8%88%e0%b8%b2-%e0%b8%82%e0%b8%ad%e0%b8%87%e0%b8%aa%e0%b8%ab%e0%b8%a3%e0%b8%b1%e0%b8%90%e0%b8%af-%e0%b9%81%e0%b8%95%e0%b9%88%e0%b8%a2%e0%b8%b4%e0%b8%99%e0%b8%94%e0%b8%b5-%e0%b8%81%e0%b8%a3%e0%b8%b0%e0%b8%8a%e0%b8%b1%e0%b8%9a%e0%b8%aa%e0%b8%b1%e0%b8%a1%e0%b8%9e%e0%b8%b1%e0%b8%99%e0%b8%98%e0%b9%8c-%e0%b9%80%e0%b8%81%e0%b8%b2%e0%b8%ab%e0%b8%a5%e0%b8%b5%e0%b9%83%e0%b8%95%e0%b9%89/6252299.html,2021_10_01
งานวิจัยชี้ ผู้ป่วยโควิด 37% มีโอกาสเกิดอาการระยะยาวอย่างน้อยหนึ่งอย่าง,"ผลการวิจัยของมหาวิทยาลัยอ็อกซ์ฟอร์ด (Oxford University) และสถาบันสาธารณสุขแห่งชาติของสหรัฐฯ (NIH) ซึ่งเผยแพร่ในวันพุธ ชี้ว่า ผู้ป่วยโควิด 37% มีโอกาสเกิดอาการระยะยาวอย่างน้อยหนึ่งอย่าง ในช่วง 3-6 เดือนหลังจากที่ติดเชื้อ รายงานของสำนักข่าวรอยเตอร์ ระบุว่า อาการโควิดระยะยาวที่มีโอกาสเกิดมากที่สุด คือ ปัญหาที่ระบบการหายใจ อ่อนเพลีย เจ็บปวด และวิตกกังวล งานวิจัยครั้งนี้ใช้กลุ่มตัวอย่างมากกว่า 270,000 คนซึ่งเป็นผู้ป่วยโควิดที่หายแล้ว รายงานชี้ด้วยว่า อาการในระยะยาวมักเกิดกับผู้ป่วยโควิดที่ต้องรักษาตัวในโรงพยาบาล และมักเกิดกับผู้หญิงมากกว่าผู้ชายเล็กน้อย โดยที่ผู้สูงอายุและผู้ชายมักมีอาการเกี่ยวกับระบบหายใจและปัญหาด้านความจำ ขณะที่ผู้หญิงมักมีอาการปวดศีรษะ อาการเกี่ยวกับช่องท้อง และความวิตกกังวลหรือซึมเศร้ามากกว่า อย่างไรก็ตาม รายงานมิได้ระบุถึงสาเหตุของอาการในระยะยาวนั้น รวมถึงความรุนแรงและระยะเวลาที่อาการเหล่านั้นคงอยู่ด้วย ศาสตราจารย์พอล แฮร์ริสัน แห่งมหาวิทยาลัยอ็อกซ์ฟอร์ด หัวหน้าคณะนักวิจัยชุดนี้ กล่าวว่า จำเป็นต้องมีการศึกษาเพิ่มเติมเกี่ยวกับกลไกที่ทำให้เกิดอาการโควิดที่หลากหลายในระยะยาว เพื่อหาวิธีป้องกันหรือรักษาโควิดอย่างถูกต้องต่อไป",https://www.voathai.com/a/%e0%b8%87%e0%b8%b2%e0%b8%99%e0%b8%a7%e0%b8%b4%e0%b8%88%e0%b8%b1%e0%b8%a2%e0%b8%8a%e0%b8%b5%e0%b9%89-%e0%b8%9c%e0%b8%b9%e0%b9%89%e0%b8%9b%e0%b9%88%e0%b8%a7%e0%b8%a2%e0%b9%82%e0%b8%84%e0%b8%a7%e0%b8%b4%e0%b8%94-%e0%b8%a1%e0%b8%b5%e0%b9%82%e0%b8%ad%e0%b8%81%e0%b8%b2%e0%b8%aa%e0%b9%80%e0%b8%81%e0%b8%b4%e0%b8%94%e0%b8%ad%e0%b8%b2%e0%b8%81%e0%b8%b2%e0%b8%a3%e0%b8%a3%e0%b8%b0%e0%b8%a2%e0%b8%b0%e0%b8%a2%e0%b8%b2%e0%b8%a7-%e0%b8%ad%e0%b8%a2%e0%b9%88%e0%b8%b2%e0%b8%87%e0%b8%99%e0%b9%89%e0%b8%ad%e0%b8%a2%e0%b8%ab%e0%b8%99%e0%b8%b6%e0%b9%88%e0%b8%87%e0%b8%ad%e0%b8%a2%e0%b9%88%e0%b8%b2%e0%b8%87/6252295.html,2021_10_01
อินเดียกระตุ้นประเทศร่ำรวยทุ่มเงินแสนล้านต่อสู้โลกร้อน ก่อนการประชุม COP26,"ที่ปรึกษาระดับสูงทางเศรษฐกิจของอินเดีย กล่าวกระตุ้นให้ประเทศร่ำรวยทั่วโลกบริจาคเงินกว่า 100,000 ล้านดอลลาร์ เพื่อช่วยเหลือประเทศยากจนต่อสู้กับปัญหาการเปลี่ยนแปลงของสภาพภูมิอากาศโลก ก่อนการประชุมว่าด้านเรื่องสภาพภูมิอากาศของสหประชาชาติ หรือ COP26 เวลานี้ประเทศรายได้สูงกำลังถูกดดันให้เร่งทำตามคำสัญญาที่ให้ไว้เมื่อปี ค.ศ. 2019 ว่าด้วยการจัดหาความช่วยเหลือด้านการเงินมูลค่า 100,000 ล้านดอลลาร์ให้แก่ประเทศกำลังพัฒนาเพื่อใช้ในการทำให้ระดับอุณหภูมิเฉลี่ยทั่วโลกไม่สูงเกินระดับ 1.5 องศาเซลเซียสจากยุคก่อนอุตสาหกรรม เค วี สุปรามาเนียน ที่ปรึกษาระดับสูงทางเศรษฐกิจของอินเดีย กล่าวกับรอยเตอร์ว่า เวลานี้อินเดียกำลังเพิ่มการผลิตพลังงานจากแหล่งพลังงานสะอาดมากขึ้นเรื่อย ๆ พร้อมกับสนับสนุนให้บริษัทอุตสาหกรรมต่าง ๆ เปลี่ยนมาใช้พลังงานสะอาดเพิ่มขึ้นด้วย ปัจจุบัน อินเดียคือประเทศที่ปล่อยก๊าซคาร์บอนสู่ชั้นบรรยากาศมากเป็นอันดับสามของโลก รองจากจีนและสหรัฐฯ โดยตั้งเป้าว่าจะสามารถทำให้อัตราการปล่อยคาร์บอนสุทธิลดลงเหลือศูนย์ให้ได้ภายในช่วงสามสิบปีจากนี้ การประชุม COP26 ถือเป็นโอกาสสำคัญที่นานาประเทศจะแสดงความตั้งใจและความร่วมมือในการลดปัญหาการเปลี่ยนแปลงของสภาพภูมิอากาศโลก จนถึงขณะนี้มีผู้นำทั่วโลกมากกว่า 100 ประเทศ ตอบรับแล้วว่าจะเข้าร่วมการประชุมสุดยอด COP26 ซึ่งจะเริ่มขึ้นในเดือนพฤศจิกายน ที่เมืองกลาสโกว์ สก็อตแลนด์",https://www.voathai.com/a/%e0%b8%ad%e0%b8%b4%e0%b8%99%e0%b9%80%e0%b8%94%e0%b8%b5%e0%b8%a2-%e0%b8%81%e0%b8%a3%e0%b8%b0%e0%b8%95%e0%b8%b8%e0%b9%89%e0%b8%99-%e0%b8%9b%e0%b8%a3%e0%b8%b0%e0%b9%80%e0%b8%97%e0%b8%a8%e0%b8%a3%e0%b9%88%e0%b8%b3%e0%b8%a3%e0%b8%a7%e0%b8%a2-%e0%b8%97%e0%b8%b8%e0%b9%88%e0%b8%a1%e0%b9%80%e0%b8%87%e0%b8%b4%e0%b8%99-%e0%b9%81%e0%b8%aa%e0%b8%99%e0%b8%a5%e0%b9%89%e0%b8%b2%e0%b8%99-%e0%b8%95%e0%b9%88%e0%b8%ad%e0%b8%aa%e0%b8%b9%e0%b9%89-%e0%b9%82%e0%b8%a5%e0%b8%81%e0%b8%a3%e0%b9%89%e0%b8%ad%e0%b8%99-%e0%b8%81%e0%b9%88%e0%b8%ad%e0%b8%99%e0%b8%81%e0%b8%b2%e0%b8%a3%e0%b8%9b%e0%b8%a3%e0%b8%b0%e0%b8%8a%e0%b8%b8%e0%b8%a1-cop26/6252287.html,2021_10_01
เศรษฐกิจเอเชียระส่ำจากวิกฤตขาดแคลนวัตถุดิบ-แรงงาน ต้นทุนขนส่งพุ่ง และการปิดตัวของโรงงาน,สภาพเศรษฐกิจในเอเชียกำลังอยู่ในภาวะย่ำแย่ อันเนื่องมาจากวิกฤตปัญหารอบด้าน ตั้งแต่เรื่อง การขาดแคลนพลังงานและชิปประมวลผลคอมพิวเตอร์รวมทั้งชิ้นส่วนต่างๆ ไปจนถึง ต้นทุนการขนส่งทางเรือที่เพิ่มสูง และการปิดตัวของโรงงานต่างๆ เนื่องจากการระบาดใหญ่ของโคโรนาไวรัส ตามรายงานของสำนักข่าว เอพี รายงานข่าวระบุว่า ขณะที่ญี่ปุ่นและอีกหลายประเทศกำลังเริ่มผ่อนคลายมาตรการฉุกเฉินเพื่อควบคุมการระบาดของโควิด-19 อยู่นี้ รัฐบาลอีกหลายประเทศกลับต้องมาบังคับใช้แผนงานต่างๆ เพื่อป้องกันการแพร่กระจายเชื้อ ทำให้ภาพรวมเกี่ยวกับทิศทางการเจริญเติบโตทางเศรษฐกิจทั้งในแง่ของภูมิภาคและของโลกยิ่งมีความไม่แน่นอนมากขึ้น และข้อมูลที่เพิ่งได้รับการเปิดเผยในวันพฤหัสบดี แสดงให้เห็นว่า ผลผลิตโรงงานของญี่ปุ่นชะลอตัวลงมาที่ระดับ 3.2 เปอร์เซ็นต์ในเดือนสิงหาคม เมื่อเทียบกับเดือนก่อนหน้าซึ่งรายงานการลดลงไว้ที่ 1.5 เปอร์เซ็นต์ สถานการณ์ในญี่ปุ่นที่ยังดูไม่ดีอยู่นี้ เป็นไปในทิศทางเดียวกับภาพรวมในเอเชียที่รายงานการปิดตัวของโรงงานต่างๆ อย่างต่อเนื่อง รายงานโดยรัฐบาลญี่ปุ่นระบุว่า อุตสาหกรรมการผลิตรถและผู้ผลิตสินค้าไอที รวมทั้งเครื่องจักรอิเล็กทรอนิกส์ คือ กลุ่มที่ได้รับผลกระทบหนักที่สุด โดยบริษัท ซูซูกิ มอเตอร์ กลายมาเป็นผู้ผลิตรถรายล่าสุดที่ออกมาประกาศพักสายการผลิตเพิ่มอีก 2-3 วัน เนื่องจากการขาดแคลนชิ้นส่วน หลังคู่แข่งรายอื่นๆ ประกาศชะลอสายการผลิตด้วยเหตุผลเดียวกันไปก่อนหน้า นอกจากนั้น ตัวเลขค้าปลีกญี่ปุ่นยังตกต่ำหนักว่าคาดถึง 4.1 เปอร์เซ็นต์จากเดือนก่อน เนื่องจากความต้องการสินค้าเสื้อผ้าและเครื่องใช้ผู้บริโภคที่อ่อนตัวลง ขณะเดียวกัน ภาพรวมอุตสาหกรรมการผลิตของจีนก็อ่อนตัวลงเช่นกัน โดยผลการสำรวจอย่างเป็นทางการของผู้จัดการโรงงานทั้งหลายพบว่า ดัชนีผู้จัดการฝ่ายจัดซื้อภาคการผลิต (PMI) ในเดือนกันยายนอยู่ที่ 49.6 หรือลดลงจากระดับ 50.1 ในเดือนสิงหาคม รายงานข่าวระบุว่า การสำรวจดังกล่าวเกิดขึ้น ก่อนที่จะมีรายงานการขาดแคลนพลังงานในจีน ที่ทำให้โรงงานในบางภูมิภาคของประเทศต้องระงับการทำงานไปเมื่อเร็วๆ นี้ สาเหตุของการลดลงของดัชนีนี้คือ ความต้องการเครื่องคอมพิวเตอร์และอุปกรณ์ต่างๆ ที่เพิ่มขึ้น เพราะนโยบายการทำงานจากบ้าน ทำให้มีไมโครชิปไม่พอสำหรับการผลิต ขณะที่ การขาดแคลนตู้ขนส่งสินค้าทางเรือและการปิดทำการของท่าเรือต่างๆ เป็นระยะๆ เนื่องจากการระบาดของโควิด-19 ก็มีส่วนทำให้เกิดเหตุสะดุดในห่วงโซ่อุปทานโลกด้วย (ที่มา: สำนักข่าว เอพี),https://www.voathai.com/a/asia-economy-manufacturing-shortages-shipping-shutdown-china-japan/6252202.html,2021_10_01
มาเลเซีย ประกาศพร้อมเพิ่มเม็ดเงินผลักดันแผนเศรษฐกิจสีเขียว,"มาเลเซียประกาศความพร้อมที่จะดำเนินแผนกระตุ้นเศรษฐกิจระยะเวลา 5 ปี เพื่อผลักดันประเทศให้บรรลุเป้าหมายเศรษฐกิจสีเขียว นายกรัฐมนตรี อิสมาอิล ซาบริ ยาขอบ ของมาเลเซีย เปิดเผยว่า แผนการกระตุ้นเศรษฐกิจดังกล่าวมุ่งเน้นไปที่การเพิ่มค่าใช้จ่ายด้านโครงสร้างพื้นฐาน และการดำเนินแผนเรียกเก็บภาษีคาร์บอน ที่เรียกเก็บจากการผลิต การจำหน่าย หรือการใช้เชื้อเพลิงฟอสซิล ภายใต้เป้าหมายการแก้ไขปัญหาสภาพภูมิอากาศโลกที่เปลี่ยนแปลง ขณะที่ รัฐบาลเร่งนำพาประเทศให้หลุดพ้นจากผลกระทบของวิกฤติโควิด-19 อยู่ นายกรัฐมนตรีมาเลเซียกล่าวด้วยว่า ภายใต้แผนพัฒนามาเลเซียฉบับที่ 12 ซึ่งนำเสนอต่อรัฐสภาไปเมื่อต้นสัปดาห์ ฐานะการเงินของประเทศน่าจะดีขึ้นภายในปี ค.ศ. 2023 โดยคาดการณ์อัตราการเจริญเติบโตทางเศรษฐกิจในช่วง 5 ปีจากนี้น่าจะอยู่ที่ราว 4.5-5.5 เปอร์เซ็นต์ต่อปี ในช่วงระหว่างปี ค.ศ. 2016 และ 2020 อัตราเฉลี่ยการขยายตัวทางเศรษฐกิจของมาเลเซียอยู่ที่ 2.7 เปอร์เซ็นต์ อันเป็นผลมาจากการหดตัวหนักถึง 5.6 เปอร์เซ็นต์ในปีที่แล้ว เพราะการระบาดใหญ่ของโคโรนาไวรัส ทั้งนี้ เศรษฐกิจของมาเลเซียที่พึ่งการส่งออกเป็นหลักได้รับผลกระทบอย่างหนักจากภาวการณ์ระบาดใหญ่ที่ดำเนินมากว่าปีแล้ว และธนาคารกลางมาเลเซียทำการปรับลดคาดการณ์อัตราการขยายตัวของจีดีพีมาอยู่ที่ 3-4 เปอร์เซ็นต์ เมื่อเทียบกับการคาดการณ์ที่ 6-7.5 เปอร์เซ็นต์ที่ประกาศออกมาเมื่อเดือนที่แล้ว สำหรับแผนการใช้จ่ายที่รัฐบาลวางไว้ในการผลักดันเศรษฐกิจนั้น นายกรัฐมนตรี อิสมาอิล ซาบริ กล่าวว่า มีงบ 95,530 ล้านดอลลาร์ สำหรับโครงการพัฒนาต่างๆ เช่น ทางหลวง เครือข่ายรถไฟ โครงการที่อยู่อาศัยราคาไม่สูง การปรับปรุงบริการด้านสาธารณสุข การศึกษา และอินเตอร์เน็ตบรอดแบนด์ ทั้งที่ดำเนินอยู่แล้วและกำลังจะเกิดขึ้นตั้งแต่ปีนี้ ไปจนถึงปี ค.ศ. 2025 โดยงบนี้ เป็นตัวเลขที่ปรับขึ้นจากงบ 62,000 ล้านดอลลาร์ภายใต้แผนพัฒนามาเลเซียฉบับที่ 11 นอกจากนั้น ผู้นำมาเลเซียยังประกาศความมุ่งมั่นที่จะทำให้ประเทศมีความเป็นกลางทางคาร์บอน (Carbon Neutral) ภายในปี ค.ศ. 2050 ด้วยมาตรการทางเศรษฐกิจต่างๆ รวมทั้งสัญญาที่จะยุติการสร้างโรงไฟฟ้าพลังงานถ่านหินในประเทศด้วย",https://www.voathai.com/a/malaysia-carbon-neutral-green-economy-goals/6252124.html,2021_10_01
