title,summary,link,published
Climate Change : Climate Chance : เปลี่ยนตัวเราก่อนเราจะถูกเปลี่ยน,Climate Change : Climate Chance : เปลี่ยนตัวเราก่อนเราจะถูกเปลี่ยน ข้อเขียนนี้ ถูกผูกขึ้นด้วยเป้าประสงค์เพื่อช่วยให้ผู้อ่านเข้าใจว่า ทำไม การแก้ปัญหาระดับวิกฤติการณ์ต่อมวลมนุษยชาติหนนี้ ต้องอาศัยความกล้าหาญอย่างยิ่งใหญ่ของคนยุคเราขนาดไหน,https://thaipublica.org/2021/10/weerasak-kowsurat20/,2021_10_30
COP26 คืออะไร มีบทบาทอย่างไรในการต่อสู้กับ Climate Change,การประชุม COP26 ไม่ได้เป็นเพียงแค่การประชุมระดับนานาชาติงานหนึ่งเท่านั้น แต่ถือเป็นช่วงเวลาสำคัญที่จะกำหนดว่าเราจะสามารถป้องกันภัยพิบัติทางสภาพภูมิอากาศที่จะเกิดในอนาคตอันใกล้ได้ดีเพียงใด,https://thaipublica.org/2021/10/what-is-cop-26/,2021_10_30
ปฏิบัติการครั้งแรกในเอเชีย! “หุ้นกู้ดิจิทัล ปตท.สผ.”  ผ่านวอลเล็ตบน “เป๋าตัง” เปิดขาย 2-4 พ.ย.นี้,"ปฏิบัติการครั้งแรกในเอเชีย! “หุ้นกู้ดิจิทัล ปตท.สผ.” ผ่านวอลเล็ตบน ""เป๋าตัง"" เปิดขาย 2-4 พ.ย.นี้ ลงทุนขั้นเริ่มที่ 1,000 บาท ซื้อขายได้ 24 ชม.",https://thaipublica.org/2021/10/pttep-and-krungthai-bank-join-hands-to-offer-pttep-digital-bond-native-ad/,2021_10_30
ก้าวหน้าเพื่อมนุษยชาติ,สามความก้าวหน้าจะเป็นผลดีอย่างมากต่อมนุษยชาติ ที่ชัดเจนที่สุดคือการลดความทุกข์ทรมานจากการเจ็บป่วย ความไม่แน่นอนของชีวิต และการความขาดแคลนน้ำสะอาด มนุษย์ในปัจจุบันเป็นคนที่โชคดีเป็นที่สุด เราควรใคร่ครวญตระหนักในความโชคดีและรับผิดชอบโลกใบนี้กันยิ่งขึ้น,https://thaipublica.org/2021/10/varakorn-357/,2021_10_30
กสิกรไทยขยายสิทธิ์ให้พนักงานเกษียณอายุก่อนกำหนดเฉพาะคราว-ช่วยโควิดคนละ1หมื่นบาท,"ธนาคารกสิกรไทยขยายสิทธิ์ให้พนักงานเกษียณอายุก่อนกำหนดเฉพาะคราว พร้อมจ่ายเงินช่วยเหลือสู้ภัยโควิดให้พนักงานทุกคน คนละ 10,000 บาท",https://thaipublica.org/2021/10/kbank-pr-30-10-2564/,2021_10_30
ThaiPublica Note: ความเทาของคนไทย (ตอนที่ 4) – เหตุผลที่คนเสพยา มากกว่าแค่เรื่องศีลธรรม,ตลอดเวลาที่ผ่านมา จิตใจของผู้ใช้ยาเสพติดถูกประทับตราว่าคือความอ่อนแอที่พ่ายแพ้ต่อสิ่งยั่วยุจนก้าวข้ามศีลธรรมอันดี แต่ไม่เคยได้รับการพิจารณาว่ามีปัญหาอื่นใดอยู่เบื้องหลังความอ่อนแอนั้นหรือไม่,https://thaipublica.org/2021/10/thaipublica-note07/,2021_10_30
HUAWEI MateBook 14s ครั้งแรกของหัวเว่ยแล็ปท็อปที่มาพร้อม mobile app ในตัว ครบจบเสมือนย้ายสมาร์ทโฟนมาอยู่บนจอที่ใหญ่กว่า,คุณเคยตั้งคำถามกับตัวเองไหม แล็ปท็อปในอุดมคติของคุณคืออ […] อ่านข่าวต้นฉบับ: HUAWEI MateBook 14s ครั้งแรกของหัวเว่ยแล็ปท็อปที่มาพร้อม mobile app ในตัว ครบจบเสมือนย้ายสมาร์ทโฟนมาอยู่บนจอที่ใหญ่กว่า,https://www.prachachat.net/advertorial/news-792187,2021_10_30
“คมนาคม”ขานรับเปิดเมือง 1 พ.ย. 64 ผ่อนคลายบริการทุกโหมดเดินทาง,“คมนาคม”ขานรับเปิดเมือง 1 พ.ย. 64 ผ่อนคลายบ […] อ่านข่าวต้นฉบับ: “คมนาคม”ขานรับเปิดเมือง 1 พ.ย. 64 ผ่อนคลายบริการทุกโหมดเดินทาง,https://www.prachachat.net/general/news-792566,2021_10_30
โอกาส Soft Power ไทย อย่าปล่อยให้หลุดมือ,คอลัมน์ ชั้น 5 ประชาชาติ ณัฐวุฒิ ประชาชาติ อย่าง […] อ่านข่าวต้นฉบับ: โอกาส Soft Power ไทย อย่าปล่อยให้หลุดมือ,https://www.prachachat.net/columns/news-788783,2021_10_30
เศรษฐกิจไทยจะไปต่ออย่างไร เมื่อเราต้องอยู่กับ COVID อีกนาน ?,คอลัมน์ช่วยกันคิด พิมฉัตร เอกฉันท์ ศูนย์วิจัย Krungthai […] อ่านข่าวต้นฉบับ: เศรษฐกิจไทยจะไปต่ออย่างไร เมื่อเราต้องอยู่กับ COVID อีกนาน ?,https://www.prachachat.net/columns/news-788742,2021_10_30
การ์ตูนขุนพล : บิ๊กป้อม ฮาโลวีนสยอง !,การ์ตูนขุนพล / ฮาโลวีนสยอง ! / บิ๊กป้อม / ธรรมนัส อ่านข่าวต้นฉบับ: การ์ตูนขุนพล : บิ๊กป้อม ฮาโลวีนสยอง !,https://www.prachachat.net/columns/news-792111,2021_10_30
ธปท. ชี้เศรษฐกิจเข้าสู่โหมด “ฟื้นฟู” ‘กรุงศรี’หนุนอัดเงินกระตุ้น,ธปท.ชี้สัญญาณเศรษฐกิจ ก.ย.-ต.ค.ฟื้นตัวต่อเนื่อง หลายธุร […] อ่านข่าวต้นฉบับ: ธปท. ชี้เศรษฐกิจเข้าสู่โหมด “ฟื้นฟู” ‘กรุงศรี’หนุนอัดเงินกระตุ้น,https://www.prachachat.net/finance/news-792303,2021_10_30
เลิกเคอร์ฟิว-ดื่มกินเสรี 4 จังหวัด เปิดประเทศเต็มรูปแบบ 1 ม.ค. 65,ศบค.เคาะคิกออฟเปิดเมืองรับนักท่องเที่ยวต่างชาติ 1 พ.ย. […] อ่านข่าวต้นฉบับ: เลิกเคอร์ฟิว-ดื่มกินเสรี 4 จังหวัด เปิดประเทศเต็มรูปแบบ 1 ม.ค. 65,https://www.prachachat.net/tourism/news-792346,2021_10_30
"ศบค.พบป่วยโควิดใหม่วันนี้ (30 ต.ค.) 9,224 ราย ATK ติดเชื้อเพิ่ม 2,944 คน","ศบค.พบผู้ติดเชื้อโควิดรายใหม่วันนี้ (30 ต.ค.) เพิ่ม 9,2 […] อ่านข่าวต้นฉบับ: ศบค.พบป่วยโควิดใหม่วันนี้ (30 ต.ค.) 9,224 ราย ATK ติดเชื้อเพิ่ม 2,944 คน",https://www.prachachat.net/general/news-792541,2021_10_30
มาริษา เจียรวนนท์ ใช้ “ศาสตร์-ศิลป์” ของอาหาร สร้างพลังบวกคืนสู่สังคม,พลพัต สาเลยยกานนท์ : เรื่อง กว่า 1 ปี ของ “มูลนิธิเชฟแค […] อ่านข่าวต้นฉบับ: มาริษา เจียรวนนท์ ใช้ “ศาสตร์-ศิลป์” ของอาหาร สร้างพลังบวกคืนสู่สังคม,https://www.prachachat.net/d-life/news-788696,2021_10_30
“แพทองธาร” ไพ่ไบใหญ่ “ทักษิณ” เดิมพันเพื่อไทย ลุ้นชนะแลนด์สไลด์,รายงานพิเศษ “พรรคเพื่อไทย” ประกาศ disrupt ตัวเองอีกหน ภ […] อ่านข่าวต้นฉบับ: “แพทองธาร” ไพ่ไบใหญ่ “ทักษิณ” เดิมพันเพื่อไทย ลุ้นชนะแลนด์สไลด์,https://www.prachachat.net/politics/news-791980,2021_10_30
สางปมถุงมือยางกู้ภาพลักษณ์ส่งออก,ข่าวอื้อฉาวการตรวจสอบพบถุงมือยางใช้แล้วนับสิบล้านชิ้นจา […] อ่านข่าวต้นฉบับ: สางปมถุงมือยางกู้ภาพลักษณ์ส่งออก,https://www.prachachat.net/columns/news-792092,2021_10_30
"ราคาบิตคอยน์วันนี้ (30 ต.ค.) ขยับขึ้น 1.07% อยู่ที่ 62,119.50 เหรียญสหรัฐ","ผู้สื่อข่าวรายงานว่า ราคาบิตคอยน์วันนี้ (30 ต.ค. […] อ่านข่าวต้นฉบับ: ราคาบิตคอยน์วันนี้ (30 ต.ค.) ขยับขึ้น 1.07% อยู่ที่ 62,119.50 เหรียญสหรัฐ",https://www.prachachat.net/finance/news-792581,2021_10_30
สิงห์รถบรรทุกขู่ขึ้นค่าขนส่ง ดีเซลแพง-1 พ.ย.ดีเดย์หยุดวิ่ง 8 หมื่นคัน,สหพันธ์การขนส่งทางบกฯเตรียมแผน 3 “ขึ้นค่าขนส่ง” แน่ หาก […] อ่านข่าวต้นฉบับ: สิงห์รถบรรทุกขู่ขึ้นค่าขนส่ง ดีเซลแพง-1 พ.ย.ดีเดย์หยุดวิ่ง 8 หมื่นคัน,https://www.prachachat.net/economy/news-792490,2021_10_30
ราคาน้ำมันวันนี้ (30 ต.ค.) เช็กราคาดีเซล-แก๊สโซฮอล์ล่าสุด,ราคาน้ำมัน ประจำวันนี้ (30 ต.ค.64) อ้างอิงข้อมูลจาก ปั๊ […] อ่านข่าวต้นฉบับ: ราคาน้ำมันวันนี้ (30 ต.ค.) เช็กราคาดีเซล-แก๊สโซฮอล์ล่าสุด,https://www.prachachat.net/economy/news-792583,2021_10_30
"ราคาทองวันนี้ (30 ต.ค.) ปรับลง 50 บาท รูปพรรณขายออกบาทละ 28,650 บาท","ราคาทองคำวันนี้ (30 ต.ค.64) สมาคมค้าทองคำประกาศราคาครั้ […] อ่านข่าวต้นฉบับ: ราคาทองวันนี้ (30 ต.ค.) ปรับลง 50 บาท รูปพรรณขายออกบาทละ 28,650 บาท",https://www.prachachat.net/finance/news-792561,2021_10_30
“เอสเอ็มอี’”ญี่ปุ่นโคม่า  หนี้ท่วมสูงสุดในรอบ 10 ปี,การแพร่ระบาดของโควิด-19 กำลังส่งผลให้วิสาหกิจขนาดกลางแล […] อ่านข่าวต้นฉบับ: “เอสเอ็มอี’”ญี่ปุ่นโคม่า หนี้ท่วมสูงสุดในรอบ 10 ปี,https://www.prachachat.net/world-news/news-792139,2021_10_30
ประกันรายได้ 3 ปี 1.6 แสนล้าน ชุบชีวิตเกษตรกร ?,กำลังเข้าสู่ปีที่ 3 ของการดำเนินโครงการประกันรายได้สินค […] อ่านข่าวต้นฉบับ: ประกันรายได้ 3 ปี 1.6 แสนล้าน ชุบชีวิตเกษตรกร ?,https://www.prachachat.net/economy/news-792460,2021_10_30
พลังประชารัฐพักรบ “ธรรมนัส” เป็นต่อ “ประวิตร” คุมเกมสภาเบ็ดเสร็จ,และแล้วการ “ล้างไพ่” กรรมการบริหาร (กก.บห.) พรรคพลังประ […] อ่านข่าวต้นฉบับ: พลังประชารัฐพักรบ “ธรรมนัส” เป็นต่อ “ประวิตร” คุมเกมสภาเบ็ดเสร็จ,https://www.prachachat.net/politics/news-791992,2021_10_30
ส่องไอเดีย 3 บลจ. 3 สไตล์ จัดพอร์ตโค้งท้ายปี ปั้นผลตอบแทน,เข้าสู่ช่วงโค้งสุดท้ายของปี 2564 แล้ว เศรษฐกิจในหลายประ […] อ่านข่าวต้นฉบับ: ส่องไอเดีย 3 บลจ. 3 สไตล์ จัดพอร์ตโค้งท้ายปี ปั้นผลตอบแทน,https://www.prachachat.net/finance/news-792291,2021_10_30
กคช. เปิดให้จองอาคารเช่าผู้มีรายน้อย 5 จังหวัด,กคช. เปิดอาคารเช่าผู้มีรายน้อย 5 จังหวัด 818 หน่วย ให้ส […] อ่านข่าวต้นฉบับ: กคช. เปิดให้จองอาคารเช่าผู้มีรายน้อย 5 จังหวัด,https://www.prachachat.net/property/news-792588,2021_10_30
บริหารความหลากหลาย กลยุทธ์สร้างคนเติบโตอย่างสมดุล,ปัจจุบันเรื่องความหลากหลาย (diversity) ของพนักงานในองค์ […] อ่านข่าวต้นฉบับ: บริหารความหลากหลาย กลยุทธ์สร้างคนเติบโตอย่างสมดุล,https://www.prachachat.net/csr-hr/news-789549,2021_10_30
ไม่มีสินทรัพย์ใดเป็น “ผู้ชนะ-ผู้แพ้” ตลอดกาล แนะจัดพอร์ต Asset Allocation,แนะนำการจัดพอร์ตโดยกระจายน้ำหนักการลงทุนในสินทรัพย์ ไฮไ […] อ่านข่าวต้นฉบับ: ไม่มีสินทรัพย์ใดเป็น “ผู้ชนะ-ผู้แพ้” ตลอดกาล แนะจัดพอร์ต Asset Allocation,https://www.prachachat.net/breaking-news/news-792171,2021_10_30
กกต.แจ้ง อสม.ที่ลงสมัคร อบต.ทั่วประเทศ ให้หยุดปฏิบัติหน้าที่ช่วยโควิด,กกต.ทำหนังสือถึงปลัดกระทรวงสาธารณสุข ขอความร่วมมือสั่งใ […] อ่านข่าวต้นฉบับ: กกต.แจ้ง อสม.ที่ลงสมัคร อบต.ทั่วประเทศ ให้หยุดปฏิบัติหน้าที่ช่วยโควิด,https://www.prachachat.net/general/news-792596,2021_10_30
แซม -ไพศาล ลาโออิชิ นั่งแท่น MD ร้านอาหารหรูเครือไทยเบฟ,แซม -ไพศาล อำลาตำแหน่งรองกรรมการผู้จัดการโออิชิ กรุ๊ป น […] อ่านข่าวต้นฉบับ: แซม -ไพศาล ลาโออิชิ นั่งแท่น MD ร้านอาหารหรูเครือไทยเบฟ,https://www.prachachat.net/marketing/news-792600,2021_10_30
เคาะแล้วราคาประกันรายได้ข้าว งวด1-2 ชาวนาเช็คด่วน!,พาณิชย์เดินหน้าประกันรายได้ข้าวเปลือก ปี 3 เคาะแล้วราคา […] อ่านข่าวต้นฉบับ: เคาะแล้วราคาประกันรายได้ข้าว งวด1-2 ชาวนาเช็คด่วน!,https://www.prachachat.net/economy/news-792605,2021_10_30
ยอดเปิดบัญชีคริปโทฯ พุ่ง 4.26 แสนบัญชี รายย่อยเทรดสูงสุด 6.9 หมื่นล้าน,ก.ล.ต. เผยตลาดสินทรัพย์ดิจิทัลสัปดาห์ที่ผ่านมามูลค่าทั่ […] อ่านข่าวต้นฉบับ: ยอดเปิดบัญชีคริปโทฯ พุ่ง 4.26 แสนบัญชี รายย่อยเทรดสูงสุด 6.9 หมื่นล้าน,https://www.prachachat.net/finance/news-792235,2021_10_30
ส่งออกข้าวไทยลุ้นโค้งสุดท้ายปี 64 ทะลุเกิน 6 ล้านตัน,"ผู้ส่งออกข้าว ชี้ส่งออกข้าว ต.ค. 64 คาดได้ 700,000 แสนต […] อ่านข่าวต้นฉบับ: ส่งออกข้าวไทยลุ้นโค้งสุดท้ายปี 64 ทะลุเกิน 6 ล้านตัน",https://www.prachachat.net/economy/news-792609,2021_10_30
ความสำเร็จ ‘อีลอน มัสก์’  บุคคลที่รวยที่สุดในโลก,ปีนี้อาจถือว่าเป็นปีทองของ “อีลอน มัสก์” ซีอีโอบริษัท “ […] อ่านข่าวต้นฉบับ: ความสำเร็จ ‘อีลอน มัสก์’ บุคคลที่รวยที่สุดในโลก,https://www.prachachat.net/world-news/news-792133,2021_10_30
สหรัฐไฟเขียว ให้ใช้วัคซีนไฟเซอร์กับเด็กอายุ 5-11 ปีแล้ว,สหรัฐไฟเขียว อนุมัติให้ใช้วัคซีนไฟเซอร์กับเด็กอายุ 5-11 […] อ่านข่าวต้นฉบับ: สหรัฐไฟเขียว ให้ใช้วัคซีนไฟเซอร์กับเด็กอายุ 5-11 ปีแล้ว,https://www.prachachat.net/world-news/news-792613,2021_10_30
รพ.จุฬาฯ เปิดลงทะเบียนฉีดวัคซีนเข็ม 3 สำหรับผู้ฉีดซิโนแวคและซิโนฟาร์ม,รพ.จุฬาลงภรณ์ เปิดให้ลงทะเบียนฉีดวัคซีนเข็ม 3 สำหรับผู้ […] อ่านข่าวต้นฉบับ: รพ.จุฬาฯ เปิดลงทะเบียนฉีดวัคซีนเข็ม 3 สำหรับผู้ฉีดซิโนแวคและซิโนฟาร์ม,https://www.prachachat.net/general/news-792620,2021_10_30
"สุชาติ ปลุก SMEs ลุยต่อ เร่งเยียวยา-รักษาจ้างงานหัวละ 3,000บาท 3 เดือน","“สุชาติ” รมว.แรงงานปลุกเอสเอ็มอีต้องเดินหน้ […] อ่านข่าวต้นฉบับ: สุชาติ ปลุก SMEs ลุยต่อ เร่งเยียวยา-รักษาจ้างงานหัวละ 3,000บาท 3 เดือน",https://www.prachachat.net/general/news-792627,2021_10_30
เปิดโผ 10 อันดับกองทุนหุ้นจีนผลตอบแทนสูงสุดในรอบ 3 ปี,มอร์นิ่งสตาร์ รีเสิร์ช ประเทศไทย เปิด 10 อันดับกองทุนห […] อ่านข่าวต้นฉบับ: เปิดโผ 10 อันดับกองทุนหุ้นจีนผลตอบแทนสูงสุดในรอบ 3 ปี,https://www.prachachat.net/finance/news-792625,2021_10_30
ลงทุนพลังงานทดแทนได้ไปต่อ กฤษฎีกาปลดล็อกให้เว้นผังเมืองตามเดิม,กฤษฎีกาปลดล็อก พพ.ออกหนังสือรับรองเอกชนลงทุนตามแผนพัฒนา […] อ่านข่าวต้นฉบับ: ลงทุนพลังงานทดแทนได้ไปต่อ กฤษฎีกาปลดล็อกให้เว้นผังเมืองตามเดิม,https://www.prachachat.net/economy/news-792419,2021_10_30
ร้านอาหารงัดบุฟเฟต์สู้กำลังซื้อซบ เพิ่มทางเลือก-รัวโปรฯถี่ยิบปั๊มยอด,เชนร้านอาหารค่ายเล็ก-ค่ายใหญ่ดาหน้าเพิ่มดีกรีลุย “บุฟเฟ […] อ่านข่าวต้นฉบับ: ร้านอาหารงัดบุฟเฟต์สู้กำลังซื้อซบ เพิ่มทางเลือก-รัวโปรฯถี่ยิบปั๊มยอด,https://www.prachachat.net/marketing/news-792406,2021_10_30
การทางพิเศษฯ ยกเลิกจำกัดเวลาให้บริการ เปิดวิ่งปกติ 1 พ.ย.นี้,กทพ. ยกเลิกการจำกัดเวลาการให้บริการสำหรับรถยนต์ทั่วไป บ […] อ่านข่าวต้นฉบับ: การทางพิเศษฯ ยกเลิกจำกัดเวลาให้บริการ เปิดวิ่งปกติ 1 พ.ย.นี้,https://www.prachachat.net/general/news-792642,2021_10_30
“มิลเลนเนียม ออโต้” จัดมหกรรมรถผู้บริหารดอกเบี้ยต่ำสุดๆ,มิลเลนเนียม ออโต้ ยกทัพยนตรกรรมผู้บริหารป้ายแดง สภาพดี […] อ่านข่าวต้นฉบับ: “มิลเลนเนียม ออโต้” จัดมหกรรมรถผู้บริหารดอกเบี้ยต่ำสุดๆ,https://www.prachachat.net/motoring/news-792644,2021_10_30
