title,summary,link,published
ลูกทรพี! เผาบ้านขู่ฆ่าแม่ อ้างดื่มหนักเครียด สำนึกผิดกราบเท้าขอโทษ,4 พ.ย.64 ผู้สื่อข่าวรายงานถึงความคืบหน้า กรณีนายอ้วน (นามสมมติ) อายุ 53 ปี ชาว ต.ตาเป๊ก อ.เฉลิมพระเกียรติ จ.บุรีรัมย์ ดื่มเหล้าหนัก 3 วันติดต่อกันแล้วแล้วก่อเหตุจุดไฟเผาบ้านตัวเองที่อาศัยอยู่กับแม่และน้องชายพิการ เคราะห์ดีที่เพื่อนบ้านมาช่วยดับไว้ได้ทัน มีเพียงที่นอนและเสื้อผ้าบางส่วนที่ถูกไฟไหม้เสียหายทั้งนี้ นายอ้วนยังด่าทอและขู่จะฆ่าปาดคอนางแก้ว (นามสมมติ) อายุ 79 ปี แม่บังเกิดเกล้าของตัวเองด้วย เหตุเกิดเมื่อคืนวันที่ 2 พ.ย.64ที่ผ่านมาหลังก่อเหตุนายอ้วนถูกเจ้าหน้าที่ตำรวจเข้าควบคุมตัวไปสงบสติอารมณ์ที่โรงพัก และถูกแจ้งข้อหาเมาประพฤติตนวุ่นวาย ล่าสุด นายอ้วน ได้ออกมาอยู่ที่บ้านแล้วหลังจากน้องชาย ที่พิการไปจ่ายค่าปรับที่โรงพักให้ ซึ่งวันนี้นายอ้วน ก็สร่างเมาและพูดจารู้เรื่องมากขึ้น จากนั้นนายสมควร กึ่งกลาง ผู้ช่วยผู้ใหญ่บ้าน ก็ได้พานายอ้วนไปกราบเท้าขอโทษแม่บังเกิดเกล้า กับสิ่งที่ทำลงไป โดยนายอ้วน กล่าวว่า ที่ดื่มเหล้าหนัก 3 วันติดต่อกันเพราะเครียดที่ช่วงโควิดตกงานไม่มีเงินใช้ ก็เลยไปดื่มเหล้ากับเพื่อนบ้านจนเมาแล้วมาบังคับขอเงินแม่เพื่อจะเอาไปซื้อเหล้ามาดื่มต่ออีก แต่แม่ไม่ให้จึงโมโหและก่อเหตุดังกล่าวขึ้น ตอนนี้สำนึกผิดแล้วอยากจะขอขมาแม่กับสิ่งที่ทำลงไป หลังจากก็จะพยายามหยุดดื่มเหล้าและปรับปรุงตัวให้ดีขึ้นกว่าเดิม ไม่ให้เกิดเหตุการณ์แบบนี้ขึ้นอีก นางแก้ว ผู้เป็นแม่ กล่าวว่า ในฐานะแม่ก็ให้อภัยลูกอยู่แล้วไม่ว่าลูกจะทำไม่ดีแค่ไหน หากเป็นไปได้ก็อยากให้ลูกชายเลิกดื่มเหล้า แต่ถ้าเลิกไม่ได้จะดื่มนิดๆ หน่อยๆ พอกินข้าวอร่อยแม่ก็ไม่ว่า แต่อย่าดื่มจนเมาแล้วมาหาเรื่องทะเลาะคนในบ้านหรหรือก่อเหตุแบบนี้อีก แต่พอถามว่าจะแจ้งความเอาผิดลูกชายหรือไม่ แม่ก็บอกว่าหัวอกคนเป็นแม่แม้จะโกรธที่ลูกทำไม่ดี แต่ก็ยังรักและสงสารลูกเหมือนเดิม ครั้งนี้ก็จะให้อภัยก่อนแต่หากก่อเหตุอีกก็คงจะแจ้งความเอาผิด ขณะที่นายสมควร กึ่งกลาง ผู้ช่วยผู้ใหญ่บ้าน บอกว่า ที่ผ่านมา นายอ้วน ก็จะดื่มเหล้าแต่ไม่ดื่มหนักขนาดนี้ ช่วงหลังๆ ตั้งแต่มีโควิดระบาดนี้ดื่มหนักมากแทบทุกวัน พอดื่มแล้วก็จะโวยวายหาเรื่องแม่และน้องชายพิการ เวลาที่ตนเห็นก็จะไปห้ามปรามบ่อยครั้ง แต่ล่าสุดถึงขั้นจะเผาบ้าน และขู่ฆ่าแม่ถือเป็นพฤติกรรมที่รุนแรงขึ้น ซึ่งหลังจากนี้ก็จะได้หารือกับผู้เป็นแม่ และญาติพี่น้อง เพื่อหาวิธีให้นายอ้วน หยุดดื่มเหล้า จะได้ไม่เกิดเหตุการณ์แบบนี้อีก. -008,https://www.naewna.com/local/613589,2021_11_04
หาดูยาก! 'ต้นไม้คู่รัก' กอดกันมานานหลายร้อยปี,4 พ.ย.64 ที่วัดพระธาตุจอมศิลป์ ต.บ้านถ้ำ อ.ดอกคำใต้ จ.พะเยา ได้มีต้นไทร และต้นเถาวัลย์ ขนาดใหญ่ ยืนต้นสูง กว่า 30 เมตร อยู่ด้วยกัน 2 ต้น อายุหลายร้อย ปี ขนาด 6 โอบโดยต้นไม้ต้นใหญ่เป็นต้นไทรขนาด 6 คนโอบและมีต้นคล้ายเถาวัลย์ขนาดใหญ่พันรัดรอบต้นไทร ตั้งแต่โคนต้นขึ้นไปจนถึงลำต้นต้นไทร ต้นไม้ 2 ชนิดนี้ ชาวบ้านบอกว่า อยู่ด้วยกันมาหลายร้อยปีชาวบ้านเรียกว่าเป็นต้นไม้ คู่รัก ถือว่าเป็นต้นไม้ที่แปลกและหาดูได้ยาก สำหรับ ต้นไทรมีลำต้นใหญ่ขนาด 6 คนโอบสูงประมาณ 30 เมตร แผ่กิ่งก้านสาขาปกคลุมให้ความร่มรื่นไปทั่วบริเวณและพบว่าได้มีต้นคล้ายเถาวัลย์ ขนาดเส้นผ่าศูนย์กลาง ขนาดเส้นรอบวง 8 นิ้วพันรอบกับลำต้นไทรเป็นเกลียวอย่างสวยงาม โดยต้นไม้ทั้งคู่ ถือว่าเป็นต้นไม้ที่มีเพียงต้นเดียวในสวนรุกขชาติบ้านถ้ำ ที่เป็นต้นไม้ใหญ่หาดูได้ยาก และมีอายุหลายร้อยปี เชื่อว่ามีนางไม้ รุกขเทวา สิงสถิตอยู่ด้วย. -008,https://www.naewna.com/likesara/613595,2021_11_04
'สิระ' ถกปม 'ทักษิณ'แทรกแซงเพื่อไทย หลังมีคนร้องยุบพรรค 'โรม'แย้งใช้อำนาจอะไรพิจารณา,ประธานกมธ.กม. ถกปม ทักษิณ แทรกแซงเพื่อไทย หลังมีคนร้องยุบพรรค ชี้ไม่ฟันธงถูก-ผิด แค่ศึกษาตามรธน. วันที่ 4 พฤศจิกายน 2564ที่รัฐสภา ในการประชุมคณะกรรมาธิการ (กมธ.) การกฎหมาย การยุติธรรม และสิทธิมนุษยชน สภาผู้แทนราษฎร ที่มีนายสิระ เจนจาคะ ส.ส.กทม.พรรคพลังประชารัฐ ในฐานะประธานกมธ.การกฎหมายฯ เป็นประธานการประชุม ได้มีการนำเรื่องที่นายสรชัช ทองเพ็ญ ผู้ประสานงานเครือข่ายธรรมาภิบาลเพื่อการเมืองสุจริต ยื่นหนังสือขอให้ตรวจสอบกรณี นายทักษิณ ชินวัตร อดีตนายกรัฐมนตรี วีดีโอคอลคุยกับกรรมการบริหารพรรคและส.ส.พรรคเพื่อไทย เพื่อวางตัวแคนดิเดตนายกรัฐมนตรีและยุทธศาสตร์ขับเคลื่อนการเลือกตั้งสมัยหน้า ซึ่งอาจเข้าข่ายยินยอมให้บุคคลภายนอกครอบงำและแทรกแซงกิจกรรมพรรคการเมือง ทำให้สมาชิกพรรคขาดความเป็นอิสระขัดพระราชบัญญัติประกอบรัฐธรรมนูญว่าด้วยพรรคการเมือง และมีโทษยุบพรรคนั้น ได้เชิญนายสมพล พรผล ผอ.สำนักกิจการพรรคการเมือง สำนักงานคณะกรรมการการเลือกตั้ง (กกต.) นายอุดม รัฐอมฤต อดีตคณบดี คณะนิติศาสตร์ มหาวิทยาลัยธรรมศาสตร์ และอดีตกรรมการร่างรัฐธรรมนูญ (กรธ.) และนายเจษฎ์ โทณะวณิก เป็นนักวิชาการทางกฎหมายและอดีตกรรมการร่างรัฐธรรมนูญ เข้าให้ข้อมูล ขณะที่ในส่วนของผู้ร้องไม่ได้เดินทางมาร่วมประชุมในครั้งนี้ด้วย ผู้สื่อข่าวรายงานว่า ก่อนเริ่มการประชุมทางกมธ.แต่ละคนได้มีการหารือกันอย่างกว้างขวาง โดยเฉพาะกมธ.ในสัดส่วนของพรรคเพื่อไทย และพรรคก้าวไกลถึงอำนาจหน้าที่ของกมธ.การกฎหมายฯ ว่ามีอำนาจในการพิจารณาเรื่องดังกล่าวหรือไม่ โดยนายรังสิมันต์ โรม ส.ส.แบบบัญชีรายชื่อ พรรคก้าวไกล ในฐานะโฆษกกมธ.การกฎหมายฯ กล่าวว่า เราควรพิจารณาก่อนว่าเรามีอำนาจในการพิจารณาเรื่องนี้หรือไม่ เพราะถือเป็นเรื่องใหญ่และเป็นข้อกล่าวหาที่ร้ายแรงถึงขั้นยุบพรรคการเมือง และตนไม่อยากเห็นการใช้กมธ.ในลักษณะการสร้างกระบวนการที่นำไปสู่การยุบพรรคการเมือง อีกทั้งกมธ.มีเรื่องร้องเรียนต่างๆมากมาย ทำไมเราไม่นำมาพิจารณาก่อน หน้าที่ของกมธ.คือการตรวจสอบรัฐบาลและฝ่ายบริหารมากกว่า ถ้าเรามุ่งสู่การพิจารณาเรื่องนี้ต่อไปสุดท้ายแล้วเราจะได้อะไร รวมถึงวันนี้ผู้ร้องเรียนไม่มาร่วมประชุม และยังไม่ได้เนื้อหารายละเอียดที่ครบถ้วนจากทางกกต. ซึ่งยังไม่ได้รับการประเมินอย่างรอบด้าน จึงขอให้ทุกคนช่วยพิจารณากันก่อนด้วย ทั้งนี้นายสิระพยายามชี้แจงในที่ประชุมว่า การนำเรื่องนี้มาพิจารณาเราไม่ได้ชี้ว่าถูกหรือผิด แต่เป็นการศึกษาอำนาจตามรัฐธรรมนูญ -007,https://www.naewna.com/politic/613599,2021_11_04
'จุ๊บจิ๊บ'ปัดนั่งประธานยุทธศาสตร์ ปชต.ใหม่ ย้ำยังเป็นสมาชิกพลังประชารัฐอยู่,วันที่ 4 พฤศจิกายน 2564 น.ส.ธนพร ศรีวิราช ภรรยา ร.อ.ธรรมนัส พรหมเผ่า เลขาธิการพรรคพลังประชารัฐ (พปชร.)กล่าวถึงกรณี นายสุรทิน พิจารณ์ ส.ส.บัญชีรายชื่อ และหัวหน้าพรรคประชาธิปไตยใหม่ (ปธม.) แถลงข่าวที่รัฐสภาวันนี้ว่า วันที่ 7 พ.ย.นี้ พรรคประชาธิปไตยใหม่ จะมีการประชุมใหญ่สามัญประจำปี ที่หอประชุมใหญ่เทศบาลเมืองคูคต จ.ปทุมธานี โดยมีวาระสำคัญคือเลือกตั้งกรรมการบริหารพรรคใหม่ทั้งหมด และจะมีการเสนอชื่อ น.ส.ธนพร ศรีวิราช ภรรยาของ ร.อ.ธรรมนัส พรหมเผ่า เลขาธิการพรรคพลังประชารัฐ เป็นประธานยุทธศาสตร์พรรค เพื่อเป็นการเตรียมพร้อมในการสู้ศึกเลือกตั้งครั้งหน้านั้น ตนเองขอปฎิเสธว่าไม่เป็นความจริงแต่อย่างใด และปัจจุบันยังเป็นสมาชิกของพรรคพลังประชารัฐ อีกด้วย มีรายงานว่า ปัจจุบัน น.ส.ธนพร ศรีวิราช เป็นสมาชิกพรรคพลังประชารัฐ เลขที่สมาชิก 00066912 อ่านข่าวที่เกี่ยวข้อง :ปชต.ใหม่ล้อฟรี! 'ธรรมนัส'เบรคดังเอี๊ยด ปัดข่าว'จุ๊บจิ๊บ'จ่อนั่งปธ.ยุทธศาสตร์ -007,https://www.naewna.com/politic/613602,2021_11_04
เมากร่าง! หนุุ่มรุ่นพี่สุดทนเตือนไม่ฟังถูกด่าถึงบุพการี ใช้เหล็กแทงหลังเจ็บสาหัส,เมากร่าง! หนุุ่มรุ่นพี่สุดทนเตือนไม่ฟังถูกด่าถึงบุพการี ใช้เหล็กแทงหลังเจ็บสาหัส 4 พ.ย.364 สมาคมกู้ภัยสว่างบุญช่วยเหลือจังหวัดตราด ได้รับแจ้งมีเหตุทะเลาะวิวาท ที่สะพานบ้านท่าแพ ต.เนินทราย อ.เมือง จ.ตราด หลังรับแจ้งได้ส่งกำลังอาสากู้ภัยเดินทางไปยังที่เกิดเหตุตรวจสอบเหตุเบื้องต้น พร้อมประสานตำรวจสายตรวจ สภ.เมืองตราด ร่วมตรวจสอบที่เกิดเหตุในที่เกิดเหตุพบชาวบ้านจำนวนมา ยืนมุงดูเหตุการณ์จำนวนมาก บนสะพานบนนายเล อายุ 20 ปี แรงงานประมงต่างชาติ ชาวกัมพูชา มีร่องรอยถูกเหล็กขูดชาร์ปแทงบริเวณหลัง ใต้เคียงต้นคอ มีเลือดออกจำนวนมาก เจ้าหน้าที่กู้ภัยจึงปฐมพยาบาลเบื้องต้น ก่อนประสานรถกู้ชีพโรงพยาบาลตราด เดินทางรับผู้บาดเจ็บ เนื่องจากมีอาการหายใจติดขัด เมื่อ ร.ต.อ.ไชยา สนั่นเมือง หัวหน้าตำรวจสายตรวจ สภ.เมืองตราด พร้อมตำรวจสายตรวจจำนวน 5 นาย เดินทางมาถึงที่เกิดเหตุ ได้ให้นายที อายุ 33 ปี ลูกเรือประมง ที่อยู่ในเหตุการณ์ ไปเรียกตัวนายเชียม เฟียรุน อายุ 32 ปี ผู้ก่อเหตุมามอบตัว ซึ่งนายเชียม เดินออกจากเรือมา มอบตัวกับตำรวจโดยดีไม่มีการขัดขืน จากนั้น ตำรวจให้นายเชียม ชี้จุดเกิดเหตุ ที่ใช้เหล็กขูดชาร์ปแทงนายเล ซึ่งจุดเกิดเหตุอยู่บนเรือประมงที่ผู้ก่อเหตุและผู้บาดเจ็บทำงานด้วยกัน พบรอยเลือดจำนวนมากบนเรือประมง นอกจากนี้ยังพบการตั้งวงนั่งดื่มสุราของแรงงานประมงด้วย นายที กล่าวว่า ผู้ก่อเหตุและผู้บาดเจ็บ เป็นญาติ เป็นลูกพี่ลูกน้องกัน ก่อนเกิดเหตุได้ทั้งดื่มสุรากันตามปกติ จากนั้นทั้งแยกย้ายไปทำงาน กระทั่งสองคนมีปากเสียงกันอย่างรุนแรง ก่อนที่นายเชียมจะเดินไปหยิบเหล็กขูดชาร์ปมาแทง ส่วนนายเจม ร่ม อายุ 34 ปี หัวหน้าคนงาน กล่าวว่า หลังจากที่ตนเองสั่งงานมอบหมายงานให้ลูกน้องทั้งหมดแล้ว ได้แยกย้ายกันไปทำงานตามปกติ ไม่นายก็ได้ยินเสียงทะเลาวิวาทกันอย่างรุนแรง จึฃเดินไปดู ก็พบว่านายเลและนายเชียม มีเรื่องกัน ส่วนสาเหตุนั้นนายเชียมไม่พอใจที่นายเล พูดถึงญาติพี่น้อง ขณะที่นายเชียม ยอมรับว่า ตนเองก่อเหตุแทงนายเลจริง เนื่องจาก นายเล มีพฤติกรรม ที่ชอบด่าพ่อแม่ หลังจากดื่มเหล้า ซึ่งตนเองในฐานะรุ่นพี่พยายามพูดคุยและเตือนนายเล ที่เป็นรุ่นน้องในเรื่องนี้แล้วหลายครั้งแล้ว และวันนี้ก่อนเกิดเหตุทั้งหมดได้นั่งดื่มสุรากันตามปกติ โดยนายเลดื่มเยอะกว่าใคร ส่วนตัวเองดื่มไม่มาก เพราะยังต้องทำงาน เมื่อนายเล เริ่มเมา ก็เริ่มพูดถึงพ่อแม่ตนเองแถมด่าไปด้วย ตนเองทนไม่ไหว จึงเดินไปหยิบเหล็กขูดชาร์ปแทงที่หลังนายเล แล้วเกิดชุลมุน ทำให้เหล็กขูดชาร์ป ตกลงไปในแม่น้ำตราดหลังแทงแล้วตนเองก็เข้าช่วยเหลือนายเล ด้วยความเป็นห่วง ช่วยปฐมพยาบาลเบื้องต้น ช่วยห้ามเลือด และก็ไม่หนีไปไหน รอมอบตัวกับตำรวจ และไม่ถือโทษโกรธนายเล เพราะตนเองทำไปด้วยความโมโห และยอมรับผิดกับสิ่งที่ทำลงไป. -008,https://www.naewna.com/local/613600,2021_11_04
