title,summary,link,published
“พระมหาไพรวัลย์” เผย แม้จะทำหลายอย่างไม่เหมาะสม แต่ไม่เคยนั่งเครื่องบินไปดูบอลต่างประเทศ!,“พระมหาไพรวัลย์” เผย แม้จะทำหลายอย่างไม่เหม […] The post “พระมหาไพรวัลย์” เผย แม้จะทำหลายอย่างไม่เหมาะสม แต่ไม่เคยนั่งเครื่องบินไปดูบอลต่างประเทศ! appeared first on มติชนออนไลน์.,https://www.matichon.co.th/education/news_3019235,2021_10_31
ราษฎร-แนวร่วมพรึบแยกราชประสงค์ ‘ไอลอว์’ ตั้งซุ้มล่าหมื่นชื่อยกเลิก 112 จับตาไฮไลต์ 1 ทุ่ม,ราษฎร-แนวร่วมพรึบแยกราชประสงค์ ‘ไอลอว์’ ตั้งซุ้มล่าหมื่ […] The post ราษฎร-แนวร่วมพรึบแยกราชประสงค์ ‘ไอลอว์’ ตั้งซุ้มล่าหมื่นชื่อยกเลิก 112 จับตาไฮไลต์ 1 ทุ่ม appeared first on มติชนออนไลน์.,https://www.matichon.co.th/politics/news_3019238,2021_10_31
‘อนุทิน’ ลั่นพรุ่งนี้พร้อมเปิดประเทศ-เรียน สถานการณ์ ‘เชียงใหม่’ ไม่กระทบ จ่อตรวจเข้มร้านอาหาร,‘อนุทิน’ ลั่น! 1 พ.ย.พร้อมเปิดเรียน-เปิด ปท […] The post ‘อนุทิน’ ลั่นพรุ่งนี้พร้อมเปิดประเทศ-เรียน สถานการณ์ ‘เชียงใหม่’ ไม่กระทบ จ่อตรวจเข้มร้านอาหาร appeared first on มติชนออนไลน์.,https://www.matichon.co.th/local/quality-life/news_3019236,2021_10_31
ปิดฉากศึกมวยไทยสมัครเล่น ปปท. ‘ศักดิ์ชาย’ พอใจ เตรียมจัดแมตช์นานาชาติ,ปิดฉากศึกมวยไทยสมัครเล่น ปปท. ‘ศักดิ์ชาย’ พ […] The post ปิดฉากศึกมวยไทยสมัครเล่น ปปท. ‘ศักดิ์ชาย’ พอใจ เตรียมจัดแมตช์นานาชาติ appeared first on มติชนออนไลน์.,https://www.matichon.co.th/sport/news_3019294,2021_10_31
‘โค้ชโย่ง’ โล่งใจ ‘ช้างศึกยู-23’ เข้ารอบสุดท้าย ยันถ้าได้ชุดเต็มผลงานดีกว่านี้,‘โค้ชโย่ง’ โล่งใจ ‘ช้างศึกยู-23’ เข้ารอบสุดท้าย ยันถ้าไ […] The post ‘โค้ชโย่ง’ โล่งใจ ‘ช้างศึกยู-23’ เข้ารอบสุดท้าย ยันถ้าได้ชุดเต็มผลงานดีกว่านี้ appeared first on มติชนออนไลน์.,https://www.matichon.co.th/sport/footballlocal/news_3019293,2021_10_31
‘อนุทิน’ จับมือ 5 กระทรวงปฏิรูประบบสาธารณสุขไทยด้วยนวัตกรรม-ดิจิทัล ตั้งเป้าปี’65 ปชช.อยู่ร่วมโควิดได้,เมื่อวันที่ 31 ตุลาคม ที่โรงแรมบัดดี้ โอเรียนทอล ริเวอร […] The post ‘อนุทิน’ จับมือ 5 กระทรวงปฏิรูประบบสาธารณสุขไทยด้วยนวัตกรรม-ดิจิทัล ตั้งเป้าปี’65 ปชช.อยู่ร่วมโควิดได้ appeared first on มติชนออนไลน์.,https://www.matichon.co.th/politics/news_3019284,2021_10_31
‘นอร์เวย์’ หวังทั่วโลกแบน ‘ฟุตบอลโลก2022’,‘นอร์เวย์’ หวังทั่วโลกแบน ‘ฟุตบอลโลก2 […] The post ‘นอร์เวย์’ หวังทั่วโลกแบน ‘ฟุตบอลโลก2022’ appeared first on มติชนออนไลน์.,https://www.matichon.co.th/sport-slide/news_3019239,2021_10_31
‘โตโยต้า กาซู เรซซิ่ง’ คว้าแชมป์สนามประเดิม ‘ไทยแลนด์ ซุปเปอร์ ซีรีส์’,‘โตโยต้า กาซู เรซซิ่ง’ คว้าแชมป์สนามประเดิม […] The post ‘โตโยต้า กาซู เรซซิ่ง’ คว้าแชมป์สนามประเดิม ‘ไทยแลนด์ ซุปเปอร์ ซีรีส์’ appeared first on มติชนออนไลน์.,https://www.matichon.co.th/sport/news_3019301,2021_10_31
“นฤมล” ยัน ความขัดแย้งภายใน “พปชร.” สงบจบหมดแล้ว,“นฤมล” ยัน ความขัดแย้งภายใน “พปชร.” สงบจบหม […] The post “นฤมล” ยัน ความขัดแย้งภายใน “พปชร.” สงบจบหมดแล้ว appeared first on มติชนออนไลน์.,https://www.matichon.co.th/politics/news_3019277,2021_10_31
‘กฤษณะ’ เผยประสานผู้จัดม็อบ 31 ตุลา ไม่ทำกิจกรรมส่งผลกระทบ ปชช. ตอบปม คฝ.แต่งกากีเข้าพื้นที่,รองโฆษก ตร. เผยตำรวจประสานผู้จัดงานแยกราชประสงค์ ไม่ทำก […] The post ‘กฤษณะ’ เผยประสานผู้จัดม็อบ 31 ตุลา ไม่ทำกิจกรรมส่งผลกระทบ ปชช. ตอบปม คฝ.แต่งกากีเข้าพื้นที่ appeared first on มติชนออนไลน์.,https://www.matichon.co.th/local/crime/news_3019286,2021_10_31
ตั้งเวทีแยกราชประสงค์ ‘เมนู’ ปราศรัย เชื่อในปชช. มั่นใจวันหนึ่งต้องชนะ หนุ่มตะโกนลั่นประตูน้ำ ‘ตร.ทำร้ายปชช.’,เมื่อวันที่ 31 ตุลาคม ที่แยกราชประสงค์ ถนนราชดำริ เขตปท […] The post ตั้งเวทีแยกราชประสงค์ ‘เมนู’ ปราศรัย เชื่อในปชช. มั่นใจวันหนึ่งต้องชนะ หนุ่มตะโกนลั่นประตูน้ำ ‘ตร.ทำร้ายปชช.’ appeared first on มติชนออนไลน์.,https://www.matichon.co.th/politics/news_3019291,2021_10_31
‘สดมภ์’ ผงาดคว้าแชมป์กอล์ฟชิงถ้วยพระราชทาน ร.9,‘สดมภ์’ ผงาดคว้าแชมป์กอล์ฟชิงถ้วยพระราชทาน […] The post ‘สดมภ์’ ผงาดคว้าแชมป์กอล์ฟชิงถ้วยพระราชทาน ร.9 appeared first on มติชนออนไลน์.,https://www.matichon.co.th/sport-slide/news_3019338,2021_10_31
“สุดารัตน์” ควง ‘สุรวุฒิ เชิดชัย’ นำทีม ทสท. ลงเรือเยี่ยมชาวโคราชที่ประสบภัยน้ำท่วม เผย 3 นโยบาย ดูแล คนตัวเล็ก-ชาวนา-ผู้สูงอายุ,เมื่อวันที่ 31 ตุลาคม ที่อำเภอชุมพวง จังหวัดนครราชสีมา […] The post “สุดารัตน์” ควง ‘สุรวุฒิ เชิดชัย’ นำทีม ทสท. ลงเรือเยี่ยมชาวโคราชที่ประสบภัยน้ำท่วม เผย 3 นโยบาย ดูแล คนตัวเล็ก-ชาวนา-ผู้สูงอายุ appeared first on มติชนออนไลน์.,https://www.matichon.co.th/politics/news_3019314,2021_10_31
‘นฤมล’ ผนึก ‘ทีม พปชร.ดินแดง-สมาคมแลกเปลี่ยนฯ’ มอบถุงยังชีพ “เราไม่ทิ้งกัน” ย้ำ มุ่งดูแลชาวกทม.แม้พื้นที่ที่ไม่มีส.ส.,เมื่อเวลา 15.00 น. วันที่ 31 ตุลาคม ที่โดมสนามกีฬาห้วยข […] The post ‘นฤมล’ ผนึก ‘ทีม พปชร.ดินแดง-สมาคมแลกเปลี่ยนฯ’ มอบถุงยังชีพ “เราไม่ทิ้งกัน” ย้ำ มุ่งดูแลชาวกทม.แม้พื้นที่ที่ไม่มีส.ส. appeared first on มติชนออนไลน์.,https://www.matichon.co.th/politics/news_3019341,2021_10_31
สภ.คอหงส์ แจงปมเอกสารเช็กชื่อ ตร.ยังไม่กดไลค์เพจ ยอมรับสื่อสารผิดพลาด ไม่มีเจตนาอื่น,สภ.คอหงส์ แจงปมเอกสารเช็กชื่อ ตร.ยังไม่กดไลค์เพจ ยอมรับ […] The post สภ.คอหงส์ แจงปมเอกสารเช็กชื่อ ตร.ยังไม่กดไลค์เพจ ยอมรับสื่อสารผิดพลาด ไม่มีเจตนาอื่น appeared first on มติชนออนไลน์.,https://www.matichon.co.th/local/crime/news_3019357,2021_10_31
พรุ่งนี้ค่อยเติม น้ำมัน “ดีเซล” ปรับลด 0.15  บาท/ลิตร!,พรุ่งนี้ค่อยเติม น้ำมัน “ดีเซล” ปรับลด 0.15 […] The post พรุ่งนี้ค่อยเติม น้ำมัน “ดีเซล” ปรับลด 0.15 บาท/ลิตร! appeared first on มติชนออนไลน์.,https://www.matichon.co.th/economy/news_3019320,2021_10_31
‘ปูน ทะลุฟ้า’ ยันยกเลิก 112 คือฉันทามติปชช. ‘บอย ธัชพงศ์’ จี้ ยุติผูกขาดประวัติศาสตร์,เมื่อวันที่ 31 ตุลาคม ที่แยกราชประสงค์ ถนนราชดำริ เขตปท […] The post ‘ปูน ทะลุฟ้า’ ยันยกเลิก 112 คือฉันทามติปชช. ‘บอย ธัชพงศ์’ จี้ ยุติผูกขาดประวัติศาสตร์ appeared first on มติชนออนไลน์.,https://www.matichon.co.th/politics/news_3019373,2021_10_31
สะพัด ‘คิมอูบิน – ชินมินอา’ เตรียมวิวาห์ พ.ย.นี้,สะพัด ‘คิมอูบิน – ชินมินอา’ เตรียมวิวาห์ พ.ย.นี้ กำลังก […] The post สะพัด ‘คิมอูบิน – ชินมินอา’ เตรียมวิวาห์ พ.ย.นี้ appeared first on มติชนออนไลน์.,https://www.matichon.co.th/entertainment/interstars/news_3019365,2021_10_31
ว่าที่พ่อเมืองเพชรบุรี ยันพร้อมเป็นเจ้าภาพจัดศึกเสือภูเขาทางเรียบ-Bike4All ในปีหน้า,ว่าที่พ่อเมืองเพชรบุรี ยันพร้อมเป็นเจ้าภาพจัดศึกเสือภูเ […] The post ว่าที่พ่อเมืองเพชรบุรี ยันพร้อมเป็นเจ้าภาพจัดศึกเสือภูเขาทางเรียบ-Bike4All ในปีหน้า appeared first on มติชนออนไลน์.,https://www.matichon.co.th/sport-slide/news_3019407,2021_10_31
ในหลวง พระราชินี ทรงบำเพ็ญพระราชกุศลถวายผ้าพระกฐิน วัดโสมนัสวิหาร,ในหลวง พระราชินี ทรงบำเพ็ญพระราชกุศลถวายผ้าพระกฐิน วัดโ […] The post ในหลวง พระราชินี ทรงบำเพ็ญพระราชกุศลถวายผ้าพระกฐิน วัดโสมนัสวิหาร appeared first on มติชนออนไลน์.,https://www.matichon.co.th/court-news/news_3018630,2021_10_31
ส่องนางเอกดัง แต่งหลอนรับวันฮาโลวีน มีทั้งสวย สยอง และเซ็กซี่,ส่องนางเอกดัง แต่งหลอนรับวันฮาโลวีน มีทั้งสวย สยอง และเ […] The post ส่องนางเอกดัง แต่งหลอนรับวันฮาโลวีน มีทั้งสวย สยอง และเซ็กซี่ appeared first on มติชนออนไลน์.,https://www.matichon.co.th/entertainment/news_3019377,2021_10_31
กรมปศุสัตว์ ขยายกัญชง-กัญชา-กระท่อม สู่ธุรกิจอาหารสัตว์,กรมปศุสัตว์ ขยายกัญชง-กัญชา-กระท่อม สู่ธุรกิจอาหารสัตว์ […] The post กรมปศุสัตว์ ขยายกัญชง-กัญชา-กระท่อม สู่ธุรกิจอาหารสัตว์ appeared first on มติชนออนไลน์.,https://www.matichon.co.th/economy/news_3019462,2021_10_31
4 องค์กรเอกชน จัดส่งถุงสู้ภัยโควิดกว่า 400 ถุง แจกปชช. 3 จังหวัดชายแดนใต้ หลังมีท่าทีโควิดจะกลับมาระบาดอีกครั้ง,เมื่อวันที่ 31 ตุลาคม ผู้สื่อข่าวรายงานว่า จากสถานการณ์ […] The post 4 องค์กรเอกชน จัดส่งถุงสู้ภัยโควิดกว่า 400 ถุง แจกปชช. 3 จังหวัดชายแดนใต้ หลังมีท่าทีโควิดจะกลับมาระบาดอีกครั้ง appeared first on มติชนออนไลน์.,https://www.matichon.co.th/local/news_3019461,2021_10_31
ฝนถล่ม ไมค์พัง ม็อบยังอยู่ ‘ยิ่งชีพ’ หวัง กม.ชัดเจน-คุยบนโต๊ะ ไม่ใช่เรียกร้องสังคมที่ดีแล้วต้องติดคุก,ฝนถล่ม ไมค์พัง ม็อบยังอยู่ ‘ยิ่งชีพ’ ปราศรัย หวัง กม.ชั […] The post ฝนถล่ม ไมค์พัง ม็อบยังอยู่ ‘ยิ่งชีพ’ หวัง กม.ชัดเจน-คุยบนโต๊ะ ไม่ใช่เรียกร้องสังคมที่ดีแล้วต้องติดคุก appeared first on มติชนออนไลน์.,https://www.matichon.co.th/politics/news_3019437,2021_10_31
บวงสรวงขอขมา “ปู่ศรีสุทโธ-ย่าศรีปทุมมา” ก่อนเปิด ‘คำชะโนด’ ให้นักท่องเที่ยวกราบไหว้ขอโชคลาภ 1 พ.ย.นี้,เมื่อวันที่ 31 ตุลาคม 2564 นายวิรุตม์ วิศิษฏ์ศิลป์ นายอ […] The post บวงสรวงขอขมา “ปู่ศรีสุทโธ-ย่าศรีปทุมมา” ก่อนเปิด ‘คำชะโนด’ ให้นักท่องเที่ยวกราบไหว้ขอโชคลาภ 1 พ.ย.นี้ appeared first on มติชนออนไลน์.,https://www.matichon.co.th/region/news_3019401,2021_10_31
‘เลิศพงศ์’ ผงาดแชมป์รุ่นใหญ่ เจ็ตสกีโปรทัวร์ สนามเปิดฤดูกาล,‘เลิศพงศ์’ ผงาดแชมป์รุ่นใหญ่ เจ็ตสกีโปรทัวร […] The post ‘เลิศพงศ์’ ผงาดแชมป์รุ่นใหญ่ เจ็ตสกีโปรทัวร์ สนามเปิดฤดูกาล appeared first on มติชนออนไลน์.,https://www.matichon.co.th/sport/news_3019363,2021_10_31
พรุ่งนี้! โมเดอร์นา 5.6 แสนโดสแรกถึงไทย อภ.-รพ.เอกชน ไลฟ์สดรับมอบที่สุวรรณภูมิ,เมื่อวันที่ 31 ตุลาคม ผู้สื่อข่าวรายงานความคืบหน้าการจั […] The post พรุ่งนี้! โมเดอร์นา 5.6 แสนโดสแรกถึงไทย อภ.-รพ.เอกชน ไลฟ์สดรับมอบที่สุวรรณภูมิ appeared first on มติชนออนไลน์.,https://www.matichon.co.th/local/quality-life/news_3019477,2021_10_31
ชาวนนท์ต้องรอก่อน ผู้ว่าฯให้ร้านขายอาหารหรือเครื่องดื่มเปิดได้ถึง 5 ทุ่ม แต่ห้ามดื่มในร้าน,ชาวนนท์ฝันสลาย! ผู้ว่าฯออกคำสั่งผ่อนคลาย ร้านจำหน่ายอาห […] The post ชาวนนท์ต้องรอก่อน ผู้ว่าฯให้ร้านขายอาหารหรือเครื่องดื่มเปิดได้ถึง 5 ทุ่ม แต่ห้ามดื่มในร้าน appeared first on มติชนออนไลน์.,https://www.matichon.co.th/region/news_3019396,2021_10_31
สยามอะเมซิ่งพาร์ค เตรียมเปิดให้บริการ 3 พ.ย.,สยามอะเมซิ่งพาร์ค เตรียมเปิดให้บริการ 3 พ.ย. เมื่อวันที […] The post สยามอะเมซิ่งพาร์ค เตรียมเปิดให้บริการ 3 พ.ย. appeared first on มติชนออนไลน์.,https://www.matichon.co.th/economy/news_3019433,2021_10_31
‘บิ๊กตู่’ ควงดอน-วราวุธ ถก ‘COP 26’ เมืองกลาสโกว์ สหราชอาณาจักร,‘บิ๊กตู่’ ควงดอน-วราวุธ ถก ‘COP 26 […] The post ‘บิ๊กตู่’ ควงดอน-วราวุธ ถก ‘COP 26’ เมืองกลาสโกว์ สหราชอาณาจักร appeared first on มติชนออนไลน์.,https://www.matichon.co.th/politics/news_3019492,2021_10_31
“บิ๊กตู่” บอก เสียดายไม่ได้อยู่ร่วมวันเปิดประเทศ เตือนอย่าสนุกจนเลยเถิด เชื่อปท.จะรุ่งเรืองด้วยมือคนไทย,เมื่อวันที่ 31 ตุลาคม ที่ บน.6 พล.อ.ประยุทธ์ จันทร์โอชา […] The post “บิ๊กตู่” บอก เสียดายไม่ได้อยู่ร่วมวันเปิดประเทศ เตือนอย่าสนุกจนเลยเถิด เชื่อปท.จะรุ่งเรืองด้วยมือคนไทย appeared first on มติชนออนไลน์.,https://www.matichon.co.th/politics/news_3019524,2021_10_31
‘ทะลุฟ้า’ ลั่นหนทางริบหรี่ก็จะเดิน ชี้หยุดกระแสกาลเวลาไม่ได้ ‘ทะลุแก๊ซ’ สมทบร้องเพลงชาติ ชู 3 นิ้ว จี้เลิก 112,‘ทะลุฟ้า’ ลั่นหนทางริบหรี่ก็จะเดิน ชี้หยุดกระแสกาลเวลาไ […] The post ‘ทะลุฟ้า’ ลั่นหนทางริบหรี่ก็จะเดิน ชี้หยุดกระแสกาลเวลาไม่ได้ ‘ทะลุแก๊ซ’ สมทบร้องเพลงชาติ ชู 3 นิ้ว จี้เลิก 112 appeared first on มติชนออนไลน์.,https://www.matichon.co.th/politics/news_3019516,2021_10_31
สธ.เข้าช่วยผู้ติดเชื้อโควิดที่บางสัก จัดยา-เวชภัณฑ์ดูแลที่บ้านครบถ้วน,เมื่อวันที่ 31 ตุลาคม นพ.สุเทพ เพชรมาก ผู้ตรวจราชการกระ […] The post สธ.เข้าช่วยผู้ติดเชื้อโควิดที่บางสัก จัดยา-เวชภัณฑ์ดูแลที่บ้านครบถ้วน appeared first on มติชนออนไลน์.,https://www.matichon.co.th/local/news_3019485,2021_10_31
ส.แอลกอฮอล์ แนะนักกิน-ดื่มมองหาเครื่องหมาย SHA เพื่อความปลอดภัย,ส.แอลกอฮอล์ แนะนักกิน-นักดื่ม อย่างปลอดภัย ให้มองหาเครื […] The post ส.แอลกอฮอล์ แนะนักกิน-ดื่มมองหาเครื่องหมาย SHA เพื่อความปลอดภัย appeared first on มติชนออนไลน์.,https://www.matichon.co.th/economy/news_3019584,2021_10_31
รวบแล้ว!สาวแบงก์ปลอมลายเซ็นแอบถอนเงินลูกค้าร่วม 20 ล้าน,เมื่อวันที่ 31 ตุลาคม พล.ต.ต.นพศิลป์ พูลสวัสดิ์ ผู้บังค […] The post รวบแล้ว!สาวแบงก์ปลอมลายเซ็นแอบถอนเงินลูกค้าร่วม 20 ล้าน appeared first on มติชนออนไลน์.,https://www.matichon.co.th/news-monitor/news_3019540,2021_10_31
ในหลวง พระราชินี ทรงบำเพ็ญพระราชกุศลถวายผ้าพระกฐิน วัดสุทัศนเทพวราราม,ในหลวง พระราชินี ทรงบำเพ็ญพระราชกุศลถวายผ้าพระกฐิน วัดส […] The post ในหลวง พระราชินี ทรงบำเพ็ญพระราชกุศลถวายผ้าพระกฐิน วัดสุทัศนเทพวราราม appeared first on มติชนออนไลน์.,https://www.matichon.co.th/court-news/news_3019436,2021_10_31
