title,summary,link,published
ทริสฯ คงอันดับเครดิตองค์กร RS ที่ BBB+ แนวโน้ม Stable,บริษัท ทริสเรทติ้ง จำกัด คงอันดับเครดิตองค์กรของ บมจ.อาร์ เอส (RS) ที่ระดับ “BBB+” ด้วยแนวโน้มอันดับเครดิต “Stable” หรือ “คงที่” อันดับเครดิตดังกล่าวสะท้อนความแข็งแกร่งในธุรกิจสื่อและบันเทิงของบริษัทและความสามารถในการใช้ความแข็งแกร่งดังกล่าวพัฒนาและสร้างการเติบโตให้แก่ธุรกิจพาณิชย์ของบริษัทได้ อันดับเครดิตยังคำนึงถึงแผนของบริษัทในการลดภาระหนี้ที่เพิ่มสูงขึ้นจากการลงทุนในช่วงที่ผ่านมาและที่กำลังจะเกิดขึ้น อย่างไรก็ตาม อันดับเครดิตดังกล่าวก็ถูกลดทอนลงจากการที่บริษัทมีประสบการณ์ที่จำกัดในธุรกิจพาณิชย์ แรงกดดันจากผลกระทบของโรคติดเชื้อไวรัสโคโรนา 2019 (โรคโควิด-19) และภาวะเศรษฐกิจ รวมถึงความท้าทายที่เพิ่มขึ้นจากการเปลี่ยนแปลงอย่างต่อเนื่องในธุรกิจสื่อ ประเด็นสำคัญที่กำหนดอันดับเครดิต – ธุรกิจพาณิชย์ได้รับผลกระทบจากโรคโควิด-19 ธุรกิจพาณิชย์ของบริษัทได้รับผลกระทบจากโรคโควิด-19 ที่ส่งผลต่อความต้องการจับจ่ายใช้สอยและกำลังซื้อของผู้บริโภคในช่วงหลายไตรมาสที่ผ่านมา อย่างไรก็ตาม ทริสเรทติ้งคาดว่าผลประกอบการจากธุรกิจพาณิชย์ของบริษัทจะปรับตัวดีขึ้นหลังจากที่สถานการณ์ของโรคโควิด-19 เป็นไปในทิศทางที่ดีขึ้น รวมถึงแผนการตลาดและการเปิดตัวสินค้าใหม่ ๆ ภายใต้สมมติฐานพื้นฐานของทริสเรทติ้งประมาณการว่ารายได้จากธุรกิจพาณิชย์ของบริษัทจะเติบโตเล็กน้อยในปี 2564 และจะเติบโตประมาณ 10%-20% ต่อปีในช่วงปี 2565-2566 โดยการเติบโตนั้นคาดว่าจะมาจากการที่บริษัทออกผลิตภัณฑ์ใหม่ ๆ เป็นหลัก โดยในครึ่งแรกของปี 2564 บริษัทได้เปิดตัวสินค้าใหม่ ได้แก่ ผลิตภัณฑ์อาหารเสริม (Food Supplement) และเครื่องดื่มเสริมอาหาร (Functional Drink) แต่ยอดขายของผลิตภัณฑ์ทั้ง 2 ประเภทได้รับผลกระทบจากความต้องการจับจ่ายใช้สอยที่ซบเซา ซึ่งทริสเรทติ้งคาดว่ายอดขายจะปรับตัวดีขึ้นในปีหน้าจากการคาดการณ์ว่ากิจกรรมทางสังคมและเศรษฐกิจจะกลับเข้าสู่ภาวะปกติมากขึ้น […] The post ทริสฯ คงอันดับเครดิตองค์กร RS ที่ BBB+ แนวโน้ม Stable appeared first on สำนักข่าวอินโฟเควสท์.,https://www.infoquest.co.th/2021/142418,2021_11_04
ก.ล.ต.เปิดข้อมูลการซื้อขาย DW สถานะ deep OTM โอกาสกำไรในความผันผวน,"นายพงศธร ปริญญาวุฒิชัย ฝ่ายวิจัย สำนักงานคณะกรรมการกำกับหลักทรัพย์และตลาดหลักทรัพย์ (ก.ล.ต.) นำเสนอบทความ เรื่อง “เปิดข้อมูลการซื้อขาย DW ในตลาดหุ้นไทย สถานะ deep OTM โอกาสกำไรในความผันผวน?” โดยระบุว่า เมื่อปี 63 ใบสำคัญ แสดงสิทธิอนุพันธ์ (derivative warrants) หรือ DW มีมูลค่าการซื้อขายอยู่ที่ 1.65 ล้านล้านบาท ทำสถิติสูงที่สุดในรอบ 11 ปี และยัง มีแนวโน้มที่จะสูงขึ้นอย่างต่อเนื่อง โดยตั้งแต่ต้นปีจนถึงสิ้นเดือน ก.ย.64 มีมูลค่าซื้อขายแล้ว1.58 ล้านล้านบาท ขณะที่จำนวนบัญชีที่มีซื้อขาย (active account) ก็เพิ่มมากขึ้นเช่นกัน เพราะจากการศึกษาพฤติกรรมและลักษณะการซื้อขาย ผ่านตลาดหลักทรัพย์ โดยใช้ข้อมูล big data ของการซื้อขายรายธุรกรรม (transaction data) พบว่า ในปี 59-62 มีจำนวนบัญชีที่มี ซื้อขาย DW อยู่ประมาณ 40,000-50,000 […] The post ก.ล.ต.เปิดข้อมูลการซื้อขาย DW สถานะ deep OTM โอกาสกำไรในความผันผวน appeared first on สำนักข่าวอินโฟเควสท์.",https://www.infoquest.co.th/2021/142411,2021_11_04
“ชาร์ป” เผยกำไรสุทธิเดือนเม.ย.-ก.ย. พุ่งเกือบ 79% รับธุรกิจจอแสดงผล-เครื่องใช้ไฟฟ้าเพิ่มขึ้น,บริษัทชาร์ป คอร์ปเปิดเผยในวันนี้ว่า กำไรสุทธิของบริษัทในช่วงเดือนเม.ย.-ก.ย. พุ่งขึ้น 78.9% เมื่อเทียบเป็นรายปี แตะที่ระดับ 4.252 หมื่นล้านเยน (372 ล้านดอลลาร์สหรัฐ) โดยได้ปัจจัยหนุนจากกลุ่มธุรกิจจอแสดงผลและเครื่องใช้ไฟฟ้าภายในบ้าน ส่วนยอดขายในช่วงครึ่งแรกของปีงบการเงิน 2564 ซึ่งสิ้นสุดในเดือนมี.ค.นั้น เพิ่มขึ้น 6.5% แตะที่ 1.22 ล้านล้านเยน ขณะที่กำไรจากการดำเนินงานเพิ่มขึ้น 31.6% สู่ระดับ 3.902 หมื่นล้านเยน ชาร์ปคงระดับการคาดการณ์ผลประกอบการปีงบการเงิน 2564 ไว้ที่ระดับเดิม โดยระบุว่าผลกำไรสุทธิจะเพิ่มขึ้นจากปีก่อน 42.7% มาอยู่ที่ 7.6 หมื่นล้านเยน นอกจากนี้ บริษัทยังคงตัวเลขคาดการณ์กำไรจากการดำเนินงานไว้ที่ 1.01 แสนล้านเยน เพิ่มขึ้น 21.5% และคาดว่าจะมียอดขายอยู่ที่ 2.55 ล้านล้านเยน เพิ่มขึ้น 5.1% โดย สำนักข่าวอินโฟเควสท์ (04 พ.ย. 64) The post “ชาร์ป” เผยกำไรสุทธิเดือนเม.ย.-ก.ย. พุ่งเกือบ 79% รับธุรกิจจอแสดงผล-เครื่องใช้ไฟฟ้าเพิ่มขึ้น appeared first on สำนักข่าวอินโฟเควสท์.,https://www.infoquest.co.th/2021/142436,2021_11_04
ชาวเมียนมาฉีดวัคซีนโควิด-19 ครบโดสกว่า 7.39 ล้านคนแล้ว,"แถลงการณ์จากกระทรวงสาธารณสุขเมียนมา เมื่อวันพุธ (3 พ.ย.) ระบุว่ามีประชาชนฉีดวัคซีนป้องกันโรคโควิด-19 ครบโดสแล้วกว่า 7.39 ล้านคน และมีผู้ฉีดวัคซีนหนึ่งโดสกว่า 6.08 ล้านคน เมื่อนับถึงวันอังคาร (2 พ.ย.) สำนักข่าวซินหัวรายงานว่า เมียนมารายงานการตรวจพบผู้ป่วยโรคโควิด-19 เพิ่ม 955 ราย และผู้ป่วยเสียชีวิต 16 ราย ทำให้มีผู้ป่วยสะสม 502,979 ราย และผู้ป่วยเสียชีวิตรวม 18,744 ราย เมื่อนับถึงวันพุธ (3 พ.ย.) ขณะเดียวกันเมียนมามีผู้ป่วยโรคโควิด-19 ที่หายป่วยและออกจากโรงพยาบาลรวม 472,364 ราย และจัดการทดสอบตัวอย่างเพื่อตรวจโรคกว่า 4.93 ล้านรายการแล้ว โดย สำนักข่าวอินโฟเควสท์ (04 พ.ย. 64) The post ชาวเมียนมาฉีดวัคซีนโควิด-19 ครบโดสกว่า 7.39 ล้านคนแล้ว appeared first on สำนักข่าวอินโฟเควสท์.",https://www.infoquest.co.th/2021/142442,2021_11_04
“เครดิตสวิส” เผยกำไรสุทธิร่วง 21% ใน Q3 พร้อมคาดขาดทุนใน Q4,"เครดิตสวิส (Credit Suisse) ซึ่งเป็นวาณิชธนกิจระดับโลกของสวิตเซอร์แลนด์ รายงานผลกำไรสุทธิ ลดลง 21% สู่ 434 ล้านฟรังก์สวิส (476 ล้านดอลลาร์) ในไตรมาส 3 โดยได้รับผลกระทบจากอัตราภาษีที่สูงขึ้น และค่าใช้จ่ายจำนวน 214 ล้านฟรังก์สวิสเพื่อดำเนินการแก้ข้อกล่าวหาเรื่องการทุจริตที่เกี่ยวข้องกับการปล่อยเงินกู้ให้แก่ประเทศโมซัมบิกซึ่งทางเครดิตสวิสได้ช่วยดำเนินการ สำนักข่าวรอยเตอร์รายงานว่า เครดิตสวิสคาดการณ์ว่า การด้อยค่าของสินทรัพย์ในไตรมาส 4 จะอยู่ที่ราว 1.6 พันล้านฟรังก์สวิสในส่วนที่เกี่ยวกับค่าความนิยม (goodwill) ที่เหลืออยู่ในงบดุลซึ่งส่วนใหญ่เกี่ยวข้องกับการเข้าซื้อกิจการของโดนัลด์สัน, ลัฟกิน แอนด์ เจนเรตต์ (Donaldson, Lufkin & Jenrette) ในปี 2543 และคาดว่าบริษัทจะรายงานยอดขาดทุนสุทธิในไตรมาส 4 โดย สำนักข่าวอินโฟเควสท์ (04 พ.ย. 64) The post “เครดิตสวิส” เผยกำไรสุทธิร่วง 21% ใน Q3 พร้อมคาดขาดทุนใน Q4 appeared first on สำนักข่าวอินโฟเควสท์.",https://www.infoquest.co.th/2021/142440,2021_11_04
ครม.เคาะงบกว่า 3 พันลบ.หนุนงานวิจัยพัฒนาวัคซีนโควิดของไทย ChulaCov19-วัคซีนใบยา,"น.ส.รัชดา ธนาดิเรก รองโฆษกประจำสำนักนายกรัฐมนตรี เปิดเผยว่า ที่ประชุมคณะรัฐมนตรี (ครม.) มีมติอนุมัติโครงการวิจัยและพัฒนาวัคซีนโควิด19 ChulaCov19 mRNA เพื่อทำการทดสอบทางคลินิกระยะที่ 3 และการผลิตเพื่อขึ้นทะเบียนวัคซีน เพื่อใช้ในภาวะฉุกเฉิน กรอบวงเงิน 2,316 ล้านบาท และเห็นชอบในหลักการโครงการวิจัยและพัฒนาวัคซีนป้องกันโรคโควิด-19 (Baiya) กรอบวงเงิน 1,309 ล้านบาท ของจุฬาลงกรณ์มหาวิทยาลัย กระทรวงการอุดมศึกษา วิทยาศาสตร์ และนวัตกรรม (อว.) โดยใช้จ่ายจากเงินกู้ภายใต้พระราชกำหนดกู้เงินเพิ่มเติมฯ พ.ศ.2564 มีรายละเอียดดังนี้ 1.โครงการวิจัยและพัฒนาวัคซีนโควิด-19 “ChulaCov19 mRNA” กรอบวงเงิน 2,316 ล้านบาท มีวัตถุประสงค์เพื่อดำเนินการทดสอบวิจัยในอาสาสมัครระยะที่ 3 เพื่อใช้ในการขึ้นทะเบียนตามเกณฑ์ที่องค์การอาหารและยา (อย.) กำหนด และเพื่อการผลิตวัคซีนสำหรับทดสอบระยะที่ 3 และเตรียมการผลิตสำหรับขึ้นทะเบียนรับรองจาก อย. ซึ่งจะเป็นประโยชน์อย่างยิ่งในการช่วยสร้างโครงสร้างพื้นฐานของการผลิตวัคซีนชนิด mRNA อย่างครบวงจร ทำให้ไทยสามารถผลิตวัคซีนโควิด-19 ใช้ได้เอง และสามารถต่อยอดเทคโนโลยีนี้สู่การผลิตวัคซีนสำหรับป้องกันโรคอื่นๆ รวมถึงโรคอุบัติใหม่ที่อาจเกิดขึ้นอีกในอนาคต ทั้งนี้ ที่ประชุมมอบหมายให้จุฬาลงกรณ์มหาวิทยาลัยดำเนินการกำหนดกลไกการกำกับติดตามและประเมินผลการดำเนินโครงการ เพื่อให้เกิดความโปร่งใสและสามารถตรวจสอบได้ 2.โครงการวิจัยและพัฒนาวัคซีนป้องกันโรคโควิด-19 […] The post ครม.เคาะงบกว่า 3 พันลบ.หนุนงานวิจัยพัฒนาวัคซีนโควิดของไทย ChulaCov19-วัคซีนใบยา appeared first on สำนักข่าวอินโฟเควสท์.",https://www.infoquest.co.th/2021/142455,2021_11_04
นายกฯ ย้ำจุดยืนกลางที่ประชุมครม. ยันไม่มีนโยบายแก้ม.112,น.ส.รัชดา ธนาดิเรก รองโฆษกประจำสำนักนายกรัฐมนตรี เปิดเผยว่า พล.อ.ประยุทธ์ จันทร์โอชา นายกรัฐมนตรีและรมว.กลาโหม ได้กล่าวถึงจุดยืนเกี่ยวกับมาตรา 112 ในที่ประชุมคณะรัฐมนตรี (ครม.)วันนี้ว่า ในนามของนายกรัฐมนตรี คณะรัฐมนตรี และพรรคร่วมรัฐบาล ไม่มีนโยบายในการแก้ไขมาตรา 112 อย่างแน่นอน โดยจะบริหารประเทศโดยยึดหลักชาติ ศาสนา และพระมหากษัตริย์ ส่วนในกรณีที่ฝ่ายค้านอภิปรายแสดงความคิดเห็นพาดพิงถึงครม.ว่า ไม่ให้ความสำคัญกับการมาตอบกระทู้ถามสดในสภานั้น เรื่องนี้นายวิษณุ เครืองาม รองนายกรัฐมนตรี ได้ชี้แจงกับนายชวน หลีกภัย ประธานสภาผู้แทนราษฎรไว้แล้วว่า เนื่องจากวันนี้เป็นการประชุมครม.กรณีพิเศษ จึงทำให้รัฐมนตรีไม่สามารถตอบกระทู้สดในสภาได้ เนื่องจากอยู่ในวาระการประชุมและรัฐมนตรีต้องชี้แจงในครม.ด้วยตัวเอง ทั้งนี้ ขอให้ฝ่ายค้านเข้าใจในความจำเป็นในจุดนี้ด้วย อย่าไปตีความ ว่า รัฐบาลไม่ได้ให้ความสำคัญกับการตอบกระทู้ เนื่องจากทุกครั้งที่ผ่านมาฝ่ายรัฐบาลก็ให้ความร่วมมือเสมอ และให้ความสำคัญต่อการชี้แจงสมาชิกสภาผู้แทนราษฎรมาโดยตลอด ซึ่งหลังจากนี้จะไม่ให้มีการประชุมครม.ในวันพฤหัสบดีอีก โดย สำนักข่าวอินโฟเควสท์ (04 พ.ย. 64) The post นายกฯ ย้ำจุดยืนกลางที่ประชุมครม. ยันไม่มีนโยบายแก้ม.112 appeared first on สำนักข่าวอินโฟเควสท์.,https://www.infoquest.co.th/2021/142451,2021_11_04
ฟิลิปปินส์เผยอัตราว่างงานเดือนก.ย.พุ่งสู่ระดับ 8.9% สูงสุดในรอบปี,สำนักงานสถิติฟิลิปปินส์ (PSA) เปิดเผยในวันนี้ว่า อัตราว่างงานในประเทศปรับตัวขึ้นสู่ระดับ 8.9% ในเดือนก.ย. แตะที่ 4.25 ล้านคน เมื่อเทียบกับ 3.88 ล้านคนในเดือนส.ค. เดนนิส มาปา หัวหน้าสำนักงานสถิติ กล่าวในการแถลงข่าวทางออนไลน์ระบุว่า อัตราว่างงานในเดือนก.ย.นับเป็นตัวเลขสูงที่สุดนับตั้งแต่เดือนม.ค.ปีนี้ สำนักงานพัฒนาเศรษฐกิจแห่งชาติ (NEDA) กล่าวว่า ฟิลิปปินส์มีอัตราว่างงานเพิ่มขึ้นในเดือนก.ย. เนื่องจากมาตรการกักตัวเพื่อควบคุมโรคโควิด-19 ที่เข้มงวด อีกทั้งภาคการเกษตรยังได้รับผลกระทบจากสภาพอากาศแปรปรวน ด้านอัตราการมีส่วนร่วมในกำลังแรงงาน (Labour Force Participation Rate) ลดลงเล็กน้อยจากระดับ 63.6% ในเดือนส.ค. มาอยู่ที่ 63.3% ในเดือนก.ย. ทั้งนี้ ฟิลิปปินส์ได้ใช้มาตรการล็อกดาวน์เฉพาะพื้นที่เพื่อลดทอนผลกระทบที่มีต่อเศรษฐกิจ โดยรัฐบาลสั่งควบคุมการเดินทางเฉพาะประชาชนที่อยู่ในชุมชนหรือในพื้นที่ที่มีคลัสเตอร์โควิด-19 เท่านั้น โดยไม่ได้ล็อกดาวน์ทั้งภูมิภาค เพื่อให้กิจกรรมทางเศรษฐกิจสามารถดำเนินต่อไปได้ โดย สำนักข่าวอินโฟเควสท์ (04 พ.ย. 64) The post ฟิลิปปินส์เผยอัตราว่างงานเดือนก.ย.พุ่งสู่ระดับ 8.9% สูงสุดในรอบปี appeared first on สำนักข่าวอินโฟเควสท์.,https://www.infoquest.co.th/2021/142447,2021_11_04
