title,summary,link,published
เอสซีจี โซลาร์รูฟ ร่วมมือสภาอุตสาหกรรม จ.ลำปาง ผลักดันการใช้พลังงานสะอาด และบริการจัดการพลังงาน,เอสซีจี โซลาร์รูฟ ร่วมมือสภาอุตสาหกรรม จ.ลำปาง ผลักดันการใช้พลังงานสะอาด และบริการจัดการพลังงาน เพื่อลดต้นทุนค่าไฟ เพิ่มกำไรให้ธุรกิจ,https://thaipublica.org/2021/11/scg-pr-4-11-2564/,2021_11_04
EXIM BANK จับมือ KBank – BBL ร่วมปล่อยกู้ “บี.กริม เพาเวอร์” 900 ล้าน ขยายธุรกิจโซลาร์ฟาร์มในกัมพูชา,EXIM BANK จับมือ KBank - BBL ร่วมสนับสนุนเงินกู้วงเงินกว่า 900 ล้านบาท ให้กลุ่มบริษัท บี.กริม เพาเวอร์ จำกัด (มหาชน) ลงทุนพัฒนาโรงไฟฟ้าพลังงานแสงอาทิตย์ 39 เมกะวัตต์ ในจังหวัดบันเตียเมียนเจย กัมพูชา โดยมีสัญญาซื้อขายไฟฟ้ากับการไฟฟ้าประเทศกัมพูชา 20 ปี เพื่อส่งเสริมการค้าและการลงทุนที่เชื่อมโยงกับเป้าหมายการพัฒนาอย่างยั่งยืน,https://thaipublica.org/2021/11/exim-bank-kbank-bbl-finance-bgrim/,2021_11_04
EXIM BANK แนะทางรอด SMEs เร่งใช้เทคโนโลยีดิจิทัล Transform ธุรกิจ รับมือ “Next Normal”,EXIM BANK เปิดให้บริการ ‘ซ่อม-สร้าง-เสริม’ ครบวงจร สนับสนุน SMEs เร่งใช้เทคโนโลยีดิจิทัล Transform ธุรกิจ ปรับกระบวนการผลิต-การค้า-การขนส่ง-Big Data เพิ่มขีดความสามารถในการแข่งขัน รับมือโลก Next Normal,https://thaipublica.org/2021/11/exim-bank-organized-seminar-help-sme/,2021_11_04
ซีไอเอ็มบี ไทย ชี้รีไฟแนนซ์ สินเชื่อบ้าน-บัตรเครดิต  หั่นภาระดอกเบี้ยลงได้กว่า 50% ทันที,ธนาคาร ซีไอเอ็มบี ไทย ชวนลูกค้าฟิตสุขภาพทางการเงินสู้โควิด เพียงรีไฟแนนซ์ สินเชื่อบ้าน-บัตรเครดิต หั่นภาระดอกเบี้ยลงได้กว่า 50% ทันที ดอกเบี้ยถูกกว่า ลดภาระหนี้เก่า ปลดล็อกเร็วขึ้น ด้วยการรีไฟแนนซ์,https://thaipublica.org/2021/11/cimbt-offers-refinance-package/,2021_11_04
บลจ. พรินซิเพิล เปิด IPO‘พรินซิเพิล เวียดนาม ไทย ออพพอร์ทูนิตี้’ 10 – 17 พ.ย.นี้,บลจ. พรินซิเพิล เดินหน้าเปิดตัวกองทุนเปิด ‘พรินซิเพิล เวียดนาม ไทย ออพพอร์ทูนิตี้’ PRINCIPAL VTOPP ชูจุดเด่นลงทุนตรงในหุ้นเวียดนาม และขยายโอกาสการลงทุนในบริษัทต่างชาติที่ดำเนินธุรกิจในเวียดนามที่ได้รับประโยชน์จาก FDI,https://thaipublica.org/2021/11/principal-to-ipo-principal-vietnam-thai-opportunity-fund/,2021_11_04
เมืองไทยประกันชีวิต คว้า “รางวัลบริษัทประกันภัยเกียรติยศสูงสุด”ควบส่งเสริมกรมธรรม์ประกันภัยเพื่อประชาชนดีเด่น,เมืองไทยประกันชีวิต สร้างประวัติศาสตร์ครั้งใหญ่ คว้า “รางวัลบริษัทประกันภัยเกียรติยศสูงสุด” รางวัลสูงสุดที่มากกว่าที่หนึ่ง นั่งแท่นบริษัทฯ ที่บริหารงานดีเด่น-แข็งแกร่งรอบด้านตลอดกาล,https://thaipublica.org/2021/11/muangthai-life-wins-hall-of-fame-awards/,2021_11_04
Money Expo Chiangmai 2021 อัดโปรแรง กู้บ้าน-กู้ส่วนบุคคล ดอกเบี้ย 0%,ข่าวประชาสัมพันธ์ งานมหกรรมการเงินเชียงใหม่ ครั้งที่ 16 […],https://thaipublica.org/2021/11/money-expo-2021-01/,2021_11_04
Cop26 สิ่งที่ประเทศพัฒนาน้อยที่สุดต้องการจากการประชุม,ประเทศกำลังพัฒนาถือเป็นกลุ่มที่มีความเสี่ยงมากที่สุดที่จะถูกทำลายจากการเปลี่ยนแปลงสภาพภูมิอากาศ (climate change) การจัดการกับความต้องการของประเทศที่เล็กกว่าและร่ำรวยน้อยกว่าเป็นสิ่งสำคัญสำหรับการประชุมสุดยอดด้านสภาพภูมิอากาศ COP26 ในกลาสโกว์ แต่ประเทศที่พัฒนาน้อยที่สุดกลับผิดหวังกับ Cop26 เพราะยังไม่มีการมอบเงิน 100 พันล้านดอลลาร์ต่อปีเพื่อช่วยประเทศยากจนในการจัดการกับการเปลี่ยนแปลงสภาพภูมิอากาศ,https://thaipublica.org/2021/11/cop26-poorest-countries-voice/,2021_11_04
"นายกฯ ย้ำจุดยืนรัฐบาลไม่มีนโยบาย แก้ ม.112-มติ ครม. จัดงบฯ 3,625 ล้าน หนุนผลิตวัคซีน “ChulaCov19-ใบยา”","นายกฯย้ำจุดยืนรัฐบาลไม่มีนโยบายแก้ไข ม.112-เผยเปิดประเทศ 3 วัน พบผู้เดินทางเข้าไทย 7,124 คน ติดโควิดฯ 6 คน-เดินหน้าตรึงราคาดีเซลไม่เกิน 30 บาท/ลิตร - มติ ครม.จัดงบฯ 3,625 ล้าน หนุนผลิตวัคซีน “ChulaCov19-ใบยา”-เพิ่ม “ค้าสื่อลามก-หนีภาษี-เก็บ ดบ.โหด” เป็นความผิดตามกม.ฟอกเงิน-ไฟเขียวตั้งผู้ว่าฯ 8 จังหวัด",https://thaipublica.org/2021/11/prayut-cabinet-2564-43/,2021_11_04
ความมั่นคงของธุรกิจในเมียนมา 9 เดือนหลังรัฐประหาร ใครถอนตัวบ้าง!!,ความมั่นคงของธุรกิจในเมียนมา 9เดือนหลังรัฐประหาร - วิกฤติโควิด-19 ใครถอนตัวบ้าง!!,https://thaipublica.org/2021/11/pundop53/,2021_11_04
ก้าวที่ 38 ของบางจากฯ คุยกับซีอีโอ…การเปลี่ยนผ่านวิธีคิดในองค์กร ไม่มี One size fits all,ก้าวที่ 38 ของบางจากฯ คุยกับซีอีโอ...การเปลี่ยนผ่านวิธีคิดในองค์กร ไม่มี One size fits all,https://thaipublica.org/2021/11/bcp-pr-4-11-2564/,2021_11_04
อังกฤษอนุมัติใช้ยาเม็ดโมลนูพิราเวียร์รักษาโควิด,MHRA ประกาศในวันนี้ว่า ได้อนุมัติยาต้านไวรัส Lagevrio (โมลนูพิราเวียร์) ที่มีความปลอดภัยและมีประสิทธิภาพในการลดความเสี่ยงของการเข้ารักษาในโรงพยาบาลและการเสียชีวิตในผู้ที่ติดเชื้อโควิด-19 ที่มีอาการเล็กน้อยถึงปานกลาง ซึ่งมีความเสี่ยงที่อาการจะรุนแรงขึ้น,https://thaipublica.org/2021/11/uk-mhra-approves-lagevrio-molnupiravir-1st-oral-antiviral-for-covid-19/,2021_11_04
ฟื้นชีพ ‘ฮอทพอท-ไดโดมอน’ JCK ทุ่มปูพรมสาขาซื้อฟาสต์ฟู้ดเสริมทัพ,“เจซีเค ฮอสพิทอลลิตี้” จัดทัพร้านอาหารครั้งใหญ่ หลังเจอ […] อ่านข่าวต้นฉบับ: ฟื้นชีพ ‘ฮอทพอท-ไดโดมอน’ JCK ทุ่มปูพรมสาขาซื้อฟาสต์ฟู้ดเสริมทัพ,https://www.prachachat.net/marketing/news-794354,2021_11_04
"ราคาบิตคอยน์วันนี้ (4 พ.ย.) ปรับลง .52% อยู่ที่ 62,893.00 เหรียญสหรัฐ","ราคาบิตคอยน์วันนี้ (4 พ.ย.) ปรับลง -.52% เมื่อเทียบกับร […] อ่านข่าวต้นฉบับ: ราคาบิตคอยน์วันนี้ (4 พ.ย.) ปรับลง .52% อยู่ที่ 62,893.00 เหรียญสหรัฐ",https://www.prachachat.net/finance/news-795432,2021_11_04
แทบทุกภาคฝนลดเหลือร้อยละ 10 ของพื้นที่ ยกเว้นภาคใต้ยังตกหนัก,กรมอุตุฯเตือนภาคใต้ฝนยังตกหนัก ภาคเหนือยังมีฝนฟ้าคะนองร […] อ่านข่าวต้นฉบับ: แทบทุกภาคฝนลดเหลือร้อยละ 10 ของพื้นที่ ยกเว้นภาคใต้ยังตกหนัก,https://www.prachachat.net/general/news-795427,2021_11_04
กลุ่มปตท.กำไรเฉียด5หมื่นล้าน “TOP-PTTEP” เด่น-ตรึงดีเซลฉุด OR,"โบรกฯประเมินไตรมาส 3/64 กลุ่ม ปตท. มีกำไร 48,400 ล้านบา […] อ่านข่าวต้นฉบับ: กลุ่มปตท.กำไรเฉียด5หมื่นล้าน “TOP-PTTEP” เด่น-ตรึงดีเซลฉุด OR",https://www.prachachat.net/finance/news-794437,2021_11_04
ราคาน้ำมันวันนี้ (4 พ.ย.) เช็กราคาดีเซล-แก๊สโซฮอล์ล่าสุด,ผู้สื่อข่าวรายงานว่า ราคาน้ำมันวันนี้ (4 พ.ย.) ตามข้อมู […] อ่านข่าวต้นฉบับ: ราคาน้ำมันวันนี้ (4 พ.ย.) เช็กราคาดีเซล-แก๊สโซฮอล์ล่าสุด,https://www.prachachat.net/economy/news-795434,2021_11_04
จับตากองทุนหุ้นสหรัฐ เจอเอฟเฟ็กต์ “เงินเฟ้อ-บอนด์ยีลด์” พุ่ง,ประเทศสหรัฐอเมริกากำลังเผชิญกับภาวะเงินเฟ้อสูงที่สุดในร […] อ่านข่าวต้นฉบับ: จับตากองทุนหุ้นสหรัฐ เจอเอฟเฟ็กต์ “เงินเฟ้อ-บอนด์ยีลด์” พุ่ง,https://www.prachachat.net/finance/news-794102,2021_11_04
ศูนย์ฉีดวัคซีนบางซื่อ เปิดลงทะเบียนฉีดไขว้ วันนี้ (4 พ.ย.),ศูนย์ฉีดวัคซีนสถานีกลางบางซื่อ เปิดลงทะเบียนฉีดไขว้ “แอ […] อ่านข่าวต้นฉบับ: ศูนย์ฉีดวัคซีนบางซื่อ เปิดลงทะเบียนฉีดไขว้ วันนี้ (4 พ.ย.),https://www.prachachat.net/general/news-795444,2021_11_04
"ศบค.พบป่วยโควิดวันนี้ (4 พ.ย.) 7,982 ราย ผล ATK บวกเพิ่ม 3,001 คน","ศบค.พบผู้ติดเชื้อโควิดรายใหม่วันนี้ (4 พ.ย.) เพิ่ม 7,98 […] อ่านข่าวต้นฉบับ: ศบค.พบป่วยโควิดวันนี้ (4 พ.ย.) 7,982 ราย ผล ATK บวกเพิ่ม 3,001 คน",https://www.prachachat.net/general/news-795440,2021_11_04
จับตาวาระครม. เคาะชื่อปธ.วิปรัฐบาลคนใหม่ ไฟเขียวเงินกู้กระตุ้นเศรษฐกิจ,ประยุทธ์ นั่งหัวโต๊ะ ประชุมครม. ทันที หลังกลับจากประชุม […] อ่านข่าวต้นฉบับ: จับตาวาระครม. เคาะชื่อปธ.วิปรัฐบาลคนใหม่ ไฟเขียวเงินกู้กระตุ้นเศรษฐกิจ,https://www.prachachat.net/politics/news-795456,2021_11_04
IRC รับรางวัล SET Awards 2021 ในกลุ่มรางวัล Sustainability Excellence ประเภท Rising Star,คุณพิมพ์ใจ ลี้อิสสระนุกูล ประธานกรรมการบริหาร บริษัท อี […] อ่านข่าวต้นฉบับ: IRC รับรางวัล SET Awards 2021 ในกลุ่มรางวัล Sustainability Excellence ประเภท Rising Star,https://www.prachachat.net/public-relations/news-795468,2021_11_04
ค่าเงินบาทวันนี้ (4 พ.ย.) แข็งค่าที่ 33.29 บาท บทวิเคราะห์ล่าสุด,ค่าเงินบาทวันนี้ (4 พ.ย.) เปิดตลาดแข็งค่าที่ 33.29 บาท […] อ่านข่าวต้นฉบับ: ค่าเงินบาทวันนี้ (4 พ.ย.) แข็งค่าที่ 33.29 บาท บทวิเคราะห์ล่าสุด,https://www.prachachat.net/finance/news-795490,2021_11_04
"ราคาทองวันนี้ (4 พ.ย.) ปรับลง 100 บาท รูปพรรณบาทละ 28,550 บาท","ราคาทองคำประจำวันนี้ (4 พ.ย.) ปรับราคาลง 100 บาท เมื่อเ […] อ่านข่าวต้นฉบับ: ราคาทองวันนี้ (4 พ.ย.) ปรับลง 100 บาท รูปพรรณบาทละ 28,550 บาท",https://www.prachachat.net/finance/news-795479,2021_11_04
เอไอเอส แจก 60 บาท สั่งอาหาร “คนละครึ่ง” บนไลน์แมน,เอไอเอส ผนึก ไลน์แมน นำ เอไอเอสพอยท์ลดค่าอาหารสูงสุด 60 […] อ่านข่าวต้นฉบับ: เอไอเอส แจก 60 บาท สั่งอาหาร “คนละครึ่ง” บนไลน์แมน,https://www.prachachat.net/ict/news-795471,2021_11_04
GC รับรางวัลเกียรติยศด้านความยั่งยืน SET Sustainability Awards of Honor  จากตลาดหลักทรัพย์ 4 ปีซ้อน,ดร.คงกระพัน อินทรแจ้ง ประธานเจ้าหน้าที่บริหาร บริษัท พี […] อ่านข่าวต้นฉบับ: GC รับรางวัลเกียรติยศด้านความยั่งยืน SET Sustainability Awards of Honor จากตลาดหลักทรัพย์ 4 ปีซ้อน,https://www.prachachat.net/advertorial/news-795486,2021_11_04
โควาซิน วัคซีนอินเดีย ได้รับการรับรองจาก WHO แล้ว,วัคซีนโควิดที่ผลิตในอินเดีย ได้รับการรับรองจาก WHO ให้ใ […] อ่านข่าวต้นฉบับ: โควาซิน วัคซีนอินเดีย ได้รับการรับรองจาก WHO แล้ว,https://www.prachachat.net/world-news/news-795467,2021_11_04
ราคาน้ำมันดิบปรับลดลงกว่า 3% หลังปริมาณน้ำมันดิบคงคลังสหรัฐเพิ่มขึ้น,ราคาน้ำมันดิบปรับลดลงกว่า 3% หลังปริมาณน้ำมันดิบคงคลังส […] อ่านข่าวต้นฉบับ: ราคาน้ำมันดิบปรับลดลงกว่า 3% หลังปริมาณน้ำมันดิบคงคลังสหรัฐเพิ่มขึ้น,https://www.prachachat.net/finance/news-795492,2021_11_04
“อนุทิน” เตรียมเปิดจุดฉีดวัคซีนโควิดแรงงานต่างจังหวัดกลับ กทม.,“อนุทิน ชาญวีรกูล” เตรียมเปิดจุดฉีดวัคซีนโค […] อ่านข่าวต้นฉบับ: “อนุทิน” เตรียมเปิดจุดฉีดวัคซีนโควิดแรงงานต่างจังหวัดกลับ กทม.,https://www.prachachat.net/general/news-795495,2021_11_04
บทวิเคราะห์ราคาทองคำวันนี้ (4 พ.ย.) โดย YLG Bullion,บริษัท วายแอลจี บูลเลี่ยน อินเตอร์เนชั่นแนล จำกัด รายงา […] อ่านข่าวต้นฉบับ: บทวิเคราะห์ราคาทองคำวันนี้ (4 พ.ย.) โดย YLG Bullion,https://www.prachachat.net/finance/news-795503,2021_11_04
กรมอุตุฯคาดการณ์ 4-9 พ.ย. อากาศเย็น-ลมแรง อุณหภูมิลดลง 2-4 องศา,หยิบเสื้อหนาวรอ! กรมอุตุฯคาดสัปดาห์หน้า มวลอากาศเย็นกำล […] อ่านข่าวต้นฉบับ: กรมอุตุฯคาดการณ์ 4-9 พ.ย. อากาศเย็น-ลมแรง อุณหภูมิลดลง 2-4 องศา,https://www.prachachat.net/general/news-795461,2021_11_04
"หุ้นไทยวันนี้ (4 พ.ย.) เปิดตลาด -0.72 จุด ดัชนีอยู่ที่ 1,611 จุด","ตลาดหุ้นไทยเช้านี้ (4 พ.ย.)ดัชนี SET Index เปิดตลาด อยู […] อ่านข่าวต้นฉบับ: หุ้นไทยวันนี้ (4 พ.ย.) เปิดตลาด -0.72 จุด ดัชนีอยู่ที่ 1,611 จุด",https://www.prachachat.net/finance/news-795518,2021_11_04
กระทรวงแรงงานเร่ง MOU นำเข้าแรงงาน แก้ลักลอบเข้าเมืองทะลักชายแดน,กระทรวงแรงงานเตรียมหารือ 4 หน่วยงาน ถึง 7 ประเด็น หลัง […] อ่านข่าวต้นฉบับ: กระทรวงแรงงานเร่ง MOU นำเข้าแรงงาน แก้ลักลอบเข้าเมืองทะลักชายแดน,https://www.prachachat.net/csr-hr/news-795494,2021_11_04
“จุรินทร์” แจงคืบหน้าคดีสอบถุงมือยางมือสอง จำคุก แพดดี้ เดอะรูม 4 ปี,“จุรินทร์” แจงคืบหน้าคดีสอบถุงมือยางมือสอง จำคุก แพดดี้ […] อ่านข่าวต้นฉบับ: “จุรินทร์” แจงคืบหน้าคดีสอบถุงมือยางมือสอง จำคุก แพดดี้ เดอะรูม 4 ปี,https://www.prachachat.net/finance/news-795540,2021_11_04
"คาดแรงขายหุ้นไทยไม่หนัก เฟดคงดอกเบี้ย-หั่น QE เดือนละ 15,000 ล้านดอลล์","บล.ฟิลลิป ประเมินตลาดหุ้นไทยแกว่งตัว 1,600-1,620 จุด อิ […] อ่านข่าวต้นฉบับ: คาดแรงขายหุ้นไทยไม่หนัก เฟดคงดอกเบี้ย-หั่น QE เดือนละ 15,000 ล้านดอลล์",https://www.prachachat.net/finance/news-795535,2021_11_04
6 จังหวัดใต้ชง ครม.สัญจร “กระบี่” ดัน 83 โครงการ ฟื้นเศรษฐกิจอันดามัน,การเดินสายประชุมคณะรัฐมนตรีสัญจรกำลังจะเริ่มขึ้นอีกครั้ […] อ่านข่าวต้นฉบับ: 6 จังหวัดใต้ชง ครม.สัญจร “กระบี่” ดัน 83 โครงการ ฟื้นเศรษฐกิจอันดามัน,https://www.prachachat.net/local-economy/news-794034,2021_11_04
เจ้าท่ารีโนเวตท่าเรือปากเมง เปิดทะเลตรังรับนักท่องเที่ยว,รายงานข่าวจากกรมเจ้าท่า (จท.) เปิดเผยว่า ความคืบหน้าโคร […] อ่านข่าวต้นฉบับ: เจ้าท่ารีโนเวตท่าเรือปากเมง เปิดทะเลตรังรับนักท่องเที่ยว,https://www.prachachat.net/property/news-794523,2021_11_04
Deco 2000 เปิดตัว DEVIALET Premium Reseller Stores ในประเทศไทย 2 สาขา,Deco 2000 เปิดตัว DEVIALET Premium Reseller Stores ในปร […] อ่านข่าวต้นฉบับ: Deco 2000 เปิดตัว DEVIALET Premium Reseller Stores ในประเทศไทย 2 สาขา,https://www.prachachat.net/public-relations/news-795545,2021_11_04
“จุรินทร์”เชื่อ หลังน้ำลดเกษตรกรเร่งปลูกผัก จัดรถโมบายขายผักราคาถูก,“จุรินทร์” จัดคาราวานแก้ผักแพง! ส่งรถโมบายข […] อ่านข่าวต้นฉบับ: “จุรินทร์”เชื่อ หลังน้ำลดเกษตรกรเร่งปลูกผัก จัดรถโมบายขายผักราคาถูก,https://www.prachachat.net/economy/news-795558,2021_11_04
