title,summary,link,published
ASEAN Roundup ธ.โลกเปิดรายงาน ชาวฟิลิปปินส์มั่งคั่งขึ้น 14%,ASEAN Roundup ประจำวันที่ 24-30 ตุลาคม 2564 ชาวฟิลิปปินส์มั่งคั่งสูงขึ้น แต่ต่ำกว่าประเทศสมาชิกตะวันออกเฉียงใต้ กัมพูชารับตำแหน่งประธานอาเซียนปี 2022 อย่างเป็นทางการ กัมพูชาดันสีหนุวิลล์ขึ้น “เสิ่นเจิ้น 2” มาเลเซียจัดสรรงบ 2022 วงเงิน 150 ล้านริงกิต หนุนเยาวชนสู่ผู้ประกอบการ สมัชชาแห่งชาติเวียดนามถกโมเดลใหม่เศรษฐกิจ,https://thaipublica.org/2021/10/asean-weekly-roundup-114/,2021_10_31
ASEAN Roundup EP 54  โอกาสนักธุรกิจไทยอยู่ตรงไหน จาก”รถไฟ  ลาว-จีน”,ThaiPublica · ASEAN Roundup EP54 โอกาสนักธุรกิจไทยอยู่ต […],https://thaipublica.org/2021/10/asean-roundup-ep-54/,2021_10_31
AAS รื้อระบบโลจิสติกส์ คลายปม…ลูกค้ารอรถนาน,สัมภาษณ์ ปัญหาของลูกค้าปอร์เช่ เอเอเอส ต้องรอรถนาน จะค่ […] อ่านข่าวต้นฉบับ: AAS รื้อระบบโลจิสติกส์ คลายปม…ลูกค้ารอรถนาน,https://www.prachachat.net/motoring/news-792019,2021_10_31
กทพ. ยกเลิกจำกัดเวลาวิ่งทางด่วน พื้นที่ กทม. เริ่มคืนนี้ (31 ต.ค.),การทางพิเศษฯ ยกเลิกจำกัดเวลาการให้บริการรถยนต์ทั่วไปบนท […] อ่านข่าวต้นฉบับ: กทพ. ยกเลิกจำกัดเวลาวิ่งทางด่วน พื้นที่ กทม. เริ่มคืนนี้ (31 ต.ค.),https://www.prachachat.net/property/news-791844,2021_10_31
เงินบาทแข็งค่า จับตาปัจจัยสำคัญสัปดาห์หน้า-เปิดประเทศ,เงินบาทแข็งค่าขึ้น ขณะที่หุ้นไทยร่วงลงทิศทางเดียวกับตลา […] อ่านข่าวต้นฉบับ: เงินบาทแข็งค่า จับตาปัจจัยสำคัญสัปดาห์หน้า-เปิดประเทศ,https://www.prachachat.net/finance/news-792716,2021_10_31
สัญญาณเศรษฐกิจไทยฟื้นช้า เปิดประเทศ 1 พ.ย. แค่ “ซ้อมใหญ่”,การทยอยคลายล็อกดาวน์ และเปิดประเทศตั้งแต่วันที่ 1 พ.ย. […] อ่านข่าวต้นฉบับ: สัญญาณเศรษฐกิจไทยฟื้นช้า เปิดประเทศ 1 พ.ย. แค่ “ซ้อมใหญ่”,https://www.prachachat.net/finance/news-792095,2021_10_31
โลกขาดแคลนแรงงาน  ซ้ำเติมห่วงโซ่อุปทาน-เศรษฐกิจ,คอลัมน์ ชีพจรเศรษฐกิจโลก นงนุช สิงหเดชะ เมื่อเริ่มแรกที […] อ่านข่าวต้นฉบับ: โลกขาดแคลนแรงงาน ซ้ำเติมห่วงโซ่อุปทาน-เศรษฐกิจ,https://www.prachachat.net/world-news/news-792128,2021_10_31
"ศบค. พบป่วยโควิดเพิ่มวันนี้ (31 ต.ค.) 8,859 ราย เสียชีวิต 47 ราย","ศบค.พบผู้ติดเชื้อโควิดรายใหม่วันนี้ (31 ต.ค.) เพิ่ม 8,8 […] อ่านข่าวต้นฉบับ: ศบค. พบป่วยโควิดเพิ่มวันนี้ (31 ต.ค.) 8,859 ราย เสียชีวิต 47 ราย",https://www.prachachat.net/general/news-792734,2021_10_31
Digital Thai Baht ประตูสู่โลกการเรียนรู้ใบใหม่,คอลัมน์ ช่วยกันคิด ดร.ขจรพงษ์ พูลสวัสดิ์ บนโลกที่มีการเ […] อ่านข่าวต้นฉบับ: Digital Thai Baht ประตูสู่โลกการเรียนรู้ใบใหม่,https://www.prachachat.net/columns/news-790517,2021_10_31
“ลานินญ่า” ปีฝนมากน้ำมาก มาไทยแล้ว ภาคใต้ระวังน้ำป่า-ดินโคลนถล่ม,ทีมกรุ๊ป วิเคราะห์ข้อมูล NOAA ล่าสุด ตั้งแต่ปลายเดือนตุ […] อ่านข่าวต้นฉบับ: “ลานินญ่า” ปีฝนมากน้ำมาก มาไทยแล้ว ภาคใต้ระวังน้ำป่า-ดินโคลนถล่ม,https://www.prachachat.net/economy/news-792738,2021_10_31
Next Normal เกษตรไทย อุ้ม 30 ล้านคน ดันจีดีพีโต 3% ต่อปี,ภาคเกษตรเกี่ยวพันกับประชากรไทย 30 ล้านคนเทียบเป็นสัดส่ว […] อ่านข่าวต้นฉบับ: Next Normal เกษตรไทย อุ้ม 30 ล้านคน ดันจีดีพีโต 3% ต่อปี,https://www.prachachat.net/economy/news-792446,2021_10_31
พระมหาไพรวัลย์ โพสต์แจงคนวิจารณ์ ปมดราม่าร่ำไห้ประกาศเตรียมสึก,พระมหาไพรวัลย์ โพสต์ตอบกลับคอมเมนต์วิจารณ์ ปมร่ำไห้คลิป […] อ่านข่าวต้นฉบับ: พระมหาไพรวัลย์ โพสต์แจงคนวิจารณ์ ปมดราม่าร่ำไห้ประกาศเตรียมสึก,https://www.prachachat.net/social-media-viral/news-792743,2021_10_31
ติดฉลากแพลตฟอร์มดิจิทัล เพิ่มอำนาจผู้บริโภค-ลดโกงออนไลน์,โควิด-19 เร่งให้เทคโนโลยีดิจิทัลมีบทบาทต่อผู้บริโภคมากข […] อ่านข่าวต้นฉบับ: ติดฉลากแพลตฟอร์มดิจิทัล เพิ่มอำนาจผู้บริโภค-ลดโกงออนไลน์,https://www.prachachat.net/ict/news-791810,2021_10_31
บทบาท “อุ๊งอิ๊ง” ในเพื่อไทย ภารกิจสร้างประชาธิปไตยที่กินได้,ทักษิณ ชินวัตร อดีตนายกรัฐมนตรี ศาสดาเอกของพรรคเพื่อไทย […] อ่านข่าวต้นฉบับ: บทบาท “อุ๊งอิ๊ง” ในเพื่อไทย ภารกิจสร้างประชาธิปไตยที่กินได้,https://www.prachachat.net/politics/news-792755,2021_10_31
ถุงมือยาง 8 หมื่นล้านป่วน ราคาร่วง-จีนเปิดศึกแย่งตลาด,"ขุมทรัพย์ส่งออกถุงมือยาง 80,000 ล้านบาทระส่ำ สารพัดปัญห […] อ่านข่าวต้นฉบับ: ถุงมือยาง 8 หมื่นล้านป่วน ราคาร่วง-จีนเปิดศึกแย่งตลาด",https://www.prachachat.net/economy/news-792318,2021_10_31
ธอส. ปรับเวลาเปิด-ปิดสาขาใหม่ เริ่ม 1 พ.ย. นี้,ธอส. ประกาศปรับเวลาเปิด-ปิดสาขาใหม่ เริ่ม 1 พ.ย.นี้ สดเ […] อ่านข่าวต้นฉบับ: ธอส. ปรับเวลาเปิด-ปิดสาขาใหม่ เริ่ม 1 พ.ย. นี้,https://www.prachachat.net/finance/news-792759,2021_10_31
เปลี่ยนวิธีคิด…ชีวิตเปลี่ยน,เอชอาร์ คอร์เนอร์ อภิวุฒิ พิมลแสงสุริยา สลิงชอท กรุ๊ป เ […] อ่านข่าวต้นฉบับ: เปลี่ยนวิธีคิด…ชีวิตเปลี่ยน,https://www.prachachat.net/csr-hr/news-789581,2021_10_31
กรมการแพทย์แผนไทยฯ กางแผนดันสมุนไพรไทย โกยรายได้ 5 หมื่นล้าน,กรมการแพทย์แผนไทยฯ กางโรดแมปดันสมุนไพรไทยลุยตลาดโลก 9.1 […] อ่านข่าวต้นฉบับ: กรมการแพทย์แผนไทยฯ กางแผนดันสมุนไพรไทย โกยรายได้ 5 หมื่นล้าน,https://www.prachachat.net/marketing/news-792764,2021_10_31
ทีเส็บหนุนไทยขึ้นฮับไมซ์โลก ดึงเมกะอีเวนต์อินเตอร์บูม “ไมซ์ซิตี้” ทั่วประเทศ,“ทีเส็บ” ขานรับนโยบายเปิดประเทศ เร่งสื่อสารความพร้อมประ […] อ่านข่าวต้นฉบับ: ทีเส็บหนุนไทยขึ้นฮับไมซ์โลก ดึงเมกะอีเวนต์อินเตอร์บูม “ไมซ์ซิตี้” ทั่วประเทศ,https://www.prachachat.net/tourism/news-792322,2021_10_31
กระทรวงต่างประเทศเพิ่ม 63 ประเทศเข้าไทย ไม่ต้องกักตัว,กระทรวงการต่างประเทศ ออกประกาศเพิ่มจำนวนประเทศเข้าไทยเป […] อ่านข่าวต้นฉบับ: กระทรวงต่างประเทศเพิ่ม 63 ประเทศเข้าไทย ไม่ต้องกักตัว,https://www.prachachat.net/general/news-792768,2021_10_31
“ร่างทรง” ตัวแทนไทย เสนอชื่อเข้าชิงออสการ์ สาขาหนังต่างประเทศ,กระแสแรงไม่หยุด! สมาพันธ์ภาพยนตร์ เลือก “ร่างทรง& […] อ่านข่าวต้นฉบับ: “ร่างทรง” ตัวแทนไทย เสนอชื่อเข้าชิงออสการ์ สาขาหนังต่างประเทศ,https://www.prachachat.net/spinoff/entertainment/news-792767,2021_10_31
กองทุน RMF คืออะไร ลดหย่อนภาษีได้เท่าไหร่,หลังจากที่ครั้งก่อนเราได้เรียนรู้และทำความเข้าใจกองทุน […] อ่านข่าวต้นฉบับ: กองทุน RMF คืออะไร ลดหย่อนภาษีได้เท่าไหร่,https://www.prachachat.net/finance/news-792312,2021_10_31
บิ๊กอีเวนต์เดินหน้างานปลายปี มอเตอร์เอ็กซ์โป-คอมมาร์ตคึก,3 บิ๊กอีเวนต์เดินหน้าจัดงานใหญ่รับเปิดเมือง “มอเตอร์เอ็ […] อ่านข่าวต้นฉบับ: บิ๊กอีเวนต์เดินหน้างานปลายปี มอเตอร์เอ็กซ์โป-คอมมาร์ตคึก,https://www.prachachat.net/prachachat-top-story/news-792386,2021_10_31
ทูลกระหม่อมฯ ทรงฉลองฮัลโลวีน แปลงโฉมเป็นตุ๊กตาจาก Squid Game,ทูลกระหม่อมฯ ทรงฉลองเทศกาลฮัลโลวีน แปลงโฉมเป็นตุ๊กตาจาก […] อ่านข่าวต้นฉบับ: ทูลกระหม่อมฯ ทรงฉลองฮัลโลวีน แปลงโฉมเป็นตุ๊กตาจาก Squid Game,https://www.prachachat.net/social-media-viral/news-792776,2021_10_31
“ส.ค้าปลีก” ชงแผนฟื้นประเทศ โควิดกระทบธุรกิจสูญ 8 แสนล้าน,ส.ผู้ค้าปลีกไทย ชี้โควิดกระทบภาคค้าปลีกและบริการสูญ 8 แ […] อ่านข่าวต้นฉบับ: “ส.ค้าปลีก” ชงแผนฟื้นประเทศ โควิดกระทบธุรกิจสูญ 8 แสนล้าน,https://www.prachachat.net/marketing/news-791768,2021_10_31
เกาะติด 3 ธนาคารกลาง ประชุมลดคิวอี-ขึ้นดอกเบี้ยทำตลาดเงินผันผวน,แบงก์ประเมินกรอบเงินบาทเคลื่อนไหว 29.50-33.50 บาทต่อดอล […] อ่านข่าวต้นฉบับ: เกาะติด 3 ธนาคารกลาง ประชุมลดคิวอี-ขึ้นดอกเบี้ยทำตลาดเงินผันผวน,https://www.prachachat.net/finance/news-792784,2021_10_31
เอาท์แลนเดอร์ พีเอชอีวี ปลั๊ก-อิน ไฮบริด ตัวแรกจากค่ายญี่ปุ่น,เทสต์คาร์ อมร พวงงาม ยุคสมัยนี้รถยนต์แบรนด์ไหน ถ้าไม่มี […] อ่านข่าวต้นฉบับ: เอาท์แลนเดอร์ พีเอชอีวี ปลั๊ก-อิน ไฮบริด ตัวแรกจากค่ายญี่ปุ่น,https://www.prachachat.net/motoring/test-car/news-792049,2021_10_31
‘เพียเจต์’ ฉีกดีไซน์ โมเดิร์นคอลเล็กชั่น,ทันทีที่ห้างสรรพสินค้า ศูนย์การค้า ฯลฯ เปิดให้บริการ ดู […] อ่านข่าวต้นฉบับ: ‘เพียเจต์’ ฉีกดีไซน์ โมเดิร์นคอลเล็กชั่น,https://www.prachachat.net/d-life/news-789097,2021_10_31
เช็กภาวะหุ้นไทยสัปดาห์หน้า เด้งรับเปิดประเทศ-กังวลเฟดลดคิวอี,บล.ฟิลลิป ชี้ภาวะหุ้นไทยสัปดาห์หน้า ตลาดเด้งรับเปิดประเ […] อ่านข่าวต้นฉบับ: เช็กภาวะหุ้นไทยสัปดาห์หน้า เด้งรับเปิดประเทศ-กังวลเฟดลดคิวอี,https://www.prachachat.net/finance/news-792789,2021_10_31
“อนุทิน” ลั่น พร้อมเปิดประเทศพรุ่งนี้ สถานการณ์เชียงใหม่ ไม่กระทบแผน,“อนุทิน” ลั่นพร้อมเปิดประเทศ-โรงเรียน 1 พ.ย […] อ่านข่าวต้นฉบับ: “อนุทิน” ลั่น พร้อมเปิดประเทศพรุ่งนี้ สถานการณ์เชียงใหม่ ไม่กระทบแผน,https://www.prachachat.net/general/news-792791,2021_10_31
ม็อบราษฎร-แนวร่วม แยกราชประสงค์คึกคัก “ไอลอว์” ล่ารายชื่อยกเลิก 112,ม็อบราษฎร-แนวร่วม แน่นแยกราชประสงค์ “ไอลอว์” […] อ่านข่าวต้นฉบับ: ม็อบราษฎร-แนวร่วม แยกราชประสงค์คึกคัก “ไอลอว์” ล่ารายชื่อยกเลิก 112,https://www.prachachat.net/politics/news-792797,2021_10_31
ดีอีเอส ผนึก 4 กระทรวง ปั้นแพลตฟอร์มเชื่อมฐานข้อมูลสุขภาพ,ดีอีเอส ผนึก 4 กระทรวง เร่งพัฒนาแพลตฟอร์ม เชื่อมต่อฐานข […] อ่านข่าวต้นฉบับ: ดีอีเอส ผนึก 4 กระทรวง ปั้นแพลตฟอร์มเชื่อมฐานข้อมูลสุขภาพ,https://www.prachachat.net/ict/news-792805,2021_10_31
เปิดประเทศแล้ว ท่องเที่ยวไทยพร้อมหรือยัง?,นับตั้งแต่ 1 พฤศจิกายนนี้เป็นต้นไป พื้นที่ 17 จังหวัดเม […] อ่านข่าวต้นฉบับ: เปิดประเทศแล้ว ท่องเที่ยวไทยพร้อมหรือยัง?,https://www.prachachat.net/tourism/news-792334,2021_10_31
Amazon กับการลงทุน ใน Climate Tech,Tech Times มัชฌิมา จันทร์สว่างภูวนะ ถ้า Amazon อยากบรรล […] อ่านข่าวต้นฉบับ: Amazon กับการลงทุน ใน Climate Tech,https://www.prachachat.net/ict/news-791829,2021_10_31
“ประยุทธ์” บินร่วมประชุม COP 26 เผย เสียดายไม่ได้อยู่ร่วมวันเปิดประเทศ,“ประยุทธ์” บินร่วมประชุม COP 26 เผย เสียดาย […] อ่านข่าวต้นฉบับ: “ประยุทธ์” บินร่วมประชุม COP 26 เผย เสียดายไม่ได้อยู่ร่วมวันเปิดประเทศ,https://www.prachachat.net/politics/news-792812,2021_10_31
ส่องโปรเจ็กต์ยักษ์ “ซีพีเอ็น” ต่อยอด “เอสเอฟ” ปูพรมมิกซ์ยูส,ปิดดีลไปเป็นที่เรียบร้อยตั้งแต่เมื่อกลางสัปดาห์ที่ผ่านม […] อ่านข่าวต้นฉบับ: ส่องโปรเจ็กต์ยักษ์ “ซีพีเอ็น” ต่อยอด “เอสเอฟ” ปูพรมมิกซ์ยูส,https://www.prachachat.net/marketing/news-791745,2021_10_31
“รุ้ง ปนัสยา” กรีดแขนประทับเลือดบนแถลงการณ์ จี้ปล่อยนักโทษการเมือง,“รุ้ง ปนัสยา” กรีดแขนซ้ายเป็นสัญลักษณ์เลข 1 […] อ่านข่าวต้นฉบับ: “รุ้ง ปนัสยา” กรีดแขนประทับเลือดบนแถลงการณ์ จี้ปล่อยนักโทษการเมือง,https://www.prachachat.net/politics/news-792827,2021_10_31
"“สุวรรณภูมิ” เปิดตึกจอดรถใหม่ 2,500 คัน รับเปิดประเทศ 1 พ.ย. 64","“สนามบินสุวรรณภูมิ” เปิดตึกจอดรถใหม่ 2,500 […] อ่านข่าวต้นฉบับ: “สุวรรณภูมิ” เปิดตึกจอดรถใหม่ 2,500 คัน รับเปิดประเทศ 1 พ.ย. 64",https://www.prachachat.net/property/news-792862,2021_10_31
วัวให้โชค 4 ปี ออกลูก 7 ตัว เจ้าของฝันมีคนส่งมาเกิด เช้าซื้อหวย เย็นวัวออกลูกแฝด,แม่วัวพันธุ์ดีออกลูกรวม 7 ตัว ใน 4 ปี ทุกตัวแข็งแรง เจ้าของซื้อหวยตอนเช้า ตอนเย็นวัวออกลูกแฝด ตั้งชื่อ 1-2-3 ตรงกับเลขท้ายลอตเตอรี่,https://www.sanook.com/news/8466406/,2021_10_31
พี่สาว 12 ขวบ ตามคนมาช่วยน้อง 7 ขวบ ถูกพ่อเลี้ยงข่มขืน แม่ช็อก คิดว่าเขารักเหมือนลูกแท้ๆ,พี่สาว 12 ขวบ ตามน้าชายมาช่วยน้อง 7 ขวบ ถูกพ่อเลี้ยงข่มขืนซ้ำๆ แม่เด็กช็อก คิดว่าเขารักลูกตัวเองเหมือนลูกแท้ๆ,https://www.sanook.com/news/8466450/,2021_10_31
"เสีย 7 แสน แขนไม่ได้จับ! เสี่ยสายเปย์โผล่อีก สาว ""แอน"" ลวงให้รักเป็นปีๆ ตัวจริงไม่ตรงปก","เสีย 7 แสน แขนไม่ได้จับ! เสี่ยสายเปย์โผล่อีก สาว ""แอน"" ลวงให้รักเป็นปี ตัวจริงไม่ตรงปก หลอกเงินอ้างพ่อแม่ล้มป่วย",https://www.sanook.com/news/8466454/,2021_10_31
"พรุ่งนี้เปิดประเทศ โควิดวันนี้ ไทยพบผู้ติดเชื้อเพิ่ม 8,859 ราย เสียชีวิตอีก 47 ราย","สถานการณ์ #โควิด19 ประจำวันที่ 31 ต.ค. 64 พบติดเชื้อรายใหม่ 8,859 ราย เสียชีวิตเพิ่ม 47 ราย",https://www.sanook.com/news/8466466/,2021_10_31
5 คู่รักมาราธอน ยิ่งคบนานยิ่งหวานไม่เปลี่ยน แฟนๆ ลุ้นอยากให้แต่งแล้ว,5 คู่รักมาราธอน แต่ละคู่นั้นคบหาดูใจกันมานานกว่า 10 ปี หวานไม่มีแผ่วจนแฟนๆอยากได้ยินข่าวดีแล้ว,https://www.sanook.com/news/8465794/,2021_10_31
อนุทิน มั่นใจเชียงใหม่เอาอยู่! สั่งเพิ่มวัคซีนอีก 7 แสนโดส ลั่นฉีดครบร้อยเปอร์เซ็นต์ใน 1 เดือน,อนุทิน มั่นใจเชียงใหม่เอาอยู่! สั่งเพิ่มวัคซีนอีก 7 แสนโดส ตั้งเป้าฉีดครบร้อยเปอร์เซนต์ภายในเดือน พ.ย.นี้,https://www.sanook.com/news/8466474/,2021_10_31
