title,summary,link,published
ชาวนครเมลเบิร์นชุมนุมประท้วงต่อต้านมาตรการควบคุมการระบาดโควิด-19,"ประชาชนนับร้อยในนครเมลเบิร์น ประเทศออสเตรเลีย ออกมาชุมนุมบนท้องถนนในวันอังคาร เพื่อประท้วงต่อต้านการดำเนินมาตรการควบคุมการระบาดของโควิด-19 ที่รัฐบาลบังคับใช้กับอุตสาหกรรมการก่อสร้าง


ทางการนครเมลเบิร์น ซึ่งเป็นเมืองที่มีขนาดใหญ่ที่สุดของประเทศ สั่งปิดพื้นที่โครงการก่อสร้างทั้งหมดเป็นเวลา 2 สัปดาห์ เนื่องจากความกังวลว่า การเคลื่อนย้ายของคนงานก่อสร้างนั้นคือ ปัจจัยที่ทำให้การแพร่กระจายโควิด-19 รุนแรงขึ้น


ภายใต้คำสั่งของรัฐบาลเมือง คนงานก่อสร้างต้องได้รับวัคซีนโควิด-19 แล้วอย่างน้อย 1 เข็มก่อนจะได้รับอนุญาตให้กลับเข้าทำงานอีกครั้ง


ล่าสุด รัฐวิกตอเรีย ซึ่งเป็นที่ตั้งของนครเมลเบิร์น รายงานตัวเลขผู้ป่วยใหม่จำนวน 603 รายในวันอังคาร ซึ่งเป็นตัวเลขรายวันสูงที่สุดนับตั้งแต่ต้นปีมา


ขณะเดียวกัน นายกรัฐมนตรี จาซินดา อาร์เดิร์น ของนิวซีแลนด์ ประกาศในวันอังคารว่า จะมีการขึ้นค่าปรับสำหรับผู้ที่ละเมิดมาตรการควบคุมและป้องกันการระบาดของโคโรนาไวรัสตั้งแต่เดือนพฤศจิกายนเป็นต้นไป โดยผู้ที่จงใจละเมิดมาตรการต่างๆอาจต้องโทษค่าปรับสูงสุดถึง 8,400 ดอลลาร์ ซึ่งเพิ่มจากอัตรา 2,800 ดอลลาร์ ในปัจจุบัน และยังอาจต้องโทษจำคุกสูงสุดถึง 6 เดือนด้วย


ในส่วนของธุรกิจที่ละเมิดมาตรการต่างๆ ค่าปรับสูงสุดนั้นอยู่ที่ 10,500 ดอลลาร์


นายกรัฐมนตรี อาร์เดิร์น กล่าวว่า ความสำเร็จในการรับมือโคโรนาไวรัสของนิวซีแลนด์นั้นมาจากความเป็นจริงที่ประชาชนให้ความร่วมมือเป็นหลัก แต่กลับยังมีผู้ที่คิดแปลกแยกทำการแหกกฎและทำให้ผู้อื่นตกอยู่ในความเสี่ยงแทน",https://www.voathai.com/a/melborne-protest-covid19-restrictions-newzealand/6238614.html,22_09_2021
ตาลิบัน แต่งตั้งรัฐมนตรีช่วยเพิ่ม-ตอกย้ำจัดตั้งรัฐบาลชายล้วน,"กลุ่มตาลิบันประกาศรายชื่อรัฐมนตรีช่วยหลายตำแหน่งเพิ่มเติมในวันอังคาร โดยไม่มีผู้ถูกเสนอชื่อที่เป็นผู้หญิงแม้แต่คนเดียว แม้ประชาคมโลกจะแสดงความผิดหวังต่อการที่รัฐบาลตาลิบันนั้นมีแต่ผู้ชายเท่านั้นก็ตาม


ในระหว่างการแถลงข่าวที่กรุงคาบูล ซาบิฮัลเลาะห์ มูจาฮิด โฆษกรัฐบาล นำเสนอรายชื่อรัฐมนตรีช่วยหน้าใหม่ ซึ่งตอกย้ำจุดยืนของกลุ่มตาลิบันที่ไม่ให้ความสำคัญกับคำสัญญาของตนที่จะจัดตั้งรัฐบาลที่เปิดกว้างและส่งเสริมสิทธิสตรี


นับตั้งแต่เกิดเหตุยึดอำนาจจากรัฐบาลพลเรือนอัฟกันมา ประชาคมโลกออกมาเตือนว่า จะตัดสินกลุ่มตาลิบันจากการกระทำของทางกลุ่ม และการยอมรับรัฐบาลที่ตาลิบันทำการจัดตั้งนั้นจะโยงกับวิธีที่กลุ่มๆ นี้ปฏิบัติต่อผู้หญิงและชนกลุ่มน้อยด้วย


เมื่อครั้งที่กลุ่มตาลิบันปกครองอัฟกานิสถานในช่วงปลายทศวรรษที่ 90 ผู้มีอำนาจในยุคนั้นสั่งห้ามไม่ให้เด็กผู้หญิงและสตรีเข้าเรียนในโรงเรียน และทำงานหาเลี้ยงชีพ รวมทั้งไม่ให้ออกไปใช้ชีวิตภายนอกบ้านด้วย


ในครั้งนี้ กลุ่มตาลิบันประกาศว่า รัฐบาลชุดที่ตนจัดตั้งนั้นเป็นรัฐบาลรักษาการ ซึ่งเป็นสัญญาณที่ชี้ว่า อาจมีการเปลี่ยนแปลงได้ แต่ทางกลุ่มยังไม่ได้เปิดเผยว่า จะมีการจัดการเลือกตั้งหรือไม่ในอนาคต


โฆษก มูจาฮิด ยังออกโรงปกป้องรายชื่อคณะรัฐมนตรีรัฐบาลตาลิบันด้วยการระบุว่า ทางกลุ่มได้เชิญสมาชิกชนกลุ่มน้อย เช่น กลุ่มฮาซาราส มาร่วมรัฐบาลด้วยแล้ว และอาจจะมีการเสนอชื่อผู้หญิงเข้าร่วมในลำดับต่อไป",https://www.voathai.com/a/taliban-deputy-ministers-government-inclusive-women-rights/6237682.html,22_09_2021
