title,summary,link,published
วิเคราะห์: “เจอโรม พาวเวลล์” กับโอกาสรับตำแหน่งประธาน Fed สมัยที่ 2,ธนาคารกลางของสหรัฐฯ หรือเฟด (Federal Reserve) ถือเป็นองค์กรอิสระสำคัญของรัฐบาลที่มีความสามารถในการควบคุมทิศทางของเศรษฐกิจอเมริกันและเสถียรภาพของระบบการเงินด้วยการปรับนโยบายต่างๆ รวมทั้งอัตราดอกเบี้ยและออกมาตราการต่อสถาบันการเงิน ปกติแล้วสามตำแหน่งใหญ่ซึ่งได้แก่ ประธาน รองประธาน และรองประธานผู้ดูแล จะได้รับการแต่งตั้งโดยประธาธิบดีสหรัฐฯ ตำแหน่งเหล่านี้จะมีวาระ 4 ปี อย่างไรก็ตาม บุคคลที่จะดำรงสามตำแหน่งข้างต้นได้นั้นจะต้องได้การแต่งตั้งให้เข้ามาอยู่ในคณะผู้ว่าการระบบธนาคารกลางสหรัฐฯ (Federal Reserve Board) เสียก่อน โดยคณะดังกล่าวประกอบด้วยผู้ว่าการ 7 คนซึ่งตำแหน่งเหล่านี้จะมีวาระทั้งสิ้น 14 ปี หมายความว่าผู้ว่าการแต่ละคนสามารถดำรงตำแหน่งคาบเกี่ยวประธานาธิบดีได้หลายสมัย การจัดตั้งระบบขึ้นมาเช่นนี้เป็นการส่งเสริมให้เฟดเป็นอิสระต่ออิทธิพลหรือแนวคิดทางเศรษฐกิจของพรรคการเมืองใดพรรคการเมืองหนึ่ง ประเด็นร้อนล่าสุดที่เกิดขึ้นและอาจจะส่งผลกระทบต่อการเสนอชื่อนาย เจอโรม พาวเวลล์ หรือประธานคณะผู้ว่าการระบบธนาคารกลางของสหรัฐฯ คนปัจจุบันให้ดำรงตำแหน่งต่อไปอีก 4 ปี มีเรื่องราวมาจากการซื้อหุ้นและอสังหาริมทรัพย์ของเจ้าหน้าที่ระดับสูงของเฟดที่ดูแลธนาคารกลางในเขตดัลลาสและเขตบอสตัน ซึ่งประกอบด้วยบุคคลตำแหน่งรองประธานสาขาดังกล่าว อย่างไรก็ตามทั้งคู่กล่าวว่าได้ทำตามกฎหมายและเเนวทางที่เกี่ยวข้อง นอกจากนั้นยังได้ประกาศลงจากตำแหน่งในวันที่ 27 กันยายนแล้ว วุฒิสมาชิก อลิซาเบธ วอร์เรน จากรัฐแมสซาชูเซตส์ได้ออกมาวิจารณ์ว่าเหตุการณ์ที่ไม่โปร่งใสข้างต้นเกิดขึ้นภายใต้การอนุมัติของนายเจอโรม พาวเวลล์ เธอจึงเรียกร้องให้มีการไต่สวนขึ้น พร้อมทั้งบอกให้หลายๆฝ่ายคัดค้านการเสนอชื่อให้นายพาวเวลล์ดำรงแหน่งหัวหน้าเฟดต่อด้วย ขณะนี้ วาระของเขาเหลือเพียงไม่ถึง 6 เดือนเท่านั้นและประธานาธิบดีไบเดนจะต้องทำการเสนอชื่อว่าจะให้นายพาวเวลล์ดำรงตำแหน่งต่อไปหรือไม่ใน เร็วๆนี้ นอกจากนี้ ตำแหน่งบนบอร์ดเฟดก็ยังมีว่างอยู่หนึ่งตำแหน่งและในเดือนมกราคมปีหน้าที่จะถึงนี้ อีกตำแหน่งก็จะว่างด้วย อย่างไรก็ตาม นักวิเคราะห์อาวุโสหลายๆ คน รวมทั้งเดวิด เวสแซลแห่งสถานบัน Brookings Institution และมาร์ค แฮมริคของเว็บไซด์ทางการเงิน Bankrate.com ต่างก็บอกกับวีโอเอว่า มีความเป็นไปได้สูงที่นาย เจอโรม พาวเวลล์ จะได้รับการเสนอชื่อให้ดำรงตำแหน่งประธานคณะผู้ว่าการระบบธนาคารกลางของสหรัฐฯ ต่อไปอีก 4 ปี คุณมาร์ค แฮมริคระบุเหตุผลว่านายพาวเวลล์มีผลงานที่ดีในการคุมบังเหียนเศรษฐกิจสหรัฐฯ ทั้งยังได้รับจากสนับสนุนจากทั้งฝั่งเดโมแครตและรีพับลิกันอีกด้วย ส่วนคุณเดวิด เวสแซลบอกสั้นๆ ว่าแม้จะได้รับการเสนอชื่ออีกครั้งแต่ก็หลีกเลี่ยงไม่ได้ที่จะยอมรับว่าประเด็นการซื้อหุ้นที่ของเจ้าหน้าที่ระดับก็ส่งผลกระทบต่อนายพาวเวลล์ในทางลบ แม้จะมีความเป็นไปได้สูงว่าการโน้มนาวของวุฒิสมาชิกวอร์เรนที่จะไม่ให้นายพาวเวลล์นั่งเก้าอี้หัวหน้าเฟดต่อนั้นจะไม่ประสบผลสำเร็จ แต่การการะทำของเธอก็ไม่ถือว่าเสียเปล่า เพราะเธอกับนักการเมืองที่มีความคิดแนวก้าวหน้าได้ออกตัวอย่างชัดเจนว่าอยากให้ผู้ว่าการเฟดอย่างเลเอล์ เบรย์เนิร์ด ที่มีจุดยืนที่สนับสนุนพรรคเดโมแครค ขึ้นมานั่งเก้าอี้หลักแทนนายพาวเวลล์ และหากไม่ได้ตำแหน่งดังกล่าว นางเบรย์เนิร์ดก็อาจจะได้มานั่งตำแหน่งสำคัญอื่นๆ แทน ปิดท้ายด้วยนายเจสสี่ แวน โทล ประธานกลุ่ม National Community Reinvestment ที่คาดการณ์ว่ามีโอกาสที่รัฐบาลชุดนี้เลือกที่จะแต่งตั้งผู้ว่าการเฟดตามคำเรียกร้องข้างต้นเพื่อให้นายพาวเวลล์ได้ดำรงตำแหน่งต่อ หากรัฐบาลชุดนี้เชื่อว่าผู้ว่าการต่างๆได้รับการแต่งตั้งให้มาดำรงตำแหน่งสำคัญๆ จะสามารถงานร่วมกับนายพาวเวลล์ได้,https://www.voathai.com/a/fed-chairman-jerome-powell-renomination-threatened-by-controversy/6261848.html,08_10_2021
‘ซีไอเอ’ ตั้งศูนย์ใหม่รับมือภัยคุกคามจากจีนโดยเฉพาะ,สำนักงานข่าวกรองกลางของสหรัฐฯ หรือ ซีไอเอ (CIA) ปรับเปลี่ยนโครงสร้างภายในบางอย่างขององค์กร ด้วยการจัดตั้ง “ศูนย์ปฏิบัติการด้านจีน” (China Mission Center) เพื่อตอบโต้ต่อนโยบายที่เป็นปรปักษ์ของรัฐบาลกรุงปักกิ่ง ผู้อำนวยการซีไอเอ วิลเลียม เบิร์นส ประกาศการจัดตั้งศูนย์แห่งใหม่ในวันพฤหัสบดี โดยระบุว่า รัฐบาลจีนคือ “ภัยคุกคามด้านภูมิศาสตร์การเมืองที่สำคัญที่สุดในศตวรรษที่ 21” และว่า ซีไอเอจะเป็นด่านหน้าในการรับมือบททดสอบที่ท้าทายที่สุดในยุคสมัยใหม่นี้ เหมือนที่ทำมาตลอดในประวัติศาสตร์อเมริกา นอกจากศูนย์ปฏิบัติการด้านจีนแล้ว ซีไอเอยังประกาศจัดตั้ง “ศูนย์ปฏิบัติการข้ามชาติและเทคโนโลยี” (Transnational and Technology Mission Center) รวมทั้งเพิ่มตำแหน่งใหม่ คือ ประธานเจ้าหน้าที่ด้านเทคโนโลยี หรือ chief technology officer เพื่อรับหน้าที่จัดการประเด็นปัญหาเกี่ยวกับการแข่งขันระหว่างประเทศ ซึ่งรวมถึงเทคโนโลยีสมัยใหม่ ความมั่นคงปลอดภัยทางเศรษฐกิจ สาธารณสุขโลก และการเปลี่ยนแปลงของสภาพภูมิอากาศ นอกจากนี้ ซีไอเอยังเปิดตัวโครงการใหม่ชื่อว่า Technology Fellows Program ซึ่งจะเชิญผู้เชี่ยวชาญจากต่างชาติให้มาทำงานกับซีไอเอเป็นเวลา 1-2 ปีด้วย เมื่อเดือนกุมภาพันธ์ปีนี้ ผอ.ซีไอเอ กล่าวกับคณะกรรมาธิการของวุฒิสภาสหรัฐฯ เพื่อยืนยันการเข้ารับตำแหน่งว่า “การแข่งขันกับจีนจะเป็นกุญแจสำคัญต่อความมั่นคงแห่งชาติของสหรัฐฯ ในช่วงหลายทศวรรษจากนี้” และกล่าวด้วยว่า ผู้นำจีนในปัจจุบันเป็นทั้ง “ศัตรู” และ “ผู้ล่า” นายเบิร์นส กล่าวด้วยว่า วิวัฒนาการของจีนในช่วง 6-7 ปีที่ผ่านมา ถือเป็นสัญญาณเตือนภัยว่า อเมริกากำลังเผชิญกับความก้าวร้าว ความทะเยอทะยาน และการรุกรานอย่างตรงไปตรงมา ผอ.ซีไอเอ กล่าวไว้เมื่อเดือนเมษายนด้วยว่า การขับเคี่ยวระหว่างสหรัฐฯ กับจีนในขณะนี้ มุ่งเน้นไปที่เรื่องเทคโนโลยีเป็นหลัก และ 1 ใน 3 ของคนทำงานในซีไอเอในปัจจุบันก็เกี่ยวข้องกับเทคโนโลยีและไซเบอร์เช่นกัน อย่างไรก็ตาม แถลงการณ์ของซีไอเอยืนยันว่า แม้จะมีการพุ่งความสนใจไปที่ภัยคุกคามจากจีนมากขึ้น แต่ความท้าทายจากส่วนอื่น ๆ ของโลกก็ยังคงอยู่ในการจับตามองของซีไอเอเหมือนที่ผ่านมา รวมถึงการคุกคามของรัสเซีย การยั่วยุของเกาหลีเหนือ และความเป็นปรปักษ์ของอิหร่าน แต่การรับมือของซีไอเอต่อความท้าทายเหล่านั้นจะเปลี่ยนไป ทั้งนี้ เจ้าหน้าที่อเมริกันผู้หนึ่งซึ่งไม่เปิดเผยชื่อ กล่าวกับวีโอเอว่า ภายใต้การปรับโครงสร้างองค์กรใหม่นี้ ซีไอเอจะลดระดับ “ศูนย์ปฏิบัติการด้านเกาหลีเหนือ” ที่จัดตั้งขึ้นเมื่อปี ค.ศ. 2017 ไปอยู่ภายใต้ “ศูนย์ปฏิบัติการด้านเอเชียตะวันออกและแปซิฟิก” เช่นเดียวกับ “ศูนย์ปฏิบัติการด้านอิหร่าน” ที่จะกลับไปอยู่ภายใต้ “ศูนย์ปฏิบัติการด้านตะวันออกใกล้” เช่นกัน,https://www.voathai.com/a/us-spy-agency-pivots-to-better-confront-beijing/6261270.html,08_10_2021
เนสท์เล่ เผยโฉม ‘กุ้งและไข่จากโปรตีนพืช’ ลงตลาดอาหารวีแกนดุเดือด,เข้ากับเทศกาลกินเจในประเทศไทย ด้วยเมนูอาหารจากโปรตีนพืชที่บริษัทเนสท์เล่ เอาใจผู้บริโภคอาหารกลุ่มโปรตีนทางเลือกที่เติบโตต่อเนื่อง ซึ่งไม่ใช่เมนูไก่ หรือ เบอร์เกอร์เนื้อเทียมอย่างที่เคย นีธิกาญจน์ กำลังวรรณ นำรายงานของรอยเตอร์ มานำเสนอวันนี้,https://www.voathai.com/a/plant-based-egg-and-shrimp-on-nestle-s-menu-as-it-taps-into-vegan-growth-10072021/6261628.html,08_10_2021
‘อังกฤษ’ ผ่อนคลายมาตรการกักตัวผู้เดินทางมาจาก 47 ประเทศ รวมไทย,รัฐบาลอังกฤษจะเริ่มผ่อนคลายการใช้มาตรการกักตัวผู้ที่เดินทางมาจากต่างประเทศ รวม 47 ประเทศ รวมทั้ง อินเดีย แอฟริกาใต้ บราซิล ตุรกี และไทย รัฐมนตรีว่าการกระทรวงคมนาคมอังกฤษ แกรนท์ แชปส์ กล่าวในวันพฤหัสบดีว่า จะถอดชื่อ 47 ประเทศออกจากบัญชีรายชื่อประเทศอันตรายที่ยังคงมีอัตราการระบาดในระดับสูง หรือ red list โดยจะเหลือเพียง 7 ประเทศที่ยังคงอยู่ในรายชื่อและต้องใช้มาตรการกักตัวในโรงแรม 10 วันต่อไป รวมทั้งโคลอมเบีย เอกัวดอร์ ปานามา และเวเนซุเอลา สำหรับผู้ที่มาจาก 47 ประเทศที่ถูกถอดชื่อออกจาก red list นั้น ไม่จำเป็นต้องกักตัว 10 วันอีกต่อไป หากว่าได้รับวัคซีนครบโดสแล้ว ซึ่งเป็นวัคซีนที่ผ่านการรับรองของรัฐบาลอังกฤษ และแสดงผลตรวจโควิดเป็นลบประกอบด้วย ปัจจุบัน วัคซีนที่ผ่านการรับรองของรัฐบาลอังกฤษมีอยู่ 4 บริษัท คือ แอสตราเซเนกา (AstraZeneca) ไฟเซอร์-ไบโอเอ็นเทค (Pfizer-BioNTech) โมเดอร์นา (Moderna) และ จอห์นสันแอนด์จอห์นสัน (Johnson & Johnson) รัฐมนตรีแชปส์ กล่าวว่า การสร้างความเชื่อมันให้นักท่องเที่ยวคือปัจจัยสำคัญในการฟื้นฟูเศรษฐกิจอังกฤษ ซึ่งการลดข้อจำกัดต่าง ๆ เพื่อให้ประชาชนสามารถเดินทางเข้าออกประเทศได้สะดวกขึ้นนั้น จะช่วยให้อังกฤษเดินหน้าฟื้นฟูเศรษฐกิจได้อย่างปลอดภัย ทั้งนี้ มาตรการใหม่นี้จะเริ่มมีผลบังคับใช้ในวันจันทร์ที่ 11 ตุลาคมนี้เป็นต้นไป (ข้อมูลบางส่วนจากสำนักข่าวรอยเตอร์),https://www.voathai.com/a/britain-eases-quarantine-requirements-for-47-countries/6261708.html,08_10_2021
แผ่นดินไหวความแรง 6.1 เขย่าโตเกียว! ทำไฟดับหลายจุด,สำนักข่าวรอยเตอร์รายงานว่า เกิดแผ่นดินไหวความแรง 6.1 บริเวณกรุงโตเกียวและพื้นที่รอบ ๆ ในช่วงคืนวันพฤหัสบดีตามเวลาท้องถิ่น ทำให้ระบบรถไฟต้องหยุดบริการชั่วคราวและมีไฟฟ้าดับบางพื้นที่ แต่ไม่มีรายงานความเสียหายครั้งใหญ่ ตามรายงานของสื่อ NHK สำนักงานธรณีวิทยาของญี่ปุ่น ระบุว่า แผ่นดินไหวครั้งนี้เกิดขึ้นเมื่อเวลาประมาณ 22.41 น. ของคืนวันพฤหัสบดีตามเวลากรุงโตเกียว จุดศูนย์กลางอยู่ในเขตชิบะ ทางตะวันออกของกรุงโตเกียว โดยมีความรุนแรงในระดับ 5 ตามมาตรวัดของทางการญี่ปุ่น ซึ่งอาจทำให้เกิดความเสียหายต่ออาคารบ้านเรือนและไฟฟ้าดับได้ อย่างไรก็ตาม NHK รายงานว่า ไม่มีอันตรายจากคลื่นยักษ์สึนามิแต่อย่างใด ภาพข่าวของ NHK แสดงให้เห็นอาคารสองชั้นในเขตไซตามะเกิดเพลิงลุกไหม้ และมีผู้ได้รับบาดเจ็บจากแผ่นดินไหว 4 ราย นอกจากนี้ บริษัทพลังงานไฟฟ้ากรุงโตเกียว รายงานว่า มีบ้านเรือนที่ไฟฟ้าดับราว 250 หลัง ด้านนายกรัฐมนตรีคนใหม่ของญี่ปุ่น ฟูมิโอะ คิชิดะ สั่งการให้หน่วยปฏิบัติการพิเศษเข้าช่วยเหลือประชาชนที่เดือดร้อน และร่วมมือกับกับทางการส่วนท้องถิ่นเพื่อรับมือภัยธรรมชาติครั้งนี้ (ที่มา: Reuters),https://www.voathai.com/a/strong-earthquake-jolts-tokyo-preliminary-magnitude-at-6-1-/6261707.html,08_10_2021
