title,summary,link,published
‘ไฟเซอร์-ไบโอเอ็นเทค’ ขอรับรองใช้วัคซีนโควิดกับเด็ก 5-11 ปี คาดทัน พ.ย.นี้,"บริษัทยาไฟเซอร์และไบโอเอ็นเทค (Pfizer - BioNTech) ยื่นคำขออย่างเป็นทางการในวันพฤหัสบดี เพื่อให้รัฐบาลสหรัฐฯ อนุมัติให้ใช้วัคซีนโควิดกับเด็กอายุระหว่าง 5-11 ปี เป็นการฉุกเฉิน ผู้ประสานงานด้านการรับมือโควิด-19 ของทำเนียบขาว เจฟฟรีย์ ไซเอนท์ส กล่าวว่า หากผ่านการรับรองของสำนักงานอาหารและยาสหรัฐฯ หรือ เอฟดีเอ (FDA) วัคซีนโควิดสำหรับประชากรอายุ 5-11 ปี อาจจะสามารถใช้ได้ในเดือนพฤศจิกายนนี้ เอฟดีเอ กำหนดหารือกับที่ปรึกษาและผู้เชี่ยวชาญในวันที่ 26 ตุลาคมนี้ ว่าจะรับรองให้ใช้วัคซีนดังกล่าวเป็นกรณีฉุกเฉินหรือไม่ ปัจจุบัน อัตราการติดเชื้อของเด็กในสหรัฐฯ เพิ่มขึ้นสูงสุดนับตั้งแต่เกิดการระบาดเมื่อปีที่แล้ว หลังจากเริ่มเปิดภาคเรียนใหม่เมื่อเดือนกันยายนที่ผ่านมา อ้างอิงจากข้อมูลของสถาบันกุมารแพทย์อเมริกัน ทั้งนี้ ไฟเซอร์ส่งข้อมูลการทดสอบวัคซีนกับเด็กให้ทางเอฟดีเอพิจารณาเมื่อเดือนที่แล้ว โดยใช้กลุ่มตัวอย่าง 2,268 คน โดยผลการทดสอบชี้ให้เห็นว่าวัคซีนมีความปลอดภัยและมีประสิทธิผลสูงกับประชากรอายุ 5-11 ปี ปัจจุบัน เอฟดีเออนุมัติให้ใช้วัคซีนของไฟเซอร์กับเยาวชนอายุ 12-15 ปีเป็นกรณีฉุกเฉิน และอนุมัติเต็มรูปแบบให้ใช้กับผู้ที่อายุเกิน 16 ปี (ข้อมูลบางส่วนจากเอพีและรอยเตอร์)",https://www.voathai.com/a/pfizer-biontech-seek-approval-for-use-of-covid-vaccine-for-children-ages-5-11/6261266.html,08_10_2021
นักเขียนขาวแทนซาเนียคว้ารางวัลโนเบลสาขาวรรณกรรม 2021,รางวัลโนเบลสาขาวรรณกรรม ประจำปี ค.ศ. 2021 ตกเป็นของนักเขียนชาวแทนซาเนีย อับดุลราซัก เกอร์นาห์ (Abdulrazak Gurnah) จากผลงานการประพันธ์นวนิยายที่พรรณนาถึงประสบการณ์การเป็นผู้ลี้ภัย และผลกระทบจากยุคล่าอาณานิคมที่มีต่อวัฒนธรรมแอฟริกัน เลขาธิการสถาบันแห่งชาติสวีเดน แมตส์ เฮล์ม ประกาศผู้ได้รับรางวัลสาขาวรรณกรรม ที่สำนักงานใหญ่ในกรุงสตอกโฮล์ม โดยระบุว่า ผลงานของเกอร์นาห์ได้รับรางวัลเพราะสามารถบ่งบอกถึงผลพวงของการล่าอาณานิคมและชะตากรรมของผู้ลี้ภัยที่ตกอยู่ท่ากลางวัฒนธรรมและถิ่นที่อยู่ต่าง ๆ ได้อย่างชัดเจน อับดุลราซัก เกอร์นาห์ เกิดเมื่อปี ค.ศ. 1948 และเติบโตมาบนเกาะซันซิบาร์ในมหาสมุทรอินเดีย เขาเดินทางมาถึงอังกฤษในช่วงปลายทศวรรษ 1960 ในสถานะผู้ลี้ภัย เกอร์นาห์เริ่มงานเขียนตั้งแต่อายุ 21 ปี และมีผลงานเป็นนวนิยาย 10 เรื่อง และเรื่องสั้นอีกหลายเรื่อง รวมทั้งผลงานล่าสุดที่ได้รับการยกย่องอย่างมากเรื่อง “Afterlives” ที่ตีพิมพ์เมื่อปีที่แล้ว เกอร์นาห์ จะได้รับเงินรางวัล 1 ล้านยูโร (1.1 ล้านดอลลาร์) เท่ากับผู้ชนะรางวัลโนเบลในสาขาอื่น ๆ เมื่อต้นสัปดาห์นี้ มีการประกาศผลรางวัลโนเบลไปแล้วสามสาขาด้วยกัน คือ สาขาการแพทย์ สาขาฟิลิกส์ และสาขาเคมี ส่วนสาขาสันติภาพจะประกาศในวันศุกร์นี้ และปิดท้ายด้วยสาขาเศรษฐศาสตร์ที่จะประกาศในวันจันทร์ที่ 11 ตุลาคม สำหรับพิธีมอบรางวัลอย่างเป็นทางการจะมีขึ้นในเดือนธันวาคม โดยปีนี้จะเป็นการผสมผสานระหว่างพิธีมอบรางวัลแบบออนไลน์กับงานที่มีผู้เข้าร่วมจริง (ข้อมูลบางส่วนจากสำนักข่าวรอยเตอร์),https://www.voathai.com/a/nobel-prize-in-literature-awarded-to-tanzanian-novelist-abdulrazak-gurnah/6261264.html,08_10_2021
ยอดขายแชมเปญจ่อพุ่งสูงสุดในรอบ 4 ปี,สำนักข่าวรอยเตอร์ รายงานว่า ยอดขายเครื่องดื่มแชมเปญในปีนี้น่าจะพุ่งถึงระดับสูงสุดในรอบ 4 ปี อันเป็นผลมาจากการส่งออกไปยังตลาดสหรัฐฯ และออสเตรเลียที่ขยายตัวอย่างมาก รายงานข่าว เปิดเผยด้วยว่า SGV ซึ่งเป็นกลุ่มล็อบบี้เกษตรกรผู้ปลูกองุ่นแชมเปญที่เปิดเผย การประเมินทิศทางยอดขายปีนี้ออกมาในวันพฤหัสบดี ระบุด้วยว่า การที่อังกฤษถอนตัวออกจากการเป็นสมาชิกสหภาพยุโรป (EU) หรือ เบร็กซิต (Brexit) และปัญหาข้อพิพาทกับรัสเซียที่บังคับให้ผู้ผลิตในฝรั่งเศสระบุที่ฉลากหลังขวดว่า ผลิตภัณฑ์นั้นเป็น Sparkling Wine หรือ ไวน์ที่มีฟอง จนทำให้มีผู้เรียกร้องให้มีการคว่ำบาตรตลาดรัสเซีย ล้วนไม่ได้มีผลต่อปริมาณการขายแชมเปญเลย ตัวเลขคาดการณ์ยอดขายดังกล่าวถือเป็นข่าวดีสำหรับผู้ผลิตที่เกี่ยวข้อง ที่ต้องประสบปัญหาผลผลิตตกต่ำที่สุดในรอบ 40 ปี ในปีนี้ หลังไร่องุ่นต่างๆ ถูกภาวะน้ำค้างแข็งและการระบาดของเชื้อราทำลายพืชผลไปมากมาย ขณะที่ อุตสาหกรรมการผลิตเครื่องดื่มเลื่องชื่อนี้ก็ต้องรับผลกระทบจากมาตรการปิดบาร์และร้านอาหารในช่วงที่มีการระบาดของโควิด-19 ด้วย แต่การผ่อนคลายมาตรการควบคุมของรัฐบาลต่างๆ และการกลับมาเปิดตลาดและกิจกรรมทางเศรษฐกิจทั้งหลายในช่วงที่ผ่านมาน่าจะช่วยกระตุ้นยอดขายให้เพิ่มขึ้นถึงระดับ 305 ล้านขวด เทียบกับยอดขาย 297 ล้านขวดในปี ค.ศ. 2019 หรือก่อนเริ่มมีการระบาดของโคโรนาไวรัส ตามการประเมินของ SGV ทั้งนี้ ข้อมูลการส่งออกแชมเปญตั้งแต่เดือนมกราคมจนถึงเดือนสิงหาคม แสดงให้เห็นอัตราการขยายตัวถึง 11.9 เปอร์เซ็นต์ เมื่อเทียบกับช่วงเดียวของปี ค.ศ. 2019 แม้ว่ายอดขายในฝรั่งเศสเองจะหดตัว 2.4 เปอร์เซ็นต์ก็ตาม (ที่มา: สำนักข่าว รอยเตอร์),https://www.voathai.com/a/champagne-sales-exports-growth-ravaged-vineyard/6261651.html,08_10_2021
‘กูเกิล’ เผย บริการค้นหาเที่ยวบินของตนช่วยลดการปล่อยก๊าซเรือนกระจกได้,‘กูเกิล’ บริษัทเทคโนโลยีชั้นนำของโลก ประกาศว่า ระบบช่วยค้นหาเที่ยวบินที่เพิ่งเปิดตัวออกมาใหม่ของตน มีความสามารถช่วยนักเดินทางตัดสินใจเลือกเที่ยวบินที่มีอัตราการปล่อยก๊าซคาร์บอนที่ต่ำได้ ซึ่งหมายถึง การเดินทางทางอากาศที่เป็นมิตรกับสิ่งแวดล้อมมากขึ้น สำนักข่าว เอพี รายงานว่า ระบบช่วยค้นหาเที่ยวบินพร้อมลูกเล่นใหม่ที่ กูเกิล เพิ่งเปิดตัวออกมาเมื่อวันพุธนี้ จะแสดงให้เห็นถึงข้อมูลปริมาณก๊าซคาร์บอนไดออกไซด์ที่แต่ละเที่ยวบินปล่อยออกมาตั้งแต่เริ่มออกบินจนถึงจุดหมายปลายทาง ขณะที่ผู้ใช้งานสามารถเลือกจัดอันดับเงื่อนไขการค้นหาโดยเน้นไปที่อัตราการปล่อยก๊าซเป็นหลัก เหมือนเวลาที่ตั้งเงื่อนไขเรื่องราคาขณะค้นหาเที่ยวบินได้ด้วย รายงานข่าวระบุว่า เที่ยวบินที่มีอัตราการปล่อยก๊าซคาร์บอนต่ำกว่าค่าเฉลี่ยมัธยฐานจะถูกไฮไลท์ด้วยแถบสีเขียว กูเกิล เปิดเผยว่า ข้อมูลเกี่ยวกับปริมาณก๊าซคาร์บอนของแต่ละเที่ยวบินนั้น เป็นการประเมินตัวเลขที่รวบรวมมาจากสำนักงานสิ่งแวดล้อมยุโรปและข้อมูลเฉพาะของแต่ละเที่ยวบินที่สายการบินแต่ละแห่งรวมทั้งหน่วยงานที่เกี่ยวข้องเปิดเผยออกมา ซึ่งรวมความถึง อายุ รุ่น และระบบของตัวเครื่อง รวมทั้งความเร็วและระดับความสูงของการบิน และระยะทางจากจุดเริ่มต้นจนถึงที่หมายด้วย อย่างไรก็ตาม กูเกิล อธิบายว่า ผลการค้นหาเที่ยวบินบางเที่ยวอาจไม่มีตัวเลขประเมินการปล่อยก๊าซ เนื่องจากไม่สามารถหาข้อมูลได้หรือมีข้อมูลไม่เพียงพอ และย้ำด้วยว่า ตัวเลขประเมินที่ระบบแสดงให้ผู้ใช้งานเห็นไม่ได้นับรวมข้อมูลด้านเส้นทางของตัวเครื่องบิน ซึ่งเป็นปัจจัยค่อนข้างสำคัญเพราะจะบอกได้ว่า เป็นการบินตามลมหรือทวนลม หรือว่า เที่ยวบินนั้นๆ ใช้เชื้อเพลิงชีวภาพหรือตัวเลือกเชื้อเพลิงอื่นๆ ทั้งนี้ เครื่องบินเป็นแหล่งกำเนิดการปล่อยก๊าซคาร์บอนแหล่งหนึ่ง ที่แม้จะมีสัดส่วนการปล่อยเพียง 2-3 เปอร์เซ็นต์ แต่สัดส่วนนี้มีลักษณะเติบโตขึ้นอย่างรวดเร็วและคาดกันว่า จะขยายตัวได้ถึง 3 เท่าภายในช่วงกลางทศวรรษนี้ (ที่มา: สำนักข่าว เอพี),https://www.voathai.com/a/google-flight-search-lower-carbon-emission-green-travel/6261579.html,08_10_2021
ไอเอ็มเอฟ เรียกร้องรัฐบาลนานาประเทศปรับเปลี่ยนแผนนโยบายการคลังเพื่อจัดการกับหนี้โควิด,กองทุนการเงินระหว่างประเทศ (IMF) แนะนำว่า รัฐบาลประเทศต่างๆ ควรเริ่มวางแผนกลับไปดำเนินแผนงบประมาณแบบยั่งยืนอีกครั้ง ภายใต้นโยบายที่จะช่วยสร้างความมั่นใจในหมู่นักลงทุน หลังออกแผนกระตุ้นเศรษฐกิจขนาดใหญ่ออกมาต่อสู้กับการระบาดใหญ่ของโควิด-19 ในช่วงกว่าปีที่ผ่านมา ตามรายงานของสำนักข่าว รอยเตอร์ IMF ระบุในรายงานการสังเกตการณ์สถานะทางการคลัง (Fiscal Monitor) ฉบับล่าสุดว่า แต่ละประเทศต้องตัดสินใจสรุปเงื่อนเวลาและจังหวะที่เหมาะสมในการสะสางปรับเปลี่ยนนโยบายทางการคลังของตนให้สอดรับกับสภาพแวดล้อมของแต่ละประเทศ ซึ่งหมายถึง การพิจารณาดูสถานการณ์การระบาดของโควิด-19 ความเสี่ยงด้านการคลังที่เผชิญอยู่ ความเสี่ยงต่อบาดแผลระยะยาวของเศรษฐกิจ แรงกดดันจากประชากรสูงอายุ ความต้องการด้านโครงการพัฒนาต่างๆ และความยากลำบากในการจัดเก็บรายได้ที่ผ่านมา เปาโล เมาโร รองผู้อำนวยการด้านนโยบายการคลังของ IMF บอกกับ รอยเตอร์ว่า ในเวลานี้ ยังมีประเทศที่เผชิญภาวะระบาดรุนแรงอยู่ ซึ่งทำให้ลำดับความสำคัญที่รัฐบาลนั้นๆ ต้องใส่ใจยังคงเป็นเรื่องของแผนฉุกเฉินเพื่อรองรับสถานการณ์ด้านสาธารณสุขตอไป แต่สำหรับประเทศที่เริ่มมีการฟื้นตัวของกิจกรรมทางเศรษฐกิจแล้ว เมาโร แนะว่า “ควรเริ่มคิดวิธีที่จะค่อยๆ ลดแผนสนับสนุนทางการคลังที่ดำเนินการมาเพื่อพยุงเศรษฐกิจได้แล้ว” รายงานที่อ้างอิงการวิจัยของ IMF ยังระบุด้วยว่า ประเทศที่ดำเนินแผนความยั่งยืนทางการคลังในระยะกลาง ภายใต้กรอบงบประมาณที่เชื่อถือได้ สามารถทำการกู้ยืมด้วยอัตราดอกเบี้ยที่ต่ำกว่าและมีความสามารถมากกว่าที่จะรีไฟแนนซ์หนี้ของตน ทั้งยังแนะนำให้นานาประเทศพยายามตั้งเป้าการคลังแบบกว้างๆ ควบคู่นโยบายภาษีและนโยบายค่าใช้จ่ายที่หนุนกันเป็นระยะเวลา 3-5 ปี รวมทั้งพิจารณาการดำเนินนโยบายเฉพาะบ้าง เช่น การปรับขึ้นภาษี หรือเพดานอายุสำหรับผู้ที่จะมีสิทธิ์รับสวัสดิการหลังเกษียณ เป็นต้น (ที่มา: สำนักข่าว รอยเตอร์),https://www.voathai.com/a/imf-fiscal-shift-covid19-pandemic-debt/6261530.html,08_10_2021
