title,summary,link,published
‘ไอพีแอดเดรส’ หลายล้านหมายเลขของแอฟริกาถูกขโมย,"เป็นเวลานานหลายปีแล้วที่ประเทศอุตสาหกรรมได้หารายได้ทวีปแอฟริกา โดยการใช้แรงงานชาวแอฟริกันในการขุดทองและเพชร ล่าสุดพบว่า ปรากฎการณ์ดังกล่าวได้ลุกลามไปยังทรัพยากรทางดิจิตัล โดยมีการนำเอา ""ไอพีแอดเดรส"" หลายล้านหมายเลขที่เป็นของทวีปแอฟริกาไปใช้ และบางครั้งเป็นการใช้อย่างผิดกฎหมาย หมายเลขไอพี หรือ ไอพีแอดเดรส (IP Address) ซึ่งย่อมาจากคำว่า อินเตอร์เน็ต โปรโตคอล แอดเดรส (Internet Protocol Address) เป็นหมายเลขเฉพาะที่กำหนดให้แก่อุปกรณ์แต่ละชนิด เช่น คอมพิวเตอร์ หรือเครื่องพิมพ์ ที่เชื่อมต่ออยู่ในเครือข่ายอินเตอร์เน็ต คล้ายกับหมายเลขที่บ้านของเรานั่นเอง โดยมีองค์กร Internet Assigned Numbers Authority หรือ IANA ทำหน้าที่กำหนดหมายเลขไอพีให้แต่ละภาคส่วนของโลก สำนักข่าว Associated Press รายงานว่ามีอาชญากรนำเอาหมายเลขไอพีของแอฟริกาไปใช้ ไอพีแอดเดรสบางหมายเลขถูกนำไปใช้ในวงการพนัน หรือใช้กับเว็บไซต์ลามกอนาจารของจีน เป็นต้น ภายในทวีปแอฟริกาเอง องค์กรไม่แสวงผลกำไร AFRINIC เป็นผู้ทำหน้าที่แจกจ่ายหมายเลขไอพี แต่กลับปรากฎว่าพนักงานระดับสูงคนหนึ่งขององค์กรกลับนำหมายเลขไอพีเหล่านั้นไปแจกจ่ายอย่างผิดกฎหมาย จนนำไปสู่การฟ้องร้องคดีฉ้อโกงใหญ่โต ทำให้ผู้บริหารชุดใหม่ของ AFRINIC ซึ่งมีสำนักงานประจำอยู่ที่ประเทศมอริเชียส กำลังพยายามนำไอพีแอดเดรสเหล่านั้นกลับคืนมา อย่างไรก็ตาม ภารกิจของ AFRINIC ต้องพบกับความท้าทายจากการสู้กลับของ ลู่ เฮง นักธุรกิจเชื้อสายจีนจากฮ่องกง ลู่ เฮง ได้รับหมายเลขไอพีกว่า 6.2 ล้านหมายเลข ซึ่งเป็นของทวีปแอฟริกาในระหว่างปี 2013 ถึง 2016 ซึ่งไม่มีข้อมูลที่แน่ชัดว่าเขาได้ไอพีแอดเดรสจำนวนมากนั้นมาได้อย่างไร หมายเลขไอพีจำนวนดังกล่าว คิดเป็นร้อยละ 5 ของหมายเลขไอพีทั้งหมดของทวีปแอฟริกา และมากกว่าจำนวนหมายเลขไอพีที่ประเทศเคนยาได้รับ คิดเป็นมูลค่า 150 ล้านดอลลาร์ เมื่อครั้งที่ AFRINIC นำเอาหมายเลขไอพีเหล่านี้กลับคืน ลู่ เฮง ได้สู้กลับ ในปลายเดือนกรกฎาคมที่ผ่านมา ทนายของลู่ เฮงได้โน้มน้าวให้ผู้พิพากษาในมอริเชียอายัดบัญชีธนาคารของกลุ่ม AFRINIC และยังกล่าวหาว่า AFRINIC และผู้บริหารหมิ่นประมาทเขาอีกด้วย การกระทำของลู่ เฮง ได้สร้างความตกตะลึงให้กับผู้สนับสนุนเสรีภาพทางอินเตอร์เน็ต ผู้ที่เห็นว่าอินเตอร์เน็ตเป็นเครื่องมือในการสร้างความก้าวหน้าและพัฒนาสังคม บางคนมองว่าการฟ้องร้องของนักธุรกิจเชื้อสายจีนผู้นี้อาจจะทำให้ระบบหมายเลขไอพีทั้งหมดอ่อนแอลง การทำงานชั้นในของเครือข่ายอินเตอร์เน็ตนั้นเป็นสิ่งที่มีคนส่วนใหญ่ในสังคมไม่ค่อยเข้าใจ และไม่ได้รับการเปิดเผยให้สังคมได้ตรวจสอบมากนัก มีองค์กรไม่หวังผลกำไรห้ากลุ่มเท่านั้นในโลกนี้ที่เป็นผู้ตัดสินใจว่าใครจะได้เป็นเจ้าของและใช้งานไอพีแอดเดรสรุ่นแรกของระบบเครือข่ายอินเตอร์เน็ต AFRINIC เป็นองค์กรลำดับสุดท้ายในห้าองค์กร ที่ก่อตั้งขึ้นมาในปี 2003 ลู่ เฮง ให้สัมภาษณ์กับสำนักข่าว Associated Press ว่าเขาเป็นคนซื่อสัตย์และไม่ได้ขโมยหรือใช้วิธีผิดกฎหมายเพื่อให้ได้มาซึ่งหมายเลขไอพีของทวีปแอฟริกา เขายังกล่าวด้วยว่ากลุ่มอย่าง AFRINIC ไม่ควรจะเป็นผู้ตัดสินใจว่าหมายเลขไอพีจะถูกใช้ที่ประเทศใด ในการนำหมายเลขไอพีคืนกลับมาจากลู่ เฮง กลุ่ม AFRINIC ได้พยายามที่จะนำเอาพื้นที่ทางอินเตอร์เน็ต ซึ่งเป็นทรัพยากรสำคัญในการพัฒนาทวีปแอฟริกา กลับคืนมาอีกครั้ง แอฟริกายังเป็นทวีปที่ล้าหลังประเทศอื่น ๆ ในโลกหากพูดถึงการใช้ทรัพยากรทางอินเตอร์เน็ตเพื่อพัฒนาสภาพความเป็นอยู่ ระบบสาธารณสุข และการศึกษาของคนในทวีป แอฟริกายังเป็นทวีปที่ได้รับไอพีแอดเดรสรุ่นแรกเพียงร้อยละ 3 ของหมายเลขไอพีรุ่นแรกของโลก",https://www.voathai.com/a/millions-of-africa-internet-addresses-ip-addresses-stolen/6263457.html,09_10_2021
โพลล์ชี้ชาวอเมริกันเห็นตรงกัน การเผยแพร่ข้อมูลผิด ๆ กำลังเป็นปัญหา,สำนักข่าวเอพี รายงานว่า ชาวอเมริกันเกือบทุกคนเห็นตรงกันว่าการเผยแพร่ข้อมูลที่ผิด ๆ เป็นปัญหาหนึ่งของสังคม ผลการสำรวจโดย The Pearson Institute และ The Associated Press-NORC Center for Public Affairs Research พบว่า ชาวอเมริกันส่วนใหญ่ยังคิดว่าบริษัทสื่อสังคมออนไลน์ หรือโซเชียลมีเดีย และผู้ใช้โซเชียลมีเดีย เป็นผู้ที่ต้องรับผิดชอบ อย่างไรก็ตามมีชาวอเมริกันเพียงส่วนน้อยเท่านั้นที่คิดว่าพวกเขาอาจจะมีส่วนที่ต้องรับผิดชอบต่อการแพร่กระจายของข้อมูลผิด ๆ ดังกล่าว ร้อยละ 95 ของชาวอเมริกันที่ตอบแบบสอบถามระบุว่าการให้ข้อมูลผิด ๆ เป็นความท้าทายเมื่อพวกเขาพยายามเข้าถึงข้อมูลที่สำคัญ ประมาณครึ่งหนึ่งของผู้ตอบแบบสอบถามกล่าวโทษรัฐบาลสหรัฐฯ สามในห้าของผู้ตอบแบบสอบถามโทษผู้ใช้โซเชียลมีเดียและบริษัทเทคโนโลยี แต่มีคนอเมริกันเพียงสองในสิบเท่านั้นที่บอกว่าพวกเขารู้สึกกังวลว่าพวกเขาเองอาจจะมีส่วนในการเผยแพร่ข้อมูลที่ผิด ๆ ในขณะที่มีประมาณร้อยละ 60 ที่มองว่าเพื่อนและคนในครอบครัวของพวกเขาเป็นส่วนหนึ่งของปัญหานี้ คาร์เมน สเปลเลอร์ นักศึกษาระดับปริญญาโทวัย 33 ปีในเมืองเล็กซิงตัน รัฐเคนตักกี บอกว่ามีความแตกต่างอย่างเห็นได้ชัดเมื่อเธอถกเรื่องการระบาดของโควิด-19 กับสมาชิกในครอบครัว สเปลเลอร์เชื่อมั่นในวัคซีนต้านโควิด ในขณะที่ครอบครัวของเธอไม่เชื่อ เธอคิดว่าครอบครัวของเธอได้รับข้อมูลผิด ๆ จากการดูทีวีหรืออ่านบทความจากเว็บไซต์ข่าวที่ไม่น่าเชื่อถือ ทำให้พวกเขาตัดสินใจไม่ยอมรับวัคซีนต้านโควิด-19 บางคนยังมองว่าเธอบ้าไปแล้วที่เชื่อข้อมูลจากรัฐบาล ซึ่งเธอมองว่าความขัดแย้งในเรื่องนี้ ทำให้เกิดความตึงเครียดในกลุ่มครอบครัวและเพื่อนของเธอ สเปลเลอร์ไม่ใช่คนเดียวเท่านั้นที่ต้องเจอกับปัญหานี้ จากการสำรวจพบว่าร้อยละ 79 ของผู้สนับสนุนพรรครีพับลิกัน และ ร้อยละ 73 ของผู้สนับสนุนพรรคเดโมแครตกล่าวว่าบริษัทโซเชียลมีเดียมีส่วนรับผิดชอบอย่างมากต่อการแพร่กระจายของข้อมูลที่ไม่ถูกต้อง ซึ่งไม่บ่อยนักที่ผู้ที่เห็นต่างทางการเมืองจะเห็นตรงกัน และความเห็นของสังคมในเรื่องนี้อาจจะสร้างความท้าทายให้กับเฟสบุ๊ค โซเชียลมีเดียที่ใหญ่ที่สุดและทำกำไรมากที่สุด ซึ่งตอนนี้กำลังได้รับการเพ่งเล็งจากสมาชิกสภาสหรัฐฯ จากทั้งสองพรรคเช่นกัน คอนสแตนติน โซนิน ศาสตราจารย์ด้านนโยบายสาธารณะแห่งมหาวิทยาลัยชิคาโก กล่าวว่า ผลโพลล์ของ AP-NORC นั้นเป็นข่าวร้ายสำหรับเฟสบุ๊ค เพราะเป็นที่ชัดเจนว่าการโจมตีเฟสบุ๊คนั้นเป็นสิ่งที่ได้รับความนิยมอย่างมาก ถึงแม้ว่าภายในสภาคองเกรสของสหรัฐฯ สมาชิกสภาจะเห็นต่างกันก็ตาม ในวันอังคารที่ผ่านมา สมาชิกวุฒิสภาสหรัฐฯ กล่าวว่าจะใช้กฎระเบียบใหม่เข้ามาควบคุมเฟสบุ๊คหลังจากที่อดีตพนักงานเฟสบุ๊คได้ขึ้นให้ข้อมูลต่อคณะอนุกรรมาธิการของวุฒิสภาว่าการทำวิจัยของเฟสบุ๊คเองแสดงได้เห็นว่า อัลกอริทึมของบริษัทได้เพิ่มการแพร่กระจายของข้อมูลที่ผิด และเนื้อหาที่เป็นภัยต่อเด็กและเยาวชน ส.ว.พรรคเดโมแครตและพรรครีพลับลิกัน เห็นตรงกันว่าจะต้องมีการใช้กฎระเบียบเพื่อเปลี่ยนแปลงวิธีการทำงานของเฟสบุ๊คในการเพิ่มเนื้อหาและการเจาะกลุ่มเป้าหมายของเฟสบุ๊ค ผลการสำรวจความคิดเห็นยังระบุอีกว่า ชาวอเมริกันพร้อมที่จะกล่าวโทษทุกคน ยกเว้นตัวเอง ในการเผยแพร่ข้อมูลที่ผิด โดยมีมากกว่าครึ่งที่ตอบว่าพวกเขาไม่คิดว่าพวกเขามีส่วนในการเผยแพร่ข้อมูลที่ไม่ถูกต้องเหล่านั้น ในขณะที่ผู้ใหญ่วัยต้นจะกังวลมากกว่าว่าพวกเขามีส่วน โดยมีชาวอเมริกันที่มีอายุ 18-29 ปี ถึงร้อยละ 25 ที่บอกว่าพวกเขากังวลอย่างมากว่าพวกเขาได้เผยแพร่ข้อมูลที่ไม่ถูกต้อง เมื่อเทียบกับร้อยละ 14 ของผู้ใหญ่ที่อายุมากกว่า 60 ปี ทั้ง ๆ ที่งานวิจัยได้แสดงให้เห็นว่าผู้ใหญ่ตอนปลายเป็นกลุ่มอายุที่มักจะแชร์ข้อมูลจากแหล่งข่าวที่ไม่น่าเชื่อถือมากที่สุด,https://www.voathai.com/a/polls-suggest-americans-agreed-misinformation-is-a-problem/6263563.html,09_10_2021
‘แดเนียล เครก’ บู๊ระห่ำสั่งลาบทสายลับ 007 ใน ‘No Time to Die’,"สิ้นสุดการรอคอยสำหรับแฟนหนังภาพยนตร์สายลับ 007 กับ No Time To Die หนังสั่งลาบทเจมส์ บอนด์ของพระเอกหุ่นบึ้ก แดเนียล เครก ที่เจอแตะเบรกเพราะโควิดมาถึง 3 ครั้ง ได้ฤกษ์เข้าฉายตามกำหนดไปในวันที่ 8 ตุลาคมนี้ บรรยากาศในรอบเปิดตัวที่กรุงลอนดอนเมื่อวันอังคาร เต็มไปด้วยบรรดาสมาชิกราชวงศ์อังกฤษ และทัพนักแสดงคนดังมากมายเข้าร่วม นับเป็นการฉายภาพยนตร์รอบปฐมทัศน์ที่ยิ่งใหญ่ที่สุดนับตั้งแต่การระบาดของโควิด-19 No Time To Die ภาพยนตร์ภาคที่ 25 ของสายลับ 007 เจอโรคเลื่อนไป 3 ครั้งถ้วนจากกำหนดการเดิมในเดือนเมษายน 2020 และการกลับมาเข้าฉายอย่างเป็นทางการครั้งนี้ บรรดาแฟนหนังและคอภาพยนตร์ต่างคาดหวังว่าจะเป็นการกลับมาของอุตสาหกรรมภาพยนตร์หลังวิกฤตโรคระบาดอย่างแท้จริง No Time To Die ที่ทุ่มทุนสร้างราว 200 ล้านดอลลาร์นี้ ว่าด้วยเรื่องราวของเจมส์ บอนด์ ที่เกษียณจากการเป็นสายลับไปหาความสงบสุขในจาเมกา ต้องร่วมงานกับสายลับสาว 00 agent ที่รับบทโดยนักแสดงสาวผิวสี ลาชานา ลินช์ (Lashana Lynch) เพื่อตามล่า ‘ซาฟิน’ ตัวร้ายซึ่งรับบทโดยเจ้าของรางวัลออสการ์ รามี มาเล็ค ทั้งนี้ ภาพยนตร์บอนด์เรื่องที่ 25 No Time To Die ได้รับกระแสตอบรับที่ดีจากฝั่งนักวิจารณ์ภาพยนตร์ โดย Rotten Tomato ให้ 84% และ IMDB ให้คะแนน 7.6 จากเต็ม 10 ส่วนในแง่รายได้ทาง Universal Pictures ประกาศเมื่อต้นสัปดาห์ว่า No Time To Die จะกวาดรายได้ตั๋วหนังทั่วโลก 121 ล้านดอลลาร์ในช่วงสุดสัปดาห์แรกที่เข้าฉาย และถือเป็นหนังเรื่องแรกที่ทำรายได้ทะลุ 100 ล้านดอลลาร์ในสุดสัปดาห์เปิดตัว โดยที่ไม่ได้เข้าฉายในจีน เฉพาะรายได้ตั๋วหนังฝั่งอังกฤษและไอร์แลนด์ เปิดตัวที่ 35 ล้านดอลลาร์ ทำให้หนังเรื่องนี้ทำสถิติหนังที่ทำรายได้เปิดตัวสูงสุดในยุคโควิดระบาดในฝั่งอังกฤษและไอร์แลนด์ไปแล้ว ขณะที่ภาพยนตร์เรื่องนี้มีกำหนดเข้าฉายในจีนปลายเดือนตุลาคมนี้ สำหรับแดเนียล เครก นี่คือหนังบอนด์ภาคที่ 5 และภาคอำลาบทพยัคฆ์ร้าย 007 ของเขา โดยเครกเปิดตัวในฐานะเจมส์ บอนด์ ในเรื่อง Casino Royale เมื่อปี 2006 ในบทบอนด์หุ่นบึ้กสายบู๊ ที่ไม่ได้ดูหล่อเหลาเจ้าสำอางเหมือนบอนด์คนก่อนๆ และครองสัมปทานบทสายลับ 007 มานานถึง 15 ปี และเมื่อวันพุธ (6 ตุลาคม) ชื่อของนักแสดงหุ่นล่ำแดเนียล เครก ได้ปรากฎใน Hollywood's Walk of Fame อย่างเป็นทางการ ก่อนหนังเรื่องสุดท้ายในฐานะเจมส์ บอนด์ของเขาจะเข้าฉายในวันที่ 8 ตุลาคมนี้ โดยดวงดาวที่ 2,704 บนถนนฮอลลีวู้ดของเขา อยู่เคียงข้างกับ โรเจอร์ มัวร์ (Roger Moore) ผู้รับบทเจมส์ บอนด์ มาถึง 7 เรื่อง ช่วงปี 1973-1985 สำหรับบทบาทต่อไปของเครก จะไปแสดงละครเวทีเรื่อง Macbeth ในเดือนมีนาคมปีหน้า (ที่มา: รอยเตอร์)",https://www.voathai.com/a/bond-is-back-in-movie-theaters-with-no-time-to-die-10082021/6263336.html,09_10_2021
