title,summary,link,published
การประชุม COP26: สานต่อเป้าหมายควบคุมอุณหภูมิไม่ให้เกิน 1.5 องศาเซลเซียส,"การประชุม 2021 United Nations Climate Change Conference หรือที่เรียกย่อ ๆ ว่า COP26 ขององค์การสหประชาชาติ มีขึ้นระหว่างวันที่ 31 ตุลาคม - 12 พฤศจิกายนนี้ที่เมืองกลาสโกว์ของสกอตแลนด์ เป็นการประชุมระหว่างประเทศเพื่อทำความตกลงเรื่องเป้าหมายและมาตรการต่าง ๆ ในความพยายามควบคุมอุณหภูมิเฉลี่ยของโลกไม่ให้เพิ่มขึ้นเกิน 1.5 องศาเซลเซียสเมื่อเทียบกับอุณหภูมิในช่วงก่อนยุคอุตสาหกรรมคือเมื่อกว่า 200 ปีที่แล้ว ผู้เชี่ยวชาญด้านสิ่งแวดล้อมชี้ว่า การประชุมระหว่างประเทศครั้งนี้มีความสำคัญที่สุดนับตั้งแต่การประชุมที่กรุงปารีสเมื่อหกปีที่แล้ว แต่ก็มีปัญหาท้าท้ายระดับโลกที่รอให้ขบแก้อยู่หลายเรื่องด้วยเช่นกัน ในการประชุมที่กรุงปารีสเมื่อหกปีที่แล้วซึ่งทำให้มีข้อตกลงกรุงปารีส หรือ Paris Agreement นั้น ตัวแทนจากนานาประเทศให้คำมั่นว่าจะพยายามทำให้อุณหภูมิเฉลี่ยของโลกสูงขึ้นไม่เกินกว่า 1.5 องศาเซลเซียสเหนืออุณหภูมิของโลกในช่วงก่อนยุคอุตสาหกรรม คือในช่วงต้นศตวรรษที่ 18 หรือเมื่อกว่า 200 ปีที่แล้ว อย่างไรก็ตาม ขณะที่ตัวแทนจากนานาประเทศกลับเข้าร่วมการประชุมติดตามผลซึ่งกำหนดขึ้นทุก ๆ ห้าปีนั้น นักวิทยาศาสตร์และผู้เชี่ยวชาญด้านสิ่งแวดล้อมก็เตือนว่าโลกของเรากำลังร้อนขึ้นอย่างรวดเร็วเกินเป้าหมายที่ตั้งไว้ และหากไม่มีความพยายามเพื่อลดการปล่อยก๊าซคาร์บอนไดออกไซด์รวมทั้งก๊าซเรือนกระจกอื่น ๆ อย่างจริงจังแล้ว โลกจะต้องพบกับภัยธรรมชาติในรูปต่าง ๆ นับตั้งแต่คลื่นความร้อนจัด พายุที่รุนแรง ภัยแล้งที่ยาวนาน รวมทั้งไฟป่าและระดับน้ำทะเลที่สูงขึ้น เป็นต้น ตามรายงานล่าสุดชื่อ United Nations Emissions Gap Report นั้น คำมั่นสัญญาและแผนดำเนินงานที่ประเทศต่าง ๆ นำเสนอเมื่อหกปีที่แล้ว ยังไม่เพียงพอที่จะทำให้อุณหภูมิของโลกสูงขึ้นไม่เกิน 1.5 องศาเซลเซียส เพราะข้อมูลขณะนี้แสดงว่า โลกกำลังมุ่งหน้าสู่ภาวะของการมีอุณหภูมิสูงขึ้น 2.7 องศาเซลเซียส และผู้เชี่ยวชาญบางคนถึงกับเตือนด้วยว่าโลกกำลังจะอยู่บนเส้นทางของการร้อนขึ้น 3.7 องศาเซลเซียสด้วย และขณะที่มีหลายสิบประเทศให้สัญญาว่าจะพยายามบรรลุภาวะของการมีก๊าซคาร์บอนสุทธิเป็นศูนย์ หรือ “net-zero” emissions ภายในปีค.ศ. 2050 ซึ่งหมายถึงการลดการผลิตก๊าซคาร์บอน รวมทั้งหาทางกำจัดก๊าซดังกล่าวด้วยวิธีต่าง ๆ เช่น เร่งปลูกป่านั้น รายงานของสหประชาชาติก็เตือนว่า แม้จะทำได้ตามสัญญาที่ให้ไว้ โลกของเราก็ยังจะอุ่นขึ้นในระดับ 2.2 องศาเซลเซียสอยู่ดี คำถามก็คืออะไรเป็นปัญหาและอุปสรรคสำคัญซึ่งทำให้เป้าหมายการควบคุมอุณหภูมิของโลกให้เพิ่มขึ้นไม่เกิน 1.5 องศาเซลเซียสนี้ยังอยู่ห่างไกล? คำตอบอาจจะมาจากเงื่อนไขเฉพาะของแต่ละประเทศ ตัวอย่างเช่น สหรัฐฯ เองนั้น แม้ประธานาธิบดีไบเดนจะแสดงความมุ่งมั่นและความร่วมมือของสหรัฐฯ ในเรื่องนี้และสัญญาว่าสหรัฐต้องการจะบรรลุภาวะ “net-zero” emissions ภายในปีค.ศ. 2050 เช่นกันก็ตาม แต่ขณะนี้รัฐสภาสหรัฐฯ เองยังไม่ได้ออกกฎหมายใด ๆ ที่ให้อำนาจรัฐบาลในเรื่องนี้ นอกจากนั้น ข้อกำหนดที่สำคัญในร่างกฎหมายดังกล่าวก็ยังถูกแปรญัตติหรือถูกถอดออกจากตัวร่างด้วย แต่นอกจากสหรัฐฯ รวมทั้งอีกหลายประเทศซึ่งแสดงความมุ่งมั่นในเรื่องนี้แล้ว จีนกับอินเดียที่เป็นผู้ผลิตก๊าซเรือนกระจกรายใหญ่ของโลกยังไม่ได้เสนอแผนดำเนินการใด ๆ อย่างชัดเจน ส่วนเม็กซิโกกับบราซิลก็ดูเหมือนจะเดินถอยหลังในเรื่องนี้ ปัญหาอีกด้านมาจากการผิดคำมั่นสัญญาของประเทศที่พัฒนาแล้วเรื่องการให้เงินช่วยเหลือแก่ประเทศกำลังพัฒนาเพื่อต่อสู้กับปัญหาโลกร้อน เพราะเมื่อปี 2009 หรือ 12 ปีที่แล้ว กลุ่มประเทศที่ร่ำรวยสัญญาจะให้เงินช่วยเหลือรวมหนึ่งแสนล้านดอลลาร์ต่อปีแก่ประเทศกำลังพัฒนาเพื่อพัฒนาเทคโนโลยีที่จะผลิตก๊าซคาร์บอนน้อยลง แต่องค์การ OECD รายงานว่า จนถึงปี 2019 เงินช่วยเหลือจากประเทศที่ร่ำรวยมีมูลค่ารวมกันเพียงแค่ราว 7 หมื่น 9 พันล้านดอลลาร์เท่านั้น โดยถึงแม้เมื่อสัปดาห์ที่ผ่านมา กลุ่มประเทศพัฒนาแล้วได้ประกาศแผนจะให้เงินช่วยเหลือให้ได้ตามเป้า คือหนึ่งแสนล้านดอลลาร์ภายในปี 2023 ก็ตาม แต่เรื่องนี้ก็ไม่ได้ช่วยให้กลุ่มประเทศที่ยากจนกว่าผู้รอรับความช่วยเหลือพอใจแต่อย่างใด โดยประเทศเหล่านี้ชี้ว่า พวกตนไม่ได้เป็นผู้ผลิตก๊าซเรือนกระจกรายใหญ่ แต่กลับต้องได้รับผลกระทบจากสภาพอากาศที่แปรปรวนและจากภัยธรรมชาติต่าง ๆโดยปริยาย จะเห็นได้ว่าความร่วมมือระดับโลกและการดำเนินการอย่างจริงจังเพื่อบรรลุเป้าหมายให้โลกมีอุณหภูมิเพิ่มขึ้นไม่เกิน 1.5 องศาเซลเซียส หรือในระดับใกล้เคียงเมื่อเทียบกับระดับอุณหภูมิก่อนยุคอุตสาหกรรมของโลกนั้น อาจไม่ใช่เรื่องง่าย ทั้งนี้ตามความเห็นของคุณลอรีนา กอนซาเลส แห่งศูนย์ World Resources Institute Finance Center ที่ว่า โลกได้ผัดผ่อนเรื่องนี้มานานสำหรับปัญหาซึ่งมีความสลับซับซ้อนมากที่สุดปัญหาหนึ่ง อย่างไรก็ตาม คุณคาเวห์ กุยลานพอร์ รองผู้อำนวยการฝ่ายยุทธศาสตร์ระหว่างประเทศของศูนย์วิเคราะห์นโยบายด้านสภาพภูมิอากาศชื่อ C2ES ก็หวังว่า การประชุม COP26 ครั้งนี้แม้อาจยังไม่สามารถสร้างผลลัพธ์ท้ายสุดได้ตามที่ต้องการ แต่การประชุมครั้งนี้ก็นับเป็นก้าวที่สำคัญ และจะไม่ใช่การประชุมระดับโลกเกี่ยวกับปัญหาเรื่องนี้ครั้งสุดท้ายอย่างแน่นอน ที่มา: VOA, Reuters",https://www.voathai.com/a/cop26-climate-talk-starts/6293502.html,2021_11_01
พันธมิตรชานม 4 ชาติ 'แอลเอ' ร่วมรำลึกเหตุการณ์เดือนตุลาฯเรียกร้องประชาธิปไตย,เครือข่ายพันธมิตรชานม ลอส แอนเจลิส ซึ่งเป็นการรวมตัวของกลุ่มผู้เรียกร้องประชาธิปไตยใน ไทย พม่า ฮ่องกง และไต้หวันในนครลอส แอนเจลิส รวมตัวจัดกิจกรรมจุดเทียนรำลึกถึงผู้สูญเสียชีวิตจากการถูกปราบปรามระหว่างการเรียกร้องประชาธิปไตยนหลายประเทศแถบเอเชียมุ่งหวังเป็นประเด็นรับรู้ในสังคมอเมริกันมากขึ้น,https://www.voathai.com/a/the-milk-tea-allianice-los-angeles--movement-for-democracy-voa-thai/6293487.html,2021_11_01
ส่องมาตรการวัคซีนสำหรับกิจการ ‘อินดอร์’ ในสหรัฐฯ พบเข้มงวดเพียงบางพื้นที่,"แม้เจ้าหน้าสาธารณสุขของสหรัฐฯ จะออกมาตรการควบคุมโควิดที่เข้มงวดเพื่อป้องกันการแพร่ระบาด แต่ก็ใช่ว่าผู้ประกอบการธุรกิจทุกรายจะปฏิบัติตามกฏข้อบังคับข้างต้น โดยเฉพาะการตรวจว่าผู้ที่มารับบริการนั้นได้รับวัคซีนแล้วหรือไม่ ตามรายงานของสำนักช่าวเอพี หลายเมืองในสหรัฐฯ มีการตรวจหลักฐานแสดงการฉีดวัคซีนสำหรับคนที่ต้องการทำกิจกรรมภายในอาคาร หรือ “อินดอร์” ต่าง ๆ ไม่ว่าจะเป็นการเข้าไปรับประทานอาหารภายในร้าน ดื่มสังสรรค์ที่บาร์ หรือการเข้าชมคอนเสิร์ตหรือภาพยนต์ อย่างไรก็ตาม การกวดขันกฏข้างต้นขึ้นอยู่กับความสมัครใจของผู้ประกอบการเป็นราย ๆ ไปเท่านั้น เจย์ แมเสลอร์ ชาวแคลิฟอร์เนียจากเมืองปาล์ม สปริง บอกกับเอพีขณะท่องเที่ยวที่ย่าน Fisherman’s Wharf ของเมืองซานฟรานซิสโก ซึ่งเป็นเมืองที่อยู่ทางเหนือของรัฐเดียวกันว่า “ธุรกิจบางแห่งระบุว่ามีการตรวจหลักฐานแสดงการฉีดวัคซีน แต่ก็ไม่ได้มีการตรวจจริงๆ” คุณเจย์ บอกกับผู้ประกอบการเหล่านั้นว่า “ขอโทษนะที่คุณเลือกที่จะไม่ปฏิบัติตามมาตรการ ผมจะไม่ใช้บริการหรือซื้อของจากพวกคุณ” เขาบอกกับเอพีอีกด้วยว่าเขาเพิ่งเดินทางไปท่องเที่ยวเมืองปรากและกรุงปารีส ซึ่งทั้งสองเมืองนี้มีการตรวจหลักฐานแสดงการฉีดวัคซีนสำหรับธุรกิจแบบ “อินดอร์” ทุกที่ สำนักข่าวเอพีให้เหตุผลว่า ผู้ประกอบบางส่วนในสหรัฐฯ เลือกที่จะไม่กวดขันมาตรการดังกล่าวเพราะกลัวที่จะเสียลูกค้า บางรายให้เหตุผลว่าไม่มีพนักงานเพียงพอที่จะมาทำการตรวจเช็คเพราะสภาพตลาดงานในสหรัฐฯ ที่มีแรงงานออกเป็นจำนานมาก บางรายก็เลือกที่จะไม่ปฏิบัติเลยเพราะไม่ต้องการโต้เถียงกับลูกค้าบางราย ในเดือนแรกที่มาตรการข้างต้นมีผลบังคับใช้ในรัฐนิวยอร์ก เจ้าหน้าได้ออกเอกสารเตือนให้ผู้ประกอบการถึง 6,000 แห่งที่ไม่ตรวจประวัติการรับการฉีดวัคซีนของผู้ที่เข้ามารับบริการ โดยธุรกิจถึง 15 แห่งถูกปรับ $1,000 ดอลลาร์เนื่องจากมีการกระทำผิดซ้ำอีกด้วย ทั้งนี้ เจ้าหน้าที่สาธารณสุขเห็นว่า มาตรการข้างต้นที่บังคับให้คนแสดงหลักฐานการฉีดวัคซีนนั้นเป็นสิ่งสำคัญที่ช่วยป้องกันการแพร่ระบาดของโคโรนาไวรัส โดยเฉพาะในช่วงเวลาที่ชาวอเมริกันกว่า 1,500 คนต่อวันเสียชีวิตจากโควิด แต่เอพีก็ชี้ว่า กฎดังกล่าวถูกฝ่าฝืนจากรัฐที่มีฐานเสียงการเมืองเป็นฝั่งอนุรักษ์นิยมมากกว่า หรือบางครั้งแม้จะเป็นในรัฐเดียวกัน การกวดขันก็ขี้นอยู่กับผู้ประกอบการแต่ละรายไป ยกตัวอย่างเช่น โรงหนังแห่งหนึ่งในเมืองซานฟรานซิสโกทำการตรวจเช็คการฉีดวัคซีนด้วยการดูรูปถ่ายบัตรรับวัคซีนจากโทรศัพท์มือถือของคนที่มาดูภาพยนต์แบบผ่าน ๆ เท่านั้น แต่ที่โรงละครโอเปร่า เจ้าหน้าที่กลับตรวจเช็คบัตรรับวัคซีนตัว พร้อมทั้งใบขับขี่ของผู้ที่มาใช้บริการอย่างละเอียด และใครที่ไม่ได้นำใบรับวัคซีนมาก็จะถูกปฏิเสธไม่ให้เข้าโรงละครโอเปร่า เอพีชี้ว่า เจ้าหน้าสาธารณสุขของเมืองซานฟรานซิสโกมักตรวจตราร้านอาหารต่าง ๆ ว่าปฏิบัติตามมาตรการของรัฐหรือไม่ แต่เจ้าหน้าที่ยอมรับว่าพวกเขาพึ่งเบาะเเสจากประชาชนที่โทรเข้ามาร้องเรียนเป็นหลัก สำหรับเมืองลอสแองเจอลิส เจ้าหน้าตรวจสอบด้านสุขอนามัยพบว่าในช่วงเวลาหนึ่งสัปดาห์ในเดือนตุลาคม ธุรกิจบันเทิงจำนวน 38 แห่งจากธุรกิจหมวดเดียวทั้งหมด 250 แห่งควรได้รับการอบรมเรื่องกฎการฉีดวัคซีน และในสัปดาห์ถัดไป เมื่อเจ้าหน้าที่กลับไปตรวจธุรกิจบันเทิงเหล่านี้อีกครั้ง พวกเขาก็พบอีกว่า 15% จากบาร์เกือบ 80 แห่งที่เข้าไปตรวจสอบก็ไม่ตรวจหลักฐานการฉีดวัคซีนของผู้ที่เข้ามาใช้บริการ เจ้าหน้าจึงที่ต้องอบรมเพิ่มขึ้นอีก ส่วนนครนิวยอร์ก เอพีพบว่าสถานที่ใหญ่ ๆ อย่างโรงละครบนถนนบรอดเวย์ หรือพิพิธภัณฑ์ มีการกวดขันเรื่องการตรวจประวัติฉีดวัคซีนที่เข้มงวด แต่ร้านกาแฟเล็กอาจจะไม่ทำเช่นนั้น ผู้อำนวยการด้านธุรกิจร้านอาหารและการโรงแรมของสถาบัน Institute of Culinary Education ในนิวยอร์ก นายริก คาแมค อธิบายว่า มาตรการข้างต้นนั้นกำกวมและสร้างความสับสนให้แก่ร้านอาหาร เช่น ต้องตรวจเอกสารฉีดวัคซีนตัวจริงที่เป็นกระดาษ หรือตรวจแบบใบแบบอิเล็กทรอนิกส์ ร้านบ้างร้านจึงกวดขันไม่เหมือนกัน และพนักงานบางคนก็ไม่ได้ถูกอบรมมาให้รับมือกับลูกค้าที่ไม่พอใจอย่างรุนเเรงด้วย ทั้งนี้ ผู้ประกอบการบางรายในสหรัฐฯ ก็เลือกที่จะกวดขันอย่างเข้มงวด เช่นร้าน the Highway Inn ในเมืองโฮโนลูลูของรัฐฮาวาย พนักงานเสิร์ฟจะตรวจบัตรฉีดวัคซีนพร้อมกับบัตรประจำตัว (ID) และมีการเก็บข้อมูลติดต่อของลูกค้าไว้ถึง 2 สัปดาห์ หุ้นส่วนเจ้าของร้าน รัสเซล ไรอัน บอกว่า ตอนแรกที่ออกกฏเมื่อเดือนกันยายนที่ผ่านมา มีเพียงลูกค้าที่ไม่ฉีดวัคซีนบางรายเท่านั้นที่ “เดินโมโหออกจากร้านไป” แต่ส่วนมากลูกค้าก็ปฏิบัติตามกฏและก็มีคนเข้ามาทานอาหารในร้านมากขึ้นเรื่อย ๆ เพราะประชากรจำนวนมากขึ้นได้รับวัคซีนแล้ว สุดท้ายนี้ เอพีระบุว่า ผู้ประกอบการบางรายเลือกที่จะปรับการทำธุรกิจโดยที่ไม่ต้องมีตรวจใบรับวัคซีน บางรายปิดการทานอาหารในร้านทั้งหมดและเปลี่ยนไปขายแบบ take-out หรือแบบ outdoor แทนกันเลยทีเดียว ที่มา สำนักช่าวเอพี",https://www.voathai.com/a/us-proof-of-vaccination/6293043.html,2021_11_01
