title,summary,link,published
ทร.ยิงสลุต 19 นัดอำลา 'บิ๊กอุ้ย' ก่อนส่งไม้ต่อ ผบ.ทร.คนใหม่,30 กันยายน 2564 พลเรือเอก ชาติชาย ศรีวรขาน ผู้บัญชาการทหารเรือ ท่านเก่า ได้ส่งมอบหน้าที่ ผู้บัญชาการทหารเรือ ให้แก่ พลเรือเอก สมประสงค์ นิลสมัย ผู้บัญชาการทหารเรือ ท่านใหม่ ณ ท้องพระโรง พระราชวังเดิม เขตบางกอกใหญ่ กรุงเทพมหานคร โดยมีนายทหารชั้นผู้ใหญ่จากหน่วยต่างๆ ของกองทัพเรือ เข้าร่วมพิธีในการนี้กองทหารเกียรติยศได้ทำการยิงสลุต จำนวน 19 นัด บริเวณป้อมวิชัยประสิทธิ์ ภายในพระราชวังเดิม เพื่อเทิดเกียรติ ให้แก่ พลเรือเอก ชาติชาย ศรีวรขาน ก่อนที่จะอำลาชีวิตการรับราชการทั้งนี้ พลเรือเอก ชาติชาย ศรีวรขาน นับเป็นผู้บัญชาการทหารเรือ ลำดับที่ 54 ในขณะที่ พลเรือเอก สมประสงค์ นิลสมัย เป็นผู้บัญชาการทหารเรือ ลำดับที่ 55 แห่งราชนาวีไทยตลอดระยะเวลา 1 ปี ที่ดำรงตำแหน่งผู้บัญชาการทหารเรือ พลเรือเอก ชาติชาย ศรีวรขาน ได้มุ่งเน้นการพัฒนากองทัพเรือให้ขับเคลื่อนตามยุทธศาสตร์ วิสัยทัศน์ และพันธกิจ ด้วยนโยบายที่มุ่งหวังให้กองทัพเรือ สามารถสร้างหลักประกันด้านความมั่นคงทางทะเล ให้กับประเทศ ธำรงไว้ซึ่งเกียรติ ศักดิ์ศรีในสังคมโลก เป็นที่ยอมรับ เชื่อถือ น่าชื่นชมและได้รับการยกย่องจากสาธารณชนโดยมอบนโยบายให้กำลังพลทุกนายยึดมั่นว่า กองทัพเรือ ต้องปฏิบัติหน้าที่ปกป้อง สถาบันชาติ ศาสนา พระมหากษัตริย์ และช่วยเหลือประชาชนอย่างเต็มกำลังความสามารถและมีแนวทางที่มอบให้แก่กำลังพลในกองทัพเรือ ที่ว่า The Power of Unity The Power of the Navy พลังสามัคคี พลังราชนาวีสำหรับ พลเรือเอก สมประสงค์ นิลสมัย เกิดเมื่อวันที่ 27 เมษายน 2505 จบการศึกษาจาก โรงเรียนเตรียมทหาร รุ่นที่ 20 โรงเรียนนายเรือ รุ่นที่ 77 หลักสูตรเสนาธิการทหารเรือ รุ่นที่ 54 วิทยาลัยการทัพเรือ รุ่นที่ 37 วิทยาลัยป้องกันราชอาณาจักร รุ่นที่ 60 เคยดำรงตำแหน่งที่สำคัญ คือ ผู้บังคับการเรือหลวงตองปลิว กองเรือปราบเรือดำน้ำ กองเรือยุทธการ ผู้ช่วยทูตฝ่ายทหารเรือ และรักษาราชการผู้ช่วยทูตฝ่ายทหารไทย ประจำกรุงโรม รองเจ้ากรมข่าวทหารเรือ รองผู้บัญชาการฐานทัพเรือกรุงเทพ ผู้ช่วยหัวหน้านายทหารฝ่ายเสนาธิการ ประจำผู้บัญชาการทหารเรือ เจ้ากรมการขนส่งทหารเรือ ผู้บัญชาการฐานทัพเรือกรุงเทพ เจ้ากรมข่าวทหารเรือ รองเสนาธิการทหารเรือ ได้รับพระมหากรุณาธิคุณ โปรดเกล้าฯ เป็น พลเรือเอก ในตำแหน่ง ผู้ทรงคุณวุฒิพิเศษกองทัพเรือ (อัตรา พลเรือเอก) เมื่อวันที่ 1 ตุลาคม 2561และ รองปลัดกระทรวงกลาโหม เมื่อ 1 ตุลาคม 2562(016),https://www.naewna.com/local/605794,01_10_2021
3ประสานเปิดเกมรุกฆาต!กางโมเดลฟันเว็บพนัน-กู้เงินออนไลน์-โจรไซเบอร์,กสทช.-บช.สอท.-ค่ายมือถือ ผนึกกำลังรุกฆาต กางโมเดล-ยกระดับกฎหมายฟันเว็บพนัน-กู้เงินออนไลน์-แชร์ลูกโซ่-นักต้มตุ๋นยุค 4.0 ดึงบิ๊กค่ายมือถือจัดการปัญหา SMS-โทรศัพท์หลอกลวง เริ่มขึ้นแบล็คลิสต์แล้ว30 กันยายน สำนักงานคณะกรรมการกิจการกระจายเสียง กิจการโทรทัศน์ และกิจการโทรคมนาคมแห่งชาติ (กสทช.) โดยนายไตรรัตน์ วิริยะศิริกุล รักษาการแทนเลขาธิการ กสทช. ร่วมกับ พล.ต.ท.กรไชย คล้ายคลึง ผู้บัญชาการกองบัญชาการตำรวจสืบสวนสอบสวนอาชญากรรมทางเทคโนโลยี (บช.สอท.) และผู้ประกอบกอบการโทรคมนาคม AIS TRUE DTAC NT และ 3BB ประชุมร่วมกันในการจัดการปัญหา SMS และโทรศัพท์หลอกลวงประชาชน โดยผู้ให้บริการโทรศัพท์เคลื่อนที่ (โอเปอเรเตอร์ทุกราย) จะทำการบล็อก SMS ที่มีเนื้อหาชัดเจนว่าเป็นการหลอกลวง เว็บพนันออนไลน์ หรือลามกอนาจารทันที และเร่งตรวจสอบ กำกับดูแลกันเองอย่างเคร่งครัด และให้ทุกค่ายเริ่มทำการ Backlist ผู้ส่งที่ส่งข้อความหลอกลวง หลังจากที่ได้การแชร์ข้อมูล SMS หลอกลวงระหว่างกันแล้วพบว่ามาจากผู้ส่งรายเดียวกันสำหรับกรณีการโทรหลอกลวงประชาชนโดยตรง สำนักงานฯ กับโอเปอเรเตอร์ทุกราย สามารถตรวจสอบการกระทำความผิดได้ชัดเจนเนื่องจากเบอร์โทรศัพท์มือถือที่มิจฉาชีพใช้สามารถตรวจสอบจากการลงทะเบียนได้ว่าใครเป็นเจ้าของเบอร์นั้น ถือเป็นหลักฐานที่ระบุต้นทางที่มา ประกอบกับข้อมูลที่ประชาชนให้ข้อมูลการหลอกลวง ส่งคลิป หรือแจ้งเบอร์โทรศัพท์เข้ามาเพื่อเป็นข้อมูล สำนักงานฯ จะนำข้อมูลทั้งหมดส่งให้กองบัญชาการตำรวจสืบสวนสอบสวนอาชญากรรมทางเทคโนโลยี (บช.สอท.) เพื่อดำเนินการตามกฎหมายในการดำเนินคดีเอาผิดกับมิจฉาชีพต่อไปพล.ต.ต.นิเวศน์ อาภาวศิน ผู้บังคับการตรวจสอบและวิเคราะห์อาชญากรรมทางเทคโนโลยี กองบัญชาการตำรวจสืบสวนสอบสวนอาชญากรรมทางเทคโนโลยี (ผบก.ตอท.บช.สอท.) เปิดเผยว่า การร่วมมือในครั้งนี้เป็นการเริ่มจากข้อมูล SMS เบื้องต้นการหลอกหลวงในรูปแบบต่างๆ เว็บพนันออนไลน์ การกู้ยืมเงินออนไลน์ หรือการทำแชร์ลูกโซ่ บช.สอท.ได้มีการหารือกับธนาคารแห่งประเทศไทยมาพอสมควร แต่เนื่องด้วยระบบอิเล็กทรอนิกส์มีปัญหาข้อกฎหมาย ทำให้การทำทุกอย่างให้เป็นรูปธรรมต้องใช้เวลา ซึ่งแนวทางการรับแจ้งปัญหาที่ประชาชนได้รับความเดือนร้อนจากโซเชียลมีเดีย บช.สอท.ได้เริ่มนำระบบออนไลน์เข้ามาใช้เรานำข้อกฎหมาย พ.ร.บ.ธุรกรรมทางอิเล็กทรอนิกส์เป็นแนวทางตามที่กฎหมายกำหนดไว้ และพ.ร.บ.คอมพิวเตอร์ ในส่วนที่ เรารับนโยบายมา เราพยายามเน้นเรื่องการป้องกันโดยเรื่องของการหลอกลวง การขายของสินค้าออนไลน์ โดยเฉพาะจากโซเชียลมีเดีย ขณะเดียวกันอยากประชาสัมพันธ์เรื่องของการลงทุนในโลกออนไลน์ คริบโตเคอเรนซี่ ขอให้ลงทุนกับเว็บเทรดคริปโตที่ได้รับใบอนุญาตประกอบสินทรัพย์ดิจิทัล จากสำนักงานคณะกรรมการกำกับหลักทรัพย์และตลาดหลักทรัพย์ (ก.ล.ต.) และการกู้เงินถ้าอยากกู้เงินขอให้กู้เงินกับสถาบันการเงิน ธนาคารเป็นหลัก พล.ต.ต.นิเวศน์ กล่าวพล.ต.ต.นิเวศน์ กล่าวอีกว่า ขณะเดียวกันความเชื่อมั่นในการซื้อสินค้าบนแพลตฟอร์มออนไลน์ เช่น ไอจี เฟซบุ๊ก ซึ่งยังไม่มีการยืนยันการระบุตัวตน อยากเชิญช่วยให้แม่ค้าออนไลน์ลงทะเบียนกับตำรวจไซเบอร์ผ่านช่องทาง Trust.HighTechcrime.org ไม่ยุ่งยาก ไม่ต้องแสดงหลักฐานอะไร ยืนยันตัวตนกับตำรวจไซเบอร์ไว้แล้ว มีรายชื่อโชว์ที่หน้าเว็บนำไปอ้างอิงเพื่อสร้างความเชื่อมั่นให้กับผู้ซื้อได้อย่างแน่นอนแนวทางที่ตั้งใจจะขับเคลื่อน คือการให้กระทรวงมหาดไทยเป็นเจ้าภาพในการนำบัตรประชาชนมาสมัครลงทะเบียนภาคสมัครใจ เพื่อยืนยันตัวตนของพ่อค้าแม่ค้าออนไลน์ และอนาคตอันใกล้ หลังจากมีการร่วมมือกันกับหน่วยงานที่เกี่ยวข้อง ทั้ง กสทช. โอเปอเรเตอร์ ธนาคาร บก.สอท. อาทิตย์หน้าจะมีการหารือกันในด้านเทคนิค การจัดเก็บข้อมูลระบบการรับแจ้งปัญหาหลอกหลวงในรูปแบบต่างๆ เว็บพนันออนไลน์ การกู้ยืมเงินออนไลน์ หรือการทำแชร์ลูกโซ่ จะเห็นชัดเจนมากยิ่งขึ้น พล.ต.ต.นิเวศน์ กล่าวอย่างไรก็ตามหลังจากการทำงานควบคู่กันทั้งด้านกฎหมาย ด้านเทคนิค และงานสืบสวนสอบสวน อีกส่วนหนึ่งที่ บก.สอท.จะดำเนินการต่อไปคือทำกรุ๊ปไลน์ กับ อาจารย์ ครู ทั่วประเทศแล้วนำข้อมูลการกระทำความผิดในรูปแบบออนไลน์ เพื่อให้ครูนำไปเป็นข้อมูลในการสอนนักเรียน เนื่องจากการประชาสัมพันธ์ การออกข่าว โทรทัศน์ วิทยุ ไม่สามารถเข้าถึงประชาชนได้ จึงเป็นเป็นปัญหาทำให้เกิดการกระทำความผิดอย่างต่อเนื่องด้านนายไตรรัตน์ กล่าวว่า การดำเนินงานร่วมกับบช.สอท.จะทำให้การดำเนินการเอาผิดและดำเนินคดีกับมิจฉาชีพ สามารถดำเนินการได้อย่างรวดเร็ว เพราะทาง บช.สอท. มีความเชี่ยวชาญและชำนาญในเรื่องดังกล่าว ซึ่งสำนักงาน กสทช. มองว่าแนวทางในการจัดการปัญหา SMS และโทรศัพท์หลอกลวงที่กำลังดำเนินการสามารถที่จะแก้ไขปัญหาได้ แต่ทั้งนี้ สำนักงานฯ ยังต้องได้รับความร่วมมือจากประชาชนผู้ใช้บริการที่ประสบปัญหาโดยตรงในการให้ข้อมูลปัญหา SMS และโทรศัพท์หลอกลวงกับ กสทช. และโอเปอเรเตอร์เพื่อจะได้แก้ไขปัญหาดังกล่าวให้ลุล่วงขอให้ประชาชนระมัดระวังอย่าหลงเชื่อข้อความจาก SMS โดยง่าย อย่ากรอก Username Password ที่ใช้ในการทำธุรกรรมต่างๆ กับธนาคารในลิงค์ที่ส่งมากับ SMS หรืออย่าให้ข้อมูลส่วนตัว เช่น บัตรประชาชน ไปกับคนที่โทรมาสอบถามข้อมูลทางโทรศัพท์ง่ายๆ ควรตรวจสอบที่มาของ SMS หรือหน่วยงานที่โทรศัพท์เข้ามาให้แน่ใจก่อน เพื่อระมัดระวังไม่ให้ข้อมูลเหล่านี้ตกไปอยู่ในมือมิจฉาชีพที่จะเอาข้อมูลส่วนตัวของเราไปใช้ทำธุรกรรม ขโมยเงินของเรา หรือนำไปก่อความเสียหายได้หากประชาชนประสบปัญหา หรือต้องการแจ้งข้อมูลเกี่ยวกับ SMS และโทรศัพท์หลอกลวง สามารถแจ้งมายัง Call Center สำนักงาน กสทช. หมายเลขโทรศัพท์ 1200 (โทรฟรี ไม่มีค่าใช้จ่าย) หรือแจ้งไปยัง Call Center ของค่ายมือถือที่ท่านใช้บริการอยู่ หรือหมายเลขโทรศัพท์ที่แต่ละค่ายมีไว้เพื่อรับข้อมูลเรื่อง SMS และโทรศัพท์หลอกลวงโดยเฉพาะ นายไตรรัตน์ กล่าว-005,https://www.naewna.com/local/605788,01_10_2021
ม็อบโผล่ท่าน้ำนนท์ ป่วน'นายกฯ'ลงพื้นที่ ตร.คุมตัว'ไบร์ท ชินวัตร',เมื่อวันที่ 30 กันยายน 2564 ผู้สื่อข่าวรายงานว่า สำหรับการรักษาความปลอดภัย พล.อ.ประยุทธ์ จันทร์โอชา นายกรัฐมนตรี และ รมว.กลาโหม ในการลงพื้นที่ จ.นนทบุรี ครั้งนี้ เป็นไปด้วยความเข้มงวด เนื่องจากก่อนที่ พล.อ.ประยุทธ์ จะมาถึงจุดแรกที่เทศบาลปากเกร็ด ได้มีประชาชนบางส่วนมารอเพื่อตะโกนขับไล่ และยังด่าทอเจ้าหน้าที่ตำรวจชุดควบคุมฝูงชน (คฝ.) ที่มาดูแลรักษาความปลอดภัย ขณะที่เจ้าหน้าที่ได้นำรถน้ำและรถดับเพลิงมาเตรียมพร้อม หลัง นายชินวัตร จันทร์กระจ่าง หรือไบร์ท แกนนำราษฎรนนทบุรี เชิญชวนประชาชน จ.นนทบุรี มารวมตัวกันต้อนรับนายกฯ ที่ท่าน้ำ จึงมีมวลชนบางส่วนสวมเสื้อแดงและแมสสีแดงมารอทั้งนี้ ก่อนที่ พล.อ.ประยุทธ์ จะเดินทางมาถึง เจ้าหน้าที่ตำรวจได้ตัดสินใจควบคุมตัว ไบร์ท และแกนนำออกจากพื้นที่ไปยัง สภ.ท่าน้ำนนท์ แล้วขณะที่บริเวณท่าน้ำนนทบุรี ซึ่งเป็นจุดที่ พล.อ.ประยุทธ์ จะต้องกลับมาขึ้นรถเพื่อเดินทางกลับ ได้มีมวลชนมาปักหลักเพื่อขับไล่ตั้งแต่เวลา 13.00 น.ซึ่งมีบางคนเตรียมน้ำปลาร้ามาด้วย โดยมีเจ้าหน้าที่ควบคุมฝงชนมาตั้งแถวห้ามไม่ให้มวลชนเข้าใกล้ท่าน้ำนนท์ จนเกิดการผลักดันกันเป็นระยะ ซึ่งเจ้าหน้าที่ตำรวจพยายามนำรถขยายเสียงและรถคุมขังเข้ามายังพื้นที่ แต่ถูกมวลชนขวางไว้ จนต้องยอมถอยออกไปอย่างไรก็ตาม นายกฯ และคณะ ได้เปลี่ยนจุดขึ้นจากที่ท่าน้ำนนทบุรี มาเป็นโป๊ะเรือตรงตึก ส.ว.อาคารรัฐสภา เกียกกาย แทน โดยเจ้าหน้าที่รักษาความปลอดภัยและส่วนล่วงหน้า รวมทั้งเจ้าหน้าที่ตำรวจในท้องที่ร่วมกันประเมิน และแจ้งไปทางเรือของนายกฯ เพื่อประสานกับทีมรักษาความปลอดภัยให้เปลี่ยนจุดขึ้นเรือ เพื่อหลีกเลี่ยงแรงปะทะ - 006,https://www.naewna.com/local/605779,01_10_2021
