title,summary,link,published
นักโทษก่อจลาจลในคุกเอกวาดอร์ ยอดดับทะลุ 100 ราย,หน่วยงานบริการดูแลผู้ต้องขังและเยาวชนผู้กระทำความผิดแห่งชาติของเอกวาดอร์ (SNAI) รายงานว่าเหตุจลาจลภายในเรือนจำลิโตรัล ซึ่งเกิดขึ้นเมื่อวันอังคาร (28 ก.ย.) ในเมืองกัวยากิล เมืองท่าทางตะวันตกเฉียงใต้ของประเทศ ส่งผลให้มีนักโทษเสียชีวิตมากกว่า 100 ราย และบาดเจ็บอีก 52 รายหน่วยงานฯ ระบุว่าสำนักงานตำรวจแห่งชาติ สำนักงานอัยการของเอกวาดอร์ และหน่วยงานอื่นๆ กำลังสืบสวนสอบสวนเหตุจลาจลในเรือนจำครั้งนี้ ซึ่งถือเป็นหนึ่งในสองเหตุการณ์รุนแรงที่สุดในปี 2021 ของเอกวาดอร์ ซึ่งปัจจุบันกำลังเผชิญวิกฤตด้านเรือนจำอันร้ายแรงเมื่อเดือนกุมภาพันธ์ เกิดเหตุจลาจลขึ้นในเรือนจำ 4 แห่งของเอกวาดอร์ ส่งผลให้มีผู้ต้องขังเสียชีวิต 79 ราย และบาดเจ็บ 20 ราย โดยในจำนวนผู้บาดเจ็บมีตำรวจด้วยเมื่อวันพุธ (29 ก.ย.) กิลเลอร์โม ลาสส์โซ ประธานาธิบดีเอกวาดอร์ ประกาศสถานการณ์ฉุกเฉินขึ้นในระบบเรือนจำของประเทศเป็นเวลา 60 วัน เพื่อป้องกันมิให้เกิดเหตุรุนแรงเพิ่มเติมที่มาxinhuathai.-011,https://www.naewna.com/inter/605836,01_10_2021
คอหวยแห่ส่อง พิธีประดิษฐานพระยอดธงฯ วัดเจดีย์(ไอ้ไข่),"คอหวยส่องเลขหยดน้ำตาเทียน พิธีประดิษฐานพระยอดธงค่ายรบพิเศษสิชล - วัดเจดีย์ (ไอ้ไข่) เผยจัดสร้างพระยอดธงวัดเจดีย์ (ไอ้ไข่) รุ่นแรกจำนวนจำกัด ก่อนนำประดิษฐานบนยอดเสาธงค่ายรบพิเศษ30 ก.ย.64 ผู้สื่อข่าวรายงานว่า ที่หน้าอาคารอำนวยการกองร้อยฝึกรบพิเศษ ค่ายฝึกรบพิเศษสิชล อ.สิชล จ.นครศรีธรรมราช พล.อ.ชาญประดิษฐ์ แสงนิล ผู้ทรงคุณวุฒิพิเศษสำนักงานปลัดกระทรวงกลาโหม เป็นประธานประกอบพิธีบรรจุพระยอดธงรุ่นแรก วัดเจดีย์ (ไอ้ไข่) และพิธีประดิษฐานยอดเสาธง ค่ายฝึกรบพิเศษที่ 4 ค่ายฝึกรบพิเศษสิชล  มี พ.ต.ประเสริฐ สายทองแท้ ผบ.ค่ายฝึกรบพิเศษสิชล นายไพรัตน์ ทับชุม นายอำเภอสิชล พ.ต.อ.กิตติศักดิ์ รามสวัสดิ์ ผกก.สภ.สิชล หัวหน้าส่วนราชการ และผู้บริหารองค์กรปกครองส่วนท้องถิ่น เข้าร่วมพิธีท่ามกลางมาตรการควบคุมป้องกันการแพร่ระบาดของไวรัสโควิดอย่างเคร่งครัดสำหรับการประกอบพิธี มีการนิมนต์พระเกจิอาจารย์ชื่อดัง อาทิ มีพระครูวิศาลธรรมจารี เจ้าอาวาสวัดเบิก เจ้าคณะตำบลฉลอง พระครูพุทฺธเจติยาภิมณฑ์ หรือ พระอาจารย์แว่น วัดเจดีย์ (ไอ้ไข่) ร่วมสวดเจริญพระพุทธมนต์ ทำน้ำพระพุทธมนต์ และบรรจุพระยอดธงพร้อมชักยอดเสาธงขึ้นประดิษฐานติดตั้งบนยอดเสาธงหน้าอาคารอำนวยการค่ายฝึกรบพิเศษ หลังการประกอบพิธีเสร็จสิ้น ผู้ที่มาร่วมพิธีแห่ตักน้ำพระพุทธมนต์ในขันน้ำมนต์ขนาดใหญ่ไปเก็บไว้ใช้เพื่อความเป็นสิริมงคล เนื่องจากมีความเชื่อว่าน้ำพระพุทธมนต์จากการประกอบพิธีจัดสร้างหรือประดิษฐานพระยอดธงนั้นมีความเข้มขลัง เอกอุ และหายากมากอย่างไรก็ตาม พบว่าในขันน้ำพระพุทธมนต์ ที่พระสงฆ์ประกอบพิธีเจริญพระพุทธมนต์นั้น ทางเกจิอาจารย์ มีการหยดน้ำตาเทียนลงในขันช่วงการประกอบพิธีอีกด้วย แต่น่าเสียดายที่หยดน้ำตาเทียนไม่ปรากฏเลขที่เด่นชัดมาก แต่มีคอหวยส่วนหนึ่งที่เพ่งมองหยดน้ำตาเทียนในขัน บอกว่า เห็นเป็นเลข 28,38,728,738 และเตรียมนำเลขดังกล่าวเสี่ยงโชคพรุ่งนี้ (1 ต.ค.64)นอกจากนี้ ช่วงระหว่างประกอบพิธี มีคณะอาจารย์จากโรงเรียนนายร้อยพระจุลจอมเกล้า นำนักเรียนนายร้อยชั้นปีที่ 4 เดินทางมาศึกษาดูงานค่ายรบพิเศษที่ 4 สิชล ซึ่งทาง พ.ต.ประเสริฐ สายทองแท้ พร้อมด้วย พล.อ.ชาญประดิษฐ์ แสงนิล จึงมอบพระยอดธงวัดเจดีย์ (ไอ้ไข่) รุ่น  เจริญยศมั่งมี ให้กับคณะอาจารย์ และนักเรียนนายร้อยทุกนาย ท่ามกลางความดีใจของอาจารย์และนักเรียนนายร้อยพ.ต.ประเสริฐ สายทองแท้ ผบ.ค่ายฝึกรบพิเศษสิชล กล่าวว่า ตนเป็นนายทหารสังกัดกองทัพภาคมที่ 4 และดำรงตำแหน่ง ผบ.ค่ายฝึกรบพิเศษสิชลมายาวนาน ในวันนี้เป็นวันสุดท้ายในการดำรงตำแหน่งเพราะเกษียณอายุราชการแล้ว ก่อนหน้านี้ตนได้จัดสร้างพระยอดธงวัดเจดีย์(ไดอ้ไข่) แบบย้อนยุค (พระกรุ) รุ่น เจริญยศมั่งมี ขอได้ไหว้รับ ป้องกันภัย เมตตา เสริมบารมี เสริมยศ มั่งมีทรัพย์ ได้ใช้ชนวนมวลสารจากการสร้างพระยอดธงหน้ากองทัพภาคที่ 4 และมวลสารจากการจัดสร้างไอ้ไข่วัดเจดีย์ รุ่น ยอดทรัพย์ ปลุกเสกพร้อมกับวัตถุมงคลๆไอ้ไข่วัดเจดีย์รุ่น ยอดทรัพย์หลายวาระ จัดสร้างจำนวนจำกัด โดยมีเกจิอาจารย์ทั่วประเทศ 108 รูป ร่วมอธิฐานจิตปลุกเสพต่อเนื่อง 1 วัน 1 คืนมีวัตถุประสงค์เพื่อจัดสวัสดิการให้กำลังพลค่ายรบพิเศษที่ 4 สิชล จัดสร่างเสาธงขนาดใหญ่ ค่ายรบพิเศษที่ 4 สิชล ซ่อมแซมปรับปรุงห้องน้ำ สร้างสนามกีฬา ซึ่งได้ดำเนินการจนแล้วเสร็จครบถ้วน และในวันนี้วันสุดท้ายในชีวิตการเป็นข้าราชการทหาร จึงกำหนดประกอบพิธีบรรจุพระยอดธงรุ่นแรก วัดเจดีย์(ไอ้ไข่) และประดิษฐานยอดเสาธงค่ายฝึกรบพิเศษที่ 4 หรือ ค่ายฝึกรบพิเศษสิชล ขึ้นดังกล่าว",https://www.naewna.com/likesara/605839,01_10_2021
‘ปทุมธานี’เริ่มมีน้ำท่วม ชาวบ้านริมเจ้าพระยาเก็บของขึ้นที่สูง,ปทุมธานีเริ่มมีน้ำท่วม ชาวบ้านริมเจ้าพระยาเก็บของขึ้นที่สูงเมื่อเวลา 19.00 น.วันที่ 30 กันยายน 2564 ผู้สื่อข่าว จ.ปทุมธานี ลงพื้นที่บริเวณใต้สะพานกลับรถสะพานปทุมธานี 1 ต.บ้านกลาง อ.เมือง จ.ปทุมธานี พบว่า มีน้ำท่วมบนถนนสูงประมาณ 20 เซนติเมตร และที่วัดโพธิ์เลื่อน ต.บ้านกระแชง อ.เมือง จ.ปทุมธานี ซึ่งอยู่ริมแม่เจ้าพระยา มีน้ำท่วมที่บริเวณลานวัดแล้วสูงประมาณ 20-30 เซนติเมตรจากการสอบถามชาวบ้านบอกว่าบริเวณใต้สะพานกลับรถสะพานปทุมธานี 1 จะมีน้ำล้นจากแม่น้ำเจ้าพระยาเข้ามาท่วมทุกปี ซึ่งเกิดจากน้ำทะเลหนุนและน้ำทางเหนือปล่อยลงมาด้วย ซึ่งตนเองก็ได้เก็บของไว้ในที่สูงแล้วด้านวัดมะขาม ต.บ้านกลาง อ.เมือง จ.ปทุมธานี ซึ่งเป็นวัดที่ติดแม่น้ำเจ้าพระยาเช่นกัน มีน้ำไหลเข้ามาท่วมบริเวณที่ให้อาหารปลา ซึ่งทางเทศบาลตำบลบ้านกลางได้นำกระสอบทรายมากั้นไว้แล้วบางส่วน นอกจากนี้ยังมีประชาชนที่บ้านอยู่ริมน้ำได้มาเฝ้าสังเกตการณ์ว่าคืนนี้น้ำจะขึ้นสูงหรือไม่ โดยประชาชนบอกว่าตนเองบ้านอยู่ริมแม่น้ำและได้ขนของขึ้นไว้บนชั้น 2 แล้ว แต่น้ำในปีนี้คงไม่น่ากลัวเหมือนปี 2554-005,https://www.naewna.com/local/605841,01_10_2021
ระทึก!หนุ่ม25ซื้อคัตเตอร์บุกเดี่ยวชิงทอง รปภ.ใจเด็ด‘ถีบ’จยย.ล้ม รวบทันควัน,ระทึก!หนุ่ม25ซื้อคัตเตอร์บุกเดี่ยวชิงทอง รปภ.ใจเด็ดถีบจยย.ล้ม รวบทันควันเมื่อเวลา 18.30 น.วันที่ 30 กันยายน 2564 กล้องวงจรปิดของห้างทองเยาวราช สินทวี ภายในห้างสรรพสินค้าโลตัส ชลบุรี ต.เสม็ด อ.เมือง จ.ชลบุรี จับภาพชายวัยรุ่น เสื้อสีน้ำเงินแบบมีหมวกคลุมอำพรางใบหน้า เดินวนไปมาและทำทีไปสอบถามราคาทองคำในจุดที่มีพนักงาน รปภ.ยืนอยู่ จากนั้นได้ใช้มีดจี้พนักงาน รปภ. แล้วกระโดดข้ามเข้าไปหยิบทองรูปพรรณ น้ำหนัก 3 บาท 4 เส้น รวม 12 บาท ก่อนที่จะหลบหนีไปอย่างรวดเร็ว โดยมี รปภ.วิ่งตามไปแล้วจับกุมตัวเอาไว้ได้ ทราบชื่อคือนายวิทย์จากนั้น พ.ต.อ.ชัยชนะ เกษมวงษ์ ผกก.สภ.เสม็ด พร้อมเจ้าหน้าที่ตำรวจทราบเรื่อง ได้รุดเข้าตรวจสอบที่เกิดเหตุ พบกระจกตู้ใส่ทองแตกได้รับความเสียหาย ส่วนคนร้ายถูกพนักงาน รปภ.และพลเมืองดีช่วยจับตัวไว้ได้ หลังจากวิ่งไปด้านนอกแล้วใช้มีดจี้ชิงรถจักรยานยนต์ (จยย.) ของคนที่มาเที่ยวห้าง รปภ.ได้ตัดสินใจกระโดดถีบจนรถล้มไปกระแทกกับเสาไฟฟ้า จนสามารถจับกุมตัวได้ในที่สุด ทราบชื่อต่อมา คือ นายวิทย์ อายุ 25 ปี พร้อมของกลางเป็นสร้อยคอทองคำน้ำหนัก 3 บาท จำนวน 4 เส้น มูลค่ากว่า 3.3 แสนบาท ซึ่งได้ให้ตำรวจควบคุมตัวไปสอบสวนต่อที่ สภ.เสม็ดนายวิทย์ อ้างว่า เดินทางมาจากกรุงเทพฯ หลังจากได้ทะเลาะกับพ่อแม่ และติดพนันออนไลน์ ทำให้เกิดอาการเครียดหนักเพราะแม่ด่าจนทนไม่ไหว เดินเข้าไปในห้างสรรพสินค้า ก่อนตัดสินใจเดินไปซื้อมีดคัตเตอร์ แล้วลงมือก่อเหตุดังกล่าว แต่สุดท้ายหนีไม่รอดถูกจับกุมตัวได้สอบถามพนักงานขายทอง กล่าวว่า คนร้ายทำทีเดินเข้ามาถามราคาทองขนาดต่างๆ แล้วเดินออกไปจากนั้นได้เดินวนไปมา จนเจ้าหน้าที่ รปภ.เห็นผิดสังเกต จึงได้ส่งสัญญาณบอกกับตน จากนั้น รปภ.ได้เรียกกำลังมาเดินสังเกตการณ์ที่หน้าร้านทองจนคนร้ายเดินไปกระชาก รปภ.อีกคนหนึ่งแล้วชี้บอกให้หลบไปจะมาเอาทอง พูดแล้วได้กระโดดข้ามตู้กระจกมาทุบเอาทองรูปพรรณและวิ่งหนีออกไป แต่ รปภ.ได้ช่วยกันไล่ติดตามจนคนร้ายจนมุมจึงสามารถจับกุมตัวเอาไว้ได้ด้านนายนภดล ทุมมานนท์ อายุ 52 ปี พนักงาน รปภ. กล่าวว่า หลังคนร้ายใช้มีดจี้ และได้มีการข่มขู่ ก่อนจะโดดไปหยิบทองแล้ววิ่งหนีไปชนกับประตูของห้างจนล้มลงและลุกขึ้นมา ได้ใช้มีดคัตเตอร์จี้เอารถ จยย.ของคนที่อยู่หน้าประตู ขณะที่กำลังจะเร่งเครื่องหลบหนี ตนจึงตัดสินใจกระโดดถีบรถ จยย. เสียหลักพุ่งไปชนกับเสาไฟฟ้าพลเมืองดีได้ช่วยกันจับกุมตัวไว้ได้-005,https://www.naewna.com/local/605842,01_10_2021
แม่ช่วยผมด้วย!เศร้าลูกชาย11 ขวบยอดกตัญญู จูงควายลงกินน้ำ จมเสียชีวิตต่อหน้าต่อตา,แม่ช่วยผมด้วย!เศร้าลูกชาย11 ขวบยอดกตัญญู จูงควายลงกินน้ำ จมเสียชีวิตต่อหน้าต่อตา30 กันยายน 2564 เวลา 18.30 น. ตำรวจ สภ.บ้านดุง จ.อุดรธานี รับแจ้งมีเหตุจมน้ำเสียชีวิตที่ทุ่งนาท้ายหมู่บ้านบ้านโพนสูงน้อย ต.โพนสูง อ.บ้านดุง จ.อุดรธานี ทางไปวัดป่าเวฬุวัน หลังรับแจ้งนายวีระพล รักเสมอวงษ์ แอดมินเพจบ้านดุงอัพเดท Bandung Update พร้อมด้วยหน่วยกู้ภัยตร.ทางหลวงบ้านดุง รุดไปตรวจสอบ และหน่วยกู้ภัยตร.ทางหลวงได้งมร่างขึ้นมาได้ทราบชื่อ คือ น้องฟลุ้ค อายุ 11 ปี บ้านอยู่ ต.ศรีสุทโธ อ.บ้านดุง จ.อุดรธานี และเป็นนักเรียนชั้น ป.4 โรงเรียนเทศบาล 1 เทศบาลเมืองบ้านดุง โดยแม่ของน้องฟลุ้ค ร่ำไห้สุดเสียใจจนไม่มีน้ำตาแม่ของน้องฟลุ้ค กล่าวว่า ก่อนเกิดเหตุได้พาลูกชายออกมาทุ่งนา ตนไปหว่านปุ๋ยในนาข้าว และน้องฟลุ้ค บอกแม่ว่าจะอาสาเอาควายลงกินน้ำในหนองน้ำให้เอง ซึ่งปกติเขาก็จะทำแบบนี้ประจำอาสาช่วยงานแม่ทุกอย่าง แม่ก็บอกว่าไม่ต้องเอาลงหรอกลูก เพราะกลัวลูกจะจมน้ำ หลังจากนั้นตนก็ไปหว่านปุ๋ยในนาข้าว ไม่นานเห็นลูกร้อง แม่ช่วยผมด้วย ผมเหนื่อยหลังจากได้ยินเสียงลูก ตนรีบทิ้งถังที่ใส่ปุ๋ยวิ่งมาช่วย เห็นแต่ขาลูกกำลังจมน้ำกระโดดลงไปคว้าขาไม่ทัน เห็นลูกจมน้ำต่อหน้าต่อตา ตนไม่กล้าลงเพราะว่ายน้ำไม่เป็น จึงรีบไปบอกชาวบ้านและแจ้งแอดมินบ้านดุงอัพเดทให้มาช่วย แต่สุดท้ายลูกก็มาเสียชีวิตแม่ของน้องฟลุ้ค กล่าวว่า ปกติทุกวันเราจะออกมาทุ่งนาประจำ เพื่อมาเอาควายกินน้ำและเข้าคอก และเขาก็ว่ายน้ำเป็น แต่วันนี้ไม่รู้เป็นอะไรดูท่าทางเขาเหนื่อย ไม่ร่าเริงเหมือนทุกวัน เสียใจมากที่ต้องมาสูญเสียลูกคนสุดท้อง เขาเป็นกตัญญูช่วยงานแม่ทุกอย่าง อย่างตอนเที่ยงวันนี้ก็ต้มบะหมี่กึ่งสำเร็จรูปให้แม่ทานก่อนออกมาที่ทุ่งนา ไม่น่าจบชีวิตสั้นแบบนี้ด้านพ่อของน้องฟลุ้คมาเห็นร่างของลูกชายจมน้ำเสียชีวิต ก็ร่ำไห้ใจจะขาด พร้อมเป่าปากหวังจะให้ลูกให้ฟื้นคืนมาต่อมาตำรวจ และแพทย์เวรชันสูตรศพ โดยญาติไม่ติดใจการเสียชีวิตจึงมอบศพให้ญาติไปบำเพ็ญตามประเพณีต่อไป-005,https://www.naewna.com/local/605844,01_10_2021
