title,summary,link,published
อุตุฯเตือน'ใต้ตอนล่าง'ฝนถล่ม เฝ้าระวังน้ำท่วมฉับพลัน-น้ำป่าไหลหลาก,วันที่ 4 พฤศจิกายน 2564 ลักษณะอากาศทั่วไป พยากรณ์อากาศ 24 ชั่วโมงข้างหน้า บริเวณภาคใต้ตอนล่างมีฝนตกหนักบางแห่ง ขอให้ประชาชนบริเวณภาคใต้ระวังอันตรายจากฝนตกหนักและฝนที่ตกสะสมซึ่งอาจทำให้เกิดน้ำท่วมฉับพลันและน้ำป่าไหลหลากได้ ทั้งนี้ เนื่องจากมีหย่อมความกดอากาศต่ำปกคลุมบริเวณประเทศมาเลเซีย ประกอบกับมรสุมตะวันออกเฉียงเหนือยังคงพัดปกคลุมอ่าวไทยและภาคใต้ สำหรับบริเวณความกดอากาศสูงที่ปกคลุมภาคตะวันออกเฉียงเหนือและทะเลจีนใต้มีกำลังอ่อนลง ในขณะที่มีลมตะวันออกเฉียงใต้ยังคงพัดปกคลุมภาคเหนือ ลักษณะเช่นนี้ทำให้ภาคเหนือยังคงมีฝนฟ้าคะนองเกิดขึ้นในระยะนี้ ฝุ่นละอองขนาดเล็ก ในช่วงนี้การสะสมของฝุ่นละออง/หมอกควันมีน้อย พยากรณ์อากาศสำหรับประเทศไทยตั้งแต่เวลา 06.00 น.วันนี้ ถึง 06.00 น.วันพรุ่งนี้ ภาคเหนือ มีฝนฟ้าคะนองร้อยละ 30 ของพื้นที่ ส่วนมากบริเวณจังหวัดแม่ฮ่องสอน เชียงใหม่ เชียงราย ลำพูน ลำปาง พะเยา น่าน ตาก สุโขทัย และกำแพงเพชร อุณหภูมิต่ำสุด 22-24 องศาเซลเซียส อุณหภูมิสูงสุด 31-35 องศาเซลเซียส ลมตะวันออกเฉียงใต้ ความเร็ว 10-20 กม./ชม. ภาคตะวันออกเฉียงเหนือ มีฝนฟ้าคะนองร้อยละ 10 ของพื้นที่ ส่วนมากบริเวณจังหวัดนครราชสีมา บุรีรัมย์ สุรินทร์ และศรีสะเกษ อุณหภูมิต่ำสุด 22-24 องศาเซลเซียส อุณหภูมิสูงสุด 33-35 องศาเซลเซียส ลมตะวันออกเฉียงเหนือ ความเร็ว 10-20 กม./ชม. ภาคกลาง มีฝนฟ้าคะนองร้อยละ 10 ของพื้นที่ ส่วนมากบริเวณจังหวัดราชบุรี กาญจนบุรี และอุทัยธานี อุณหภูมิต่ำสุด 22-26 องศาเซลเซียส อุณหภูมิสูงสุด 33-35 องศาเซลเซียส ลมตะวันออก ความเร็ว 10-20 กม./ชม. ภาคตะวันออก มีฝนฟ้าคะนองร้อยละ 10 ของพื้นที่ ส่วนมากบริเวณจังหวัดฉะเชิงเทรา ชลบุรี และระยอง อุณหภูมิต่ำสุด 22-26 องศาเซลเซียส อุณหภูมิสูงสุด 33-35 องศาเซลเซียส ลมตะวันออก ความเร็ว 10-30 กม./ชม.ทะเลมีคลื่นต่ำกว่า 1 เมตร ภาคใต้ (ฝั่งตะวันออก) มีฝนฟ้าคะนองร้อยละ 70 ของพื้นที่ และมีฝนตกหนักบางแห่ง บริเวณจังหวัดนครศรีธรรมราช พัทลุง สงขลา ยะลา ปัตตานี และนราธิวาส อุณหภูมิต่ำสุด 22-24 องศาเซลเซียส อุณหภูมิสูงสุด 27-33 องศาเซลเซียส ตั้งแต่จังหวัดสุราษฎร์ธานีขึ้นมา: ลมตะวันออก ความเร็ว 15-30 กม./ชม.ทะเลมีคลื่นสูงประมาณ 1 เมตร บริเวณที่มีฝนฟ้าคะนองคลื่นสูง 1-2 เมตร ตั้งแต่จังหวัดนครศรีธรรมราชลงไป: ลมตะวันออก ความเร็ว 15-35 กม./ชม.ทะเลมีคลื่นสูง 1-2 เมตร บริเวณที่มีฝนฟ้าคะนองคลื่นสูงประมาณ 2 เมตร ภาคใต้ (ฝั่งตะวันตก) มีฝนฟ้าคะนองร้อยละ 60 ของพื้นที่ และมีฝนตกหนักบางแห่ง บริเวณจังหวัดพังงา กระบี่ ตรัง และสตูล อุณหภูมิต่ำสุด 20-25 องศาเซลเซียส อุณหภูมิสูงสุด 29-33 องศาเซลเซียส ลมตะวันออก ความเร็ว 10-30 กม./ชม.ทะเลมีคลื่นต่ำกว่า 1 เมตร บริเวณที่มีฝนฟ้าคะนองคลื่นสูงมากกว่า 1 เมตร กรุงเทพมหานครและปริมณฑล มีฝนฟ้าคะนองร้อยละ 10 ของพื้นที่ อุณหภูมิต่ำสุด 25-26 องศาเซลเซียส อุณหภูมิสูงสุด 33-34 องศาเซลเซียส ลมตะวันออก ความเร็ว 10-20 กม./ชม. - 006,https://www.naewna.com/local/613437,2021_11_04
โควิดชลบุรีติดเชื้อ 280 ราย รักษาหาย 320 ราย,"เมื่อเวลา 06.30 น.วันที่ 4 พฤศจิกายน 2564 สำนักงานประชาสัมพันธ์จังหวัดชลบุรี - Chonburi PR รายงานว่า วันนี้มีรายงานผู้ติดเชื้อโควิด-19 รายใหม่ จำนวน 280 ราย 1. คนที่พักอาศัยในจังหวัดระยอง เข้ามารักษาในจังหวัดชลบุรี 31 ราย สะสม 4,605 ราย และจังหวัดอื่นๆรวมสะสม 1,754 ราย 2. Cluster เขตพื้นที่ทหารเรือ อ.สัตหีบ 9 ราย สะสม 1,476 ราย 2.1 ข้าราชการทหารเรือ 3 ราย 2.2 ทหารเกณฑ์ 3 ราย 2.3 ลูกจ้างทหารเรือ 3 ราย 3. Cluster บริษัท สยาม เด็นโซ่ แมนูแฟคเจอริ่ง จำกัด อ.พานทอง 6 ราย สะสม 28 ราย 4. Cluster บริษัท บี ที โอโต้พาร์ต จำกัด อ.เมืองชลบุรี 4 ราย สะสม 20 ราย 5. อาชีพเสี่ยงพบปะผู้คนจำนวนมาก 10 ราย 6. บุคลากรทางการแพทย์ 4 ราย 7. ให้ประวัติเดินทางมาจากพื้นที่เสี่ยงต่างจังหวัด 7.1 กทม. 2 ราย 7.2 จังหวัดระยอง 2 ราย 7.3 จังหวัดเชียงใหม่ 2 ราย 7.4 จังหวัดขอนแก่น 1 ราย 7.5 จังหวัดฉะเชิงเทรา 1 ราย 8. สัมผัสผู้ป่วยยืนยัน 8.1 ในครอบครัว 78 ราย 8.2 จากสถานที่ทำงาน 51 ราย 8.3 บุคคลใกล้ชิด 19 ราย 9. สัมผัสผู้ป่วยยืนยัน (อยู่ระหว่างสอบสวนโรค) 15 ราย 10. อยู่ระหว่างการสอบสวนโรค 45 ราย การระบาดของโควิด-19 ระลอกเดือนเมษายน เริ่มจากแหล่งสถานบันเทิง สู่ครอบครัว มาสู่เพื่อนร่วมงาน มาสู่ชุมชนที่พักอาศัยพนักงาน แรงงาน ซึ่งมีปัจจัยเสี่ยงมาจากการทานข้าวร่วมกัน หรือมีกิจกรรมใกล้ชิด สังสรรค์แม้จะเป็นเพียงกลุ่มเล็ก 2-3 คนในเพื่อนสนิท ทำให้เกิดการระบาดเป็นกลุ่มก้อน (Cluster) ในที่มีผู้คนรวมตัวกัน ทั้งในในสถานประกอบการ ตลาด แคมป์คนงานก่อสร้าง และชุมชนที่พักอาศัย ค่ายทหาร ขอความร่วมมือ แหล่งชุมชุมชนดังนี้ ตลาด 1. ผู้ค้าหรือลูกจ้าง ไม่สัมผัสใกล้ชิดกับผู้ค้าหรือลูกจ้างร้านอื่น ๆ ไม่ทานอาหารใกล้ชิดด้วย 2. ไม่สังสรรค์ 3. ป่วยต้องหยุด 4. ทำความสะอาดห้องน้ำสม่ำเสมอ โดยเฉพาะจุดสัมผัสร่วม หลังออกจากห้องน้ำต้องล้างมือทุกครั้ง ไม่ใช้มือจับหน้าโดยไม่ล้างมือ 5. ใส่แมสก์ตลอดเวลา 6. เมื่อมีผู้ติดเชื้อในตลาด หากมีการตรวจเชิงรุก ขอให้รับการตรวจเชิงรุกทุกคน 7. เมื่อมีการปิดตลาด ขอความร่วมมือผู้สัมผัส หรือมีความเสี่ยงต่อการติดเชื้อให้หยุดอยู่บ้าน 8. ไม่รับแรงงานต่างด้าวจากพื้นที่เสี่ยง 9 มีการสุ่มตรวจ ATK สม่ำเสมอ สถานประกอบการ 1. ไม่สังสรรค์ ไม่ตั้งวงดื่มเหล้า 2. อาหารต้องไม่ทานใกล้ชิดด้วย 3. ป่วยต้องหยุด 4. จุดสัมผัสร่วม ต้องทำความสะอาดบ่อยๆ เช่น ลูกบิด ราวบันได สแกนนิ้วมือ เซ็นชื่อแล้วต้องล้างมือทันที 5. เคร่งครัดในสุขอนามัยส่วนบุคคล ใส่แมสก์ตลอดเวลา ล้างมือบ่อยๆ อยู่ห่างๆกัน 6 สุ่มตรวจ ATK สม่ำเสมอ สำหรับผู้สัมผัสใกล้ชิดผู้ติดเชื้อโควิด-19 ต้องมีการกักตัวอย่างเข้มงวด ไม่ออกไปแพร่เชื้อ การควบคุมป้องกันการระบาดของโควิด-19 ในจังหวัดชลบุรี อยู่บนพื้นฐานของสมดุลระหว่าง การควบคุมโรค เศรษฐกิจ สังคม ปัจจัยความเร็วในการแพร่ระบาดของโควิด-19 ขึ้นกับการเคลื่อนที่นอกบ้านของประชาชน ความใกล้ชิดกัน รวมทั้งระยะเวลาในการใกล้ขิดกัน นอกเหนือจากการไม่เคร่งครัดในสุขอนามัยส่วนบุคคล หากไม่ล้างมือก่อนจับหน้า เชื้อเข้าทางจมูก ปากตา ทำให้มีการติดเชื้อและแพร่ระบาดได้ ในสภาวะการณ์ที่โควิด-19 มีการระบาดในวงกว้าง จนอาจกลายเป็นโรคประจำถิ่น เชื้อไม่ได้หมดสิ่นไป ทำให้มีโอกาสในการติดเชื้อได้ แต่ต้องไม่ให้เกิดการระบาดจนระบบสาธารณสุขรองไม่ไหว และต้องไม่เสียชีวิต ดังนั้นจึงขอความร่วมมือทุกภาคส่วนปฏิบัติตามมาตรการควบคุมโรคของจังหวัดชลบุรี ค้นให้มาก กักให้ดี ชีวิตวิถีใหม่ ร่วมใจฉีดวัคซีน 1 ค้นให้มาก สถานที่ให้บริการประชาชน แหล่งชุมนุมชน ต้องมีการคัดกรองด้วย ATK สม่ำเสมอ ประชาชนที่มีอาการหรือสงสัยสัมผัสใกล้ชิดผู้ติดเชื้อโควิด-19 ให้มีการตรวจ ATK คัดกรอง 2 กักให้ดี ผู้สัมผัสผู้ติดเชื้อให้กักตัวให้ดี ผู้ติดเชื้อต้องแยกกัก ไม่ให้แพร่เชื้อสู่ผู้อื่น 3 ชีวิตวิถีใหม่ ทุกคนต้องเคร่งครัดในสุขอนามัยส่วนบุคคล อยู่ห่างกัน หมั่นล้างมือ แมสก์ต้องใส่ เขื้อเข้าทาง จมูก ปาก ตา ต้องไม่จับหน้า โดยไม่ล้างมือ ทุกคนต้องสามารถอยู่ร่วมกันได้อย่างปลอดภัยในสถานการณ์ที่โควิด-19 ยังคงต้องหลงเหลือ ( smart living with covid-19 )และอาจกลายเเป็นเชื้อประจำถิ่น สถานที่ให้บริการประชาชน ต้องมีมาตรการควบคุมปัองกัน ( covid-19 free setting) 4 ร่วมใจฉีดวัคซีน วัคซีนลดความรุนแรงของโควิด-19 ได้ 100% แต่ผู้ที่ฉีดวัคซีนแล้ว ยังคงสามารถติดเชื้อโควิด-19 ได้ ยังคงต้องมีสุขอนามมัยส่วนบุคคล ขอความร่วมมือทุกท่านในการฉีดวัคซีน เพื่อลดความเร็วในการระบาด และลดความรุนแรงของโควิด-19 โดยเฉพาะผู้สูงอายุและผู้ที่มีโรคประตำตัว ขณะนี้ยังคงมีผู้เสียชีวิตจากโควิด-19 ส่วนใหญ่จะเป็นผู้สูงอายุและมีโรคประจำตัว และเป็นผู้ที่ไม่ฉีดวัคซีน ผู้เสียชีวิตรายใหม่ 2 รายของวันนี้ (เพศชาย อายุ 67 ปี และเพศหญิง อายุ 79 ปี) เป็นผู้สัมผัสผู้ป่วยยืนยันในครอบครัวของผู้ป่วยยืนยันรายก่อนหน้า มีปัจจัยเสี่ยงร่วมที่ทำให้ความรุนแรงของโรคที่นำไปสู่การเสียชีวิต คือ เป็นผู้สูงอายุ และการมีโรคประจำตัว ได้แก่ โรคเบาหวาน ความดันโลหิตสูง โรคไขมันในเลือดสูง โรคไตเรื้อรัง และทั้งสองรายไม่พบประวัติการรับวัคซีน ดังนั้น การฉีดวัคซีนจะช่วยป้องกันไม่ให้ป่วยหนัก ผู้สูงอายุควรได้รับการฉีดวัคซีนป้องกันโรคโควิด 19 เนื่องจากบุคคลกลุ่มนี้มีอัตราป่วยหนักหรือเสียชีวิตจากโรคโควิด 19 มากกว่ากลุ่มอื่น - 006",https://www.naewna.com/local/613438,2021_11_04
จยย.ชนท้ายรถบรรทุกล้มคว่ำ เก๋งตามหลังชนทับ ดับ 1 เจ็บ 1,4 พฤศจิกายน 2564 เมื่อเย็นวันที่ 3 พ.ย.ที่ผ่านมา พ.ต.ต.สินสมุทร์ บุญทัศนา สารวัตรเวรสอบสวน สภ.บางศรีเมือง จ.นนทบุรี พร้อมเจ้าหน้าที่มูลนิธิรป่อเต็กตึ๊ง เดินทางเข้าตรวจสอบหลังจากได้รับแจ้งมีรถ จยย.ชนท้ายรถบรรทุก มีผู้บาดเจ็บและเสียชีวิต เหตุเกิดด้านถนนรัตนาธิเบศร์ขาออก ช่วงใต้ต่างระดับถนนราชพฤกษ์ตัดถนนรัตนาธิเบศร์ ต.บางรักน้อยอ.เมืองนนทบุรี จากนั้นจึงประสานแพทย์เวรจากสถาบันนิติวิทยาศาสตร์รุดเข้าตรวจสอบ ที่เกิดเหตุเจ้าหน้าที่กู้ชีพและกู้ภัย เร่งยื้อชีวิตด้วยการปั๊มหัวใจ น.ส.อุษา ฤทธิ์ใย อายุ 66 ปีนานกว่า 30 นาทีแต่ไม่เป็นผลเสียชีวิตในเวลาต่อมาส่วนผู้บาดเจ็บเป็นหญิงอีก 1 คนถูกนำตัวส่ง ร.พ.พระนั่งเกล้าไปก่อนหน้า ในที่เกิดเหตุพบรถ จยย.ยี่ห้อฮอนด้า รุ่นสกู๊ปปี้สีแดง ทะเบียน 3ขล 1304 กทม สภาพด้านหน้าพังเสียหายและมีข้าวของต่างๆตกอยู่ ใกล้กันพบรถบรรทุก 4 ล้อขนาดกลางยี่ห้อ เกีย ทะเบียน ณย 4462 กทม บรรทุกรถ จยย.ใหม่มาที่ท้ายรถและจอดอยู่ที่เกิดโดยพบร่องรอยเฉี่ยวชนที่มุมขวาด้านท้าย ซึ่งเหตุการณ์นี้ยังมีรถเก๋งยี่ห้อ โตโยต้า สีดำ ทะเบียน 4กท 1656 กทม จอดอยู่โดยทราบว่าก่อนหน้ารถเก๋งนั้นทับร่างของผู้เสียชีวิตไว้ นายอาทิตย์ อายุ 33 ปี ชาวเมียนม่า เป็นคนขับรถบรรทุกกล่าวว่าตนเองนำรถ จยย.มาจากบริษัทและจะนำไปส่งยังปลายทางในพื้นที่ อ.บางบัวทอง ระหว่างทางจึงจอดรถริมทางเพื่อทำการตรวจสอบรถ จยย.ที่ท้ายรถว่ามีการเสียดสีและเชือกมัดแน่นหรือไม่เกรงว่าจะมีร่องรอยความเสียหายในขณะที่ลงมาดูความเรียบร้อยเดินวนรอบรถ 1 รอบก่อนที่จะเดินกลับขึ้นรถซึ่งในขณะที่กำลังเคลื่อนตัวออก จู่ๆ ก็ได้ยินเสียงและมีความรู้สึกว่าถูกกระแทกจากด้านท้ายจนกระทั่งเห็นรถ จยย.นั้นไถลไปบริเวณกลางถนน น.ส.ศยามล เฉลยผล อายุ 43 ปีทางด้านคนขับรถเก๋งกล่าวว่าตนเองขับตามหลังรถ จยย.มาจนกระทั่งรถ จยย.นั้นเฉี่ยวชนเข้าที่ท้ายรถบรรทุกที่จอดอยู่ก่อนที่คนขี่และซ้อนท้ายรถ จยย.ทั้ง 2 จะกระเด็นมาที่หน้ารถของตนซึ่งไม่สามารถเบรกได้ทันจึงทำให้เกิดชนและทับซ้ำดังกล่าว ทางด้านเจ้าหน้าที่ตำรวจกล่าวว่าเบื้องต้นได้ทำการบันทึกภาพที่เกิดเหตุพร้อมกับสอบปากคำคนขับรถบรรทุกและคนขับรถเก๋งไว้โดยคนขับรถบรรทุกอ้างว่า ได้จอดรถเพื่อลงดูความเรียบร้อยรถ จยย.ที่บรรทุกมาก่อนจะเดินขึ้นรถเพื่อขับต่อไปแต่ถูกรถ จยย.ชนท้ายก่อน แต่อย่างไรก็ตามจะต้องทำการสอบปากคนขับรถบรรทุกและรถเก๋งเพิ่มเติมอีกครั้ง ส่วนผู้เสียชีวิตได้มอบให้ทางเจ้าหน้าที่มูลนิธิป่อเต็กตึ๊ง นำส่งสถาบันนิติวิทยาศาสตร์ ร.พ.ธรรมศาสตร์เฉลิมพระเกียรติรังสิตเพื่อชันสูตร ต่อไป. 012,https://www.naewna.com/local/613439,2021_11_04
