title,summary,link,published
ระทึก! 'เซียนพระ'ชื่อดังขับฟอร์จูนเนอร์ พุ่งชนยับคาลานจอดรถห้างดังลพบุรี,ระทึก!เซียนพระชื่อดัง อดีตผู้สมัคร ส.อบจ.ลพบุรี พรรคก้าวไกล ไม่รู้ขับรถอีท่าไหนพุ่งชนรถคนอื่นพังเป็นแถบๆคาลานจอดรถห้างดังลพบุรี และยังมีกลิ่นแก๊สเหม็นตลบอบอวลสร้างความแตกตื่นให้กับปชช.ที่มาจับจ่ายซื่้อของ ด้านตร.คุมตัวสอบสอวน พร้อมดำเนินคดีตามขั้นตอนกฎหมาย 27 ตุลาคมท 2564 ผู้สื่อข่าวรายงานว่า เมื่อช่วงเย็นที่ผ่านมา ร.ต.อ.เอกวิทย์ทองพุ่ม พนักงานสอบสวน สภ.เมืองลพบุรี รับแจ้งเกิดอุบัติเหตุรถชนกันภายในลานจอดรถด้านหลังของห้างสรรพสินค้าบิ๊กซี ซุปเปอร์เซนเตอร์(บิ๊กซี1 )ม.1ต.ท่าศาลาอ.เมือง จ.ลพบุรี มีรถยนต์ได้รับความเสียหายหลายคันและยังมีกลิ่นแก๊สเหม็นตลบอบอวล เกรงจะเกิดเหตุร้าย จึงแจ้งรถดับเพลิงเทศบาล ต.ท่าศาลา จำนวน1คัน พร้อมรุดไปที่เกิดเหตุ โดยจุดเกิดเหตุ เป็นลานจอดรถของห้างดังกล่าว มีประชาชนต่างยืนดูด้วยความแตกตื่น ส่วนที่ผนังของห้างบิ๊กซี ซึ่งเป็นพื้นที่คลังสินค้าของร้านจำหน่ายเครื่องสำอางวัตสันมีสภาพถูกรถยนต์ชนจนพังเสียหาย ในช่องจอด4 Bพบรถยนต์เก๋งโตโยต้าหมายเลข ทะเบียน ภย.6828กทม.รถเก๋ง ฮอนด้า สีขาว หมายเลขทะเบียน กบ 5904สระบุรี รถยนต์เก๋ง ฮอนด้า ภท8188สระบุรีสภาพถูกชนยับใกล้กันพบรถโตโยต้าฟอร์จูนเนอร์ หมายเลขทะเบียน5กพ1901กทม. สภาพด้านหน้าชนกับเสาลานจอดรถ ช่อง5 Bจนกระโปรงหน้ายุบ ที่นั่งด้านคนขับมีถุงลมนิรภัยทำงาน ส่วนที่ด้านท้ายรถสภาพพังยับเยิน ป้ายทะเบียนห้อยลงมา และมีกลิ่นคล้ายแก๊สออกมาจากรถคันดังกล่าวเจ้าหน้าที่ต้องเร่งตรวจสอบอย่างเร่งด่วน นอกจากนี้รถคันดังกล่าวยังชนเข้ากับ รถยนต์เก๋ง นิสสัน กร9057ลพบุรี ที่จอดในลานจอดรถได้รับความเสียหายอีกด้วย ระหว่างนั้น เจ้าหน้าที่พบชายคนหนึ่งผมยาวสวมเสื้อกล้ามสีดำ นุ่งกางเกงยีนส์ทราบว่าเป็นเจ้าของรถฟอร์จูนเนอร์ เดินโทรศัพท์ไปมา ทราบชื่อนายฐพลศรีทองสุขหรือ แจ๊คมณีแดงอายุ52ปี อยู่บ้านเลขที่90/1หมู่6ต.พรหมมาสตร์ อ.เมืองลพบุรีเซียนพระชื่อดัง อดีตผู้สมัคร ส.อบจ.พรรคก้าวไกล และเป็นผู้ขับรถคันดังกล่าวชนกับผนังของห้างและชนเข้ากับรถหลายคัน ซึ่งมากับหญิงสาวคนหนึ่งเจ้าหน้าที่จึงนำตัวไปสอบสวนที่ สภ.เมืองลพบุรี พร้อมทั้งให้มีการเป่าปริมาณแอลกอฮอล์ จากการสอบสวนทราบว่าก่อนเกิดเหตุ นายฐพลได้ขับรถยนต์เข้ามาพร้อมกับหญิงสาวคนดังกล่าวและกำลังถอยเข้าจอดในพื้นที่จอดรถคนพิการอย่างแรง แต่กลับถอยพุ่งเข้าชนคลังสินค้าของร้านดัง จนผนังและสินค้าได้รับความเสียหายจากนั้นยังได้เร่งคันเร่งพุ่งตัวออกอย่างรวดเร็ว จนไปพุ่งชนรถเก๋งที่จอดในช่อง4Bจนพังเสียหายจากนั้นยังเสียหลักไปชนเข้ากับเสาของห้าง จนรถไม่สามารถออกตัวไปไหนได้และยังชนเข้ากับรถเก๋งนิสสันอีกด้วยโชคดีไม่มีผู้ได้รับบาดเจ็บเบื้องต้นค่าเสียหายยังอยู่ระหว่างการตรวจสอบ -001,https://www.naewna.com/local/611865,2021_10_27
ลุงโร่ขึ้นโรงพักลอตเตอรี่หายทั้งแผง วอนคนเก็บได้หรือใครขโมยช่วยส่งคืนด้วย,"ลุงวัย 67 ปีวิ่งโร่ขึ้นโรงพักแจ้งความลอตเตอรี่หายทั้งแผง วอนคนเก็บได้หรือใครขโมยไปช่วยส่งคืนด้วยจะมีรางวัลให้ เผยถ่ายสำเนาเอาไว้หมดแล้ว เมื่อเวลา18.00 น.วันที่ 27 ต.ค.64 ร.ต.อ.เลิศศักดิ์วังคีรี รอง สว.(สอบสวน)สภ.เมืองระยอง รับแจ้งจากนาย ฐิติวัชร์กรรณิกาอายุ 67 ปี บ้านเลขที่ 117/2 ม.2 ต.นาตาขวัญ อ.เมือง จ.ระยอง อาชีพขายของชำว่าลอตเตอรี่ จำนวน 125 ใบ ได้หายไป โดยนายฐิติวัชร์ เล่าว่า ตนเปิดร้านขายของชำภายในบ้านชื่อร้านลุงวัตร-ป้าแป้ว อยู่ที่ในหมู่บ้าน มาบตารอด ม.7 ต.ชากบก อ.บ้านค่าย จ.ระยอง ช่วงเวลา 16.00 น.ของเมื่อวันที่ 26 ต.ค. ตนได้ขับขี่รถจยย.พ่วง (ซาเล้ง) ยี่ห้อฮอนด้า รุ่นเวฟ 125 สีแดง หมายเลขทะเบียน กษพ 252 ระยอง ออกไปที่ร้านวรรณ สาขา 2 ภายในตัวเมืองระยอง เพื่อซื้อสินค้าของชำนำมาขายที่บ้าน โดยได้นำลอตเตอรี่ติดฟิวเจอร์บอร์ดสีเขียว จำนวน 125 ใบ ของงวดวันที่ 1 พ.ย.2564 คิดเป็นเงินราคา 10,240บาท ใส่ติดรถจยย.พ่วงข้างไปด้วยที่บริเวณพ่วงข้างของรถมีลักษณะเป็นตะแกงเหล็ก นายฐิติวัชร์ กล่าวว่า เมื่อตนได้ซื้อของสินค้าของชำเสร็จแล้ว ได้นำแผงลอตเตอรี่นำขึ้นจากรถและเอาสินค้าที่ซื้อมาทับเอาไว้ ก่อนจะขับขี่รถจยย.พ่วงไปแวะจอดที่ลานจอดรถของตลาดนัด ต.นาตาขวัญ ซึ่งห่างจากร้านวรรณ 2ประมาณเกือบ 7 กิโลเมตรเพื่อซื้ออาหารของกินก่อนกลับยังบ้านพักที่อำเภอบ้านค่าย ใช้เวลาเดินในตลาดประมาณ 20 นาที จึงขับรถพ่วงกลับบ้าน เมื่อถึงบ้านพักได้นำสินค้าของชำลงมาเพื่อจะเรียงขายของภายร้าน ปรากฏว่าไม่พบแผงลอตเตอรี่ที่วางอยู่พ่วงข้างของรถจยย.ไม่ทราบว่าหล่นหายไปตอนไหนหรือมีคนร้ายมาฉกขโมยเอาไป ก่อนหน้านี้ผมได้ถ่ายเอกสารลอตเตอรี่ทั้ง 125 ใบที่หายไปเอาไว้ที่บ้าน เพื่อให้ภรรยานำออกมาให้ลูกค้าดู กรณีอยากซื้อลอตเตอรี่ก็ให้จองเลข และโทรไปบอกผม ขณะที่เร่ขายตามสถานที่ต่างๆก็จะเก็บเอาไว้ให้จึงอยากประกาศบอกคนที่เก็บแผงลอตเตอรี่ได้หรืออาจเป็นผู้ร้ายมาฉกเอาไปว่าช่วยนำลอตเตอรี่มาคืนให้ด้วย ผมขายลอตเตอรี่เป็นอาชีพเสริม ต้องหาเช้ากินค่ำอยู่กันเพียง 2 คน ตา-ยาย พอมีพอกินในครอบครัว ขอความเมตตาให้ส่งคืนที่โรงพักเมืองระยอง หรือโทรศัพท์มาหาโดยตรง หมายเลข 094-2693525 และจะมีรางวัลให้สมควรตามอัตภาพอีกทั้งลอตเตอรี่ทุกใบได้ถ่ายเอกสารไว้หมดแล้ว จึงมีหลักฐานทุกใบพ่อค้าลอต้เตอรี่ รายนี้กล่าว -001",https://www.naewna.com/local/611863,2021_10_27
ระทึก! จนท.พิทักษ์ป่าเขตฯตะเบาะ- ห้วยใหญ่เจอกระทิงชนบาดเจ็บ,เจ้าหน้าที่พิทักษ์ป่า เขตรักษาพันธุ์สัตว์ป่าตะเบาะ- ห้วยใหญ่ ถูกกระทิงชน ขณะลาดตระเวนป่าด้านผอ.สบอ.11 ลงพื้นที่เยี่ยมและให้กำลังใจเจ้าหน้าที่แล้ว 27 ตุลาคม 2564นายเสกสันต์ ลอมแปลง หัวหน้าเขตรักษาพันธุ์สัตว์ป่าตะเบาะ - ห้วยใหญ่ เปิดเผยว่า เมื่อวันที่ 25 ตุลาคม 2564 ได้จัดเจ้าหน้าที่ออกปฏิบัติหน้าที่ลาดตระเวนเพื่อตรวจป้องกันและปราบปรามการกระทำผิดกฎหมายเกี่ยวกับการป่าไม้ ในพื้นที่เขตรักษาพันธุ์สัตว์ป่าตะเบาะ-ห้วยใหญ่ ซึ่งเวลาประมาณ 13.00 น. ขณะเดินลาดตระเวนบริเวณป่าปางตาพุฒ ต.ท่าด้วง อ.หนองไผ่ จ.เพชรบูรณ์ อยู่นั้น นายชัยรัตน์ แก้วแจ่ม เจ้าหน้าที่พิทักษ์ป่า ได้ถูกกระทิงชนได้รับบาดเจ็บบริเวณซี่โครงด้านซ้าย สะโพกซ้ำบวม และมีบาดแผลบริเวณเหนือหัวเข่าฉีกขาด ประมาณ 2.5 ซม. จึงได้เร่งนำตัวส่งโรงพยาบาลหนองไผ่ จ.เพชรบูรณ์ ต่อมาได้รับรายงานจากเจ้าหน้าที่รายดังกล่าวว่า แพทย์ได้ตรวจรักษาเอกซเรย์แล้ว ปรากฏว่าอาการปกติ โดยทำการเย็บแผล 5 เข็ม และอนุญาตให้กลับมาพักฟื้นอาการที่บ้านพัก ล่าสุดนายโกเมศ พุทธสอน ผู้อำนวยการสำนักบริหารพื้นที่อนุรักษ์ที่ 11 พร้อมด้วยผู้อำนวยการส่วน หัวหน้ากลุ่มงาน เดินทางลงพื้นที่หน่วยพิทักษ์ป่าปางยาง เขตรักษาพันธุ์สัตว์ป่าตะเบาะ-ห้วยใหญ่ อ.เมือง จ.เพชรบูรณ์ เพื่อมอบกระเช้าเยี่ยม พร้อมเงินช่วยเหลือและชุดปฏิบัติงานภาคสนาม (ชุดลายพราง) เพื่อสร้างขวัญกำลังใจแก่ นายชัยรัตน์ แก้วแจ่ม เจ้าหน้าที่พิทักษ์ป่า (บุคคลภายนอกฯ) หลังถูกกระทิงชนได้รับบาดเจ็บและชุดปฏิบัติงานฉีกขาด ขณะออกปฏิบัติหน้าที่ลาดตระเวนปกป้องผืนป่า เมื่อวันที่ 25 ตุลาคม 2564 ล่าสุดอาการดีขึ้นและปลอดภัยแล้ว ในโอกาสนี้ ผอ.สบอ.11 ยังได้มอบเสบียงอาหารให้แก่เจ้าหน้าที่ผู้ปฏิบัติงานประจำหน่วยพิทักษ์ป่าปางยาง เพื่อสร้างขวัญกำลังใจในการปฏิบัติหน้าที่ปกป้องและปราบปรามการกระทำผิดเกี่ยวกับทรัพยากรป่าและสัตว์ป่า พร้อมพูดคุยสอบถามความเป็นอยู่ทั่วไปและปัญหาในการปฏิบัติงานด้านต่างๆ โดยมีนายเสกสันต์ ลอมแปลง หัวหน้า ขสป.ตะเบาะ-ห้วยใหญ่ และเจ้าหน้าที่ให้การต้อนรับและนำตรวจเยี่ยมพื้นที่ ขอบคุณข้อมูลเฟชบุ๊ก สำนักบริหารพื้นที่อนุรักษ์ที่ 11 (พิษณุโลก),https://www.naewna.com/local/611861,2021_10_27
'ธรรมนัส'เคลื่อนไหวแล้ว! ประกาศลั่นไม่มีตำแหน่งทางการเมืองก็ไม่ทิ้งประชาชน,27 ตุลาคม 2564 ร.อ.ธรรมนัส พรหมเผ่า ส.ส.พะเยา และเลขาธิการพรรคพลังประชารัฐ โพสต์ผ่านเฟขบุ๊กว่าผมยืนยันกับพี่น้องประชาชนอีกครั้งว่า ต่อให้ผมไม่มีตำแหน่งใดๆเลย เหมือนก่อนเข้ามาในวงจรการเมือง เป็นเพียง ร้อยเอก ธรรมนัส พรหมเผ่า ผมก็จะอุทิศตนช่วยเหลือพ่อแม่พี่น้องประชาชนอย่างเต็มที่เหมือนเดิมตามที่ผมได้ตั้งใจไว้ไม่เปลี่ยนแปลง ผมเกิดมาจากครอบครัวชาวนา เป็นลูกชาวนาฐานะยากจน ต่อสู้ชีวิตมาจนถึงวันนี้ พอมีฐานะความเป็นอยู่ที่ดีไม่ขัดสน ผมเข้าใจดีครับว่าความลำบากของคนยากคนจนนั้นเป็นอย่างไร ผมคิดถึงพี่น้องประชาชนเป็นที่ตั้งเสมอ ผมอาจจะไม่ใช่คนที่พูดเก่ง มีวาทศิลป์ แต่ขอให้ดูผลงาน ความทุ่มเท ในการช่วยเหลือพี่น้องประชาชนเป็นที่ตั้ง และให้สิ่งนั้นเป็นคำพูดแทนตัวของผมครับ ขอขอบพระคุณทุกกำลังใจจากทุกๆท่านในทุกๆช่องทางครับ ผู้สื่อข่าวรายงานว่า สำหรับร.อ.ธรรมนัส กำลังเจอมรสุมการเมืองอีกระลอก หลังจากก่อนหน้านี้มีข่าวที่จะปลดพ้นจากตำแหน่งเลขาธิการพรรค โดยจะมีการประชุมกรรมการบริหารพรรคในวันที่ 28 ตุลาคมนี้ ท่ามกลางกระแสข่าวสะพัดมีทั้งฝ่ายที่ต้องการล้างบางสายธรรมนัส และฝ่ายที่ยังต้องการให้เขาทำหน้าที่แม่บ้านพรรคต่อไป -001,https://www.naewna.com/politic/611856,2021_10_27
