title,summary,link,published
ยิปซีพยากรณ์ 'ดวงรายวัน' ประจำวันศุกร์ที่ 22 ตุลาคม 2564,ท่านที่เกิดวันอาทิตย์ อิทธิพลของไพ่โลก(The World)วันนี้จะมีโชคลาภเข้ามาดังลุ้นส่วนคนหวังสิ่งของมีค่าจะได้มาดังรอคอย และคนค้าขายเริ่มดีขึ้นหลังจากมีครอยครัวเข้ามาช่วย งานประจำเริ่มทำผลงานดีกว่าเดิม จึงทำให้ทำงานอย่างมีความสุขและมั่นใจ ความรักเริ่มเข้าใจกันหลังจากไม่พอใจกันมาหลายวัน ท่านที่เกิดวันจันทร์ อิทธิพลของไพ่7 ไม้เท้า(Seveof Wands)วันนี้หายเครียดเพราะงานที่มีปัญหาสามารถแก้ไขได้ลุล่วง และคนที่มีงานส่วนคัวการเจรจาเริ่มเป็นไปในทางที่ดี ความรักมีปัญหากันบ้างจากเรื่องเดิมๆ ด้านการเงินอย่าคาดหวังมากนักกับการเสี่ยง และต้องประหยัดมากๆ วันนี้ ท่านที่เกิดวันอังคาร อิทธิพลของไพ่ 9 ถ้วย(Nine of Cups) วันนี้เงินทองพอมีเข้ามาแต่รายจ่ายสังคมมากเกิน ด้านการเสี่ยงมีเข้ามาบ้างแต่ไม่มาก ด้านการงานทำงานอย่างมีความสุข เพราะเคลียร์ปัญหากับเพื่อนร่วมงานได้ คนค้าขายไปได้ดีขึ้นเพราะนำสื่อใหม่มาช่วย ความรักคนโสดให้ระวังจะไปพบคนมีเจ้าของ ท่านที่เกิดวันพุธ อิทธิพลของไพ่ 8 ไม้เท้า(Eight of Wands)วันนี้ทำงานดีมีผลงานทำให้เจ้านายพอใจ การค้าการขายกิจการส่วนตัวไปได้ดี เงินทองหมุนเวียนได้แต่มิใช่เงินก้อนโตความรักเรื่อยๆ เพราะไม่ค่อยมีเวลาให้กันและกัน ท่านที่เกิดวันพฤหัสบดี อิทธิพลของไพ่ 10 ถ้วย(Ten of Cups)วันนี้ความรักสดใสหลังจากเพื่อนเป็นกาวใจให้ ทำให้ชีวิตสุขสดชื่น แอบชอบใครเขาวาจาดีด้วย เงินทองได้มาจากพี่น้องช่วย ทำให้เคลียร์หนี้สินได้เสียที งานเด่นผลงานเริ่ดเจ้านายประทับใจ กิจการเดินหน้าได้คนช่วย ท่านที่เกิดวันศุกร์ อิทธิพลของไพ่ 9 เหรียญ(Nine of Pentacles)วันนี้เงินทองราบรื่นมีเงินก้อนโตได้มาจากครอบครัว ส่วนที่เป็นเจ้าหนี้จะได้เงินคืนอย่างไม่คาดฝันแม้จะไม่เต็มจำนวน ความรักคนโสดจะได้พบคนถูกใจแต่เป็นคนมีตำหนิ ด้านการงานจะแสดงความสามารถได้โดดเด่น ทำให้หายเครียดกังวลใจ และคนค้าขายเริ่มรุ่งแล้วสิ ท่านที่เกิดวันเสาร์ อิทธิพลของไพ่กงล้อมหาสมบัติ(Wheel of Fortune)วันนี้เงินทองเริ่มเดินสะพัดมีลาภลอยจากคนใกล้ตัว ทำให้หายเครียดกังวลใจ ความรักคนโสดพบคนถูกใจ ด้านการงานผลงานเกินหน้าชาวบ้านเขา ทำให้โดนคนอื่นอิจฉาอย่างออกนอนกหน้า ธุรกิจส่วนตัวเดินหน้าไปได้อย่างน่าพอใจ ท่านผู้อ่านที่มีความประสงค์ต้องการปรึกษา เรื่องดวงชะตาเป็นการส่วนตัวกับอาจารย์กิติคุณพลวัน สอบถามรายละเอียดเพิ่มเติมได้ที่094-6298799 - 006,https://www.naewna.com/lady/610573,2021_10_22
ความกดอากาศสูงระลอกใหม่แผ่ปกคลุม ทำไทยมีฝนเพิ่ม-กทม.ตก70%ของพื้นที่,ความกดอากาศสูงระลอกใหม่แผ่ปกคลุม ทำไทยมีฝนเพิ่ม-กทม.ตก70%ของพื้นที่ เมื่อเวลา 05.00 น.วันที่ 22 ตุลาคม 2564 กรมอุตุนิยมวิทยา รายงานลักษณะอากาศทั่วไป พยากรณ์อากาศ 24 ชั่วโมงข้างหน้า บริเวณความกดอากาศสูงระลอกใหม่อีกระลอกหนึ่งจากประเทศจีนได้แผ่ลงมาปกคลุมบริเวณประเทศลาวตอนบนและทะเลจีนใต้ตอนบนแล้ว คาดว่าจะแผ่ลงมาปกคลุมบริเวณภาคเหนือตอนบนและภาคตะวันออกเฉียงเหนือตอนบนในวันนี้ (22 ตุลาคม 2564) ประกอบกับลมตะวันออกและลมตะวันออกเฉียงใต้ยังคงพัดปกคลุมบริเวณประเทศไทยตอนบน ในขณะที่มรสุมตะวันตกเฉียงใต้พัดปกคลุมทะเลอันดามัน ภาคใต้ และอ่าวไทย ลักษณะเช่นนี้ทำให้ประเทศไทยมีฝนเพิ่มขึ้น โดยมีฝนฟ้าคะนองกับมีลมกระโชกแรงเกิดขึ้นได้บางพื้นที่ในระยะแรก และมีฝนตกหนักบางแห่งในภาคเหนือ ภาคตะวันออกเฉียงเหนือ ภาคกลาง ภาคตะวันออก และภาคใต้ ขอให้ประชาชนในบริเวณพื้นที่เสี่ยงภัยดังกล่าวระวังอันตรายจากฝนฟ้าคะนองและลมกระโชกแรงที่อาจจะเกิดขึ้น รวมถึงระวังอันตรายจากฝนตกหนักและฝนที่ตกสะสม ซึ่งอาจทำให้เกิดน้ำท่วมฉับพลันและน้ำป่าไหลหลากในระยะนี้ไว้ด้วย ฝุ่นละอองขนาดเล็ก ในช่วงของฤดูฝนการสะสมของฝุ่นละออง/หมอกควันมีน้อย พยากรณ์อากาศสำหรับประเทศไทยตั้งแต่เวลา 06:00 วันนี้ ถึง 06:00 วันพรุ่งนี้ + ภาคเหนือ มีฝนฟ้าคะนองร้อยละ 70 ของพื้นที่ กับมีฝนตกหนักและมีลมกระโชกแรงบางแห่ง บริเวณจังหวัดเชียงราย พะเยา แพร่ น่าน อุตรดิตถ์ สุโขทัย พิษณุโลก กำแพงเพชร พิจิตร และเพชรบูรณ์ อุณหภูมิต่ำสุด 22-24 องศาเซลเซียส อุณหภูมิสูงสุด 29-34 องศาเซลเซียส ลมใต้ ความเร็ว 10-20 กม./ชม. + ภาคตะวันออกเฉียงเหนือ มีฝนฟ้าคะนองร้อยละ 60 ของพื้นที่ กับมีฝนตกหนักและมีลมกระโชกแรงบางแห่ง บริเวณจังหวัดเลย หนองคาย หนองบัวลำภู อุดรธานี ขอนแก่น ชัยภูมิ นครราชสีมา บุรีรัมย์ สุรินทร์ ศรีสะเกษ และอุบลราชธานี อุณหภูมิต่ำสุด 21-25 องศาเซลเซียส อุณหภูมิสูงสุด 30-32 องศาเซลเซียส ลมตะวันออก ความเร็ว 10-20 กม./ชม. + ภาคกลาง มีฝนฟ้าคะนองร้อยละ 60 ของพื้นที่ กับมีฝนตกหนักและมีลมกระโชกแรงบางแห่ง บริเวณจังหวัดกาญจนบุรี สุพรรณบุรี สระบุรี พระนครศรีอยุธยา ราชบุรี นครปฐม สมุทรสงคราม และสมุทรสาคร อุณหภูมิต่ำสุด 23-26 องศาเซลเซียส อุณหภูมิสูงสุด 31-33 องศาเซลเซียส ลมใต้ ความเร็ว 10-20 กม./ชม. + ภาคตะวันออก มีฝนฟ้าคะนองร้อยละ 70 ของพื้นที่ กับมีฝนตกหนักและมีลมกระโชกแรงบางแห่ง บริเวณจังหวัดนครนายก ปราจีนบุรี สระแก้ว ฉะเชิงเทรา ชลบุรี ระยอง จันทบุรี และตราด อุณหภูมิต่ำสุด 23-25 องศาเซลเซียส อุณหภูมิสูงสุด 30-33 องศาเซลเซียส ลมตะวันออกเฉียงใต้ ความเร็ว 10-30 กม./ชม. ทะเลมีคลื่นต่ำกว่า 1 เมตร บริเวณที่มีฝนฟ้าคะนองคลื่นสูงประมาณ 1 เมตร + ภาคใต้ (ฝั่งตะวันออก) มีฝนฟ้าคะนองร้อยละ 70 ของพื้นที่ กับมีฝนตกหนักบางแห่ง บริเวณจังหวัดเพชรบุรี ประจวบคีรีขันธ์ ชุมพร สุราษฎร์ธานี นครศรีธรรมราช และยะลา อุณหภูมิต่ำสุด 23-25 องศาเซลเซียส อุณหภูมิสูงสุด 30-32 องศาเซลเซียส ลมตะวันตก ความเร็ว 10-30 กม./ชม. ทะเลมีคลื่นต่ำกว่า 1 เมตร บริเวณที่มีฝนฟ้าคะนองคลื่นสูงประมาณ 1 เมตร + ภาคใต้ (ฝั่งตะวันตก) มีฝนฟ้าคะนองร้อยละ 70 ของพื้นที่ กับมีฝนตกหนักบางแห่ง บริเวณจังหวัดระนอง พังงา ภูเก็ต และกระบี่ อุณหภูมิต่ำสุด 19-25 องศาเซลเซียส อุณหภูมิสูงสุด 28-31 องศาเซลเซียส ลมตะวันตกเฉียงใต้ ความเร็ว 10-30 กม./ชม. ทะเลมีคลื่นต่ำกว่า 1 เมตร บริเวณที่มีฝนฟ้าคะนองคลื่นสูงประมาณ 1 เมตร + กรุงเทพมหานครและปริมณฑล มีฝนฟ้าคะนองร้อยละ 70 ของพื้นที่ กับมีฝนตกหนักและมีลมกระโชกแรงบางแห่ง อุณหภูมิต่ำสุด 24-26 องศาเซลเซียส อุณหภูมิสูงสุด 31-33 องศาเซลเซียส ลมตะวันออกเฉียงใต้ ความเร็ว 10-20 กม./ชม. -005,https://www.naewna.com/local/610575,2021_10_22
เกาะติด! รายงานสถานการณ์ผู้ติดเชื้อไวรัส COVID-19 ทั่วโลก,"ติดตามรายงานสถานการณ์การแพร่ระบาดล่าสุดของ ไวรัสโควิด-19 จากประเทศต่างๆ ทั่วโลก ประจำวันที่ 22ตุลาคม2564มีรายละเอียดดังต่อไปนี้... ผู้ติดเชื้อรวม :243,240,311 ผู้เสียชีวิตรวม : 4,944,687 รักษาหายรวม :220,429,507 ยอดรวมประเทศที่ติดเชื้อ:www.worldometers.info",https://www.naewna.com/inter/610574,2021_10_22
หนุ่มขี่จยย.ชนท้ายสิบล้อพ่วงจอดข้างทาง กะโหลกแตกเสียชีวิต คนขับเผ่นหนี,22 ตุลาคม 2564 เมื่อกลางดึกที่ผ่านมา ร.ต.ท ภัณณิพงค์ จิตร์ตารานนท์ ร้อยเวรสอบสวน สภ.คูคต ได้รับแจ้งมีอุบัติเหตุรถจักรยานยนต์ชนท้ายรถสิบล้อ เป็นเหตุให้มีผู้เสียชีวิตเป็นชาย 1 รายเหตุเกิดภายในซอยลำลูกกา 45 ตำบลลาดสวาย อำเภอลำลูกกา จังหวัดปทุมธานี หลังได้รับแจ้งเหตุได้ไปตรวจสอบที่เกิดเหตุ ร่วมกับแพทย์เวรจากโรงพยาบาลภูมิพลอดุลยเดชและเจ้าหน้าที่อาสาสมัครมูลนิธิร่วมกตัญญู ในที่เกิดเหตุพบผู้เสียชีวิตเป็นชาย 1 ราย ทราบชื่อคือ นายพรศักดิ์ ปึ้งตาเณร อายุ 37 ปี ชาวจังหวัดอุบลราชธานี ตรวจพบบาดแผลกะโหลกศีรษะแตกแขนขวาหัก ซึ่งเป็นผู้ขับขี่รถจักรยานยนต์ MSX 125cc สีดำแดง หมายเลขทะเบียน 6 กง 5072 กทม. สภาพรถด้านหน้าพังยับเยิน หลังจากขับชนอัดท้าย รถบรรทุก 10 ล้อบรรทุกตู้คอนเทนเนอร์ ยี่ห้อ isuzu สีขาว หมายเลขทะเบียน ตัวแม่ 70- 0985 อ่างทอง ตัวลูกทะเบียน 70-0985 อ่างทอง สภาพด้านท้ายมีลอยถูกชนอย่างแรง จึงทำให้เหล็กกันชนงอพับติดด้านใน จากการตรวจสอบยังไม่มีผู้ใดออกมาแสดงตนว่าเป็นเจ้าของรถ เพราะสถานที่ที่จอดค่อนข้างมืด ทำให้รถจักรยานยนต์คันดังกล่าวมองในระยะไกลไม่เห็น จึงทำให้พุ่งชนท้ายอย่างจัง ทางด้านร.ต.ท ภัณณิพงค์ จิตร์ตารานนท์ ร้อยเวรสอบสวน สภ.คูคต ได้ลงพื้นที่ตรวจสอบในจุดเกิดเหตุและร่วมชันสูตรพลิกศพพร้อมกับแพทย์เวร จากนั้นจึงได้บันทึกภาพเก็บไว้เป็นหลักฐาน ก่อนเร่งติดตามตัวเจ้าของรถบรรทุกสิบล้อ โดยทางพนักงานสอบสวนได้ใช้กระดาษเขียนแปะไว้บริเวณด้านหน้ารถ ให้ติดต่อพนักงานสอบสวน สภ.คูคต ด่วนพร้อมกับเบอร์โทร ส่วนผู้เสียชีวิตมอบให้เจ้าหน้าที่อาสาสมัครมูลนิธิร่วมกตัญญูนำร่างผู้เสียชีวิตส่งชันสูตร ที่นิติเวชโรงพยาบาลภูมิพลอดุลยเดชเพื่อหาสาเหตุการตายอีกครั้งและจะได้ประสานทางญาติๆมารับศพนำกลับไปบำเพ็ญกุศลต่อไป,https://www.naewna.com/local/610580,2021_10_22
ยังน่าห่วง! 'อังกฤษ'พบยอดติดเชื้อรายวันทะลุ 5 หมื่นราย,"22 ต.ค.64 สำนักข่าวต่างประเทศรายงานว่ากระทรวงสาธารณสุขอังกฤษระบุว่า มีผู้ติดเชื้อโควิด-19 รายใหม่ 52,000 รายในวันพฤหัสบดี(21ต.ค.) โดยตัวเลขเฉลี่ยรายวันในช่วงสัปดาห์ที่ผ่านมาอยู่ที่กว่า 44,000 คน สูงกว่าสัปดาห์ก่อนหน้าประมาณ 16% นายกรัฐมนตรีบอริส จอห์นสัน กล่าวว่า รัฐบาลยังคงดำเนินแผนงานตามที่ประกาศออกมาเมื่อต้นปีคือการทำตามขั้นตอนต่างๆ เพื่อเปิดกิจกรรมทางสังคมและเศรษฐกิจ พร้อมยกเลิกคำสั่งจำกัดต่างๆ เพื่อให้ประเทศกลับมาอยู่ในภาวะใกล้ปกติอีกครั้ง ด้านองค์การอนามัยโลก (ดับเบิลยูเอชโอ) เพิ่มออกมาเตือนเมื่อต้นสัปดาห์ว่า อังกฤษคือหนึ่งในประเทศที่มีอัตราผู้ติดเชื้อรายใหม่ต่อวันสูงที่สุดในภาคพื้นยุโรป ซึ่งเป็นภูมิภาคเดียวของโลกที่มีการปรับขึ้นของตัวเลขในสัปดาห์ที่แล้ว นอกจากนี้ จอห์นสันยังแนะให้ประชาชนเร่งออกมารับวัคซีนเข็มกระตุ้นให้มากกว่านี้ หลังจากรัฐบาลประกาศพร้อมฉีดวัคซีนเข็มพิเศษให้กับประชาชนที่มีอายุ 50 ปีขึ้นไป และได้รับวัคซีนครบโดสไปก่อนหน้านี้แล้ว ปัจจุบัน ชาวอังกฤษที่มีอายุตั้งแต่ 12 ปีขึ้นไปได้รับวัคซีนโควิด-19 ครบโดสแล้วในสัดส่วนเกือบ 80%",https://www.naewna.com/inter/610586,2021_10_22
