title,summary,link,published
"ยอดผู้ติดเชื้อโควิดทั่วโลก 238,980,193 ราย","เว็บไซต์ worldometers รายงานสถานการณ์โควิด-19 ทั่วโลก ประจำวันที่ 12 ตุลาคม 2564 พบผู้ติดเชื้อแล้ว 238,980,193 ราย เพิ่มขึ้น 299,571 ราย เสียชีวิต 4,872,116 ราย เพิ่มขึ้น 4,437 ราย รักษาหาย 216,223,976 ราย รักษาหายเพิ่ม 376,953 รา",https://mgronline.com/uptodate/detail/9640000100962,12_10_2021
ชลบุรีพบผู้ติดเชื้อโควิดเพิ่ม 511 ราย เสียชีวิต 3 ราย,"สำนักงานสาธารณสุขจังหวัดชลบุรี รายงานสถานการณ์โควิด-19 ประจำวันที่ 12 ตุลาคม 2564 วันนี้มีรายงานผู้ติดเชื้อโควิด-19 รายใหม่ จำนวน 511 ราย เสียชีวิต 3 ราย โดยมีรายละเอียดดังนี้1. Cluster เขตพื้นที่ทหารเรือ อำเภอสัตหีบ 8 ราย สะสม 1,",https://mgronline.com/uptodate/detail/9640000100961,12_10_2021
อุตุฯ เตือนเหนือ-อีสาน-กลาง-ใต้ มีฝนตกหนัก/ กทม.60%,กรมอุตุนิยมวิทยาพยากรณ์อากาศ 24 ชั่วโมงข้างหน้า ร่องมรสุมพาดผ่านภาคเหนือตอนล่าง ภาคกลาง ภาคตะวันออก และภาคตะวันออกเฉียงเหนือตอนล่าง ในขณะที่มรสุมตะวันตกเฉียงใต้กำลังแรงพัดปกคลุมทะเลอันดามัน ภาคใต้ และอ่าวไทย ลักษณะเช่นนี้ทำให้ประเ,https://mgronline.com/uptodate/detail/9640000100959,12_10_2021
"ไทยป่วยโควิดเพิ่ม 9,445 ราย เสียชีวิต 84 ราย","ศูนย์ข้อมูล COVID-19 รายงานสถานการณ์การแพร่ระบาดโควิด 19 ของประเทศไทย ประจำวันที่ 12 ต.ค.64 มีผู้ติดเชื้อรายใหม่ 9,445 ราย ยอดผู้ป่วยสะสม 1,701,501 ราย หายป่วยกลับบ้าน 11,452 ราย เสียชีวิต 84 ราย รวมเสียชีวิตสะสม 17,741 ราย",https://mgronline.com/uptodate/detail/9640000100965,12_10_2021
‘ไพศาล’แนะจับตาเพื่อไทยเสนอชื่อใครเป็นนายกฯ,นายไพศาล พืชมงคล อดีตกรรมการผู้ช่วยรองนายกรัฐมนตรี (พล.อ.ประวิตร วงษ์สุวรรณ) โพสต์ผ่านเฟซบุ๊ก ระบุว่า จับตาเพื่อไทยเสนอชื่อใครเป็นนายก?1.ถ้าลุงโทนี่ยังเป็นลุงโทนี่คนเดิม คงเสนอผู้คนในครอบครัวหรือคนใกล้ชิดกับคนในครอบครัวเป็นนายกรัฐ,https://mgronline.com/uptodate/detail/9640000100970,12_10_2021
"เปิดตลาดทองคำร่วง 250 บ. รูปพรรณขายออก 28,400 บ.","สมาคมค้าทองคำประกาศราคาซื้อขายทอง เวลา 09.28 น. ครั้งที่ 1 ปรับลง 250 บาท เมื่อเทียบกับราคาวานนี้ โดยทองคำแท่งรับซื้อ 27,800.00 บาท ขายออก 27,900.00 บาท ทองรูปพรรณรับซื้อ 27,303.16 บาท ขายออก 28,400.00 บาท",https://mgronline.com/uptodate/detail/9640000100975,12_10_2021
ปภ.เผยมีพื้นที่ประสบอุทกภัย 14 จังหวัด คลี่คลายแล้ว 19 จังหวัด,กรมป้องกันและบรรเทาสาธารณภัย ในฐานะกองอำนวยการป้องกันและบรรเทาสาธารณภัยกลาง (กอปภ.ก.) รายงานจากอิทธิพลพายุ “เตี้ยนหมู่” ซึ่งเคลื่อนตามแนวร่องมรสุมเข้าปกคลุมภาคตะวันออกเฉียงเหนือ และภาคกลาง ทำให้บริเวณประเทศไทยตอนบนมีฝนเพิ่มมากขึ้น,https://mgronline.com/uptodate/detail/9640000100980,12_10_2021
'หมอธีระ'ถามหากเปิด ปท.ในขณะที่คนติดโควิดหลักหมื่นต่อวัน จะเกิดอะไรขึ้น,รศ.นพ.ธีระ วรธนารัตน์ คณะแพทยศาสตร์ จุฬาลงกรณ์มหาวิทยาลัย โพสต์เฟซบุ๊ก Thira Woratanarat ระบุว่า ที่อื่นเค้าเปิดเมื่อพร้อมทั้งเรื่อง1.ระบบตรวจคัดกรองพร้อม มีศักยภาพตรวจได้มาก2.ประชากรส่วนใหญ่ได้วัคซีนครบสองโดส3.ระบบตรวจสอบ ติดตามต,https://mgronline.com/uptodate/detail/9640000101004,12_10_2021
"หุ้นไทยเปิดตลาดบวก 10.69 จุด มูลค่าซื้อขาย 5,858 ล้านบาท","บรรยากาศการซื้อขายตลาดหุ้นไทยเช้านี้ (12 ต.ค.) ดัชนีอยู่ที่ระดับ 1,644.13 จุด ปรับขึ้น 10.69 จุด หรือคิดเป็น 0.65% มูลค่าซื้อขาย 5,858 ล้านบาท",https://mgronline.com/uptodate/detail/9640000101010,12_10_2021
พณ.เผยราคาสินค้าเปลี่ยนแปลงหลายรายการ เมื่อเทียบกับวันก่อนหน้า,กระทรวงพาณิชย์ โดยกรมการค้าภายใน รายงานภาวะราคาสินค้าพื้นที่กรุงเทพฯ พบว่า ราคาสินค้าเปลี่ยนแปลงหลายรายการ เมื่อเทียบกับวันก่อนหน้า โดยถั่วฝักยาว เพิ่มขึ้นเป็นกิโลกรัมละ 50-55 บาท ผักชีเพิ่มขึ้นเป็นกิโลกรัมละ 290-300 บาท ผักคะน้า,https://mgronline.com/uptodate/detail/9640000101006,12_10_2021
ข่าวปลอม! พ.ร.บ.ข้าวฉบับใหม่ ชาวนาเก็บเมล็ดพันธุ์ใช้เองมีโทษจำคุก 1 ปี ปรับ 1 แสน,จากกระแสข่าวที่กำลังถูกแชร์ต่อในโซเชียลระบุว่า พ.ร.บ. ข้าวฉบับใหม่ ชาวนาเก็บเมล็ดพันธุ์ใช้เองมีโทษจำคุก 1 ปี และปรับ 1 แสนนั้น ทางกรมการข้าว กระทรวงเกษตรและสหกรณ์ ได้ตรวจสอบโพสต์ดังกล่าวและชี้แจงข้อมูลว่า ไม่เป็นความจริง เนื่องจาก,https://mgronline.com/uptodate/detail/9640000101005,12_10_2021
แผ่นดินไหว อ.ทองผาภูมิ 1.8 ริกเตอร์ ไม่มีรายงานความเสียหาย,วันนี้ (12 ต.ค.) เวบา 03.48 น. เกิดแผ่นดินไหว ต.ปิล็อก อ.ทองผาภูมิ จ.กาญจนบุรี ขนาด 1.8 ตามมาตราริกเตอร์ ลึกจากผิวดิน 1 กิโลเมตร ไม่มีรายงานความเสียหาย,https://mgronline.com/uptodate/detail/9640000101015,12_10_2021
ปัตตานีพบผู้ติดเชื้อโควิดรายใหม่ 423 ราย เสียชีวิต 4 ราย,"สถานการณ์การแพร่ระบาดของเชื้อโควิด-19 จังหวัดปัตตานี ประจำวันที่ 12 ต.ค.64 พบผู้ติดเชื้อรายใหม่ 423 ราย ทำให้ยอดผู้ติดเชื้อสะสมอยู่ที่ 27,115 ราย มีผู้เสียชีวิตเพิ่มขึ้น 4 ราย ยอดผู้เสียชีวิตสะสมอยู่ที่ 331 ราย",https://mgronline.com/uptodate/detail/9640000101014,12_10_2021
"""นิพิฎฐ์""โพสต์เรื่อง""รองเท้าพระภิกษุสงฆ์ในพระพุทธศาสนานิกายเถรวาท""","นายนิพิฏฐ์ อินทรสมบัติ อดีตรองหัวหน้าพรรคประชาธิปัตย์ โพสต์เฟซบุ๊ก ระบุว่า""รองเท้าพระภิกษุสงฆ์ในพระพุทธศาสนานิกายเถรวาทหลายปีมาแล้ว ผมถวายรองเท้าพระภิกษุสงฆ์ผู้ปฏิบัติดี-ปฏิบัติชอบรูปหนึ่ง ท่านถามติดตลกว่า แปลก ทำไมถวายรองเท้า ไม่",https://mgronline.com/uptodate/detail/9640000101030,12_10_2021
นายกฯ เป็นประธานการประชุมคณะรัฐมนตรี,พล.อ.ประยุทธ์ จันทร์โอชา นายกรัฐมนตรีและรัฐมนตรีว่าการกระทรวงกลาโหม เป็นประธานการประชุมคณะรัฐมนตรี ที่ตึกสันติไมตรีทำเนียบรัฐบาล โดยมีบรรดารองนายกรัฐมนตรี รัฐมนตรี และหน่วยงานที่เกี่ยวข้องเข้าร่วมการประชุมอย่างพร้อมเพียง,https://mgronline.com/uptodate/detail/9640000101029,12_10_2021
GISTDA เปิดภาพดาวเทียมน้ำท่วม 10 จังหวัด เกือบ 8 แสนไร่,GISTDA สำนักงานพัฒนาเทคโนโลยีอวกาศและภูมิสารสนเทศ (องค์การมหาชน) โพสต์เฟซบุ๊ก ระบุว่า GISTDA ใช้ดาวเทียม Cosmo Skymed-1 วันที่ 12 ต.ค.64 ติดตามสถานการณ์น้ำในเขตภาคกลาง ล่าสุดพบพื้นที่น้ำท่วมขังบริเวณบางส่วนของจังหวัดนครสวรรค์ พระน,https://mgronline.com/uptodate/detail/9640000101033,12_10_2021
ศาลเตือน'แม่น้ำหนึ่ง'อย่าโฆษณาพนันหวยใต้ดิน-ทำผิดซ้ำ,ศาลอาญามีนบุรีได้ไต่สวนคดีหมายเลขดำ อ.1883/2564 ที่พนักงานคุมประพฤติได้รายงานต่ออธิบดีผู้พิพากษาศาลอาญามีนบุรีว่า น.ส.ภิรดา ธนโชติจินดา หรือ แม่น้ำหนึ่ง อายุ 27 ปี จำเลย ซึ่งเป็นอดีตเจ้าของเพจเว็บไซต์พนันออนไลน์ และมีพฤติกรรมใบ้หว,https://mgronline.com/uptodate/detail/9640000101043,12_10_2021
ข่าวปลอม! ตร.คุมตัวเด็ก 14 ปี ไป สน.ดินแดง บีบให้รับสารภาพเป็นผู้ลงมือยิง คฝ.ในม็อบ 6 ต.ค.,จากกรณีการโพสต์ที่ระบุข้อมูลว่า เยาวชนวัย 14 ปี ถูกตำรวจควบคุมตัวจากบ้านไปยังสน.ดินแดง ตั้งแต่เวลาประมาณเที่ยงวันของวันที่ 10 ต.ค. 64 โดยตำรวจพยายามบีบบังคับให้รับสารภาพว่าเป็นผู้ลงมือก่อเหตุยิง คฝ. ในม็อบวันที่ 6 ตุลาคมนั้น ทางกอ,https://mgronline.com/uptodate/detail/9640000101047,12_10_2021
เตือนหากมีผู้แอบอ้างเป็นตำรวจ สภ.เมืองเชียงใหม่ เรียกเงินช่วยคดีอย่าหลงโอนเงิน,พ.ต.อ.ภูวนาถ ดวงดี ผกก.สภ.เมืองเชียงใหม่ กล่าวว่า ฝากให้ประชาชนระมัดระวัง ถ้ามีผู้อื่น บุคคลใดแอบอ้างว่าเป็นตำรวจ หรือ เจ้าหน้าที่ตำรวจ สภ.เมืองเชียงใหม่ เรียกรับเงิน ว่าสามารถช่วยเรื่องคดี และติดต่อประชาชนไปในทุกช่องทาง อย่าเชื่อ,https://mgronline.com/uptodate/detail/9640000101052,12_10_2021
"ราคาทองคำครั้งที่ 2 ขึ้น 50 บ. รูปพรรณขายออก 28,400 บ.","สมาคมค้าทองคำประกาศราคาซื้อขายทอง เวลา 12.09 น. ครั้งที่ 2 ปรับขึ้น 50 บาท โดยทองคำแท่งรับซื้อ 27850.00 บาท ขายออก 27950.00 บาท ทองรูปพรรณรับซื้อ 27,348.64 บาท ขายออก 28,450.00 บาท",https://mgronline.com/uptodate/detail/9640000101061,12_10_2021
"""โรม""ห่วงสัญญาเปิดประเทศจาก""บิ๊กตู่""เป็นได้แค่ลมปากพล่อยๆ","นายรังสิมันต์ โรม ส.ส.บัญชีรายชื่อ พรรคก้าวไกล โพสต์เฟซบุ๊ก ระบุว่า ""อีก 2 วัน ครบกำหนด 120 วันเปิดประเทศ บทพิสูจน์คำพูดของพลเอกประยุทธ์อีกครั้ง กับความหวังของประชาชนที่จะมีชีวิตปกติ ช่วงเวลาที่ผ่านมาตลอดการปิดสมัยประชุมสภา ผมและเ",https://mgronline.com/uptodate/detail/9640000101058,12_10_2021
"หุ้นไทยปิดตลาดเช้าบวก 7.33 จุด มูลค่าซื้อขาย 55,072 ล้านบาท","บรรยากาศการซื้อขายหุ้นไทยปิดตลาดภาคเช้าอยู่ที่ระดับ 1,640.77 จุด ปรับขึ้น 7.33 จุด หรือคิดเป็น 0.45% มูลค่าซื้อขาย 55,072 ล้านบาท",https://mgronline.com/uptodate/detail/9640000101080,12_10_2021
10 จังหวัดที่มีผู้ติดเชื้อโควิด-19 รายใหม่สูงสุด,"ศูนย์บริหารสถานการณ์โควิด-19 (ศบค.) รายงานข้อมูลจังหวัดที่มีผู้ติดเชื้อโควิด-19 รายใหม่มากที่สุด 10 อันดับแรก มีรายละเอียดดังนี้1.กรุงเทพมหานคร 1,170 ราย2.ปัตตานี 566 ราย3.ชลบุรี 511 ราย4.ยะลา 493 ราย5.นราธิวาส 473 ราย6.สงขลา 467",https://mgronline.com/uptodate/detail/9640000101074,12_10_2021
'โบว์'ชี้ทุกคนอย่าพะวงยอดติดเชื้อโควิดไม่จบไม่สิ้น แนะ 1 พ.ย.เปิด ร.ร.ได้เลย,น.ส.ณัฏฐา มหัทธนา หรือโบว์ นักเคลื่อนไหวทางการเมือง โพสต์ทวิตเตอร์ Bow Nuttaa Mahattana @NuttaaBow ระบุว่า ข้อมูลจาก Worldometers ไทยมีผู้เสียชีวิตจากโควิดสะสมคิดเป็นสัดส่วนต่อ 1 ล้านประชากรสูงเป็นลำดับที่ 130 จากจำนวน 223 ประเทศ,https://mgronline.com/uptodate/detail/9640000101089,12_10_2021
ม็อบทะลุฟ้าจัดเสวนา “กระบวนการยุติธรรมกับอิสรภาพนักเคลื่อนไหว”พรุ่งนี้,เพจเฟซบุ๊กทะลุฟ้า โพสต์ระบุว่า ม็อบ13ตุลา เสวนากระบวนการยุติธรรมกับอิสรภาพนักเคลื่อนไหวทางการเมือง เวลา 16:00-19:00 น. ณ เรือนจำพิเศษกรุงเทพ สิทธิการประกันตัวชั่วคราวเป็นสิทธิขั้นพื้นฐาน แล้วพบกัน,https://mgronline.com/uptodate/detail/9640000101093,12_10_2021
“บก.ลาย”โพสต์ถามเปิดประเทศขณะประกาศใช้ พ.ร.ก.ฉุกเฉิน ไม่ย้อนแย้งหน่อยเหรอ,นายสมบัติ บุญงามอนงค์ หรือ บก.ลายจุด และนักเคลื่อนไหวกิจกรรม โพสต์เฟซบุ๊ก ระบุว่า เปิดประเทศในขณะที่ยังประกาศใช้ พ.ร.ก.ฉุกเฉิน มันไม่ย้อนแย้งกันหน่อยเหรอ,https://mgronline.com/uptodate/detail/9640000101112,12_10_2021
SCB แจ้งปิดสาขาบางลำพูชั่วคราว หลัง พนง.ใกล้ชิดผู้ติดเชื้อโควิด,วันนี้ (12 ต.ค.) ธนาคารไทยพาณิชย์ขอแจ้งปิดสาขาบางลำพูชั่วคราว เนื่องจากพนักงานใกล้ชิดผู้ติดเชื้อ COVID-19 เพื่อความปลอดภัยของลูกค้าและพนักงานตามมาตรการของกระทรวงสาธารณสุข,https://mgronline.com/uptodate/detail/9640000101109,12_10_2021
รถบัสพุ่งตกลงแม่น้ำในจีน ตาย 2 ราย สูญหาย 12 ราย,สำนักข่าวซินหัวรายงานว่า วานนี้ (11 ต.ค.) เมื่อเวลาราว 07.00 น. เกิดเหตุรถบัสพุ่งตกลงในแม่น้ำฮูถัว เมืองเหอเป่ยของจีน ส่งผลให้มีผู้โดยสารเสียชีวิต 2 ราย และสูญหายอีก 12 ราย จากจำนวนผู้โดยสารทั้งหมด 51 คน,https://mgronline.com/uptodate/detail/9640000101116,12_10_2021
ผู้ค้าบุกทำเนียบยื่นหนังสือร้องนายกฯ หลังโดนเรียกเงินคืนโครงการเราชนะ,นายสามารถ เจนชัยจิตรวนิช อดีตผู้สมัครพรรคพลังประชารัฐ นำผู้ประกอบการที่ได้รับผลกระทบจากการเรียกเงินคืนในโครงการเราชนะ ยื่นหนังสือร้องเรียนถึง พล.อ.ประยุทธ์ จันทร์โอชา นายกรัฐมนตรี และรัฐมนตรีว่าการกระทรวงกลาโหม ที่ศูนย์รับเรื่องรา,https://mgronline.com/uptodate/detail/9640000101125,12_10_2021
สั่งตั้ง กก.สอบข้อเท็จจริงครูสาวเพชรบุรีโปรโมทเว็บพนันออนไลน์,จากกรณีมีการแชร์ข้อความจากผู้ใช้ทวิตเตอร์ Red Skull เป็นเรื่องราวของครูสาวโรงเรียนแห่งหนึ่งใน จ.เพชรบุรี โปรโมทเว็บพนันออนไลน์ และมีการเชิญชวนให้มาร่วมเล่นพนันออนไลน์ นอกจากนี้ ยังได้รับรางวัลหมื่นคุรุชนคนคุณธรรมอีกด้วยนายสุรวิทย์,https://mgronline.com/uptodate/detail/9640000101122,12_10_2021
พังงาฝนตกหนัก-คลื่นลมแรงจากอิทธิพลพายุไลออนร็อก ชาวบ้านหวั่นพายุลูกใหม่,จังหวัดพังงา มีฝนตกต่องเนื่องและคลื่นลมแรงจากอิทธิพลพายุไลออนร็อก โดยที่บริเวณชายหาดบ้านบางเนียง หมู่ที่ 5 ต.คึกคัก อ.ตะกั่วป่า ถูกคลื่นกัดเซาะสร้างความเสียหายเป็นระยะทางกว่า 300 เมตร ผู้ประกอบการรีสอร์ท บังกะโล ต้องเร่งสร้างแนวกั,https://mgronline.com/uptodate/detail/9640000101132,12_10_2021
น้ำป่าหลากท่วมหลายพื้นที่ อ.ขลุง จนท.เร่งช่วยเหลือ ปชช.,ป้องกันและบรรเทาสาธารณะภัยจังหวัดจันทบุรี รายงานว่า วันนี้ (12 ต.ค.) เวลา 10.30 น. เกิดน้ำป่าไหลหลากเข้าพื้นที่ ต.วังสรรพรส อำเภอขลุง หมู่ที่ 1 2 3 4 5 6 7 8 และหมู่ที่ 9 ทำให้การสัญจรบางจุด รถขนาดเล็กไม่สามารถเดินทางได้ทั้งนี้ ฝ,https://mgronline.com/uptodate/detail/9640000101131,12_10_2021
