title,summary,link,published
"ราคาทองคำครั้งที่ 3 ลง 50 บ. รูปพรรณขายออก 28,400 บ.","สมาคมค้าทองคำประกาศราคาซื้อขายทอง เวลา 14.15 น. ครั้งที่ 3 ปรับลง 50 บาท โดยทองคำแท่งรับซื้อ 27,800.00 บาท ขายออก 27,900.00 บาท ทองรูปพรรณรับซื้อ 27,303.16 บาท ขายออก 28,400.00 บาท",https://mgronline.com/uptodate/detail/9640000101130,12_10_2021
ครม.มีมติเยียวยาคนขับแท็กซี่-วินฯ อายุ 65 ปี ในพื้นที่ควบคุมสูงสุด,ที่ประชุมคณะรัฐมนตรี วันนี้ (12 ต.ค.) มีมติเห็นชอบเยียวยาคนขับแท็กซี่ วินมอเตอร์ไซค์ ที่มีอายุ 65 ปี ขึ้นไป ที่ประกอบอาชีพในพื้นที่ควบคุมสูงสุด และเป็นผู้ไม่อยู่ในผู้ประกันตนตาม มาตรา 33 และมีชื่ออยู่ในระบบของกรมการขนส่งทางบก โดยจ,https://mgronline.com/uptodate/detail/9640000101139,12_10_2021
โฆษกรัฐย้ำชัดนายกฯ ยังไม่มีแนวคิดยุบสภา พร้อมขอรอดูผลงาน รบ.,นายธนกร วังบุญคงชนะ โฆษกประจำสำนักนายกรัฐมนตรี แถลงภายหลังการประชุมคณะรัฐมนตรี (ครม.) วันนี้ (12 ต.ค.) ว่า พล.อ.ประยุทธ์ จันทร์โอชา นายกรัฐมนตรี ยังไม่มีแนวคิดยุบสภา โดยรัฐบาลต้องเดินหน้าทำงานเพื่อแก้ไขปัญหาโควิด-19 และน้ำท่วมก่อน,https://mgronline.com/uptodate/detail/9640000101137,12_10_2021
สธ.ยันฉีดวัคซีนโควิดสูตรไขว้ ภูมิฯ ยังอยู่ระดับสูง วอน ปชช.อย่ากังวล,วันนี้ (12 ต.ค.) นพ.เฉวตสร นามวาท ผู้อำนวยการกองควบคุมโรคและภัยสุขภาพในภาวะฉุกเฉิน กล่าวถึงประเด็นการฉีดวัคซีนป้องกันโควิด-19 ว่า การฉีดวัคซีนซิโนแวคเป็นเข็ม 1 ที่ฉีดมาระยะหนึ่งแล้วจะกระตุ้นด้วยวัคซีนแอสตร้าเซนเนก้า เพราะภูมิคุ้มก,https://mgronline.com/uptodate/detail/9640000101168,12_10_2021
ผู้โดยสารเที่ยวบินจากโฮจิมินห์ ซิตี้ ไปยังกรุงฮานอยต้องกักตัว 7 วัน,คณะกรรมการประชาชนประจำกรุงฮานอย ของเวียดนาม เปิดเผยวันนี้ (12 ต.ค.) ว่า ผู้โดยสารเที่ยวบินจากเมืองโฮจิมินห์ ซิตี้ จะต้องกักตัวเป็นเวลา 7 วัน เมื่อเดินทางถึงกรุงฮานอย ซึ่งนโยบายกักตัวดังกล่าวเป็นสิ่งจำเป็น สำหรับการป้องกันเชื้อไวรั,https://mgronline.com/uptodate/detail/9640000101164,12_10_2021
นายกฯ แจงถอดถอนพระสังฆาธิการ เป็นเรื่องมหาเถรฯ,นายธนกร วังบุญคงชนะ โฆษกประจำสำนักนายกรัฐมนตรี กล่าวถึงกรณีการถอดถอนพระสังฆาธิการ จำนวน 3 รูป พ้นจากตำแหน่งเจ้าคณะจังหวัด รวมถึงกระแสเรื่องพระมหาสมปอง ตาลปุตฺโต นั้น พล.อ.ประยุทธ์ จันทร์โอชา นายกรัฐมนตรี ชี้แจงว่า เป็นเรื่องของมติ,https://mgronline.com/uptodate/detail/9640000101175,12_10_2021
15.46 น. ตึกถล่ม! บริเวณถนนประชาชื่น ส่งผลรถติดขัด,JS100 รายงานผ่านทวิตฯ วันนี้ (12 ต.ค.) ว่า เวลา 15.46 น. เกิดเหตุตึกถล่ม บริเวณถนนประชาชื่น ฝั่งขาออก ก่อนถึงมหาวิทยาลัยธุรกิจบัณฑิตย์ ประมาณ 200 เมตร โดยเจ้าหน้าที่ได้ลงพื้นที่และกำลังดำเนินการแก้ไข ทั้งนี้ ส่งผลให้ถนนเส้นทางกล่า,https://mgronline.com/uptodate/detail/9640000101170,12_10_2021
นายกฯ เผยแนวทางชำระหนี้บีทีเอส อยู่ในตอนกฎหมาย,นายธนกร วังบุญคงชนะ โฆษกประจำสำนักนายกรัฐมนตรี เปิดเผยว่า นายกรัฐมนตรี ชี้แจงถึงการชำระหนี้ บีทีเอส สายสีเขียวส่วนต่อขยายาย ว่า อยู่ระหว่างดำเนินการ ซึ่งจะชัดเจนเร็วๆ นี้ โดยมีหลายประเด็นที่เกี่ยวข้อง ส่วนแนวทางการชำระหนี้จำนวน 37,https://mgronline.com/uptodate/detail/9640000101189,12_10_2021
นายกฯ ยันมีมาตรการเยียวยาผู้ประสบอุทกภัย 30 จว.แล้ว,พล.อ.ประยุทธ์ จันทร์โอชา นายกรัฐมนตรีและรัฐมนตรีว่าการกระทรวงกลาโหม ชี้แจงถึงการเยียวยาผู้ประสบอุทกภัยน้ำท่วมใน 30 จังหวัด โดยเฉพาะเกษตรกรผู้ปลูกข้าว ว่า มีมาตรการเยียวยาตามระเบียบอยู่แล้ว ซึ่งต้องเร่งสำรวจข้อเท็จจริง ในเรื่องความ,https://mgronline.com/uptodate/detail/9640000101197,12_10_2021
อุุตุฯ ฉ.2 เตือนอีสานระวังฝนตกหนักช่วง 13-14 ต.ค.นี้ จากอิทธิพลพายุโซนร้อนฯคมปาซุ,"กรมอุตุนิยมวิทยา ประกาาศ ""พายุคมปาซุ"" ฉบับที่ 2 วันนี้ (12 ต.ค.) ว่า เมื่อเวลา 10.00 น. วันนี้ พายุโซนร้อนกำลังแรงคมปาซุ บริเวณทะเลจีนใต้ตอนบน มีศูนย์กลางอยู่ที่ละติจูด 19.0 องศาเหนือ ลองจิจูด 118.3 องศาตะวันออก มีความเร็วลมสูงสุด",https://mgronline.com/uptodate/detail/9640000101203,12_10_2021
ครม.มีมติปรับเพิ่มวงเงินโครงการก่อสร้างทางหลวงพิเศษระหว่างเมืองบางใหญ่-กาญจนบุรี,"น.ส.ไตรศุลี ไตรสรณกุล รองโฆษกประจำสำนักนายกรัฐมนตรี เปิดเผยว่า ที่ประชุมคณะรัฐมนตรี วันนี้ (12 ต.ค.) มีมติอนุมัติปรับเพิ่มกรอบวงเงินโครงการก่อสร้างทางหลวงพิเศษระหว่างเมืองสายบางใหญ่-กาญจนบุรี จากเดิม 55,927 ล้านบาท เป็น 56,047.77",https://mgronline.com/uptodate/detail/9640000101209,12_10_2021
ครม.ไฟเขียวรับการสนับสนุนวัคซีนโควิดจากเกาหลี 4.7 แสนโดส,"น.ส.ไตรศุลี ไตรสรณกุล รองโฆษกประจำสำนักนายกรัฐมนตรี เปิดเผยว่า คณะรัฐมนตรีมีมติเห็นชอบรับการสนับสนุนวัคซีนโควิด-19 จากเกาหลี จำนวน 470,000 โดส โดยเกาหลีมีความประสงค์ที่จะให้การสนับสนุนบริจาควัคซีนแอสตร้าเซนเนก้าให้กับไทย โดยจะเน้",https://mgronline.com/uptodate/detail/9640000101217,12_10_2021
ผู้บริหารกรุงไทยชี้นายกฯ เปิด ปท.1 พ.ย.นี้ เป็นเรื่องดี ปชช.ต้องอยู่กับโควิดให้ได้,นายผยง ศรีวณิช กรรมการผู้จัดการใหญ่ ธนาคารกรุงไทย จำกัด (มหาชน) ประเมินถึงกรณีที่นายกรัฐมนตรีประกาศเตรียมความพร้อมเปิดรับนักท่องเที่ยวเข้าประเทศ ในวันที่ 1 พฤศจิกายนนี้ ว่า เป็นเรื่องดี พร้อมเน้นย้ำว่า ประเทศจะต้องอยู่กับเชื้อโควิ,https://mgronline.com/uptodate/detail/9640000101224,12_10_2021
เชียงใหม่พบผู้ติดเชื้อโควิดรายใหม่ 214 ราย,สำนักงานสาธารณสุขจังหวัดเชียงใหม่ รายงานสถานการณ์ของโรคโควิด-19 ในพื้นที่วันนี้ (12 ต.ค.) ว่า พบผู้ติดเชื้อรายใหม่ 214 ราย แบ่งเป็นผู้ติดเชื้อในพื้นที่ 209 ราย ติดเชื้อจากต่างจังหวัด 5 ราย ทำให้ยอดผู้ติดเชื้อสะสมระลอกใหม่ ตั้งแต่เ,https://mgronline.com/uptodate/detail/9640000101228,12_10_2021
ก.แรงงานวางมาตรการ 3 ระยะ ช่วยแรงงานจากผลกระทบอุทกภัย,นายสุชาติ ชมกลิ่น รัฐมนตรีว่าการกระทรวงแรงงาน เปิดเผยว่า นายกรัฐมนตรีห่วงใยประชาชนและแรงงานที่ได้รับผลกระทบจากสถานการณ์อุทกภัย โดยมอบหมายให้กระทรวงแรงงานดูแลเรื่องสิทธิประกันสังคม สิทธิตามกฎหมายคุ้มครองแรงงานที่จะได้รับภายหลังน้ำล,https://mgronline.com/uptodate/detail/9640000101239,12_10_2021
"ททท.เตรียมดึง""ลิซ่า แบล็กพิงก์""ร่วมเคาท์ดาวน์งานปีใหม่ที่ภูเก็ต",นายยุทธศักดิ์ สุภสร ผู้ว่าการการท่องเที่ยวแห่งประเทศไทย (ททท.) เปิดเผยว่า ททท.เตรียมร่วมกับเอกชนที่เป็นพันธมิตรดึงตัว น.ส.ลลิษา มโนบาล หรือ ลิซ่า แบล็กพิงก์ ศิลปินสาวชาวไทยชื่อดังระดับโลก และ แอนเดรีย โบเซลลี นักร้องโอเปราชื่อดังข,https://mgronline.com/uptodate/detail/9640000101245,12_10_2021
18.03 น. รถชนกัน 3 คันซ้อนเส้นบางพลี-สุขสวัสดิ์ ส่งผลรถติดขัด,FM91 Trafficpro รายงานวันนี้ (12 ต.ค.) ว่า เวลา 18.03 น. เกิดอุบัติเหตุรถบรรทุก 18 ล้อ รถนั่งส่วนบุคคล และรถกระบะ ชนกันบนทางพิเศษ กาญจนาภิเษก (บางพลี-สุขสวัสดิ์) มุ่งหน้าบางขุนเทียน กม.19+100A เชิงทางขึ้นสะพานกาญจนาภิเษก ทำให้กีดข,https://mgronline.com/uptodate/detail/9640000101242,12_10_2021
"หุ้นไทยปิดวันนี้ +10.20 จุด มูลค่าซื้อขายรวม 93,081 ล.","การซื้อขายหุ้นไทยวันนี้ (12 ต.ค.) ดัชนี SET Index ปิดตลาดปรับขึ้น 10.20 จุด หรือคิดเป็น ร้อยละ 0.62 อยู่ที่ระดับ 1,643.64 จุด โดยมีมูลค่าการซื้อขายรวมทั้งสิ้น 93,081 ล้านบาท",https://mgronline.com/uptodate/detail/9640000101249,12_10_2021
"อุตุฯ ฉ.3 ""พายุคมปาซุ"" เตือนทั่วไทยระวังฝนตกหนัก-ทะเลคลื่นสูง เรือเล็กงดออกจากฝั่ง","กรมอุตุนิยมวิทยา ประกาศฉบับที่ 3 ""พายุคมปาซุ"" เมื่อเวลา 16.00 น.วันนี้ (12 ต.ค.) ว่า พายุโซนร้อนกำลังแรงคมปาซุ บริเวณทะเลจีนใต้ตอนบน มีศูนย์กลางอยู่ที่ละติจูด 18.4 องศาเหนือ ลองจิจูด 117.0 องศาตะวันออก มีความเร็วลมสูงสุดใกล้ศูนย์ก",https://mgronline.com/uptodate/detail/9640000101260,12_10_2021
อินโดฯ จะเปิดเที่ยวบินระหว่าง ปท.ไปยังเกาะบาหลีอีกครั้ง 14 ต.ค.นี้,นายลูฮัท บินซาร์ ปันด์จัยตัน รัฐมนตรีกระทรวงประสานงานกิจการทางทะเลและการลงทุนอินโดนีเซีย แถลงวันนี้ (12 ต.ค.) ว่า อินโดนีเซียจะเปิดเที่ยวบินระหว่างประเทศไปยังเกาะบาหลีอีกครั้ง ในวันที่ 14 ตุลาคมนี้ สำหรับชาวต่างชาติที่เดินทางมาจาก,https://mgronline.com/uptodate/detail/9640000101255,12_10_2021
"กกต.เผยมีผู้สมัครนายก-สมาชิก อบต.ครบแล้ว 76 จว. รวม 98,398 ราย","สำนักงานคณะกรรมการการเลือกตั้ง (กกต.) เผยแพร่เอกสารแจ้งว่า จากการที่ กกต.กำหนดให้มีการเลือกตั้งนายกและสมาชิกองค์การบริหารส่วนตำบล (อบต.) และมีการเปิดรับสมัครระหว่างวันที่ 11-15 ตุลาคม 2564 นั้น ในจำนวน อบต. 5,300 มีผู้สมัครนายกและ",https://mgronline.com/uptodate/detail/9640000101265,12_10_2021
ในหลวงโปรดเกล้าฯ ให้ผู้ว่าฯ ยะลานำดอกไม้พระราชทานมอบ 4 ตร.เหยื่อบึ้มรถสายตรวจ,วันนี้ (12 ต.ค.64) เวลา 14.00 น. พระบาทสมเด็จพระเจ้าอยู่หัว ทรงพระกรุณาโปรดเกล้าโปรดกระหม่อมให้ นายภิรมย์ นิลทยา ผู้ว่าราชการจังหวัดยะลา เชิญดอกไม้และตะกร้าสิ่งของพระราชทานของพระบาทสมเด็จพระเจ้าอยู่หัว และสมเด็จพระนางเจ้า ฯ พระบร,https://mgronline.com/uptodate/detail/9640000101267,12_10_2021
ปัตตานียังวิกฤต ยอดติดเชื้อโควิดรายวันสูงกว่า 400 ราย ต่อเนื่องเป็นสัปดาห์ที่ 2,สถานการณ์การแพร่ระบาดของเชื้อโควิด-19 ในพื้นที่จังหวัดปัตตานี ยังสูงกว่า 400​ ราย ต่อเนื่อง​เป็นสัปดาห์ที่​ 2 หลังมาตรการผ่อนปรน​จากการถูกกำหนดเป็นพื้นที่ควบคุมสูงสุด​สีแดงเข้ม​ โดยวานนี้ (11 ต.,https://mgronline.com/uptodate/detail/9640000101273,12_10_2021
