title,summary,link,published
"ไทยพบผู้ติดเชื้อโควิดรายใหม่ 7,574 ราย เสียชีวิตเพิ่ม 78 คน","ศูนย์บริหารสถานการณ์โควิด-19 (ศบค.) รายงานสถานการณ์โรคโควิด-19 ในประเทศไทยวันนี้ ( 2 พ.ย.) ว่า รอบ 24 ชั่วโมง ที่ผ่านมา มีผู้ติดเชื้อรายใหม่ 7,574 ราย จำแนกเป็นผู้ป่วยจากระบบเฝ้าระวังและบริการ 6,793 ราย จากการค้นหาเชิงรุก 256 ร",https://mgronline.com/uptodate/detail/9640000108386,2021_11_02
นายกฯ เชิญผู้นำสหรัฐฯ เยือนไทยในการประชุมเอเปค ปี 65,พล.อ.ประยุทธ์ จันทร์โอชา นายกรัฐมนตรีและรัฐมนตรีว่าการกระทรวงกลาโหม ได้พบปะพูดคุยกับ นายโจ ไบเดน ประธานาธิบดีสหรัฐฯ ระหว่างงานเลี้ยงรับรองผู้นำในการประชุมรัฐภาคีกรอบอนุสัญญาสหประชาชาติว่าด้วยการเปลี่ยนแปลงสภาพภูมิอากาศ (COP 26) หล,https://mgronline.com/uptodate/detail/9640000108391,2021_11_02
อุตุฯ เตือนใต้ระวังอันตรายจากฝนตกหนัก-น้ำท่วมฉับพลัน กทม.มีฝน 40%,กรมอุตุนิยมวิทยา พยากรณ์อากาศ 24 ชั่วโมงข้างหน้า วันนี้ (2 พ.ย.) ว่า บริเวณความกดอากาศสูงยังคงแผ่ปกคลุมภาคตะวันออกเฉียงเหนือและทะเลจีนใต้ ส่งผลให้มีลมตะวันออก และลมตะวันออกเฉียงใต้พัดปกคลุมประเทศไทยตอนบน ในขณะที่มีลมตะวันออกพัดปกค,https://mgronline.com/uptodate/detail/9640000108387,2021_11_02
รมช.ศธ.ชี้คลัสเตอร์ รร.เชียงใหม่ ได้มอบอำนาจให้ผู้ว่าฯ จัดการแล้ว,คุณหญิงกัลยา โสภณพนิช รัฐมนตรีช่วยว่าการกระทรวงศึกษาธิการ เปิดเผยถึงภาพรวมการเปิดภาคเรียนที่ 2 แบบ on site เมื่อวานนี้ (1 พ.ย.) ซึ่งเป็นวันแรกของการเปิดประเทศ ว่า ทั่วประเทศเปิดการเรียนการสอนแบบ on-site แล้วจำนวนหมื่นกว่าโรงเรียน,https://mgronline.com/uptodate/detail/9640000108398,2021_11_02
สหรัฐฯ เริ่มฉีดวัคซีนไฟเซอร์ให้เด็กวัย 5-11 ปี 8 พ.ย.นี้,ผู้ประสานงานการตอบสนองต่อการระบาดของเชื้อไวรัสโควิด-19 ประจำทำเนียบขาวของสหรัฐฯ เปิดเผยว่า การฉีดวัคซีนโควิด-19 ของไฟเซอร์-ไบออนเทค ให้เด็กในอายุระหว่าง 5-11 ปี ในสหรัฐฯ นั้น จะเริ่มดำเนินการอย่างเต็มที่ตั้งแต่วันที่ 8 พฤศจิกายนนี,https://mgronline.com/uptodate/detail/9640000108393,2021_11_02
อินเดียกลับมาเปิดชั้นเรียนอีกครั้งวานนี้ หลังปิดนานจากพิษโควิด-19,โรงเรียนทั้งหมดกรุงนิวเดลีของอินเดีย กลับมาเปิดชั้นเรียนอีกครั้งตั้งแต่เมื่อวานนี้ (1 พ.ย.) หลังจากปิดมานานถึง 19 เดือน จากการระบาดของเชื้อไวรัสโควิด-19 ภายใต้นโยบายใหม่ ทั้งนี้ อนุญาตให้นักเรียนเข้าเรียน ร้อยละ 50 ต่อวัน และสลับก,https://mgronline.com/uptodate/detail/9640000108408,2021_11_02
อินโดฯ อนุมัติใช้วัคซีนของโนวาแวกซ์เป็นการฉุกเฉิน เป็นประเทศแรกของโลกแล้ว,โนวาแวกซ์ ซึ่งเป็นบริษัทเทคโนโลยีชีวภาพของสหรัฐฯ เปิดเผยว่า ทางการอินโดนีเซียอนุมัติการใช้วัคซีนโควิด-19 ของโนวาแวกซ์ เป็นการฉุกเฉิน เป็นประเทศแรกของโลก โดยวัคซีนของโนวาแวกซ์ที่จะใช้ในอินโดนีเซียถูกผลิตโดยสถาบันเซรุ่มของอินเดีย ซึ,https://mgronline.com/uptodate/detail/9640000108406,2021_11_02
ผอ.บดินทรเดชาฯ ยันไม่บังคับเรียนแบบ On-site ทุกอย่างขึ้นกับนักเรียน,บรรยากาศการเปิดเทอมแบบ On-site ของโรงเรียนบดินทรเดชา (สิงห์ สิงหเสนี) ในวันที่สอง วันนี้ (2 พ.ย.) เป็นไปอย่างคึกคัก นักเรียนต่างสวมหน้ากากอนามัย ผ่านจุดคัดกรองตรวจวัดอุณหภูมิ และล้างมือด้วยเจลแอลกอฮอล์ ก่อนเข้าไปภายในโรงเรียนด้าน,https://mgronline.com/uptodate/detail/9640000108409,2021_11_02
รพ.สนามธรรมศาสตร์แจงยุติบริจาควัคซีนโมเดอร์นาจากโปแลนด์,เพจโรงพยาบาลสนามธรรมศาสตร์ โพสต์ข้อความชี้แจงวันนี้ (2 พ.ย.) ว่า ขอยุติการบริจาควัคซีนโควิด-19 ของโมเดอร์นา จำนวน 1.5 ล้านโดส จากประเทศโปแลนด์ หลังได้ดำเนินการประสานเป็นผู้รับผิดชอบตรวจสอบวัคซีน จัดหาผู้ขนส่ง และค่าใช้จ่ายในเรื่อง,https://mgronline.com/uptodate/detail/9640000108416,2021_11_02
"ราคาทองเปิดตลาดปรับขึ้น 50 บ. ทองรูปพรรณขายออก 28,750 บ.","สมาคมค้าทองคำ ประกาศราคาทอง96.5% ประจำวันที่ 2 พฤศจิกายน 2564 เวลา 09:27 น. (ครั้งที่ 1) ราคามีการปรับขึ้น 50 บาท เมื่อเทียบกับราคาสุดท้ายของวานนี้ โดยทองคำแท่ง รับซื้อบาทละ 28,150 บาท ขายออกบาทละ 28,250 บาท ส่วนทองรูปพรรณ รับซื้อ",https://mgronline.com/uptodate/detail/9640000108414,2021_11_02
10.24 น. ฟอร์จูนเนอร์เสียหลักตก ถ.พหลโยธิน ช่วงตลาดไท ทำจราจรติดขัด,JS100 รายงานว่า เวลา 10.24 น. วันนี้ (2 พ.ย.) เกิดบัติเหตุรถฟอร์จูนเนอร์ เสียหลักตกร่องกลางถนนพหลโยธิน ช่วงตลาดไท ถึงนิคมอุตสาหกรรมนวนคร บริเวณหน้าศาลอุทธรณ์ภาค 1 ทำให้การจราจรติดขัดและรถเคลื่อนตัวได้ช้า,https://mgronline.com/uptodate/detail/9640000108444,2021_11_02
จีนเตือน ปชช.ตุนเครื่องอุปโภค-บริโภครับมือภาวะราคาขึ้นช่วงฤดูหนาว,กระทรวงพาณิชย์จีน แถลงการณ์เมื่อคืนวานนี้ (1 พ.ย.) ตามเวลาท้องถิ่น ว่า ขอให้แต่ละครอบครัวในประเทศจีน สำรองเครื่องอุปโภค บริโภคประจำวันไว้ให้พร้อม กรณีความต้องการสินค้ามีการปรับตัวเพิ่มขึ้นอย่างกะทันหันนอกจากนี้ ยังขอให้หน่วยงานท้อ,https://mgronline.com/uptodate/detail/9640000108442,2021_11_02
ตร.กำชับผู้ประกอบการสระแก้วเข้มมาตรการ ศบค.แม้เปิด ปท.หวั่นคลัสเตอร์ใหม่,พล.ต.ต.ณัฐพงษ์ สัตยานุรักษ์ ผู้บังคับการตำรวจภูธรจังหวัดสระแก้ว กำชับผู้ประกอบการร้านอาหารและที่พัก ในพื้นที่จังหวัดสระแก้ว ให้ปฏิบัติตามมาตรการที่ศูนย์บริหารสถานการณ์โควิด-19 หรือ ศบค. กำหนดอย่างเคร่งครัด แม้จะมีการเปิดประเทศ และ,https://mgronline.com/uptodate/detail/9640000108452,2021_11_02
"""นิพนธ์"" เตรียมแถลง 11 โมงนี้ คาดแจงปม กกต.ให้พ้นความเป็น รมต.",นายนิพนธ์ บุญญามณี รัฐมนตรีช่วยว่าการกระทรวงมหาดไทย ในฐานะรองหัวหน้าพรรคประชาธิปัตย์ (ปชป.) จะแถลงในเวลา 11.00 น.วันนี้ (2 พ.ย.) โดยคาดว่า เป็นการชี้แจง กรณีมีการยื่นคำร้องต่อคณะกรรมการการเลือกตั้ง (กกต.) ให้พิจารณาและเสนอให้ศาลรั,https://mgronline.com/uptodate/detail/9640000108456,2021_11_02
"""บิ๊กป้อม"" ไม่ทราบ ""บิ๊กแป๊ะ"" ถอนตัวชิงเก้าอี้ผู้ว่าฯ กทม.",พล.อ.ประวิตร วงษ์สุวรรณ รองนายกรัฐมนตรี ระบุว่า ไม่ทราบรายละเอียดกรณี พล.ต.อ.จักรทิพย์ ชัยจินดา อดีตผู้บัญชาการตำรวจแห่งชาติ ถอนตัวจากการลงสมัครเลือกตั้งผู้ว่าราชการกรุงเทพมหานคร และ พล.ต.อ.จักรทิพย์ ไม่ได้หารือหรือปรึกษาตนในเรื่,https://mgronline.com/uptodate/detail/9640000108455,2021_11_02
เกาหลีใต้เผย CPI ต.ค.64 พุ่งขึ้น 3.2% สูงสุดในรอบเกือบ 10 ปี,สำนักงานสถิติแห่งชาติเกาหลีใต้ เปิดเผยว่า ดัชนีราคาผู้บริโภค (CPI) ซึ่งเป็นมาตรวัดเงินเฟ้อที่เกิดจากการใช้จ่ายของผู้บริโภคในเดือนตุลาคม 2564 พุ่งขึ้นร้อยละ 3.2 ซึ่งขยายตัวรวดเร็วสุดในรอบเกือบ 10 ปี อันเนื่องมาจากผลกระทบของฐานเปร,https://mgronline.com/uptodate/detail/9640000108470,2021_11_02
"""หมอยง"" รับอาสาสมัครโครงการศึกษาวิจัยกระตุ้นเข็ม 3 ฉีดไฟเซอร์-โมเดอร์นา",วันนี้ (2 พ.ย.) เพจเฟซบุ๊ก Yong Poovorawan ของ ศ.นพ.ยง ภู่วรวรรณ หัวหน้าศูนย์เชี่ยวชาญเฉพาะทางด้านไวรัสวิทยาคลินิก ภาควิชากุมารเวชศาสตร์ คณะแพทยศาสตร์ จุฬาลงกรณ์มหาวิทยาลัย โพสต์ข้อความรับอาสาสมัครฉีดวัคซีน ว่าโควิด-19 วัคซีน รับอ,https://mgronline.com/uptodate/detail/9640000108483,2021_11_02
ระยองพบผู้ติดเชื้อโควิดรายใหม่ 147 ราย เสียชีวิตเพิ่ม 3 คน,ศูนย์ปฏิบัติการโควิด-19 จังหวัดระยอง รายงานพบผู้ติดเชื้อโควิด-19 ในพื้นที่วันนี้ ( 2 พ.ย.) ว่า พบผู้ติดเชื้อรายใหม่ 147 ราย จากระบบเฝ้าระวังและบริการ 116 ราย และการค้นหาเชิงรุก 31 ราย รวมผู้ป่วยสะสมตั้งแต่เดือนเมษายน 2564 จำนว,https://mgronline.com/uptodate/detail/9640000108481,2021_11_02
อินโดฯ เดินหน้าย้ายเมืองหลวงภายในปี 67 ชี้ช่วยกระจายกิจกรรม ศก.,สำนักข่าวบลูมเบิร์ก รายงานว่า อินโดนีเซียอยู่ระหว่างเดินหน้าแผนการย้ายเมืองหลวง จากกรุงจาการ์ตา ไปจังหวัดกาลิมันตันตะวันออก ภายในช่วงครึ่งแรกของปี 2567 ขณะที่ประธานาธิบดีโจโค วิโดโด้ ของอินโดนีเซีย กล่าวว่า การย้ายเมืองหลวงจะช่วยก,https://mgronline.com/uptodate/detail/9640000108493,2021_11_02
กรมชลฯ สั่งเฝ้าระวังพื้นที่เสี่ยงน้ำหลาก-ดินถล่มภาคใต้ หลังฝนตกต่อเนื่อง,นายประพิศ จันทร์มา อธิบดีกรมชลประทาน ระบุว่า ได้สั่งให้เฝ้าระวังพื้นที่เสี่ยงน้ำหลาก ดินถล่ม น้ำล้นอ่างเก็บน้ำ และน้ำล้นตลิ่ง ในพื้นที่ภาคใต้ หลังเริ่มมีฝนตกอย่างต่อเนื่อง โดยให้ทุกโครงการชลประทานในพื้นที่ติดตามสถานการณ์น้ำ สภาพอ,https://mgronline.com/uptodate/detail/9640000108490,2021_11_02
"""สุทิน"" เผยประชุมร่วมฝ่ายค้านวันนี้ เน้นหารือการทำงาน-วาระประชุมสภาฯ",นายสุทิน คลังแสง ประธานคณะกรรมการประสานงานพรรคร่วมฝ่ายค้าน(วิปฝ่ายค้าน) เปิดเผยว่า การประชุมพรรคร่วมฝ่ายค้านในวันนี้ (2 พ.ย.) จะเน้นพูดคุยเรื่องการทำงานที่ผ่านมา รวมถึงการพูดคุยถึงวาระการประชุมสภาผู้แทนราษฎรในแต่ละสัปดาห์ ส่วนกรณี,https://mgronline.com/uptodate/detail/9640000108488,2021_11_02
"""รุ้ง ปนัสยา"" ขอเลื่อนพบ บก.ปอท.หลังเรียกรับทราบข้อกล่าวหาคดี ม.112 วันนี้",นางสาวปนัสยา สิทธิจิรวัฒนกุล หรือ รุ้ง แกนนำ กลุ่มราษฎร ขอเลื่อนเข้าพบคณะพนักงานสอบสวน กองบังคับการปราบปรามการกระทำความผิดเกี่ยวกับอาชญากรรมทางเทคโนโลยี (บก.ปอท. ) หลังถูกออกหมายเรียกให้มารับทราบข้อกล่าวหาคดีมาตรา 112 ในวันนี้ (2,https://mgronline.com/uptodate/detail/9640000108500,2021_11_02
ไฟไหม้ร้านค้าตลาดนัดจตุจักร จนท.ระงับเหตุได้แล้ว,JS100 รายงานว่า เวลา 12.30 น. วันนี้ (2 พ.ย.) เกิดเหตุเพลิงไหม้ร้านขายของภายในตลาดนัดจตุจักร โครงการ 21 บริเวณใกล้เคียงหอนาฬิกา โดยเจ้าหน้าที่เข้าระงับเหตุเพลิงไหม้ให้สงบลงแล้ว เบื้องต้น พบเพลิงไหม้ร้านนวดและร้านเฟอร์นิเจอร์ ส่วนส,https://mgronline.com/uptodate/detail/9640000108516,2021_11_02
อย.คาดอนุมัติฉีดวัคซีนไฟเซอร์ในเด็ก 5-11 ปี เร็ววันนี้ หลังสหรัฐฯ ใช้ฉุกเฉินแล้ว,นพ.ไพศาล ดั่นคุ้ม เลขาธิการคณะกรรมการอาหารและยา กล่าวถึงกรณีการขยายช่วงอายุการฉีดวัคซีนป้องกันโรคโควิด-19 ยี่ห้อไฟเซอร์ ว่า สำนักงานคณะกรรมการอาหารและยา (อย.) ยังอนุญาตให้ฉีดวัคซีนไฟเซอร์ได้ ตั้งแต่อายุ 12 ปีขึ้นไป ขนาด 30 ไมโครกร,https://mgronline.com/uptodate/detail/9640000108518,2021_11_02
ชาวบุรีรัมย์รวมตัวประกาศชัย! หลังแก้ปัญหาน้ำท่วมซ้ำซากเขตแคนดงได้,นายพิจิตร​ ศักดิ์ศรี​ท้าว นายกเทศบาลแคนดง อ.แคนดง จ.บุรีรัมย์ นำเจ้าหน้าที่ปกครอง เจ้าหน้าที่ป้องกันและบรรเทาสาธารณภัยเทศบาลแคนดง หน่วยกู้ภัยสว่างจรรยาธรรม กว่า 100 คน ไปรวมตัวกันที่บริเวณสปริงเวย์ ของอ่างเก็บน้ำแคนดง,https://mgronline.com/uptodate/detail/9640000108530,2021_11_02
ประกาศปิดอุทยานแห่งชาติ - วนอุทยานชั่วคราว จากสถานการณ์โควิด,ส่วนจัดการท่องเที่ยวและนันทนาการ สำนักอุทยานแห่งชาติ เปิดเผยวันนี้ (2 พ.ย.) ว่า กรมอุทยานแห่งชาติ สัตว์ป่า และพันธุ์พืช ประกาศปิดการท่องเที่ยว ในเขตอุทยานแห่งชาติ และวนอุทยานประจำปี เป็นการชั่วคราว เนื่องจากสถานการณ์โควิด-19 โดยอุ,https://mgronline.com/uptodate/detail/9640000108526,2021_11_02
"หุ้นไทยปิดตลาดเช้านี้ +6.98 จุด มูลค่าซื้อขายรวม 45,260 ล.","การซื้อขายหลักทรัพย์ในตลาดหุ้นไทยวันนี้ (02 พ.ย.) ดัชนี SET Index ปิดตลาดภาคเช้าปรับขึ้น 6.98 จุด หรือคิดเป็น ร้อยละ 0.43 อยู่ที่ระดับ 1,620.76 จุด โดยมีมูลค่าการซื้อขายรวมทั้งสิ้น 45,260 ล้านบาท",https://mgronline.com/uptodate/detail/9640000108537,2021_11_02
ทล.แจ้งทางหลวงถูกน้ำท่วม-สะพานชำรุด จราจรผ่านไม่ได้ 2 แห่ง ในกรุงเก่า,ฝ่ายประชาสัมพันธ์ กรมทางหลวง (ทล.) แจ้งว่า เมื่อเวลา 12.30 น. วันนี้ (2 พ.ย.64) พบทางหลวงถูกน้ำท่วม/ดินสไลด์ และสะพานชำรุด จำนวน 1 จังหวัด คือ จ.พระนครศรีอยุธยา 1 สายทาง 2 แห่ง การจราจรผ่านไม่ได้ 2 แห่ง ดังนี้ 1.ทล.3412 จ.พระนครศ,https://mgronline.com/uptodate/detail/9640000108541,2021_11_02
เรือบรรทุกตู้คอนเทนเนอร์ชนกัน! กลางแม่น้ำเจ้าพระยา โชคดีไม่มีเจ็บ-ตาย,เกิดอุบัติเหตุเรือบรรทุกตู้คอนเทนเนอร์ 2 ลำ ชนกันกลางแม่น้ำเจ้าพระยา ช่วงบริเวณหน้าศาลากลางจังหวัดสมุทรปราการ แตไม่มีลูกเรือได้รับบาดเจ็บหรือเสียชีวิต โดยเจ้าหน้าที่หลายฝ่าย ทั้งตำรวจน้ำ และเจ้าท่าสมุทรปราการ เร่งเข้าตรวจสอบ และเช,https://mgronline.com/uptodate/detail/9640000108538,2021_11_02
