title,summary,link,published
"โควิด-19 ในไทยวันนี้ ติดเชื้อเพิ่ม 9,742 ราย หายป่วย 10,182 ราย เสียชีวิต 74 คน","ศูนย์ข้อมูล COVID-19 รายงานสถานการณ์โควิด-19 ในประเทศไทย (ตั้งแต่ 1 เมษายน 2564) ประจำวันที่ 23 ตุลาคม 2564 มีจำนวนผู้ติดเชื้อเพิ่มขึ้น 9,742 ราย เพิ่มจำนวนผู้ป่วยยืนยันสะสมตั้งแต่ 1 เมษายน เป็น 1,812,526 ราย และจำนวนผู้ป่วยยืนยัน",https://mgronline.com/uptodate/detail/9640000104976,2021_10_23
สภาพอากาศวันนี้ เหนือ กลาง ตะวันออก ใต้และกทม.มีฝนฟ้าคะนอง ตกหนักบางแห่ง โดย กทม.มีฝนฟ้าคะนอง 40%,กรมอุตุนิยมวิทยารายงานสภาพอากาศวันนี้ (23 ต.ค. 64) บริเวณความกดอากาศสูงระลอกใหม่จากประเทศจีนได้แผ่ลงมาปกคลุมบริเวณภาคเหนือด้านตะวันออก ภาคตะวันออกเฉียงเหนือ ภาคกลางตอนบน และทะเลจีนใต้ตอนบนแล้ว ประกอบกับมีลมตะวันออกและลมตะวันออกเฉี,https://mgronline.com/uptodate/detail/9640000104978,2021_10_23
โควิด-19 สมุทรสาครเริ่มแผ่ว! ติดเชื้อรายใหม่ 87 ราย เสียชีวิต 2 คน ฉีดวัคซีนแล้วกว่า 1.27 ล้านโดส,"ศูนย์ COVID-19 สมุทรสาคร รายงานสถานการณ์โควิด-19 ในพื้นที่ จ.สมุทรสาคร (ข้อมูล ณ วันที่ 22 ตุลาคม 2564 เวลา 16.00 น.) พบผู้ติดเชื้อรายใหม่ 87 ราย เป็นคนในจังหวัด 66 ราย และนอกจังหวัด 21 ราย จำนวนผู้ป่วยยืนยันสะสมเพิ่มเป็น 92,239 ร",https://mgronline.com/uptodate/detail/9640000104980,2021_10_23
ทั่วโลกป่วยโควิด-19 เพิ่มกว่า 4 แสนราย เสียชีวิตเพิ่มกว่า 8 พันราย ยอดป่วยสะสม 243.7 ล้านราย,"เมื่อเวลา 09.00 น. (23 ต.ค. 64) ตามเวลาประเทศไทย Worldometer เว็บไซต์รายงานข้อมูลล่าสุดที่รวบรวมจากหน่วยงานด้านสาธารณสุขทั่วโลก รายงานตัวเลขผู้ป่วยโรคติดเชื้อไวรัสโคโรนา 2019 หรือ โควิด-19 ทั่วโลก อยู่ที่ 243,729,114 ราย เพิ่มขึ้น",https://mgronline.com/uptodate/detail/9640000104979,2021_10_23
"ราคาทองปรับขึ้น [+50] ทองแท่งขายออก 28,300 บาท","สมาคมค้าทองคำประกาศราคาทองประจำวันเสาร์ที่ 23 ตุลาคม 2564 (ครั้งที่ 1) เมื่อเวลา 09.33 น. ราคาทองปรับขึ้น 50 บาท ทองแท่ง รับซื้อบาทละ 28,200 บาท ขายออกบาทละ 28,300 บาท ส่วนทองรูปพรรณ รับซื้อบาทละ 27,697.32 บาท ขายออกบาทละ 28,800 บ",https://mgronline.com/uptodate/detail/9640000104981,2021_10_23
อุทกภัยทำน้ำท่วม/ทางขาด 40 สายทางใน 18 จังหวัด ปิดทางห้ามผ่าน 26 สายทาง,ฝ่ายประชาสัมพันธ์ กรมทางหลวงชนบท แจ้งว่า เมื่อเวลา 08.30 น. วันนี้ (23 ต.ค.64) สำนักบำรุงทางรายงานสถานการณ์อุทกภัยว่า มีถนนที่ประสบอุทกภัยในพื้นที่ 18 จังหวัด ได้แก่ พระนครศรีอยุธยา อ่างทอง ลพบุรี สิงห์บุรี ชัยภูมิ สุรินทร์ บุรีรั,https://mgronline.com/uptodate/detail/9640000104982,2021_10_23
"รัฐบาลปลื้มกระแสตอบรับ""คนละครึ่ง-ยิ่งใช้ยิ่งได้-กินช้อปใช้""ผ่านฟู้ดเดลิเวอรีดีเกินคาด",นายธนกร วังบุญคงชนะ โฆษกประจำสำนักนายกรัฐมนตรี เปิดเผยถึงความคืบหน้ามาตรการใช้จ่ายลดค่าครองชีพของรัฐ ได้แก่ โครงการคนละครึ่ง เฟส 3 เพิ่มกำลังซื้อในบัตรสวัสดิการแห่งรัฐ โครงการยิ่งใช้ยิ่งได้ และโครงการเพิ่มกำลังซื้อ ให้แก่ผู้ที่ต้อ,https://mgronline.com/uptodate/detail/9640000104989,2021_10_23
นายกฯ ขอสื่อสร้างความเข้าใจประกาศ 46 ประเทศเข้าไทยไม่ต้องกักตัว,พล.อ.ประยุทธ์ จันทร์โอชา นายกรัฐมนตรีและรัฐมนตรีว่าการกระทรวงกลาโหม กล่าวย้ำให้สื่อมวลชนสร้างความเข้าใจกับประชาชน หลังประกาศคำสั่งศูนย์บริหารสถานการณ์โควิด-19 หรือ ศบค. ประกาศเพิ่ม 10 ประเทศที่มีความเสี่ยงต่ำเป็น 46 ประเทศ และเขตป,https://mgronline.com/uptodate/detail/9640000104991,2021_10_23
"คลังเผยยอดใช้จ่าย""คนละครึ่ง เฟส 3""ทะลุ 1 แสนล้านบาท ยังเหลือกว่า 7 หมื่นสิทธิ","นายพรชัย ฐีระเวช ผู้อำนวยการสำนักงานเศรษฐกิจการคลัง ในฐานะโฆษกกระทรวงการคลัง เปิดเผยว่า จากข้อมูล ณ วันที่ 21 ตุลาคม 2564 โครงการคนละครึ่ง ระยะที่ 3 มีผู้ใช้สิทธิสะสมจำนวน 25.32 ล้านราย มียอดการใช้จ่ายสะสมรวม 105,444 ล้านบาท แบ่งเ",https://mgronline.com/uptodate/detail/9640000104995,2021_10_23
หน่วยงานรัฐ-พรรคการเมืองร่วมวางพวงมาลาวันปิยมหาราช,เนื่องในวันคล้ายวันสวรรคตของพระบาทสมเด็จพระจุลจอมเกล้าเจ้าอยู่หัว รัชกาลที่ 5 หรือวันปิยมหาราช ที่พระบรมราชานุสรณ์ พระลานพระราชวังดุสิต มีพิธีวางพวงมาลา เพื่อน้อมรำลึกในพระมหากรุณาธิคุณอันล้นพ้นต่อพสกนิกรชาวไทย โดยมีตัวแทนจากหลากห,https://mgronline.com/uptodate/detail/9640000104994,2021_10_23
'ดีอีเอส'เตือนข่าวปลอม! ปชช.อย่าหลงเชื่อ SMS คนละครึ่งเฟส 4,นายชัยวุฒิ ธนาคมานุสรณ์ รัฐมนตรีว่าการกระทรวงดิจิทัลเพื่อเศรษฐกิจและสังคม (ดีอีเอส) กล่าวถึงข่าวที่ให้ประชาชนลงทะเบียนโครงการคนละครึ่งเฟส 4 ผ่าน SMS ว่า ขอเตือนประชาชนว่า โครงการคนละครึ่งเฟส 4 ยังไม่มี ตอนนี้มีเพียงเฟส 3 เพิ่มวงเง,https://mgronline.com/uptodate/detail/9640000104993,2021_10_23
กทม.เร่งรณรงค์หญิงตั้งครรภ์ฉีดวัคซีนโควิด-19,"นายขจิต ชัชวานิชย์ ปลัดกรุงเทพมหานคร เปิดเผยว่า สถานการณ์โควิด-19 ทั่วโลกในปัจจุบันพบหญิงตั้งครรภ์ติดเชื้อโควิด-19 เพิ่มขึ้นร้อยละ 50-60 โดยทั้งประเทศข้อมูลตั้งแต่วันที่ 1 เมษายน - 16 ตุลาคม 2564 พบหญิงตั้งครรภ์ติดเชื้อ 4,778 คน ท",https://mgronline.com/uptodate/detail/9640000105002,2021_10_23
เมืองชลลุยตรวจคัดกรองโควิดเชิงรุก เตรียมพร้อมเปิดเมือง 1 พ.ย.นี้,นายภัครธรณ์ เทียนไชย ผู้ว่าราชการจังหวัดชลบุรี เปิดเผยว่า ขณะนี้ส่วนราชการและผู้ประกอบการในพื้นที่ต่างเตรียมความพร้อมในการเปิดประเทศ เพื่อรับนักท่องเที่ยวต่างชาติในวันที่ 1 พฤศจิกายนนี้ ซึ่งสถานประกอบการส่วนใหญ่ได้มีการตรวจหาเชื้อ,https://mgronline.com/uptodate/detail/9640000104997,2021_10_23
มาเลเซียเปิดเกาะลังกาวีรับนักท่องเที่ยวต่างชาติที่ฉีดวัคซีนครบโดสโดยไม่ต้องกักตัว,นายกรัฐมนตรีอิสมาอิล ซาบรี ยาคอบ ของมาเลเซีย เปิดเผยว่า เกาะลังกาวี ในรัฐเกดะห์ จะกลับมาเปิดรับนักท่องเที่ยวต่างชาติที่ได้รับการฉีดวัคซีนโควิด-19 ครบ และไม่ต้องกักตัว ภายใต้โครงการนำร่องที่ดำเนินการแบบ Bubble โดยนักท่องเที่ยวต่างช,https://mgronline.com/uptodate/detail/9640000105003,2021_10_23
บัวแก้วเร่งพีอาร์เตรียมพร้อมรับการเปิดประเทศ เดินทางจาก 46 ประเทศเข้าไทยไม่ต้องกักตัว,นายธานี แสงรัตน์ อธิบดีกรมสารนิเทศและโฆษกกระทรวงการต่างประเทศ ชี้แจงการเตรียมความพร้อมของสถานเอกอัครราชทูตและสถานกงสุลใหญ่ของไทยทั่วโลก เพื่อรองรับการเปิดประเทศตั้งแต่วันที่ 1 พฤศจิกายน 2564 ดังนี้1. ตั้งแต่ต้นปี 2563 สถานเอกอัครร,https://mgronline.com/uptodate/detail/9640000105005,2021_10_23
'ซิลลิค ฟาร์มา'ยืนยันส่งวัคซีน'โมเดอร์นา'ลอตแรก 5.6 แสนโดส ถึงไทยไม่เกิน 5 พ.ย.นี้,"บริษัท ซิลลิค ฟาร์มา จำกัด ออกแถลงการณ์ความคืบหน้าของการส่งมอบวัคซีนโควิด-19 โมเดอร์นาให้แก่ประเทศไทย โดยระบุเนื้อหาว่า""แซดพี เทอราพิวติกส์ หน่วยธุรกิจภายใต้ ซิลลิค ฟาร์มา พันธมิตรทางธุรกิจอย่างเป็นทางการของโมเดอร์นาในประเทศไทย ขอ",https://mgronline.com/uptodate/detail/9640000105010,2021_10_23
ภาพรวมสถานการณ์อุทกภัยเริ่มคลี่คลาย ยังเหลือสถานการณ์ใน 16 จังหวัด,กรมป้องกันและบรรเทาสาธารณภัย ในฐานะกองอำนวยการป้องกันและบรรเทาสาธารณภัยกลาง (กอปภ.ก.) รายงานว่า จากอิทธิพลความกดอากาศสูงจากประเทศจีนที่แผ่ลงมาปกคลุมบริเวณภาคเหนือตอนบน ภาคตะวันออกเฉียงเหนือตอนบน และทะเลจีนใต้ตอนบน ประกอบกับมีลมตะว,https://mgronline.com/uptodate/detail/9640000105016,2021_10_23
สงขลาอ่วม! ยอดโควิดทุบสถิติอีก ติดเชื้อเพิ่ม 695 ราย,"คณะกรรมการโรคติดต่อ จ.สงขลา รายงานสถานการณ์โควิด-19 ในพื้นที่ จ.สงขลา วันนี้ พบผู้ติดเชื้อรายใหม่ 695 ราย นับว่าเป็นยอดการติดเชื้อสูงที่สุดในรอบ 2 ปี ส่งผลให้ยอดป่วยยืนยันสะสมเพิ่มเป็น 42,392 ราย และเสียชีวิตสะสม 176 รายสำหรับผู้ต",https://mgronline.com/uptodate/detail/9640000105020,2021_10_23
รวงข้าวคาดเงินบาทสัปดาห์หน้าเคลื่อนไหวในกรอบ 32.80-33.80 บาท/ดอลลาร์,ธนาคารกสิกรไทย (KBANK) คาดการณ์กรอบการเคลื่อนไหวของค่าเงินบาทสำหรับสัปดาห์ถัดไป (25-29 ต.ค.) ที่ 32.80-33.80 บาทต่อดอลลาร์สหรัฐ ขณะที่ศูนย์วิจัยกสิกรไทยประเมินปัจจัยสำคัญที่ต้องติดตาม ได้แก่ ทิศทางเงินทุนของนักลงทุนต่างชาติ ตัวเลข,https://mgronline.com/uptodate/detail/9640000105017,2021_10_23
"""ลุงตู่""ห่วงนักลงทุนมือใหม่ลงทุนสินทรัพย์ดิจิทัล ชี้มีความผันผวนสูง",น.ส.รัชดา ธนาดิเรก รองโฆษกประจำสำนักนายกรัฐมนตรี เปิดเผยว่า พล.อ.ประยุทธ์ จันทร์โอชา นายกรัฐมนตรีและรัฐมนตรีว่าการกระทรวงกลาโหม มีความเป็นห่วงนักลงทุนในการลงทุนในสินทรัพย์ดิจิทัล โดยเฉพาะกลุ่มเยาวชน คนรุ่นใหม่วัยทำงาน หลังพบว่ามีก,https://mgronline.com/uptodate/detail/9640000105027,2021_10_23
จีนสั่งปิด รร.-ยกเลิกหลายร้อยเที่ยวบิน เร่งคุมการระบาดโควิด-19 ระลอกใหม่,ทางการจีนสั่งยกเลิกเที่ยวบินในประเทศหลายร้อยเที่ยว รวมทั้งสั่งปิดโรงเรียน และเร่งตรวจคัดกรองเชิงรุก ตรวจหาเชื้อโควิด-19 ให้แก่ประชาชนในหลายพื้นที่ เพื่อพยายามควบคุมการแพร่ระบาดของโรคโควิด-19 ระลอกใหม่ ซึ่งเชื่อมโยงกับกลุ่มนักท่องเ,https://mgronline.com/uptodate/detail/9640000105024,2021_10_23
ศรีลังกาประกาศฉีดวัคซีนบูสเตอร์โดสบุคลากรการแพทย์-อุตสาหกรรมท่องเที่ยว เริ่ม 1 พ.ย.นี้,รัฐบาลศรีลังกาประกาศว่า นับตั้งแต่วันที่ 1 พฤศจิกายนนี้ บุคลากรการแพทย์ เจ้าหน้าที่สาธารณสุขด่านหน้า และผู้ประกอบอาชีพในอุตสาหกรรมท่องเที่ยว จะเป็นบุคคลกลุ่มแรกในประเทศที่ได้รับวัคซีนเข็มที่ 3 เป็นของไฟเซอร์-ไบโอเอ็นเทค เพื่อกระตุ,https://mgronline.com/uptodate/detail/9640000105040,2021_10_23
ตร.PCT บุกจับเว็บพนันดังคาคอนโดฯ หรูกลางกรุง ตะลึง!เงินหมุนเวียน 50 ล./เดือน,พล.ต.อ.สุวัฒน์ แจ้งยอดสุข ผู้บัญชาการตำรวจแห่งชาติ สั่งการให้ พล.ต.อ.ดำรงศักดิ์ กิตติประภัสร์ รองผู้บัญชาการตำรวจแห่งชาติ ในฐานะผู้อำนวยการศูนย์ปราบปรามอาชญากรรมทางเทคโนโลยีสารสนเทศ สำนักงานตำรวจแห่งชาติ (ศปอส.ตร.) หรือศูนย์ PCT พ,https://mgronline.com/uptodate/detail/9640000105043,2021_10_23
"รัฐบาลย้ำ""ใบกระท่อม""ยังใช้ประกอบอาหารไม่ได้ ต้องรอ อย.ประกาศ",น.ส.ไตรศุลี ไตรสรณกุล รองโฆษกประจำสำนักนายกรัฐมนตรี กล่าวว่า จากที่มีการแก้ไข พ.ร.บ.ยาเสพติดให้โทษ (ฉบับที่ 8) และกระทรวงสาธารณสุขได้ออกประกาศถอดพืชกระท่อมออกจากบัญชียาเสพติดให้โทษประเภท 5 มีผลให้ตั้งแต่วันที่ 24 สิงหาคม 2564 เป็น,https://mgronline.com/uptodate/detail/9640000105058,2021_10_23
"'ภูเก็ตแซนด์บ็อกซ์'คึกคัก 113 วัน เงินสะพัดแล้วกว่า 3,100 ล.",นายธนกร วังบุญคงชนะ โฆษกประจำสำนักนายกรัฐมนตรี เปิดเผยว่า บรรยากาศการท่องเที่ยวในภูเก็ตกลับมาคึกคักมาก ตามโครงการภูเก็ตแซนด์บ็อกซ์ (Phuket Sandbox) โดยตั้งแต่ท่าอากาศยานนานาชาติภูเก็ต สังเกตได้ว่ามีจำนวนนักท่องเที่ยวทั้งชาวไทยและช,https://mgronline.com/uptodate/detail/9640000105065,2021_10_23
สถานการณ์โควิด-19 เชียงใหม่ยังหนัก! ติดเชื้อเพิ่ม 461 ราย เสียชีวิตเพิ่ม 2 คน,สำนักงานสาธารณสุขจังหวัดเชียงใหม่ รายงานสถานการณ์โควิด-19 ในพื้นที่ จ.เชียงใหม่ วันนี้ (23 ต.ค.64) พบผู้ติดเชื้อรายใหม่ 461 ราย แบ่งเป็น ผู้ติดเชื้อในพื้นที่ 456 ราย ติดเชื้อจากต่างจังหวัด 5 ราย และเสียชีวิตเพิ่ม 2 ราย ทำให้ยอดผู้,https://mgronline.com/uptodate/detail/9640000105066,2021_10_23
แผ่นดินไหว 2.3 ในเมียนมา ห่าง อ.ปางมะผ้า 82 กม.,กองเฝ้าระวังแผ่นดินไหว รายงานว่า เมื่อเวลา 14.13 น. (23 ต.ค.) ตามเวลาประเทศไทย เกิดแผ่นดินไหวที่ประเทศเมียนมา วัดแรงสั่นสะเทือนได้ 2.3 แมกนิจูด ตามมาตราริกเตอร์ ศูนย์กลางอยู่ลึกจากผิวดิน 3 กิโลเมตร ห่างไปทางทิศตะวันตกเฉียงเหนือของ,https://mgronline.com/uptodate/detail/9640000105072,2021_10_23
"สนทช.มอบหมายกรมชลฯ เร่งพร่องน้ำรับมือพายุ""หมาเหล่า""","นายฐนโรจน์ วรรัฐประเสริฐ รองโฆษกสำนักงานทรัพยากรน้ำแห่งชาติ (สทนช.) เปิดเผยว่า สถาบันสารสนเทศทรัพยากรน้ำ (สสน.) และกรมอุตุนิยมวิทยา รายงานว่า มีการก่อตัวของหย่อมความกดอากาศต่ำซึ่งอาจพัฒนาเป็นพายุลูกใหม่ ""หมาเหล่า"" ทำให้มีปริมาณฝนต",https://mgronline.com/uptodate/detail/9640000105085,2021_10_23
รพ.กระทุ่มแบนเปิดฉีดไฟเซอร์รอบใหม่ 26-27 ต.ค.นี้,โรงพยาบาลกระทุ่มแบน จะเปิดฉีดวัคซีนไฟเซอร์รอบใหม่ ในวันที่ 26-27 ตุลาคมนี้ ที่วัดดอนไก่ดี อ.กระทุ่มแบน จ.สมุทรสาคร เวลา 09.00-11.00 น. โดยผู้มีสิทธิที่จะได้รับการฉีด คือ 1. ผู้ที่ฉีดไฟเซอร์เข็มที่ 1 และยังไม่ได้รับเข็มที่ 2 และ 2.,https://mgronline.com/uptodate/detail/9640000105089,2021_10_23
