title,summary,link,published
กพท.ประกาศหลักเกณฑ์รับนโยบายเปิดประเทศ 1 พ.ย.นี้,นายสุทธิพงษ์ คงพูล ผู้อำนวยการสำนักงานการบินพลเรือนแห่งประเทศไทย (กพท.) เปิดเผยว่า เมื่อวันที่ 22 ตุลาคม ที่ผ่านมา ได้ลงนามในประกาศสำนักงานการบินพลเรือนแห่งประเทศไทย เรื่อง เงื่อนไขในการอนุญาตให้อากาศยานทำการบินเข้าออกประเทศไทย (ฉ,https://mgronline.com/uptodate/detail/9640000105092,2021_10_23
"ซูเปอร์โพลเผย ปชช.กังวลภัยทางไซเบอร์ แนะใช้""สังคมคุมสังคม""เสริมระบบลดปัญหา","นายนพดล กรรณิกา ผู้อำนวยการสำนักวิจัยซูเปอร์โพล (SUPER POLL) เสนอผลสำรวจภาคสนามแบบผสมผสาน เรื่อง ""ปัจจัยเสี่ยงต่ออันตรายทางไซเบอร์"" กรณีศึกษาประชาชนทุกสาขาอาชีพทั่วประเทศ จำนวน 1,017 ตัวอย่างที่น่าเป็นห่วง คือ ส่วนใหญ่ หรือร้อยละ",https://mgronline.com/uptodate/detail/9640000105099,2021_10_23
ยธ.เล็งเปิดให้ญาติเข้าเยี่ยมผู้ต้องขังตั้งแต่ พ.ย.นี้ เริ่มจากเรือนจำที่ฉีดวัคซีนครบ,นายสมศักดิ์ เทพสุทิน รัฐมนตรีว่าการกระทรวงยุติธรรม กล่าวว่า สถานการณ์โควิด-19 ในเรือนจำขณะนี้ถือว่ามีการควบคุมและจัดการได้ดี พบผู้ติดเชื้อน้อยลง มีอัตราการเสียชีวิตจากโควิด-19 ต่ำกว่าค่าเฉลี่ย แต่ยังให้กรมราชทัณฑ์สต็อกยาฟ้าทะลายโจ,https://mgronline.com/uptodate/detail/9640000105102,2021_10_23
"ในหลวง-พระราชินี ทรงวางพวงมาลาถวายบังคมพระบรมรูป ร.5 เนื่องในวัน""ปิยมหาราช""",วันที่ 23 ตุลาคม 2564 เวลา เวล 17.39 น. พระบาทสมเด็จพระเจ้าอยู่หัว และสมเด็จพระนางเจ้า ฯ พระบรมราชินี เสด็จพระราชดำเนินโดยรถยนต์พระที่นั่ง พร้อมด้วยสมเด็จพระเจ้าลูกเธอเจ้าฟ้าพัชรกิติยาภา นเรนทิราเทพยวดี กรมหลวงราชสาริณีสิริพัชร มห,https://mgronline.com/uptodate/detail/9640000105106,2021_10_23
สิงคโปร์ประกาศให้วัคซีนโควิด-19 ของซิโนแวคอยู่ในบัญชีวัคซีนหลักแห่งชาติ,กระทรวงสาธารณสุขของสิงคโปร์ (MOH) ประกาศในวันนี้ (23 ต.ค.) ว่า วัคซีนป้องกันโควิด-19 ของบริษัทซิโนแวค ไบโอเท็ค จากจีน จะรวมอยู่ในบัญชีรายชื่อวัคซีนในโครงการวัคซีนแห่งชาติของสิงคโปร์ ประเภท 3 โดสคณะกรรมการของกระทรวงสาธารณสุข มีความ,https://mgronline.com/uptodate/detail/9640000105109,2021_10_23
เชียงใหม่มีคำสั่งปิดสถานที่เสี่ยง-ขยายเวลาพื้นที่ตลาดนวรัฐ-ตลาดเมืองใหม่เป็นพื้นที่เฝ้าระวังสูง,นายประจญ ปรัชญ์สกุล ผู้ว่าราชการจังหวัดเชียงใหม่ ในฐานะประธานคณะกรรมการโรคติดต่อจังหวัดเชียงใหม่ ผู้กำกับการบริหารราชการในสถานการณ์ฉุกเฉินจังหวัดเชียงใหม่ ลงนามคำสั่งคณะกรรมการโรคติดต่อจังหวัดเชียงใหม่ จำนวน 4 ฉบับ เรื่อง ปิดสถานท,https://mgronline.com/uptodate/detail/9640000105110,2021_10_23
ตำรวจนครบาลเฝ้าระวังสถานการณ์การชุมนุมกลุ่มทะลุแก๊สที่แยกดินแดง,พล.ต.ต.จิรสันต์ แก้วแสงเอก รองผู้บัญชาการตำรวจนครบาล ในฐานะโฆษกกองบัญชาการตำรวจนครบาล กล่าวว่า วันนี้มีรายงานความเคลื่อนไหวการชุมนุมทางการเมือง 3 กลุ่ม ที่นัดรวมตัวชุมนุมตามสถานที่ต่างๆ ในพื้นที่กรุงเทพมหานคร โดยเบื้องต้นมีกลุ่มที,https://mgronline.com/uptodate/detail/9640000105112,2021_10_23
"ผอ.TDRI จี้รัฐทำวาทกรรม""ไม่ทิ้งใครไว้ข้างหลัง""ให้เป็นจริง ย้ำหมดเวลา""ตกหล่น""","ดร.สมชัย จิตสุชน ผู้อำนวยการวิจัยด้านการพัฒนาอย่างทั่วถึง สถาบันวิจัยเพื่อการพัฒนาประเทศไทย (ทีดีอาร์ไอ) โพสต์ข้อความผ่านเฟซบุ๊กส่วนตัว ""Somchai Jitsuchon"" ระบุว่า""เราจะสร้างอนาคตประเทศชาติได้อย่างไร หากเด็กและเยาวชนที่เป็นอนาคตข",https://mgronline.com/uptodate/detail/9640000105113,2021_10_23
'นนท์ ASEAN'จัดฉีดวัคซีนโควิดเข็ม 1 ให้แรงงานเมืองนนท์ 3 สัญชาติ ลงทะเบียนได้ถึง 26 ต.ค.,"สำนักงานสาธารณสุขจังหวัดนนทบุรี ประกาศว่า ""นนท์ ASEAN"" จัดฉีดวัคซีนโควิด-19 เข็มที่ 1 สำหรับชาวพม่า ลาว กัมพูชา ที่มีอายุตั้งแต่ 18 ปีขึ้น (เฉพาะผู้ที่ทำงานในจังหวัดนนทบุรีเท่านั้น) โดยวัคซีนที่จะฉีดในครั้งนี้เป็นสูตรซิโนแวค+แอสตร",https://mgronline.com/uptodate/detail/9640000105114,2021_10_23
โฆษก รบ.ย้ำการเปิดรับนักท่องเที่ยวแบบไม่กักตัว เน้นคนไทยปลอดภัย ต่างชาติมั่นใจ,นายธนกร วังบุญคงชนะ โฆษกประจำสำนักนายกรัฐมนตรี เปิดเผยถึงหลักเกณท์การเปิดรับผู้เดินทางเข้าประเทศไทยแบบไม่กักตัวและไม่จำกัดพื้นที่ ซึ่งจะเริ่มตั้งแต่วันที่ 1 พฤศจิกายน 2564 เป็นการทยอยเปิดตามห้วงเวลาที่ชัดเจน ด้วยกลยุทธ์การเปิดประเ,https://mgronline.com/uptodate/detail/9640000105118,2021_10_23
สมเด็จพระสังฆราชเสด็จเป็นองค์ประธานพิธีบำเพ็ญกุศลอุทิศถวายเนื่องในวันปิยมหาราช,วันที่ 23 ตุลาคม 2564 เวลา 09.30 น. ที่พระอุโบสถวัดราชบพิธสถิตมหาสีมาราม สมเด็จพระอริยวงศาคตญาณ สมเด็จพระสังฆราช สกลมหาสังฆปริณายก เสด็จเป็นองค์ประธานในการบำเพ็ญกุศลอุทิศถวาย เนื่องในวาระคล้ายวันสวรรคตแห่งพระบาทสมเด็จพระจุลจอมเกล้,https://mgronline.com/uptodate/detail/9640000105121,2021_10_23
แบงก์คืนเงินลูกค้าบัตรเครดิต/เดบิตถูกตัดเงินผิดปกติครบทุกรายแล้ว มูลค่าเสียหายรวม 131 ล.,"ธนาคารแห่งประเทศไทย (ธปท.) และสมาคมธนาคารไทย ได้ออกแถลงการณ์ร่วมรายงานความคืบหน้ากรณีการตัดเงินที่ผิดปกติผ่านบัตรเครดิตและบัตรเดบิต ว่า เมื่อวันที่ 22 ตุลาคม ที่ผ่านมา ธนาคารได้คืนเงินลูกค้าบัตรเครดิตและบัตรเดบิต 10,700 ใบ ครบทุกร",https://mgronline.com/uptodate/detail/9640000105128,2021_10_23
