title,summary,link,published
คาร์ โกชี้ตลาดรถมือสองช่วงเปิดปลายปีนี้ รุนแรงแน่ เป็นโอกาสทองผู้บริโภค,นายวุฒิ โอภาศเจริญสุข ประธานเจ้าหน้าที่ปฏิบัติการ บริษัท คาร์ โก (ประเทศไทย) จำกัด เปิดเผยถึงสถานการณ์ตลาดรถยนต์มือสอง ในช่วงไตรมาสสุดท้ายของปี 2564 หรือช่วงเปิดประเทศ ว่า ตลาดเข้าสู่ช่วงฤดูการซื้อขายและการแข่งขันที่รุนแรงแน่นอน ซ,https://mgronline.com/uptodate/detail/9640000109415,2021_11_04
ในหลวง โปรดเกล้าฯ ให้ผู้ว่าฯ ยะลานำสิ่งของพระราชทาน 2 นายตำรวจเหยื่อโจรใต้,วันที่ 4 พฤศจิกายน 2564 เวลา 13.30 น. พระบาทสมเด็จพระเจ้าอยู่หัว ทรงพระกรุณาโปรดเกล้าโปรดกระหม่อมให้ นายธีรุตม์ ศุภวิบูลย์ผล รองผู้ว่าราชการจังหวัดยะลา เชิญดอกไม้และตะกร้าสิ่งของพระราชทานของพระบาทสมเด็จพระเจ้าอยู่หัว และสมเด็จพระ,https://mgronline.com/uptodate/detail/9640000109450,2021_11_04
นายกฯ ย้ำ ครม.-พรรคร่วมรัฐบาลไม่มีนโยบายแก้ ม.112,น.ส.รัชดา ธนาดิเรก รองโฆษกประจำสำนักนายกรัฐมนตรี แถลงภายหลังการประชุมคณะรัฐมนตรี (ครม.) ว่า พล.อ.ประยุทธ์ จันทร์โอชา นายกรัฐมนตรีและรัฐมนตรีว่าการกระทรวงกลาโหม ได้ย้ำกับคณะรัฐมนตรีถึงจุดยืนเกี่ยวกับประมวลกฎหมายอาญา มาตรา 112 และฝา,https://mgronline.com/uptodate/detail/9640000109457,2021_11_04
"ครม.ชดเชยผู้รับผลกระทบด้านเสียงจากการก่อสร้างทางวิ่ง ทอ.สุวรรณภูมิ 6,254 ล.",น.ส.ไตรศุลี ไตรสรณกุล รองโฆษกประจำสำนักนายกรัฐมนตรี แถลงว่า ที่ประชุมคณะรัฐมนตรี (ครม.) เห็นชอบการปรับหลักเกณฑ์การชดเชยผู้ได้รับผลกระทบด้านเสียงจากการก่อสร้างทางวิ่งเส้นที่ 3 ท่าอากาศยานสุวรรณภูมิ จากเดิมที่ชดเชยเฉพาะอาคารที่ก่อสร,https://mgronline.com/uptodate/detail/9640000109470,2021_11_04
ปภ.เผย 13 จว.ประสบอุทกภัยจากอิทธิพลพายุเตี้ยนหมู่-ไลออนร็อก-คมปาซุ,กรมป้องกันและบรรเทาสาธารณภัย (ปภ.) รายงานอิทธิพลพายุเตี้ยนหมู่ พายุไลออนร็อก พายุคมปาซุ และร่องมรสุมพาดผ่านภาคตะวันออกและภาคใต้ ตั้งแต่วันที่ 23 กันยายน ถึงวันที่ 4 พฤศจิกายน ที่ผ่านมา ทำให้เกิดน้ำท่วมฉับพลัน น้ำป่าไหลหลาก และน้ำล,https://mgronline.com/uptodate/detail/9640000109480,2021_11_04
ผู้ว่าฯ กระบี่เผยสถานการณ์โควิดดีขึ้น ปชช.พื้นที่รับวัคซีนเกือบ 70% แล้ว,นายพุฒิพงศ์ ศิริมาตย์ ผู้ว่าราชการจังหวัดกระบี่ เปิดเผยภาพรวมสถานการณ์โรคโควิด-19 ในพื้นที่วันนี้ (4 พ.ย.) ว่า มีแนวโน้มดีขึ้น โดยมีนักท่องเที่ยวชาวไทยเดินทางเข้ามาท่องเที่ยวจำนวนมากทั้งนี้ ทางจังหวัดมีมาตรการอย่างเข้มงวดในการดูแล,https://mgronline.com/uptodate/detail/9640000109483,2021_11_04
เวียดนามคาดเริ่มสร้างรถไฟความเร็วสูงเชื่อมเหนือ-ใต้ ปี 2571-2572,รัฐมนตรีกระทรวงคมนาคมเวียดนาม เปิดเผยถึงการก่อสร้างรถไฟความเร็วสูง เชื่อมระหว่างเหนือ-ใต้ ของเวียดนามนั้น คาดว่า จะเริ่มขึ้นในช่วงปี 2571-2572 โดยแผนการดังกล่าว อยู่ในแผนงานเครือข่ายเส้นทางรถไฟ ที่จะดำเนินการในช่วงปี 2564-2573ทั้ง,https://mgronline.com/uptodate/detail/9640000109497,2021_11_04
ครม.อนุมัติโครงการวิจัย-พัฒนาวัคซีนโควิด-19 ChulaCov19 mRNA,"ที่ประชุมคณะรัฐมนตรี (ครม.) วันนี้ (4 พ.ย.) อนุมัติโครงการวิจัยและพัฒนาวัคซีนโควิด19 ChulaCov19 mRNA เพื่อทำการทดสอบทางคลินิก ระยะที่ 3 และการผลิตเพื่อขึ้นทะเบียนวัคซีน เพื่อใช้ในภาวะฉุกเฉิน กรอบวงเงิน 2,316 ล้านบาท และเห็นชอบในหล",https://mgronline.com/uptodate/detail/9640000109504,2021_11_04
ชาวห้วยยูงร้อง ส.ป.ก.กระบี่เร่งจัดสรรที่ดินทำกินสวนปาล์ม,"วันนี้ (4 พ.ย.) ชาวตำบลห้วยยูง อ.เหนือคลอง จ.กระบี่ รวมตัวเรียกร้องให้สำนักงานการปฏิรูปที่ดินจังหวัดกระบี่ หรือ ส.ป.ก.กระบี่ เร่งจัดสรรที่ดินทำกินสวนปาล์มพื้นที่กว่า 3,000 ไร่ ที่ยึดคืนจากบริษัทเอกชน หลังตรวจสอบพบว่ามีการถือครองโด",https://mgronline.com/uptodate/detail/9640000109505,2021_11_04
ผู้ว่าฯ กทม.เผย นร.ชั้นมัธยมฯ จะเรียนในโรงเรียนอีกครั้ง หลังรับวัคซีนครบ 2 เข็ม,พล.ต.อ.อัศวิน ขวัญเมือง ผู้ว่าราชการกรุงเทพมหานคร เปิดเผยว่า เมื่อนักเรียนชั้น มัธยมฯ 1-6 ในโรงเรียนสังกัดกรุงเทพมหานครทั้ง 109 แห่ง ได้รับการฉีดวัคซีนครบ 2 เข็มแล้ว จะได้กลับมาเรียนในโรงเรียนอีกครั้ง วันที่ 15 พฤศจิกายนนี้ โดยทุก,https://mgronline.com/uptodate/detail/9640000109522,2021_11_04
เกาหลีใต้จัดตั้งคณะทำงานใหม่ด้านความมั่นคงทางเศรษฐกิจ,เจ้าหน้าที่กระทรวงการต่างประเทศเกาหลีใต้ เปิดเผยวันนี้ (4 พ.ย.) ว่า รัฐบาลจัดตั้งคณะทำงานขึ้นใหม่ 1 ชุด ของกระทรวงการต่างประเทศ เป็นคณะทำงานความมั่นคงทางเศรษฐกิจ เพื่อสนับสนุนการดำเนินการของรัฐบาล ในการสร้างความยืดหยุ่นของห่วงโซ่อ,https://mgronline.com/uptodate/detail/9640000109519,2021_11_04
รฟม.แจ้งปิดเบี่ยงจราจร-ปิดพื้นที่เวนคืนบน ถ.ติวานนท์ 20 พ.ย.นี้,การรถไฟฟ้าขนส่งมวลชนแห่งประเทศไทย (รฟม.) แจ้งวันนี้ (4 พ.ย.) ว่า บริษัท ซิโน-ไทย เอ็นจีเนียริ่ง แอนด์ คอนสตรัคชั่น จำกัด (มหาชน) ผู้รับจ้างก่อสร้างงานโยธา โครงการรถไฟฟ้าสายสีชมพู ช่วงแคราย - มีนบุรี มีความจำเป็นต้องปิดเบี่ยงจราจร,https://mgronline.com/uptodate/detail/9640000109535,2021_11_04
"คปภ.เผยครึ่งแรกปี 64 มีเบี้ยประกันภัยรับโดยตรง 424,673 ล.","นายสุทธิพล ทวีชัยการ เลขาธิการคณะกรรมการกำกับและส่งเสริมการประกอบธุรกิจประกันภัย หรือ คปภ. เปิดเผยว่า ช่วงครึ่งแรกปี 2564 มีเบี้ยประกันภัยรับโดยตรง 424,673 ล้านบาท แบ่งเป็นธุรกิจประกันชีวิต 294,666 ล้านบาท ธุรกิจประกันวินาศภัย 130",https://mgronline.com/uptodate/detail/9640000109543,2021_11_04
กปน.แจ้งน้ำประปาไหลอ่อนถึงไม่ไหลชั่วคราวคืนวันนี้ เหตุซ่อมท่อประธาน,การประปานครหลวง (กปน.) ประกาศแจ้งเตือนว่า คืนวันนี้ (4 พ.ย.) ตั้งแต่เวลา 22.00 น. ถึงเวลา 05.00 น.ของวันพรุ่งนี้ น้ำประปาไหลอ่อนถึงไม่ไหลชั่วคราว โดยการประปานครหลวง (กปน.) มีความจำเป็นต้องปิดประตูน้ำท่อประธานขนาดเส้นผ่านศูนย์กลาง,https://mgronline.com/uptodate/detail/9640000109548,2021_11_04
"""สุเทพ"" เตือนอย่าเพิ่งวิจารณ์คนเสนอแก้ ม.112 รอเห็นร่างก่อน",นายสุเทพ เทือกสุบรรณ ประธานมูลนิธิมวลมหาประชาชนเพื่อการปฏิรูประเทศไทย (มปท.) เปิดเผยผ่านเฟซบุ๊กส่วนตัว Suthep Thaugsuban (สุเทพ เทือกสุบรรณ) ว่า ตนไม่ได้มาชวนประชาชนให้ไปวิพากษ์วิจารณ์ว่าคนที่เสนอแก้ไขกฎหมายอาญามาตรา 112 เหมาะสมหร,https://mgronline.com/uptodate/detail/9640000109553,2021_11_04
"เยอรมนีพบผู้ป่วยโควิด-19 เพิ่มขึ้น 33,949 คน สูงสุดตั้งแต่เผชิญโควิด","สำนักข่าวต่างประเทศรายงานจากกรุงเบอร์ลิน ประเทศเยอรมนี ในวันนี้ (4 พ.ย.) ว่า กระทรวงสาธารณสุขของเยอรมนีรายงานสถิติผู้ป่วยโรคโควิด-19 เพิ่มขึ้น 33,949 คน เป็นสถิติรายวันสูงสุด นับตั้งแต่เผชิญกับการแพร่ระบาดของโรคด้านอัตราการรักษาตั",https://mgronline.com/uptodate/detail/9640000109556,2021_11_04
อินเดียฉลองเทศกาลทิวาลี ท่ามกลางวิกฤตโควิดที่เริ่มซาลง,สำนักข่าวเอพีรายงานจากกรุงนิวเดลี ประเทศอินเดีย ในวันนี้ (4 พ.ย.) ว่า ทิวาลี หรือทิปาวลี (Diwali) เป็นการฉลองเชิงสัญลักษณ์ ชัยชนะของความสว่างเหนือความมืดมน หรือความดีเหนือความชั่ว ซึ่งส่วนหนึ่งของกิจกรรมนั้น ประชาชนจะจุดเทียนตะเกี,https://mgronline.com/uptodate/detail/9640000109557,2021_11_04
19.00 น. ไม่พบกลุ่มฝนในกรุงเทพฯ อุณหภูมิวัดได้ 31 องศาฯ,ศูนย์ป้องกันน้ำท่วม กรุงเทพมหานคร รายงานว่า เวลา 19.00 น. วันนี้ (4 พ.ย.) ไม่พบกลุ่มฝนในพื้นที่กรุงเทพมหานคร โดยอุณหภูมิที่สำนักการระบายน้ำวัดได้ 31 องศาเซลเซียส และมีความชื้นสัมพัทธ์ ร้อยละ 68,https://mgronline.com/uptodate/detail/9640000109559,2021_11_04
ศิริราชเชิญผู้รับวัคซีนซิโนแวค 2 เข็มจาก รพ.ลงทะเบียนฉีดแอสตร้าฯ เข็ม 3,โรงพยาบาลศิริราช ขอให้ผู้ได้รับการฉีดวัคซีนโควิด-19 ของซิโนแวค จากโรงพยาบาลศิริราช ครบ 2 เข็ม ภายในเดือนกรกฎาคม ที่ผ่านมา เข้าจองวันและเวลาเพื่อเข้ารับการฉีดวัคซีนโควิด-19 ของแอสตราเซเนก้า เป็นวัคซีนบูสเตอร์โดส หรือเข็ม 3ทั้งนี้,https://mgronline.com/uptodate/detail/9640000109565,2021_11_04
