title,summary,link,published
ทล.เผยปี 65 เดินหน้าโครงการบูรณะโครงข่ายทางหลวงเชื่อมโยงระหว่างภาค,นายสราวุธ ทรงศิวิไล อธิบดีกรมทางหลวง (ทล.) เปิดเผยว่า นายศักดิ์สยาม ชิดชอบ รัฐมนตรีว่าการกระทรวงคมนาคม เป็นประธานเปิดสัมมนาและมอบนโยบายเรื่องแนวทางการปฏิบัติราชการของ ทล. ประจำปีงบประมาณ 2565 เมื่อวันที่ 26 ตุลาคม ที่ผ่านมา ทล.ได้,https://mgronline.com/uptodate/detail/9640000108550,2021_11_02
14.00 น. ฝนตกเล็กน้อยฝั่งธนฯ กทม. สูงสุดที่เขตทวีวัฒนา,ศูนย์ป้องกันน้ำท่วม กรุงเทพมหานคร รายงานว่า เวลา 14.00 น. วันนี้ (2 พ.ย.) กรุงเทพมหานคร มีฝนตกเล็กน้อยในเขตบางแค และหนองแขม โดยกลุ่มฝนเคลื่อนตัวไปทางทิศตะวันตก และมีแนวโน้มลดลง ซึ่งปริมาณฝนสูงสุดอยู่ที่เขตทวีวัฒนา 17.0 มิลลิเมตร,https://mgronline.com/uptodate/detail/9640000108553,2021_11_02
สรท.เตรียมเปิดตัวสมุดปกขาวเสนอแนวทางแก้ผลกระทบราคาน้ำมันแพง,นายชัยชาญ เจริญสุข ประธานสภาผู้ส่งสินค้าทางเรือแห่งประเทศไทย (สรท.) กล่าวว่า สถานการณ์ราคาน้ำมันที่ปรับตัวสูงขึ้นเวลานี้มีผลกระทบกับการผลิตสินค้า และหากยังคงอยู่ในระดับสูงจะมีผลกับต้นทุนการผลิตของผู้ประกอบการมากขึ้น อาจมีผลต่อราคา,https://mgronline.com/uptodate/detail/9640000108577,2021_11_02
ศปก.ศบค.ขอ 15 วันประเมินผลผ่อนคลายมาตรการ ก่อนพิจารณาคลายล็อกเพิ่ม,ศูนย์ปฏิบัติการศูนย์บริหารสถานการณ์โควิด-19 (ศปก.ศบค.) ระบุว่า จะใช้เวลา 15 วัน นับจากวันที่ 1 พฤศจิกายน 2564 เพื่อประเมินผลของการผ่อนคลายมาตรการสกัดการแพร่ระบาดโควิด-19 ครั้งล่าสุด และการเปิดประเทศรับนักท่องเที่ยวต่างชาติโดยไม่ต้,https://mgronline.com/uptodate/detail/9640000108581,2021_11_02
กบน.เห็นชอบกู้เงิน 2 หมื่้นล้าน ตรึงราคาดีเซลไม่เกิน 30 บาท,นายสมภพ พัฒนอริยางกูล โฆษกกระทรวงพลังงาน เปิดเผยว่า ที่ประชุมคณะกรรมการบริหารกองทุนน้ำมันเชื้อเพลิง (กบน.) ครั้งที่ 9/2564 วานนี้ (1 พ.ย.) มีมติเห็นชอบเนื้อหาและสาระสำคัญร่างหลักเกณฑ์การกู้ยืมเงินตามที่สำนักงานกองทุนน้ำมันเชื้อเพล,https://mgronline.com/uptodate/detail/9640000108599,2021_11_02
4 พ.ย.นี้ สร.ขสมก.นัดสหพันธ์แรงงานขนส่งระหว่างประเทศร้องนายกฯ ลดราคาน้ำมัน,นายบุญมา ป๋งมา ประธานสหภาพแรงงานรัฐวิสาหกิจองค์การขนส่งมวลชนกรุงเทพ (สร.ขสมก.) เปิดเผยว่า ในวันที่ 4 พฤศจิกายนนี้ เวลา 10.00 น. สหภาพฯ จะร่วมกับคณะกรรมการประสานงานสหพันธ์แรงงานขนส่งระหว่างประเทศแห่งประเทศไทย (ITF-THAI) ไปยื่นหนังส,https://mgronline.com/uptodate/detail/9640000108607,2021_11_02
ตำรวจเตรียมส่งสำนวนคดี'อดีต ผกก.โจ้'พร้อมพวกให้อัยการฟ้องเอาผิด 4 ข้อหาพรุ่งนี้,พล.ต.อ.สุชาติ ธีระสวัสดิ์ รองผู้บัญชาการตำรวจแห่งชาติ แถลงความคืบหน้าคดี พ.ต.อ.ธิติสรรค์ อุทธนผล (ผู้กำกับโจ้) อดีตผู้กำกับการสถานีตำรวจภูธรตำรวจนครสวรรค์ และพวกอดีตชุดปราบปรามยาเสพติด จ.นครสวรรค์ ก่อเหตุใช้ถุงดำคลุมศีรษะ นายจิระพ,https://mgronline.com/uptodate/detail/9640000108612,2021_11_02
ผู้ว่าฯ สุโขทัยแถลงข่าวจัดงานประเพณีลอยกระทง เผาเทียน เล่นไฟ วิถีใหม่ 18-20 พ.ย.นี้,นายวิรุฬ พรรณเทวี ผู้ว่าราชการจังหวัดสุโขทัย แถลงข่าวการจัดงานประเพณีลอยกระทง เผาเทียน เล่นไฟ วิถีใหม่ ประจำปี 2564 ซึ่งได้กำหนดจัดขึ้นระหว่างวันที่ 18-20 พฤศจิกายนนี้ บริเวณอุทยานประวัติศาสตร์สุโขทัย อำเภอเมือง จังหวัดสุโขทัย เพื,https://mgronline.com/uptodate/detail/9640000108618,2021_11_02
ปิดตลาดฯ หุ้นไทย +4.11 จุด มูลค่าซื้อขายกว่า 7.6 หมื่้นล้านบาท,"ตลาดหลักทรัพย์ฯ ปิดการซื้อขายวันนี้ ดัชนีหุ้นไทยปิดบวกเล็กน้อย ที่ระดับ 1,617.89 จุด เพิ่มขึ้น 4.11 จุด หรือ +0.25% ด้วยมูลค่าการซื้อขาย 76,695.01 ล้านบาท",https://mgronline.com/uptodate/detail/9640000108624,2021_11_02
"ราคาทองวันนี้ปรับเพิ่มสุทธิ 50 บาท ทองแท่งขายออก 28,250 บาท","สถานการณ์ราคาทองในประเทศวันนี้ มีการเปลี่ยนแปลง 3 ครั้ง เป็นการปรับขึ้นสุทธิ 50 บาท ทองแท่ง รับซื้อบาทละ 28,150 บาท ขายออกบาทละ 28,250 บาท ส่วนทองรูปพรรณ รับซื้อบาทละ 27,636.68 บาท ขายออกบาทละ 28,750 บาท",https://mgronline.com/uptodate/detail/9640000108621,2021_11_02
เวียดนามเล็งฉีดวัคซีนโควิด-19 เข็มแรกเด็กวัย 12-17 ปีในกรุงฮานอยไตรมาส 4 ปีนี้,"คณะกรรมการประชาชนประจำกรุงฮานอยของเวียดนาม เปิดเผยว่า ทางการกรุงฮานอยวางแผนฉีดวัคซีนโควิด-19 ให้เด็กกลุ่มวัย 12-17 ปี ในกรุงฮานอย ซึ่งมีอยู่ประมาณ 700,000-850,000 คน โดยคาดการณ์ว่าเด็กๆ กลุ่มวัยดังกล่าวจะได้รับการฉีดวัคซีนเข็มแรกภ",https://mgronline.com/uptodate/detail/9640000108649,2021_11_02
สรท.เผยส่งออกเดือน ก.ย.ขยายตัว 17.1% คาดทั้งปีขยายตัวไม่ต่ำกว่า 12%,"นายชัยชาญ เจริญสุข ประธานสภาผู้ส่งสินค้าทางเรือแห่งประเทศไทย (สรท.) เปิดเผยว่า การส่งออกของไทยเดือนกันยายน 2564 มีมูลค่า 23,036 ล้านดอลลาร์สหรัฐ ขยายตัวร้อยละ 17.1 เมื่อเทียบกับช่วงเวลาเดียวของปีก่อนหน้า ขณะที่การนำเข้า ขยายตัวร้",https://mgronline.com/uptodate/detail/9640000108645,2021_11_02
"""อนุทิน""จ่อชง ครม.ซื้อ""โมลนูพิราเวียร์""2 ล้านเม็ด รักษาผู้ป่วยโควิด-19",นายอนุทิน ชาญวีรกูล รองนายกรัฐมนตรีและรัฐมนตรีว่าการกระทรวงสาธารณสุข สรุปภาพรวมการเปิดประเทศวันที่ 1 พฤศจิกายน ทุกอย่างเป็นไปด้วยดี และได้กำชับอธิบดีกรมควบคุมโรคพิจารณาปรับลดขั้นตอนที่ไม่จำเป็น เพื่อเพิ่มความสะดวกในการเข้าประเทศ แ,https://mgronline.com/uptodate/detail/9640000108653,2021_11_02
ญี่ปุ่นวางแผนลดเวลากักตัวนักธุรกิจที่ฉีดวัคซีนโควิด-19 แล้ว,สื่อท้องถิ่นญี่ปุ่นรายงานว่า รัฐบาลญี่ปุ่นวางแผนลดระยะเวลากักตัวของนักเดินทางที่ฉีดวัคซีนโควิด-19 แล้ว และเดินทางเข้าประเทศด้วยวัตถุประสงค์ทางธุรกิจ จากเดิม 10 วัน เหลือเพียง 3 วันกฎระเบียบใหม่ดังกล่าว ซึ่งจะมีผลบังคับใช้ตั้งแต่วั,https://mgronline.com/uptodate/detail/9640000108656,2021_11_02
เชียงใหม่สั่งปิดตลาดนัดทั่ว อ.แม่อาย 14 วัน พร้อมสั่งปิด-ควบคุมการเข้าออก 2 หมู่บ้าน อ.ดอยเต่า,คณะกรรมการโรคติดต่อจังหวัดเชียงใหม่ มีมติให้ออกคำสั่งฯ ที่ 232/2564 เรื่อง ปิดสถานที่เสี่ยงเป็นการชั่วคราว โดยสั่งให้ ปิดตลาดนัดทุกแห่งในพื้นที่ อำเภอแม่อาย จังหวัดเชียงใหม่ เป็นระยะเวลา 14 วัน โดยให้มีผลตั้งแต่วันที่ 30 ตุลาคม ถึ,https://mgronline.com/uptodate/detail/9640000108662,2021_11_02
"สถานประกอบการใน กทม.ผ่านมาตรฐาน SHA แล้วกว่า 3,400 แห่ง",วันนี้ พล.ต.ท.โสภณ พิสุทธิวงษ์ รองผู้ว่าราชการกรุงเทพมหานคร เป็นประธานการประชุมศูนย์บริหารสถานการณ์การแพร่ระบาดของโรคติดเชื้อไวรัสโคโรนา 2019 (โควิด-19) กรุงเทพมหานคร หรือ ศบค.กทม. ครั้งที่ 56/2564 ณ ห้องรัตนโกสินทร์ ศาลาว่าการกรุ,https://mgronline.com/uptodate/detail/9640000108667,2021_11_02
คนดังดาหน้าสยบข่าวลือ ยันไม่ยุ่งการเมือง-ไม่เกี่ยวข้องพรรคไทยพัฒนา,ตามที่มีการเผยแพร่เอกสารการจัดตั้งพรรคไทยพัฒนาในสื่อโซเชียล โดยมีภาพเครื่องหมาย ชื่อย่อ นโยบายของพรรคบางส่วน รวมทั้งรายชื่อคณะกรรมการบริหารพรรค ซึ่งปรากฏชื่อบุคคลที่มีชื่อเสียงในสังคม ทั้งในแวดวงการเมือง นักธุรกิจ ศิลปิน ดำรงตำแหน,https://mgronline.com/uptodate/detail/9640000108677,2021_11_02
ปภ.เตือน 11 จังหวัดภาคใต้เฝ้าระวังอุทกภัย 3-6 พ.ย.นี้,กองอำนวยการป้องกันและบรรเทาสาธารณภัยกลาง (กอปภ.ก) ได้รับแจ้งจากกองอำนวยการน้ำแห่งชาติว่า จากการประเมินและวิเคราะห์สถานการณ์น้ำจากแผนที่ฝนคาดการณ์ (ONE MAP) ของกรมอุตุนิยมวิทยาและสถาบันสารสนเทศทรัพยากรน้ำ (องค์กรมหาชน) พบว่าในช่วงว,https://mgronline.com/uptodate/detail/9640000108683,2021_11_02
"กรมคุกเผยเหลือผู้ต้องขังป่วยโควิด 2,939 ราย ฉีดวัคซีนผู้ต้องขังแล้ว 380,665 โดส",นายอายุตม์ สินธพพันธุ์ อธิบดีกรมราชทัณฑ์ เปิดเผยถึงสถานการณ์โควิด-19 ในเรือนจำและทัณฑสถาน (ข้อมูล ณ วันที่ 1 พฤศจิกายน 2564 เวลา 16.00 น.) พบผู้ติดเชื้อรายใหม่ 515 ราย (พบในเรือนจำสีแดง 461 ราย และในห้องแยกกักโรคผู้ต้องขังรับใหม่,https://mgronline.com/uptodate/detail/9640000108690,2021_11_02
ในหลวง-พระราชินีโปรดเกล้าฯ ผวจ.ยะลานำสิ่งของพระราชทานมอบแก่ ตร.ยะลา บาดเจ็บจากเหตุลอบวางระเบิด,วันที่ 2 พฤศจิกายน 2564 พระบาทสมเด็จพระเจ้าอยู่หัว ทรงพระกรุณาโปรดเกล้าฯ ให้ นายภิรมย์ นิลทยา ผู้ว่าราชการจังหวัดยะลา เชิญดอกไม้และตะกร้าสิ่งของพระราชทานของพระบาทสมเด็จพระเจ้าอยู่หัว และสมเด็จพระนางเจ้า ฯ พระบรมราชินี ไปมอบแก่ ดาบ,https://mgronline.com/uptodate/detail/9640000108693,2021_11_02
รัฐบาลแจง ศบค.ปรับสูตรฉีดไฟเซอร์ 2 เข็ม สกัดโควิด 4 จังหวัดภาคใต้,น.ส.รัชดา ธนาดิเรก รองโฆษกประจำสำนักนายกรัฐมนตรี เปิดเผยว่า พล.อ.ประยุทธ์ จันทร์โอชา นายกรัฐมนตรีและรัฐมนตรีว่าการกระทรวงกลาโหม ติดตามการแก้ไขปัญหาการแพร่ระบาดโควิด-19 ในพื้นที่ 4 จังหวัดภาคใต้ด้วยความห่วงใยอย่างต่อเนื่อง โดยที่ปร,https://mgronline.com/uptodate/detail/9640000108704,2021_11_02
พาณิชย์เดินหน้าปรับปรุง กม.ลิขสิทธิ์ มุ่งแก้ปัญหาละเมิดลิขสิทธิ์บนสื่อออนไลน์,นายสินิตย์ เลิศไกร รัฐมนตรีช่วยว่าการกระทรวงพาณิชย์ เปิดเผยว่า กระทรวงพาณิชย์เดินหน้าผลักดันการปรับปรุงกฎหมายลิขสิทธิ์ เพื่อระงับการละเมิดลิขสิทธิ์บนอินเทอร์เน็ตอย่างทันท่วงที ตอบโจทย์การค้าในยุคดิจิทัล ซึ่งในปัจจุบันกฎหมายลิขสิทธ,https://mgronline.com/uptodate/detail/9640000108708,2021_11_02
