title,summary,link,published
สธ.อนุญาตให้ชุดตรวจโควิด-19 แบบ ATK Self Test จำหน่ายทั่วไปแล้ว,นพ.ไพศาล ดั่นคุ้ม เลขาธิการคณะกรรมการอาหารและยา (อย.) ระบุว่า กระทรวงสาธารณสุข อนุญาตให้ชุดตรวจโควิด-19 แบบตรวจหาแอนติเจนด้วยตนเอง หรือ ATK Self Test จำหน่ายได้ทั่วไปตามร้านค้าและช่องทางออนไลน์แล้ว โดยมีผลบังคับใช้ตั้งแต่เมื่อวานน,https://mgronline.com/uptodate/detail/9640000096823,30_09_2021
เวียดนามเผย GDP ไตรมาส 3 ปีนี้ ลดลง 6.17% รุนแรงสุดของไตรมาสนี้,สำนักงานสถิติเวียดนาม เปิดเผยว่า ผลิตภัณฑ์มวลรวมในประเทศ หรือ จีดีพี ในไตรมาสที่ 3 ปี 2564 ของเวียดนาม ปรับลดลงร้อยละ 6.17 เมื่อเทียบรายปี นับเป็นการปรับลดลงรุนแรงที่สุดของไตรมาส 3 เนื่องจากได้รับผลกระทบหนักจากการระบาดของเชื้อไวรั,https://mgronline.com/uptodate/detail/9640000096813,30_09_2021
BOJ คงมาตรการกระตุ้นเศรษฐกิจ-นโยบายการเงิน ไม่ปรับตามรัฐ,นายฮารุฮิโกะ คุโรดะ ผู้ว่าการธนาคารกลางญี่ปุ่น หรือ บีโอเจ เปิดเผยวันนี้ (30 ก.ย.) ว่า เศรษฐกิจญี่ปุ่นจะฟื้นตัวต่อเนื่อง และอาจแตะระดับก่อนเกิดการระบาดของเชื้อไวรัสโควิด-19 ภายในสิ้นปี 2564 หรือต้นปี 2565 ขณะเดียวกัน บีโอเจจะรักษา,https://mgronline.com/uptodate/detail/9640000096809,30_09_2021
"หุ้นไทยเปิดตลาด -2.03 จุด มูลค่าซื้อขายรวม 21,172.11 ล.","การซื้อขายหุ้นไทยวันนี้ (30 ก.ย.) เปิดตลาดดัชนี Set Index ปรับลดลง 2.03 จุด หรือคิดเป็นร้อยละ 0.13% อยู่ที่ระดับ 1,614.95 จุด โดยมีมูลค่าการซื้อขายรวมทั้งสิ้น 21,172.11 ล้านบาท",https://mgronline.com/uptodate/detail/9640000096797,30_09_2021
"ราคาทองเปิดตลาดลดลง 50 บ. ทองรูปพรรณขายออก 28,350 บ.","สมาคมค้าทองคำ ประกาศราคาทองประจำวันที่ 30 กันยายน 2564 เวลา 09:26 น. (ครั้งที่ 1) ราคามีการปรับลดลง 50 บาท โดยทองคำแท่ง 96.5%	ขายออก	27,850 บาท รับซื้อ 27,750 บาท ส่วนทองรูปพรรณ 96.5% ขายออก 28,350 บาท รับซื้อ (ฐานภาษี) 27,257.68",https://mgronline.com/uptodate/detail/9640000096796,30_09_2021
"สุพรรณฯ ประกาศ 10 อำเภอเป็นเขตภัยพิบัติแล้ว ""อำเภอเมือง-สองพี่น้อง-บางปลาม้า"" หนักสุด",นายเอกภพ จันทร์เพ็ญ หัวหน้าสำนักงานป้องกันและบรรเทาสาธารณภัยจังหวัดสุพรรณบุรี (ปภ.) เปิดเผยถึงสถานการณ์น้ำท่วมในพื้นที่วันนี้ (30 ก.ย.) ว่า ทางจังหวัดประกาศให้ทั้ง 10 อำเภอ ของจังหวัดเป็นเขตภัยพิบัติแล้ว โดยเบื้องต้นมีประชาชนได้รั,https://mgronline.com/uptodate/detail/9640000096788,30_09_2021
ปภ.เผยอุทกภัย 18 จว.ยังไม่คลี่คลาย พร้อมเร่งให้ความช่วยเหลือแล้ว,"กรมป้องกันและบรรเทาสาธารณภัย (ปภ.) รายงานสถานการณ์อุทกภัยจากอิทธิพลพายุเตี้ยนหมู่ ว่า เกิดอุทกภัยใน 31 จังหวัด รวม 190 อำเภอ 956 ตำบล 6,335 หมู่บ้าน 1 เขตเทศบาล ประชาชนได้รับผลกระทบ 227,470 ครัวเรือน มีผู้เสียชีวิต 7 ราย สูญหาย 1",https://mgronline.com/uptodate/detail/9640000096781,30_09_2021
ปภ.สิงห์บุรีสั่งทุกภาคส่วนจับตามวลน้ำเจ้าพระยา พร้อมเตรียมอพยพ ปชช.,"นางสาวนงเยาว์ เทพศิริ หัวหน้าสำนักงานป้องกันและบรรเทาสาธารณภัยจังหวัดสิงห์บุรี (ปภ.) เปิดเผยสถานการณ์อุทกภัยในพื้นที่ วันนี้ (30 ก.ย.) ว่า มีน้ำไหลทะลักเข้าท่วมบ้านเรือนประชาชน แล้วประมาณ 4,419 หลังคาเรือน ในพื้นที่  4 อำเภอ 14 ตำ",https://mgronline.com/uptodate/detail/9640000096777,30_09_2021
"สหรัฐฯ เผยผลทดลอง""โมลนูพิราเวียร์""ต้านไวรัสโควิดเดลต้าได้",เมอร์ค (Merck) บริษัทยาชั้นนำของสหรัฐฯ เปิดเผยถึงผลการศึกษาจากห้องปฏิบัติการพบว่า การทดลองโมลนูพิราเวียร์ ซึ่งเป็นยาต้านเชื้อไวรัสโควิด-19 ที่ออกฤทธิ์โดยการให้ทางปาก มีประสิทธิภาพในการต้านเชื้อไวรัสโคโรนาสายพันธุ์ต่างๆ ซึ่งรวมถึงส,https://mgronline.com/uptodate/detail/9640000096761,30_09_2021
กรุงเก่าเร่งสร้างคันกั้นแข่งกับระดับน้ำที่เพิ่มสูง จนล้นท่วมตลาดริมแม่น้ำป่าสักแล้วเช้านี้,สถานการณ์น้ำในพื้นที่ จ.พระนครศรีอยุธยา วันนี้ (30 ก.ย.) ระดับน้ำในแม่น้ำเจ้าพระยา เพิ่มสูงขึ้นอีกว่า 50 เซนติเมตร จนทะลักเข้าคลองเมืองเอ่อล้นท่วมวัดศาลาปูนวรวิหาร และวัดพรหมนิวาศ ต.ท่าวาสุกรี แล้ว โดยมีระดับน้ำสูงกว่า 30 เซนติเมต,https://mgronline.com/uptodate/detail/9640000096759,30_09_2021
ข่าวปลอม! จ้างเด็กอายุต่ำกว่า 15 ปี ทำงาน ยังผิดกฎหมาย,กรมสวัสดิการและคุ้มครองแรงงาน แจ้งเตือนถึงกรณีข่าวที่มีการแก้ไขกฎหมายให้จ้างเด็กอายุต่ำกว่า 15 ปี ทำงานได้นั้น ว่า ไม่เป็นความจริง ยังไม่มีการแก้ไขกฎหมายดังกล่าว หากผู้ประกอบการใดฝ่าฝืนจ้างเด็กอายุต่ำกว่า 15 ปี ทำงานจะมีโทษหนัก จำ,https://mgronline.com/uptodate/detail/9640000096834,30_09_2021
จีนย้ำสาธารณสุขทั่วประเทศอย่าการ์ดตกป้องกันโควิด-19,โฆษกคณะกรรมาธิการสาธารณสุขแห่งชาติของจีน เน้นย้ำกับหน่วยงานสาธารณสุขทั่วประเทศ ว่า อย่าการ์ดตกในการป้องกัน และควบคุมการระบาดของเชื้อไวรัสโควิด-19 ในช่วงวันหยุดยาว 7 วัน เนื่องในวันชาติจีน ซึ่งจะเริ่มขึ้นในวันที่ 1 ตุลาคมนี้ นอกจาก,https://mgronline.com/uptodate/detail/9640000096842,30_09_2021
"""ประวิตร"" ห่วงภาวะโลกร้อน ขอทุกภาคส่วนร่วมรณรงค์ลดก๊าซเรือนกระจก",พล.ต.พัชร์ชศักดิ์ ปฏิรูปานนท์ ผู้ช่วยโฆษกประจำรองนายกรัฐมนตรี เปิดเผยว่า วันนี้ (30 ก.ย.) ว่า พล.อ.ประวิตร วงษ์สุวรรณ รองนยกรัฐมนตรี เป็นประธานการประชุมคณะกรรมการนโยบายการเปลี่ยนแปลงสภาพภูมิอากาศแห่งชาติ ครั้งที่ 4/2564 โดยมี นายว,https://mgronline.com/uptodate/detail/9640000096853,30_09_2021
เทศบาลโคราชปักธงเหลืองเตือน หลังระดับน้ำลำตะคองสูงกว่า 4 เมตรแล้ว,สถานการณ์น้ำที่จังหวัดนครราชสีมา วันนี้ (30 ก.ย.) น้ำลำตะคองเอ่อล้นตลิ่งเข้าท่วมบ้านเรือนประชาชนในชุมชนมิตรภาพซอย 4 ต.ในเมือง อ.เมือง และชุมชนใกล้เคียง มีบ้านเรือนถูกน้ำท่วมกว่า 200 หลังคาเรือน และชุมชนที่อยู่ด้านในได้รับความเดือด,https://mgronline.com/uptodate/detail/9640000096859,30_09_2021
ทีมกู้ภัยเร่งค้นหาเรือ CPI 77 พร้อมคนขับ-ภรรยาอีกครั้ง หลังเรือล่มกลางแม่น้ำป่าสัก,ทีมหน่วยกู้ภัยอยุธยารวมใจ และทีมเรือ ของบริษัท บริษัท Cpi ทรานสปอร์ต กรุงเทพฯ เริ่มระดมค้นหาเรือ CPI 77 พร้อมคนขับเรือและภรรยาอีกครั้งในวันนี้ (30 ก.ย.) หลังประสบเหตุเรือลากจูงล่มกลางแม่น้ำป่าสัก รอยต่อแม่น้ำเจ้าพระยา และสูญหายไป,https://mgronline.com/uptodate/detail/9640000096863,30_09_2021
ทช.แจ้งเลี่ยง  31 สายทางใน 16 จังหวัดที่ประสบอุทกภัย,กรมทางหลวงชนบท (ทช.) รายงานว่า มีถนนทางหลวงชนบท ประสบอุทกภัยในพื้นที่ 16 จังหวัด ได้แก่ ชัยนาท ลพบุรี สิงห์บุรี ระยอง พิจิตร นครราชสีมา บุรีรัมย์ ชัยภูมิ ขอนแก่น เลย อำนาจเจริญ นครสวรรค์ กำแพงเพชร สุโขทัย สระแก้ว และหนองบัวลำภู รว,https://mgronline.com/uptodate/detail/9640000096865,30_09_2021
"หุ้นไทยปิดตลาดเช้านี้ -3.64 จุด มูลค่าซื้อ-ขายรวม 46,087.97 ล.","การซื้อขายหุ้นไทยวันนี้ (30 ก.ย.) ปิดตลาดภาคเช้า ดัชนี Set Index ลดลง 3.64 จุด หรือคิดเป็นร้อยละ 0.23 อยู่ที่ระดับ 1,613.34 จุด โดยมีมูลค่าการซื้อ-ขายรวมทั้งสิ้น 46,087.97 ล้านบาท",https://mgronline.com/uptodate/detail/9640000096868,30_09_2021
ยะลาพบผู้ติดเชื้อโควิดรายใหม่ 566 ราย เสียชีวิตเพิ่ม 4 คน,"สำนักงานสาธารณสุขจังหวัดยะลา รายงานสถานการณ์โรคโควิด-19 ในพื้นที่วันนี้ (30 ก.ย.) ว่า รอบ 24 ชั่วโมง ที่่ผ่านมา พบผู้ป่วยติดเชื้อรายใหม่ 566 ราย ทำให้มีผู้ติดเชื้อสะสมระลอกเดือนเมษายนที่ผ่านมา มีทั้งสิ้น 22,793 ราย รักษาหายเพิ่ม 4",https://mgronline.com/uptodate/detail/9640000096878,30_09_2021
ลาวเริ่มก่อสร้างวิทยาลัยอาชีวะการรถไฟในเวียงจันทน์,กรมอาชีวะและเทคนิค กระทรวงศึกษาธิการและกีฬา สาธารณรัฐประชาธิปไตยประชาชนลาว เปิดเผยวันนี้ (30 ก.ย.) ว่า ได้เริ่มก่อสร้างวิทยาลัยอาชีวะการรถไฟในนครหลวงเวียงจันทน์แล้ว เพื่อฝึกอบรมผู้ที่ทำงานด้านการรถไฟใน สปป ลาว และรถไฟที่เชื่อมระหว,https://mgronline.com/uptodate/detail/9640000096882,30_09_2021
"ราคาทองครั้งที่ 2 ลดลง 50 บ. ทองรูปพรรณขาย 28,300 บ.","สมาคมค้าทองคำ ประกาศราคาทองประจำวันที่ 30 กันยายน 2564 ครั้งที่ 2 เวลา 13:41 น. ราคาทองปรับลดลง 50 บาท โดยทองคำแท่ง 96.5% ขายออก 27,800 บาท รับซื้อ 27,700 บาท ส่วนทองรูปพรรณ 96.5% ขายออก 28,300 บาท รับซื้อ (ฐานภาษี) 27,197.04 บาท",https://mgronline.com/uptodate/detail/9640000096884,30_09_2021
กทม.เตือน 11 ชุมชนนอกคันป้องกันริมน้ำเจ้าพระยาเฝ้าระวังน้ำท่วม,พล.ต.อ.อัศวิน ขวัญเมือง ผู้ว่าราชการกรุงเทพมหานคร (กทม.) เปิดเผยว่า วันที่ 28 กันยายน ถึงวันที่ 2 ตุลาคมนี้ กรมอุตุนิยมวิทยา คาดการณ์ว่าร่องมรสุมพาดผ่านภาคกลางตอนล่างและภาคใต้ตอนบนจะทำให้มีฝนตกหนัก และคาดว่าจะมีน้ำหลากจากพื้นที่ตอ,https://mgronline.com/uptodate/detail/9640000096899,30_09_2021
ศบศ.ไฟเขียวหนุนจ้างงานในธุรกิจ SMEs - เปิดประเทศด้านการท่องเที่ยว,นายธนกร วังบุญคงชนะ โฆษกประจำสำนักนายกรัฐมนตรี เปิดเผยว่า ที่ประชุมคณะกรรมการบริหารสถานการณ์เศรษฐกิจจากผลกระทบจากการระบาดของโรคติดเชื้อไวรัสโคโรนา 2019 (ศบศ.) ครั้งที่ 4 มีมติเห็นชอบหลักการโครงการส่งเสริมและรักษาระดับการจ้างงานในธ,https://mgronline.com/uptodate/detail/9640000096903,30_09_2021
ราชกิจจาฯ เผยแพร่กฎกระทรวงการคลัง ขึ้นภาษีบุหรี่ มีผล 1 ต.ค.,ราชกิจจานุเบกษาเผยแพร่กฎกระทรวงการคลัง กำหนดพิกัดอัตราภาษีสรรพสามิต (ฉบับที่ 17) พ.ศ. 2564 มีสาระสำคัญเรื่องการปรับโครงสร้างภาษีบุหรี่ใหม่ โดยให้มีผลตั้งแต่วันที่ 1 ตุลาคมนี้ เป็นต้นไปสำหรับโครงสร้างภาษีบุหรี่ใหม่ กำหนดให้ผู้ผลิตแ,https://mgronline.com/uptodate/detail/9640000096928,30_09_2021
นายกฯ อวยพร ขรก.เกษียณ ใช้ชีวิตกับครอบครัวอย่างมีสุข เก็บความภาคภูมิใจที่ทำงานเพื่อชาติ-ปชช.ติดตัวตลอดไป,นายธนกร วังบุญคงชนะ โฆษกประจำสำนักนายกรัฐมนตรี เปิดเผยว่า พล.อ.ประยุทธ์ จันทร์โอชา นายกรัฐมนตรีและรัฐมนตรีว่าการกระทรวงกลาโหม ฝากอวยพรถึงข้าราชการที่ครบวาระเกษียณอายุราชการทุกคน ซึ่งวันนี้ (30 กันยายน) จะเป็นการทำงานวันสุดท้าย และ,https://mgronline.com/uptodate/detail/9640000096922,30_09_2021
เกาหลีใต้ตั้งเป้าผลิตวัคซีน mRNA ให้ได้ภายในปี 2566,เจ้าหน้าที่รัฐบาลเกาหลีใต้ เปิดเผยว่า เกาหลีใต้มีความมุ่งหมายที่จะพัฒนาวัคซีนโควิด-19 แบบ mRNA ภายในประเทศให้ได้อย่างน้อย 1 ตัว ภายในปี 2566ความมุ่งหมายดังกล่าวเป็นส่วนหนึ่งของแผนการที่จะทำให้เกาหลีใต้เป็นศูนย์กลางการผลิตวัคซีนโคว,https://mgronline.com/uptodate/detail/9640000096934,30_09_2021
โควิด-19 ที่ยะลายังแรง ติดเชื้อเพิ่ม 566 ราย เสียชีวิต 4 คน,"สำนักงานสาธารณสุขจังหวัดยะลา รายงานสถานการณ์โควิด-19 ในพื้นที่ จ.ยะลา วันนี้ พบผู้ป่วยรายใหม่ 566 ราย รักษาหายเพิ่ม 408 ราย และเสียชีวิตเพิ่ม 4 ราย ทำให้จำนวนผู้ติดเชื้อสะสมตั้งแต่เดือนเมษายน ที่ผ่านมา รวมทั้งสิ้น 22,793 ราย รักษา",https://mgronline.com/uptodate/detail/9640000096939,30_09_2021
"คลังโอนเงิน""คนละครึ่ง เฟส 3""รอบ 2 พรุ่งนี้","กระทรวงการคลังจะโอนวงเงินสนับสนุนให้แก่ผู้ได้รับสิทธิโครงการคนละครึ่ง ระยะที่ 3 รอบที่ 2 เพิ่มเติม 1,500 บาท ในวันพรุ่งนี้ (1 ต.ค.64) โดยยอดจะไปรวมกับวงเงินสิทธิคงเหลือจากรอบแรกให้อัตโนมัติ หากประชาชนลงทะเบียนใหม่และได้รับสิทธิโคร",https://mgronline.com/uptodate/detail/9640000096936,30_09_2021
"ปภ.รายงานสถานการณ์อุทกภัยจากอิทธิพล""เตี้ยนหมู่""เหลือน้ำท่วมใน 18 จังหวัด",กรมป้องกันและบรรเทาสาธารณภัย  รายงานสถานการณ์อุทกภัยจากอิทธิพลพายุเตี้ยนหมู่ ตั้งแต่วันที่ 23 กันยายน ที่ผ่านมา จนถึงปัจจุบัน ส่งผลให้เกิดน้ำท่วมฉับพลัน น้ำป่าไหลหลาก ในพื้นที่ 31 จังหวัด ได้แก่ เชียงใหม่ ลำพูน ลำปาง ตาก สุโขทัย พ,https://mgronline.com/uptodate/detail/9640000096942,30_09_2021
กรมชลฯ ขานรับคำสั่งนายกฯ ระดมเครื่องสูบน้ำระบายน้ำท่วมเมืองชัยภูมิ,นายประพิศ จันทร์มา อธิบดีกรมชลประทาน เปิดเผยว่า ได้สั่งการให้สำนักงานชลประทานที่ 6 นำเครื่องสูบน้ำเข้าติดตั้งจุดต่างๆ ในจังหวัดชัยภูมิ ซึ่งเป็นบริเวณที่ร,https://mgronline.com/uptodate/detail/9640000096965,30_09_2021
ในหลวง-พระราชินี โปรดเกล้าฯ ให้องคมนตรีเชิญถุงพระราชทานมอบแก่ราษฎรผู้ประสบอุทกภัย จ.พระนครศรีอยุธยา,ด้วยพระบาทสมเด็จพระเจ้าอยู่หัว และสมเด็จพระนางเจ้า ฯ พระบรมราชินี  ทรงห่วงใยราษฎรที่ประสบอุทกภัยในพื้นที่จังหวัดพระนครศรีอยุธยา  ในการนี้ ทรงพระกรุณาโปรดเกล้าโปรดกระหม่อมให้องคมนตรี ร่วมกับมูลนิธิราชประชานุเคราะห์ ในพระบรมราชูปถัม,https://mgronline.com/uptodate/detail/9640000097026,30_09_2021
