title,summary,link,published
กรมการแพทย์เตรียมเปิด รพ.สนาม รพ.เลิดสิน,นายแพทย์สมศักดิ์ อรรฆศิลป์ อธิบดีกรมการแพทย์ เปิดเผยว่า จากสถานการณ์โควิด-19 ที่จำนวนผู้ป่วยในพื้นที่กรุงเทพมหานครและปริมณฑลเริ่มมีแนวโน้มลดลง รวมทั้งได้มีการนำวิธีการดูแลผู้ป่วยโควิด-19 แบบ Home Isolation มาใช้ กรมการแพทย์จึงได้ม,https://mgronline.com/uptodate/detail/9640000097024,30_09_2021
รมว.เกษตรฯ ตรวจสถานการณ์น้ำเมืองปทุม ยันไม่กระทบ กทม.-ปริมณฑล,นายเฉลิมชัย ศรีอ่อน รัฐมนตรีว่าการกระทรวงเกษตรและสหกรณ์ เปิดเผยภายหลังลงพื้นที่ติดตามสถานการณ์น้ำของลุ่มน้ำเจ้าพระยา ณ ชุมชนวัดน้ำวน ตำบลบางเดื่อ อำเภอเมือง จังหวัดปทุมธานี โดยได้พบปะพูดคุยและมอบสิ่งของให้กับชุมชนนอกคันกั้นน้ำ บริ,https://mgronline.com/uptodate/detail/9640000097021,30_09_2021
สปส.จ่ายเงินเยียวยานายจ้าง-ลูกจ้างแล้วกว่า 9 หมื่นล้านบาท,นายสุชาติ ชมกลิ่น รัฐมนตรีว่าการกระทรวงแรงงาน เปิดเผยความคืบหน้าการจ่ายเงินเยียวยาแรงงานและผู้ประกอบการจากรัฐบาลใน 29 จังหวัดพื้นที่สีแดงเข้ม ได้แก่ กรุงเทพมหานคร นครปฐม นนทบุรี ปทุมธานี สมุทรปราการ สมุทรสาคร ปัตตานี ยะลา นราธิวาส,https://mgronline.com/uptodate/detail/9640000097014,30_09_2021
"ปิดฉาก รพ.บุษราคัม หลังให้บริการรักษาผู้ป่วยโควิด-19 รวม 20,436 คน 103 วัน","นายแพทย์เกียรติภูมิ วงศ์รจิต ปลัดกระทรวงสาธารณสุข เป็นประธานปิดโรงพยาบาลบุษราคัม ซึ่งเป็นโรงพยาบาลสนามขนาดใหญ่ 3,700 เตียง ที่อาคารอิมแพ็ค ชาเลนเจอร์ เมืองทองธานี หลังเปิดให้บริการรักษาผู้ป่วยติดเชื้อโควิด-19 ตั้งแต่วันที่ 14 พฤษภ",https://mgronline.com/uptodate/detail/9640000097003,30_09_2021
ปิดการซื้อขายวันนี้ หุ้นไทย -11.30 จุด มูลค่าซื้อขายกว่า 9 หมื่นล้านบาท,"ตลาดหลักทรัพย์ฯ ปิดการซื้อขายวันนี้ ดัชนีหุ้นไทยร่วงลง 11.30 จุด หรือ -0.70% โดยปิดที่ระดับ 1,605.68 จุด ด้วยมูลค่าการซื้อขาย 90,650.11 ล้านบาท",https://mgronline.com/uptodate/detail/9640000096994,30_09_2021
ในหลวงพระราชทานพวงมาลาวางหน้าหีบศพ 2 ตร.นราธิวาส เสียชีวิตจากเหตุคนร้ายลอบวางระเบิด,วันที่ 30  กันยายน 2564 เวลา 10.00 น. พระบาทสมเด็จพระเจ้าอยู่หัว ทรงพระกรุณาโปรดเกล้าโปรดกระหม่อมให้ นายเจษฎา จิตรัตน์ ผู้ว่าราชการจังหวัดนราธิวาส เชิญพวงมาลาของพระบาทสมเด็จพระเจ้าอยู่หัว พวงมาลาของสมเด็จพระนางเจ้าสิริกิติ์ พระบรม,https://mgronline.com/uptodate/detail/9640000096992,30_09_2021
"ราคาทองวันนี้เปลี่ยนแปลง 5 ครั้ง ปรับลดสุทธิ 150 บาท ทองแท่งขายออก 27,750 บาท","สถานการณ์ราคาทองในประเทศวันนี้ มีการเปลี่ยนแปลงทั้งสิ้น 5 ครั้ง ปรับลดสุทธิ 150 บาท ทองแท่ง รับซื้อบาทละ 27,650 บาท ขายออกบาทละ 27,750 บาท ส่วนทองรูปพรรณ รับซื้อบาทละ 27,151.56 บาท ขายออกบาทละ 28,250 บาท",https://mgronline.com/uptodate/detail/9640000096987,30_09_2021
เศรษฐกิจไทยเดือน ส.ค.ยังได้รับผลกระทบจากโควิด-19,น.ส.ชญาวดี ชัยอนันต์ ผู้อำนวยการอาวุโส ฝ่ายเศรษฐกิจมหภาค ธนาคารแห่งประเทศไทย (ธปท.) กล่าวว่า เศรษฐกิจไทยในเดือนสิงหาคม ยังได้รับผลกระทบต่อเนื่องจากการแพร่ระบาดของโควิด-19 ทั้งในและต่างประเทศ โดยเครื่องชี้การบริโภคภาคเอกชนลดลงตามกำ,https://mgronline.com/uptodate/detail/9640000097032,30_09_2021
กอนช.ชี้ 10 วันจากนี้ฝนจะตกในภาคใต้เป็นส่วนใหญ่ ใช้เป็นโอกาสเร่งระบายน้ำ,นายสมเกียรติ ประจำวงษ์ เลขาธิการสำนักงานทรัพยากรน้ำแห่งชาติ (สทนช.) ในฐานะรองผู้อำนวยการกองอำนวยการน้ำแห่งชาติ (กอนช.) กล่าวว่า จากการติดตามข้อมูลสถานการณ์พายุจากกรมอุตุนิยมวิทยา พบว่าพายุที่ขนาบอยู่ทั้งสองฝั่งของประเทศไทยในปัจจุบ,https://mgronline.com/uptodate/detail/9640000097048,30_09_2021
"คลังเล็งขยายเวลา""คนละครึ่ง-ยิ่งใช้ยิ่งได้""ไปจนถึงตรุษจีน","นายอาคม เติมพิทยาไพสิฐ รัฐมนตรีว่าการกระทรวงคลัง ยืนยันว่า กระทรวงการคลังจะมีการพิจารณาออกมาตรการกระตุ้นเศรษฐกิจเพิ่มเติมแน่นอน  อย่างไรก็ตาม ขณะนี้ยังมีโครงการ ""ยิ่งใช้ยิ่งได้"" สำหรับผู้มีกำลังซื้อซึ่งจะได้รับค่าลดหย่อน 7,000 บาท",https://mgronline.com/uptodate/detail/9640000097052,30_09_2021
ในหลวง-พระราชินี โปรดเกล้าฯ องคมนตรีเชิญถุงพระราชทานมอบแก่ผู้ประสบอุทกภัย จ.ชัยภูมิ,ด้วยพระบาทสมเด็จพระเจ้าอยู่หัว และสมเด็จพระนางเจ้า ฯ พระบรมราชินี ทรงห่วงใยราษฎรที่ประสบอุทกภัยในพื้นที่จังหวัดชัยภูมิ  ในการนี้ ทรงพระกรุณาโปรดเกล้าโปรดกระหม่อมให้องคมนตรี ร่วมกับมูลนิธิราชประชานุเคราะห์ ในพระบรมราชูปถัมภ์ เชิญถุ,https://mgronline.com/uptodate/detail/9640000097055,30_09_2021
