title,summary,link,published
กรุงไทย แจ้งปิดระบบ พัฒนาบริการ “ไทยร่วมใจ” 1-2 ต.ค.,ธนาคารกรุงไทย แจ้งปิดทำการ เพื่อพัฒนาระบบ “ไทยร่ว […] อ่านข่าวต้นฉบับ: กรุงไทย แจ้งปิดระบบ พัฒนาบริการ “ไทยร่วมใจ” 1-2 ต.ค.,https://www.prachachat.net/finance/news-773716,01_10_2021
ด่วน ! ราชกิจจาฯ ประกาศ วันเลือกตั้งสมาชิกสภา-นายก อบต. 28 พ.ย.,ราชกิจจานุเบกษา เผยแพร่ประกาศ จัดการเลือกตั้งสมาชิกสภาอ […] อ่านข่าวต้นฉบับ: ด่วน ! ราชกิจจาฯ ประกาศ วันเลือกตั้งสมาชิกสภา-นายก อบต. 28 พ.ย.,https://www.prachachat.net/politics/news-773724,01_10_2021
“กรุงศรีฯ-CIMBT” เปิดชำระเงิน QR Code ระหว่างไทย-อินโดนีเซีย,ธปท.ประกาศความคืบหน้าการเปิดให้บริการชำระเงินด้วย QR Co […] อ่านข่าวต้นฉบับ: “กรุงศรีฯ-CIMBT” เปิดชำระเงิน QR Code ระหว่างไทย-อินโดนีเซีย,https://www.prachachat.net/finance/news-773745,01_10_2021
เทศกาลกินเจ 2564 : เตรียมตัวอย่างไร ? กินเจที่ไหนได้บ้าง ? เช็กพิกัด,ใกล้ถึงเทศกาลกินเจประจำปี 2564 เทศกาลสะสมบุญที่สำคัญนี้ […] อ่านข่าวต้นฉบับ: เทศกาลกินเจ 2564 : เตรียมตัวอย่างไร ? กินเจที่ไหนได้บ้าง ? เช็กพิกัด,https://www.prachachat.net/general/news-773325,01_10_2021
กทม.เผยรายชื่อ 11 ชุมชน รวม 239 ครัวเรือน เสี่ยงน้ำท่วม,ผู้ว่าฯ กทม. เผยรายชื่อ 11 ชุมชน ใน 7 เขต อยู่นอกแนวคัน […] อ่านข่าวต้นฉบับ: กทม.เผยรายชื่อ 11 ชุมชน รวม 239 ครัวเรือน เสี่ยงน้ำท่วม,https://www.prachachat.net/general/news-773774,01_10_2021
CPF โชว์นวัตกรรมอาหารเพื่อสุขภาพที่ดี ย้ำกลยุทธ์ “CPF Sustainability in Action” งาน TSX 2021,บริษัท เจริญโภคภัณฑ์อาหาร จำกัด (มหาชน) หรือ ซีพีเอฟ สน […] อ่านข่าวต้นฉบับ: CPF โชว์นวัตกรรมอาหารเพื่อสุขภาพที่ดี ย้ำกลยุทธ์ “CPF Sustainability in Action” งาน TSX 2021,https://www.prachachat.net/public-relations/news-773777,01_10_2021
theAsianparent เผยที่สุดของแบรนด์ผลิตภัณฑ์สำหรับแม่และเด็กแห่งปี ในกิจกรรม theAsianparent Awards 2021,theAsianparent (ดิเอเชี่ยนพาเรนท์) คอมมูนิตี้สำหรับคุณพ […] อ่านข่าวต้นฉบับ: theAsianparent เผยที่สุดของแบรนด์ผลิตภัณฑ์สำหรับแม่และเด็กแห่งปี ในกิจกรรม theAsianparent Awards 2021,https://www.prachachat.net/public-relations/news-773791,01_10_2021
สระบุรีแจ้งด่วน ! แนวกั้นน้ำพัง เตือน 3 อำเภอ ขนย้ายสิ่งของขึ้นที่สูง,สสจ.สระบุรี เผยแนวกั้นน้ำพัง เตือนคนพื้นที่ อ.บ้านหมอ อ […] อ่านข่าวต้นฉบับ: สระบุรีแจ้งด่วน ! แนวกั้นน้ำพัง เตือน 3 อำเภอ ขนย้ายสิ่งของขึ้นที่สูง,https://www.prachachat.net/local-economy/news-773792,01_10_2021
5 ไฮไลท์ งาน Cultural District 2021 : เทศกาลศิลปะเปิดเกาะรัตนโกสินทร์,เปิด 5 ไฮไลท์ ชวนเช็กอิน งาน Cultural District 2021 : เ […] อ่านข่าวต้นฉบับ: 5 ไฮไลท์ งาน Cultural District 2021 : เทศกาลศิลปะเปิดเกาะรัตนโกสินทร์,https://www.prachachat.net/d-life/news-773825,01_10_2021
ศูนย์วิจัยกสิกรไทย ชี้ หนี้ครัวเรือนไตรมาส 2 ยังทรงตัวระดับสูง,ศูนย์วิจัยกสิกรไทย เผยหนี้ครัวเรือนเติบโตต่อใน Q2/2564 […] อ่านข่าวต้นฉบับ: ศูนย์วิจัยกสิกรไทย ชี้ หนี้ครัวเรือนไตรมาส 2 ยังทรงตัวระดับสูง,https://www.prachachat.net/breaking-news/news-773842,01_10_2021
เรียนออนไลน์ทำพิษ คณะกรรมการปฏิรูปการศึกษาเร่งจัดการสอนที่โรงเรียน,เรียนออนไลน์ทำพิษ เด็กแสนคนขาดเครื่องมือการเรียน เพิ่มภ […] อ่านข่าวต้นฉบับ: เรียนออนไลน์ทำพิษ คณะกรรมการปฏิรูปการศึกษาเร่งจัดการสอนที่โรงเรียน,https://www.prachachat.net/education/news-773403,01_10_2021
INTUCH ผู้ถือหุ้นไฟเขียว แต่งตั้งกรรมการ 8 ท่านนั่งบอร์ด,ผู้ถือหุ้น “INTUCH” ไฟเขียว อนุมัติแต่งตั้ง 8 กรรมการนั […] อ่านข่าวต้นฉบับ: INTUCH ผู้ถือหุ้นไฟเขียว แต่งตั้งกรรมการ 8 ท่านนั่งบอร์ด,https://www.prachachat.net/finance/news-773757,01_10_2021
