title,summary,link,published
ttb มองราคาน้ำมันพุ่ง “ครัวเรือนไทย-ธุรกิจ” แบกภาระเพิ่ม 2 แสนล้าน,ศูนย์วิเคราะห์เศรษฐกิจ ทีทีบี หรือ “ttb analytics” ประเ […] อ่านข่าวต้นฉบับ: ttb มองราคาน้ำมันพุ่ง “ครัวเรือนไทย-ธุรกิจ” แบกภาระเพิ่ม 2 แสนล้าน,https://www.prachachat.net/finance/news-791855,2021_10_29
"หุ้นไทยวันนี้ (29 ต.ค.) ปิดตลาดภาคเช้า -3 จุด ซื้อขายน้อย 35,943 ล้าน","หุ้นไทยวันนี้ (29 ต.ค.) ปิดตลาดภาคเช้า -3.06 จุด ดัชนีอ […] อ่านข่าวต้นฉบับ: หุ้นไทยวันนี้ (29 ต.ค.) ปิดตลาดภาคเช้า -3 จุด ซื้อขายน้อย 35,943 ล้าน",https://www.prachachat.net/finance/news-791895,2021_10_29
แผนปฏิบัติการเปิดประเทศ รับมือโควิดแพร่ระบาดปี 65 กทม.พร้อมน้อยสุด,ศบค.สั่งทุกหน่วยงานทำแผนปฏิบัติการรับมือเปิดประเทศ คุมแ […] อ่านข่าวต้นฉบับ: แผนปฏิบัติการเปิดประเทศ รับมือโควิดแพร่ระบาดปี 65 กทม.พร้อมน้อยสุด,https://www.prachachat.net/politics/news-791776,2021_10_29
SMEs ภูเก็ตลุ้นเปิดประเทศ 1 พ.ย. สะท้อน 3 เดือน “แซนด์บอกซ์” ไม่ฟื้น,วันหยุดยาวช่วงสุดสัปดาห์ที่ผ่านมา (22-25 ต.ค. 2564) หลา […] อ่านข่าวต้นฉบับ: SMEs ภูเก็ตลุ้นเปิดประเทศ 1 พ.ย. สะท้อน 3 เดือน “แซนด์บอกซ์” ไม่ฟื้น,https://www.prachachat.net/local-economy/news-789205,2021_10_29
สินิตย์ เลิศไกร 8 เดือน ประเดิมงาน รมช.พาณิชย์คนใหม่,การเปลี่ยนแปลงทางการเมืองในช่วงต้นปีที่ผ่านมา ส่งผลให้เ […] อ่านข่าวต้นฉบับ: สินิตย์ เลิศไกร 8 เดือน ประเดิมงาน รมช.พาณิชย์คนใหม่,https://www.prachachat.net/economy/news-789039,2021_10_29
ประกาศแล้ว! กรมอุตุฯแจ้งเตือนไทยเข้าสู่ฤดูหนาว 2 พ.ย.นี้,กรมอุตุนิยมวิทยาออกประกาศแจ้งเตือนประเทศไทยเริ่มเข้าฤดู […] อ่านข่าวต้นฉบับ: ประกาศแล้ว! กรมอุตุฯแจ้งเตือนไทยเข้าสู่ฤดูหนาว 2 พ.ย.นี้,https://www.prachachat.net/general/news-791912,2021_10_29
ประวิตร สั่งรับมือฝนภาคใต้ ชงครม.เคาะ 9 มาตรการฤดูแล้งปี 64/65,ประวิตร สั่งรับมือฤดูฝนภาคใต้เต็มพิกัด พร้อมหนุน 9 มาตร […] อ่านข่าวต้นฉบับ: ประวิตร สั่งรับมือฝนภาคใต้ ชงครม.เคาะ 9 มาตรการฤดูแล้งปี 64/65,https://www.prachachat.net/economy/news-791930,2021_10_29
สนค. ชี้ความเชื่อมั่นชายแดนใต้ดีขึ้น หวังเปิดประเทศกระตุ้นเศรษฐกิจ,สนค.-ศอ.บต. เผยดัชนีความเชื่อมั่นจังหวัดชายแดนใต้ ไตรมา […] อ่านข่าวต้นฉบับ: สนค. ชี้ความเชื่อมั่นชายแดนใต้ดีขึ้น หวังเปิดประเทศกระตุ้นเศรษฐกิจ,https://www.prachachat.net/economy/news-791941,2021_10_29
โษฆกรัฐบาล เร่งกักตัว ขอ WFH พบคณะทำงานติดเชื้อโควิด,ทีมหน้าห้อง “ธนกร วังบุญคงชนะ” ตรวจพบว่าติด […] อ่านข่าวต้นฉบับ: โษฆกรัฐบาล เร่งกักตัว ขอ WFH พบคณะทำงานติดเชื้อโควิด,https://www.prachachat.net/politics/news-791974,2021_10_29
อยู่สบาย ๆ ใช้ชีวิตใกล้กรุง ที่บ้านเดี่ยวชลบุรี,ถ้าคุณกำลังมองหาบ้านสักหลังแต่ไม่ต้องการอยู่ในกรุงเทพฯ […] อ่านข่าวต้นฉบับ: อยู่สบาย ๆ ใช้ชีวิตใกล้กรุง ที่บ้านเดี่ยวชลบุรี,https://www.prachachat.net/public-relations/news-791965,2021_10_29
กสิกรไทย อัดเม็ดเงิน 2 แสนล้านตั้งเป้าปี 73 ก๊าซเรือนกระจกเป็นศูนย์,ธนาคารกสิกรไทย ประกาศจุดยืนปล่อยก๊าซเรือนกระจกสุทธิเป็น […] อ่านข่าวต้นฉบับ: กสิกรไทย อัดเม็ดเงิน 2 แสนล้านตั้งเป้าปี 73 ก๊าซเรือนกระจกเป็นศูนย์,https://www.prachachat.net/finance/news-791966,2021_10_29
27 สายการบิน ผู้โดยสารกว่า 1 หมื่นคน จองตั๋วเครื่องบินเข้าไทย 1-5 พ.ย.,เปิดรายชื่อ 27 สายการบิน มีการจองบัตรโดยสารเดินทางเข้า- […] อ่านข่าวต้นฉบับ: 27 สายการบิน ผู้โดยสารกว่า 1 หมื่นคน จองตั๋วเครื่องบินเข้าไทย 1-5 พ.ย.,https://www.prachachat.net/tourism/news-791898,2021_10_29
รพ.เอกชัย ทุ่ม 165 ล้าน ลงทุน “เดอะคลีนิกค์” ลุยธุรกิจความงาม,รพ.เอกชัย อัดงบลงทุน 165 ล้านบาท เข้าถือหุ้น 10% เดอะคล […] อ่านข่าวต้นฉบับ: รพ.เอกชัย ทุ่ม 165 ล้าน ลงทุน “เดอะคลีนิกค์” ลุยธุรกิจความงาม,https://www.prachachat.net/marketing/news-791981,2021_10_29
ราชกิจจาฯ ห้ามชุมนุม-มั่วสุม ช่วงเปิดประเทศ 1 พ.ย. โทษจำคุก 2 ปี,ราชกิจจาฯ เผยแพร่ประกาศ ห้ามชุมนุม-มั่วสุมทั่วราชอาณาจั […] อ่านข่าวต้นฉบับ: ราชกิจจาฯ ห้ามชุมนุม-มั่วสุม ช่วงเปิดประเทศ 1 พ.ย. โทษจำคุก 2 ปี,https://www.prachachat.net/politics/news-791978,2021_10_29
ยามาฮ่า YZF-R7 เขย่าตลาดสปอร์ตไบก์,เวทีรถใหม่ ไทยยามาฮ่ามอเตอร์ ตอกย้ำบทบาทผู้นำตลาดรถจักร […] อ่านข่าวต้นฉบับ: ยามาฮ่า YZF-R7 เขย่าตลาดสปอร์ตไบก์,https://www.prachachat.net/motoring/news-788956,2021_10_29
SCC แจงเหตุเพลิงไหม้โรงปูนแก่งคอย คุมสถานการณ์ได้ ไม่มีผู้บาดเจ็บ,SCC แจงสถานการณ์เพลิงไหม้โรงปูนแก่งคอย ควบคุมเพลิงได้แล […] อ่านข่าวต้นฉบับ: SCC แจงเหตุเพลิงไหม้โรงปูนแก่งคอย คุมสถานการณ์ได้ ไม่มีผู้บาดเจ็บ,https://www.prachachat.net/finance/news-791996,2021_10_29
รู้กลโกงก่อนกรอกบัตรเครดิต,คอลัมน์ Pawoot.com ภาวุธ พงษ์วิทยภานุ ที่ผ่านมามีข่าวเก […] อ่านข่าวต้นฉบับ: รู้กลโกงก่อนกรอกบัตรเครดิต,https://www.prachachat.net/ict/news-789035,2021_10_29
“อินเดีย” เร่งทำ FTA หวังกระตุ้น “ส่งออก”,เพียงไม่กี่วันหลังจากรัฐมนตรีคลังจากประเทศกลุ่มจี 20 เห […] อ่านข่าวต้นฉบับ: “อินเดีย” เร่งทำ FTA หวังกระตุ้น “ส่งออก”,https://www.prachachat.net/world-news/news-789431,2021_10_29
รถไฟฟ้า MRT สายสีน้ำเงิน-สีม่วง แจ้งปรับเวลาให้บริการ มีผล 1 พ.ย.,รฟม. แจ้งปรับเวลาให้บริการรถไฟฟ้า MRT สายสีน้ำเงิน-สายส […] อ่านข่าวต้นฉบับ: รถไฟฟ้า MRT สายสีน้ำเงิน-สีม่วง แจ้งปรับเวลาให้บริการ มีผล 1 พ.ย.,https://www.prachachat.net/property/news-792035,2021_10_29
“คาร์โร” จับมือลีสซิ่งในเครือ อนุมัติไวผ่อนนานดอกเบี้ยต่ำ,คาร์โร แพลตฟอร์มออนไลน์ซื้อขายรถมือสอง จับมือพันธมิตรจี […] อ่านข่าวต้นฉบับ: “คาร์โร” จับมือลีสซิ่งในเครือ อนุมัติไวผ่อนนานดอกเบี้ยต่ำ,https://www.prachachat.net/public-relations/news-788943,2021_10_29
โนวาแวกซ์ ยื่นขอขึ้นทะเบียนวัคซีนโควิด ในสหราชอาณาจักร,โนวาแวกซ์ ยื่นขออนุมัติขึ้นทะเบียนวัคซีนโควิด-19 ชนิดทำ […] อ่านข่าวต้นฉบับ: โนวาแวกซ์ ยื่นขอขึ้นทะเบียนวัคซีนโควิด ในสหราชอาณาจักร,https://www.prachachat.net/world-news/news-791993,2021_10_29
ร้านอาหาร-ผับ บาร์ ร้องนายกฯ ปลดล็อกเปิดสถานบันเทิงช่วงไฮซีซั่น,กลุ่มผู้ประกอบการร้านอาหาร สถานบันเทิง 311 แห่งในเขตกรุ […] อ่านข่าวต้นฉบับ: ร้านอาหาร-ผับ บาร์ ร้องนายกฯ ปลดล็อกเปิดสถานบันเทิงช่วงไฮซีซั่น,https://www.prachachat.net/marketing/news-792026,2021_10_29
นิสสัน อัลเมร่าโมเดลขายดีสุดในไทย 10 ปี ทะลุ 2.3 แสนคัน,นิสสัน ประกาศความสำเร็จ นิสสัน อัลเมร่าใช้เวลา 10 ปี ขา […] อ่านข่าวต้นฉบับ: นิสสัน อัลเมร่าโมเดลขายดีสุดในไทย 10 ปี ทะลุ 2.3 แสนคัน,https://www.prachachat.net/motoring/news-792009,2021_10_29
เปิดประเทศ 1 พ.ย. จังหวัดคุณสีอะไร ? ทำอะไรได้บ้าง เช็กที่นี่,ศบค. ปรับมาตรการรับเปิดประเทศ 1 พ.ย. แต่ละจังหวัดสีอะไร […] อ่านข่าวต้นฉบับ: เปิดประเทศ 1 พ.ย. จังหวัดคุณสีอะไร ? ทำอะไรได้บ้าง เช็กที่นี่,https://www.prachachat.net/general/news-791847,2021_10_29
เอเชียประกันภัย : ลูกค้าเคลมรถยนต์หลัง 15 ต.ค.64 ต้องดำเนินการอย่างไร?,สมาคมประกันวินาศภัยไทย อัพเดท 21 บริษัทประกันวินาศภัยเข […] อ่านข่าวต้นฉบับ: เอเชียประกันภัย : ลูกค้าเคลมรถยนต์หลัง 15 ต.ค.64 ต้องดำเนินการอย่างไร?,https://www.prachachat.net/breaking-news/news-792083,2021_10_29
"ศบค.เคาะมาตรการลอยกระทงสุโขทัย 18-20 ต.ค. เข้าได้ไม่เกิน 15,000 คน/วัน","ศบค. การจัดงานลอยกระทงสุโขทัย ประจำปี 2564 พร้อมแนวทางแ […] อ่านข่าวต้นฉบับ: ศบค.เคาะมาตรการลอยกระทงสุโขทัย 18-20 ต.ค. เข้าได้ไม่เกิน 15,000 คน/วัน",https://www.prachachat.net/local-economy/news-791998,2021_10_29
อาคม ชี้ ออก พ.ร.ก. กู้เงินเพิ่ม ต้องดูสถานการณ์-ความจำเป็นในการใช้,รมว. คลัง ชี้ออก พ.ร.ก. กู้เงินเพิ่ม ต้องดูสถานการณ์-คว […] อ่านข่าวต้นฉบับ: อาคม ชี้ ออก พ.ร.ก. กู้เงินเพิ่ม ต้องดูสถานการณ์-ความจำเป็นในการใช้,https://www.prachachat.net/finance/news-792098,2021_10_29
ดีเดย์ 1 พ.ย. กรมทรัพย์สินทางปัญญา เปิดบริการเต็มรูปแบบ,กรมทรัพย์สินทางปัญญา เปิดศูนย์บริการประชาชน ชั้น 3 ดีเด […] อ่านข่าวต้นฉบับ: ดีเดย์ 1 พ.ย. กรมทรัพย์สินทางปัญญา เปิดบริการเต็มรูปแบบ,https://www.prachachat.net/economy/news-792124,2021_10_29
เปิดสถิติ “ราคาน้ำมัน” ตลอดเดือนตุลาคม 2564 เชลล์ปรับบ่อยสุด,ราคาน้ำมันขายปลีกในเดือนตุลาคม มีความผันผวน สถานีน้ำมัน […] อ่านข่าวต้นฉบับ: เปิดสถิติ “ราคาน้ำมัน” ตลอดเดือนตุลาคม 2564 เชลล์ปรับบ่อยสุด,https://www.prachachat.net/economy/news-790751,2021_10_29
ทำความรู้จักกับสีทาบ้าน องค์ประกอบสำคัญของทุกบ้าน,สีทาบ้าน ช่วยแต่งเติมสีสัน รวมถึงการสร้างบรรยากาศในบ้าน […] อ่านข่าวต้นฉบับ: ทำความรู้จักกับสีทาบ้าน องค์ประกอบสำคัญของทุกบ้าน,https://www.prachachat.net/public-relations/news-792166,2021_10_29
“โรงพยาบาลสนามแสงแห่งใจ” เตรียมปิดให้บริการ 8 พฤศจิกายนนี้ หลังสถานการณ์โควิด-19 คลื่คลาย,ด้วยสถานการณ์การระบาดของไวรัสโควิด-19 เริ่มคลี่คลาย จำน […] อ่านข่าวต้นฉบับ: “โรงพยาบาลสนามแสงแห่งใจ” เตรียมปิดให้บริการ 8 พฤศจิกายนนี้ หลังสถานการณ์โควิด-19 คลื่คลาย,https://www.prachachat.net/public-relations/news-792177,2021_10_29
ประยุทธ์ ลั่น พาคนไทยรอดพ้นวิกฤตเศรษฐกิจ ชูพลังอำนาจใหม่ด้านวัฒนธรรม,ประยุทธ์ แถลงนโยบาย 4 ข้อ ก่อนเปิดประเทศ 1 พ.ย.นี้ ลั่น […] อ่านข่าวต้นฉบับ: ประยุทธ์ ลั่น พาคนไทยรอดพ้นวิกฤตเศรษฐกิจ ชูพลังอำนาจใหม่ด้านวัฒนธรรม,https://www.prachachat.net/politics/news-792157,2021_10_29
ศบค.ผวาปลดล็อกดื่มเหล้า จุดชนวนโควิดรอบใหม่ ให้เอกชนร่วมรับผิดชอบ,ศบค. ผวาปลดล็อกดื่มแอลกอฮอล์ หวั่นเกิดการแพร่ระบาดอีกรอ […] อ่านข่าวต้นฉบับ: ศบค.ผวาปลดล็อกดื่มเหล้า จุดชนวนโควิดรอบใหม่ ให้เอกชนร่วมรับผิดชอบ,https://www.prachachat.net/general/news-792044,2021_10_29
นนทบุรี เปิดจองวัคซีนโมเดอร์นา เข็มที่ 1 ลงทะเบียนวันนี้ถึง 31 ต.ค.,สสจ.นนทบุรี เปิดจองฉีดวัคซีนโมเดอร์นา ของสภากาชาดไทย เข […] อ่านข่าวต้นฉบับ: นนทบุรี เปิดจองวัคซีนโมเดอร์นา เข็มที่ 1 ลงทะเบียนวันนี้ถึง 31 ต.ค.,https://www.prachachat.net/local-economy/news-792237,2021_10_29
มิตซูบิชิ อีเล็คทริค ที่สุดของแบรนด์เครื่องปรับอากาศที่ได้รับความน่าเชื่อถือและไว้วางใจจากผู้บริโภค 21 ปีซ้อน,นายชินจิ คามิยะ กรรมการผู้จัดการ บริษัท มิตซูบิชิ อีเล็ […] อ่านข่าวต้นฉบับ: มิตซูบิชิ อีเล็คทริค ที่สุดของแบรนด์เครื่องปรับอากาศที่ได้รับความน่าเชื่อถือและไว้วางใจจากผู้บริโภค 21 ปีซ้อน,https://www.prachachat.net/public-relations/news-792242,2021_10_29
เปิดประเทศ 1 พ.ย. แอปพลิเคชันเดินทางเข้าประเทศ มีอะไรบ้าง ?,เปิดแอปพลิเคชันที่นักท่องเที่ยวต้องใช้ในการเดินทางเข้าป […] อ่านข่าวต้นฉบับ: เปิดประเทศ 1 พ.ย. แอปพลิเคชันเดินทางเข้าประเทศ มีอะไรบ้าง ?,https://www.prachachat.net/ict/news-792113,2021_10_29
รพ.วิมุต เปิดจองวัน-เวลา ฉีดโมเดอร์นา ดีเดย์ฉีดวัคซีน 9 พ.ย.,โรงพยาบาลวิมุติ เปิดจอง วัน-เวลา ฉีดวัคซีนโมเดอร์นา 2-6 […] อ่านข่าวต้นฉบับ: รพ.วิมุต เปิดจองวัน-เวลา ฉีดโมเดอร์นา ดีเดย์ฉีดวัคซีน 9 พ.ย.,https://www.prachachat.net/marketing/news-792248,2021_10_29
โออาร์-ปตท.-กฟผ. หนุนกรมการแพทย์ เปิดพื้นที่จอดรถโมบายสโตรคยูนิต,โออาร์ – ปตท. – กฟผ. ร่วมหนุนกรมการแพทย์ เปิดพื้นที่จุด […] อ่านข่าวต้นฉบับ: โออาร์-ปตท.-กฟผ. หนุนกรมการแพทย์ เปิดพื้นที่จอดรถโมบายสโตรคยูนิต,https://www.prachachat.net/economy/news-792252,2021_10_29
ทำความรู้จัก “สินทรัพย์ดิจิทัล” ก่อนลงทุน-หลังยอดเปิดบัญชีเทรดพุ่ง 5 เท่า,ทำความรู้จัก “สินทรัพย์ดิจิทัล” ก่อนลงทุน ว […] อ่านข่าวต้นฉบับ: ทำความรู้จัก “สินทรัพย์ดิจิทัล” ก่อนลงทุน-หลังยอดเปิดบัญชีเทรดพุ่ง 5 เท่า,https://www.prachachat.net/finance/news-791295,2021_10_29
“สิงห์ปาร์ค” เติมผลไม้เกรดพรีเมี่ยมตลาดในประเทศ ประเดิม “กล้วยหอมทอง” มาตรฐานญี่ปุ่นเปิด Pre-order ส่งทั่วประเทศ,สิงห์ปาร์ค เชียงราย แหล่งท่องเที่ยวทางการเกษตร ยกจุดแข็ […] อ่านข่าวต้นฉบับ: “สิงห์ปาร์ค” เติมผลไม้เกรดพรีเมี่ยมตลาดในประเทศ ประเดิม “กล้วยหอมทอง” มาตรฐานญี่ปุ่นเปิด Pre-order ส่งทั่วประเทศ,https://www.prachachat.net/public-relations/news-792264,2021_10_29
กสิกรไทย หนุนพนักงานเกษียณอายุก่อนกำหนด-ขยายสิทธิ์อีกรอบ,ธนาคารกสิกรไทย ประกาศขยายสิทธิ์ให้พนักงานเกษียณอายุก่อน […] อ่านข่าวต้นฉบับ: กสิกรไทย หนุนพนักงานเกษียณอายุก่อนกำหนด-ขยายสิทธิ์อีกรอบ,https://www.prachachat.net/finance/news-792265,2021_10_29
ประยุทธ์ เตรียมใช้งบฯเยียวยา ศบค.ส่วนหน้า 4 จังหวัดชายแดนใต้,ศบค.ส่วนหน้า เสนอ 5 มาตรการ รับมือโควิดชายแดนใต้ เล็งกำ […] อ่านข่าวต้นฉบับ: ประยุทธ์ เตรียมใช้งบฯเยียวยา ศบค.ส่วนหน้า 4 จังหวัดชายแดนใต้,https://www.prachachat.net/politics/news-792142,2021_10_29
