title,summary,link,published
ประกาศ ประมวลจริยธรรมข้าราชการการเมือง 42 ข้อ บังคับ นายกฯ-รัฐมนตรี,ราชกิจจานุเบกษา เผยแพร่ ประมวลจริยธรรมของข้าราชการการเม […] อ่านข่าวต้นฉบับ: ประกาศ ประมวลจริยธรรมข้าราชการการเมือง 42 ข้อ บังคับ นายกฯ-รัฐมนตรี,https://www.prachachat.net/politics/news-790633,2021_10_27
คลัง กำหนด 5 แนวทางพัฒนาตลาดทุนไทย เน้นตอบโจทย์รอบด้าน,คลังกำหนด 5 แนวทางพัฒนาตลาดทุนไทย หลังเข้าร่วมประชุมบอร […] อ่านข่าวต้นฉบับ: คลัง กำหนด 5 แนวทางพัฒนาตลาดทุนไทย เน้นตอบโจทย์รอบด้าน,https://www.prachachat.net/finance/news-790637,2021_10_27
มาเลเซียจ่อเปิดประเทศ “เต็มรูปแบบ” ต้นเดือนธันวาคมนี้,“มาเลเซีย” ตั้งเป้าหมายเปิดประเทศเต็มรูปแบบ ให้นักท่องเ […] อ่านข่าวต้นฉบับ: มาเลเซียจ่อเปิดประเทศ “เต็มรูปแบบ” ต้นเดือนธันวาคมนี้,https://www.prachachat.net/world-news/news-790631,2021_10_27
ONEE,Market-think สรกล อดุลยานนท์ ครั้งหนึ่งตอนที่มีข […] อ่านข่าวต้นฉบับ: ONEE,https://www.prachachat.net/opinion-column-2/news-787228,2021_10_27
สายเนื้อห้ามพลาด! 7 ร้านเด็ดเนื้อออสเตรเลีย,MLA (Meat & Livestock Australia) องค์กรซึ่งก่อตั้งโ […] อ่านข่าวต้นฉบับ: สายเนื้อห้ามพลาด! 7 ร้านเด็ดเนื้อออสเตรเลีย,https://www.prachachat.net/spinoff/lifestyle/news-790606,2021_10_27
เอ็มจี ขายรถอีวี MG EP  บิ๊กล็อต เร่งผุดสถานีชาร์จทั่วประเทศ,เอ็มจี ชี้เทรนด์รถอีวี พุ่งปลื้มขายรถยนต์ไฟฟ้า MG EP ล๊ […] อ่านข่าวต้นฉบับ: เอ็มจี ขายรถอีวี MG EP บิ๊กล็อต เร่งผุดสถานีชาร์จทั่วประเทศ,https://www.prachachat.net/motoring/news-790600,2021_10_27
คณะปฏิรูปการศึกษาเขย่าแผนบิ๊กร็อค 4 ปั้นคนอาชีวะเสิร์ฟตลาดแรงงาน,คณะกรรมการปฏิรูปประเทศด้านการศึกษา เร่งสร้างค่านิยมใหม่ […] อ่านข่าวต้นฉบับ: คณะปฏิรูปการศึกษาเขย่าแผนบิ๊กร็อค 4 ปั้นคนอาชีวะเสิร์ฟตลาดแรงงาน,https://www.prachachat.net/csr-hr/news-790531,2021_10_27
“กรุงศรี” ตัดขายหนี้ด้อยคุณภาพ 1.4 พันล้านบาทให้ BAM,ธนาคารกรุงศรีอยุธยา ตัดขายหนี้ด้อยคุณภาพ 1.4 พันล้านบาท […] อ่านข่าวต้นฉบับ: “กรุงศรี” ตัดขายหนี้ด้อยคุณภาพ 1.4 พันล้านบาทให้ BAM,https://www.prachachat.net/finance/news-790586,2021_10_27
ช่องทางลงทะเบียนฉีดวัคซีนเข็ม 3 ศูนย์ฯบางซื่อ พรุ่งนี้ (28 ต.ค.),เปิดช่องทางลงทะเบียนฉีดวัคซีนป้องกันโควิดเข็มกระตุ้น หร […] อ่านข่าวต้นฉบับ: ช่องทางลงทะเบียนฉีดวัคซีนเข็ม 3 ศูนย์ฯบางซื่อ พรุ่งนี้ (28 ต.ค.),https://www.prachachat.net/general/news-790543,2021_10_27
ปูนซีเมนต์ฯ ใส่เงิน 7.8 ล้านบาท เปิดบริษัทโลจิสติกส์ในฟิลิปปินส์,ปูนซิเมนต์ไทย แจ้งตลาดหลักทรัพย์ ใส่เงินให้ “เอสซ […] อ่านข่าวต้นฉบับ: ปูนซีเมนต์ฯ ใส่เงิน 7.8 ล้านบาท เปิดบริษัทโลจิสติกส์ในฟิลิปปินส์,https://www.prachachat.net/finance/news-790574,2021_10_27
วัคซีนเข็มกระตุ้น แอสตร้าฯ หรือ ไฟเซอร์ ใครได้ฉีดบ้าง?,กรมควบคุมโรค เปิดแนวทางฉีดวัคซีน “เข็มกระตุ้นR […] อ่านข่าวต้นฉบับ: วัคซีนเข็มกระตุ้น แอสตร้าฯ หรือ ไฟเซอร์ ใครได้ฉีดบ้าง?,https://www.prachachat.net/general/news-790262,2021_10_27
OR ส่งบริษัทลูกซื้อหุ้น “อิ่มทรัพย์ โกลบอล คูซีน” ต่อยอดธุรกิจอาหาร,OR ส่งบริษัทลูก “มอคูลัสฯ ” ซื้อหุ้น “ […] อ่านข่าวต้นฉบับ: OR ส่งบริษัทลูกซื้อหุ้น “อิ่มทรัพย์ โกลบอล คูซีน” ต่อยอดธุรกิจอาหาร,https://www.prachachat.net/finance/news-790557,2021_10_27
“ปิ่นทอง” เคาะราคาหุ้นไอพีโอ 3.90 บาท จองซื้อ 28-29 ต.ค.นี้,บมจ.ปิ่นทอง อินดัสเตรียล ปาร์ค หรือ PIN กำหนดราคาเสนอขา […] อ่านข่าวต้นฉบับ: “ปิ่นทอง” เคาะราคาหุ้นไอพีโอ 3.90 บาท จองซื้อ 28-29 ต.ค.นี้,https://www.prachachat.net/finance/news-790544,2021_10_27
ส่องกลยุทธ์ “ซัมซุง” ดูแลคน-สร้างความยั่งยืน สู่รางวัล Factory of Choice,ไทยซัมซุง อิเลคโทรนิคส์คว้ารางวัล Factory of Choice จาก […] อ่านข่าวต้นฉบับ: ส่องกลยุทธ์ “ซัมซุง” ดูแลคน-สร้างความยั่งยืน สู่รางวัล Factory of Choice,https://www.prachachat.net/csr-hr/news-790184,2021_10_27
ดอลลาร์สหรัฐแข็งค่า หลังเปิดเผยตัวเลขเศรษฐกิจที่ค่อนข้างสดใส,ดอลลาร์สหรัฐแข็งค่า หลังการเปิดเผยตัวเลขเศรษฐกิจที่ค่อน […] อ่านข่าวต้นฉบับ: ดอลลาร์สหรัฐแข็งค่า หลังเปิดเผยตัวเลขเศรษฐกิจที่ค่อนข้างสดใส,https://www.prachachat.net/finance/news-790482,2021_10_27
คดีถุงมือยางมือสองส่งไปสหรัฐฯ อัยการสั่งฟ้อง แพดดี้ เดอะ รูม แล้ว,จุรินทร์ เข้มสอบ 4 ข้อ ประเด็นถุงมือยางมือสอง ส่งไป USA […] อ่านข่าวต้นฉบับ: คดีถุงมือยางมือสองส่งไปสหรัฐฯ อัยการสั่งฟ้อง แพดดี้ เดอะ รูม แล้ว,https://www.prachachat.net/economy/news-790493,2021_10_27
ไมเนอร์ชงขายเหล้าเบียร์ 1 พ.ย. ร่อนจดหมายถึง กทม.ไฟเขียวร้านอาหาร-โรงแรม,ไมเนอร์ฯร่อน จม.เปิดผนึกถึงผู้ว่าฯ กทม.ขอให้เริ่มขายเคร […] อ่านข่าวต้นฉบับ: ไมเนอร์ชงขายเหล้าเบียร์ 1 พ.ย. ร่อนจดหมายถึง กทม.ไฟเขียวร้านอาหาร-โรงแรม,https://www.prachachat.net/marketing/news-789154,2021_10_27
อุตฯ อาหาร-เครื่องดื่มไทย โกยรายได้ 8 เดือน 1.4 หมื่นล้านเหรียญสหรัฐ,สนค. ชี้กลุ่มอุตสาหกรรมอาหารและเครื่องดื่ม ยังคงเป็นอุต […] อ่านข่าวต้นฉบับ: อุตฯ อาหาร-เครื่องดื่มไทย โกยรายได้ 8 เดือน 1.4 หมื่นล้านเหรียญสหรัฐ,https://www.prachachat.net/economy/news-790421,2021_10_27
ปตท. ปรับเพิ่มราคาน้ำมันทุกชนิด พรุ่งนี้ ตี 5,ปตท. ประกาศปรับเพิ่มราคาน้ำมัน เริ่มพรุ่งนี้ (28 ต.ค.) […] อ่านข่าวต้นฉบับ: ปตท. ปรับเพิ่มราคาน้ำมันทุกชนิด พรุ่งนี้ ตี 5,https://www.prachachat.net/economy/news-790447,2021_10_27
เมอร์ค ตอบรับกระแส “ปลดล็อกกระท่อม ถูกกฎหมาย” ผ่านงานสัมนาออนไลน์,บริษัท เมอร์ค ประเทศไทย ผู้ดำเนินธุรกิจยา เคมีภัณฑ์ และ […] อ่านข่าวต้นฉบับ: เมอร์ค ตอบรับกระแส “ปลดล็อกกระท่อม ถูกกฎหมาย” ผ่านงานสัมนาออนไลน์,https://www.prachachat.net/public-relations/news-790467,2021_10_27
ชวนคลายล็อกกล้ามเนื้อ ลดอาการออฟฟิศซินโดรม กับ 4 ท่ายืดเหยียด ด้วย FOAM ROLLER,มายืดเส้นยืดสายผ่อนคลายกล้ามเนื้อไปกับคลาส LET’S STRETC […] อ่านข่าวต้นฉบับ: ชวนคลายล็อกกล้ามเนื้อ ลดอาการออฟฟิศซินโดรม กับ 4 ท่ายืดเหยียด ด้วย FOAM ROLLER,https://www.prachachat.net/public-relations/news-790445,2021_10_27
ศบค.ยึดโมเดล กทม.ส่งทีม CCRT แก้โควิดใต้ จันทบุรีเจอคลัสเตอร์ใหม่,ศบค. เผย 10 จังหวัดติดเชื้อโควิดสูงสุดยังเป็นภาคใต้กับจ […] อ่านข่าวต้นฉบับ: ศบค.ยึดโมเดล กทม.ส่งทีม CCRT แก้โควิดใต้ จันทบุรีเจอคลัสเตอร์ใหม่,https://www.prachachat.net/general/news-790311,2021_10_27
“อาคม” คาดจีดีพี ปี’64 โต 1% เปิดประเทศหนุนเศรษฐกิจไตรมาสสุดท้าย,รมว.คลัง คาดปี 2564 จีดีพีไทย โต 1% ชี้เปิดประเทศ 1 พ.ย […] อ่านข่าวต้นฉบับ: “อาคม” คาดจีดีพี ปี’64 โต 1% เปิดประเทศหนุนเศรษฐกิจไตรมาสสุดท้าย,https://www.prachachat.net/finance/news-790446,2021_10_27
ลักษณะเสี่ยงต่อการมีบุตรยาก ที่แพทย์อยากบอก,สุขภาพดีกับรามาฯ อ.พญ.อาทิตยา สิงห์วงษา ปัญหาสุด […] อ่านข่าวต้นฉบับ: ลักษณะเสี่ยงต่อการมีบุตรยาก ที่แพทย์อยากบอก,https://www.prachachat.net/d-life/news-786890,2021_10_27
"เปิดแล้ว! “เซ็นทรัล ศรีราชา” ต้นแบบโครงการมิกซ์ยูสแห่งอนาคต 4,200 ล้าน ใหญ่และครบครันที่สุดในภาคตะวันออก","• ยก Success Model จากเซ็นทรัล อีสต์วิลล์มาไว้ที่ศรีราช […] อ่านข่าวต้นฉบับ: เปิดแล้ว! “เซ็นทรัล ศรีราชา” ต้นแบบโครงการมิกซ์ยูสแห่งอนาคต 4,200 ล้าน ใหญ่และครบครันที่สุดในภาคตะวันออก",https://www.prachachat.net/public-relations/news-790416,2021_10_27
หมอธีระวัฒน์ ชี้ 7 ข้อห่วง ก่อนเปิดประเทศ 1 พ.ย.,หมอธีระวัฒน์ ชี้ 7 ข้อ เปิดประเทศ 1 พ.ย. น่าเป็นห่วงหรื […] อ่านข่าวต้นฉบับ: หมอธีระวัฒน์ ชี้ 7 ข้อห่วง ก่อนเปิดประเทศ 1 พ.ย.,https://www.prachachat.net/general/news-790397,2021_10_27
เช็กความพร้อมโรงเรียนดัง เปิด-ไม่เปิดเรียนออนไซต์ 1 พ.ย.,จากการที่กระทรวงศึกษาธิการ (ศธ.) ประกาศให้โรงเรียนทุกสั […] อ่านข่าวต้นฉบับ: เช็กความพร้อมโรงเรียนดัง เปิด-ไม่เปิดเรียนออนไซต์ 1 พ.ย.,https://www.prachachat.net/education/news-789706,2021_10_27
วัคซีนโปรตีนซับยูนิตไต้หวัน ได้ร่วมทดลองกับ องค์การอนามัยโลก,วัคซีนโปรตีนซับยูนิต MVC-COV1901 ของบริษัท เมดิเจน ได้ร […] อ่านข่าวต้นฉบับ: วัคซีนโปรตีนซับยูนิตไต้หวัน ได้ร่วมทดลองกับ องค์การอนามัยโลก,https://www.prachachat.net/marketing/news-790334,2021_10_27
Bangkok Bank SME Podcast เปิดโลกธุรกิจเพื่อนใหม่ผ่านเรื่องราวเสียง,Bangkok Bank SME Podcast เปิดโลกธุรกิจเพื่อนใหม่ผ่านเรื […] อ่านข่าวต้นฉบับ: Bangkok Bank SME Podcast เปิดโลกธุรกิจเพื่อนใหม่ผ่านเรื่องราวเสียง,https://www.prachachat.net/public-relations/news-790401,2021_10_27
ส่อง Swensen’s Craft Bar คอนเซปต์ใหม่ สเวนเซ่นส์ สาขาพารากอน,สเวนเซ่นส์ ผุด ไอศกรีม คราฟต์ บาร์ ที่สยามพารากอน คอนเซ […] อ่านข่าวต้นฉบับ: ส่อง Swensen’s Craft Bar คอนเซปต์ใหม่ สเวนเซ่นส์ สาขาพารากอน,https://www.prachachat.net/marketing/news-790644,2021_10_27
