title,summary,link,published
หุ้นไทยปิดตลาดวันนี้ (29 ต.ค.) -0.88 จุด ซื้อขาย 6.6 หมื่นล้าน,หุ้นไทยปิดตลาดวันนี้ (29 ต.ค.) -0.88 จุด ดัชนีอยู่ที่ 1 […] อ่านข่าวต้นฉบับ: หุ้นไทยปิดตลาดวันนี้ (29 ต.ค.) -0.88 จุด ซื้อขาย 6.6 หมื่นล้าน,https://www.prachachat.net/finance/news-792292,2021_10_29
เครือ รพ.บางปะกอก เปิดจองวันฉีด-โอนสิทธิ์ “โมเดอร์นา” เริ่ม 1 พ.ย.,เครือ รพ.บางปะกอก เปิดเช็กลำดับคิว จองวัน-เวลาฉีด-โอนสิ […] อ่านข่าวต้นฉบับ: เครือ รพ.บางปะกอก เปิดจองวันฉีด-โอนสิทธิ์ “โมเดอร์นา” เริ่ม 1 พ.ย.,https://www.prachachat.net/marketing/news-792277,2021_10_29
กอล์ฟไทยแลนด์ โอเพ่น กลับมาในสัปดาห์นี้,ขึ้นแท่นปักที พิศณุ นิลกลัด FB : @Pitsanuofficial &nbsp […] อ่านข่าวต้นฉบับ: กอล์ฟไทยแลนด์ โอเพ่น กลับมาในสัปดาห์นี้,https://www.prachachat.net/guru-sport/golf/news-789087,2021_10_29
บอร์ด บสย. ตั้ง “ธีรัชย์ อัตนวานิช” นั่งเก้าอี้ประธานคนใหม่,บอร์ด บสย. ตั้ง “ธีรัชย์ อัตนวานิช” นั่งเก้ […] อ่านข่าวต้นฉบับ: บอร์ด บสย. ตั้ง “ธีรัชย์ อัตนวานิช” นั่งเก้าอี้ประธานคนใหม่,https://www.prachachat.net/finance/news-792319,2021_10_29
ธปท. ระบุเงินบาทเดือน ต.ค. อ่อนค่าตามบอนด์ยีลด์-เงินเฟ้อสหรัฐฯ,ธปท. เผยค่าเงินบาทเดือนต.ค.ปรับอ่อนค่าตามเงินดอลลาร์ที่ […] อ่านข่าวต้นฉบับ: ธปท. ระบุเงินบาทเดือน ต.ค. อ่อนค่าตามบอนด์ยีลด์-เงินเฟ้อสหรัฐฯ,https://www.prachachat.net/finance/news-792365,2021_10_29
"กสิกรไทย ควัก 32 ล้าน แจกพนักงานคนละ 10,000 หมื่น กำลังใจสู้โควิด","ธนาคารกสิกรไทย ทุ่มกว่า 32 ล้านบาท แจกพนักงานกว่า 32,00 […] อ่านข่าวต้นฉบับ: กสิกรไทย ควัก 32 ล้าน แจกพนักงานคนละ 10,000 หมื่น กำลังใจสู้โควิด",https://www.prachachat.net/finance/news-792331,2021_10_29
“มิชลิน” แตกไลน์กาวติดไม้อัด,มิชลินส่ง “ResiCare” นวัตกรรมสารยึดติดที่ปลอดภัยและเป็น […] อ่านข่าวต้นฉบับ: “มิชลิน” แตกไลน์กาวติดไม้อัด,https://www.prachachat.net/motoring/news-788950,2021_10_29
รัฐวิสาหกิจเบิกจ่ายลงทุนปีงบ’64 ตามเป้า สคร. ลั่นปีงบ’65 ต้องไม่ต่ำ 95%,รัฐวิสาหกิจเบิกจ่ายสิ้นปีงบ 2564 ตามเป้า สูงกว่าปีก่อนห […] อ่านข่าวต้นฉบับ: รัฐวิสาหกิจเบิกจ่ายลงทุนปีงบ’64 ตามเป้า สคร. ลั่นปีงบ’65 ต้องไม่ต่ำ 95%,https://www.prachachat.net/breaking-news/news-792314,2021_10_29
การเคหะแห่งชาติจับมือกับ NIDA พัฒนาบุคลากรด้านการบริหารจัดการสิ่งแวดล้อม,เพื่อนำองค์ความรู้พัฒนาที่อยู่อาศัยสำหรับผู้มีรายได้น้อ […] อ่านข่าวต้นฉบับ: การเคหะแห่งชาติจับมือกับ NIDA พัฒนาบุคลากรด้านการบริหารจัดการสิ่งแวดล้อม,https://www.prachachat.net/public-relations/news-792420,2021_10_29
เศรษฐกิจเดือน ก.ย. ส่งสัญญาณฟื้นตัวตามผ่อนคลายล็อกดาวน์,ธปท.เผยสัญญาณเศรษฐกิจเดือนก.ย.ปรับดีขึ้นทุกตัวตามผ่อนคล […] อ่านข่าวต้นฉบับ: เศรษฐกิจเดือน ก.ย. ส่งสัญญาณฟื้นตัวตามผ่อนคลายล็อกดาวน์,https://www.prachachat.net/finance/news-792393,2021_10_29
“มท.2 ผนึก กปภ. ลงพื้นที่ลพบุรี บรรเทาความเดือดร้อนน้ำท่วม เร่งพัฒนาประปาให้ทั่วถึง”,นายทรงศักดิ์ ทองศรี รัฐมนตรีช่วยว่าการกระทรวงมหาดไทย (ม […] อ่านข่าวต้นฉบับ: “มท.2 ผนึก กปภ. ลงพื้นที่ลพบุรี บรรเทาความเดือดร้อนน้ำท่วม เร่งพัฒนาประปาให้ทั่วถึง”,https://www.prachachat.net/public-relations/news-792447,2021_10_29
CRC บุกตลาด “คริปโตเคอร์เรนซี” เปิดตัว “C-Coin” นำร่องใช้ในองค์กร,“เซ็นทรัล รีเทล” บุกตลาดคริปโตเคอร์เรนซี เปิดตัวสกุลเงิ […] อ่านข่าวต้นฉบับ: CRC บุกตลาด “คริปโตเคอร์เรนซี” เปิดตัว “C-Coin” นำร่องใช้ในองค์กร,https://www.prachachat.net/marketing/news-792467,2021_10_29
บอร์ด PPP จี้เดินหน้าโครงการกลุ่ม High Priority PPP มูลค่า 5 แสนล้าน,บอร์ด PPP เห็นชอบการนำข้อตกลงคุณธรรม (Integrity Pact) ใ […] อ่านข่าวต้นฉบับ: บอร์ด PPP จี้เดินหน้าโครงการกลุ่ม High Priority PPP มูลค่า 5 แสนล้าน,https://www.prachachat.net/breaking-news/news-792392,2021_10_29
ดอลลาร์สหรัฐอ่อนค่า หลังตัวเลขเศรษฐกิจส่งสัญญาณชะลอตัว,ดอลลาร์สหรัฐอ่อนค่า หลังตัวเลขเศรษฐกิจเริ่มส่งสัญญาณชะล […] อ่านข่าวต้นฉบับ: ดอลลาร์สหรัฐอ่อนค่า หลังตัวเลขเศรษฐกิจส่งสัญญาณชะลอตัว,https://www.prachachat.net/finance/news-792472,2021_10_29
“กวีบุ๊ค” อีบุ๊กสัญชาติไทย ธุรกิจที่เริ่มต้นจากข้อจำกัดและความรัก,ตลอด 3-4 ปีที่ผ่านมาธุรกิจสิ่งพิมพ์น่าจะเป็นธุรกิจแรก ๆ […] อ่านข่าวต้นฉบับ: “กวีบุ๊ค” อีบุ๊กสัญชาติไทย ธุรกิจที่เริ่มต้นจากข้อจำกัดและความรัก,https://www.prachachat.net/ict/news-788999,2021_10_29
เกรท วอลล์ เคาะราคา ORA GOOD CAT ต่ำสุด 9.89 แสนบาท,เกรทวอลล์ เคาะราคา ORA GOOD CAT รถยนต์ไฟฟ้า 100% ต่ำสุ […] อ่านข่าวต้นฉบับ: เกรท วอลล์ เคาะราคา ORA GOOD CAT ต่ำสุด 9.89 แสนบาท,https://www.prachachat.net/breaking-news/news-792348,2021_10_29
“เกษตรมหัศจรรย์และวันเส้นทางเศรษฐี” วันแรกคึกคัก! คนแห่ชมไม้ด่างหายากสุดอลังการ,เปิด “เกษตรมหัศจรรย์และวันเส้นทางเศรษฐี” วันแรกคึกคัก! […] อ่านข่าวต้นฉบับ: “เกษตรมหัศจรรย์และวันเส้นทางเศรษฐี” วันแรกคึกคัก! คนแห่ชมไม้ด่างหายากสุดอลังการ,https://www.prachachat.net/spinoff/lifestyle/news-792516,2021_10_29
“สยามสะเต๊ค” ลุยแฟรนไชส์ สารพัดโมเดลปูพรมทุกพื้นที่,สยามสะเต๊คเร่งเครื่องสู้พิษโควิด เดินหน้ายกทัพเบอร์เกอร […] อ่านข่าวต้นฉบับ: “สยามสะเต๊ค” ลุยแฟรนไชส์ สารพัดโมเดลปูพรมทุกพื้นที่,https://www.prachachat.net/marketing/news-789120,2021_10_29
