title,summary,link,published
บริษัทลูก MILL จับมือ AFIN พัฒนาแพลตฟอร์มซื้อขาย Carbon Credit ด้วยคริปโต,AFIN (เอฟิน) ร่วมจับมือกับ บริษัท มูนช็อต เวนเจอร์ แคปปิตอล จำกัด ที่ดำเนินธุรกิจร่วมลงทุนในสตาร์ทอัพผู้คิดค้นและพัฒนาเทคโนโลยีชั้นสูง และ บริษัท ซันเทค รีไซเคิล แอนด์ ดีคาร์บอน ที่ทำธุรกิจด้านการดูแลสิ่งแวดล้อม นอกจากนี้ยังเป็นศูนย์กลางการรีไซเคิลขยะอุตสาหกรรม โดยเป็นบริษัทย่อยของ บริษัท มิลล์คอน สตีล จำกัด​ (มหาชน) หรือ MILL พร้อมเดินหน้าพัฒนาแพลตฟอร์มการซื้อขาย Carbon Credit ด้วยคริปโตฯทำให้องค์กรทั้งเล็กและใหญ่สามารถเข้าถึงการเป็น Net Zero หรือองค์กรที่มีการปล่อยก๊าซเรือนกระจกสุทธิเป็นศูนย์ ซึ่งเป็นเป้าหมายของหลายองค์กรทั้งในและต่างประเทศ ทั้งยังเป็นเรื่องสำคัญระดับนานาชาติอีกด้วย นับว่าเป็นก้าวสำคัญเพื่อการเติบโตที่แข็งแกร่งและยั่งยืนในอนาคตโดยให้ความสำคัญกับการดูแลสิ่งแวดล้อม นายเซบาสเตียน โจแฮนส์สัน ผู้อำนวยการใหญ่ภูมิภาคเอเชียตะวันออกเฉียงใต้ AFIN แพลตฟอร์มสะพานในการเชื่อมต่อโลกของคริปโตฯ และความยั่งยืนให้ก้าวไปด้วยกัน กล่าวว่า “เป็นที่ทราบดีว่าปัจจุบัน ปัญหาโลกร้อนได้ส่งผลกระทบกับชีวิตคนทั่วทุกมุมโลก ไม่ว่าจะเป็นฤดูการที่แปรปรวน ฝนตกไม่ตามฤดู อากาศหนาวจัด หรือร้อนจัดในบางพื้นที่สิ่งเหล่านี้เป็นผลมาจากการที่เราดำเนินชีวิตและพัฒนาโลกโดยที่ไม่คำนึงถึงสิ่งแวดล้อมมาเป็นระยะเวลานานไม่ว่าจะเป็นการทำเหมืองการผลิตพลังงานไฟฟ้าจากถ่านหินการขุดน้ำมันหรือการใช้รถซึ่งปล่อยก๊าซคาร์บอนมอนนอกไซด์ออกมาทำลายชั้นบรรยากาศ นับวันผลกระทบเหล่านี้ยิ่งทวีความรุณแรงมากยิ่งขึ้น ทั้งนี้ผู้นำแต่ละชาติและบริษัทต่าง ๆ เริ่มเล็งเห็นความสำคัญที่จะมีส่วนลดการปล่อยก๊าซเรือนกระจกเพื่อลดหรือชะลอความเสียหายที่เกิดขึ้นกับธรรมชาติให้ได้มากที่สุด นำมาสู่แนวคิดของการเป็น Net Zero […] The post บริษัทลูก MILL จับมือ AFIN พัฒนาแพลตฟอร์มซื้อขาย Carbon Credit ด้วยคริปโต appeared first on สำนักข่าวอินโฟเควสท์.,https://www.infoquest.co.th/2021/143006,2021_11_06
นายกฯย้ำให้สธ.เร่งดำเนินการสั่งซื้อยาเม็ดรักษาโควิด-หวังได้เป็นคิวแรก ๆ,นายประยุทธ์ จันทร์โอชา นายกรัฐมนตรี ได้โพสข้อความทางสื่อออนไลน์ว่า เมื่อวานนี้ (5 พ.ย.) บริษัทไฟเซอร์เพิ่งประกาศความสำเร็จในการพัฒนายารักษาโควิด-19 ที่มีชื่อว่า “แพกซ์โลวิด” (Paxlovid) ช่วยลดการรักษาตัวในโรงพยาบาล และลดการเสียชีวิตในผู้ป่วยที่มีความเสี่ยงสูงได้ ซึ่งก่อนหน้านี้ (4 พ.ย.64) ที่ประเทศอังกฤษ ก็เพิ่งประกาศอนุญาตให้ใช้ยาเม็ดรักษาโควิด “โมลนูพิราเวียร์” ของบริษัทเมอร์คได้ แต่กว่ายาเหล่านี้ จะเริ่มมีออกมาให้ใช้ก็คงจะเป็นในช่วงต้นปีหน้าครับ โดยผมได้เน้นย้ำกับทางกระทรวงสาธารณสุขไปแล้ว ว่าให้เร่งดำเนินการในทันที เพื่อสั่งซื้อยาตั้งแต่ตอนนี้ จะได้เป็นคิวแรก ๆ สถานการณ์แพร่ระบาดโควิดของบ้านเราในปัจจุบัน มีแนวโน้มที่ดี อยู่ภายใต้การควบคุม ซึ่งเราคนไทยทุกคนยังคงต้องช่วยกันคนละไม้คนละมือ รักษาวินัยของตัวเองอย่างเคร่งครัด สวมหน้ากากอนามัยอยู่เสมอ และเว้นระยะห่างทางสังคมต่อไปนะครับ ทั้งนี้ช่วงสัปดาห์ที่ผ่านมาเราคงได้รับทราบข่าวสารว่าหลายประเทศในยุโรปมีจำนวนผู้ติดเชื้อรายใหม่กลับมาพุ่งสูงขึ้นอีก ซึ่งองค์การอนามัยโลกประเมินว่า สาเหตุมาจากการที่ผู้คนเริ่มหละหลวม ไม่สวมหน้ากากอนามัย และไม่เว้นระยะห่างทางสังคม ดังนั้นผมจึงขอความร่วมมือให้พี่น้องชาวไทยทุกคนช่วยกันรักษาวินัยต่อไปด้วยครับ “สุดท้ายนี้ ผมขอเน้นย้ำเจ้าหน้าที่ที่ควบคุมดูแลในทุกขั้นตอนของการเข้าประเทศ รวมทั้งตรวจตราการลักลอบเข้าเมืองโดยผิดกฎหมาย ทั้งทางบก ทางน้ำ และทางอากาศ ให้ปฏิบัติหน้าที่อย่างเข้มงวดและไม่ประมาท ขอบคุณที่ทุกคนทำงานด้วยความเสียสละทุ่มเท เพื่อให้ประเทศไทยของเราสามารถเดินหน้าต่อไปได้ บนเส้นทางที่จะไปสู่การพลิกฟื้นเศรษฐกิจกลับคืนมา และทำมาหากินได้อีกครั้งแบบ New normal ครับ” […] The post นายกฯย้ำให้สธ.เร่งดำเนินการสั่งซื้อยาเม็ดรักษาโควิด-หวังได้เป็นคิวแรก ๆ appeared first on สำนักข่าวอินโฟเควสท์.,https://www.infoquest.co.th/2021/143009,2021_11_06
AIIB ยันให้เงินสนับสนุนประเทศกำลังพัฒนาจัดหาวัคซีนป้องกันโควิดในปีหน้า,ผู้บริหารระดับสูงของธนาคารเพื่อการลงทุนโครงสร้างพื้นฐานเอเชีย (AIIB) ซึ่งจีนสนับสนุนเปิดเผยว่า AIIB จะยังคงให้เงินสนับสนุนประเทศกำลังพัฒนาในการจัดหาวัคซีนป้องกันโรคโควิด-19 สำนักข่าวรอยเตอร์รายงานว่า เมื่อปีที่แล้ว AIIB ได้จัดตั้งกองทุนเพื่อช่วยเหลือภาครัฐและภาคเอกชนในการต่อสู้กับโรคระบาด โดย ณ วันที่ 5 พ.ย. AIIB ได้อนุมัติโครงการช่วยเหลือไปแล้ว 42 โครงการ มูลค่ากว่า 1.03 หมื่นล้านดอลลาร์ ศูนย์กู้วิกฤต (Crisis Recovery Facility) ของ AIIB ได้จัดสรรเงินถึง 1.3 หมื่นล้านดอลลาร์แล้วเพื่อสนับสนุนสมาชิกของ AIIB และลูกค้าในการรับมือกับผลกระทบทางเศรษฐกิจและสุขภาพที่เกิดจากวิกฤตโควิด-19 นายแดนนี อเล็กซานเดอร์ รองประธานด้านนโยบายและกลยุทธ์ของ AIIB เปิดเผยกับรอยเตอร์นอกรอบการประชุม COP26 ที่เมืองกลาสโกว์ว่า เงินทุนสนับสนุนด้านวัคซีนมีผลกระทบด้านการพัฒนาอย่างมาก “สิ่งอื่นๆ เหล่านี้ทั้งหมด (เงินทุนด้านสิ่งแวดล้อม) ที่เรากำลังพูดถึง จะไม่เกิดขึ้น จนกว่าคุณจะสามารถควบคุมการระบาดใหญ่ได้” นายอเล็กซานเดอร์กล่าว โดย สำนักข่าวอินโฟเควสท์ (06 พ.ย. 64) The post AIIB ยันให้เงินสนับสนุนประเทศกำลังพัฒนาจัดหาวัคซีนป้องกันโควิดในปีหน้า appeared first on สำนักข่าวอินโฟเควสท์.,https://www.infoquest.co.th/2021/143012,2021_11_06
โฆษกรัฐบาลเผยภาพรวมฉีดวัคซีนเด็กนักเรียนแล้ว 3.11 ล้านราย คิดเป็นกว่า  80%,"นายธนกร วังบุญคงชนะ โฆษกประจำสำนักนายกรัฐมนตรี เปิดเผยว่า พลเอกประยุทธ์ จันทร์โอชา นายกรัฐมนตรี และรัฐมนตรีว่าการกระทรวงกลาโหม ติดตามผลการเปิดการเรียนการสอนในรูปแบบปกติของนักเรียนทุกระดับชั้น ภายใต้สถานการณ์การแพร่ระบาดของโควิด-19 กำชับกระทรวงศึกษาธิการและกระทรวงสาธารณสุข เน้นมาตรการลดความเสี่ยงในการแพร่ระบาด สร้างความปลอดภัยแก่นักเรียนทุกระดับชั้น พร้อมเดินหน้าฉีดวัคซีนให้นักเรียนและบุคลากรการศึกษาให้ครอบคลุมมากที่สุด ทั้งนี้ กระทรวงศึกษาธิการ รายงานข้อมูล ณ 2 พฤศจิกายน มีโรงเรียนที่เปิดภาคเรียน On Site แล้วตั้งแต่วันที่ 1 พ.ย. ที่ผ่านมา กว่า 12,110 แห่ง จากจำนวนโรงเรียนทุกสังกัดทั้งหมด 35,193 โรงเรียน สำหรับโรงเรียนที่มีความพร้อม จะมีการหารือร่วมกันระหว่างครู นักเรียนและผู้ปกครอง เพื่อเปิดการเรียนการสอนแบบปกติในระยะต่อไป ขณะนี้หลายโรงเรียนยังมีรูปแบบการเรียนผสมผสาน ทั้ง onsite+online และ รูปแบบ onsite+onhand ด้วย นายธนกร กล่าวว่า ล่าสุด กระทรวงสาธารณสุขยังให้โรงเรียนทุกแห่งยึดปฏิบัติตาม 6 มาตรการหลัก (DMHT-RC) เพิ่ม 6 มาตรการเสริม และมี […] The post โฆษกรัฐบาลเผยภาพรวมฉีดวัคซีนเด็กนักเรียนแล้ว 3.11 ล้านราย คิดเป็นกว่า 80% appeared first on สำนักข่าวอินโฟเควสท์.",https://www.infoquest.co.th/2021/143019,2021_11_06
สภาผู้แทนฯสหรัฐไฟเขียวกม.ใช้จ่ายด้านโครงสร้างพื้นฐาน ส่งต่อไบเดนลงนาม,สภาผู้แทนราษฎรสหรัฐได้อนุมัติกฎหมายการใช้จ่ายด้านโครงสร้างพื้นฐาน (Bipartisan Infrastructure Framework – BIF) มูลค่ากว่า 1 ล้านล้านดอลลาร์แล้วในวันศุกร์ (5 พ.ย.) ตามเวลาสหรัฐ และส่งต่อให้ประธานาธิบดีโจ ไบเดน เพื่อลงนามบังคับใช้ต่อไป สำนักข่าวซีเอ็นบีซีรายงานว่า สภาผู้แทนฯ สหรัฐลงมติอนุมัติกฎหมายดังกล่าวด้วยคะแนนเสียง 228 ต่อ 206 เสียง โดยสมาชิกพรรครีพับลิกัน 3 คนลงมติสนับสนุนกฎหมายดังกล่าว ขณะที่สมาชิกพรรคเดโมแครต 6 คนลงมติคัดค้าน ทั้งนี้ คาดว่าปธน.ไบเดนจะลงนามบังคับใช้กฎหมายดังกล่าวภายในไม่กี่วันข้างหน้านี้ ส่วนวุฒิสภาสหรัฐได้อนุมัติกฎหมายดังกล่าวตั้งแต่เดือนส.ค.ที่ผ่านมา โดย สำนักข่าวอินโฟเควสท์ (06 พ.ย. 64) The post สภาผู้แทนฯสหรัฐไฟเขียวกม.ใช้จ่ายด้านโครงสร้างพื้นฐาน ส่งต่อไบเดนลงนาม appeared first on สำนักข่าวอินโฟเควสท์.,https://www.infoquest.co.th/2021/143016,2021_11_06
"ธ.ก.ส.พร้อมจ่ายประกันรายได้เกษตรกรผู้ปลูกข้าว ปี 64/65 วงเงิน 13,225 ลบ.","นายสมเกียรติ กิมาวหา รองผู้จัดการธนาคารเพื่อการเกษตรและสหกรณ์การเกษตร (ธ.ก.ส.) เปิดเผยว่า ตามที่คณะกรรมการ ธ.ก.ส. ในการประชุมเมื่อวันที่ 28 ต.ค.64 และมติคณะรัฐมนตรีเมื่อวันที่ 4 พ.ย.64 ซึ่งเสนอโดยกระทรวงพาณิชย์ เห็นชอบให้ ธ.ก.ส. ดำเนินโครงการประกันรายได้เกษตรกรผู้ปลูกข้าว ปี 2564/65 วงเงินรวม 13,225 ล้านบาท เพื่อช่วยเหลือเกษตรกรผู้ปลูกข้าว และป้องกันความเสี่ยงด้านราคาไม่ให้ประสบปัญหาขาดทุน ลดภาระค่าใช้จ่ายในการแก้ไขปัญหาราคาผลผลิตตกต่ำจากสถานการณ์เศรษฐกิจโลก การแพร่ระบาดของเชื้อไวรัสโควิด-19 และอุทกภัย โดยที่กลไกตลาดยังคงทำงานเป็นปกติ โดยประกันรายได้แก่เกษตรกรผู้ปลูกข้าว 5 ชนิด ได้แก่ ข้าวเปลือกหอมมะลิ ตันละ 15,000 บาท ครัวเรือนละไม่เกิน 14 ตัน ข้าวเปลือกหอมมะลินอกเขต ตันละ 14,000 บาท ครัวเรือนละไม่เกิน 16 ตัน ข้าวเปลือกเจ้า ตันละ 10,000 บาท ครัวเรือนละไม่เกิน 30 ตัน ข้าวเปลือกหอมปทุมธานี ตันละ […] The post ธ.ก.ส.พร้อมจ่ายประกันรายได้เกษตรกรผู้ปลูกข้าว ปี 64/65 วงเงิน 13,225 ลบ. appeared first on สำนักข่าวอินโฟเควสท์.",https://www.infoquest.co.th/2021/143022,2021_11_06
GPSC ปรับกลยุทธ์ดำเนินธุรกิจสอดรับแผนพลังงานชาติมุ่งสู่พลังงานสะอาด,นายวรวัฒน์ พิทยศิริ ประธานเจ้าหน้าที่บริหารและกรรมการผู้จัดการใหญ่ บมจ. โกลบอล เพาเวอร์ ซินเนอร์ยี่ (GPSC) เปิดเผยว่า ในระยะยาว บริษัทฯ ได้ปรับกลยุทธ์การดำเนินธุรกิจที่สอดรับกับแผนพลังงานชาติ (National Energy Plan) ที่มุ่งสู่พลังงานสะอาดในการลดภาวะโลกร้อน โดย GPSC มีเป้าหมายที่จะก้าวสู่การเป็นบริษัทชั้นนำด้านนวัตกรรมพลังงานเพื่อความยั่งยืน 1 ใน 3 ของเอเชียตะวันออกเฉียงใต้ ที่มีสัดส่วนของพลังงานสะอาดมากกว่า 50% ผ่าน 4 กลยุทธ์หลักหรือ 4S ประกอบด้วย S1: Strengthen and Expand the Core S2: Scale–up Green Energy S3: S-Curve & Batteries และ S4: Shift to Customer–centric Solutions ล่าสุดบริษัทฯ ได้ลงนามในความร่วมมือกับ บริษัท ผลิตไฟฟ้าและพลังงานร่วม จำกัด […] The post GPSC ปรับกลยุทธ์ดำเนินธุรกิจสอดรับแผนพลังงานชาติมุ่งสู่พลังงานสะอาด appeared first on สำนักข่าวอินโฟเควสท์.,https://www.infoquest.co.th/2021/143026,2021_11_06
"ศบค.เผยยอดฉีดวัคซีน 5 พ.ย.64 เพิ่มขึ้น 861,848 โดส","ศูนย์บริหารสถานการณ์โควิด-19 (ศบค.) รายงานยอดการฉีดวัคซีนโควิด-19 ให้แก่ประชาชนในวันที่ 5 พ.ย.64 มีจำนวนผู้ได้รับวัคซีน 861,848 โดส รายละเอียดดังนี้ โดย สำนักข่าวอินโฟเควสท์ (06 พ.ย. 64) The post ศบค.เผยยอดฉีดวัคซีน 5 พ.ย.64 เพิ่มขึ้น 861,848 โดส appeared first on สำนักข่าวอินโฟเควสท์.",https://www.infoquest.co.th/2021/143030,2021_11_06
