title,summary,link,published
FPT ผุดมิกซ์ยูสพันธุ์ใหม่ Silom Edge เปิดเกมรุกแลนด์มาร์คหัวมุมถนนสีลม,"นายธนพล ศิริธนชัย ประธานเจ้าหน้าที่บริหาร บมจ.เฟรเซอร์ส พร็อพเพอร์ตี้ (ประเทศไทย) (FPT) กล่าวว่า บริษัทได้เปิดตัวโครงการมิกซ์ยูสแห่งใหม่ Silom Edge มูลค่าโครงการกว่า 1.8 พันล้านบาท บนที่ดินเช่าจากสำนักงานทรัพย์สินส่วนพระมหากษัตริย์ ระยะเวลาเช่า 30 ปีหัวมุมถนนสีลม ซึ่งเคยเป็นที่ตั้งของห้างสรรพสินค้าโรบินสัน โครงการ Silom Edge เป็นโครงการ Re-development แห่งแรกของ FPT ที่จะมาเสริมความแข็งแกร่งและกระจายความเสี่ยง พร้อมเพิ่มสัดส่วนของรายได้ประจำ (Recurring Income) ให้แก่พอร์ตฯคอมเมอร์เชียลของบริษัท เนื่องจากมีพื้นที่โครงการเป็นสำนักงานให้เช่า 12,000 ตารางเมตร และ พื้นที่ค้าปลีกให้เช่า 10,000 ตารางเมตร คาดว่าจะเริ่มรับรู้รายได้ตั้งแต่ไตรมาส 4/65 เป็นต้นไป บริษัทเล็งเห็นถึงศักยภาพของที่ตั้งโครงการที่อยู่หัวมุมถนนสีลม ซึ่งเป็นสุดยอดทำเลใจกลาง CBD เชื่อมต่อกับทั้งรถไฟฟ้า BTS และ MRT และยังเคยเป็นแลนด์มาร์คสำคัญของกรุงเทพฯ และเป็นที่ตั้งของบริษัทชั้นนำหลายแห่ง ทำให้ถนนสีลมเป็นหนึ่งในถนนเศรษฐกิจสำคัญของประเทศ และเกิดการพัฒนาอย่างต่อเนื่อง จึงทำให้ปัจจุบันไม่มีที่ดินว่างมากพอสำหรับพัฒนาโครงการใหม่ บริษัทจึงตัดสินใจเข้าลงทุนในทรัพย์สินนี้เมื่อช่วงต้นปีที่ผ่านมาเพื่อพัฒนาเป็นโครงการมิกซ์ยูส สอดคล้องกับกลยุทธ์การสร้างความเติบโตอย่างยั่งยืนให้แก่องค์กร […] The post FPT ผุดมิกซ์ยูสพันธุ์ใหม่ Silom Edge เปิดเกมรุกแลนด์มาร์คหัวมุมถนนสีลม appeared first on สำนักข่าวอินโฟเควสท์.",https://www.infoquest.co.th/2021/136974,2021_10_19
รมว.ดีอีเอส ประสานธปท.ปิดช่องว่างโอนเงินผ่านทำธุรกรรมออนไลน์,นายชัยวุฒิ ธนาคมานุสรณ์ รมว.ดิจิทัลเพื่อเศรษฐกิจและสังคม (ดีอีเอส) ชี้แจงกรณีบัญชีธนาคารหลายแห่งถูกแฮกพร้อมกันเป็นจำนวนมากว่า ไม่ใช่เป็นการถูกแฮกบัญชี เพราะระบบการโอนเงินจ่ายเงินของธนาคารยังมั่นคง ปลอดภัย แต่สิ่งเกิดขึ้นคือการนำเอาข้อมูลบัตรเครดิตและบัตรเดบิตไปใช้โดยเจ้าของบัตรไม่รู้ ทั้งนี้ ตำรวจกำลังสืบสวนสอบสวนว่าคนร้ายนำข้อมูลจากแพลตฟอร์มใด แต่ถือว่ามีความผิดต้องนำตัวดำเนินคดี ทั้งนี้ นายชัยวุฒิ เชื่อว่า น่าจะมีผู้กระทำความผิดมีทั้งในและต่างประเทศ เพราะปัจจุบันมีการใช้จ่ายเงินผ่านระบบออนไลน์มากขึ้น โดย พล.อ.ประยุทธ์ จันทร์โอชา นายกรัฐมนตรี ได้กำชับนำผู้กระทำความผิดมาลงโทษให้ได้ และเน้นย้ำต้องกำกับดูแลการทำธุรกิจ และการทำธุรกรรมผ่านออนไลน์ ต้องมีมาตรฐานตรวจสอบได้ มีระบบการรับ-ชำระเงิน ที่น่าเชื่อถือ เช่นต้องมีการยืนยันรหัส OTP ในการจ่ายเงิน หากไม่มีการส่งรหัสจะต้องมีการแจ้งเตือนอื่นๆ พร้อมขอฝากเตือนไปยังประชาชนหากจะใช้บัตรเครดิต บัตรเดบิตของธนาคารใด ให้ตรวจสอบระบบการป้องกันว่าเพียงพอหรือไม่ นอกจากนี้ ตนเองได้หารือร่วมกับธนาคารแห่งประเทศไทย (ธปท.) ในการปรับปรุงช่องว่างโดยเฉพาะการโอนเงินจำนวนน้อย ที่มองว่าไม่สำคัญ แต่อาจเป็นช่องว่างให้มิจฉาชีพหาประโยชน์จากตรงนี้ ดังนั้นจะต้องมีการตรวจสอบโดยเฉพาะการโอนเงินหลายครั้งจะต้องมีการปิดกั้นด้วยเพราะถือเป็นความผิดปกติ ขณะที่การปรับปรุงกฎหมายเพื่อคุ้มครองประชาชนนั้น นายชัยวุฒิ ระบุว่า ขณะนี้ร่างพระราชกฤษฎีกา กำกับควบคุมแพลตฟอร์มดิจิทัลธุรกิจออนไลน์ได้ยกร่างเสร็จแล้ว แต่รอเข้าที่ประชุมคณะรัฐมนตรี (ครม.) พิจารณา ซึ่งหลักการคืออยากให้แพลตฟอร์มดิจิทัลที่ทำธุรกิจออนไลน์กับประชาชนต้องมาจดแจ้งการการประกอบธุรกิจจะได้กำกับกับดูแลได้ รวมถึงจะมีมาตรการเบื้องต้นที่ธุรกิจต้องถูกกฎหมาย มีระบบการยืนยันตัวตนของผู้ซื้อขาย มีระบบการชำระเงินเชื่อถือได้ นอกจากนี้ แพลตฟอร์มออนไลน์ของต่างประเทศที่จะทำธุรกิจกับคนไทยนั้น […] The post รมว.ดีอีเอส ประสานธปท.ปิดช่องว่างโอนเงินผ่านทำธุรกรรมออนไลน์ appeared first on สำนักข่าวอินโฟเควสท์.,https://www.infoquest.co.th/2021/136981,2021_10_19
กทม. เตือนชุมชนนอกคันกั้นแม่น้ำเจ้าพระยา 23-30 ต.ค. ระดับน้ำสูงขึ้น,"พล.ต.อ.อัศวิน ขวัญเมือง ผู้ว่าราชการกรุงเทพมหานคร (กทม.) เปิดเผยถึงสถานการณ์น้ำเหนือไหลผ่านเขื่อนเจ้าพระยาว่า ตามที่กองอำนวยการน้ำแห่งชาติ (กอนช.) ได้ประเมินและวิเคราะห์ปริมาณฝนตก (ONE MAP) ร่วมกับกรมอุตุนิยมวิทยา และสถาบันสารสนเทศทรัพยากรน้ำ (องค์การมหาชน) คาดการณ์ปริมาณน้ำหลากจากตอนบนของลุ่มน้ำเจ้าพระยาจากแม่น้ำปิง ในช่วงวันที่ 23 – 30 ต.ค.64 ระดับน้ำในแม่น้ำเจ้าพระยาบริเวณท้ายเขื่อนเจ้าพระยา มีระดับน้ำเพิ่มสูงขึ้นจากปัจจุบัน ประมาณ 0.20-0.40 เมตร จึงขอให้ชุมชนที่อยู่นอกคันกั้นน้ำแม่น้ำเจ้าพระยา 11 ชุมชน 239 ครัวเรือน ในพื้นที่ 7 เขต ติดตามสถานการณ์น้ำอย่างใกล้ชิด ทั้งนี้ กทม. ได้เตรียมพร้อมรับสถานการณ์น้ำโดยตรวจสอบความแข็งแรงและจุดรั่วซึมของแนวป้องกันน้ำท่วมริมแม่น้ำเจ้าพระยา ตั้งแต่สะพานพระราม 7 จนถึงบางนา ความยาวประมาณ 78.93 กิโลเมตร และเรียงกระสอบทรายเป็นเขื่อนชั่วคราวในบริเวณที่ไม่มีแนวป้องกันน้ำถาวร (แนวฟันหลอ) และบริเวณแนวป้องกันที่มีระดับต่ำตามจุดต่างๆ 14 จุด รวมระยะทาง 2,512 เมตร พร้อมทั้งตรวจสอบความพร้อมของสถานีสูบน้ำริมแม่น้ำเจ้าพระยา จำนวน 97 สถานี และบ่อสูบน้ำตามแนวริมแม่น้ำเจ้าพระยาทั้งสองฝั่งในช่วงน้ำทะเลขึ้น […] The post กทม. เตือนชุมชนนอกคันกั้นแม่น้ำเจ้าพระยา 23-30 ต.ค. ระดับน้ำสูงขึ้น appeared first on สำนักข่าวอินโฟเควสท์.",https://www.infoquest.co.th/2021/136993,2021_10_19
KTB เตือนระวังมิจฉาชีพแอบอ้างโครงการ “คนละครึ่ง” ส่ง SMS หลอกขอข้อมูลส่วนตัว,ธนาคารกรุงไทย (KTB) เตือนประชาชนให้ระวังมิจฉาชีพแอบอ้างโครงการคนละครึ่ง โดยมิจฉาชีพจะทำการส่ง SMS หลอกขอข้อมูลส่วนตัว และส่ง ลิงก์ ปลอมให้กรอกข้อมูลเพื่อยืนยันตัวตน เพื่อนำไปทุจริตโอนเงินออกจากบัญชี สำหรับกลโกงของมิจฉาชีพ ได้แก่ 1. มิจฉาชีพส่ง SMS แนบลิงก์ แอบอ้างโครงการคนละครึ่ง 2. เหยื่อสนใจรีบคลิกลิงก์ 3. กรอกข้อมูลส่วนตัว และข้อมูลทางการเงิน เช่น เลขที่บัตรประชาชน เลขหน้าบัตร ATM 16 หลัก รหัสบัตร ATM และรหัส OTP 4. มิจฉาชีพจะนำข้อมูลไปทุจริตโอนเงินออกจากบัญชี อย่างไรก็ดี มีแนวทางรับมือเบื้องต้น คือ 1. “ไม่เชื่อ” รัฐบาล และธนาคาร ที่ไม่มีนโยบายขอข้อมูลบัตรเดบิต เช่น เลขบัตร 16 หลัก รหัสกดเงิน เป็นต้น 2. “ไม่บอก” ข้อมูลบัตรเดบิตเป็นความลับ จึงควรเก็บรักษาให้ปลอดภัย 3. “ไม่กรอก” ข้อมูลส่วนตัว […] The post KTB เตือนระวังมิจฉาชีพแอบอ้างโครงการ “คนละครึ่ง” ส่ง SMS หลอกขอข้อมูลส่วนตัว appeared first on สำนักข่าวอินโฟเควสท์.,https://www.infoquest.co.th/2021/136990,2021_10_19
ดัชนี SET ภาคเช้าร่วง 10 จุด รับแรงขายหุ้นบิ๊กแคป,"ตลาดหุ้นไทยภาคเช้าปรับตัวลง 10 จุด จากแรงขายทำกำไรหุ้นขนาดใหญ่ (Big Cap) กลุ่มพลังงาน กลุ่มขนส่ง-AOT หลังก่อนหน้านี้ปรับตัวขึ้นมามาก และไม่มีปัจจัยใหม่เข้ามา เมื่อเวลา 11.49 น.ดัชนี SET อยู่ที่ 1,633.65 จุด ลดลง 10.27 จุด (-0.62%) โดย สำนักข่าวอินโฟเควสท์ (19 ต.ค. 64) The post ดัชนี SET ภาคเช้าร่วง 10 จุด รับแรงขายหุ้นบิ๊กแคป appeared first on สำนักข่าวอินโฟเควสท์.",https://www.infoquest.co.th/2021/137005,2021_10_19
ปภ.เผยภาพรวมน้ำท่วมเริ่มคลี่คลาย เหลือท่วมขังพื้นที่ลุ่มต่ำ 15 จังหวัด,"กรมป้องกันและบรรเทาสาธารณภัย (ปภ.) รายงานว่า ผลกระทบจากอิทธิพลร่องมรสุมพาดผ่านภาคตะวันออก และภาคใต้ตอนบน เข้าสู่หย่อมความกดอากาศต่ำบริเวณประเทศลาวตอนบน และประเทศเวียดนามตอนกลาง ประกอบกับมรสุมตะวันตกเฉียงใต้กำลังปานกลางพัดปกคลุมทะเลอันดามัน ภาคใต้ และอ่าวไทย ตั้งแต่วันที่ 17-18 ต.ค.64 ส่งผลให้เกิดน้ำท่วมฉับพลัน น้ำป่าไหลหลาก 9 จังหวัด ได้แก่ ขอนแก่น ชัยภูมิ บุรีรัมย์ ศรีสะเกษ สระแก้ว ชลบุรี สมุทรปราการ นครปฐม และกาญจนบุรี รวม 26 อำเภอ 71 ตำบล 289 หมู่บ้านประขาชนได้รับผลกระทบ 6,165 ครัวเรือน สถานการณ์คลี่คลายแล้ว 3 จังหวัด ยังคงมีสถานการณ์ 6 จังหวัด 20 อำเภอ 64 ตำบล 282 หมู่บ้าน 6,164 ครัวเรือน ดังนี้ 1.ขอนแก่น น้ำท่วมในพื้นที่อำเภอโคกโพธิ์ไชย ระดับน้ำลดลง 2.ชัยภูมิ […] The post ปภ.เผยภาพรวมน้ำท่วมเริ่มคลี่คลาย เหลือท่วมขังพื้นที่ลุ่มต่ำ 15 จังหวัด appeared first on สำนักข่าวอินโฟเควสท์.",https://www.infoquest.co.th/2021/137001,2021_10_19
เมียนมาเตรียมปล่อยตัวนักโทษการเมืองกว่า 5 พันคน หลังถูกอาเซียนกดดัน,"สื่อท้องถิ่นของเมียนมารายงานในวันนี้ว่า รัฐบาลทหารเมียนมาได้ปล่อยตัวนักโทษการเมืองจำนวนหลายร้อยคนจากเรือนจำอินเส่ง ซึ่งรวมถึงโฆษกพรรคสันนิบาตแห่งชาติเพื่อประชาธิปไตย (NLD) ของนางอองซาน ซูจี และนายซาร์กานาร์ นักแสดงตลกชื่อดังของเมียนมา เพียงไม่นานหลังจากที่นายพลมิน อ่อง หล่าย ผู้นำรัฐบาลทหารพม่าได้กล่าวสุนทรพจน์เมื่อวานนี้ สถานีโทรทัศน์ของรัฐบาลเมียนมาก็ประกาศว่า นักโทษการเมืองกว่า 5,600 คนที่ถูกจับกุมหรือถูกออกหมายจับในข้อหาประท้วงต่อต้านการรัฐประหารนั้น จะได้รับการนิรโทษกรรมด้วยเหตุผลด้านมนุษยธรรม นักเคลื่อนไหวบางคนมองว่า การปล่อยตัวนักโทษการเมืองในครั้งนี้เป็นเพราะรัฐบาลทหารเมียนมาพยายามที่จะกอบกู้ชื่อเสียงในสายตาของนานาประเทศ หลังจากกลุ่มอาเซียนได้ใช้มาตรการกดดันอย่างที่ไม่ค่อยเห็นบ่อยนัก ซึ่งรวมถึงการไม่เชิญผู้นำรัฐบาลทหารพม่าเข้าร่วมการประชุมสุดยอดอาเซียน นายทอม แอนดรูว์ เจ้าหน้าที่พิเศษขององค์การสหประชาชาติ (UN) ได้ทวีตข้อความขานรับการปล่อยตัวนักโทษการเมืองในเมียนมา แต่เขากล่าวว่า “การที่รัฐบาลทหารเมียนมาปล่อยตัวนักโทษไม่ใช่เพราะพวกเขาเปลี่ยนใจ แต่เป็นเพราะถูกกดดัน” กลุ่มอาเซียนแถลงเมื่อวันที่ 16 ต.ค.ว่า อาเซียจะเชิญผู้แทนที่ไม่ได้มาจากฝ่ายการเมืองของเมียนมาให้เข้าร่วมการประชุมสุดยอดผู้นำกลุ่มอาเซียนในวันที่ 26-28 ต.ค.นี้ ซึ่งเท่ากับเป็นการกีดกันทางอ้อมไม่ให้ผู้นำของรัฐบาลทหารเมียนมาเข้าร่วมการประชุมสุดยอด โดยได้ให้เหตุผลว่า รัฐบาลทหารของเมียนมาไม่ปฏิบัติตามแผนสันติภาพที่ได้ตกลงไว้กับอาเซียน การตัดสินใจครั้งนี้นับเป็นความเคลื่อนไหวครั้งสำคัญของอาเซียน ซึ่งที่ผ่านมามักเลือกใช้แนวทางการเจรจา และยึดหลักไม่แทรกแซงกิจการในประเทศ โดย สำนักข่าวอินโฟเควสท์ (19 ต.ค. 64) The post เมียนมาเตรียมปล่อยตัวนักโทษการเมืองกว่า 5 พันคน หลังถูกอาเซียนกดดัน appeared first on สำนักข่าวอินโฟเควสท์.",https://www.infoquest.co.th/2021/136997,2021_10_19
