title,summary,link,published
BYD เผย E-Bus สายแรกนำร่องให้บริการแล้ว 12 คันก่อนเพิ่มครบ 10 สายต้นปี 65,บล.บียอนด์ (BYD) เปิดเผยว่า บริษัท ไทยสมายล์บัส (TSB) ซึ่งเป็นบริษัทที่ BYD เข้าไปลงทุนผ่านบริษัทในกลุ่ม ได้เริ่มนำรถบัสพลังงานไฟฟ้า 100% (E-Bus) ออกให้บริการแล้วตั้งแต่วันที่ 5 ต.ค.ที่ผ่านมา เพื่อพลิกโฉมรถโดยสารในระบบขนส่งมวลชนของกรุงเทพฯ และปริมณฑลให้สะดวกสบายยิ่งขึ้น รวมทั้งก้าวไปสู่การเป็นยานยนต์ไฟฟ้าเชิงพาณิชย์รายแรกในประเทศไทยที่ทันสมัย สะอาด ปลอดภัย และใส่ใจสิ่งแวดล้อม ภายใต้สโลแกน “เดินทางด้วยรอยยิ้ม ใส่ใจสิ่งแวดล้อม” โดยรถ E-Bus นี้ มีการออกแบบให้มีห้องโดยสารกว้างขวาง โล่งโปร่ง สบาย พื้นที่รองรับสำหรับผู้พิการ และวีลล์แชร์ (Wheel Chair) มีจุดชาร์จแบตโทรศัพท์ทุกเสา เพื่ออำนวยความสะดวก อีกทั้งป้องกันการแพร่กระจายของเชื้อโควิด-19 ด้วยเทคโนโลยีที่ทันสมัย และยังมีที่กั้นระหว่างพนักงานขับรถ เพื่อให้มั่นใจในความปลอดภัยอีกด้วย นางสาวออมสิน ศิริ ประธานเจ้าหน้าที่บริหาร BYD กล่าววา ปัจจุบัน TSB นำร่องให้บริการรถบัสไฟฟ้าสายแรกไปแล้วจำนวน 12 คัน และอยู่ระหว่างทยอยนำรถบัสไฟฟ้าเข้ามาใช้ในสายอื่นๆ จนครบ 10 สาย รวมทั้งสิ้น […] The post BYD เผย E-Bus สายแรกนำร่องให้บริการแล้ว 12 คันก่อนเพิ่มครบ 10 สายต้นปี 65 appeared first on สำนักข่าวอินโฟเควสท์.,https://www.infoquest.co.th/2021/137224,2021_10_19
"LEO เล็งเพิ่มเป้ารายได้ปีนี้อีกรอบ,เดินหน้า M&A พร้อมมองโอกาสลงทุน Non-Logistic","นายเกตติวิทย์ สิทธิสุนทรวงศ์ ประธานเจ้าหน้าที่บริหาร บมจ.ลีโอ โกลบอล โลจิสติกส์ (LEO) เปิดเผยว่า บริษัทเตรียมพิจารณาปรับเป้ารายได้ปีนี้อีกครั้งจากที่เคยตั้งไว้ว่าจะเติบโตราว 80-85% หรือมาที่ 2.1-2.2 พันล้านบาท เนื่องจากรายได้ในขณะนี้น่าจะทะลุเป้าเดิมไปแล้ว และสำหรับปี 65 บริษัทตั้งเป้าว่ารายได้จะเติบโตต่อเนื่องราว 20-25% จากปีนี้ โดยมีปัจจัยสำคัญมาจากเศรษฐกิจโลกที่ฟื้นตัวหลังวิกฤติการแพร่ระบาดของเชื้อไวรัสโควิด-19 คลี่คลายลง ส่งผลดีต่อทุกธุรกิจของบริษัททั้งช่องทาง Sea Freight, Air Freight, Integrated Logistics Services และ Self Storage & Container Depot “ช่องทางรายได้จาก Sea Freight คิดเป็นสัดส่วนรายได้หลักของเราราว 82% ซึ่งการที่เศรษฐกิจโลกฟื้นตัว เกิดการจับจ่ายใช้สอยมากขึ้นก็เป็นผลดีต่อเรา เช่น ช่วงโปรโมชั่น 11.11 หรือ 12.12 ร้านค้าต่าง ๆ ก็ต้องสั่งสินค้าจำนวนมากเพื่อตุนของให้เพียงพอกับคำสั่งซื้อ หรืออย่างอินเดียและอินโดนีเซียที่เผชิญวิกฤตโควิด-19 อย่างรุนแรง แต่ตอนนี้สถานการณ์เริ่มกลับมาปกติแล้ว การอุปโภคบริโภคเริ่มกลับมา ทำให้ความต้องการตู้ในการนำเข้าหรือส่งออกมีมากขึ้น” […] The post LEO เล็งเพิ่มเป้ารายได้ปีนี้อีกรอบ,เดินหน้า M&A พร้อมมองโอกาสลงทุน Non-Logistic appeared first on สำนักข่าวอินโฟเควสท์.",https://www.infoquest.co.th/2021/137222,2021_10_19
นายกฯ ลงพื้นที่ติดตามสถานการณ์น้ำ จ.สิงห์บุรี พรุ่งนี้,นายธนกร วังบุญคงชนะ โฆษกประจำสำนักนายกรัฐมนตรี กล่าวว่า ในวันที่ 20 ต.ค.นี้ พล.อ.ประยุทธ์ จันทร์โอชา นายกรัฐมนตรีและรมว.กลาโหม เตรียมลงพื้นที่จังหวัดสิงห์บุรีร่วมกับนายชัยวุฒิ ธนาคมานุสรณ์ รมว.ดิจิทัลเพื่อเศรษฐกิจและสังคม (ดีอีเอส) เพื่อติดตามและตรวจเยี่ยมสถานการณ์อุทกภัย พร้อมมอบถุงยังชีพให้กับผู้ประสบภัยน้ำท่วม โดยนายกรัฐมนตรีจะนั่งเรือท้องแบนลงพื้นที่ประสบอุทกภัยชุมชนบางแคใน ใต้สะพานบางระจัน อำเภอเมือง จังหวัดสิงห์บุรี เพื่อตรวจเยี่ยมให้กำลังใจและมอบถุงยังชีพให้ผู้ประสบภัยในชุมชนซึ่งประสบปัญหาระดับน้ำท่วมสูง จากนั้น นายกรัฐมนตรีจะเดินทางไปตรวจสภาพพนังกั้นน้ำริมแม่น้ำเจ้าพระยา บริเวณวัดเฉลิมมาศ ตำบลอินทร์บุรี เสร็จแล้ว จะเป็นประธานเปิดโครงการ “ส่งสุขภาพดีให้คนไทย#จากใจไปรษณีย์ไทย Delivers Wellness” ก่อนเดินทางกลับกรุงเทพมหานคร นายธนกร กล่าวว่า สถานการณ์ปัจจุบันมีหลายพื้นที่ประสบอุทกภัย ซึ่งนายกรัฐมนตรีพยายามหาโอกาสลงไปติดตามสถานการณ์ด้วยตนเอง พร้อมกำชับส่วนราชการในพื้นที่เร่งช่วยเหลือผู้ประสบภัยในพื้นที่เพื่อบรรเทาความเดือดร้อนในเบื้องต้น ยืนยัน รัฐบาลไม่ได้นิ่งนอนใจต่อปัญหาความเดือดร้อนของประชาชน ทั้งนี้ นายกรัฐมนตรี ได้มีการสั่งการเร่งสำรวจพื้นที่น้ำลด สำรวจความเสียหาย เพื่อช่วยเหลือเยียวยาผู้ได้รับผลกระทบจากน้ำท่วม ขณะเดียวกันขอให้เก็บกักน้ำในพื้นที่แก้มลิง พร้อมกับสั่งการให้หน่วยงานที่เกี่ยวข้องเตรียมเครื่องมือ ซึ่งคาดว่า จะมีมวลน้ำส่วนหนึ่งมาที่ภาคกลางตอนล่าง และภาคใต้ โดย สำนักข่าวอินโฟเควสท์ (19 ต.ค. 64) The post นายกฯ ลงพื้นที่ติดตามสถานการณ์น้ำ จ.สิงห์บุรี พรุ่งนี้ appeared first on สำนักข่าวอินโฟเควสท์.,https://www.infoquest.co.th/2021/137202,2021_10_19
มท. ขอถอนวาระโครงการรถไฟฟ้าสายสีเขียวออก เหตุคมนาคมมีข้อทักท้วง,นายวิษณุ เครืองาม รองนายกรัฐมนตรี กล่าวถึงการที่คณะรัฐมนตรี (ครม.) ยังไม่พิจาณาต่ออายุสัมปทานโครงการรถไฟฟ้าสายสีเขียวที่กระทรวงมหาดไทยเป็นผู้เสนอเข้าสู่ที่ประชุมว่า เนื่องจากมีรายละเอียดที่ยังไม่เรียบร้อย เป็นเรื่องที่กระทรวงคมนาคมได้มีข้อทักท้วงมา และทางกระทรวงมหาดไทยต้องตอบข้อทักท้วงกระทรวงคมนาคมให้ได้เสียก่อน ซึ่งตนเองยังไม่ได้เห็นข้อทักท้วงนั้นว่า เป็นข้อทักท้วงเดิมหรือเรื่องใหม่ นายวิษณุกล่าวว่า ไม่ได้เป็นการดึงวาระดึงออกมา เพียงแต่เมื่อถึงวาระดังกล่าว พล.อ.อนุพงษ์ เผ่าจินดา รมว.มหาดไทย ได้ขอถอนวาระนี้ออกไปเพื่อทำความเห็นเข้ามาใหม่ ซึ่งยังไม่ทราบว่ามีกี่ประเด็น ส่วนจะเสนอเข้ามาใหม่ในสัปดาห์หน้าหรือไม่ขึ้นกับว่าทางกระทรวงมหาดไทยจะทำเสร็จหรือไม่ ซึ่งยังไม่ทราบว่า มีกี่ประเด็นและผู้ที่เกี่ยวข้องยังไม่ได้มาปรึกษาตนเอง โดย สำนักข่าวอินโฟเควสท์ (19 ต.ค. 64) The post มท. ขอถอนวาระโครงการรถไฟฟ้าสายสีเขียวออก เหตุคมนาคมมีข้อทักท้วง appeared first on สำนักข่าวอินโฟเควสท์.,https://www.infoquest.co.th/2021/137239,2021_10_19
ครม.เห็นชอบกรอบเจรจาว่าด้วยการเปลี่ยนแปลงสภาพภูมิอากาศ,น.ส.ไตรศุลี ไตรสรณกุล รองโฆษกประจำสำนักนายกรัฐมนตรี กล่าวว่า ที่ประชุมคณะรัฐมนตรี (ครม.) เห็นชอบกรอบท่าทีเจรจาของไทยในการประชุมกรอบอนุสัญญาสหประชาชาติว่าด้วยการเปลี่ยนแปลงสภาพภูมิอากาศประจำปี 2564 ระหว่างวันที่ 31 ต.ค.-12 พ.ย.64 โดยประเทศไทยให้ความสำคัญกับความเป็นธรรมและความรับผิดชอบร่วมกันในระดับที่แตกต่าง โดยคำนึงถึงขีดความสามารถของแต่ละประเทศ เน้นย้ำให้ประเทศพัฒนาแล้วต้องเป็นผู้นำในการลดการปล่อยก๊าซเรือนกระจก ให้การจัดทำและการดำเนินงานตามการมีส่วนร่วมที่ประเทศกำหนด อยู่ภายใต้หลักการของกรอบอนุสัญญาฯและความตกลงปารีส การกำหนดนโยบายหรือมาตรการด้านการเปลี่ยนแปลงสภาพภูมิอากาศต้องคำนึงถึงผลกระทบด้านเศรษฐกิจ การค้า และสังคมของประเทศกำลังพัฒนา ส่งเสริมบทบาทของภาคป่าไม้และการใช้ประโยชน์ที่ดินทั้งในด้านการกักเก็บคาร์บอนและการปรับตัวต่อผลกระทบจากการเปลี่ยนแปลงสภาพภูมิอากาศ นอกจากนี้ การกำหนดแนวทางและความกลไกความร่วมมือเกี่ยวกับกลไกตลาดและไม่ใช่ตลาดต้องมีความยืดหยุ่น ไม่เป็นภาระเพิ่มเติม ต้องการให้มีการยกระดับการสนับสนุนทางด้านการเงิน เทคโนโลยี และการเสริมสร้างศักยภาพต่อการดำเนินงานด้านการปรับตัวของประเทศกำลังพัฒนา ให้มีการสนับสนุนด้านองค์ความรู้ การวิจัย การเงิน การถ่ายทอดเทคโนโลยี และเสริมสร้างศักยภาพในภาคเกษตรเพื่อลดผลกระทบจากการเปลี่ยนแปลงสภาพภูมิอากาศ ให้ประเทศพัฒนาแล้วเป็นผู้นำและยกระดับการสนับสนุนทางการเงินแก่ประเทศกำลังพัฒนาอย่างเพียงพอ สมดุล และต่อเนื่อง ให้มีการยกระดับศักยภาพของบุคลากร สถาบัน และระบบในประเทศกำลังพัฒนาอย่างบูรณาการและยั่งยืน การกำหนดรายละเอียดของกรอบความโปร่งใสในการดำเนินงานและการสนับสนุนต้องมีความยืดหยุ่นและคำนึงถึงศักยภาพที่แตกต่างของประเทศกำลังพัฒนา ทั้งนี้ประเทศไทยพร้อมจะเป็นประเทศที่ให้และประสานความช่วยเหลือหรือแลกเปลี่ยนประสบการณ์การดำเนินงานการเปลี่ยนแปลงสภาพภูมิอากาศไปยังประเทศกำลังพัฒนาอื่นๆ โดย สำนักข่าวอินโฟเควสท์ (19 ต.ค. 64) The post ครม.เห็นชอบกรอบเจรจาว่าด้วยการเปลี่ยนแปลงสภาพภูมิอากาศ appeared first on สำนักข่าวอินโฟเควสท์.,https://www.infoquest.co.th/2021/137236,2021_10_19
ครม.ไฟเขียวตั้งนิคมฯ ราชทัณฑ์ นำร่อง 4 เรือนจำต้นแบบ,"นายธนกร วังบุญคงชนะ โฆษกประจำสำนักนายกรัฐมนตรี เปิดเผยว่า ที่ประชุมคณะรัฐมนตรี (ครม.) มีมติรับทราบผลการศึกษาแนวทางการจัดตั้งนิคมอุตสาหกรรมราชทัณฑ์ ตามที่กระทรวงยุติธรรมได้ทำการศึกษาแนวทางการจัดตั้งนิคมฯ แนวทางการจัดตั้งนิคมอุตสาหกรรมราชทัณฑ์ มีจุดมุ่งหมายที่จะสร้างคุณภาพชีวิตที่ดีให้แก่ผู้พ้นโทษ สร้างอาชีพในอนาคต โดยกระทรวงยุติธรรมตั้งเป้าหมายที่จะพัฒนาและส่งผู้ที่ได้รับการพักการลงโทษเข้าไปทำงานในสถานประกอบการให้ได้จำนวน 16,000 คน/ปี ซึ่งเมื่อเปรียบเทียบกับงบประมาณที่ภาครัฐจะต้องใช้ในการดูแลผู้ต้องขังที่อยู่ในเรือนจำ เฉลี่ย 21,000 บาท/คน/ปี จะทำให้ภาครัฐประหยัดงบประมาณที่ใช้ดูแลผู้ต้องขังในเรือนจำประมาณ 336 ล้านบาท/ปี และยังสร้างความมั่นคงทางแรงงานให้แก่ผู้ประกอบการด้วย โดยมีพื้นที่นำร่องต้นแบบ 4 แห่ง ได้แก่ 1.เรือนจำจังหวัดสมุทรสาคร (เรือนจำชั่วคราวบางหญ้าแพรก) 2.เรือนจำกลางชลบุรี (เรือนจำชั่วคราวบ้านบึง) 3.เรือนจำกลางสมุทรปราการ (เรือนจำชั่วคราวคลองด่าน) และ4.เรือนจำกลางระยอง (เรือนจำชั่วคราวเขาไม้แก้ว) โดยภาครัฐจะให้การสนับสนุนคัดเลือกผู้ประกอบธุรกิจที่เน้นนวัตกรรม แรงงานใช้ฝีมือและรูปแบบธุรกิจที่ทันสมัย พร้อมให้สิทธิประโยชน์ เพื่อให้เกิดแรงจูงใจของภาคธุรกิจในการร่วมลงทุนแก่ผู้ประกอบการภาคเอกชน ทั้งนี้ ที่ประชุม ครม.มอบหมายให้ กระทรวงยุติธรรม ร่วมกับกระทรวงการคลัง กระทรวงคมนาคม กระทรวงทรัพยากรธรรมชาติและสิ่งแวดล้อม กระทรวงพลังงาน กระทรวงมหาดไทย กระทรวงอุตสาหกรรม สำนักงานคณะกรรมการกฤษฎีกา การนิคมอุตสาหกรรมแห่งประเทศไทย พิจารณาถึงความเป็นไปได้ในการจัดตั้งนิคมฯ โดยคำนึงถึงความคุ้มค่า ต้นทุน ผลประโยชน์ เสถียรภาพ […] The post ครม.ไฟเขียวตั้งนิคมฯ ราชทัณฑ์ นำร่อง 4 เรือนจำต้นแบบ appeared first on สำนักข่าวอินโฟเควสท์.",https://www.infoquest.co.th/2021/137209,2021_10_19
