title,summary,link,published
ราคาถ่านหินจีนดิ่ง 13% เหตุรัฐจ่อแทรกแซงราคาหวังลดวิกฤตพลังงาน,"สัญญาถ่านหินให้ความร้อนของจีนร่วงลง 13% ในวันนี้ โดยปรับตัวลงต่อเนื่องนับตั้งแต่วันอังคาร หลังรัฐบาลจีนส่งสัญญาณว่า จะเข้าแทรกแซงเพื่อชะลอความร้อนแรงของราคาถ่านหินที่พุ่งขึ้น เพื่อช่วยเหลือผู้ผลิตไฟฟ้าให้รอดพ้นจากวิกฤตขาดแคลนพลังงาน สัญญาถ่านหินให้ความร้อนส่งมอบเดือนม.ค.ที่ตลาดสินค้าโภคภัณฑ์เจิ้งโจว ร่วงลงแตะ 1,380.8 หยวนต่อตันในช่วงเช้าวันนี้ และร่วงลงมากกว่า 30% แล้ว นับตั้งแต่แตะระดับสูงเป็นประวัติการณ์เมื่อวันอังคารที่ 1,982 หยวนต่อตัน ราคาถ่านหินโค้กร่วงลง 11% และสัญญาล่วงหน้าถ่านหินโค้ก ร่วงลง 9.5% ที่ตลาดสินค้าโภคภัณฑ์ต้าเหลียนในการซื้อขายช่วงเช้า และร่วงลงมากที่สุด 12% ในการซื้อขายเมื่อวานนี้ วิกฤตพลังงานในจีนซึ่งเกิดจากการขาดแคลนถ่านหิน ทำให้ราคาเชื้อเพลิงพุ่งขึ้นสู่ระดับสูงสุดเป็นประวัติการณ์ท่ามกลางอุปสงค์ด้านอุตสาหกรรมที่เพิ่มขึ้นหลังเกิดโรคระบาด ขณะที่จีนจะเปลี่ยนไปใช้เชื้อเพลิงที่เป็นมิตรกับสิ่งแวดล้อม ทั้งนี้ จีนกำลังผลักดันให้บรรดาผู้ประกอบการเหมืองเพิ่มการผลิตถ่านหิน และเพิ่มการนำเข้า เพื่อให้สถานีไฟฟ้าสามารถเพิ่มสต็อกก่อนฤดูหนาว แต่นักวิเคราะห์คาดว่า การขาดแคลนถ่านหินมีแนวโน้มที่จะดำเนินต่อไปอีกอย่างน้อย 2-3 เดือน โดย สำนักข่าวอินโฟเควสท์ (22 ต.ค. 64) The post ราคาถ่านหินจีนดิ่ง 13% เหตุรัฐจ่อแทรกแซงราคาหวังลดวิกฤตพลังงาน appeared first on สำนักข่าวอินโฟเควสท์.",https://www.infoquest.co.th/2021/138184,2021_10_22
ออสเตรเลียเตรียมเปิดรับผู้ถือวีซ่าจากสิงคโปร์เข้าประเทศ,"นายกรัฐมนตรีสก็อต มอร์ริสันของออสเตรเลียเปิดเผยในวันนี้ว่า ผู้ถือวีซ่าจากสิงคโปร์อาจได้รับอนุญาตให้เข้าประเทศออสเตรเลียได้ในเร็ว ๆ นี้ เนื่องจากออสเตรเลียเตรียมที่จะเปิดพรมแดนระหว่างประเทศในอีกไม่กี่เดือนข้างหน้านี้ นายมอร์ริสันกล่าวกับผู้สื่อข่าวว่า “เราอยู่ในขั้นตอนสุดท้ายของการจัดการร่วมกับรัฐบาลสิงคโปร์ โดยเมื่อไม่กี่เดือนที่ผ่านมา ผมได้พบปะกับนายกรัฐมนตรีของสิงคโปร์เพื่อดำเนินการจัดการครั้งใหม่ ซึ่งเราจะเปิดพรมแดนของเราเร็วขึ้นให้กับสิงคโปร์” “เราคาดว่า การจัดการดังกล่าวจะแล้วเสร็จภายในสัปดาห์หน้า ขณะที่เราจะเปิดรับผู้ถือวีซ่าที่เดินทางมาจากสิงคโปร์” นายมอร์ริสันกล่าวเสริม ทั้งนี้ นายมอร์ริสันไม่ได้ระบุว่านักท่องเที่ยวจากสิงคโปร์จะได้รับอนุญาตให้เดินทางเข้าสู่ออสเตรเลียได้เมื่อใด ขณะที่ผู้ถือวีซ่านั้นอาจหมายถึงนักเรียน, นักธุรกิจ และผู้อพยพที่เป็นแรงงานฝีมือ โดย สำนักข่าวอินโฟเควสท์ (22 ต.ค. 64) The post ออสเตรเลียเตรียมเปิดรับผู้ถือวีซ่าจากสิงคโปร์เข้าประเทศ appeared first on สำนักข่าวอินโฟเควสท์.",https://www.infoquest.co.th/2021/138197,2021_10_22
กนอ.เร่งศึกษาแนวทางจัดตั้งนิคมฯ ราชทัณฑ์ สร้างโอกาสคืนคนดีสู่สังคม,"นายวีริศ อัมระปาล ผู้ว่าการการนิคมอุตสาหกรรมแห่งประเทศไทย (กนอ.) เปิดเผยว่า ในการประชุมคณะรัฐมนตรี (ครม.) เมื่อวันที่ 19 ต.ค.ที่ผ่านมา ที่ประชุม ครม.รับทราบผลการศึกษาจัดตั้งนิคมอุตสาหกรรมราชทัณฑ์ ตามที่กระทรวงยุติธรรมได้ทำการศึกษา โดยมีวัตถุประสงค์เพื่อแก้ปัญหาผู้ต้องขังล้นเรือนจำ ฝึกทักษะอาชีพ พัฒนายกระดับฝีมือแรงงาน และสร้างผู้พ้นโทษให้เป็นผู้ประกอบการรายใหม่ ซึ่งเป็นการสร้างอาชีพในอนาคต ลดจำนวนอัตราการกระทำผิดซ้ำของผู้ต้องขัง โดยกลุ่มเป้าหมายคือผู้พ้นโทษและผู้อยู่ระหว่างพักการลงโทษหรือลดจำนวนวันต้องโทษ โดย กนอ.จะนำแนวทางที่ได้จากข้อเสนอแนะของ ครม.ไปร่วมหารือกับหน่วยงานที่เกี่ยวข้อง เพื่อหาแนวทางดำเนินงานตามมติ ครม.ต่อไป เบื้องต้นจากการศึกษารูปแบบการดำเนินงานที่เหมาะสมนั้น จะดำเนินการในลักษณะของการเชิญชวนผู้ประกอบการ ซึ่งเป็นนักพัฒนาอสังหาริมทรัพย์ที่มีความเชี่ยวชาญในการพัฒนานิคมอุตสาหกรรม เป็นผู้จัดหาที่ดินของเอกชนและพัฒนาเป็นนิคมฯ เพื่อให้เกิดความคล่องตัวและมีประสิทธิภาพ โดยรัฐสนับสนุนสิทธิประโยชน์ต่างๆ และ กนอ.ทำหน้าที่ตรวจสอบ กำกับดูแล เพื่อให้เป็นไปตามหลักเกณฑ์ เงื่อนไข และวิธีการในการจัดตั้งหรือขยายนิคมอุตสาหกรรม ส่วนการคัดเลือกผู้ประกอบธุรกิจจะเน้นนวัตกรรม แรงงานใช้ทักษะฝีมือ และรูปแบบธุรกิจที่ทันสมัย “กนอ.จะเร่งศึกษาความเป็นไปได้ มาตรการ และสิทธิประโยชน์ เพื่อดึงดูดนักลงทุน อาทิ จัดให้มีบริการระบบสาธารณูปโภคและสิ่งอำนวยความสะดวกที่เอื้อต่อการประกอบกิจการในนิคมอุตสาหกรรม, การให้บริการอนุมัติ อนุญาต และกำกับดูแลการประกอบกิจการของผู้ประกอบการในนิคมอุตสาหกรรม, การยกเว้นค่าใช้จ่ายร่วมดำเนินงานนิคมอุตสาหกรรมให้แก่ผู้พัฒนานิคมอุตสาหกรรม เช่น ค่าธรรมเนียมและบริการร่วมดำเนินงาน และการจัดให้มีและให้บริการสิทธิประโยชน์ที่สอดคล้องกับความต้องการของผู้ประกอบการในนิคมอุตสาหกรรม ตลอดจนควบคุม กำกับดูแล […] The post กนอ.เร่งศึกษาแนวทางจัดตั้งนิคมฯ ราชทัณฑ์ สร้างโอกาสคืนคนดีสู่สังคม appeared first on สำนักข่าวอินโฟเควสท์.",https://www.infoquest.co.th/2021/138207,2021_10_22
จีนรั้งตำแหน่งประเทศผู้นำเข้ารายใหญ่อันดับ 2 ของโลกต่อเนื่อง 11 ปี,สำนักข่าวซินหัวรายงานว่า กระทรวงพาณิชย์จีนเปิดเผยเมื่อวันพฤหัสบดี (21 ต.ค.) ว่า จีนเป็นประเทศผู้นำเข้ารายใหญ่อันดับ 2 ของโลกติดต่อกันเป็นปีที่ 11 ซู่ เจ๋ว์ถิง โฆษกกระทรวงฯ แถลงข่าวว่า ในช่วงเดือนมกราคม-กันยายน จีนนำเข้าสินค้ามูลค่าเกือบ 2 ล้านล้านดอลลาร์สหรัฐ (ราว 66.74 ล้านล้านบาท) สูงขึ้น 32.6% เมื่อเทียบปีต่อปี ข้อมูลจากองค์การการค้าโลก (WTO) ระบุว่า ปริมาณสินค้าที่จีนนำเข้าในช่วง 6 เดือนแรก คิดเป็นราว 12% ของยอดรวมทั่วโลก และจีนมีส่วนทำให้ปริมาณการนำเข้าทั่วโลกเพิ่มขึ้น 15% ซู่กล่าวว่า จีนจะผลักดันการเปิดกว้างระดับสูง ขยายการนำเข้า และเปลี่ยนตลาดของประเทศให้กลายเป็นตลาดระดับโลกที่ทุกฝ่ายมีส่วนแบ่ง และสามารถเข้าถึงได้ ขณะเดียวกันจีนจะเดินหน้าพัฒนาการเปิดเสรีทางการค้า รวมถึงอำนวยความสะดวก และปรับปรุงสภาพแวดล้อมทางธุรกิจของประเทศ เพื่อส่งเสริมการฟื้นตัว และการเติบโตระดับโลก โดย สำนักข่าวอินโฟเควสท์ (22 ต.ค. 64) The post จีนรั้งตำแหน่งประเทศผู้นำเข้ารายใหญ่อันดับ 2 ของโลกต่อเนื่อง 11 ปี appeared first on สำนักข่าวอินโฟเควสท์.,https://www.infoquest.co.th/2021/138203,2021_10_22
ที่ประชุมเอเปคครั้งที่ 28 ร่วมหารือรับมือกับโควิด-19 ควบคู่ขับเคลื่อนศก.,นายพรชัย ฐีระเวช ผู้อำนวยการสำนักงานเศรษฐกิจการคลัง ในฐานะโฆษกกระทรวงการคลัง กล่าวว่า นายอาคม เติมพิทยาไพสิฐ รัฐมนตรีว่าการกระทรวงการคลังในฐานะหัวหน้าคณะผู้แทนไทย ได้เข้าร่วมการประชุมรัฐมนตรีว่าการกระทรวงการคลังเอเปค (APEC Finance Ministers’ Meeting: APEC FMM) ครั้งที่ 28 เมื่อวันที่ 22 ตุลาคม 2564 ด้วยการประชุมผ่านสื่ออิเล็กทรอนิกส์ โดยมีนาย Grant Robertson รองนายกรัฐมนตรี และรัฐมนตรีว่าการกระทรวงการคลังนิวซีแลนด์ เป็นประธาน พร้อมด้วยรัฐมนตรีว่าการกระทรวงการคลัง และผู้แทนระดับสูงจากสมาชิกเอเปคทั้ง 21 เขตเศรษฐกิจ ผู้แทนจากองค์กรระหว่างประเทศ อาทิ องค์การเพื่อความร่วมมือทางเศรษฐกิจและการพัฒนา (Organization for Economic Co-operation and Development: OECD) กองทุนการเงินระหว่างประเทศ (International Monetary Fund: IMF) กลุ่มธนาคารโลก (World Bank Group) ธนาคารพัฒนาเอเชีย (Asian Development Bank) […] The post ที่ประชุมเอเปคครั้งที่ 28 ร่วมหารือรับมือกับโควิด-19 ควบคู่ขับเคลื่อนศก. appeared first on สำนักข่าวอินโฟเควสท์.,https://www.infoquest.co.th/2021/138200,2021_10_22
ปชป. เสนอ 4 มาตรการเข้มข้นหลังยกเลิกเคอร์ฟิวส์ 17 จว. ป้องกันติดเชื้อพุ่ง,นายปริญญ์ พานิชภักดิ์ รองหัวหน้าพรรคประชาธิปัตย์ (ปชป.) หัวหน้าทีมเศรษฐกิจทันสมัย และนางดรุณวรรณ ชาญพิพัฒนชัย รองโฆษกพรรค ได้แถลงข่าวถึงการที่รัฐบาลมีมาตรการยกเลิกเคอร์ฟิวใน “17 จังหวัดนำร่องท่องเที่ยว” โดยประกาศมีผลบังคับใช้ 1 พฤศจิกายนนี้ ถือเป็นเรื่องที่น่ายินดี และสอดคล้องกับแนวทางของทีมเศรษฐกิจทันสมัยที่ได้เสนอประเด็นนี้มาอย่างต่อเนื่องที่ต้องการให้รัฐบาลมีมาตรการผ่อนคลายเป็นลำดับขั้น เพราะเรื่องสาธารณสุข และเศรษฐกิจจำเป็นที่จะต้องเดินควบคู่กัน ไม่สามารถให้น้ำหนักกับประเด็นใดประเด็นหนึ่ง ยกเว้นในสถานการณ์ที่มีการระบาดรุนแรงที่จำเป็นต้องให้ความสำคัญกับเรื่องสาธารณสุขเป็นหลัก แต่เมื่อตัวเลขการติดเชื้อมีสถานการณ์ที่ดีขึ้นภายใต้การฉีดวัคซีนที่ครอบคลุมมากขึ้น จึงจำเป็นต้องให้ประชาชนสามารถกลับมาใช้ชีวิตได้ตามปกติ เพื่อไม่ให้ส่งผลกระทบต่อเศรษฐกิจ นางดรุณวรรณ กล่าวว่า รู้สึกยินดีกับพี่น้องประชาชนใน 17 จังหวัดนำร่องรวมถึงกรุงเทพมหานคร ที่ได้รับการยกเลิกเคอร์ฟิวแล้ว แม้บางจังหวัดอาจมีบางพื้นที่ที่ยังต้องควบคุมแบบเข้มงวดอยู่ก็ตาม ถือเป็นนิมิตรหมายที่ดีในการเปิดประเทศ เพื่อเตรียมรับทั้งนักท่องเที่ยวทั้งคนไทยและต่างประเทศ แต่อยากฝากไปถึงภาครัฐและผู้ที่มีส่วนเกี่ยวข้อง โดยเฉพาะ ศบค. ว่า มาตรการใด ๆ ที่ออกมาขณะนี้ยังมีความจำเป็นที่จะต้องมีมาตรการคู่ขนานออกมาควบคู่กันไปด้วย เพราะเมื่อยกเลิกเคอร์ฟิวแล้วสิ่งที่อาจเกิดขึ้นตามมาก็คือจำนวนตัวเลขผู้ติดเชื้อที่มีแนวโน้มเพิ่มมากขึ้น โดยมีมาตรการคู่ขนานที่ต้องเตรียมความพร้อมทั้งทางด้านสาธารณสุขและกฎหมาย ดังต่อไปนี้ 1. การเตรียมความพร้อมเรื่องสถานพยาบาล โรงพยาบาลสนาม บุคลากรทางการแพทย์ในกรณีที่พบผู้ติดเชื้อเพิ่มขึ้น รวมถึงการบริหารจัดการเตียงเพื่อรองรับกลุ่มผู้ป่วยสีเหลืองที่จำเป็นต้องได้รับการรักษาในโรงพยาบาล โดยเฉพาะในพื้นที่ 17 จังหวัดนำร่องที่ยกเลิกเคอร์ฟิว 2. เร่งฉีดวัคซีนให้ครอบคลุม โดยเฉพาะจังหวัดที่มีการยกเลิกเคอร์ฟิว ซึ่งควรมีสัดส่วนผู้ได้รับวัคซีนอย่างน้อย 70% […] The post ปชป. เสนอ 4 มาตรการเข้มข้นหลังยกเลิกเคอร์ฟิวส์ 17 จว. ป้องกันติดเชื้อพุ่ง appeared first on สำนักข่าวอินโฟเควสท์.,https://www.infoquest.co.th/2021/138213,2021_10_22
