title,summary,link,published
จีนทดลองขีปนาวุธความเร็วเสียงที่ตรวจจับได้ยาก,"Submitted on Sun, 2021-10-17 23:50จีนทำการทดลองขีปนาวุธความเร็วเสียงที่ตรวจจับได้ยากโดยใช้วิธีแล่นอยู่ในวงโคจรระดับต่ำ รายงานในเรื่องนี้ทำให้หน่วยข่าวกรองสหรัฐฯ ""ประหลาดใจ"" รายงานข่าวต่างประเทศเมื่อวันที่ 17 ต.ค. 2564 ระบุว่าทางการจีนเคยทดสอบขีปนาวุธที่สามารถติดหัวรบนิวเคลียร์โดยอาศัยอากาศยานความเร็วเสียงในการลำเลียงในแบบที่ทำให้สามารถตรวจจับได้ยาก สื่อต่างประเทศระบุว่ารายงานเกี่ยวกับการทดสอบอาวุธใหม่ของจีนที่เกิดขึ้นตั้งแต่เดือน ส.ค. ปีนี้ ""สร้างความประหลาดใจให้กับหน่วยข่าวกรองสหรัฐฯ"" ซึ่งนับเป็นครั้งแรกที่จีนมีการทดสอบ ""ขีปนาวุธความเร็วเสียงที่มีความสามารถในการติดหัวรบนิวเคลียร์"" โดยที่การทดสอบขีปนาวุธดังกล่าวนี้ของจีนมีการให้ขีปนาวุธแล่นผ่านวงโคจรโลกระดับต่ำก่อนที่จะพุ่งเข้าสู่เป้าหมาย ถึงแม้ว่าขีปนาวุธที่ทำการทดสอบในครั้งนี้จะพลาดเป้า แต่สื่อเอ็นเอชเคก็ระบุว่ามันนับเป็นการแสดงให้เห็นถึง ""ความก้าวหน้าอย่างน่าทึ่ง"" ของเทคโนโลยีขีปนาวุธความเร็วเสียงของจีนในระดับที่ทำให้หน่วยข่าวกรองของสหรัฐฯ คาดไม่ถึง ผู้เชี่ยวชาญกล่าวว่าถ้าหากจีนสามารถพัฒนาเทคโนโลยีเช่นนี้ได้อย่างเต็มที่ก็อาจจะส่งผลกระทบต่อระบบการป้องกันขีปนาวุธของสหรัฐฯ และของญี่ปุ่นได้ อย่างไรก็ตามประเทศสหรัฐฯ และรัสเซียก็เคยมีการพัฒนาขีปนาวุธความเร็วเสียงไว้เช่นกัน อาวุธของทั้งสองประเทศนี้แล่นด้วยความเร็วเหนือกว่าความเร็วเสียง 5 เท่า และสามารถบังคับได้ในขณะที่บินอยู่ ทำให้ยากต่อการตรวจจับ เรียบเรียงจากChina surprises US with hypersonic missile test, report says, Financial Express, 17-10-2021China reportedly tests hypersonic missile, NHK, 17-10-2021 ข่าวต่างประเทศจีนขีปนาวุธอาวุธสงครามติดตามประชาไทอัพเดท ได้ที่เฟซบุ๊ก https://fb.me/prachatai : ทวิตเตอร์ https://twitter.com/prachatai : LINE ไอดี = @prachatai",http://feedproxy.google.com/~r/prachatai/~3/hHUoyMHx2rk/95520,2021_10_17
ธปท.-ส.ธนาคาร แจงกรณีการตัดเงินผิดปกติผ่านบัตรเครดิต-เดบิตของลูกค้าจำนวนมาก,"Submitted on Sun, 2021-10-17 22:52ธนาคารแห่งประเทศไทย (ธปท.) และสมาคมธนาคารไทย แจงกรณีการตัดเงินที่ผิดปกติผ่านบัตรเครดิตและบัตรเดบิตของลูกค้าจำนวนมาก เบื้องต้นพบไม่ได้เกิดจากการรั่วไหลของข้อมูลจากธนาคาร แต่เป็นรายการที่เกิดจากการทำธุรกรรมชำระค่าสินค้าและบริการกับร้านค้าออนไลน์ที่จดทะเบียนในต่างประเทศเป็นส่วนใหญ่ และไม่ใช่แอปฯ ดูดเงินตามที่ปรากฏเป็นข่าว 17 ต.ค. 2564 ธนาคารแห่งประเทศไทย (ธปท.) และสมาคมธนาคารไทยได้แจ้งข่าว ว่าตามที่ปรากฏข่าวพบลูกค้าผู้ถือบัตรเครดิตและบัตรเดบิตจำนวนมากประสบปัญหาการทำรายการชำระเงินโดยที่ไม่ได้ทำธุรกรรมด้วยตนเอง ธนาคารแห่งประเทศไทย และสมาคมธนาคารไทย ได้รับทราบปัญหาและ ได้ตรวจสอบสถานการณ์ดังกล่าว โดยเบื้องต้นพบว่ามิได้เกิดจากการรั่วไหลของข้อมูลจากธนาคาร แต่เป็นรายการที่เกิดจากการทำธุรกรรมชำระค่าสินค้าและบริการกับร้านค้าออนไลน์ที่จดทะเบียนในต่างประเทศเป็นส่วนใหญ่ และไม่ใช่แอปดูดเงินตามที่ปรากฏเป็นข่าว ขณะนี้ธนาคารเจ้าของบัตรได้ดำเนินการระงับการใช้บัตรของลูกค้าที่มีรายการผิดปกติ และติดต่อลูกค้า รวมทั้งอยู่ระหว่างดำเนินการตรวจสอบร้านค้าที่มีธุรกรรมที่ผิดปกติเหล่านี้ นอกจากนี้ ลูกค้าที่ตรวจสอบพบความผิดปกติของรายการธุรกรรมด้วยตนเอง สามารถติดต่อคอลเซ็นเตอร์หรือสาขาของธนาคารผู้ออกบัตรเพื่อแจ้งตรวจสอบและยืนยันการทำธุรกรรมในทันที โดยธนาคารจะดูแลแก้ไขปัญหาที่เกิดขึ้น และเร่งคืนเงินให้กับลูกค้าที่ได้รับความเสียหายตามขั้นตอนของธนาคารโดยเร็วต่อไป ธปท. และสมาคมธนาคารไทย ให้ความสำคัญอย่างยิ่งกับความปลอดภัยในการทำธุรกรรมทางการเงิน และการคุ้มครองข้อมูลส่วนบุคคลของลูกค้า โดยธนาคารพาณิชย์มีระบบการรักษาความมั่นคงปลอดภัยและมีการตรวจสอบการทำธุรกรรมที่ผิดปกติอย่างต่อเนื่อง เมื่อพบรายการที่ผิดปกติ ธนาคารจะแจ้งลูกค้าเพื่อตรวจสอบและยืนยันรายการธุรกรรม และพร้อมจะดูแลลูกค้าด้วยความรับผิดชอบเสมอ” ก่อนหน้านี้ ผู้จัดการออนไลน์ รายงานว่ามีลูกค้าเป็นจำนวนมากของของธนาคารหลายแห่งร้องเรียนว่วถูกหักเงินจากบัญชี บัตรเดบิต หรือบัตรเครดิตที่ผูกไว้กับวิลเลจหรือสโตร์ออนไลน์ โดยจำนวนเงินที่หักไม่สูง แต่มีจำนวนหลายรายการติดๆกัน โดยข้อความระบุว่า Purchase via EDC ซึ่งส่วนใหญ่แล้วจะเป็นการซื้อสินค้าบริการผ่านบัตรเดบิต และมาตัดเงินจากบัญชีธนาคารอีกโดยรายการที่เกิดขึ้นจะพบในวันที่ 1-2 ต.ค. 2564 ที่ผ่านมา ยกตัวอย่างบัญชีธนาคารจะโดนตัดเงินทีละ 37 บาท 5 รายการ และ 86.90 บาท 7 รายการ และ 17.27 บาท 1 รายการ รวมเป็นเงินทั้งหมด 810.57 บาท ในช่วงเวลาประมาณ ตี 3 ของวันที่ 2 ต.ค. 2564 เป็นต้น ทั้งนี้กลุ่มผู้เสียหายได้รวมตัวกันตั้งกลุ่ม “แชร์ประสบการณ์โดนหักเงินจากบัญชีโดยไม่รู้ตัว” เพื่อแชร์ประสบการณ์และความเสียหายจากเหตุการณ์ดังกล่าว โดยมีผู้เสียหายเข้าร่วมกลุ่มจำนวนกว่า 1.4 หมื่นรายแล้ว ต่อมาหน่วยงานที่เกี่ยวข้องอยู่ระหว่างการตรวจสอบสาเหตุที่เกิดขึ้น รวมถึงธนาคารแห่งประเทศไทย(ธปท.) ก็ได้เร่งประชุมกับผู้บริหารเทคโนโลยีสารสนเทศระดับสูง (Chief Information Officer :CIO) ของธนาคารพาณิชย์ถึงสถานการณ์ดังกล่าว ก่อนออกคำชี้แจงฉบับดังกล่าวที่รายงานไปแล้วในขั้นต้น ข่าวเศรษฐกิจสังคมคุณภาพชีวิตไอซีทีธนาคารธนาคารแห่งประเทศไทยติดตามประชาไทอัพเดท ได้ที่เฟซบุ๊ก https://fb.me/prachatai : ทวิตเตอร์ https://twitter.com/prachatai : LINE ไอดี = @prachatai",http://feedproxy.google.com/~r/prachatai/~3/5YdKyKJSnho/95519,2021_10_17
หนังละครจากนิยาย ‘ตรี อภิรุม’ | หมายเหตุประเพทไทย EP.388,"Submitted on Sun, 2021-10-17 21:08 หมายเหตุประเพทไทยสัปดาห์นี้ ภาวิน มาลัยวงศ์ และชานันท์ ยอดหงษ์ เล่าถึงวรรณกรรมแนวลี้ลับ ภูตผีปีศาจของ ‘ตรี อภิรุม’ ซึ่งถูกดัดแปลงเป็นละครโทรทัศน์และภาพยนตร์หลายเรื่องอย่าง นาคี ทายาทอสูร อมฤตาลัย แก้วขนเหล็ก ภูตแม่น้ำโขง ฯลฯ ทั้งนี้มีวิทยานิพนธ์ที่ศึกษางานของ ตรี อภิรุม โดยใช้กรอบแบบวรรณกรรมสัจนิยมมหัศจรรย์มาศึกษาด้วย แต่อีกทางหนึ่งงานงานของ ตรี อภิรุม อาจเป็นเพียงการสะท้อนมุมมองแฟนตาซีต่อพื้นที่ชนบท การเน้นเรื่องชาติภพ ความเชื่อทางศาสนา ซึ่งปรากฏเด่นในวรรณกรรมช่วงต้นทศวรรษ 2500 มากกว่า ติดตามรายการหมายเหตุประเพทไทยย้อนหลังที่เฟสบุ๊ค https://www.facebook.com/maihetpraphetthaiYouTube เพลยลิสต์ หมายเหตุประเพทไทยหรือลงทะเบียนรับชมที่ https://youtube.com/prachatai ข่าวสังคมวัฒนธรรมหมายเหตุประเพทไทยตรี อภิรุมนาคีวรรณกรรมละครละครไทยภูตแม่น้ำโขงทายาทอสูรติดตามประชาไทอัพเดท ได้ที่เฟซบุ๊ก https://fb.me/prachatai : ทวิตเตอร์ https://twitter.com/prachatai : LINE ไอดี = @prachatai",http://feedproxy.google.com/~r/prachatai/~3/-E7Gz0IWOsc/95518,2021_10_17
ผลสำรวจ 94 ประเทศ ชี้ 'ครู' ทำงานหนัก-ค่าจ้างต่ำ และถูกประเมินค่าต่ำเกินไป,"Submitted on Sun, 2021-10-17 19:06รายงานฉบับใหม่ของสหภาพแรงงานคนทำงานภาคการศึกษานานาชาติ (EI) สำรวจความเห็นครูใน 94 ประเทศ พบอาชีพนี้ทำงานหนักเกินไป ได้รับค่าจ้างต่ำเกินไป และถูกประเมินค่าต่ำเกินไป สหภาพแรงงานคนทำงานภาคการศึกษานานาชาติ (EI) ระบุอาชีพ 'ครู' ทำงานหนักเกินไป ได้รับค่าจ้างต่ำเกินไป และถูกประเมินค่าต่ำเกินไป | ที่มาภาพประกอบ: UNICEF/Des (อ้างใน theirworld.org) เนื่องในวันครูโลก (World Teachers’ Day) เมื่อวันที่ 5 ต.ค. 2564 ที่ผ่านมา สหภาพแรงงานคนทำงานภาคการศึกษานานาชาติ (Education International ได้เปิดเผยรายงาน The Global Report on the Status of Teachers 2021 เขียนโดยศาสตราจารย์เกรก ทอมสัน จาก Queensland University of Technology ในออสเตรเลีย โดยใช้ข้อมูลจากการสำรวจความคิดเห็นผู้นำและเจ้าหน้าที่สหภาพแรงงานด้านการศึกษา 128 คน ใน 94 ประเทศ เผยทั่วโลกต้องการ 'ครู' อย่างน้อยอีก 69 ล้านคน รายงานฉบับนี้ได้ชี้ถึงปัจจัยที่ส่งผลต่อสถานะของคนทำงานด้านการศึกษาทั่วโลก เช่น ค่าจ้างและสภาพการทำงาน ตลอดจนความเป็นอิสระทางวิชาชีพ และภาพลักษณ์ของครูในสื่อกระแสหลัก โดยข้อค้นพบหลัก ๆ ของรายงานฉบับนี้ได้แก่ • ค่าจ้างครูต่ำเกินไป การระบาดของ COVID-19 ได้ทำให้การโครงสร้างพื้นฐานเพื่อสนับสนุนการเรียนการสอนไม่ใช่สิ่งสำคัญอันดับแรกสำหรับรัฐบาล ผู้ตอบแบบสอบถามกว่าร้อยละ 42 ระบุว่าสภาพการทำงานของครูตกต่ำในช่วง 3 ปีที่ผ่านมา ร้อยละ 84 ระบุว่าเงินเดือนของพวกเขาลดลงในช่วงการระบาดของ COVID-19 • ปริมาณงานเพิ่มมากขึ้น ผู้ตอบแบบสอบถามกว่าร้อยละ 55 ระบุว่าพวกเขามีปริมาณงานล้นเกินจนไม่สามารถจัดการได้ ผู้ตอบแบบสอบถามกว่าร้อยละ 66 รู้สึกว่างานด้านการบริหารจัดการ มีส่วนทำให้เกิดแรงกดดันด้านปริมาณงานมากเกินไปสำหรับผู้เชี่ยวชาญด้านการศึกษา • ภาพลักษณ์ของครูเป็นปัญหา ร้อยละ 48 ของผู้ตอบแบบสอบถาม คิดว่าอาชีพครูไม่ใช่อาชีพที่น่าสนใจสำหรับเยาวชนและผู้คนทั่วไปแล้ว • การจ้างงานที่ไม่มั่นคงกำลังเพิ่มขึ้น เกือบร้อยละ 60 ของผู้ตอบแบบสอบถามชี้ให้เห็นถึงการใช้สัญญาจ้างงานชั่วคราวและระยะสั้นเพื่อจ้างครูและนักวิชาการเพิ่มขึ้น 'ครูสัญญา' จ้างจำนวนมากอธิบายว่าได้รับค่าตอบแทนน้อยกว่าครูที่มีสัญญาจ้างประจำ นอกจากนี้การสนับสนุนทางวิชาชีพแก่ครูสัญญานั้นยังไม่เพียงพอและมีสภาพการทำงานที่ย่ำแย่อีกด้วย • การพัฒนาวิชาชีพอย่างต่อเนื่องยังคงไม่เพียงพอสำหรับครู ผู้ตอบแบบสอบถามชี้ว่าพวกเขาไม่มีความก้าวหน้าในอาชีพและไม่มีสวัสดิการด้านอาชีพที่ชัดเจน ที่มาเรียบเรียงจากNew global report points to overworked, underpaid, and undervalued teaching profession (Education International, 4 October 2021) ข่าวการศึกษาแรงงานต่างประเทศสหภาพแรงงานคนทำงานภาคการศึกษานานาชาติEducation InternationalEIครูคนทำงานภาคการศึกษาติดตามประชาไทอัพเดท ได้ที่เฟซบุ๊ก https://fb.me/prachatai : ทวิตเตอร์ https://twitter.com/prachatai : LINE ไอดี = @prachatai",http://feedproxy.google.com/~r/prachatai/~3/zmI9WsdQ2EI/95517,2021_10_17
