title,summary,link,published
อัตราแรงขุด Bitcoin บนเครือข่ายเริ่มฟื้นตัว บ่งชี้ว่านักขุดที่ย้ายออกจากจีนเริ่มกลับมาเดินเครื่องอีกครั้ง,อัตราแรงขุดของ Bitcoin บนเครือข่าย ดูเหมือนว่าจะเริ่มมีการฟื้นตัวกลับมาแล้ว โดยคาดว่าเป็นผลมาจากนักขุดจากในประเทศจีนที่เริ่มกลับมาเดินเครื่องขุดอีกครั้ง หลังอพยพย้ายเครื่องขุดออกนอกประเทศไปยังประเทศอื่น ๆ ตามมาตรการกวาดล้างของรัฐบาล  ตามรายงานของผู้ให้บริการข้อมูลบนเครือข่าย Glassnode แสดงให้เห็นว่า อัตราแรงขุดของ Bitcoin hashrate ส่วนใหญ่เริ่มฟื้นตัวกลับมาแล้ว หลังจากที่อัตราแรงขุดบนเครือข่ายกว่า 50% ได้มีการออฟไลน์หายไปในเดือนพฤษภาคม  Glassnode ระบุว่า ทั้งอัตราแฮชและค่าความยากในการขุด สามารถ “ฟื้นตัวกลับมาได้” อย่างมั่งคง หลังจากที่ก่อนหน้านี้ในช่วงต้นเดือนกรกฎาคมมีรายงานว่า ค่าความยากลำบากในการขุด Bitcoin ได้ร่วงลดลงไปกว่า 28% ค่าความยากในการขุดได้ฟื้นตัวกลับมากว่า 39% นับตั้งแต่ช่วงปลายเดือนกรกฎาคมและเพิ่มขึ้นเกือบแตะระดับก่อนที่จะมีการปราบปรามคริปโตของรัฐบาลจีน โดยคาดว่าตัวเลขส่วนใหญ่ได้มีการปรับตัวขึ้นเพิ่มเติมในสัปดาห์นี้ Glassnode ยังรายงานด้วยว่า Difficulty Ribbon ซึ่งเป็นตัวชี้วัดค่าความยากลำบากในการขุด Bitcoin บนเครือข่ายได้เห็นการฟื้นตัวครั้งใหญ่ในรอบ 3 ปี แม้ว่าตัวเลข Block reward จะลดลงกว่าครึ่งนึงจาก 12.5 BTC เหลือเพียง 6.25 BTC นับตั้งแต่เหตุการณ์ Halving ในเดือนพฤษภาคม 2020 แต่ผลกำไรที่ได้จากการขุดก็ยังคงเพิ่มขึ้นอย่างต่อเนื่องนับตั้งแต่นั้น  Glassnode ตั้งข้อสังเกตว่า ผลกำไรจากการขุดในปัจจุบันที่ระดับ 40 ล้านดอลลาร์ต่อวันนั้นคิดเป็นมูลค่าเพิ่มขึ้นกว่า 275% นับตั้งแต่ก่อนเกิดเหตุการณ์ Bitcoin Halving ในเดือนพฤษภาคม 2020 และมีมูลค่าเพิ่มขึ้นประมาณ 630% เมื่อเทียบกับจุดต่ำสุดในเดือนมิถุนายน 2020 ที่ระหว่าง 6 ล้านดอลลาร์ถึง 8 ล้านดอลลาร์ “แม้จะมีการเหตุการณ์มากมายที่ส่งผลต่ออุตสาหกรรมการขุดคริปโต ไม่ว่าจะเป็นการปรับฐานราคาครั้งใหญ่หลายต่อหลายครั้ง รวมถึงเหตุการณ์ halving ในเดือนพฤษภาคม 2020 แต่ผลกำไรที่ได้จากการขุด ก็ยังคงเพิ่มสูงขึ้นอย่างต่อเนื่อง และสร้างแรงจูงใจให้ตลาดมีปรับตัว เปลี่ยนแปลง และมีการฟื้นตัวกลับมาได้อย่างสมบูรณ์” รายงานกล่าว,https://siamblockchain.com/2021/10/05/hash-rate-and-difficulty-rebound-shows-miners-have-recovered-from-china-exodus/,05_10_2021
ขอนแก่นเผยเตรียมนำเทคโนโลยี Blockchain มาใช้มุ่งเป้า “แก้จน ลดความเหลื่อมล้ำ สร้างความโปร่งใส”,"จบลงไปเป็นที่เรียบร้อยแล้วสำหรับงาน Khon Kaen Blockchain Forum ครั้งที่ 1 โดยในงานได้มีพูดถึงสาระประเด็นสำคัญในเรื่องของโปรเจกต์ “METAVERSE ขอนแก่น” ด้วยในการนำเทคโนโลยี Blockchain มาใช้พัฒนาชีวิตของผู้คนในท้องถิ่น พร้อมพูดถึงเป้าหมายสูงสุดของโปรเจกต์ในมุ่งเน้นไปที่ “การแก้จน ลดความเหลื่อมล้ำ การสร้างความโปร่งใส”  ในหัวข้อว่า “ NFT แก้จน / Token ลดความเหลื่อมล้ำ / Blockchain สร้างความโปร่งใส ได้อย่างไร?” โดยวันที่ 2 ตุลาคมที่ผ่านมาทาง KKTT ได้ลงนามในข้อตกลง MOU ร่วมกับทาง Xchain ของคุณโดมเพื่อใช้เป็นปูพื้นฐานโครงสร้าง Blockchain ให้กับจังหวัดขอนแก่น สำหรับบทสรุปของการเสวนาในวันที่ 2 ตุลาคมจะแบ่งเป็น 3 ประเด็นหลัก ๆ ดังต่อไปนี้ ขอนแก่นกำลังเตรียมออกเหรียญ Stable Coins เป็นของตัวเอง (กำลังอยู่ในช่วงระหว่างการตั้งชื่อ) ภายในเดือน พย 64 ขอนแก่นเตรียมจัดตั้งหน่วยงานที่เกี่ยวข้องเพื่อสร้าง NFT สินค้า OTOP ให้กับชุมชนท้องถิ่น, ศิลปินท้องถิ่น และภูมิปัญญาชาวบ้าน ขอนแก่นเตรียมเปิดตัว ขอนแก่นMETAVERSE เพื่อเป็น Open Platform ที่ช่วยให้กิจกรรมที่เกี่ยวข้องกับข้อ 1 กับข้อ 2 ข้างต้นสำหรับนำมาใช้ประโยชน์ได้จริง และพร้อมรองรับกิจกรรมในทุกรูปแบบที่จะนำมาใช้พัฒนาบน METAVERSE แห่งนี้ และที่สำคัญที่สุด เตรียมพร้อมรองรับกิจกรรมระดับจักรวาลที่กำลังจะเกิดขึ้นในอีก 18 เดือนข้างหน้า",https://siamblockchain.com/2021/10/05/khon-kaen-metavarse/,05_10_2021
มูลค่าตลาด Bitcoin พุ่งทะลุ 9 แสนล้านดอลลาร์ แซงหน้า Facebook อย่างเป็นทางการ,"ในวันนี้ Bitcoin ได้ประสบความสำเร็จขึ้นไปอีกขั้น โดยมีมูลค่าตลาดพุ่งแตะ $ 929,014,620,160 ดอลลาร์แซงหน้า Facebook อย่างเป็นทางการ อ้างอิงข้อมูลจาก Asset Dash แม้ว่า Bitcoin จะได้เห็นปรับฐานราคาครั้งใหญ่เมื่อช่วงต้นปีที่ผ่านมา แต่ราคา BTC ยังคงฟื้นตัวกลับมาได้อย่างน่าประทับใจในปัจจุบัน และเพิ่มขึ้นมากกว่า 360% ในปีช่วงที่ผ่านมา เมื่อเทียบกับ Facebook ที่เพิ่มขึ้นเพียง 22% เท่านั้น ซึ่งดูเหมือนว่า Facebook จะกลายเป็นบริษัทยักษ์ใหญ่รายล่าสุดที่เพิ่งถูกสังหารในเส้นทางการเติบโตของ Bitcoin  อย่างไรก็ตามข้อมูลดังกล่าวนี้เป็นเพียงการเปรียบเทียบระหว่างมูลค่าหุ้นของ Facebook ที่ซื้อขายในตลาดหลักทรัพย์และ Bitcoin ที่เป็นสินทรัพย์ทางการเงินในเครือข่ายแบบกระจายอำนาจเท่านั้น ยังไม่รวมถึงธุรกิจอื่น ๆ ของบริษัท Bitcoin กลายเป็นสินทรัพย์ที่ให้ผลตอบแทนดีที่สุดในช่วงทศวรรษที่ผ่านมาและหลายคนเชื่อกันว่า Bitcoin อาจจะได้เห็นช่วงขาขึ้นครั้งใหญ่เกิดขึ้นในช่วงไตรมาสที่ 4 ของปีนี้ ดังที่เห็นตามสถิติในอดีตที่ราคา Bitcoin นั้นจะเพิ่มขึ้นในช่วงไตรมาสที่ 4 ของทุกปี ประกอบกับสถานการณ์ต่าง ๆ ในปัจจุบันที่อาจส่วนช่วยผลักดันราคาให้ Bitcoin เพิ่มสูงขึ้นไปอีกเช่น การขยายตัวของอุปทานเงินดอลลาร์จากธนาคารกลางสหรัฐฯ, การเคลื่อนไหวของเอลซัลวาดอร์ในการทำให้ Bitcoin เป็นสกุลเงินที่ถูกต้องตามกฎหมายและอุปทานเหรียญบนกระดานแลกเปลี่ยนที่ลดน้อยลงทั่วโลก อันเป็นผลมาจากการที่นักลงทุนส่วนใหญ่หันไปถือครองเหรียญในระยะยาวมากขึ้น ฯลฯ ทั้งนี้เราก็คงก็รอดูกันต่อไปว่า ในช่วงไตรมาสจะเป็นภาพในฝันของใครหลาย ๆ คนหรือไม่",https://siamblockchain.com/2021/10/05/bitcoin-surpasses-facebook-in-market-capitalization/,05_10_2021
ตองกาเตรียมเดินตามรอยเอลซัลวาดอร์เสนอร่างกฎหมายใหม่เพิ่ม Bitcoin เป็นสกุลเงิน,"นักการเมืองในตองกากำลังพยายามเสนอร่างกฎหมายใหม่เพื่อช่วยให้ bitcoin กลายสกุลเงินที่ถูกกฎหมายในประเทศ การเคลื่อนไหวในครั้งนี้ เกิดขึ้นหลังจากที่เอลซัลวาดอร์ได้ประกาศ Bitcoin กลายเป็นสกุลเงินที่สามารถใช้ชำระหนี้ได้ตามกฎหมายในประเทศเมื่อช่วงเดือนกันยายนที่ผ่านกัน และเป็นการแสดงให้ถึงจุดยืนของตองกาที่มีต่อ Bitcoin ในระหว่างการให้สัมภาษณ์กับFinancial Review Fusitu’a นาย Lord Fusitu’a สมาชิกสภาผู้แทนราษฎรแห่ง Niuas เปิดเผยว่าข้อเสนอร่างกฎหมาย Bitcoin แบบเดียวกับเอลซัลวาดอร์นั้นจะถูกนำเสนอต่อรัฐสภาของประเทศในเดือนพฤษภาคม 2022 Fusitu’a เชื่อว่าประเทศของเขาจะได้รับประโยชน์จากการทำให้ Bitcoin เป็นเงินที่ถูกกฎหมายควบคู่ไปกับสกุลเงินดั้งเดิมที่มีอยู่ นั่นคือ Tongan Pa’anga อย่างไรก็ตามการเสนอร่างกฎหมายจะต้องได้รับการสนับสนุนจากนักการเมืองชาวตองกาคนอื่น ๆ รวมถึงธนาคารกลางของประเทศก่อนถึงถูกนำไปพิจารณาผ่านร่างกฎหมายในขั้นตอนสุดท้าย ตองกามีประชากรเพียง 100,000 คนและมีจีดีพีของประเทศอยู่ที่ประมาณ500 ล้านดอลลาร์ในปี 2020 แม้จะเป็นเพียงประเทศเล็ก ๆ บนเกาะแปซิฟิก แต่ตองกาอาจช่วยปูทางให้ประเทศในหมู่เกาะแปซิฟิกอื่น ๆ ดำเนินตามรอยพวกเขาในการนำสินทรัพย์คริปโตมาใช้ การโอนเงินจากต่างประเทศเข้ามาถือว่าเป็น  GDP ส่วนใหญ่ของตองกา ดังนั้นการนำ Bitcoin มาใช้จะสามารถช่วยปรับปรุงระบบการชำระเงินข้ามพรมแดนที่มีอยู่ของตองกาได้ นาย Lord Fusitu’a กล่าว ในเดือนกันยายนเอลซัลวาดอร์ได้สร้างประวัติศาสตร์หน้าใหม่ ด้วยการเป็นประเทศแรกในโลกที่ Bitcoin ให้กลายเป็นสกุลเงินที่ถูกกฎหมาย การนำ Bitcoin มาใช้อย่างถูกกฎหมายในเอลซัลวาดอร์นั้นถูกมองว่าเป็นจุดเปลี่ยนที่สำคัญและเป็นการส่งสัญญาณว่า cryptocurrency เช่น Bitcoin และ Ethereum กำลังเริ่มเตรียมเข้ามาเป็นส่วนสำคัญของระบบการเงินทั่วโลก อย่างไรก็ตามการตัดสินใจเอลซัลวาดอร์เพื่อใช้ Bitcoin เป็นสกุลเงินของรัฐอย่างเป็นทางการนั้นได้พบกับคำวิจารณ์ที่รุนแรงและเผชิญกับการประท้วงหลายครั้งจากพรรคการเมืองในประเทศเกี่ยวกับการเปลี่ยนแปลงทางการเงิน",https://siamblockchain.com/2021/10/05/following-el-salvador-tongan-parliament-may-consider-bitcoin-legal-tender/,05_10_2021
"เม็ดเงินไหลออกจากกระดานเทรด Crypto เกือบ 13,900 BTC สิ่งนี้หมายถึงอะไร?","Colin Wu นักข่าวและบล็อกเกอร์ crypto ชาวจีนที่แบ่งปันข้อมูลครอบคลุมทุกอย่างที่เกี่ยวกับ blockchain และ crypto ในประเทศจีนและทั่วโลก ได้แบ่งปันข้อมูลล่าสุดที่แสดงให้เห็นว่าเกือบ 14,000 Bitcoin ได้ไหลออกจากแพลตฟอร์มการซื้อขายที่ใหญ่ที่สุดในประเทศจีนอย่าง Huobi และยังมี crypto ที่มีขนาดเล็กกว่าอีก 2 สกุลเงินที่ได้มีการไหลออกเป็นจำนวนมากเช่นเดียวกัน ในขณะเดียวกัน บริษัทแลกเปลี่ยนดิจิทัลรายใหญ่อย่าง Binance, Coinbase และ Bitfinex ก็เห็น Bitcoin ไหลเข้าแพลตฟอร์มมาเป็นจำนวนมากเช่นเดียวกัน ภายใต้แรงกดดันจากการต่อต้าน crypto ของจีนเมื่อเร็ว ๆ นี้ ทำให้ผู้ใช้งานและถือครอง Bitcoin ต่างพากันออกจาก Huobi หลังจากที่แพลตฟอร์มประกาศว่าจะเลิกใช้ลูกค้าปัจจุบันทั้งหมดในประเทศจีน  โดยหากอ้างอิงจาก ViewBase ซึ่งเป็นเว็บไซต์การวิเคราะห์จะเห็นได้ว่ามีการถอนบิตคอยน์กว่า 13,903 BTC ออกจากเว็บกระดานเทรด Huobi และได้มีเว็บกระดานเทรดอื่น ๆ อย่างเช่น Okex และ Gate.io ที่ถูกโอนย้าย BTC ออกจากแพลตฟอร์มแม้ว่าจะมีขนาดเล็กกว่าก็ตาม โดยผู้ใช้ถอน 5,872 BTC จาก Okex และ 95 BTC จาก Gate.io ตามทวีตของ Wu จะเห็นได้ว่ากระดานเทรดรายใหญ่ เช่น Binance, Bitfinex และแพลตฟอร์ม crypto ที่ใหญ่ที่สุดในสหรัฐฯ คือ Coinbase กำลังเห็น Bitcoin ไหลเข้าจำนวนมาก โดยมากกว่า 7,000 BTC ถูกโอนไปยัง Binance และเกือบ 5,000 BTC ไปที่ Bitfinex รวมถึง 122 BTC ถูกย้ายไปที่ Coinbase Huobi และ Binance กำลังลดผู้ใช้งานในประเทศจีน ก่อนหน้านี้ Huobi ได้ประกาศว่าจะหยุดให้บริการแก่ผู้ค้า",https://siamblockchain.com/2021/10/05/nearly-13900-btc-is-flowing-out-of-crypto-exchanges-what-happened-to-these/,05_10_2021
