title,summary,link,published
CEO JPMorgan ยังคงมองว่า Bitcoin นั้น “ไร้ค่า” แม้ลูกค้าของเขาจะไม่เห็นด้วย,ดูเหมือนว่าล่าสุดนาย Jamii Dimon ซีอีโอของบริษัทธนาคารยักษ์ใหญ่ JP Morgan Chase จะออกมากล่าวโจมตี Bitcoin อีกครั้งหนึ่ง ในระหว่างการประชุมประจำปีของสมาคมอุตสาหกรรมการเงินระดับโลก (IFF) เมื่อวันที่ 11 ตุลาคม โดยเขาได้กล่าวยืนยันถึงจุดยืนเดิมที่เป็นอคติต่อ Bitcoin ว่า เหรียญคริปโตเบอร์หนึ่งของโลกนั้น “ไร้ค่า” อย่างไรก็ตาม Dimon ยอมรับว่า ความคิดเห็นของเขาอาจไม่ใช่เรื่องที่ลูกค้าของบริษัทเห็นด้วย “โดยส่วนตัวแล้วผมคิดว่า bitcoin นั้นไร้ค่า อย่างไรก็ตามลูกค้าของเราเป็นผู้ใหญ่มากพอและส่วนใหญ่พวกเขาไม่เห็นด้วยกับผม” Dimon กล่าว “หากพวกเขาต้องการเข้าถึงและซื้อ bitcoin ให้กับตัวเอง เราไม่อาจปฏิเสธสิ่งนี้ได้ แต่เราจะต้องทำให้การเข้าถึง Bitcoin นั้นเป็นเรื่องที่ถูกต้องตามกฎหมายมากที่สุดเท่าที่จะเป็นไปได้” แน่นอนว่าชุมชนคริปโตนั้นได้ออกมาตอบสนองต่อความเห็นของ Dimon อย่างรวดเร็ว โดยผู้ใช้ทวีตรายหนึ่งพยายามชี้ให้เห็นว่าการมองโลกในร้ายของซีอีโอ JP Morgan นั้นไม่ใช่ครั้งแรก และการเติบโตเพิ่มขึ้นของ Bitcoin ก็เป็นการพิสูจน์ให้เห็นแล้วว่าเขาคิดผิดมาโดยตลอด ในขณะเดียวกันนาย Michael Saylor ซีอีโอของ MicroStrategy ก็ได้ออกมาร่วมวงแสดงความคิดเห็นด้วยว่า นี่อาจเป็นสาเหตุที่ Dimon และนายธนาคารอื่น ๆ รู้สึกผิดหวังกับการเพิ่มขึ้นของราคา Bitcoin ในอดีต เพราะพวกเขาไม่เข้าใจว่า Bitcoin นั้นทำงานอย่างไรและสามารถทำอะไรได้บ้าง เช่นเดียวกับนักวิเคราะห์ชื่อดัง Plan B ซึ่งเป็นผู้ที่รู้จักกันดีในฐานะผู้สร้างโมเดลคาดการณ์ราคา Bitcoin สุดแม่นยำ Stock-to-Flow ที่ได้มีการแชร์ภาพ meme เกี่ยวกับการ Fud ของ Dimon ที่มักจะเกิดขึ้นก่อนเริ่มต้นเข้าสู่ช่วง Bull run,https://siamblockchain.com/2021/10/12/jpmorgan-chase-ceo-still-thinks-bitcoin-is-worthless-but-his-clients-disagree/,12_10_2021
Ripple ประกาศสนับสนุนโครงการพลังงานทดแทน เพื่อชดเชยการปล่อยก๊าซคาร์บอนในอุตสาหกรรม Crypto,เมื่อเร็ว ๆ นี้ Ripple ได้ประกาศความร่วมมือกับทาง Nelnet ซึ่งเป็นบริษัทผู้ให้บริการทางการเงินในเมืองลินคอล์น โดยการร่วมมือกันในครั้งนี้เป็นส่วนหนึ่งในข้อตกลงร่วมลงทุนเงินเป็นมูลค่ากว่า 44 ล้านดอลลาร์สหรัฐฯ ในแผนกธุรกิจพลังงานหมุนเวียนของบริษัท เพื่อจัดหาเงินทุนสำหรับโครงการพลังงานแสงอาทิตย์ในสหรัฐฯ อเมริกา นาย Ken Weber หัวหน้าฝ่าย Social Impact ของ Ripple อ้างว่า การชดเชยการปล่อยก๊าซคาร์บอนควรเป็นหนึ่งในความสำคัญอันดับแรก ๆ ในทุกอุตสาหกรรม รวมถึงอุตสาหกรรมคริปโต : “การรับประกันอนาคตด้วยพลังงานสะอาดคือ สิ่งที่สำคัญเป็นอันดับแรกของทุกอุตสาหกรรม มันไม่เพียงแต่จะขับเคลื่อนการเติบโตทางเศรษฐกิจในอนาคตเท่านั้น แต่ยังช่วยให้โลกมีความยั่งยืนก้าวหน้ามากขึ้นอีกด้วย ในขณะที่การยอมรับของ cryptocurrency และเทคโนโลยี blockchain ยังคงเติบโตเพิ่มขึ้นอย่างต่อเนื่อง เห็นได้ชัดว่าเทคโนโลยีจะสนับสนุนระบบการเงินของเราในอนาคต” โดยคาดว่าโครงการที่ได้รับเงินทุนจาก Ripple จะสามารถชดเชยการปล่อยก๊าซคาร์บอนไดออกไซด์ไบโอเมตริกซ์ได้มากกว่า 1.5 ล้านตัน Nelnet เริ่มเปิดให้บริการแก่นักพัฒนาธุรกิจในเดือนมิถุนายน 2020 เพื่อพยายามขยายธุรกิจให้มีความหลากหลายมากขึ้น ซึ่งเดิมทีบริษัทได้ทำงานเกี่ยวกับอุตสาหกรรมกู้ยืมของนักศึกษา และเริ่มให้เงินทุนสนับสนุนโครงการพลังงานแสงอาทิตย์ในปี 2018Ripple เป็นหนึ่งในบริษัทด้านเทคโนโลยีที่คำนึงถึงสภาพแวดล้อมมากที่สุด เห็นได้จากเมื่อช่วงต้นเดือนเมษายนที่ผ่านมา บริษัทได้กลายเป็นส่วนหนึ่งในข้อตกลง Crypto Climate ร่วมกับทาง Consensys และ CoinShares,https://siamblockchain.com/2021/10/12/ripple-to-support-solar-energy-projects-to-reduce-crypto-industrys-carbon-footprint/,12_10_2021
ข้อมูลเผยนักเทรด Bitcoin ยังไม่ต้องการขายเหรียญ แม้ราคาจะพุ่งแตะจุดสูงสุดในรอบ 5 เดือน,"ตามรายงานล่าสุดจากผู้ให้บริการวิเคราะห์ข้อมูลบนเครือข่าย Glassnode เผยว่า นักลงทุน Bitcoin ในระยะยาวยังไม่ต้องการที่จะเทขายเหรียญของตนในเวลานี้ แม้ว่ามูลค่าตลาด Bitcoin จะมีมูลค่าเพิ่มขึ้นอย่างรวดเร็วแตะจุดสูงสุดในรอบ 5 เดือน ตามรายงาน “Week on Chain” ของ Glassnode ในวันที่ 11 ตุลาคมตั้งข้อสังเกตว่า กระเป๋าเงิน Bitcoin ที่ไม่มีการเคลื่อนไหวเงินมานานกว่า 155 วัน ตอนนี้ได้ถือครอง Bitcoin ไว้ทั้งหมดเป็นจำนวนกว่า 13,300,000 BTC หรือคิดเป็น 70% ของอุปทานของ Bitcoin ทั้งหมดที่หมุนเวียนอยู่ในระบบ รายงานระบุว่า กระเป๋าเงินเหล่านี้ได้สะสม Bitcoin เพิ่มเติมกว่า 2.37 ล้าน BTC ในช่วงตลอด 7 เดือนที่ผ่านมา ในขณะที่มี Bitcoin เพียง 186,000 BTC เท่านั้นที่ขุดขึ้นมาใหม่ในช่วงเวลาเดียวกัน Glassnode สรุปว่า นักลงทุนระยะยาวได้มีการเก็บสะสม Bitcoin เพิ่มคิดเป็นจำนวนกว่า 12.7 เท่า เมื่อเทียบกับอุปทานที่ถูกสร้างขึ้นมาใหม่บนเครือข่าย นอกจากนี้ Glassnode ยังตั้งข้อสังเกตด้วยว่า หลังราคาของ Bitcoin พุ่งขึ้นแตะจุดสูงสุดใหม่ที่ 57,860 ดอลลาร์ในวันที่ 12 ต.ค. กิจกรรมบนเครือข่ายก็ดูเหมือนจะเพิ่มขึ้นด้วยเช่นกัน ในเดือนตุลาคม จำนวน Address ที่มีการใช้งานบนเครือข่ายเพิ่มขึ้นกว่า 19% เป็น 291,000 Address ซึ่งเป็นระดับที่ไม่เคยเห็นมาก่อน นับตั้งแต่เดือนธันวาคม 2020 โดย Glassnode ชี้ให้เห็นว่ากิจกรรมที่พุ่งสูงขึ้นนี้อาจมาจากความคาดหวังในช่วงขาขึ้นของนักลงทุน นอกจากนี้ Glassnode ยังได้สังเกตเห็น ขนาดการทำธุรกรรมเฉลี่ยบนเครือข่ายที่เพิ่มขึ้นเป็นประมาณ 1.3 BTC ต่อการโอนหนึ่งครั้ง ซึ่งบ่งชี้ให้เห็นถึง กระแสเงินลงทุนที่มาจากนักลงทุนสถาบัน เมื่อวันที่ 12 ต.ค. Glassnode รายงานว่า ยอดคงเหลือของ Bitcoin",https://siamblockchain.com/2021/10/12/long-term-bitcoin-bulls-hodl-strong-despite-five-month-price-high/,12_10_2021
เว็บเทรดคริปโตระดับโลก FTX ประกาศเปิดตัวตลาด Solana NFT Marketplace ในสหรัฐอเมริกา,"อ้างอิงตามทวีตล่าสุดของ FTX ที่เผยแพร่ในวันนี้ เว็บเทรดคริปโตอันดับต้น ๆ ของโลกได้ประกาศเปิดตัวตลาด Solana NFT Marketplace อย่างเป็นทางการ เพื่อช่วยให้เหล่าศิลปินและนักสะสม NFT ได้เข้ามามีส่วนร่วมแพลตฟอร์มของตน ทั้งนี้คอลเลกชัน NFT ใดๆ ที่จะทำธุรกรรมในตลาดแห่งใหม่นี้จะต้องดำเนินการอยู่บนเครือข่าย Solana blockchain เท่านั้น แต่ในอนาคตอันใกล้นี้แพลตฟอร์มมีแผนที่จะรองรับ NFT บน Ethereum blockchain ด้วย FTX.US North American ซึ่งเป็นบริษัทในเครือของ FTX ได้ประกาศอนุญาตให้ผู้ใช้สามารถ Mint, Remove, Edit และเทรด NFT บนตลาดใหม่แห่งนี้ได้ โดยแพลตฟอร์มดังกล่าวจะถูกรวมเข้ากับแพลตฟอร์มหลักของ FTX.US Solana NFT Marketplace จะเรียกเก็บค่าธรรมเนียมอยู่ที่ 2% จากทั้งผู้ซื้อและผู้ขายหรือการแลกเปลี่ยนในแต่ละครั้ง พร้อมกับค่าธรรมเนียม 1 ดอลลาร์สำหรับการ Mint หรือลิสต์ NFT Metaplex NFT ทั้งนี้ทั้งนั้นโทเค็นทั้งหมดบนแพลตฟอร์มจะใช้โปรโตคอลของ Metaplex Solana เท่านั้น จึงทำให้เข้าใจว่าผู้ใช้แพลตฟอร์มจำเป็นจะต้องปฏิบัตตามข้อกำหนดระบุตัวตน KYC ที่เข้มงวดสำหรับการซื้อขาย NFT ต่างจากตลาดชั้นนำอื่น ๆ เช่น OpenSea Solana NFT Marketplace จะรองรับการโอนเงินผ่านธนาคารและบัตรเครดิตเพื่อซื้อ NFT ด้วยโทเค็นที่ถูกสร้างขึ้นใหม่ในสกุลเงิน USD, SOL หรือ ETH แม้จะมีข่าวดีเกี่ยวกับการเปิดตัวตลาด NFT แห่งใหม่ แต่ดูเหมือนว่าราคาของเหรียญ SOL จะร่วงลดลงเล็กน้อยในวันนี้ โดยลดลง 5.5% ในช่วง 24 ชั่วโมงที่ผ่านมา อ้างอิงข้อมูลจาก CoinGecko",https://siamblockchain.com/2021/10/12/ftx-launches-solana-nft-marketplace-in-the-united-states/,12_10_2021
“Sorare” เกม Card สะสมฟุตบอล NFT กำลังถูกเพ่งเล็งจากหน่วยงานกำกับดูแลของประเทศอังกฤษ,คณะกรรมการการพนันแห่งประเทศอังกฤษ (UK Gambling Commission) คือ หน่วยงานด้านการออก ใบอนุญาตคาสิโน คาสิโนออนไลน์ เป็นหน่วยงานใหญ่ระดับโลก ขึ้นตรงกับสถาบัน แห่งรัฐบาลอังกฤษ ได้โพสต์คำแถลงเมื่อวันศุกร์ที่ผ่านมาว่า “คณะกรรมการกำลังดำเนินการสอบถามข้อมูลกับบริษัทเพื่อตรวจสอบว่า Sorare.com ต้องมีใบอนุญาตประกอบการหรือไม่ และบริการที่เปิดอยู่นั้นเข้าข่ายเป็นการพนันหรือไม่” ในขณะเดียวกันทางด้าน Sorare ได้ออกมาตอบสนองต่อการประกาศอย่างรวดเร็ว โดยระบุว่า พวกเขามีความมั่นใจอย่างมากว่า แพลตฟอร์มของพวกเขาไม่มีบริการใดที่เป็นเข้าข่ายเป็นการพนัน “สิ่งนี้ได้รับการยืนยันจากความคิดเห็นทางกฎหมายของผู้เชี่ยวชาญในทุกขั้นตอน นับตั้งแต่เริ่มก่อตั้งบริษัท รวมถึงในระหว่างการระดมทุนหลายครั้ง” Sorare กล่าวเสริม พร้อมกันนี้บริษัทยังกล่าวด้วยว่า พวกเขาจะให้ความร่วมมืออย่างเต็มนี้กับหน่วยงานกำกับดูแลเพื่อปฏิบัตตามกฎระเบียบอย่างเคร่งครัด อย่างไรก็ตามแม้ Sorare อาจไม่ได้นำเสนอรูปแบบการพนัน แต่ทั่วไปแล้ว NFT นั้นยังคงมีลักษณะที่เข้าข่ายเป็นการเก็งกำไร เนื่องจากค่านิยมของพวกมันที่สามารถผันผวนขึ้นลงได้ตลอดเวลา ดังนั้นด้วยคุณสมบัติเหล่านี้มันอาจทำให้คณะกรรมาธิการตีความได้ว่า Sorare เป็นหนึ่งในเกมการพนันที่เข้าข่ายลักษณะการเก็งกำไรนั่นเอง เมื่อไม่นานมานี้ Sorare เพิ่งระดมทุนรอบ Series B ได้รับเงินมูลค่ากว่า 680 ล้านดอลลาร์ ซึ่งการเปิดระดมทุนดังกล่าวทำให้ Sorare ถูกประเมินมูลค่าทั้งหมดอยู่ที่ 4.3 พันล้านดอลลาร์ นำโดยนักลงทุนที่มีชื่อเสียง เช่นผู้ร่วมก่อตั้ง Reddit และนาย Alexis Ohanian ผู้ก่อตั้ง Seven Seven Six เข้ามาร่วมลงุทนด้วย นอกเหนือจากการระดมทุนแล้ว Sorare ยังได้ประกาศถึงการแผนการที่จะเปิดตัวสำนักงานใหญ่ในสหรัฐอเมริกาอีกด้วย พร้อมเพิ่มทีมฟุตบอลหญิง และขยายแบรนด์ NFT ไปสู่กีฬาอื่น ๆ เพิ่มเติม,https://siamblockchain.com/2021/10/12/uk-gambling-watchdog-sorare-soccer-nft/,12_10_2021
