title,summary,link,published
ประเทศจีนเตรียมหาทางออกกฎหมายที่เข้มงวดกับวงการ Crypto อีกครั้ง,ผู้ใกล้ชิดกับรัฐบาลจีนบอกกับนิตสาร Caijing เกี่ยวกับความเป็นไปได้ของมาตราการที่จะเกิดขึ้นเพื่อเพิ่มความเข้มงวดและข้อจำกัดของอุตสาหกรรม cryptocurrency ที่จะทำเสนอต่อสาธารณชน แม้ว่ากิจกรรมเชิงพานิชย์ใด ๆ ก็ตามที่เชื่อมโยงกับ cryptocurrency ต่างถือว่าผิดกฎหมายในประเทศจีนแต่ก็ไม่มีกรอบการอนุมัติทางกฎหมายสำหรับบริษัทที่กระทำการเช่นนี้ นึงไม่สามารถบังคับใช้กฎหมายปัจจุบันกับหน่วยงานดังกล่าวได้และนั่นคือเหตุผลสำคัญว่าทำไมรัฐบาลจีนกำลังมองหาการตีความทางกฎหมายคริปโตใหม่ อ้างอิงจาก Caijing ว่าธนาคารกลางกำลังดิ้นหนเพื่อค้นหาวิธีการที่ถูกต้องในการดำนเนินการตามข้อกำหนดด้านกฎระเบียบ แม้ว่าปัจจุบันหน่วยงานกำกับดูแลกำลังอยู่ในช่วงการปราบปรามอุตสาหกรรมการขุด crypto และสกุลเงินดิจิทัลก็ตาม แต่ตอนนี้ดูเหมือนว่าจีนแผ่นดินใหญ่กำลังศึกษาและตั้งคำถามเพื่อค้นหาแนวทางในการกำกับดูแลกำลังขุด crypto อย่างถูกต้องรวมถึงกำหนดแนวทางสำหรับการตัดสินลงโทษและการพิจารณาคดี ในขณะที่สถาบันความปลอดภัยมีหน้าที่รับผิดชอบในการดำเนินการประกาศข้อกำหนดจากธนาคารกลางที่กำลังถูกใช้เป็นคำสั่งเพื่อจัดการผู้ที่อยู่ภายใต้การกำกับดูแลอย่างหมดจด ปัจจุบันบริษัทในประเทศจีนไม่ได้รับอนุญาตให้บริการใด ๆ แก่ธุรกิจที่เกี่ยวข้องกับอุตสาหกรรมคริปโทเคอร์เรนซี่ทั้งในและต่างประเทศ ซึ่งรวมถึงบริษัทที่ทำงานในต่างประเทศและให้บริการกับชาวจีนก็ต้องรับผิดชอบตามกฎหมายของประเทศจีนด้วย อย่างไรก็ตามชาวจีนไม่สามารถเป็นส่วนหนึ่งในการแลกเปลี่ยนแบบ P2P บนแพลตฟอร์มใด ๆ ได้แล้วเป็นที่เรียบร้อย แม้ว่าประกาศนั้นจะเป็นการควบคุมบริษัทเป็นส่วนใหญ่แต่บุคคลที่ให้บริการแลกเปลี่ยนสกุลเงินดิจิทัลบนแพลตฟอร์มของบริษัทแลกเปลี่ยนชื่อดังอย่าง Binance ก็ถือว่าเข้าเงื่อนไขดังกล่าวและจะต้องรับผิดชอบตามกฎหมายเช่นเดียวกัน,https://siamblockchain.com/2021/10/12/china-is-again-looking-for-austerity-in-the-crypto-industry/,12_10_2021
"ราคา BTC ทะลุ 57,400 ดอลลาร์อีกครั้งแม้จะร่วงลงแตะ 51,000 ดอลลาร์ในสุดสัปดาห์ก็ตาม","ตลาดกระทิงของ Bitcoin ได้กวาดซื้อทุกขาลงหลังจากราคาร่วงจากจุดสูงสุด ซึ่งดูเหมือนว่ารอบทุดท้ายของตลาดกระทิงใน Q4 นั้นอาจเป็นไปตามที่นักวิเคราะห์ cryptocurrency ชื่อดังได้คาดการณ์ไว้ Bitcoin (BTC) ในขณะนี้ทำให้ตลาดเต็มไปด้วยการคาดการเกี่ยวกับ Wall Street ที่จะทำการเปิดตัวในวันที่ 11 ตุลาคม หลังจากถูกปฏิเสธไปเมื่อคาดว่าจะแตะระดับสูงสุดตั้งแต่เดือนพฤษภาคม นักวิเคราะห์ชี้ราคา Bitcoin อาจพุ่งถึง 1 แสนดอลลาร์ ข้อมูลจาก Cointelegraph Markets Pro และ TradingView แสดงให้เห็นว่า BTC/USD ได้ทำการแตะระดับราคาที่ 57,000 หลังจากทำจุดสูงสุดที่ 57,450 ดอลลาร์บน Bitstamp ตั้งแต่วันที่ 10 พฤษภาคม ซึ่งจากการที่ Bitcoin สามารถไต่ระดับขึ้นในระดับราคานี้ได้ ก็ส่งผลให้เห็นว่าเหรียญดิจิทัลอันดับ 1 นี้ไม่ได้รับผลกระทบจากการล่มสลายเนื่องจากแรงขุดจากเหมือง Bitcoin ในประเทศจีนได้ลดลงจากการปราบปราม จนทำให้อัตรา Hash rate กระจายไปทั่วโลก ท่ามกลางอารมณ์การเฉลิมฉลองในหมู่นักวิเคราะห์คริปโทเคอร์เรนซี่ ก็ได้มีการคาดคะแนว่า BTC จะมุ่งเข้าสู่หกหลักในไม่ช้าก็เร็ว โดยจากข้อมูลทั้งหมดจากการวิเคราะห์ของเทรดเดอร์และนักวิเคราะห์ Rekt Capitalเผยว่า BTC จะพุ่งขึ้นสูงสุดมากกว่า 100,000 ดอลลาร์ในรอบนี้ วิกฤตอุปทานบิตคอยน์กลายเป็นกระแสหลัก ดูเหมือนว่า BTC จะมีเสน่ห์แบบที่ไม่ซ้ำใครเนื่องจากเป็นเหรียญที่จำกัดอุปทาน แม้ว่า BTC มีแนวโน้มขาขึ้นบ่อยครั้ง แต่เมื่อกับกับการเพิ่มขึ้นของหนี้สินของสหรัฐฯ และความตึงเครียดในช่วงที่ Bitcoin เริ่มเข้ามามีประสิทธิภาพนั้นอาจจะเข้าสู่ระยะสำคัญของการเพิ่มขึ้นของราคา BTC ใน Q4 ทั้งนี้ Mike McGlone นักยุทธศาสตร์อาวุโสได้กล่าวลงในทวีตของเขาว่า “เพดานหนี้อาจทำงานกับผู้จัดการที่หลีกเลี่ยงการจัดสรร Bitcoin” อย่างไรก็ตามความกังวลเรื่องหนี้สินของสหรัฐฯ ต่อคริปโทเคอร์เรนซี่อันดับที่หนึ่งนั้นไม่ได้ทำให้ค่าเงินดอลลาร์เป็นกังวลเมื่อต้นสัปดาห์ อีกทั้งยังส่งผลให้ดัชนีค่าเงินดอลลาร์สหรัฐ (DXY) พุ่งขึ้นเหนือแนวรับ 94 อีกครั้ง",https://siamblockchain.com/2021/10/11/btc-price-hits-57400-again-despite-falling-to-51000-over-the-week/,12_10_2021
25% ของ ETH ถูกโอนออกนอกเว็บกระดานเทรดในปีที่ผ่านมา สิ่งนี้จะส่งผลอะไร และควรกังวลไหม?,Ethereum ในกระดานเทรดนั้นมีมากกว่า 24 ล้าน ETH ซึ่งทั้งหมดถูกบันทึกในเดือนมกราคมปี 2021 แม้ว่าจะมีการลดลงอย่างต่อเนื่องจากการอัปเกรด London Hardfork ที่มีการเผาเหรียญอย่างต่อเนื่องในทุกเดือนจนกระทั่งตอนนี้เหลือเพียง 18 ล้าน ETH เท่านั้นที่อยู่ในกระดานเทรดอย่าง Coinbase หรือ Kraken จำนวนเหรียญในเว็บกระดานเทรดนี้ดูเหมือนว่าจะสอดคล้องกับราคาอย่างมีนัยสำคัญแต่ก็พูดได้อย่างไม่เต็มปาก เนื่องจากช่วงเมษายนถึงมิถุนายนในปีนี้นั้นอุปทานทั้งหมดจากกระดานเทรดดูเหมือนจะคงที่แต่ราคากลับเพิ่มขึ้นเป็นสองเท่าก่อนจะลดลงในช่วงตลาดล่มที่ผ่านมา ดูเหมือนว่าการเพิ่มขึ้นของราคานั้นจะดูสอดคล้องและไม่สอดคล้องกับจำนวนเหรียญในกระดานเทรดในเวลาเดียวกัน แต่ก็อาจจะเป็นไปได้ว่าการเพิ่มขึ้นของราคานั้นอาจเกิดจากการที่ DeFi ได้เพิ่มทางเลือกให้กับผู้ถือ ETH มากขึ้น จำนวน ETH ที่เกี่ยวข้อง DeFi ในช่วงฤดูร้อนนั้นได้เพิ่มขึ้นประมาณ 2 ล้าน ETH ระหว่างเดือนมีนาคมถึงเมษายน อย่างไรก็ตามอุปทานในกระดานเทรดได้ลดลงอย่างต่อเนื่อง แต่อุปทานใน DeFi นั้นดูเหมือนจะเพิ่มขึ้นอย่างต่อเนื่องเป็น 7.4 ล้าน ETH หรือมูลค่าประมาณ 2.64 หมื่นล้านดอลลาร์ นั่นทำให้เห็นว่ามีจักรวาลคู่ขนานถูกสร้างถึงภายในอุตสาหกรรม crypto ทั้งนี้ดูเหมือนว่า 7 ล้าน ETH ที่ถูกนำออกจากการหมุนเวียนในกระดานเทรด จะมีประสิทธิภาพมากกว่าเมื่ออยู่ในแพลตฟอร์ม DeFi ที่ทำให้มูลค่านั้นเติบโตอย่างไม่ยุติธรรมเมื่อเทียบกับเมื่อตอนอยู่ในกระดานเทรด ทั้งนี้เหรียญอันดับสองนี้ยังคงดำเนินการเผาไหม้มากกว่าครึ่งล้านและดูเหมือนว่าจะถูกเผาต่อไปเรื่อย ๆ อย่างต่อเนื่อง แม้ว่าตอนนี้กว่า 20% ของอุปทานทั้งหมดของ Ethereum ที่ถูกนำออกจากการหมุนเวียนในกระดานเทรดก็ตาม อย่างไรก็ตามนั่นเป็นวิกฤตอุปทานของ ETH อย่างที่ไม่เคยเห็นมาก่อน แม้ว่า DeFi ได้เพิ่มโอกาสใหม่ ๆ ให้กับเหรียญที่มีมูลค่าตลาดรวมเป็นอันดับที่สองอย่าง ETH นี้ก็ตาม,https://siamblockchain.com/2021/10/11/25-percent-of-eth-was-transferred-off-the-board-in-the-past-year-what-effect-will-this-have-and-should-i-be-worried/,12_10_2021
SHIB กำลังดีดขึ้นท่ามกลางการเทขายเหรียญที่ใหญ่ที่สุดในประวัติศาสตร์,หลังจากที่เหรียญมีมนี้ได้เติบโตขึ้นไปกว่า 300% ในสัปดาห์ที่ผ่านมาจากการทวีตถึงสุนัขชิบะอินุตัวใหม่ของ Elon Musk ซึ่งดูเหมือนว่า SHIB ได้ผ่านการเทขายเหรียญที่ใหญ่ที่สุดในประวัติศาสตร์นับตั้งแต่เหรียญได้ก่อตั้งมา ตามข้อมูลของ Santiment ได้แสดงให้เห็นว่าการซื้อขายโทเคนตั้งแต่เริ่มต้นในเดือนพฤษภาคมหลังจากจดทะเบียนใน Binance ครั้งแรกโดยแสดงให้เห็นถึงการเพิ่มขึ้นของราคากว่า 250% แต่ต่อมาก็ได้ลดลงกว่า 50% ภายในสองวัน อย่างไรก็ตามการถ่ายโอนข้อมูลบนเครือข่าย SHIB นั้นเกิดขึ้นจากผู้ถือครองเหรียญขนาดเล็กกว่า 1-10 ล้าน SHIB ทำให้เหรียญมีมนี้จะถูกเทขายในตลาดโดยตรงมากกว่า 3 หมื่นล้านเหรียญเนื่องจากราคาเหรียญที่พุ่งขึ้นอย่างรวดเร็ว แต่หลังจากการลดลงของราคาได้ไม่นาน กำลังซื้อเหรียญมีมดังกล่าวก็ได้กลับมาอย่างมีนัยสำคัญทำให้ราคาเติบโตขึ้นกว่า 22% ทำให้ตอนนี้ SHIB ยังคงเป็นสินทรัพย์ที่มีความผันผวนสูงและยังมีจำนวนเหรียญอยู่ในระดับที่สูงมาก อย่างไรก็ตามในปัจจุบัน Shiba Inu มีการเติบโต 10% ต่อวันและได้ใกล้ชิดกับ All Time High ขึ้นทุกวัน แม้ว่าตลอดที่ผ่านมาผู้ซื้อขายกำลังสูญเสียความสนใจในสินทรัพย์ก็ตามจากการอ้างอิงปริมาณการซื้อขายบน Binance ที่ลดลงจาก 240 ล้านล้าน SHIB เหลือน้อยกว่า 30 ล้านล้าน,https://siamblockchain.com/2021/10/11/shib-rising-amid-largest-coin-sales-in-history/,12_10_2021
Charles Hoskinson เตรียมขยายเทคโนโลยีของ Cardano ไปยังแอฟริกา หวังเป็นเจ้าตลาด,Charles Hoskinson CEO ของ Input Output Global และผู้ก่อตั้ง Cardano กลับมาจากวันหยุดพักผ่อนสุดสัปดาห์ใน Wyoming และได้ออกมาเตือนนักลงทุน cryptocurrency ว่าทัวร์ Cardano ของเขาในแอฟริกากำลังจะเริ่มต้นในไม่ช้านี้ Hoskinson กลับมาแล้วหลังจากห่างหาย Twitter ไปซักพัก เมื่อวันที่ 30 กันยายนที่ผ่านมา ผู้ก่อตั้ง Cardano ได้ทวีตว่าการอัปเกรด Alonzo Hardfork นั้นได้เกิดขึ้นเป็นที่เรียบร้อยแล้วและสิ่งต่าง ๆ ก็กำลังดำเนินไปอย่างราบรื่น โดยเขาขอลาพักร้อนเป็นเวลาสองสัปดาห์ซึ่งวางแผนว่าจะพักผ่อนโดยไม่มีโซเชียลมีเดียและงานที่เกี่ยวกับ Cardano เข้ามาเกี่ยวข้องตลอดระยะเวลา นั่นทำให้บางคนในชุมชนสงสัยว่า Hoskinson จะสามารถอยู่ห่างจากงานที่เขารักได้ที่เพิ่งกลายเป็นบล็อกเชนแบบ proof-of-stake อันดับสามขอโลกและกลายมาเป็นเหรียญที่มีความนิยมอยู่สุดในขณะนี้ โดยชุมชนต่างคาดหวังว่าเขาจะทำตัวเหมือน Elon Musk ซึ่งได้ทวีตว่าจะปิด Twitter สักพักก่อนจะกลับมาในอีก 2-3 วันต่อมา อย่างไรก็ตาม CEO ของ IOG ยึดมั่นในคำสัญญาของเขาและไม่มีใครเห็นทวีตตั้งแต่วันที่ 30 กันยายน และได้กลับมาโพสต์ทวีตว่าพร้อมกลับมาลุยงานต่อ พร้อมกับเตือนชุมชนว่าทัว Cardano ในแอฟริกากำลังจะเริ่มต้นในเร็ว ๆ นี้และเขาก็จะเข้าร่วมด้วย ทั้งนี้ทัวร์ที่เกิดขึ้นในจะเริ่มในแอฟริกาใต้และจะมุ่งหน้าต่อไปยังอียิปต์ ซึ่งดูเหมือนว่ากองทุนที่ได้ลงทุนไว้กว่า 6 ล้านดอลลาร์ในช่งที่ผ่านมานั้นจะมุ่งเน้นไปที่การสร้างบล็อกเชนบนเครือข่าย Cardano ในแอฟริกา Cardano สนับสนุนนวัตกรรมที่ใช้ DLT ทีมงานของ Cardano จะเดินทางไปทั่วแอฟริกา เป้าหมายคือการมีส่วนร่วมในการเลือกสตาร์ทอัพ ซึ่งไม่เพียงได้รับการสนับสนุนทางการเงินที่จำเป็นจากกองทุน VC เท่านั้นแต่ยังได้รับคำปรึกษาที่จำเป็นและการสนับสนุนอื่น ๆ อีกด้วย ขณะนี้ IOG กำลังทำงานเพื่อให้การศึกษาด้านไอทีในส่วนต่าง ๆ ของประเทศ ให้มีฐานขนาดใหญ่ แม้กระทั่งในในเอธิโอเปีย IOG ก็ได้ร่วมมือกับรัฐบาลและทำงานร่วมกับครูอีก 5 ล้านคนเพื่อผลักดันให้นักเรียนที่มีอนาคตสดใส อย่างไรก็ตามทีมงานของ Cardano ที่พร้อมด้วย CEO จะเดินทางไปทั่วแอฟริกาเพื่อพบกับหัวหน้าของสตาร์ทอัพที่เป็นนวัตกรรมใหม่และบุคคลสำคัญทางการทูต และทัวร์นี้จะครอบคลุมพื้นที่ต่าง ๆ เช่น แซนซิบาร์ แอฟริกาใต้ บุรุนดู,https://siamblockchain.com/2021/10/11/charles-hoskinson-to-expand-cardano-technology-to-africa/,12_10_2021
