title,summary,link,published
ราคา Bitkub Coin วิ่งเข้าใกล้ 30 บาทอย่างช้า ๆ 2 วันก่อนเปิดตัวเกม Morning Moon Village หรือเราอาจเห็น ATH?,ราคาของเหรียญขวัญใจชาวไทย Bitkub Coin นั้นดูเหมือนว่าจะมีการพุ่งขึ้นอย่างช้า ๆ ในวันนี้ โดยล่าสุดนั้นมันได้วิ่งไปแตะจุดสูงสุดในรอบเดือนนี้ที่ 29.15 บาทแล้ว กราฟ KUBTHB จาก TradingView เผยให้เห็นว่าราคาของเหรียญ Bitkub Coin นั้นได้มีการปรับตัวขึ้นติดต่อกันวันนี้เป็นวันที่ 5 จากเมื่อวันที่ 13 ตุลาคมที่ผ่านมา โดยจุดต่ำสุดของราคาในวันนี้อยู่ที่ 25.81 บาท ขึ้นมาอยู่ที่ระดับ 27.80 บาทในวันนี้ บ่งบอกถึงอารมณ์ของตลาดที่กำลังรอคอยอะไรบางอย่าง อย่างไรก็ตาม หากอ้างอิงจากหน้าเพจของเกมบน Blockchain ของ Bitkub Coin อย่าง Morning Moon Village นั้น พวกเขาเผยว่าตัวเกมจะมีการเปิดตัวอย่างเป็นทางการในวันที่ 21 ตุลาคมนี้ หลังจากที่เพิ่งเปิดให้ทดสอบเล่นในเวอร์ชัน closed beta กันไปเมื่อไม่นานมานี้ ตามที่ทางสยามบล็อกเชนเคยรายงานไปก่อนหน้านี้ เกม Morning Moon นั้นจะเป็นเกมแรกบนบล็อกเชนของ Bitkub ซึ่งรูปแบบการเล่นจะมีกลิ่นอายของการทำฟาร์ม ปลูกพืชผัก เข้าป่าหาทรัพยากร และการจำลองตัวละครในเกม ซึ่งจุดนี้มีการนำเอา NFT และ Yield Farming เข้ามาอยู่ในเกมด้วย ทำให้ได้รับความสนใจเป็นอย่างมาก และเหรียญ Token ประจำเกมอย่าง LUMI ก็มีกลไกที่น่าสนใจไม่แพ้กัน คุณป๊อบ เนนิน อนันต์บัญชาชัย หรือผู้พัฒนาเกม Morning Moon Village เคยกล่าวให้สัมภาษณ์กับสยามบล็อกเชนว่า “ในอนาคตเหรียญ LUMI มีแพลนที่จะนำไปอยู่ที่อื่นด้วยนอกจากในตัวเกม อย่างพวก Decentralized Exchange หรือ Centralized Exchange เพื่อให้มันมีสภาพคล่องที่มากขึ้น” พร้อมเสริมว่า “ผมยังเชื่อว่า Morning Moon Village ยังสามารถสร้างอะไรได้เหมือน Axie Infinity อาจจะมีเป็น Landing ตราบใดที่คอมมูนิตี้มันใหญ่ขึ้น ในอนาคตมันต่อยอดไปได้อีกเพราะ NFT มันกว้าง,https://siamblockchain.com/2021/10/19/bitkub-coin-approaching-30-thb/,2021_10_19
คนไทยโดนแฮก เงินหาย หรือ Crypto จะเป็นคำตอบสุดท้ายในการเก็บเงิน ?,เมื่อวานนี้สื่อข่าวหลายสำนักได้ออกมาเผยแพร่เรื่องราวเกี่ยวกับกรณีที่ประชาชนจำนวนมากได้รับความเดือดร้อนจากการถูกดูดเงินและการหักเงินในบัญชีบัตรเครดิตและบัตรเดบิตทั้ง ๆ ที่ไม่ได้ทำธุรกรรมใด ๆ โดยส่วนใหญ่พบว่ามีการถูกตัดเงินในบัญชีพร้อมกับข้อความที่แจ้งว่า “Purchase via EDC” แน่นอนว่าเรื่องราวที่เกิดขึ้นนี้ได้ทำให้ผู้ใช้บัญชีธนาคารชาวไทยเกิดความหวาดผวา พร้อมแสดงความกังวลว่าแม้เงินของตนจะอยู่ในธนาคาร แต่ก็ยังสามารถถูกขโมยได้อยู่ดี ถือว่าไม่มีการรับประกันความปลอดภัยใด ๆ ในขณะที่ชุมชนคริปโตชาวไทยก็ได้มีการออกมาแสดงความคิดเห็นเกี่ยวกับประเด็นนี้เช่นกัน โดยตั้งข้อสังเกตว่า การเก็บเงินไว้ในคริปโตอาจจะเป็นทางออกให้กับเรื่องนี้ได้ เงินในบัญชีธนาคารเป็นของคุณหรือเปล่า แม้ทุกวันนี้เราจะฝากเงินอยู่ในธนาคาร แต่คำถามก็คือเงินที่คุณพักอยู่ในธนาคารนั้นเป็นของคุณจริงๆหรือเปล่า หลายคนคงสงสัยเกี่ยวกับเรื่องนี้แน่นอนว่า การที่ฝากเงินไว้ในธนาคารส่วนนึงเป็นเพราะเราไม่มั่นใจในการเก็บออมเงินด้วยตัวเอง เพราะมันอาจจะถูกขโมยได้เช่นกัน ยกตัวอย่างเช่นขโมยขึ้นบ้านเป็นต้น แต่เมื่อคุณเอาเงินไปฝากธนาคารที่มีการรับรองทางด้านกฎหมาย แน่นอนล่ะในทางทฤษฎีมันอาจจะเป็นของคุณจริง แต่หากเราลองคิดดูดีดีในเชิงกลับกันมันเป็นของคุณจริง ๆ หรือเปล่า จากกรณีที่กล่าวไปข้างต้นทำให้เราเห็นภาพได้ชัดเจนเลยว่า เงินของเราที่อยู่ในธนาคารอาจจะไม่ใช่เงินของเราจริงๆ เพราะการที่คุณเอาเงินไปฝากกับตัวกลางใดมันมีโอกาสที่สูญเสียไปได้ทั้งหมด ไม่ว่าจะเป็นในเรื่องของกฎหมายที่สามารถยึดทรัพย์สินของคุณได้ทุกเมื่อ หรือในกรณีของ Bank Run ที่มีคนมาแห่ถอนเงินพร้อมกัน จนคุณไม่สามารถถอนเงินของคุณได้ รวมถึงเสี่ยงอื่น ๆ อีกมากมาย หรือ Crypto จะเป็นคำตอบสุดท้ายในการเก็บเงิน หลังจากที่เราได้พิจารณาถึงเรื่องนี้แล้ว ทำให้หลายคนเริ่มมองว่าคริปโตนั้นอาจจะเป็นคำตอบสุดท้ายในการเก็บออมเงินของเราแทนการเก็บเงินไว้กับธนาคาร เนื่องจากในโลกของคริปโตนั้นจะเปิดโอกาสให้คุณสามารถเป็นเจ้าของสินทรัพย์ด้วยตัวเองผ่านการเก็บรักษาเงินของคุณในกระเป๋าเงินคริปโตที่คุณเป็นคนถือ Private key ด้วยตัวเอง ต่างจากการฝากทรัพย์สินหรือเงินไว้กับธนาคารที่มีความเสี่ยงที่เงินของคุณจะสูญหาย อย่างไรก็ตามผู้ถือ Private key ของตัวเองก็ต้องระมัดระวังพิเศษ เนื่องจากการที่เราเป็นผู้ดูแลสินทรัพย์ของเราเองก็เท่ากับว่าจะไม่มีใครที่ช่วยดูแลสินทรัพย์ของเราได้ ดังนั้นหากเราทำ Private key สูญหายไป นั้นความหมายเงินของเราเองก็อาจสูญหายไปตลอดกาลเช่นเดียวกัน กูรู Bitcoin ชื่อดังในไทยเผยถึงต้นตอของปัญหาในระบบการเงินแบบดั้งเดิม เมื่อเร็ว ๆ นี้กูรู Bitcoin ชื่อดังในไทยและ Managing Director แห่ง Chaloke.com “อาจารย์ตั้ม พิริยะ สัมพันธารักษ์” ก็แสดงออกมาแสดงความคิดเห็นเกี่ยวกับประเด็นนี้ด้วย โดยกล่าวว่า “ต้นตอของปัญหาในระบบการเงินโดยทั่วไปอยู่ที่ความจำเป็นต้องอาศัยความเชื่อใจ เราจำเป็นต้องเชื่อใจว่า ธนาคารกลางจะไม่บั่นทอนมูลค่าของสกุลเงิน แต่ประวัติศาสตร์ของเงินตรารัฐบาลกลับเต็มไปด้วยการล่วงละเมิดความเชื่อใจดังกล่าว” “เราจำเป็นต้องเชื่อใจว่าธนาคารจะเก็บเงินของเราเอาไว้ และคอยทำหน้าที่รับส่งเงินของเราผ่านระบบอิเล็กทรอนิกส์ แต่พวกเขากลับนำมันไปปล่อยกู้จนเกิดเป็นคลื่นของฟองสบู่สินเชื่อโดยแทบไม่เหลือเงินเก็บไว้เลยด้วยซ้ำ” “เราจำเป็นต้องเชื่อใจว่าพวกเขาจะปกป้องความเป็นส่วนตัวของพวกเรา เชื่อใจว่าพวกเขาจะไม่ยอมให้มิจฉาชีพทำการสวมรอยขโมยเงินของเราจนหมดบัญชีได้” จากคำพูดของอาจารย์ตั้มข้างต้น สามาถสรุปได้ว่า ระบบการเงินในปัจจุบันนั้นขึ้นอยู่กับความไว้ใจและความปลอดภัย ซึ่งดูเหมือนว่า Bitcoin และสินทรัพย์คริปโตจะถูกสร้างขึ้นเพื่อเติมเต็มสิ่งเหล่านั้น,https://siamblockchain.com/2021/10/19/bank-thai-been-hacked-cryto-may-be-help/,2021_10_19
ผู้ก่อตั้ง Cardano ปฏิเสธข่าวลือเชิงลบเกี่ยวกับการอัปเกรด PAB ที่กำลังจะมีขึ้นในเร็ว ๆ นี้,ในช่วงเมื่อวานนี้นาย Charles Hoskinson ผู้ก่อตั้ง Cardano ได้มีการจัดทำ live สั้น ๆ เพื่อความคืบหน้าเกี่ยวกับโปรเจกต์ Cardano พร้อมปฏิเสธข่าวลือเชิงลบเกี่ยวกับการอัพเกรด Plutus Application Backend (PAB) ของ Cardano ที่กำลังจะมีขึ้นในเดือนพฤศจิกายน Hoskinson ได้ออกมาปฏิเสธข่าวลือที่เขาพบเห็นบนทวีตเตอร์เมื่อช่วงไม่กี่วันที่ผ่านมาเกี่ยวกับการอัปเกรด PAB บนเครือข่ายของ Cardano ที่คาดว่าจะมีขึ้นในช่วงช่วงต้นเดือนพฤศจิกายน PAB นั้นย่อมาจาก Plutus Application Backend ซึ่งเป็นหนึ่งในเครื่องมือที่ถูกนำเสนอโดยแพลตฟอร์ม เพื่อช่วยให้นักพัฒนาสามารถปรับใช้สัญญา Smart contract บนเครือข่าย หลังจากเปิดใช้งาน Alonzo Hardfork ไปในเดือนกันยายน Hoskinson กล่าวเสริมว่าเขามักจะพบเห็น “ข่าวลือ” ประเภทนี้อยู่บ่อยครั้ง เช่นเรื่อง การวิพากษ์วิจารณ์ถึงปัญหาความสามารถในการปรับขนาดและความเร็วในการทำธุรกรรมบนเครือข่าย ซึ่งนั้นเป็นข่าวลือปลอม ๆ ที่ถูกใช้เพื่อโจมตี Cardano ทั้งนี้เขากล่าวว่าปัจจุบันแพลตฟอร์มกำลังมีการพัฒนาอย่างต่อเนื่องและระบบนิเวศของ Cardano นั้นยังคงแข็งแกร่งไม่มีปัญหาใด ๆ ให้ต้องกังวล Hoskinson กล่าวเพิ่มเติมด้วยว่า Cardano มีผลิตภัณฑ์จำนวนมากที่เตรียมจ่อเปิดตัวบนเครือข่าย โดยเขาตั้งข้อสังเกตว่าเทคโนโลยีใหม่เหล่านี้จะเปิดตัวบนบล็อคเชนของ Cardano ในอีก 3 ถึง 9 เดือนข้างหน้า,https://siamblockchain.com/2021/10/19/charles-hoskinson-addresses-fud-about-upcoming-pab-upgrade-heres-what-he-says/,2021_10_19
"วอลุ่มซื้อขาย Bitcoin บนเว็บเทรด OKex พุ่งทำจุดสูงสุดใหม่แตะระดับ 10,000 BTC","ข้อมูลล่าสุดจาก TradingView แสดงให้เห็นว่าวอลุ่มการซื้อขาย BTC/ USDT บนเว็บเทรด OKex นั้นได้ดีดตัวเพิ่มขึ้นอย่างมีนัยสำคัญแตะระดับ 10,000 BTC เมื่อช่วงประมาณตี 2 ของวันนี้ การเพิ่มขึ้นของวอลุ่มซื้อขาย Bitcoin ในวันนี้ ดูเหมือนว่าจะมาพร้อมกับราคาที่ฟื้นตัวกลับขึ้นมาแตะระดับ 63,000 ดอลลาร์ในช่วงสั้น ๆ ก่อนที่จะร่วงลดลงในเวลาต่อมา แสดงให้เห็นถึงโมเมนตันแรงซื้อที่เพิ่มขึ้นอย่างรวดเร็วในตลาด ท่ามกลางความคาดหวังของกองทุน Bitcoin ETF แบบฟิวเจอรส์ที่ได้มีการเปิดตัวครั้งแรกในวันนี้ อย่างไรก็ตามวอลุ่มการซื้อขายที่เพิ่มขึ้นสู่ระดับ 10,000 btc ยังไม่ถือว่าเป็นสถิติใหม่ของเว็บเทรด OKEx โดยก่อนหน้านี้เว็บเทรดเคยทำสถิติสูงสุดอยู่ที่ระดับ 14,000 BTC",https://siamblockchain.com/2021/10/19/record-breaking-10000-btc-sell-order-filled-on-okex/,2021_10_19
ทำไม Dogecoin ถึงมีส่วนช่วยทำให้มือใหม่แห่มาลงทุน Bitcoin,"นาย David Gokhshtein อดีตผู้สมัครรับเลือกตั้งรัฐสภาคองเกรสแห่งสหรัฐฯ ได้ออกมาทวีตแสดงความคิดเห็นล่าสุดเกี่ยวกับเหรียญ Dogecoin เมื่อเร็ว ๆ นี้ว่าเหรียญมีมรูปสุนัขพันธุ์ชิบะนั้น ดูเหมือนจะมีส่วนช่วยดึงดูดความสนใจของผู้คนให้เข้ามาลงทุนใน Bitcoin Dogecoin มีส่วนช่วยทำให้ผู้คนหันมาสนใจลงทุนใน Bitcoin โดยปกติแล้ว Gokhshtein มักจะมีการพูดถึงเหรียญ cryptocurrency ตัวอื่น ๆ บนทวีตของเขา เช่นเหรียญ PAC , XRP และ Bitcoin แต่ในครั้งนี้ดูเหมือนว่าจะเป็นครั้งแรกที่เขาได้มีการพูดถึงเหรียญ Dogecoin Gokhshtein เปิดเผยว่า ปัจจุบันเขากำลังทำการสำรวจเหรียญคริปโตมีมในตลาด โดยเฉพาะอย่างยิ่งสำหรับเหรียญ Dogecoin และเหรียญ Shiba Inu (SHIB) ที่กำลังเป็นกระแสนิยมในปัจจุบัน และในวันนี้เขาโพสต์ทวีตเกี่ยวกับเหรียญ DOGE โดยกล่าวว่า เหรียญดังกล่าวนั้นเริ่มต้นจากการล้อเลียน Bitcoin ในปี 2013 และดึงดูดให้ผู้คนจำนวนมากหันมาสนใจลงทุนใน Bitcoin Elon Musk ปั่นราคาเหรียญ DOGE ให้พุ่งขึ้นกว่า 13% ในช่วงเมื่อวานนี้ราคาเหรียญ Dogecoin ได้พุ่งขึ้นเกือบ 13% หลังจาก นาย Elon Musk ได้ออกมาโพสต์ทวีตรูปอีโมจิรูปน้องหมากำลังปล่อยจรวด บ่งบอกว่า “ราคาเหรียญ Dogecoin กำลังพุ่งขึ้นสู่ดวงจันทร์” ซึ่งไม่นานหลังจากราคาของเหรียญก็ดีดตัวพุ่งขึ้นแตะจุดสูงสุดระหว่างวันที่ระดับ 0.27 ดอลลาร์ทันที ก่อนที่จะร่วงลงมาอยู่ที่ระดับ 0.24 ดอลลาร์ในขณะที่เขียนรายงาน",https://siamblockchain.com/2021/10/19/doge-has-allowed-lots-of-people-to-get-into-bitcoin-david-gokhshtein/,2021_10_19
