title,summary,link,published
"""ใบเฟิร์น พิมพ์ชนก"" ปล่อยของต้อนรับวันเกิด  29 ปี เปิดภาพใส่ชุดซีทรู","<img alt=""&quot;ใบเฟิร์น พิมพ์ชนก&quot; ปล่อยของต้อนรับวันเกิด  29 ปี เปิดภาพใส่ชุดซีทรู"" height=""75"" src=""https://s.isanook.com/ns/0/rp/rc/w75h75/ya0xacm1w0/aHR0cHM6Ly9zLmlzYW5vb2suY29tL25zLzAvdWQvMTY5MC84NDUxMDA2L2JhaS5qcGc=.jpg"" width=""75"" />&nbsp;&nbsp;ใบเฟิร์น พิมพ์ชนก ปล่อยภาพสุดเซ็กซี่ใส่ชุดลายลูกไม้ซีทรู ต้อนรับวันเกิด 29 ปี ทำหนุ่มๆ ตาค้างไปเลย",https://www.sanook.com/news/8451006/,"Thu, 30 Sep 2021 10:37:40 +0700"
สาวสุดช็อก เจอบิลเรียกเก็บค่าไฟ 120 ล้าน จากปกติเคยจ่าย 2-3 หมื่น,"<img alt=""สาวสุดช็อก เจอบิลเรียกเก็บค่าไฟ 120 ล้าน จากปกติเคยจ่าย 2-3 หมื่น"" height=""75"" src=""https://s.isanook.com/ns/0/rp/rc/w75h75/ya0xacm1w0/aHR0cHM6Ly9zLmlzYW5vb2suY29tL25zLzAvdWQvMTY5MC84NDUxMDE0L2VsZWN0cmljaXR5YmlsbC5qcGc=.jpg"" width=""75"" />&nbsp;&nbsp;สาวร้องเพจดัง เจอบิลเรียกเก็บค่าไฟ 120 ล้าน จากปกติแค่ 2-3 หมื่น ด้านชาวเน็ตแห่เข้ามาบ่นอุบค่าไฟแพงขึ้นมาก",https://www.sanook.com/news/8451014/,"Thu, 30 Sep 2021 10:35:57 +0700"
บิ๊กป๊อก หยอดคำหวาน ส.ว.ชุดนี้ทำงานดีสุดเท่าที่เคยมี ยืนยันน้ำท่วมปีนี้ไม่หนักซ้ำรอยปี 54,"<img alt=""บิ๊กป๊อก หยอดคำหวาน ส.ว.ชุดนี้ทำงานดีสุดเท่าที่เคยมี ยืนยันน้ำท่วมปีนี้ไม่หนักซ้ำรอยปี 54"" height=""75"" src=""https://s.isanook.com/ns/0/rp/rc/w75h75/ya0xacm1w0/aHR0cHM6Ly9zLmlzYW5vb2suY29tL25zLzAvdWQvMTY5MC84NDUxMDEwL2FudXBvbmctMjkwOTIxLXRuLnBuZw==.png"" width=""75"" />&nbsp;&nbsp;มท.1 ยืนยันพายุ ""เตี้ยนหมู่"" ผ่านไทยไปแล้ว คาดน้ำท่วมไม่หนักซ้ำรอยปี 54 มีแผนรับมือพายุอีก 2 ลูก อย่าโยงลงพื้นที่นายกฯ เป็นประเด็นการเมือง ระบุในเวที ส.ว. 2 ปี รับอ่อนด้อยใกล้ชิดประชาชน ชม ส.ว.ชุดนี้ดีที่สุดเท่าที่เคยมี เผยนายกฯ สั่งงานวันละไม่ต่ำกว่า 10 งาน",https://www.sanook.com/news/8451010/,"Thu, 30 Sep 2021 10:24:12 +0700"
งงกันทั้งตึก หญิงปริศนาโดดจากชั้น 10 คอนโดดังเมืองนนท์ ดับสลดแต่เช้า,"<img alt=""งงกันทั้งตึก หญิงปริศนาโดดจากชั้น 10 คอนโดดังเมืองนนท์ ดับสลดแต่เช้า"" height=""75"" src=""https://s.isanook.com/ns/0/rp/rc/w75h75/ya0xacm1w0/aHR0cHM6Ly9zLmlzYW5vb2suY29tL25zLzAvdWQvMTY5MC84NDUwOTYyL2NvbmRvMTAuanBn.jpg"" width=""75"" />&nbsp;&nbsp;ป้าคิดสั้นโดดตึกชั้น 10 เสียชีวิต คอนโดดังของ จ.นนทบุรี คนในตึกเผยได้ยินเสียงดังตูม ยังนึกว่าใครปิดประตูเสียงดัง",https://www.sanook.com/news/8450962/,"Thu, 30 Sep 2021 10:20:27 +0700"
"""มนต์สิทธิ์"" มาตามนัด อวดเลขเด็ดของตัวเอง บอกหมดงวดนี้ชอบเลขไหนบ้าง","<img alt=""&quot;มนต์สิทธิ์&quot; มาตามนัด อวดเลขเด็ดของตัวเอง บอกหมดงวดนี้ชอบเลขไหนบ้าง"" height=""75"" src=""https://s.isanook.com/ns/0/rp/rc/w75h75/ya0xacm1w0/aHR0cHM6Ly9zLmlzYW5vb2suY29tL25zLzAvdWQvMTY5MC84NDUwOTE0L2NvY2VlLmpwZw==.jpg"" width=""75"" />&nbsp;&nbsp;มาแล้ว ""มนต์สิทธิ์ คำสร้อย"" นำเลขที่ชอบมาฝาก พร้อมอวดลอตเตอรี่ในมือ แฟนๆ พากันคอมเมนต์แชร์เลขของตัวเอง",https://www.sanook.com/news/8450914/,"Thu, 30 Sep 2021 10:09:08 +0700"
"""เอกพจน์ วงศ์นาค"" จากนักร้องก่อนวางไมค์ลงการเมือง เผยต่อสู้มะเร็งต่อมน้ำเหลืองสุดทรมาน","<img alt=""&quot;เอกพจน์ วงศ์นาค&quot; จากนักร้องก่อนวางไมค์ลงการเมือง เผยต่อสู้มะเร็งต่อมน้ำเหลืองสุดทรมาน"" height=""75"" src=""https://s.isanook.com/ns/0/rp/rc/w75h75/ya0xacm1w0/aHR0cHM6Ly9zLmlzYW5vb2suY29tL25zLzAvdWQvMTY5MC84NDUwOTg2LzE1LmpwZw==.jpg"" width=""75"" />&nbsp;&nbsp;อดีตนักร้องชื่อดัง เอกพจน์ วงศ์นาค หลังวางไมค์หันไปเอาดีทางด้านการเมือง เจอมรสุมชีวิตป่วยเป็นมะเร็งต่อมน้ำเหลือง ทรมานที่สุดในชีวิต",https://www.sanook.com/news/8450986/,"Thu, 30 Sep 2021 10:01:23 +0700"
"ศาลสั่งปลดบิดาของ ""บริทนีย์ สเปียร์ส"" จากการเป็นผู้พิทักษ์ชีวิต-ทรัพย์สินนาน 13 ปี มีผลทันที","<img alt=""ศาลสั่งปลดบิดาของ &quot;บริทนีย์ สเปียร์ส&quot; จากการเป็นผู้พิทักษ์ชีวิต-ทรัพย์สินนาน 13 ปี มีผลทันที"" height=""75"" src=""https://s.isanook.com/ns/0/rp/rc/w75h75/ya0xacm1w0/aHR0cHM6Ly9zLmlzYW5vb2suY29tL25zLzAvdWQvMTY5MC84NDUwOTY2L2JyaXRuZXlzcGVhcnMuanBn.jpg"" width=""75"" />&nbsp;&nbsp;ผู้พิพากษาตัดสินปลด ""เจมี สเปียร์ส"" จากการเป็นผู้พิทักษ์ชีวิตและทรัพย์สินของ ""บริทนีย์ สเปียร์ส"" #FreeBritney",https://www.sanook.com/news/8450966/,"Thu, 30 Sep 2021 09:51:06 +0700"
"""หยาดทิพย์"" ชีวิตเปลี่ยน รีวิวการเป็นแม่ 1 เดือนผ่านไปอย่างรวดเร็วมากๆ","<img alt=""&quot;หยาดทิพย์&quot; ชีวิตเปลี่ยน รีวิวการเป็นแม่ 1 เดือนผ่านไปอย่างรวดเร็วมากๆ"" height=""75"" src=""https://s.isanook.com/ns/0/rp/rc/w75h75/ya0xacm1w0/aHR0cHM6Ly9zLmlzYW5vb2suY29tL25zLzAvdWQvMTY5MC84NDUwOTM0L3lhcmQuanBn.jpg"" width=""75"" />&nbsp;&nbsp;หยาดทิพย์ รีวิววิถีการเป็นคุณแม่ 1 เดือนที่ผ่านมาชีวิตเปลี่ยนมาก",https://www.sanook.com/news/8450934/,"Thu, 30 Sep 2021 09:40:01 +0700"
"""ไฮโซพก"" มีคำถามถึง ""อั้ม พัชราภา"" โมเมนต์หวานครบรอบ 3 ปี","<img alt=""&quot;ไฮโซพก&quot; มีคำถามถึง &quot;อั้ม พัชราภา&quot; โมเมนต์หวานครบรอบ 3 ปี"" height=""75"" src=""https://s.isanook.com/ns/0/rp/rc/w75h75/ya0xacm1w0/aHR0cHM6Ly9zLmlzYW5vb2suY29tL25zLzAvdWQvMTY5MC84NDUwOTI2L2F1bTIuanBn.jpg"" width=""75"" />&nbsp;&nbsp;ไฮโซพก โพสต์รูปคู่ อั้ม พัชราภา โมเมนต์หวานครบรอบ 3 ปี มีคำถาม ขึ้นปี4 แล้วยังไม่เบื่อใช่มั้ย?",https://www.sanook.com/news/8450926/,"Thu, 30 Sep 2021 09:23:19 +0700"
กอนช.ประกาศเตือน 8 จังหวัดท้ายเขื่อน รวม กทม. เตรียมรับมือน้ำ ช่วง 1-5 ต.ค.,"<img alt=""กอนช.ประกาศเตือน 8 จังหวัดท้ายเขื่อน รวม กทม. เตรียมรับมือน้ำ ช่วง 1-5 ต.ค."" height=""75"" src=""https://s.isanook.com/ns/0/rp/rc/w75h75/ya0xacm1w0/aHR0cHM6Ly9zLmlzYW5vb2suY29tL25zLzAvdWQvMTY5MC84NDUwOTMwL2Zsb29kLmpwZw==.jpg"" width=""75"" />&nbsp;&nbsp;กองอำนวยการน้ำฯ ออกประกาศเตือน 8 จังหวัดท้ายเขื่อน รวม กทม. ด้วย เตรียมรับมือน้ำท่วม หลังเขื่อนเจ้าพระยา-เขื่อนป่าสักชลสิทธิ์ ระบายน้ำเพิ่ม",https://www.sanook.com/news/8450930/,"Thu, 30 Sep 2021 09:08:19 +0700"
ดราม่าเอฟซีอยากรู้ เพจรักหมาไลฟ์สดรับบริจาคดูแลน้องหมาถี่ยิบ ยอดถึง 3 ล้าน,"<img alt=""ดราม่าเอฟซีอยากรู้ เพจรักหมาไลฟ์สดรับบริจาคดูแลน้องหมาถี่ยิบ ยอดถึง 3 ล้าน"" height=""75"" src=""https://s.isanook.com/ns/0/rp/rc/w75h75/ya0xacm1w0/aHR0cHM6Ly9zLmlzYW5vb2suY29tL25zLzAvdWQvMTY5MC84NDUwODk4L2RvZy5qcGc=.jpg"" width=""75"" />&nbsp;&nbsp;คนรักสุนัขถามเพจ ""หมาลูกพ่อเนตร ตาไทย"" ที่ อ.กระสัง บุรีรัมย์ อยากเห็นสุนัขว่ามีกว่า 100 ตัวจริงหรือไม่ หลังไลฟ์สดขอบริจาคถี่ยิบ เจ้าตัวยอมรับได้เงินบริจาคมากว่า 3 ล้านบาท",https://www.sanook.com/news/8450898/,"Thu, 30 Sep 2021 08:45:14 +0700"
"""น้องมาริน"" โชว์กรีดนิ้ว อวด ""แม่มิว นิษฐา"" ชาวเน็ตทักมือสวยแบบนี้ โตขึ้นวาสนาดีมาก","<img alt=""&quot;น้องมาริน&quot; โชว์กรีดนิ้ว อวด &quot;แม่มิว นิษฐา&quot; ชาวเน็ตทักมือสวยแบบนี้ โตขึ้นวาสนาดีมาก"" height=""75"" src=""https://s.isanook.com/ns/0/rp/rc/w75h75/ya0xacm1w0/aHR0cHM6Ly9zLmlzYW5vb2suY29tL25zLzAvdWQvMTY5MC84NDUwOTAyLzEuanBn.jpg"" width=""75"" />&nbsp;&nbsp;ละมุนหัวใจมาก เปิดคลิป ""น้องมาริน"" โชว์กรีดนิ้ว อวด ""แม่มิว นิษฐา"" ชาวเน็ตคอมเมนต์ทักมือสวยแบบนี้ โตขึ้นวาสนาดีมาก",https://www.sanook.com/news/8450902/,"Thu, 30 Sep 2021 08:38:26 +0700"
"น่ารักเท่าโลก  ""เต๋อ ฉันทวิชช์"" ภาพเดียวทำสาวๆ กรี๊ดบอกเป็นผู้ชายในฝัน","<img alt=""น่ารักเท่าโลก  &quot;เต๋อ ฉันทวิชช์&quot; ภาพเดียวทำสาวๆ กรี๊ดบอกเป็นผู้ชายในฝัน"" height=""75"" src=""https://s.isanook.com/ns/0/rp/rc/w75h75/ya0xacm1w0/aHR0cHM6Ly9zLmlzYW5vb2suY29tL25zLzAvdWQvMTY5MC84NDUwOTEwLzE1LmpwZw==.jpg"" width=""75"" />&nbsp;&nbsp;เต๋อ ฉันทวิชช์ กับภาพที่สาวๆ กรี๊ดหนักมากพร้อมกับบอกเป็นผู้ชายในฝันจริงๆ ยืนล้างจ้านด้วยรอยยิ้มสดใส",https://www.sanook.com/news/8450910/,"Thu, 30 Sep 2021 08:34:17 +0700"
"""ตู่ ปิยวดี"" หมดสติกลางอากาศ หัวฟาดพื้นอย่างแรง ถูกหามตัวส่งโรงพยาบาลด่วน","<img alt=""&quot;ตู่ ปิยวดี&quot; หมดสติกลางอากาศ หัวฟาดพื้นอย่างแรง ถูกหามตัวส่งโรงพยาบาลด่วน"" height=""75"" src=""https://s.isanook.com/ns/0/rp/rc/w75h75/ya0xacm1w0/aHR0cHM6Ly9zLmlzYW5vb2suY29tL25zLzAvdWQvMTY5MC84NDUwODQ2L2NvLmpwZw==.jpg"" width=""75"" />&nbsp;&nbsp;อาการน่าห่วง ""ตู่ ปิยวดี"" แพ้ยาวูบกลางอากาศ ล้มหัวฟาดพื้น รีบเข้ารักษาตัวที่โรงพยาบาลด่วน แฟนๆ แห่ส่งกำลังใจ",https://www.sanook.com/news/8450846/,"Thu, 30 Sep 2021 08:30:28 +0700"
พยากรณ์อากาศวันนี้ กรมอุตุฯ เผยไทยฝนลดลง แต่ยังตกอีก 36 จังหวัด,"<img alt=""พยากรณ์อากาศวันนี้ กรมอุตุฯ เผยไทยฝนลดลง แต่ยังตกอีก 36 จังหวัด"" height=""75"" src=""https://s.isanook.com/ns/0/rp/rc/w75h75/ya0xacm1w0/aHR0cHM6Ly9zLmlzYW5vb2suY29tL25zLzAvdWQvMTY5MC84NDUwODk0L3RoYWlsYW5kLmpwZw==.jpg"" width=""75"" />&nbsp;&nbsp;พยากรณ์อากาศวันนี้ กรมอุตุฯ เผย บริเวณใต้ตอนล่างยังฝนตกหนัก ขณะที่บริเวณภาคอื่นเริ่มมีฝนลดลง",https://www.sanook.com/news/8450894/,"Thu, 30 Sep 2021 08:09:03 +0700"
"ยังเกินหลักหมื่น! โควิดวันนี้ ไทยพบติดเชื้อเพิ่ม 11,646 ราย เสียชีวิตอีก 107 ราย","<img alt=""ยังเกินหลักหมื่น! โควิดวันนี้ ไทยพบติดเชื้อเพิ่ม 11,646 ราย เสียชีวิตอีก 107 ราย"" height=""75"" src=""https://s.isanook.com/ns/0/rp/rc/w75h75/ya0xacm1w0/aHR0cHM6Ly9zLmlzYW5vb2suY29tL25zLzAvdWQvMTY5MC84NDUwODcwL2NvdmlkLmpwZw==.jpg"" width=""75"" />&nbsp;&nbsp;สธ.รายงานยอดผู้ติดเชื้อ #โควิด19 วันนี้ ติดเชื้อเพิ่ม 11,646 ราย เสียชีวิต 107 ราย หายป่วยเพิ่ม 10,887 ราย",https://www.sanook.com/news/8450870/,"Thu, 30 Sep 2021 11:36:03 +0700"
สธ. อนุมัติขายชุดตรวจ ATK ผ่านร้านค้า-ช่องทางออนไลน์ได้ ย้ำโฆษณาทุกแบบต้องผ่าน อย.,"<img alt=""สธ. อนุมัติขายชุดตรวจ ATK ผ่านร้านค้า-ช่องทางออนไลน์ได้ ย้ำโฆษณาทุกแบบต้องผ่าน อย."" height=""75"" src=""https://s.isanook.com/ns/0/rp/rc/w75h75/ya0xacm1w0/aHR0cHM6Ly9zLmlzYW5vb2suY29tL25zLzAvdWQvMTY5MC84NDUxMTAyL2F0ay1zZWxsLWFsbC1jaGFubmVsLTMwMDkyMS10bi5wbmc=.png"" width=""75"" />&nbsp;&nbsp;กระทรวงสาธารณสุข ไฟเขียวให้ขายชุดตรวจ ATK ได้ตามร้านค้าและช่องทางออนไลน์ แนะผู้บริโภคสังเกตฉลากภาษาไทย และมีข้อความแสดงคำเตือน ""บุคคลทั่วไปสามารถใช้ได้""",https://www.sanook.com/news/8451102/,"Thu, 30 Sep 2021 11:38:21 +0700"
"""หม่ำ จ๊กมก"" พาไปดูที่ดินซื้อไว้ 200 ไร่บนหาดชะอำ ลูกน้องเห็นแล้วถึงกับลั่นเลย อะไรกันเนี่ย!","<img alt=""&quot;หม่ำ จ๊กมก&quot; พาไปดูที่ดินซื้อไว้ 200 ไร่บนหาดชะอำ ลูกน้องเห็นแล้วถึงกับลั่นเลย อะไรกันเนี่ย!"" height=""75"" src=""https://s.isanook.com/ns/0/rp/rc/w75h75/ya0xacm1w0/aHR0cHM6Ly9zLmlzYW5vb2suY29tL25zLzAvdWQvMTY5MC84NDUxMDY2LzE1LmpwZw==.jpg"" width=""75"" />&nbsp;&nbsp;หม่ำ จ๊กมก บอกเล่าซื้อที่ดินไว้ 200 ไร่ที่ชะอำ ด้านลูกน้องเห็นภาพของที่ดินแล้วถึงกับร้องเฮ้อสมองไปหมดแล้ว",https://www.sanook.com/news/8451066/,"Thu, 30 Sep 2021 10:53:44 +0700"
"""กรีน อัษฎาพร"" เล่าทั้งน้ำตา ความจริงเรื่องพ่อทำให้มองความรักเปลี่ยนไป","<img alt=""&quot;กรีน อัษฎาพร&quot; เล่าทั้งน้ำตา ความจริงเรื่องพ่อทำให้มองความรักเปลี่ยนไป"" height=""75"" src=""https://s.isanook.com/ns/0/rp/rc/w75h75/ya0xacm1w0/aHR0cHM6Ly9zLmlzYW5vb2suY29tL25zLzAvdWQvMTY5MC84NDUwOTUwL2dyZWVuLmpwZw==.jpg"" width=""75"" />&nbsp;&nbsp;กรีน อัษฎาพร ออกมาเผยทั้งน้ำตา ชีวิตนี้ขอทำเพื่อแม่ ได้ทราบความจริงเรื่องทำเอามุมมองเรื่องความรักเปลี่ยนไปเลย",https://www.sanook.com/news/8450950/,"Thu, 30 Sep 2021 12:29:29 +0700"
บีทีเอส ยื่นฟ้อง กทม. ทวงค่าจ้างเดินรถ 1.2 หมื่นล้าน หลังติดค้างกว่า 4 ปี เล็งยื่นอีกคดี,"<img alt=""บีทีเอส ยื่นฟ้อง กทม. ทวงค่าจ้างเดินรถ 1.2 หมื่นล้าน หลังติดค้างกว่า 4 ปี เล็งยื่นอีกคดี"" height=""75"" src=""https://s.isanook.com/ns/0/rp/rc/w75h75/ya0xacm1w0/aHR0cHM6Ly9zLmlzYW5vb2suY29tL25zLzAvdWQvMTY5MC84NDUxMTEwL2J0cy1ia2stZGVidC0zMDA5MjEtdG4ucG5n.png"" width=""75"" />&nbsp;&nbsp;บีทีเอส ฟ้องศาลปกครองกลาง ทวงหนี้ที่กรุงเทพมหานครค้างจ่ายค่าจ้างเดินรถอยู่ราว 1.2 หมื่นล้านบาท",https://www.sanook.com/news/8451110/,"Thu, 30 Sep 2021 12:09:24 +0700"
"""ซ้อปลา"" เจอกระชากหัวอย่างแรง หลังประกาศแชร์ล่ม ลูกแชร์นับร้อยบุกทวงเงิน","<img alt=""&quot;ซ้อปลา&quot; เจอกระชากหัวอย่างแรง หลังประกาศแชร์ล่ม ลูกแชร์นับร้อยบุกทวงเงิน"" height=""75"" src=""https://s.isanook.com/ns/0/rp/rc/w75h75/ya0xacm1w0/aHR0cHM6Ly9zLmlzYW5vb2suY29tL25zLzAvdWQvMTY5MC84NDUxMTM0L3BsYS5qcGc=.jpg"" width=""75"" />&nbsp;&nbsp;นาทีชุลมุน ลูกแชร์นับร้อยคนบุกทวงเงิน ""ซ้อปลา"" หลังประกาศวงแชร์ล่ม อ้างตำรวจยักยอกเงิน 5 ล้าน ลูกแชร์ขอค้นทรัพย์สินในบ้านแต่ไม่ยอม",https://www.sanook.com/news/8451134/,"Thu, 30 Sep 2021 12:44:46 +0700"
"มดเต็มหาด ""หมาก-คิมเบอร์ลี่"" นอนสวีทดูหนังกลางแปลงริมทะเล","<img alt=""มดเต็มหาด &quot;หมาก-คิมเบอร์ลี่&quot; นอนสวีทดูหนังกลางแปลงริมทะเล"" height=""75"" src=""https://s.isanook.com/ns/0/rp/rc/w75h75/ya0xacm1w0/aHR0cHM6Ly9zLmlzYW5vb2suY29tL25zLzAvdWQvMTY5MC84NDUxMDAyL2tpbS5qcGc=.jpg"" width=""75"" />&nbsp;&nbsp;หวานหนักมาก หมาก-คิมเบอร์ลี่ ดินเนอร์โรแมนติกริมทะเล นอนสวีทดูหนังดูดาวยามค่ำคืน",https://www.sanook.com/news/8451002/,"Thu, 30 Sep 2021 12:44:33 +0700"
"""วาววา ณิชชา"" ชวนหวานใจ โชว์สเต็ปรักริมหาด หุ่นแซ่บในชุดบิกินีกระแทกตาเต็มๆ","<img alt=""&quot;วาววา ณิชชา&quot; ชวนหวานใจ โชว์สเต็ปรักริมหาด หุ่นแซ่บในชุดบิกินีกระแทกตาเต็มๆ"" height=""75"" src=""https://s.isanook.com/ns/0/rp/rc/w75h75/ya0xacm1w0/aHR0cHM6Ly9zLmlzYW5vb2suY29tL25zLzAvdWQvMTY5MC84NDUwOTE4LzIuanBn.jpg"" width=""75"" />&nbsp;&nbsp;ไทม์ไลน์แทบจะกลายเป็นสีชมพู เมื่อนางเอกซุปตาร์ ""วาววา ณิชชา"" ชวนหวานใจฝรั่ง ""เฮนรี่ เลน"" โชว์สเต็ปรักริมหาด",https://www.sanook.com/news/8450918/,"Thu, 30 Sep 2021 13:04:53 +0700"
ลูกค้าอึ้ง! จ้างทำคัพเค้กวันเกิด แม่ค้ารับปากดิบดี สุดท้ายมาส่งช้า แถมยังกล้าที่จะสอน,"<img alt=""ลูกค้าอึ้ง! จ้างทำคัพเค้กวันเกิด แม่ค้ารับปากดิบดี สุดท้ายมาส่งช้า แถมยังกล้าที่จะสอน"" height=""75"" src=""https://s.isanook.com/ns/0/rp/rc/w75h75/ya0xacm1w0/aHR0cHM6Ly9zLmlzYW5vb2suY29tL25zLzAvdWQvMTY5MC84NDUxMTYyL2Nha2UuanBn.jpg"" width=""75"" />&nbsp;&nbsp;แม่ค้าหรือเปล่า แม่ค้าไม่น่ารักหรือเปล่า?",https://www.sanook.com/news/8451162/,"Thu, 30 Sep 2021 13:34:31 +0700"
ลูกค้าอึ้ง! สั่งทำคัพเค้กวันเกิด แม่ค้ารับปากดิบดี สุดท้ายมาส่งช้า แถมยังกล้าที่จะสอน,"<img alt=""ลูกค้าอึ้ง! สั่งทำคัพเค้กวันเกิด แม่ค้ารับปากดิบดี สุดท้ายมาส่งช้า แถมยังกล้าที่จะสอน"" height=""75"" src=""https://s.isanook.com/ns/0/rp/rc/w75h75/ya0xacm1w0/aHR0cHM6Ly9zLmlzYW5vb2suY29tL25zLzAvdWQvMTY5MC84NDUxMTYyL2Nha2UuanBn.jpg"" width=""75"" />&nbsp;&nbsp;แม่ค้าหรือเปล่า แม่ค้าไม่น่ารักหรือเปล่า?",https://www.sanook.com/news/8451162/,"Thu, 30 Sep 2021 13:40:12 +0700"
