title,summary,link,published
"มาแบบเต็มๆ ""เจนนี่-ยิว"" เปิดใจเคลียร์ทุกดราม่า และโมเมนต์ ""ยิว"" คุกเข่า (ซ้อม) ขอแต่งงาน","<img alt=""มาแบบเต็มๆ &quot;เจนนี่-ยิว&quot; เปิดใจเคลียร์ทุกดราม่า และโมเมนต์ &quot;ยิว&quot; คุกเข่า (ซ้อม) ขอแต่งงาน"" height=""75"" src=""https://s.isanook.com/ns/0/rp/rc/w75h75/ya0xacm1w0/aHR0cHM6Ly9zLmlzYW5vb2suY29tL25zLzAvdWQvMTY4OS84NDQ5NTI2LzE1LmpwZw==.jpg"" width=""75"" />&nbsp;&nbsp; เจนนี่-ยิว ควงคู่เคลียร์ทุกดราม่า สรุปท้อง-ไม่ท้อง ซ้อมขอแต่งงานกลางรายการสด เป็นภาพที่น่ารักมาก",https://www.sanook.com/news/8449526/,"Mon, 27 Sep 2021 17:44:42 +0700"
"มาแบบเต็มๆ ""เจนนี่-ยิว"" เปิดใจเคลียร์ทุกดราม่า และโมเมนต์ ""ยิว"" คุกเข่า (ซ้อม) ขอแต่งงาน","<img alt=""มาแบบเต็มๆ &quot;เจนนี่-ยิว&quot; เปิดใจเคลียร์ทุกดราม่า และโมเมนต์ &quot;ยิว&quot; คุกเข่า (ซ้อม) ขอแต่งงาน"" height=""75"" src=""https://s.isanook.com/ns/0/rp/rc/w75h75/ya0xacm1w0/aHR0cHM6Ly9zLmlzYW5vb2suY29tL25zLzAvdWQvMTY4OS84NDQ5NTI2LzE1LmpwZw==.jpg"" width=""75"" />&nbsp;&nbsp; เจนนี่-ยิว ควงคู่เคลียร์ทุกดราม่า สรุปท้อง-ไม่ท้อง ซ้อมขอแต่งงานกลางรายการสด เป็นภาพที่น่ารักมาก",https://www.sanook.com/news/8449526/,"Mon, 27 Sep 2021 17:44:42 +0700"
"มาแบบเต็มๆ ""เจนนี่-ยิว"" เปิดใจเคลียร์ทุกดราม่า และโมเมนต์ ""ยิว"" คุกเข่า (ซ้อม) ขอแต่งงาน","<img alt=""มาแบบเต็มๆ &quot;เจนนี่-ยิว&quot; เปิดใจเคลียร์ทุกดราม่า และโมเมนต์ &quot;ยิว&quot; คุกเข่า (ซ้อม) ขอแต่งงาน"" height=""75"" src=""https://s.isanook.com/ns/0/rp/rc/w75h75/ya0xacm1w0/aHR0cHM6Ly9zLmlzYW5vb2suY29tL25zLzAvdWQvMTY4OS84NDQ5NTI2LzE1LmpwZw==.jpg"" width=""75"" />&nbsp;&nbsp; เจนนี่-ยิว ควงคู่เคลียร์ทุกดราม่า สรุปท้อง-ไม่ท้อง ซ้อมขอแต่งงานกลางรายการสด เป็นภาพที่น่ารักมาก",https://www.sanook.com/news/8449526/,"Mon, 27 Sep 2021 17:44:42 +0700"
"มาแบบเต็มๆ ""เจนนี่-ยิว"" เปิดใจเคลียร์ทุกดราม่า และโมเมนต์ ""ยิว"" คุกเข่า (ซ้อม) ขอแต่งงาน","<img alt=""มาแบบเต็มๆ &quot;เจนนี่-ยิว&quot; เปิดใจเคลียร์ทุกดราม่า และโมเมนต์ &quot;ยิว&quot; คุกเข่า (ซ้อม) ขอแต่งงาน"" height=""75"" src=""https://s.isanook.com/ns/0/rp/rc/w75h75/ya0xacm1w0/aHR0cHM6Ly9zLmlzYW5vb2suY29tL25zLzAvdWQvMTY4OS84NDQ5NTI2LzE1LmpwZw==.jpg"" width=""75"" />&nbsp;&nbsp; เจนนี่-ยิว ควงคู่เคลียร์ทุกดราม่า สรุปท้อง-ไม่ท้อง ซ้อมขอแต่งงานกลางรายการสด เป็นภาพที่น่ารักมาก",https://www.sanook.com/news/8449526/,"Mon, 27 Sep 2021 17:44:42 +0700"
"มาแบบเต็มๆ ""เจนนี่-ยิว"" เปิดใจเคลียร์ทุกดราม่า และโมเมนต์ ""ยิว"" คุกเข่า (ซ้อม) ขอแต่งงาน","<img alt=""มาแบบเต็มๆ &quot;เจนนี่-ยิว&quot; เปิดใจเคลียร์ทุกดราม่า และโมเมนต์ &quot;ยิว&quot; คุกเข่า (ซ้อม) ขอแต่งงาน"" height=""75"" src=""https://s.isanook.com/ns/0/rp/rc/w75h75/ya0xacm1w0/aHR0cHM6Ly9zLmlzYW5vb2suY29tL25zLzAvdWQvMTY4OS84NDQ5NTI2LzE1LmpwZw==.jpg"" width=""75"" />&nbsp;&nbsp; เจนนี่-ยิว ควงคู่เคลียร์ทุกดราม่า สรุปท้อง-ไม่ท้อง ซ้อมขอแต่งงานกลางรายการสด เป็นภาพที่น่ารักมาก",https://www.sanook.com/news/8449526/,"Mon, 27 Sep 2021 17:44:42 +0700"
"มาแบบเต็มๆ ""เจนนี่-ยิว"" เปิดใจเคลียร์ทุกดราม่า และโมเมนต์ ""ยิว"" คุกเข่า (ซ้อม) ขอแต่งงาน","<img alt=""มาแบบเต็มๆ &quot;เจนนี่-ยิว&quot; เปิดใจเคลียร์ทุกดราม่า และโมเมนต์ &quot;ยิว&quot; คุกเข่า (ซ้อม) ขอแต่งงาน"" height=""75"" src=""https://s.isanook.com/ns/0/rp/rc/w75h75/ya0xacm1w0/aHR0cHM6Ly9zLmlzYW5vb2suY29tL25zLzAvdWQvMTY4OS84NDQ5NTI2LzE1LmpwZw==.jpg"" width=""75"" />&nbsp;&nbsp; เจนนี่-ยิว ควงคู่เคลียร์ทุกดราม่า สรุปท้อง-ไม่ท้อง ซ้อมขอแต่งงานกลางรายการสด เป็นภาพที่น่ารักมาก",https://www.sanook.com/news/8449526/,"Mon, 27 Sep 2021 17:44:42 +0700"
"มาแบบเต็มๆ ""เจนนี่-ยิว"" เปิดใจเคลียร์ทุกดราม่า และโมเมนต์ ""ยิว"" คุกเข่า (ซ้อม) ขอแต่งงาน","<img alt=""มาแบบเต็มๆ &quot;เจนนี่-ยิว&quot; เปิดใจเคลียร์ทุกดราม่า และโมเมนต์ &quot;ยิว&quot; คุกเข่า (ซ้อม) ขอแต่งงาน"" height=""75"" src=""https://s.isanook.com/ns/0/rp/rc/w75h75/ya0xacm1w0/aHR0cHM6Ly9zLmlzYW5vb2suY29tL25zLzAvdWQvMTY4OS84NDQ5NTI2LzE1LmpwZw==.jpg"" width=""75"" />&nbsp;&nbsp; เจนนี่-ยิว ควงคู่เคลียร์ทุกดราม่า สรุปท้อง-ไม่ท้อง ซ้อมขอแต่งงานกลางรายการสด เป็นภาพที่น่ารักมาก",https://www.sanook.com/news/8449526/,"Mon, 27 Sep 2021 17:44:42 +0700"
"มาแบบเต็มๆ ""เจนนี่-ยิว"" เปิดใจเคลียร์ทุกดราม่า และโมเมนต์ ""ยิว"" คุกเข่า (ซ้อม) ขอแต่งงาน","<img alt=""มาแบบเต็มๆ &quot;เจนนี่-ยิว&quot; เปิดใจเคลียร์ทุกดราม่า และโมเมนต์ &quot;ยิว&quot; คุกเข่า (ซ้อม) ขอแต่งงาน"" height=""75"" src=""https://s.isanook.com/ns/0/rp/rc/w75h75/ya0xacm1w0/aHR0cHM6Ly9zLmlzYW5vb2suY29tL25zLzAvdWQvMTY4OS84NDQ5NTI2LzE1LmpwZw==.jpg"" width=""75"" />&nbsp;&nbsp; เจนนี่-ยิว ควงคู่เคลียร์ทุกดราม่า สรุปท้อง-ไม่ท้อง ซ้อมขอแต่งงานกลางรายการสด เป็นภาพที่น่ารักมาก",https://www.sanook.com/news/8449526/,"Mon, 27 Sep 2021 17:44:42 +0700"
"มาแบบเต็มๆ ""เจนนี่-ยิว"" เปิดใจเคลียร์ทุกดราม่า และโมเมนต์ ""ยิว"" คุกเข่า (ซ้อม) ขอแต่งงาน","<img alt=""มาแบบเต็มๆ &quot;เจนนี่-ยิว&quot; เปิดใจเคลียร์ทุกดราม่า และโมเมนต์ &quot;ยิว&quot; คุกเข่า (ซ้อม) ขอแต่งงาน"" height=""75"" src=""https://s.isanook.com/ns/0/rp/rc/w75h75/ya0xacm1w0/aHR0cHM6Ly9zLmlzYW5vb2suY29tL25zLzAvdWQvMTY4OS84NDQ5NTI2LzE1LmpwZw==.jpg"" width=""75"" />&nbsp;&nbsp; เจนนี่-ยิว ควงคู่เคลียร์ทุกดราม่า สรุปท้อง-ไม่ท้อง ซ้อมขอแต่งงานกลางรายการสด เป็นภาพที่น่ารักมาก",https://www.sanook.com/news/8449526/,"Mon, 27 Sep 2021 17:44:42 +0700"
"""โอปอล์ ปาณิสรา"" สวยแซ่บมาก เปิดภาพในสระว่ายน้ำทริปหัวหิน","<img alt=""&quot;โอปอล์ ปาณิสรา&quot; สวยแซ่บมาก เปิดภาพในสระว่ายน้ำทริปหัวหิน"" height=""75"" src=""https://s.isanook.com/ns/0/rp/rc/w75h75/ya0xacm1w0/aHR0cHM6Ly9zLmlzYW5vb2suY29tL25zLzAvdWQvMTY4OS84NDQ5NzgyL29wYWwuanBn.jpg"" width=""75"" />&nbsp;&nbsp;โอปอล์ ปาณิสรา ยกครอบครัวไปเที่ยวทะเลหัวหินหัวหิน แม่แซ่บมากปล่อยภาพเซ็กซี่ในสระว่ายน้ำ",https://www.sanook.com/news/8449782/,"Tue, 28 Sep 2021 12:18:38 +0700"
"""เอ ศุภชัย"" จัดเต็มหน้าผมเทียบ ""อั้ม พัชราภา"" ไม่เหมือนตรงไหนเอาปากกามาวง","<img alt=""&quot;เอ ศุภชัย&quot; จัดเต็มหน้าผมเทียบ &quot;อั้ม พัชราภา&quot; ไม่เหมือนตรงไหนเอาปากกามาวง"" height=""75"" src=""https://s.isanook.com/ns/0/rp/rc/w75h75/ya0xacm1w0/aHR0cHM6Ly9zLmlzYW5vb2suY29tL25zLzAvdWQvMTY4OS84NDQ5Njk4L2EuanBn.jpg"" width=""75"" />&nbsp;&nbsp;พี่เอ ลงทุนจัดเต็มขนาดนี้ ถึงกับตั้งคำถามเองเลยว่า ไม่เหมือนน้องอั้มตรงไหน วง!!!",https://www.sanook.com/news/8449698/,"Tue, 28 Sep 2021 12:04:40 +0700"
ดีอีเอส-ศูนย์ต้านเฟกนิวส์ยังเงียบ ปมตัดต่อรูป รมช.ศธ ลงเพจ ชาวเน็ตหวั่น 2 มาตรฐาน,"<img alt=""ดีอีเอส-ศูนย์ต้านเฟกนิวส์ยังเงียบ ปมตัดต่อรูป รมช.ศธ ลงเพจ ชาวเน็ตหวั่น 2 มาตรฐาน"" height=""75"" src=""https://s.isanook.com/ns/0/rp/rc/w75h75/ya0xacm1w0/aHR0cHM6Ly9zLmlzYW5vb2suY29tL25zLzAvdWQvMTY4OS84NDQ5ODA2L2thbm9rd2FuLXBob3Rvc2hvcHBlZC1mYWtlbmV3LmpwZw==.jpg"" width=""75"" />&nbsp;&nbsp;กระทรวงดิจิทัลเพื่อเศรษฐกิจและสังคม (ดีอีเอส) และศูนย์ต้านเฟกนิวส์ยังเงียบ ปมตัดต่อรูป นางกนกวรรณ วิลาลัย์ รมช.ศึกษาธิการ ลงเพจ ชาวเน็ตเกรงว่าจะกลายเป็นเรื่อง 2 มาตรฐาน",https://www.sanook.com/news/8449806/,"Tue, 28 Sep 2021 11:56:47 +0700"
"ด่วน! ""พิยดา"" บอสใหญ่ Phonebymint หลอกขายมือถือเด็ก ย่องมอบตัวที่เชียงใหม่","<img alt=""ด่วน! &quot;พิยดา&quot; บอสใหญ่ Phonebymint หลอกขายมือถือเด็ก ย่องมอบตัวที่เชียงใหม่"" height=""75"" src=""https://s.isanook.com/ns/0/rp/rc/w75h75/ya0xacm1w0/aHR0cHM6Ly9zLmlzYW5vb2suY29tL25zLzAvdWQvMTY4OS84NDQ5ODU0L3Nhbm9va190aHVtYm5haWxfMTIwMHg3MjAtMi5qcGc=.jpg"" width=""75"" />&nbsp;&nbsp;""พิยดา"" Phonebymint หลอกขายมือถือ ""น้องก้อง"" ย่องมอบตัวที่ กองบังคับการตำรวจภูธรจังหวัดเชียงใหม่ ตำรวจเตรียมแถลงข่าวเร็วๆนี้",https://www.sanook.com/news/8449854/,"Tue, 28 Sep 2021 11:54:02 +0700"
"โอ้โห! ""ไอซ์ อภิษฎา"" ลุคเรียบๆ แต่เฉียบที่เสื้อ เปิดอกเซ็กซี่ ใครเห็นก็ร้องขอกรรไกร","<img alt=""โอ้โห! &quot;ไอซ์ อภิษฎา&quot; ลุคเรียบๆ แต่เฉียบที่เสื้อ เปิดอกเซ็กซี่ ใครเห็นก็ร้องขอกรรไกร"" height=""75"" src=""https://s.isanook.com/ns/0/rp/rc/w75h75/ya0xacm1w0/aHR0cHM6Ly9zLmlzYW5vb2suY29tL25zLzAvdWQvMTY4OS84NDQ5NzcwL2RvLmpwZw==.jpg"" width=""75"" />&nbsp;&nbsp;ไอซ์ อภิษฎา แซ่บไม่ไหว มากับลุคเรียบๆ แต่เฉียบที่เสื้อ ใครเห็นก็ร้องขอกรรไกรกันเป็นแถว แฟนๆ แห่กดไลก์กระหน่ำ",https://www.sanook.com/news/8449770/,"Tue, 28 Sep 2021 11:30:32 +0700"
เต่าตัวใหญ่ซุกใต้ท้องรถ เชื่อมาให้โชคลาภ เปิดสถิติงวดที่แล้วก็ตรงเลขท้าย 2 ตัว,"<img alt=""เต่าตัวใหญ่ซุกใต้ท้องรถ เชื่อมาให้โชคลาภ เปิดสถิติงวดที่แล้วก็ตรงเลขท้าย 2 ตัว"" height=""75"" src=""https://s.isanook.com/ns/0/rp/rc/w75h75/ya0xacm1w0/aHR0cHM6Ly9zLmlzYW5vb2suY29tL25zLzAvdWQvMTY4OS84NDQ5ODI2L3Nhbm9va190aHVtYm5haWxfMTIwMHg3MjAtMi5qcGc=.jpg"" width=""75"" />&nbsp;&nbsp;เต่าตัวใหญ่ซุกใต้ท้องรถ เชื่อมาให้โชคลาภ เปิดสถิติงวดที่แล้วก็ตรงเลขท้าย 2 ตัว",https://www.sanook.com/news/8449826/,"Tue, 28 Sep 2021 11:25:19 +0700"
“พชร์ อานนท์” ตอบละเอียด ชาวเน็ตดราม่า นิมนต์ “พระมหาไพรวัลย์” เล่น หอแต๋วแตก,"<img alt=""“พชร์ อานนท์” ตอบละเอียด ชาวเน็ตดราม่า นิมนต์ “พระมหาไพรวัลย์” เล่น หอแต๋วแตก"" height=""75"" src=""https://s.isanook.com/ns/0/rp/rc/w75h75/ya0xacm1w0/aHR0cHM6Ly9zLmlzYW5vb2suY29tL25zLzAvdWQvMTY4OS84NDQ5NzU4LzIuanBn.jpg"" width=""75"" />&nbsp;&nbsp;“พชร์ อานนท์” เคลียร์ดราม่าดึง พส. “พระมหาไพรวัลย์” เล่น หอแต๋วแตกฯ ยอมเปิดเรื่องรักครั้งแรกแฟนอายุห่าง 30 ปี เปย์หนักมาก",https://www.sanook.com/news/8449758/,"Tue, 28 Sep 2021 11:06:51 +0700"
โคราชอ่วม น้ำทะลักเข้าเมือง ทรัพย์สิน-สัตว์เลี้ยงจมน้ำหมด ล่าสุดรถบัสตกถนนจมครึ่งคัน,"<img alt=""โคราชอ่วม น้ำทะลักเข้าเมือง ทรัพย์สิน-สัตว์เลี้ยงจมน้ำหมด ล่าสุดรถบัสตกถนนจมครึ่งคัน"" height=""75"" src=""https://s.isanook.com/ns/0/rp/rc/w75h75/ya0xacm1w0/aHR0cHM6Ly9zLmlzYW5vb2suY29tL25zLzAvdWQvMTY4OS84NDQ5NzkwL3Nhbm9va190aHVtYm5haWxfMTIwMHg3MjAtMi5qcGc=.jpg"" width=""75"" />&nbsp;&nbsp;โคราชระทมหนัก น้ำจากลำเชียงไกรและลำตะคอง ทะลักท่วม ล่าสุดเข้า อ.เมือง แล้ว ล่าสุดมีอุบัติเหตุ รถบัสพลิกคว่ำตกถนน เพราะกระแสน้ำแรง และมองไม่เห็นผิวถนน",https://www.sanook.com/news/8449790/,"Tue, 28 Sep 2021 10:50:22 +0700"
"""นุ่น รมิดา"" เป็นกระบอกเสียงขอความช่วยเหลือ โรงพยาบาลบ้านเกิดน้ำท่วมเสียหายหนัก","<img alt=""&quot;นุ่น รมิดา&quot; เป็นกระบอกเสียงขอความช่วยเหลือ โรงพยาบาลบ้านเกิดน้ำท่วมเสียหายหนัก"" height=""75"" src=""https://s.isanook.com/ns/0/rp/rc/w75h75/ya0xacm1w0/aHR0cHM6Ly9zLmlzYW5vb2suY29tL25zLzAvdWQvMTY4OS84NDQ5NzA2L2NvY2VyLmpwZw==.jpg"" width=""75"" />&nbsp;&nbsp;""นุ่น รมิดา"" ไม่นิ่งเฉย ช่วยเป็นกระบอกเสียงขอรับบริจาคเงินช่วยเหลือ ฟื้นฟูโรงพยาบาลบำเหน็จณรงค์ จ.ชัยภูมิ หลังน้ำท่วมเสียหายหนัก",https://www.sanook.com/news/8449706/,"Tue, 28 Sep 2021 10:38:59 +0700"
"อลังการ ""เบสท์"" ทำเซอร์ไพรส์ ""ตงตง"" ขึ้นจอ LED หน้าเซ็นทรัลเวิลด์","<img alt=""อลังการ &quot;เบสท์&quot; ทำเซอร์ไพรส์ &quot;ตงตง&quot; ขึ้นจอ LED หน้าเซ็นทรัลเวิลด์"" height=""75"" src=""https://s.isanook.com/ns/0/rp/rc/w75h75/ya0xacm1w0/aHR0cHM6Ly9zLmlzYW5vb2suY29tL25zLzAvdWQvMTY4OS84NDQ5NzMwL3BhZ2UyLmpwZw==.jpg"" width=""75"" />&nbsp;&nbsp;เบสท์ เล่นใหญ่มาก ขึ้นจอ LED เซอร์ไพรส์สุดหวานวันเกิด ตงตง หน้าห้างเซ็นทรัลเวิลด์",https://www.sanook.com/news/8449730/,"Tue, 28 Sep 2021 10:22:08 +0700"
"มาแรงมาก! ดูเลย เลขเด็ด ""เจ๊ฟองเบียร์"" เลข 2 ตัว เลข 3 ตัว มาครบ งวด 1/10/64","<img alt=""มาแรงมาก! ดูเลย เลขเด็ด &quot;เจ๊ฟองเบียร์&quot; เลข 2 ตัว เลข 3 ตัว มาครบ งวด 1/10/64"" height=""75"" src=""https://s.isanook.com/ns/0/rp/rc/w75h75/ya0xacm1w0/aHR0cHM6Ly9zLmlzYW5vb2suY29tL25zLzAvdWQvMTY4OS84NDQ5NzU0L3Nhbm9va190aHVtYm5haWxfMTIwMHg3MjAoNSkuanBn.jpg"" width=""75"" />&nbsp;&nbsp;มาแรงมาก แนวทางเลขเด็ด เจ๊ฟองเบียร์  รีบซื้อก่อนเกลี้ยงแผง ลุ้นเสี่ยงโชค 1/10/64",https://www.sanook.com/news/8449754/,"Tue, 28 Sep 2021 09:56:11 +0700"
รวมข่าวหวย เลขเด็ดงวดนี้ ก่อนออกสลากกินแบ่งรัฐบาลงวด 1/10/64,"<img alt=""รวมข่าวหวย เลขเด็ดงวดนี้ ก่อนออกสลากกินแบ่งรัฐบาลงวด 1/10/64"" height=""75"" src=""https://s.isanook.com/ns/0/rp/rc/w75h75/ya0xacm1w0/aHR0cHM6Ly9zLmlzYW5vb2suY29tL25zLzAvdWQvMTY4OS84NDQ5NzUwL2FsbC1sb3R0by1uZXdzLmpwZw==.jpg"" width=""75"" />&nbsp;&nbsp;รวมมาให้แล้ว ข่าวหวย เลขเด็ดงวดนี้ เลขเด็ดมาแรง ก่อนการออกรางวัลสลากกินแบ่งรัฐบาล งวดวันที่ 1/10/64",https://www.sanook.com/news/8449750/,"Tue, 28 Sep 2021 09:34:10 +0700"
เร่งกู้เส้นทางแม่สอด-อุ้มผาง น้ำป่า-ดินถล่มตัดขาดโลกภายนอก นับร้อยชีวิตติดอยู่บนดอย,"<img alt=""เร่งกู้เส้นทางแม่สอด-อุ้มผาง น้ำป่า-ดินถล่มตัดขาดโลกภายนอก นับร้อยชีวิตติดอยู่บนดอย"" height=""75"" src=""https://s.isanook.com/ns/0/rp/rc/w75h75/ya0xacm1w0/aHR0cHM6Ly9zLmlzYW5vb2suY29tL25zLzAvdWQvMTY4OS84NDQ5NzM0L3Nhbm9va190aHVtYm5haWxfMTIwMHg3MjAtMi5qcGc=.jpg"" width=""75"" />&nbsp;&nbsp;เร่งกู้เส้นทางแม่สอด-อุ้มผาง น้ำป่า-ดินถล่มตัดขาดโลกภายนอก นับร้อยชีวิตติดอยู่บนดอย",https://www.sanook.com/news/8449734/,"Tue, 28 Sep 2021 09:20:42 +0700"
"""อาภาพร"" นึกว่าจะรอด เผยภาพน้ำท่วมนาข้าวและไร่มัน จมอยู่ใต้น้ำ 200 กว่าไร่","<img alt=""&quot;อาภาพร&quot; นึกว่าจะรอด เผยภาพน้ำท่วมนาข้าวและไร่มัน จมอยู่ใต้น้ำ 200 กว่าไร่"" height=""75"" src=""https://s.isanook.com/ns/0/rp/rc/w75h75/ya0xacm1w0/aHR0cHM6Ly9zLmlzYW5vb2suY29tL25zLzAvdWQvMTY4OS84NDQ5NzAyL3BhZ2UzLmpwZw==.jpg"" width=""75"" />&nbsp;&nbsp;นึกว่าจะรอด ""ฮาย อาภาพร"" เผยภาพน้ำท่วมที่นาและไร่มันเสียหาย จมอยู่ใต้น้ำ 200 กว่าไร่",https://www.sanook.com/news/8449702/,"Tue, 28 Sep 2021 09:20:38 +0700"
"""อาย กมลเนตร"" เซอร์ไพรส์ ""ว่านไฉ"" จัดของขวัญชุดใหญ่มอบให้ในวันเกิด","<img alt=""&quot;อาย กมลเนตร&quot; เซอร์ไพรส์ &quot;ว่านไฉ&quot; จัดของขวัญชุดใหญ่มอบให้ในวันเกิด"" height=""75"" src=""https://s.isanook.com/ns/0/rp/rc/w75h75/ya0xacm1w0/aHR0cHM6Ly9zLmlzYW5vb2suY29tL25zLzAvdWQvMTY4OS84NDQ5NzE4L2V5ZS5qcGc=.jpg"" width=""75"" />&nbsp;&nbsp;ของขวัญที่ อาย กมลเนตร มอบให้ ว่านไฉ ในวันเกิด บอกเลยไม่ธรรมดาจริงๆ",https://www.sanook.com/news/8449718/,"Tue, 28 Sep 2021 09:18:31 +0700"
"""หมอริท"" ดี๊ด๊า ถอยรถใหม่ป้ายแดงหรูหราสมใจ แฟนๆ แห่ส่องเลขทะเบียนรัวๆ","<img alt=""&quot;หมอริท&quot; ดี๊ด๊า ถอยรถใหม่ป้ายแดงหรูหราสมใจ แฟนๆ แห่ส่องเลขทะเบียนรัวๆ"" height=""75"" src=""https://s.isanook.com/ns/0/rp/rc/w75h75/ya0xacm1w0/aHR0cHM6Ly9zLmlzYW5vb2suY29tL25zLzAvdWQvMTY4OS84NDQ5Njc0L2NvY2VyLmpwZw==.jpg"" width=""75"" />&nbsp;&nbsp;""หมอริท เรืองฤทธิ์"" ได้ฤกษ์งามยามดี ถอยรถใหม่ป้ายแดง สวย หรู แฟนๆ แห่ยินดี พร้อมส่องเเลขทะเบียน",https://www.sanook.com/news/8449674/,"Tue, 28 Sep 2021 09:16:02 +0700"
