title,summary,link,published
สาวโรงงานคลอดลูกในห้องน้ำ ใช้ถุงเท้ารัดคอเด็กจนตาย ผงะ หิ้วถุงดำไป รพ.ด้วย,"<img alt=""สาวโรงงานคลอดลูกในห้องน้ำ ใช้ถุงเท้ารัดคอเด็กจนตาย ผงะ หิ้วถุงดำไป รพ.ด้วย"" height=""75"" src=""https://s.isanook.com/ns/0/rp/rc/w75h75/ya0xacm1w0/aHR0cHM6Ly9zLmlzYW5vb2suY29tL25zLzAvdWQvMTY4OS84NDQ4OTgyL2tpbGwuanBn.jpg"" width=""75"" />&nbsp;&nbsp;รวบสาวโรงงาน วัย 26 ปี ใช้ถูกเท้ารัดคอลูกแรกเกิดเสียชีวิต ก่อนยัดถุงดำ โป๊ะแตกหลังตรวจร่างกาย เจ้าหน้าที่สงสัยชอบมองถุงดำ",https://www.sanook.com/news/8448982/,"Sun, 26 Sep 2021 19:57:07 +0700"
"หมดกัน ""สุนารี"" เผยคลิปน้ำท่วมนาข้าวไร่สวนกว่า 80 ไร่ เกิดมา 53 ปี เพิ่งเคยเจอ","<img alt=""หมดกัน &quot;สุนารี&quot; เผยคลิปน้ำท่วมนาข้าวไร่สวนกว่า 80 ไร่ เกิดมา 53 ปี เพิ่งเคยเจอ"" height=""75"" src=""https://s.isanook.com/ns/0/rp/rc/w75h75/ya0xacm1w0/aHR0cHM6Ly9zLmlzYW5vb2suY29tL25zLzAvdWQvMTY4OS84NDQ4OTc0L3BhZ2UuanBn.jpg"" width=""75"" />&nbsp;&nbsp;สุนารี ราชสีมา โพสต์คลิปไร่นาและสวนที่บ้านพื้นที่กว่า 80 ไร่ โดนน้ำท่วม บ่นอุบหมดกัน เกิดมา 53 ปี เพิ่งเคยเจอ",https://www.sanook.com/news/8448974/,"Sun, 26 Sep 2021 19:34:32 +0700"
แนวร่วมธรรมศาสตร์ฯ จัดกิจกรรมครบรอบ 1 ปีความจริงสู่ความหวัง,"<img alt=""แนวร่วมธรรมศาสตร์ฯ จัดกิจกรรมครบรอบ 1 ปีความจริงสู่ความหวัง"" height=""75"" src=""https://s.isanook.com/ns/0/rp/rc/w75h75/ya0xacm1w0/aHR0cHM6Ly9zLmlzYW5vb2suY29tL25zLzAvdWQvMTY4OS84NDQ4OTcwL3RoYW1tYXNhdHVmdGQuanBn.jpg"" width=""75"" />&nbsp;&nbsp;แนวร่วมธรรมศาสตร์และการชุมนุม จัดงานครบรอบ 1 ปีความจริงสู่ความหวัง บริเวณหน้าหอศิลป์ฯ",https://www.sanook.com/news/8448970/,"Sun, 26 Sep 2021 19:12:40 +0700"
ชลประทานเตือนชาวโคราชเก็บของขึ้นที่สูง รับมือมวลน้ำไหลบ่าจากอ่างเก็บน้ำลำเชียงไกร,"<img alt=""ชลประทานเตือนชาวโคราชเก็บของขึ้นที่สูง รับมือมวลน้ำไหลบ่าจากอ่างเก็บน้ำลำเชียงไกร"" height=""75"" src=""https://s.isanook.com/ns/0/rp/rc/w75h75/ya0xacm1w0/aHR0cHM6Ly9zLmlzYW5vb2suY29tL25zLzAvdWQvMTY4OS84NDQ4OTY2L2tvcmF0LWZsb29kLWFnYWluLmpwZw==.jpg"" width=""75"" />&nbsp;&nbsp;ด่วน!! ชลประทานโคราชเตือนประชาชนเก็บของขึ้นที่สูง หลังอ่างเก็บน้ำลำเชียงไกรตอนล่าง มีแนวโน้มระดับน้ำเพิ่มสูงขึ้นอย่างรวดเร็ว",https://www.sanook.com/news/8448966/,"Sun, 26 Sep 2021 18:45:52 +0700"
มิสแกรนด์สุโขทัย แจงดราม่า แต่งเต็มยศ-สวมมงมาช่วยน้ำท่วม แต่เจอคอมเมนต์แรง,"<img alt=""มิสแกรนด์สุโขทัย แจงดราม่า แต่งเต็มยศ-สวมมงมาช่วยน้ำท่วม แต่เจอคอมเมนต์แรง"" height=""75"" src=""https://s.isanook.com/ns/0/rp/rc/w75h75/ya0xacm1w0/aHR0cHM6Ly9zLmlzYW5vb2suY29tL25zLzAvdWQvMTY4OS84NDQ4OTU0L1dvcmFkYUNoYXRzcmkuanBn.jpg"" width=""75"" />&nbsp;&nbsp;กวาง วรดา ฉัตรศรี มิสแกรนด์สุโขทัย โพสต์แจง หลังเจอวิจารณ์แต่งเต็มยศ สวมมงนั่งเรือลงช่วยเหลือน้ำท่วม เผยเจ้าของเรือขอให้ขึ้นไปถ่าย ""ไม่ได้เป็นอย่างที่ทุกท่านเข้าใจผิด""",https://www.sanook.com/news/8448954/,"Sun, 26 Sep 2021 18:39:55 +0700"
สามีหายทุกคนต้องรู้! ชาวบ้านสุดเซ็ง หญิงบีบแตรดังลั่นกลางดึก หลังตามหาสามีแต่ไม่พบตัว,"<img alt=""สามีหายทุกคนต้องรู้! ชาวบ้านสุดเซ็ง หญิงบีบแตรดังลั่นกลางดึก หลังตามหาสามีแต่ไม่พบตัว"" height=""75"" src=""https://s.isanook.com/ns/0/rp/rc/w75h75/ya0xacm1w0/aHR0cHM6Ly9zLmlzYW5vb2suY29tL25zLzAvdWQvMTY4OS84NDQ4OTUwL2hvcm4uanBn.jpg"" width=""75"" />&nbsp;&nbsp;ชาวบ้านสุดเซ็ง หญิงบีบแตรดังลั่นกลางดึก หลังตามหาสามีแต่ไม่พบตัว",https://www.sanook.com/news/8448950/,"Sun, 26 Sep 2021 18:13:53 +0700"
"""ชมพู่ อารยา"" เผยภาพแรกหลังประกาศข่าวดีตั้งท้อง แอบโฟกัสที่หุ่นแม่","<img alt=""&quot;ชมพู่ อารยา&quot; เผยภาพแรกหลังประกาศข่าวดีตั้งท้อง แอบโฟกัสที่หุ่นแม่"" height=""75"" src=""https://s.isanook.com/ns/0/rp/rc/w75h75/ya0xacm1w0/aHR0cHM6Ly9zLmlzYW5vb2suY29tL25zLzAvdWQvMTY4OS84NDQ4OTMwL2Nob20uanBn.jpg"" width=""75"" />&nbsp;&nbsp;ชมพู่ อารยา เผยภาพแรกหลังประกาศข่าวดีตั้งท้อง แฟชั่นแม่ชมพู่ถ้าไม่บอกก็แทบไม่รู้ว่าท้องอยู่",https://www.sanook.com/news/8448930/,"Sun, 26 Sep 2021 18:07:17 +0700"
"โดนเพิ่ม 2 หมายจับ ""พิยดา"" บอสใหญ่หลอกขายมือถือเด็ก ตำรวจไซเบอร์จัดทีมล่า","<img alt=""โดนเพิ่ม 2 หมายจับ &quot;พิยดา&quot; บอสใหญ่หลอกขายมือถือเด็ก ตำรวจไซเบอร์จัดทีมล่า"" height=""75"" src=""https://s.isanook.com/ns/0/rp/rc/w75h75/ya0xacm1w0/aHR0cHM6Ly9zLmlzYW5vb2suY29tL25zLzAvdWQvMTY4OS84NDQ4OTQyL3BpeWFkYS5qcGc=.jpg"" width=""75"" />&nbsp;&nbsp;ตำรวจไซเบอร์จัดทีมล่า ""พิยดา"" บอสใหญ่หลอกขายมือถือเด็ก พบยังคงหลบหนีอยู่ ล่าสุด โดนเพิ่มอีก 2 หมายจับ",https://www.sanook.com/news/8448942/,"Sun, 26 Sep 2021 18:00:34 +0700"
ฉลองหายป่วยโควิด รวบ 39 วัยรุ่น เช่าพูลวิลล่ากลางสวนทุเรียนจัดปาร์ตี้เสพยา,"<img alt=""ฉลองหายป่วยโควิด รวบ 39 วัยรุ่น เช่าพูลวิลล่ากลางสวนทุเรียนจัดปาร์ตี้เสพยา"" height=""75"" src=""https://s.isanook.com/ns/0/rp/rc/w75h75/ya0xacm1w0/aHR0cHM6Ly9zLmlzYW5vb2suY29tL25zLzAvdWQvMTY4OS84NDQ4OTI2LzM5LmpwZw==.jpg"" width=""75"" />&nbsp;&nbsp;ทลายปาร์ตี้แก๊งปาร์ตี้บ้านพูลวิลล่ากลางสวนทุเรียน ฉลองหายป่วย #โควิด19 รวบ 39 วัยรุ่น ขณะมั่วสุมเสพยา",https://www.sanook.com/news/8448926/,"Sun, 26 Sep 2021 17:10:28 +0700"
สุโขทัยอ่วม! น้ำยังท่วมหนัก 288 หมู่บ้านเดือดร้อน,"<img alt=""สุโขทัยอ่วม! น้ำยังท่วมหนัก 288 หมู่บ้านเดือดร้อน"" height=""75"" src=""https://s.isanook.com/ns/0/rp/rc/w75h75/ya0xacm1w0/aHR0cHM6Ly9zLmlzYW5vb2suY29tL25zLzAvdWQvMTY4OS84NDQ4OTM4L3N1a2hvdGhhaS1yb2FkLmpwZw==.jpg"" width=""75"" />&nbsp;&nbsp;สุโขทัยอ่วมน้ำยังท่วมหนัก หลายเส้นทางรถยังไม่สามารถสัญจรได้",https://www.sanook.com/news/8448938/,"Sun, 26 Sep 2021 17:04:04 +0700"
"รวมมาให้แล้ว ทะเบียนรถ ""บิ๊กตู่"" ควง ""บิ๊กป๊อก"" ตรวจสถานการณ์น้ำท่วมสุโขทัย","<img alt=""รวมมาให้แล้ว ทะเบียนรถ &quot;บิ๊กตู่&quot; ควง &quot;บิ๊กป๊อก&quot; ตรวจสถานการณ์น้ำท่วมสุโขทัย"" height=""75"" src=""https://s.isanook.com/ns/0/rp/rc/w75h75/ya0xacm1w0/aHR0cHM6Ly9zLmlzYW5vb2suY29tL25zLzAvdWQvMTY4OS84NDQ4OTEwL3ByYXl1dC5qcGc=.jpg"" width=""75"" />&nbsp;&nbsp;จัดเต็มเอาใจคอหวย รวมภาพทะเบียนรถนายกฯ ลงพื้นที่พร้อม บิ๊กป๊อก ติดตามสถานการณ์น้ำท่วมที่สุโขทัย",https://www.sanook.com/news/8448910/,"Sun, 26 Sep 2021 16:35:19 +0700"
ถึงกับอึ้ง พ่อค้าขายพริกแห้งซื้อของจากร้านขายส่ง เจอหินถ่วงน้ำหนักเพียบ,"<img alt=""ถึงกับอึ้ง พ่อค้าขายพริกแห้งซื้อของจากร้านขายส่ง เจอหินถ่วงน้ำหนักเพียบ"" height=""75"" src=""https://s.isanook.com/ns/0/rp/rc/w75h75/ya0xacm1w0/aHR0cHM6Ly9zLmlzYW5vb2suY29tL25zLzAvdWQvMTY4OS84NDQ4ODkwL2RyaWVkY2hpbGkuanBn.jpg"" width=""75"" />&nbsp;&nbsp;พริกแห้ง 1 ถุง มี 10 กิโลกรัม เจอหินถ่วงมาแบบนี้ น้ำหนักหายไปครึ่งกิโลกรัมเลยทีเดียว",https://www.sanook.com/news/8448890/,"Sun, 26 Sep 2021 15:50:06 +0700"
สระแตก-น้ำทะลัก!  ชาวบ้านที่โคราชหนีตาย หลังมวลน้ำมหาศาลไหลท่วมกลางดึก,"<img alt=""สระแตก-น้ำทะลัก!  ชาวบ้านที่โคราชหนีตาย หลังมวลน้ำมหาศาลไหลท่วมกลางดึก"" height=""75"" src=""https://s.isanook.com/ns/0/rp/rc/w75h75/ya0xacm1w0/aHR0cHM6Ly9zLmlzYW5vb2suY29tL25zLzAvdWQvMTY4OS84NDQ4ODk4L2tvcmF0LWZsb29kLmpwZw==.jpg"" width=""75"" />&nbsp;&nbsp;สระหมู่บ้านในจ.นครราชสีมา แตกอีกแล้ว! หลังฝนตกหนัก มวลน้ำมหาศาลไหลเข้าขอบสระรับไม่ไหวพังเสียหาย ขณะที่พิพิธภัณฑสถานแห่งชาติพิมายเร่งวางกระสอบทราย",https://www.sanook.com/news/8448898/,"Sun, 26 Sep 2021 15:40:14 +0700"
"""หญิงลี"" ปลื้ม ""ลิซ่า"" ทำบุรีรัมย์โด่งดัง พร้อมเปิดรีสอร์ต หลังลงทุนทำสระกว่า 3 ล้าน","<img alt=""&quot;หญิงลี&quot; ปลื้ม &quot;ลิซ่า&quot; ทำบุรีรัมย์โด่งดัง พร้อมเปิดรีสอร์ต หลังลงทุนทำสระกว่า 3 ล้าน"" height=""75"" src=""https://s.isanook.com/ns/0/rp/rc/w75h75/ya0xacm1w0/aHR0cHM6Ly9zLmlzYW5vb2suY29tL25zLzAvdWQvMTY4OS84NDQ4ODg2L3lpbmdsZWUuanBn.jpg"" width=""75"" />&nbsp;&nbsp;หญิงลี นักร้องลูกทุ่งชื่อดัง เป็นปลื้ม ลิซ่า BLACKPINK หลังทำให้คนไทยและคนทั่วโลกรู้จักบุรีรัมย์ พร้อมรับงานและเปิดรีสอร์ตต้อนรับแขกมาพัก หลังลงทุนทำสระน้ำกว่า 3 ล้านบาท",https://www.sanook.com/news/8448886/,"Sun, 26 Sep 2021 15:25:42 +0700"
นายกฯ ยอมรับ ไม่สามารถแก้ปัญหาน้ำท่วมได้ 100%,"<img alt=""นายกฯ ยอมรับ ไม่สามารถแก้ปัญหาน้ำท่วมได้ 100%"" height=""75"" src=""https://s.isanook.com/ns/0/rp/rc/w75h75/ya0xacm1w0/aHR0cHM6Ly9zLmlzYW5vb2suY29tL25zLzAvdWQvMTY4OS84NDQ4ODcwL3ByYXl1dC0yNi5qcGc=.jpg"" width=""75"" />&nbsp;&nbsp;นายกฯ ยอมรับไม่สามารถแก้ปัญหาน้ำท่วมได้ร้อยเปอร์เซ็นต์ จึงต้องมีการบริหารจัดการน้ำเป็นพื้นที่",https://www.sanook.com/news/8448870/,"Sun, 26 Sep 2021 15:19:39 +0700"
"""แมท ภีรนีย์"" ปล่อยภาพใส่ชุดว่ายน้ำผิวขาวสวยสะท้อนแสงแดด","<img alt=""&quot;แมท ภีรนีย์&quot; ปล่อยภาพใส่ชุดว่ายน้ำผิวขาวสวยสะท้อนแสงแดด"" height=""75"" src=""https://s.isanook.com/ns/0/rp/rc/w75h75/ya0xacm1w0/aHR0cHM6Ly9zLmlzYW5vb2suY29tL25zLzAvdWQvMTY4OS84NDQ4ODI2L21hdC5qcGc=.jpg"" width=""75"" />&nbsp;&nbsp;แมท ภีรนีย์ เช็คอินเที่ยวทะเลหัวหิน ปล่อยภาพใส่ชุดว่ายน้ำวันพีซผิวขาวสะท้อนแสงแดด",https://www.sanook.com/news/8448826/,"Sun, 26 Sep 2021 15:03:00 +0700"
เตือนด่วน! ถ.หนองบัวแดง-ชัยภูมิ ดินถล่มหลังฝนตกหนัก เตือนผู้ขับขี่ระวัง หวั่นเกิดอุบัติเหตุซ้ำ,"<img alt=""เตือนด่วน! ถ.หนองบัวแดง-ชัยภูมิ ดินถล่มหลังฝนตกหนัก เตือนผู้ขับขี่ระวัง หวั่นเกิดอุบัติเหตุซ้ำ"" height=""75"" src=""https://s.isanook.com/ns/0/rp/rc/w75h75/ya0xacm1w0/aHR0cHM6Ly9zLmlzYW5vb2suY29tL25zLzAvdWQvMTY4OS84NDQ4ODYyL3JvYWQuanBn.jpg"" width=""75"" />&nbsp;&nbsp;เตือนภัย !! ประชาชนให้ระมัดระวัง การสัญจรเส้นทางหนองบัวแดง-ชัยภูมิ",https://www.sanook.com/news/8448862/,"Sun, 26 Sep 2021 14:59:54 +0700"
"CFO หัวเว่ย ""เมิ่ง หว่านโจว"" กลับถึงบ้านเกิดแล้ว จีนจัดพิธีต้อนรับสุดอลัง","<img alt=""CFO หัวเว่ย &quot;เมิ่ง หว่านโจว&quot; กลับถึงบ้านเกิดแล้ว จีนจัดพิธีต้อนรับสุดอลัง"" height=""75"" src=""https://s.isanook.com/ns/0/rp/rc/w75h75/ya0xacm1w0/aHR0cHM6Ly9zLmlzYW5vb2suY29tL25zLzAvdWQvMTY4OS84NDQ4ODU0L21lbmd3YW56aG91LmpwZw==.jpg"" width=""75"" />&nbsp;&nbsp;ชาวจีนปีติยินดี ต้อนรับ ""เมิ่ง หว่านโจว"" CFO ของหัวเว่ย กลับถึงบ้านเกิด โดยเครื่องบินเช่าเหมาลำที่จัดโดยรัฐบาลจีน",https://www.sanook.com/news/8448854/,"Sun, 26 Sep 2021 14:43:19 +0700"
ฟังอีกด้าน ลูกสาวลุงวัย 62 โต้ พ่อไม่ได้ย่องข่มขืนสาวม่าย แต่ทั้งคู่เป็นชู้กันมานานแล้ว,"<img alt=""ฟังอีกด้าน ลูกสาวลุงวัย 62 โต้ พ่อไม่ได้ย่องข่มขืนสาวม่าย แต่ทั้งคู่เป็นชู้กันมานานแล้ว"" height=""75"" src=""https://s.isanook.com/ns/0/rp/rc/w75h75/ya0xacm1w0/aHR0cHM6Ly9zLmlzYW5vb2suY29tL25zLzAvdWQvMTY4OS84NDQ4ODM4L3Nhbm9va190aHVtYm5haWxfMTIwMHg3MjAtMi5qcGc=.jpg"" width=""75"" />&nbsp;&nbsp;ลูกสาวลุงวัย 62 ปีสุดทน พ่อผูกคอตาย ทั้งถูกใส่ร้ายว่าข่มขืน ขอยืนยันพ่อกับคู่กรณีคบชู้กันมานาน 4-5 ปี ที่แทงฝ่ายหญิง เพราะจับได้ว่ามั่วชายอื่น",https://www.sanook.com/news/8448838/,"Sun, 26 Sep 2021 14:01:59 +0700"
อดีตผัวเลิกกันได้ 3 วัน กลับมาขอแบ่งสมบัติจากเมีย เคลียร์กันไม่ลงตัว จ้วงแทงเมียเจ็บ,"<img alt=""อดีตผัวเลิกกันได้ 3 วัน กลับมาขอแบ่งสมบัติจากเมีย เคลียร์กันไม่ลงตัว จ้วงแทงเมียเจ็บ"" height=""75"" src=""https://s.isanook.com/ns/0/rp/rc/w75h75/ya0xacm1w0/aHR0cHM6Ly9zLmlzYW5vb2suY29tL25zLzAvdWQvMTY4OS84NDQ4ODM0L3Nhbm9va190aHVtYm5haWxfMTIwMHg3MjAtMi5qcGc=.jpg"" width=""75"" />&nbsp;&nbsp;อดีตผัวอ้าง บันดาลโทสะโดนด่าพ่อ คว้ามีดปอกผลไม้แทงเมียที่เลิกกันไปได้ 3 วัน",https://www.sanook.com/news/8448834/,"Sun, 26 Sep 2021 13:43:06 +0700"
เคลื่อนย้ายผู้ป่วย รพ.บำเหน็จณรงค์ 26 ราย หนีน้ำท่วม ห้องเอกซเรย์-ห้องคลอด ไม่สามารถใช้งานได้,"<img alt=""เคลื่อนย้ายผู้ป่วย รพ.บำเหน็จณรงค์ 26 ราย หนีน้ำท่วม ห้องเอกซเรย์-ห้องคลอด ไม่สามารถใช้งานได้"" height=""75"" src=""https://s.isanook.com/ns/0/rp/rc/w75h75/ya0xacm1w0/aHR0cHM6Ly9zLmlzYW5vb2suY29tL25zLzAvdWQvMTY4OS84NDQ4OTkwL2hvc3BpdGFsLmpwZw==.jpg"" width=""75"" />&nbsp;&nbsp;สธ.เร่งเคลื่อนย้ายผู้ป่วย 26 ราย รพ.บำเหน็จณรงค์ จ.ชัยภูมิหนีน้ำท่วม – ด้านรพ.สุโขทัย ยังเปิดให้บริการปกติ",https://www.sanook.com/news/8448990/,"Sun, 26 Sep 2021 20:26:17 +0700"
"เพจข่าวสำนักงานรัฐมนตรี ศธ. แจงแล้ว ปมภาพ รมช.ศึกษาธิการ เจอแซวยับ ""ขาลอย""","<img alt=""เพจข่าวสำนักงานรัฐมนตรี ศธ. แจงแล้ว ปมภาพ รมช.ศึกษาธิการ เจอแซวยับ &quot;ขาลอย&quot;"" height=""75"" src=""https://s.isanook.com/ns/0/rp/rc/w75h75/ya0xacm1w0/aHR0cHM6Ly9zLmlzYW5vb2suY29tL25zLzAvdWQvMTY4OS84NDQ5NTcwL2thbm9rd2FuLmpwZw==.jpg"" width=""75"" />&nbsp;&nbsp; เฟซบุ๊กแฟนเพจ ข่าวสำนักงานรัฐมนตรี ศธ. ออกมาชี้แจงแล้ว ปมภาพ ""กนกวรรณ"" รมช.ศธ. เจอชาวเน็ตแซวยับ ลุยน้ำท่วมทิพย์-ขาลอย",https://www.sanook.com/news/8449570/,"Mon, 27 Sep 2021 19:06:24 +0700"
"""น้องบีน่า"" ลูกนานา-เวย์ โตเป็นสาวแล้ว สวย เท่ มีสไตล์ ได้พ่อกับแม่มาเต็มๆ","<img alt=""&quot;น้องบีน่า&quot; ลูกนานา-เวย์ โตเป็นสาวแล้ว สวย เท่ มีสไตล์ ได้พ่อกับแม่มาเต็มๆ"" height=""75"" src=""https://s.isanook.com/ns/0/rp/rc/w75h75/ya0xacm1w0/aHR0cHM6Ly9zLmlzYW5vb2suY29tL25zLzAvdWQvMTY4OS84NDQ5NTM0LzdfMS5qcGc=.jpg"" width=""75"" />&nbsp;&nbsp;เป๊ะมาก ""น้องบีน่า"" ลูก นานา-เวย์ เปิดภาพล่าสุดโตเป็นสาวแล้ว คาแรคเตอร์ชัดเจน! สวยเท่ได้พ่อกับแม่มาเต็มๆ",https://www.sanook.com/news/8449534/,"Mon, 27 Sep 2021 19:05:52 +0700"
ไทยได้รับวัคซีน AZ กว่า 1.2 แสนโดส พร้อมชุดตรวจหาเชื้อโควิด 7 แสนชุดจากสิงคโปร์,"<img alt=""ไทยได้รับวัคซีน AZ กว่า 1.2 แสนโดส พร้อมชุดตรวจหาเชื้อโควิด 7 แสนชุดจากสิงคโปร์"" height=""75"" src=""https://s.isanook.com/ns/0/rp/rc/w75h75/ya0xacm1w0/aHR0cHM6Ly9zLmlzYW5vb2suY29tL25zLzAvdWQvMTY4OS84NDQ5NTQ2L3NpbmdhcG9yZS1zZW5kLXZhY2NpbmUtYXRrLTI3MDkyMS5wbmc=.png"" width=""75"" />&nbsp;&nbsp;""อนุทิน"" รับมอบวัคซีนแอสตร้าเซนเนก้า ชุดตรวจ ATK และชุดตรวจแบบ Nasopharyngeal Swab เพื่อสนับสนุนการทำงานของบุคลากรทางการแพทย์ในการควบคุมโรคโควิด 19",https://www.sanook.com/news/8449546/,"Mon, 27 Sep 2021 18:36:13 +0700"
"ช็อกทั้งจังหวัด สูญเสีย ""ชาตรี จันทร์วีระชัย"" รองผู้ว่าฯ ประจวบคีรีขันธ์ ด้วยวัย 58 ปี","<img alt=""ช็อกทั้งจังหวัด สูญเสีย &quot;ชาตรี จันทร์วีระชัย&quot; รองผู้ว่าฯ ประจวบคีรีขันธ์ ด้วยวัย 58 ปี"" height=""75"" src=""https://s.isanook.com/ns/0/rp/rc/w75h75/ya0xacm1w0/aHR0cHM6Ly9zLmlzYW5vb2suY29tL25zLzAvdWQvMTY4OS84NDQ5NTUwL2NoYXRlZS5qcGc=.jpg"" width=""75"" />&nbsp;&nbsp;ชาวประจวบฯ สุดอาลัยสูญเสียคนดี ""ชาตรี จันทร์วีระชัย"" รองผู้ว่าฯ เสียชีวิตอย่างสงบ ด้วยวัย 58 ปี",https://www.sanook.com/news/8449550/,"Mon, 27 Sep 2021 18:32:02 +0700"
"ปาฏิหาริย์ รูปเหมือน ""หลวงปู่แสง"" 6 คนยกไม่ขึ้น เชื่อถ้าคนมีบารมีจะยกขึ้นได้แบบชิลล์ๆ","<img alt=""ปาฏิหาริย์ รูปเหมือน &quot;หลวงปู่แสง&quot; 6 คนยกไม่ขึ้น เชื่อถ้าคนมีบารมีจะยกขึ้นได้แบบชิลล์ๆ"" height=""75"" src=""https://s.isanook.com/ns/0/rp/rc/w75h75/ya0xacm1w0/aHR0cHM6Ly9zLmlzYW5vb2suY29tL25zLzAvdWQvMTY4OS84NDQ5NDcwL21vbmsuanBn.jpg"" width=""75"" />&nbsp;&nbsp;ไวยาวัจกรวัดเล่าปาฏิหาริย์ รูปเหมือน ""หลวงปู่แสง"" วัดโพธิ์ไทร จ.นครนายก 6 คน โอบยกไม่ขึ้น",https://www.sanook.com/news/8449470/,"Mon, 27 Sep 2021 17:49:30 +0700"
