title,summary,link,published
คนบันเทิง-แฟนเพลงนับพันร่วมอาลัย &quot;พรศักดิ์ ส่องแสง&quot; ในงานฌาปนกิจแน่นวัด,"คนบันเทิงและแฟนคลับนับพันพร้อมใจมาร่วมพิธีฌาปนกิจ ""พรศักดิ์ ส่องแสง"" ตำนานหมอลำ แน่นวัดป่าศรีสว่าง ที่ จ.หนองบัวลำพู ญาติและครอบครัวร่ำไห้สุดอาลัย แล้วสุดท้ายเปิดเพลงอ้ายตายอย่าอ่านประวัติ",https://www.thairath.co.th/news/local/northeast/2222455,2021_10_19
หนุ่มขับรถพุ่งตกน้ำจมหาย 20 นาทีรอดปาฏิหาริย์ เผยสติล้วนๆ ถีบกระจกหนี,กระบะพุ่งตกน้ำจมมิดกว่า 20 นาที ไทยมุงใจแป้วคิดว่าไม่รอด จู่ๆ โผล่พรวดขึ้นจากน้ำ ก่อนที่ชาวบ้านจะไปช่วยขึ้นมาบนฝั่ง ด้านคนขับเผย ก้มเก็บของจนรถเสียหลัก รอดได้ด้วยสติ พยายามถีบกระจกรถหนีออกมา,https://www.thairath.co.th/news/local/central/2222452,2021_10_19
Apple เปิดตัว MacBook Pro 14 และ MacBook Pro 16 มาพร้อมชิปเซตขุมพลัง M1 Pro และ M1 Max,ในที่สุดก็เป็นเวลาของพระเอกประจำงาน Apple Event Unleashed นั่นก็คือ การเปิดตัว MacBook Pro โดยจะมาด้วยกันสองโมเดล ได้แก่ MacBook Pro 14 และ MacBook Pro 16,https://www.thairath.co.th/news/tech/2222476,2021_10_19
&quot;กรมราชทัณฑ์&quot; ประกาศนโยบายปี 65 ยกระดับคุณภาพชีวิต &quot;จนท.-ผู้ต้องขัง&quot;,"""กรมราชทัณฑ์"" ยุคใหม่ Next Normal ""อายุตม์"" ประกาศ 5 นโยบาย ปี 65 ยกระดับคุณภาพชีวิต ""จนท.-ผู้ต้องขัง"" สร้างโอกาสกลับสู่สังคม ป้องกันทำผิดซ้ำ เปิดช่องร้องทุกข์ตรงถึงอธิบดีฯ",https://www.thairath.co.th/news/local/2222472,2021_10_19
รมว.ยุติธรรม ยันเดินหน้า &quot;นิคมฯราชทัณฑ์&quot; หวังสร้างงานนักโทษ-ลดทำผิดซ้ำ,"รมว.ยุติธรรม ปลื้ม ""ม.มหิดล"" นำโครงการ ""นิคมอุตสาหกรรมราชทัณฑ์-กฎหมาย JSOC"" ออกข้อสอบปริญญาเอก ยันเดินหน้าต่อให้สำเร็จ หวังช่วยสังคมให้ปลอดภัย สร้างงานให้ผู้พ้นโทษ ลดการกระทำผิดซ้ำ",https://www.thairath.co.th/news/local/2222467,2021_10_19
Apple ประเดิมเปิดตัว HomePod mini และ AirPods 3 ต้อนรับงาน Apple Event Unleashed,แอปเปิล (Apple) เปิดตัว AirPods รุ่นที่ 3 หรือ AirPods 3rd generation เรียบร้อยแล้ว ควบคู่ไปกับ HomePod mini สีใหม่ ประเดิมงาน Apple Event Unleashed,https://www.thairath.co.th/news/tech/gadget/2222466,2021_10_19
โคลิน พาวเวลล์ อดีต รมต.ต่างประเทศ-ผู้พาสหรัฐฯ บุกอิรัก เสียชีวิตแล้ว,พลเอก โคลิน พาวเวลล์ อดีตรัฐมนตรีต่างประเทศผิวดำคนแรกของสหรัฐฯ ผู้ได้รับความนิยมอย่างสูง แต่ประวัติด่างพร้อยเพราะพาสหรัฐฯ บุกอิรัก เสียชีวิตแล้วด้วยภาวะแทรกซ้อนจากเชื้อโควิด-19,https://www.thairath.co.th/news/foreign/2222460,2021_10_19
อ่างเก็บน้ำห้วยใหญ่ล้นความจุ ทะลักไหลเข้าท่วมหลายหมู่บ้านที่ อ.ไพศาลี,ฝนที่ตกหนักในพื้นที่ อำเภอไพศาลี จ.นครสวรรค์อย่างต่อเนื่อง จนล้นอ่างเก็บน้ำห้วยใหญ่ทะลักผ่านสปิลเวย์ไหลเข้าท่วมหลายหมู่บ้านระดับความสูง 20-30 ซม.ผู้นำหมู่บ้านเร่งสำรวจรายงานต่ออำเภอแล้ว,https://www.thairath.co.th/news/local/central/2222457,2021_10_19
เยอร์เกน คลอปป์ : ผมเคารพ &quot;ซิเมโอเน&quot; แต่ไม่ชอบสไตล์ทำทีมของเขา,"""เยอร์เกน คลอปป์"" นายใหญ่เลือดเบียร์ของ ""ลิเวอร์พูล"" ออกมาบอกว่าตัวเขาให้ความเคารพ ""ดิเอโก ซิเมโอเน"" แต่ไม่ชอบสไตล์การทำทีมของเทรนเนอร์รายนี้",https://www.thairath.co.th/sport/eurofootball/uefa/2222592,2021_10_19
"“บิ๊กป้อม” ยันทหารมีความสำคัญดูแลใต้ ปัด สทนช. ใช้งบ 2,000 ล้านวิจัยน้ำ","“บิ๊กป้อม” บอก ภูมิใจไทยตอบแล้วปมคำสั่งนายกฯ ตั้ง ศบค.ส่วนหน้า ยัน ทหารมีความสำคัญดูแลชายแดนใต้ ปัดใช้งบ 2,000 ล้านวิจัยเรื่องน้ำ ลั่น พร้อมให้ตรวจสอบ",https://www.thairath.co.th/news/politic/2222687,2021_10_19
Apple ประกาศวางจำหน่ายสินค้านวัตกรรมใหม่ “ผ้าเช็ดหน้าจอ” ในราคาเฉียด 700 บาท,นอกเหนือจากการประกาศวางจำหน่าย MacBook Pro 14 และ MacBook Pro 16 ไปจนถึง AirPods 3 แล้ว ในช่วงค่ำคืนที่ผ่านมา แอปเปิลมีการวางจำหน่ายสินค้าชนิดใหม่เป็นผ้าเช็ดหน้าจอ หรือ Polishing Cloth,https://www.thairath.co.th/news/tech/gadget/2222675,2021_10_19
ปราม “ศุภชัย” ปมวิจารณ์คำสั่งนายกฯ ยังอุบรับ “พรพิมล” เข้าภูมิใจไทย,“อนุทิน” ปราม “ศุภชัย” ปมวิจารณ์คำสั่งนายกฯ ตั้ง “พล.อ.ณัฐพล” เป็นผู้อำนวยการ ศบค.ส่วนหน้า เป็นการใช้การทหารนำสาธารณสุข ยัน ชี้แจงทำความเข้าใจแล้ว อุบรับ “พรพิมล” เข้าภูมิใจไทย บอกยังมีเวลา,https://www.thairath.co.th/news/politic/2222680,2021_10_19
คาดไทยเข้าสู่ฤดูหนาว ปลายตุลาคมนี้ อ.ธรณ์ วิเคราะห์ อาจหนาวเป็นวูบๆ,กรมอุตุนิยมวิทยา คาดการณ์ไทยเข้าสู่ฤดูหนาว ช่วงปลายเดือนตุลาคมนี้ ด้าน อ.ธรณ์ วิเคราะห์ อาจหนาวเป็นวูบๆ ผลพวงลานีญา,https://www.thairath.co.th/news/society/2222671,2021_10_19
ชาวบ้านหนองขุ่นใหญ่ เชื่อ จยย.เกี่ยวคว่ำตาย 2 เจ็บ 2 เป็นตัวตายตัวแทน,กรณีเยาวชนชายขี่รถจักรยานยนต์เกี่ยวกันล้ม บนถนนระหว่าง บ.นาสีใส-บ.หนองขุ่นใหญ่ จนมีผู้เสียชีวิต 2 ศพ เจ็บ 2 ราย เชื่อเป็นเรื่องตัวตายตัวแทน เผยจุดนี้เกิดเหตุบ่อยมาก สังเวยมาแล้วหลายศพ,https://www.thairath.co.th/news/local/northeast/2222627,2021_10_19
กล้องโทรทรรศน์อวกาศฮับเบิลพบปฏิสัมพันธ์ อันวิกฤติของกาแล็กซี,ส่งการบ้านกลับมาอีกครั้งสำหรับกล้องโทรทรรศน์อวกาศฮับเบิลขององค์การบริหารการบินและอวกาศแห่งชาติสหรัฐอเมริกา หรือองค์การนาซา และองค์การอวกาศยุโรป หรืออีเอสเอแสดงภาพของดาราจักรหรือกาแล็กซี,https://www.thairath.co.th/lifestyle/life/2222297,2021_10_19
เมียถอดแหวนแต่งงาน &quot;อิคาร์ดี&quot; ยังขาดซ้อม ส่อวืด &quot;เปแอสเช&quot; บู๊ &quot;ไลป์ซิก&quot; ชปล.,ปัญหาครอบครัวยังไม่เคลียร์ ล่าสุดภรรยาทิ้งปริศนาบนโซเชียล ทำเอา เปแอสเช ลุ้นสุดตัวว่าจะมี เมาโร อิคาร์ดี ลงบู๊ ไลป์ซิก หรือไม่,https://www.thairath.co.th/sport/eurofootball/uefa/2222636,2021_10_19
เมืองโคราชเตรียมรับมือ น้ำจากสูงเนิน-ขามทะเลสอ เข้าเขตเมือง 20 ต.ค.,ผู้ว่าฯ โคราช-นายกเล็กนครฯ ประชุมด่วน เตรียมรับมือมวลน้ำจาก อ.สูงเนิน อ.ขามทะเลสอ เข้าเขตเมือง 20 ต.ค.นี้ วางแผนป้องกัน 3 รพ.ที่ติดลำตะคอง ย้ำ ปชช.ตลอดลำน้ำลำตะคอง เตรียมรับน้ำท่วมด้วย,https://www.thairath.co.th/news/local/northeast/2222660,2021_10_19
เตือน 11 จังหวัด รวมกรุงเทพฯ ระวังน้ำขึ้นสูง 20-30 ต.ค.นี้ เสี่ยงท่วม,ปภ. ประสาน 11 จังหวัด รวมทั้ง กทม. เฝ้าระวังสถานการณ์น้ำลุ่มน้ำเจ้าพระยาและแม่น้ำท่าจีนเพิ่มสูงขึ้น ช่วงวันที่ 20-30 ต.ค.นี้ เตือนจุดเสี่ยงระวังน้ำท่วม,https://www.thairath.co.th/news/local/2222645,2021_10_19
น้อง พรสุดา เปิดใจหย่าอดีตสามีนักการทูตชาวบรูไน,น้อง พรสุดา นักแสดงยุค 90 เปิดใจหลังเลิกรากับอดีตสามีนักการทูตชาวบรูไน หลังซุ่มเงียบหย่ามานาน 5 ปี เผยเส้นทางในวงการบันเทิงถ้าไม่มีฝีมืออยู่ไม่ได้,https://www.thairath.co.th/entertain/news/2222617,2021_10_19
อนุทิน คาดปี 64 อาจฉีดวัคซีนโควิดถึง 80% ห่วงเปิดผับบาร์ ต้องเข้มมาตรการ,“อนุทิน” คาดปี 64 ฉีดวัคซีนโควิดทะลุเป้า 70% แน่ โวอาจได้ถึง 80% เดินหน้าฉีดเข็ม 3 สร้างภูมิคุ้มกัน รับ เป็นห่วงเปิดผับบาร์ ต้องเข้มมาตรการ ขอประชาชนให้ความร่วมมือ,https://www.thairath.co.th/news/politic/2222646,2021_10_19
จุ้มจิ้ม วรนันท์ คลอดลูกแฝดแล้ว ภัทร จึงกานต์กุล เผยโฉมทายาทหมื่นล้าน,จุ้มจิ้ม วรนันท์ คลอดลูกแฝดแล้วเมื่อ 18 ต.ค. 2564 โดยตั้งชื่อลูกว่า น้องโซลาร์ และ น้องลูนาร์ ด้านสามี ภัทร จึงกานต์กุล เผยโฉมทายาทหมื่นล้าน ท่ามกลางคอมเมนต์ยินดีจากแฟนๆ และคนในวงการบันเทิง,https://www.thairath.co.th/entertain/news/2222610,2021_10_19
เงินหายจากบัญชี เกิดจากมิจฉาชีพสุ่มยิงบอท รูดซื้อสินค้า บริการต่างประเทศ,"พบสาเหตุเงินหายจากบัญชี เกิดจากมิจฉาชีพสุ่มยิงบอท ซื้อสินค้า และบริการจากต่างประเทศ พบความเสียหายกว่า 17,000 บัตร 50% เป็นบัตรเดบิตมูลค่า 30 ล้าน บัตรเครดิตมูลค่า 100 ล้าน",https://www.thairath.co.th/business/finance/2222586,2021_10_19
จับร้าน &quot;ทาปาส&quot; แอบขายสุรา นักเที่ยวโดน 93 ราย ฝ่าฝืน พ.ร.ก.ฉุกเฉิน-มั่วสุม,ตำรวจ สน.ปทุมวัน บุกจับร้านทาปาส ในโซน Groove ของเซ็นทรัลเวิลด์ หลังมีการลักลอบขายสุรา พร้อมดำเนินคดีผู้ใช้บริการ 93 คน ฝ่าฝืน พ.ร.ก.ฉุกเฉิน และมั่วสุมเสี่ยงโควิดระบาด รวมกลุ่มเกิน 50 คน,https://www.thairath.co.th/news/crime/2222626,2021_10_19
“จอย ศิริลักษณ์” รับ “บ่วงใบบุญ” คือบทที่รอคอยมานานในชีวิตของการเป็นนักแสดง,ล่าสุดกลับมารับบทสุดท้าทายครั้งสำคัญในชีวิตการแสดงอย่าง ละคร “บ่วงใบบุญ” ทางช่อง 8 ในบท “ใบศรี” สาวใบ้ ชีวิตสุดรันทด จนเจ้าตัวขอยกเป็นบทเอกชั้นครู นี่แหละคือบทที่รอมานาน,https://www.thairath.co.th/novel/news/2222172,2021_10_19
&quot;วิเอรา&quot; โอดครวญ &quot;พาเลซ&quot; โดน &quot;อาร์เซนอล&quot; ไล่ตีเจ๊าทดเจ็บนาทีสุดท้าย,"""ปาทริก วิเอรา"" กุนซือ ""คริสตัล พาเลซ"" ออกมาเปิดเผยว่า ตัวเขาสุดผิดหวังที่ทีมโดน ""อาร์เซนอล"" ไล่ตามตีเสมอช่วงท้ายทดเวลาบาดเจ็บนาทีสุดท้าย",https://www.thairath.co.th/sport/eurofootball/premierleague/2222591,2021_10_19
ประธานคณะกรรมการอำนวยการ รพ.สนามท่าเรือคลองเตย นำคณะเข้าพบ พล.อ.ประวิตร,วันที่ 18 ตุลาคม 2564 ที่มูลนิธิอนุรักษ์ป่ารอยต่อ 5 จังหวัด ถนนพหลโยธิน กทม. ดร.หิมาลัย ผิวพรรณ ประธานคณะกรรมการอำนวยการ โรงพยาบาลสนามท่าเรือคลองเตย พร้อมด้วย พลตรีปธาน ทองขุนนา,https://www.thairath.co.th/news/local/2222601,2021_10_19
เสรีพิศุทธ์ แนะติดตาม พรุ่งนี้ศาลนัดอ่านคำวินิจฉัยสมาชิกภาพ ส.ส.ไพบูลย์,“เสรีพิศุทธ์” ฝากประชาชนติดตาม พรุ่งนี้ศาลรัฐธรรมนูญนัดอ่านคำวินิจฉัย “ไพบูลย์ นิติตะวัน” จะขาดสมาชิกภาพ ส.ส. หรือไม่ ปมเลิกพรรคประชาชนปฏิรูป ก่อนย้ายร่วมพลังประชารัฐ,https://www.thairath.co.th/news/politic/2222615,2021_10_19
&quot;โค้ชโย่ง&quot; เผยเหตุเลือก &quot;ธนวัฒน์&quot; ทำหน้าที่กัปตันยู-23 ลุยมองโกเลีย,"""โค้ชโย่ง"" เผยสาเหตุที่ตัดสินใจเลือก ""กัน"" ธนวัตน์ ทำหน้าที่กัปตันทีมช้างศึกชุดยู-23 ในการแข่งขันชิงแชมป์เอเชียรอบคัดเลือก ด้านเจ้าตัวสุดภูมิใจได้สวมปลอกแขนทีมชาติ",https://www.thairath.co.th/sport/thaifootball/changsuek/2222465,2021_10_19
เทศบาลเมืองฯ ประกาศเตือนชาวบ้านเตรียมรับน้ำท่วม 2 ฝั่งแม่น้ำปราจีนบุรี,มวลน้ำจากพื้นที่ อ.กบินทร์บุรี ไปถึง อ.ศรีมหาโพธิ และ อ.เมืองปราจีนบุรี ส่งผลให้น้ำเอ่อล้นตลิ่งทั้งสองฝั่งแม่น้ำปราจีนบุรี เทศบาลเมืองปราจีนฯ เตือนชาวบ้านริมน้ำทั้ง 2 ฝั่งเตรียมรับมือน้ำท่วม,https://www.thairath.co.th/news/local/east/2222596,2021_10_19
กู้ภัยร้อยเอ็ดช่วยเก็บกู้แพอาหารลอยไปกับน้ำ ติดคาตอม่อสะพานที่จังหาร,ทีมกู้ภัยร้อยเอ็ด เข้าช่วยเก็บกู้แพอาหารที่ติดคาตอม่อสะพานข้ามแม่น้ำชี บนถนนสายกมลาไสย-จังหาร ที่บ้านแซงแหลม อ.จังหาร หลังลอยไปกับกระแสน้ำที่ไหลเชี่ยว ใช้ 10 คนลากกลับฝั่งได้ในเวลา 3 ชั่วโมง,https://www.thairath.co.th/news/local/northeast/2222577,2021_10_19
ถ่านหินเลนจากหนองบึงของยุโรปตอนเหนือ ใช้ผลิตแบตเตอรี่,ถ่านหินเลน (Peat) เกิดจากซากต้นไม้ในหนองน้ำทับถมกัน ถ่านหินชนิดนี้มีสีน้ำตาลเข้มประกอบด้วยคาร์บอนประมาณ 60% ทว่าถึงจะเป็นถ่านหินชนิดที่มีคุณภาพต่ำสุด,https://www.thairath.co.th/lifestyle/life/2222296,2021_10_19
โรโบคอป ตำรวจเหล็ก! สัมผัสแรก ทดสอบ HYUNDAI STARIA SEL,"ทดสอบ HYUNDAI STARIA SEL รถตู้ MPV ประกอบเกาหลี เครื่องยนต์ดีเซล 2.2 ลิตร 177 แรงม้า 431 นิวตันเมตร เกียร์ออโต้ 8 สปีด ราคา 1,999,000 บาท",https://www.thairath.co.th/news/auto/testdrive/2219640,2021_10_19
&quot;อาร์เตตา&quot; สุดเซ็งได้แค่แต้มเดียวจาก &quot;พาเลซ&quot; แจงเหตุถอด &quot;ซากา&quot; ช่วงพักครึ่ง,"""มิเกล อาร์เตตา"" กุนซือชาวเลือดกระทิงดุของ ""อาร์เซนอล"" ตกเป็นข่าว ไม่พอใจที่ทีมได้แค่แต้มเดียวในเกมลีกนัดล่าสุดที่เปิดบ้านเสมอ ""คริสตัล พาเลซ"" 2-2",https://www.thairath.co.th/sport/eurofootball/premierleague/2222522,2021_10_19
“เดียร์น่า” โดนจัดหนัก “เต๋อ-ปาริธ” เซอร์ไพรส์เปิดฉาก “Help Me คุณผีช่วยด้วย”,เปิดตัวมาแบบตรงปกเป๊ะสำหรับละครเรื่อง “Help Me คุณผีช่วยด้วย” ค่ายทีวีซีน ที่ใช้สโลแกน “ละครหรรษาเดี๋ยวฮาเดี๋ยวโฮ” ที่ต้องบอกว่าถ้าไม่ครบตรงไหนเอาปากกามาวง แค่ฉากเปิดตัวก็ได้ทั้งเสียงหัวเราะ,https://www.thairath.co.th/novel/news/2222106,2021_10_19
ราคาทองวันนี้ 19 ต.ค. 64 ล่าสุดเปิดตลาดวันอังคาร ปรับขึ้น 50 บาท,"""ราคาทองวันนี้"" เปิดตลาดเช้าวันอังคาร ปรับขึ้น 50 บาท โดยราคา ""ทองคำแท่ง"" ขายออกบาทละ 28,000 ราคา ""ทองรูปพรรณ"" ขายออกบาทละ 28,500 บาท",https://www.thairath.co.th/business/investment/gold/2222582,2021_10_19
สะเทือนเมืองจันท์ ตร.จับนายก อบจ.-พระครูปลัดฯ ทุจริตเงินสนับสนุนพุทธมณฑล,สะเทือนทั้งจังหวัดจันทบุรี ตำรวจสอบสวนกลางเปิดยุทธการ “จันทบูร” ลุยค้น 9 จุด บุกจับนายก อบจ.จันทบุรี พร้อมพวก และนิมนต์พระครูปลัดฯ รับทราบข้อกล่าวหาคดีทุจริตเงินสนับสนุนพุทธมณฑล,https://www.thairath.co.th/news/crime/2222555,2021_10_19
