title,summary,link,published
กทม. เตือนชุมชนนอกคันกั้นแม่น้ำเจ้าพระยา 23-30 ต.ค. เฝ้าระวังระดับน้ำสูงขึ้น,"กทม. แจ้งเตือนชุมชนนอกคันกั้นน้ำ ""แม่น้ำเจ้าพระยา"" วันที่ 23-30 ต.ค.นี้ ระดับน้ำสูงขึ้น 20-40 ซม. ขอติดตามสถานการณ์อย่างใกล้ชิด",https://www.thairath.co.th/news/local/bangkok/2222821,2021_10_19
เหยื่อโดนดูดเงิน แจ้งความในพื้นที่ บช.น. แล้ว 13 คดี คาดวันนี้มีเพิ่มอีก,"รอง ผบช.น. เผยกรณีประชาชนถูกหักเงินในบัญชี ในส่วนของ บช.น. มีผู้เสียหายมาแจ้งความแล้ว 13 คดี ยอดมูลค่าความเสียหายรวมประมาณ 116,903 บาท",https://www.thairath.co.th/news/crime/2222806,2021_10_19
คาเฟ่ดังย่านศาลายาแจงยิบ หลังมีดราม่า ค่าอาหารไม่ตรงเมนู,คาเฟ่ดังย่านศาลายาแจงยิบ หลังมีดราม่า ค่าอาหารไม่ตรงเมนู ชี้ มีการบวก vat 7% และเซอร์วิสชาร์จ 10% ซึ่งถูกต้องตามกฎหมาย ยืนยันว่าไม่ได้บวกซ้อน หรือทุจริตต่อผู้บริโภค,https://www.thairath.co.th/news/society/2222811,2021_10_19
นายกฯ ห่วงประชาชนถูกหักเงินทางออนไลน์ สั่งหน่วยงานที่เกี่ยวข้องแก้ไขด่วน,โฆษกรัฐบาลเผย นายกฯ เป็นห่วง เตือนประชาชน ระวังภัยฉ้อโกงออนไลน์ สั่ง แบงก์ชาติ-ดีอีเอส-ตช. แก้ปัญหาด่วน ขณะที่ดีอีเอสเตรียมยกร่าง พ.ร.ฎ.ว่าด้วยการควบคุมดูแลธุรกิจบริการแพลตฟอร์มดิจิทัล,https://www.thairath.co.th/news/politic/2222800,2021_10_19
SHELL เปิดปั๊มใหม่สุดไฮเทคย่านกาญจนาภิเษก เอาใจคนชอบความครบ,Shell เปิดตัวสถานีบริการน้ำมันและสเตชั่นชาร์จรถไฟฟ้าโมเดลใหม่แห่งแรกในไทย คอนเซปต์ “Site of the Future” บนถนนกาญจนาภิเษก เอาใจลูกค้าแบบครบวงจร,https://www.thairath.co.th/news/auto/news/2222251,2021_10_19
นิวซีแลนด์ติดเชื้อพุ่งสูงสุด ทุบสถิติตั้งแต่เริ่มการระบาด,ยอดติดเชื้อโควิด-19 ในนิวซีแลนด์ พุ่งทำสถิติสูงสุดนับตั้งแต่เริ่มพบการระบาด โดยพื้นที่ระบาดหนักอยู่ในเมืองโอ๊คแลนด์,https://www.thairath.co.th/news/foreign/2222785,2021_10_19
กทม. ฉีดวัคซีนเข็ม 2 แล้วกว่า 70% เตรียมพร้อมเปิดเมืองรับนักท่องเที่ยว,โฆษกกรุงเทพมหานคร เผย คนในกรุงเทพฯ ฉีดวัคซีนเข็ม 2 แล้วกว่า 70% เพื่อป้องกันความรุนแรงจากโควิด และเตรียมพร้อมเปิดเมืองรับนักท่องเที่ยว,https://www.thairath.co.th/news/local/bangkok/2222782,2021_10_19
เปิดกำหนดการ “บิ๊กตู่” ติดตามสถานการณ์น้ำท่วมที่สิงห์บุรี วันพรุ่งนี้,เปิดกำหนดการ “พล.อ.ประยุทธ์” ลงพื้นที่สิงห์บุรี ติดตามสถานการณ์น้ำ-มอบถุงยังชีพประชาชน ก่อนกดปุ่มปล่อยโดรนนำจ่ายกล่องยาไปบ้านผู้ประสบอุทกภัย,https://www.thairath.co.th/news/politic/2222792,2021_10_19
ดีเจสเนก ปล่อยคลิป SXY GIRL เบื้องหลังสุดเซ็กซี่ ลิซ่า แบล็กพิงก์,ปล่อยคลิปเบื้องหลังสั้นๆ ออกมาอีกแล้ว กระตุ้นๆ ให้อยากฟัง! รอเต้นตามได้เลย ดีเจสุดฮอตระดับโลก,https://www.thairath.co.th/entertain/inter/2222715,2021_10_19
Kick It Out ถกแฟนนิวคาสเซิล งดโพกหัวสื่อถึงกลุ่มทุนซาอุฯ ชี้อาจนำไปสู่ปัญหา,องค์กรต่อต้านเหยียดผิวและเชื้อชาติ ขอร้องให้แฟนบอลนิวคาสเซิลงดแต่งกายเฉลิมฉลองการเข้ามาของกลุ่มทุนซาอุฯ เพื่อตัดปัญหาที่อาจตามมา,https://www.thairath.co.th/sport/eurofootball/premierleague/2222757,2021_10_19
ตำรวจเร่งหารือสถาบันการเงิน หลังเงินในบัญชีประชาชนถูกดูดหาย,รอง ผบ.ตร.ประชุมหารือแบงก์ชาติ กสทช. ปปง. วางแนวทางแก้ปัญหากรณีมีการลักลอบหักเงินจากบัญชีธนาคาร บัตรเครดิต หรือบัญชีเดบิต ของประชาชนจำนวนมาก เบื้องต้นมีผู้เสียหายหลักหมื่นคนทยอยเข้าแจ้งความ,https://www.thairath.co.th/news/crime/2222787,2021_10_19
&quot;ดัง วาน ลัม&quot; ไร้ความผิดหนี &quot;เมืองทอง&quot; ซบทีมเจลีก กิเลนยื่นอุทธรณ์อีกรอบ,สหพันธ์ฟุตบอลนานาชาติ หรือ ฟีฟ่า ยืนยันว่า ดัง วาน ลัม ไร้ความผิดฐานยกเลิกสัญญากับ เมืองทองฯ ซบทีมใน เจลีก ซึ่งทางทัพกิเลนยื่นอุทธรณ์ทันที,https://www.thairath.co.th/sport/thaifootball/2222765,2021_10_19
“บิ๊กตู่” แนะ เชิญศิลปินไทยร่วมเทศกาลปีใหม่ กระตุ้นท่องเที่ยวและเศรษฐกิจ,นายกฯ ขอภาครัฐจับมือเอกชนเดินหน้าเปิดรับนักท่องเที่ยว 1 พ.ย.นี้ แนะเชิญศิลปินไทย ร่วมจัดกิจกรรมคอนเสิร์ตช่วงปีใหม่ กระตุ้นท่องเที่ยวและเศรษฐกิจในประเทศ เตรียมฟื้นจัด ครม.สัญจรเดือนหน้า,https://www.thairath.co.th/news/politic/2222776,2021_10_19
บช.น.เผยชุมนุม 6 กลุ่ม เผยอาการ คฝ.ถูกยิงดีขึ้น ใกล้ออกหมายจับผู้ก่อเหตุ,บช.น.สรุปการชุมนุมวันนี้ 6 จุด ทั้งผู้ค้าสลากฯ แรงงาน กลุ่มรถบรรทุก นอกเหนือจากผู้ชุมนุมการเมืองและป่วนแยกดินแดง พร้อมเผยอาการ ส.ต.ต.เดชวิทย์ คฝ.ที่ถูกยิงดีขึ้นแล้ว ใกล้ออกหมายจับผู้ก่อเหตุ,https://www.thairath.co.th/news/crime/2222745,2021_10_19
สมศักดิ์ ย้ำยังไม่ถึงเวลาการเมือง เหน็บคนชอบพูดความขัดแย้ง ไม่ต้องใช้สมอง,“สมศักดิ์” ลั่น ยังไม่ถึงเวลาการเมือง ลุยทำงานเพื่อประโยชน์สังคมก่อน เหน็บคนพูดความขัดแย้งเพราะไม่ต้องใช้สมอง,https://www.thairath.co.th/news/politic/2222770,2021_10_19
สหรัฐฯ ได้ฤกษ์เปิดประเทศ วัคซีนเป็นตัวช่วยไม่ให้โควิดระบาดหนักซ้ำ,สหรัฐอเมริกาได้ฤกษ์เปิดประเทศในเดือน พ.ย. 64 หลังโควิดทำพิษปิดพรมแดนมายาวนานกว่าหนึ่งปี นายแพทย์เฟาซี ชี้ วัคซีนสามารถช่วยระงับการเกิดการแพร่ระบาดระลอกใหม่ได้,https://www.thairath.co.th/news/foreign/2222451,2021_10_19
ผู้นำหญิงฮ่องกงล้มข้อศอกแตกในบ้านพักเข้า รพ.,นางแคร์รี ลัม ผู้บริหารสูงสุดของเกาะฮ่องกงลื่นล้มในบ้านพัก เข้ารักษาตัวที่โรงพยาบาลอาการไม่รุนแรง ยกเลิกภารกิจทั้งหมดแล้ว,https://www.thairath.co.th/news/foreign/2222736,2021_10_19
ตร.แจงจับร้านอาหารลอบขายสุรา เตือนแล้วไม่ฟังต้องจับ ยื่นฟ้องนักเที่ยววันนี้,รอง ผบช.น. เผยกรณี ตร.ปทุมวันจับกุมร้านอาหารลอบขายสุรา เคยตักเตือนไปแล้วแต่ไม่ฟังเลยเข้าจับ ส่วนนักเที่ยว 93 คน ตำรวจจะยื่นฟ้องศาลแขวงใต้ในวันนี้ ย้ำยังไม่อนุญาตให้จำหน่ายสุรา-เปิดสถานบริการ,https://www.thairath.co.th/news/crime/2222732,2021_10_19
ตำรวจเตือนระวังเป็นเหยื่อฟิชชิ่ง ลวงกดลิงก์หลอกเอาข้อมูล-รหัสส่วนตัว,โฆษก ตร.เตือนประชาชนระวังตกเป็นเหยื่อโจรไซเบอร์ใช้วิธีฟิชชิ่ง หลอกกดลิงก์เว็บปลอม ลวงเอาข้อมูลส่วนตัวพาสเวิร์ด เพื่อแฮกบัญชีธนาคาร บัตรเครดิต และโซเชียล ย้ำอย่ากู้เงินผ่านแอปฯที่ไม่ใช่ธนาคาร,https://www.thairath.co.th/news/crime/2222721,2021_10_19
คนละครึ่งเฟส 4 อยู่ในแผนกระตุ้นเศรษฐกิจไตรมาส 4 เผย ยังไม่คิดกู้เพิ่ม,“สุพัฒนพงษ์” เผย โครงการคนละครึ่งเฟส 4 อยู่ในแผนกระตุ้นเศรษฐกิจไตรมาสสุดท้าย เผย ยังไม่มีแนวคิดกู้เพิ่มเร็วๆ นี้ ชี้เงินยังเหลือ มองแนวโน้มเศรษฐกิจดีขึ้น,https://www.thairath.co.th/business/economics/2222750,2021_10_19
คุมเพลิงได้แล้ว ไฟไหม้โรงงานรองเท้าย่านกิ่งแก้ว คาดเสียหายกว่าร้อยล้าน,เจ้าหน้าที่สามารถควบคุมเพลิงที่ลุกไหม้ในโรงงานผลิตรองเท้าย่านถนนกิ่งแก้วได้แล้ว เหลือเพียงกลุ่มควัน ขณะที่คาดว่า ความเสียหายน่าจะไม่ต่ำกว่า 100 ล้านบาท,https://www.thairath.co.th/news/local/central/2223212,2021_10_19
18 สโมสรพรีเมียร์ลีก โหวตขวาง “นิวคาสเซิล” เซ็นสปอนเซอร์เอี่ยวเจ้าของทีม,มีรายงานว่า 18 สโมสรของ พรีเมียร์ลีก อังกฤษ โหวตขวาง นิวคาสเซิล ยูไนเต็ด เซ็นสัญญาทางการค้ากับบริษัทที่เกี่ยวข้องกับเจ้าของทีมเป็นการชั่วคราว,https://www.thairath.co.th/sport/eurofootball/premierleague/2223210,2021_10_19
&quot;ไตรศุลี&quot; ย้ำ มติ ครม.วันหยุดยาว 21-22 ต.ค. ของภาคกลาง-วันชดเชยปิยมหาราช,รองโฆษกรัฐบาล ย้ำ วันหยุดปลายเดือนตุลาคม วันที่ 21 เป็นวันหยุดของภาคกลาง เนื่องในวันออกพรรษา ส่วนวันที่ 22 ถูกเลื่อนมาเป็นวันหยุดชดเชยปิยมหาราช เพื่อให้สัปดาห์นี้มีวันหยุดยาว,https://www.thairath.co.th/news/politic/2223205,2021_10_19
&quot;โอเวน&quot; ทำนายผล ยูฟ่า แชมเปียนส์ลีก 4 สโมสรอังกฤษ วืดชัย 1 ทีม,ไมเคิล โอเวน อดีตดาวยิงชื่อดังออกมาทำนายผล ยูฟ่า แชมเปียนส์ลีก ของ 4 สโมสรอังกฤษในสัปดาห์นี้ มี 1 ทีมไม่ชนะ,https://www.thairath.co.th/sport/eurofootball/uefa/2223135,2021_10_19
กมธ.ดีอีเอส จ่อถกอุดช่องโหว่ แก้โกงแอปดูดเงิน ป้อง ปชช.ถูกเอาเปรียบ,"""กัลยา"" เผย กมธ.ดีอีเอส เตรียมเชิญ ""ส.ธนาคารฯ-ธปท."" แจ้งกรณีประชาชนโดนแอปฯ ดูดเงิน ชี้ต้องอุดช่องโหว่ให้ได้ ""เศรษฐพงค์"" แนะรวบหน่วยงานแก้โกงดูดเงินบัตรเครดิต ระบุลดทอนความเดือดร้อน ปชช.",https://www.thairath.co.th/news/politic/2223200,2021_10_19
หมายจับ ผช.ผญบ.มือยิงหนุ่มตายคาศาลาวัด ตร.ค้นบ้านผู้ต้องหา ยังไม่พบตัว,ศาลจังหวัดทุ่งสงออกหมายจับ นายพรชัย ทองศรี ผช.ผญบ.ปืนดุยิงลูกบ้านดับคาศาลาวัดวังรีบุญเลิศ ที่ อ.ถ้ำพรรณรา ก่อนนำหมายค้นบุกบ้านหาพยานหลักฐานเพิ่มแต่ไม่พบตัว เผย ทั้งคู่เคยมีประวัติอาชญากรรม,https://www.thairath.co.th/news/crime/2223141,2021_10_19
แฮชแท็ก ไฟไหม้กิ่งแก้ว คนหวั่นซ้ำรอยหมิงตี้ ภาวนาขอให้คุมเพลิงได้โดยเร็ว,แฮชแท็ก #ไฟไหม้กิ่งแก้ว ติดเทรนด์ทวิตเตอร์ คนแจ้งข่าว หวั่นซ้ำรอยหมิงตี้ ภาวนาขอให้คุมเพลิงได้โดยเร็ว ล่าสุดมีรายงาน คุมเพลิงได้ในวงจำกัดแล้ว,https://www.thairath.co.th/news/society/2223195,2021_10_19
ด่วน ไฟไหม้โรงงานผลิตรองเท้าย่านกิ่งแก้ว ยังคุมเพลิงไม่ได้ อาคารทรุดตัว,เกิดเหตุเพลิงไหม้โรงงานวัฒนาฟุตแวร์ ซ.กิ่งแก้ว 9/1 ต.ราชาเทวะ อ.บางพลี จังหวัดสมุทรปราการ ล่าสุดอาคารเริ่มมีการทรุดตัว,https://www.thairath.co.th/news/local/central/2223190,2021_10_19
ตำรวจ ชี้แจงข้อสรุป แนวทางแก้ไขปัญหา หลังเงินในบัญชีประชาชน ถูกดูดหาย,รองโฆษก ตร.ชี้แจงข้อสรุปการดำเนินการของผู้ที่ได้รับความเสียหายจากกรณีถูกหักเงินออกจากบัญชีของธนาคารหลายครั้ง โดยไม่ทราบสาเหตุ มูลค่าความเสียหายรวมกว่า 100 ล้านบาท,https://www.thairath.co.th/news/crime/2223185,2021_10_19
ดีกรีไม่ธรรมดา &quot;โรนัลโด&quot; เสนอชื่อกุนซือใหม่ให้ &quot;แมนยูฯ&quot; พิจารณาแล้ว,คริสเตียโน โรนัลโด ดาวยิงของแมนเชสเตอร์ ยูไนเต็ด ตกเป็นข่าว เสนอชื่อกุนซือคนใหม่ของปิศาจแดงให้ต้นสังกัดพิจารณาแล้ว,https://www.thairath.co.th/sport/eurofootball/premierleague/2223130,2021_10_19
เกิดเสียงดัง 3 ครั้งใต้ทางด่วน ขณะที่ จนท.ยังเน้นลาดตระเวนดูผู้ชุมนุม,ที่แยกสามเหลี่ยมดินแดง เกิดเสียงดัง 3 ครั้ง ที่ใต้ทางด่วนแต่ไม่พบมวลชน ส่วนเจ้าหน้าที่ยังตรึงกำลังแฟลตดินแดง เน้นลาดตระเวนดูผู้ชุมนุม เหตุการณ์โดยรวมยังถือว่าสงบ,https://www.thairath.co.th/news/politic/2223182,2021_10_19
&quot;อนุทิน&quot; เปิด รพ.สนาม &quot;เลิดสิน&quot; 200 เตียง รองรับผู้ป่วย กทม. ชี้แค่เตรียมพร้อม,"รองนายกฯ อนุทิน เปิด รพ.สนาม ""เลิดสิน"" 200 เตียง รับผู้ป่วยโควิดฯ เมืองหลวง ย้ำ แนวโน้ม กทม.สถานการณ์ดีขึ้น แต่ต้องไม่ประมาท ชี้เปิด รพ.สนามเพิ่ม ไม่ได้หมายความว่าสถานการณ์แย่ แค่เตรียมพร้อม",https://www.thairath.co.th/news/local/bangkok/2223140,2021_10_19
โคราชน้ำทะลักท่วมมิตรภาพซอย 4 หนักสุดในรอบ 11 ปี &quot;ถนนกลายเป็นคลอง&quot;,สถานการณ์น้ำท่วมที่ชุมชนมิตรภาพซอย 4 เขตเทศบาลนครนครราชสีมา ยังน่าเป็นห่วง คาดหากมีฝนตกลงมาในช่วงนี้ อาจจะสร้างความเดือดร้อนหนักเหมือนกับปี 53,https://www.thairath.co.th/news/local/northeast/2223142,2021_10_19
พช. หนุนหลักปรัชญาเศรษฐกิจพอเพียง เดินหน้าขจัดความยากจน,อธิบดีกรมการพัฒนาชุมชน เดินหน้าขับเคลื่อนการขจัดความยากจนและพัฒนาคนทุกช่วงวัยอย่างยั่งยืน ตามหลักปรัชญาของเศรษฐกิจพอเพียง,https://www.thairath.co.th/news/local/2223127,2021_10_19
บอร์ด นิวคาสเซิล คัด 3 ชื่อสุดท้ายตัวเต็งกุนซือคุมต่อจาก &quot;สตีฟ บรูซ&quot;,บอร์ดบริหารใหม่ของ นิวคาสเซิล คัดเลือก 3 รายชื่อสุดท้ายที่จะมาเป็นแคนดิเดตในการเป็นกุนซือคนต่อไปของทีมต่อจาก สตีฟ บรูซ ที่ใกล้จะถูกไล่ออก,https://www.thairath.co.th/sport/eurofootball/premierleague/2223111,2021_10_19
ครม. เห็นชอบร่างไทย-จีน ดันอุตสาหกรรมภาพยนตร์เป็น Soft power,ครม.เห็นชอบไทย-จีน จับมือผลักดันอุตสาหกรรมภาพยนตร์ทั้งระบบ ใช้เป็น Soft power ส่งเสริมการค้า การลงทุน ท่องเที่ยว หนุนอุตสาหกรรมภาพยนตร์-ดิจิทัลโตหลายเท่าตัว,https://www.thairath.co.th/news/politic/2223092,2021_10_19
ดวงจันทร์โผล่ ที่บึงสามพัน เพชรบูรณ์ ชาวบ้านผวา กลัวอุบัติเหตุ (คลิป),หมอแล็บแพนด้า โพสต์คลิปดวงจันทร์โผล่ ที่บึงสามพัน เพชรบูรณ์ ชาวบ้านผวา กลัวอุบัติเหตุ รถพุ่งชนตลาด น้ำท่วม วอนหน่วยงานเกี่ยวข้องเร่งแก้ไข,https://www.thairath.co.th/news/society/2223091,2021_10_19
ฟีฟ่า เชิญกุนซือทีมชาติหารือจัดบอลโลกทุก 2 ปีหลัง 2024 อังกฤษ ปฏิเสธเข้าร่วม,อดีตกุนซือปืนใหญ่ในฐานะเป็น ผอ.ฝ่ายพัฒนาฟุตบอลของฟีฟ่า ร่อนจดหมายเชิญเหล่ากุนซือทีมชาติมาหารือเรื่องเปลี่ยนปฏิทินเพื่อจัดบอลโลกทุกๆ 2 ปี,https://www.thairath.co.th/sport/worldcup/2223081,2021_10_19
