title,summary,link,published
อังคารนี้ 2 ทุ่ม เตรียมพบกับ ‘โทนี วู้ดซัม’ ชวนคุย 7 ปีพัง…ขออีก 5 ปีคงพินาศ,อังคารนี้ 2 ทุ่ม เตรียมพบกับ ‘โทนี วู้ดซัม’ […] The post อังคารนี้ 2 ทุ่ม เตรียมพบกับ ‘โทนี วู้ดซัม’ ชวนคุย 7 ปีพัง…ขออีก 5 ปีคงพินาศ appeared first on มติชนออนไลน์.,https://www.matichon.co.th/politics/news_2986205,11_10_2021
สั่งปิดบ้านดงน้อย หลังพบโควิดกว่า 75 ราย บางครอบครัวป่วยทั้งบ้าน หญิงชรา 102 ติดเชื้อด้วย,สั่งปิดบ้านดงน้อย หลังพบโควิดกว่า 75 ราย บางครอบครัวป่ว […] The post สั่งปิดบ้านดงน้อย หลังพบโควิดกว่า 75 ราย บางครอบครัวป่วยทั้งบ้าน หญิงชรา 102 ติดเชื้อด้วย appeared first on มติชนออนไลน์.,https://www.matichon.co.th/covid19/thai-covid19/news_2986204,11_10_2021
เล็งผุดเส้นทางใหม่ แก้ปัญหาจราจรในตัวเมืองแปดริ้ว จากกลางใจเมืองเชื่อมสุวินทวงศ์,เล็งผุดเส้นทางใหม่ แก้ปัญหาการจราจรแออัดในตัวเมืองแปดริ […] The post เล็งผุดเส้นทางใหม่ แก้ปัญหาจราจรในตัวเมืองแปดริ้ว จากกลางใจเมืองเชื่อมสุวินทวงศ์ appeared first on มติชนออนไลน์.,https://www.matichon.co.th/region/news_2986193,11_10_2021
ขึ้นเทรนอันดับ1 ทวิตเตอร์ #ประยุทธ์ หลังแถลงเปิดประเทศ 1 พ.ย.โซเชียลถล่มเดือด!,ขึ้นเทรนอันดับ1ทวิตเตอร์ #ประยุทธ์ หลังแถลงเปิดประเทศ 1 […] The post ขึ้นเทรนอันดับ1 ทวิตเตอร์ #ประยุทธ์ หลังแถลงเปิดประเทศ 1 พ.ย.โซเชียลถล่มเดือด! appeared first on มติชนออนไลน์.,https://www.matichon.co.th/politics/news_2986180,11_10_2021
โควิดทำพิษ! ปิดตลาดฉัตร์ไชยครั้งแรกในรอบ 95 ปี ติดเชื้อพุ่งกว่า 40 ราย เอกชนแนะเลื่อนเปิดเมือง,โควิดทำพิษ! สั่งปิดตลาดฉัตร์ไชยครั้งแรกในรอบ 95 ปี หลัง […] The post โควิดทำพิษ! ปิดตลาดฉัตร์ไชยครั้งแรกในรอบ 95 ปี ติดเชื้อพุ่งกว่า 40 ราย เอกชนแนะเลื่อนเปิดเมือง appeared first on มติชนออนไลน์.,https://www.matichon.co.th/covid19/thai-covid19/news_2986182,11_10_2021
‘ปืนใหญ่’ หวังยืม ‘แชมเบอร์เลน’ กลับถิ่น,‘ปืนใหญ่’ หวังยืม ‘แชมเบอร์เลน’ […] The post ‘ปืนใหญ่’ หวังยืม ‘แชมเบอร์เลน’ กลับถิ่น appeared first on มติชนออนไลน์.,https://www.matichon.co.th/sport-slide/news_2985159,11_10_2021
ผอ.รพ.กันทรลักษ์ ยันไม่มีการสวมสิทธิ์ฉีดวัคซีน ชี้เกิดจากเหตุลงเลขบัตรปชช.คลาดเคลื่อน,ผอ.รพ.กันทรลักษ์ ยันไม่มีการสวมสิทธิ์ฉีดวัคซีน ชี้เกิดจ […] The post ผอ.รพ.กันทรลักษ์ ยันไม่มีการสวมสิทธิ์ฉีดวัคซีน ชี้เกิดจากเหตุลงเลขบัตรปชช.คลาดเคลื่อน appeared first on มติชนออนไลน์.,https://www.matichon.co.th/region/news_2986172,11_10_2021
ตร.ภาชี ซุ่มจับหนุ่มหนองแค ขี่ซาเล้งขโมยเหล็กทำถนน ขายเอาเงินใช้ดื่มสุรา-เที่ยวผู้หญิง,ตร.ภาชี ซุ่มจับหนุ่มหนองแค ขี่ซาเล้งขโมยเหล็กทำถนน ขายเ […] The post ตร.ภาชี ซุ่มจับหนุ่มหนองแค ขี่ซาเล้งขโมยเหล็กทำถนน ขายเอาเงินใช้ดื่มสุรา-เที่ยวผู้หญิง appeared first on มติชนออนไลน์.,https://www.matichon.co.th/region/news_2986171,11_10_2021
โปรดเกล้าฯ แต่งตั้งนายก–กรรมการสภา ม.สงขลานครินทร์-ม.ราชภัฏนครสวรรค์ รวม 27 ราย,โปรดเกล้าฯ แต่งตั้งนายก–กรรมการสภา ม.สงขลานครินทร์-ม.รา […] The post โปรดเกล้าฯ แต่งตั้งนายก–กรรมการสภา ม.สงขลานครินทร์-ม.ราชภัฏนครสวรรค์ รวม 27 ราย appeared first on มติชนออนไลน์.,https://www.matichon.co.th/news-monitor/news_2986163,11_10_2021
ตำรวจไซเบอร์ รวบเจ้าของร้านอาหาร ใส่เครื่องแบบตำรวจ ยศ ‘พ.ต.อ.’ โพสต์ Tiktok,ตำรวจไซเบอร์ รวบหนุ่มใหญ่ วัย 43 ปี ใส่เครื่องแบบตำรวจ […] The post ตำรวจไซเบอร์ รวบเจ้าของร้านอาหาร ใส่เครื่องแบบตำรวจ ยศ ‘พ.ต.อ.’ โพสต์ Tiktok appeared first on มติชนออนไลน์.,https://www.matichon.co.th/local/crime/news_2986162,11_10_2021
สาธารณสุขเมืองพังงา รุดติดตาม น.ศ. ถูกตัดขาหลังฉีดไขว้ เตรียมบริการรับยื่นคำร้องเยียวยาถึงบ้าน,สาธารณสุขเมืองพังงา ลงพื้นที่บ้าน น.ศ. ถูกตัดขาหลังฉีดว […] The post สาธารณสุขเมืองพังงา รุดติดตาม น.ศ. ถูกตัดขาหลังฉีดไขว้ เตรียมบริการรับยื่นคำร้องเยียวยาถึงบ้าน appeared first on มติชนออนไลน์.,https://www.matichon.co.th/region/news_2986141,11_10_2021
ปิงปอง-ศิรศักดิ์  โพสต์ หาลู่ทางย้ายประเทศ ถ้าลุงและพรรคพวกยังถลุงประเทศแบบนี้,ปิงปอง-ศิรศักดิ์ โพสต์ เตรียม หาลู่ทางย้ายประเทศ ถ้าลุง […] The post ปิงปอง-ศิรศักดิ์ โพสต์ หาลู่ทางย้ายประเทศ ถ้าลุงและพรรคพวกยังถลุงประเทศแบบนี้ appeared first on มติชนออนไลน์.,https://www.matichon.co.th/news-monitor/news_2986143,11_10_2021
‘ม.ร.ว.จิราคม’ ราชสกุลเชื้อสายจีน ร่วมพิธีกรรมกินเจ ‘เยาวราช’,‘ม.ร.ว.จิราคม’ ราชสกุลเชื้อสายจีน ร่วมพิธีก […] The post ‘ม.ร.ว.จิราคม’ ราชสกุลเชื้อสายจีน ร่วมพิธีกรรมกินเจ ‘เยาวราช’ appeared first on มติชนออนไลน์.,https://www.matichon.co.th/news-monitor/news_2986142,11_10_2021
เชียร์ลีดดิ้งสาวไทยคว้าแชมป์โลก ฮิปฮอปไม่น้อยหน้าซิวทองแดง,เชียร์ลีดดิ้งสาวไทยคว้าแชมป์โลก ฮิปฮอปไม่น้อยหน้าซิวทอง […] The post เชียร์ลีดดิ้งสาวไทยคว้าแชมป์โลก ฮิปฮอปไม่น้อยหน้าซิวทองแดง appeared first on มติชนออนไลน์.,https://www.matichon.co.th/sport/news_2985409,11_10_2021
Great Harbour เปิดประสบการณ์ บุฟเฟต์นานาชาติ สไตล์ Fine dining รับนิวนอร์มอล,บริษัท ซีพี ไห่หลาย ฮาร์เบอร์ จำกัด ผู้ดำเนินธุรกิจร้าน […] The post Great Harbour เปิดประสบการณ์ บุฟเฟต์นานาชาติ สไตล์ Fine dining รับนิวนอร์มอล appeared first on มติชนออนไลน์.,https://www.matichon.co.th/publicize/news_2986134,11_10_2021
กลุ่มเส้นด้าย ร่วมเทศบาลนครหาดใหญ่-ภาคีเครือข่าย ลุยตรวจเชิงรุกสกัดโควิด-19,กลุ่มเส้นด้าย ร่วมกับเทศบาลนครหาดใหญ่และภาคีเครือข่าย ร […] The post กลุ่มเส้นด้าย ร่วมเทศบาลนครหาดใหญ่-ภาคีเครือข่าย ลุยตรวจเชิงรุกสกัดโควิด-19 appeared first on มติชนออนไลน์.,https://www.matichon.co.th/region/news_2986125,11_10_2021
หนุ่มใหญ่ลงเล่นน้ำ ถูกซัดจมหายต่อหน้า ขณะจนท.ค้นหาร่างเด็กถูกท่อน้ำดูดเสียชีวิต,หนุ่มใหญ่ลงเล่นน้ำ ถูกซัดจมหายต่อหน้า ขณะจนท.ค้นหาร่างเ […] The post หนุ่มใหญ่ลงเล่นน้ำ ถูกซัดจมหายต่อหน้า ขณะจนท.ค้นหาร่างเด็กถูกท่อน้ำดูดเสียชีวิต appeared first on มติชนออนไลน์.,https://www.matichon.co.th/region/news_2986111,11_10_2021
ประกาศ! ตามหาเจ้าของโอ่งใบใหญ่ ลอยตามน้ำท่วม ติดต่อขอรับได้ ที่ตลาดเช้าท่าเรือ,โอ่งใบใหญ่ ของใครหาย ลอยตามน้ำท่วมมาในแม่น้ำป่าสัก พบที […] The post ประกาศ! ตามหาเจ้าของโอ่งใบใหญ่ ลอยตามน้ำท่วม ติดต่อขอรับได้ ที่ตลาดเช้าท่าเรือ appeared first on มติชนออนไลน์.,https://www.matichon.co.th/region/news_2986110,11_10_2021
จับแล้ว! หนุ่มอ้างเป็น ผกก. แต่งเครื่องแบบตำรวจ อวดลง TikTok,จับแล้ว! หนุ่มอ้างเป็น ผกก. แต่งเครื่องแบบตำรวจ อวดลง T […] The post จับแล้ว! หนุ่มอ้างเป็น ผกก. แต่งเครื่องแบบตำรวจ อวดลง TikTok appeared first on มติชนออนไลน์.,https://www.matichon.co.th/local/crime/news_2986104,11_10_2021
ดาวกับดวง ประจำวันอังคารที่ 12 ตุลาคม 2564,ดาวกับดวง ประจำวันอังคารที่ 12 ตุลาคม 2564 ท่านผู้อ่านโ […] The post ดาวกับดวง ประจำวันอังคารที่ 12 ตุลาคม 2564 appeared first on มติชนออนไลน์.,https://www.matichon.co.th/lifestyle/news_2983901,11_10_2021
คาราเต้เดือด ‘แชมป์ชนแชมป์’ โยนกรรมการ 7 คนฟันธง,คาราเต้เดือด ‘แชมป์ชนแชมป์’ โยนกรรมการ 7 คน […] The post คาราเต้เดือด ‘แชมป์ชนแชมป์’ โยนกรรมการ 7 คนฟันธง appeared first on มติชนออนไลน์.,https://www.matichon.co.th/sport/thai-sport/news_2985395,11_10_2021
เชียงใหม่ พบคลัสเตอร์ใหม่ ‘หอพักแม่แอ๊ด’ แม่แฝกใหม่-สันทราย 12 ราย,เชียงใหม่พบคลัสเตอร์ใหม่ ‘หอพักแม่แอ๊ด’ แม่แฝกใหม่-สันท […] The post เชียงใหม่ พบคลัสเตอร์ใหม่ ‘หอพักแม่แอ๊ด’ แม่แฝกใหม่-สันทราย 12 ราย appeared first on มติชนออนไลน์.,https://www.matichon.co.th/region/news_2986099,11_10_2021
หวั่นย่ำอยู่​กับที่! ‘ลูกศร ธนาภรณ์’ ฟาดแรง ‘ขออีก 5 ปี.. ให้ 5 นาที ก็ใจดีมากละ’,หวั่นย่ำอยู่​กับที่! ‘ลูกศร ธนาภรณ์’ ฟาดแรง […] The post หวั่นย่ำอยู่​กับที่! ‘ลูกศร ธนาภรณ์’ ฟาดแรง ‘ขออีก 5 ปี.. ให้ 5 นาที ก็ใจดีมากละ’ appeared first on มติชนออนไลน์.,https://www.matichon.co.th/entertainment/thai-entertainment/news_2986077,11_10_2021
‘บิ๊กตู่’ลั่น เปิดรับนักท่องเที่ยวตปท.ฉีดวัคซีนครบ 1 พ.ย.ไม่ต้องกักตัว 1 ธ.ค.ดื่มในร้านได้,เมื่อเวลา 20.30 น. พล.อ.ประยุทธ์ จันทร์โอชา นายกรัฐมนตร […] The post ‘บิ๊กตู่’ลั่น เปิดรับนักท่องเที่ยวตปท.ฉีดวัคซีนครบ 1 พ.ย.ไม่ต้องกักตัว 1 ธ.ค.ดื่มในร้านได้ appeared first on มติชนออนไลน์.,https://www.matichon.co.th/news-monitor/news_2986073,11_10_2021
‘เสือ เสฏกานต์’ ยืนยันครอบครัวโลโซยังปักหลักอยู่ไทย ไม่คิดย้ายประเทศ,‘เสือ เสฏกานต์’ ยืนยันครอบครัวโลโซยังปักหลั […] The post ‘เสือ เสฏกานต์’ ยืนยันครอบครัวโลโซยังปักหลักอยู่ไทย ไม่คิดย้ายประเทศ appeared first on มติชนออนไลน์.,https://www.matichon.co.th/entertainment/thai-entertainment/news_2986061,11_10_2021
ไฮโซหนุ่มขับ ‘ลัมโบร์กีนี’ ถูกชนท้าย คู่กรณียกมือไหว้ขอโทษ เจ้าตัวเผยไม่ติดใจ,ไฮโซหนุ่ม ‘ลัมโบร์กีนี’ ถูกชนท้าย คู่กรณียก […] The post ไฮโซหนุ่มขับ ‘ลัมโบร์กีนี’ ถูกชนท้าย คู่กรณียกมือไหว้ขอโทษ เจ้าตัวเผยไม่ติดใจ appeared first on มติชนออนไลน์.,https://www.matichon.co.th/bullet-news-today/news_2986053,11_10_2021
