title,summary,link,published
‘หมอปลา’หอบหลักฐานยื่นดีเอสไอ เช็คบิลขบวนการโยงใย‘วัดท่าพุ’,หมอปลาหอบหลักฐานยื่นดีเอสไอ เช็คบิลขบวนการโยงใยวัดท่าพุ 28 กันยายน 2564 ที่กรมสอบสวนคดีพิเศษ (ดีเอสไอ) นายจีรพันธ์ เพชรขาว หรือ หมอปลา พร้อมนายไพศาล เรืองฤทธิ์ ทนายความ ยื่นหนังสือร้องทุกข์ต่อ พ.ต.อ.อัครพล บุณโยปัษฎัมภ์ รองอธิบดีดีเอสไอ เพื่อขอให้ตรวจสอบเอาผิดขบวนการนำส่งผู้ติดยาเสพติดมาบำบัดที่วัดท่าพุราษฎร์บำรุง จ.กาญจนบุรี พร้อมทั้งมีการซ้อมทรมาน นายไพศาล กล่าวว่า วันนี้ได้นำหลักฐานสลิปการโอนเงิน คำให้การของผู้เสียหาย และภาพถ่ายมามอบให้กับพนักงานสอบสวนคดีพิเศษ ชำนาญการพิเศษ กองคดีการค้ามนุษย์ เพื่อตรวจสอบผู้ที่เกี่ยวข้องทั้งหมดที่เกี่ยวกับขบวนการส่งผู้ป่วยบำบัดที่วัดท่าพุราษฎร์บำรุง ส่วนที่เคยไปร้องทุกข์ที่กองบังคับการปราบปราม (บก.ป.) ก่อนหน้านี้แล้วนั้น วันนี้ที่มาร้องต่อดีเอสไออีก เพราะต้องการให้หน่วยงานรัฐตรวจสอบคู่ขนานกันไป เพื่อความบริสุทธิ์ยุติธรรมกับผู้ที่เกี่ยวข้องทั้งหมด ยืนยันว่าไม่ได้กล่าวหาหรือจับผิดเจ้าหน้าที่ นายไพศาล กล่าว ด้านนายจีรพันธ์ กล่าวว่า ตนมีเจตนาต้องการช่วยเหลือประชาชนที่เดือดร้อน แต่กลับถูกกลุ่มบุคคลนำกฎหมายมาเล่นงานแจ้งความดำเนินคดี โดยส่วนตัวไม่ได้กังวล จากนี้จะขอดูข้อมูลรายละเอียดเพิ่มเติมก่อน และอาจเตรียมฟ้องกลับบุคคลที่ดำเนินคดีกับตัวเอง แต่ขณะนี้ยังไม่ได้รับหมายเรียกจากตำรวจแต่อย่างใด -005,https://www.naewna.com/local/605238,29_09_2021
'สงขลา'ยังพุ่ง! พบติดเชื้อโควิด-19รายใหม่ 281 ราย-เสียชีวิต 1 ราย,"โควิดยังพุ่งรายใหม่ 281 คน เสียชีวิต 1 คน ผู้ว่าฯ จี้เคร่งครัดมาตรการส่วนบุคคลผู้ประกอบการสงขลา เฮรับ ศบค.ปลดล็อก 22.00 น. ขับเคลื่อนเศรษฐกิจท้องถิ่น ม.อ.จองวัคซีน 3 หมื่นโดสฉีดนักศึกษาเปิดเทอม 2 28 ก.ย.64 นายจารุวัฒน์ เกลี้ยงเกลา ผู้ว่าราชการ จ.สงขลาเปิดเผยว่า จากการตรวจคัดกรองในพื้นที่และตรวจด้วยATKพบผู้ป่วยรายใหม่281 คน ผู้ป่วยสะสม 29,943 คนมีผู้เสียชีวิต1 คนเสียชีวิตสะสม150 คนสถานการณ์เริ่มคลี่คลายไปในทิศทางที่ดี และคาดว่าในเดือน ต.ค.64 ผู้ป่วยทุกกลุ่มลดลง แต่ตัวเลขของผู้ป่วยรายใหม่ยังสูงอยู่ ผู้ป่วยรักษาในโรงพยาบาล5 พันกว่าคน นายจารุวัน์ฯ เปิดเผยว่า ถึงแม้ ศบค.มีการคลายล็อกให้กับสถานประกอบการบางอย่างและเวลาเปิดบริการ เพื่อให้เศรษฐกิจเดินไปข้างหน้าแต่อย่าลืมมาตรการส่วนบุคคลที่จะต้องยึดอย่างเคร่งครัดด้วย และยังมีการตรวจคัดกรองในชุมชนต่อไป นายสมชาติ พิมพ์ธนพูนพร ผู้จัดการโรงแรมซากุระบัดแจ็ส อ.หาดใหญ่เปิดเผยว่าการที่ศบค.คลายล็อกเวลาไปถึง 22.00 น.ให้กับสถานประกอบการบางชนิดเปิดบริการ จะเป็นผลดี ประชาชนจะมีงานทำรายได้ประชาชนและท้องถิ่นเพิ่มขึ้น แต่สถานประกอบการต้องเคร่งครัดในมาตรการป้องกันโควิดเคร่งครัด เพื่อไม่ให้โควิดแพร่กระจาย หากโควิดแพร่ราดในรอบ 4 จะหนักกว่ารอบ 3 ผศ.ดร.นิวัต แก้วประดับ อธิการบดีมหาวิทยาลัยสงขลานครินทร์ (ม.อ.) เปิดเผยว่าสถานการณ์โควิดในพื้นที่ จ.สงขลาเริ่มคลี่คลายไปในทิศทางที่ดี ผู้เสียชีวิตน้อยลง ผู้ป่วยรายใหม่อยู่ในกลุ่มสีเขียวที่มีอาการไม่รุนแรง ม.อ.จะเปิดเรียนในภาคเรียนที่ 2 เดือน พ.ย. ขณะนี้ได้จองวัคซีนฉีดนักศึกษา 30,000 โดส เพื่อให้นักศึกษาได้รับวัคซีนคนละ 2 เข็ม กลุ่มผู้ป่วยสีแดงลดน้อยลงมาก เหลือที่นอนรักษาตัวในโรงพยาบาล ม.อ.ประมาณ 10 คน การที่ ศบค.คลายล็อกเพื่อให้เศรษฐกิจขับเคลื่อนไปได้",https://www.naewna.com/local/605246,29_09_2021
ครม.โอนอำนาจ 4 กรม ก.เกษตรฯ งานเดิม'ธรรมนัส' ให้'บิ๊กป้อม'ดูแลแทน,เมื่อวันที่ 28 กันยายน 2564 ที่ทำเนียบรัฐบาล น.ส.ไตรศุลี ไตรสรณกุล รองโฆษกประจำสำนักนายกรัฐมนตรี แถลงภายหลังประชุมคณะรัฐมนตรี (ครม.) ว่า มีรายงานว่า ครม.รับทราบคำสั่งนายกฯ แก้ไขเพิ่มเติมคำสั่งมอบหมายและมอบอำนาจให้รองนายกรัฐมนตรี และรัฐมนตรีประจำสำนักนายกรัฐมนตรี ปฏิบัติราชการแทนนายกรัฐมนตรี (ฉบับที่ 2) โดยให้ พล.อ.ประวิตร วงษ์สุวรรณ รองนายกรัฐมนตรี กำกับการบริหารราชการแทนนายกรัฐมนตรี แทน นายจุรินทร์ ลักษณวิศิษฏ์ รองนายกรัฐมนตรี เป็นการชั่วคราว ในส่วนของกระทรวงเกษตรและสหกรณ์ เฉพาะกรมพัฒนาที่ดิน กรมฝนหลวงและการบินเกษตร สำนักงานการปฏิรูปที่ดินเพื่อเกษตรกรรม และองค์การตลาดเพื่อเกษตรกร ผู้สื่อข่าวรายงานว่า แต่เดิมทั้ง 4 กรมนั้น อยู่ในความรับผิดชอบของ ร.อ.ธรรมนัส พรมเผ่า อดีตรัฐมนตรีช่วยว่าการกระทรวงเกษตรและสหกรณ์ แต่ปัจจุบันอยู่ในความรับผิดชอบของ นายเฉลิมชัย ศรีอ่อน รัฐมนตรีว่าการกระทรวงเกษตรและสหกรณ์ โดยกระทรวงเกษตรฯ อยู่ในอำนาจกำกับดูแลของรองนายกฯ จุรินทร์ และเมื่อมีมติ ครม.ดังกล่าวส่งผลให้งานของ 4 กรมนี้ เมื่อ รมว.เกษตรฯ พิจารณากลั่นกรองแล้วจะเสนอเรื่องเข้า ครม.ต้องเสนอผ่าน พล.อ.ประวิตร แทน - 006,https://www.naewna.com/politic/605261,29_09_2021
เช็ค‘ทุ่งผักไห่-บางบาล’ หลังเขื่อนเจ้าพระยาเพิ่มการระบาย น้ำเข้าท่วมชุมชน,"เช็คทุ่งผักไห่-บางบาล หลังเขื่อนเจ้าพระยาเพิ่มการระบาย น้ำเข้าท่วมชุมชน 28 กันยายน 2564 ผู้สื่อข่าวรายงานสถานการณ์น้ำท่วมที่ จ.พระนครศรีอยุธยา พบว่า หลังจากเขื่อนเจ้าพระยาเพิ่มการระบายน้ำลงสู่พื้นที่ท้ายเขื่อน ที่ 2,631 ลบ.ม.ต่อวินาที ส่งผลทำให้ระดับน้ำในแม่น้ำเจ้าพระยา แม่น้ำน้อย คลองต่างๆ ระดับน้ำเพิ่มสูงขึ้น ทั้งนี้ ที่ประตูระบายน้ำคลองบางบาล รับน้ำจากแม่น้ำเจ้าพระยา มีน้ำไหลแรง เข้าท่วมบ้านเรือนประชาชน วัด โรงเรียน ถนนทางเข้าชุมชนที่โรงเรียนบางบาล เจ้าหน้าทีทหารจากกองพลทหารม้าที่ 2 รักษาพระองค์ นำกำลังเข้าทำแนวป้องกันน้ำท่วมไม่ให้ไหลเข้าท่วมพื้นที่ในโรงเรียน ซึ่งระดับน้ำที่โรงเรียนสูงประมาณ 1 เมตร น้ำไหลแรง นอกจากนี้พบว่าระดับน้ำในแม่น้ำเจ้าพระยาที่ไหลผ่าน อ.พระนครศรีอยุธยา ระดับเพิ่มสูงขึ้นล้นตลิ่งเข้าท่วมชุมชนที่อาศัยอยู่ริมแม่น้ำเจ้าพระยา ใน ต.ภูเขาทอง ชาวบ้านต้องขนย้ายสิ่งของไว้ที่สูง และบนถนน รวมถึงชุมชน ต.ประตูชัย ส่วนการระบายน้ำเข้านั้น ในส่วนของทุ่งผักไห่-บางบาล จ.พระนครศรีอยุธยา พื้นที่รับน้ำ ตอนนี้ ทั้งน้ำทุ่ง-น้ำท่าขังอยู่ในทุ่งจำนวนมาก ซึ่งเป็นหนึ่งสาเหตุที่ริมแม่น้ำเจ้าพระยาเอ่อมากขึ้น เพราะระบายเข้าไปเก็บได้น้อยแล้ว ด้านนายธนากร ตันติกุล ผู้อำนวยการโครงการชลประทานพระนครศรีอยุธยา กล่าวว่า ในทุ่งนาส่วนใหญ่จะเป็นน้ำฝน จะต้องติดตามสถานการณ์ว่าทางกรมชลประทานยังไม่มีการผันน้ำเข้าไป ทางกรมชลประทานจะต้องเฝ้าติดตามสถานการณ์อีกครั้งว่าจะต้องพิจารณาน้ำเข้าทุ่งได้เมื่อไร ในปีนี้กรมชลประทานยังสามารถควบคุมสถานการณ์น้ำได้ มีพายุเข้ามาในประเทศไทยเพียง 1 ลูกเท่านั้น ไม่เหมือนปี 2554 ซึ่งมีเข้ามาจำนวนหลายลูก ขอให้พี่น้องประชาชนอย่าวิตกกังวล ให้ติดตามการรายงานสถานการณ์น้ำจาก กรมชลประทาน กรมอุตุนิยมวิทยา -005",https://www.naewna.com/local/605267,29_09_2021
กระบะหักหลบตัวเงินตัวทอง พุ่งชนเสาไฟฟ้าล้มเสียหาย 8 ต้น,หนุ่มขับกระบะหลบตัวเงิน-ตัวทองพุ่งชนเสาไฟฟ้าล้มเสียหาย8ต้นชาวบ้านแห่ส่องทะเบียนรถ 28 ก.ย.64เมื่อเวลา14.00น. เจ้าหน้าที่ตำรวจตำรวจสภ.ไทรน้อยจ.นนทบุรีพร้อมเจ้าหน้าที่มูลนิธิป่อเต็กตึ๊งเดินทางเข้าตรวจสอบหลังจากได้รับแจ้งมีรถกระบะชนเสาไฟฟ้าหักล้มหลายต้นและมีผู้บาดเจ็บมีรถเสียหายหลายคันเหตุเกิดถนนตลิ่งชัน-สุพรรณบุรีขาออกเชิงสะพานลากฆ้อนต.ราษฏร์นิยมอ.ไทรน้อยจากนั้นจึงรุดเข้าตรวจสอบ ที่เกิดเหตุพบผู้บาดเจ็บคือนายสมจิตพรมตาอายุ59ปีมีอาการเจ็บที่หน้าอกนอนอยู่ริมทางมีพลเมืองดีและญาติค่อยปฐมพยาบาลก่อนที่กู้ภัยจะมาถึงและนำส่งร.พ.เกษมราษฎร์รัตนาธิเบศร์และจากการตรวจสอบในที่เกิดเหตุพบรถกระบะยี่ห้ออีซูซุสีขาวทะเบียนบล5613สุพรรณบุรีเป็นรถของผู้บาดเจ็บสภาพด้านหน้ารถพังเสียหายตกอยู่ร่องกลางถนนโดยมีเสาไฟฟ้า1ต้นหักลงมาใกล้ตัวรถและห่างไปเล็กน้อยพบรถกระบะส่งของยี่ห้อบห6595สุพรรณบุรีมีร่องรอยถูกชนด้านท้ายตัวรถตกไปอยู่ร่องกลางถนนเช่นกัน ขณะเดียวกันทางเจ้าหน้าที่ยังตรวจสอบอีกฝั่งหนึ่งของถนนพบเสาไฟฟ้าอีกจำนวน7ต้นหักล้มลงมาขวางถนนและทับรถเก๋งยี่ห้อโตโยต้ารุ่นยาริสสีขาวทะเบียนฌท2350กทมของนายอุดมพรผมหอมที่ขับมากับครอบครัวตอนเกิดเหตุแต่โชคดีทุกคนปลอดภัย จากการสอบถามนายสมจิตผู้บาดเจ็บกล่าวว่าระหว่างที่ตนกำลังขับรถเพื่อมุ่งหน้าไปทางจ.สุพรรณบุรีจู่ๆเห็นตัวเงินตัวทองวิ่งตัดหน้ารถอย่างกระทันหันจึงพยายามเบรคและหักหลบทำให้รถเสียหลักพุ่งตกร่องกลางถนนไปชนเสาไฟฟ้าดังกล่าว ขณะที่ทางด้านของนายรุ่งภูมิอายุ49ปีคนขับรถกระบะส่งของให้การว่าในขณะที่ขับรถมุ่งหน้าจ.สุพรรณบุรีจู่ๆก็มีความรู้สึกว่าถูกชนท้ายทำให้รถเกิดเสียหลักตกลงไปข้างทางซึ่งตนมารู้ภายหลังว่าถูกรถของนายสมจิตชนท้าย นายอุดมพรคนขับรถเก๋งโตโยต้ารุ่นยาริสที่ถูกเสาไฟฟ้าทับเปิดเผยนาทีระทึกว่าตนขับรถมาด้วยกัน3คนโดยมีตนพ่อตาลูกสาวและสุนัขอีก1ตัวตนกำลังจะขับรถกลับห้องพักซึ่งห่างจากจุดเกิดเหตุไม่ไกลนักจู่ๆได้ยินเสียงดังขึ้น1ครั้งจึงหันไปมองกระจกหลังเห็นสายไฟร่วงหล่นลงมาที่พื้นถนนจากนั้นเสาไฟที่มีหม้อแปลงขนาดใหญ่ก็หักล้มลงมาทับหน้ารถของตนจนมีเสียงระเบิดขึ้นซึ่งตอนนั้นตกใจมากพอตั้งสติได้จึงพยายามเปิดประตูอีกฝั่งหนึ่งและนำพ่อตาพร้อมกับลูกสาวรวมถึงสุนัขออกมาจากรถได้อย่างปลอดภัย ทางด้านเจ้าหน้าที่ตำรวจกล่าวว่าเบื้องต้นได้ทำการบันทึกภาพที่เกิดเหตุรวมถึงสอบปากคำผู้ขับขี่รถที่เสียหายไว้โดยเบื้องต้นทราบว่านายสมจิต(ผู้บาดเจ็บ)คนขับรถกระบะเป็นต้นเหตุหักหลบตัวเงินตัวทองทำให้รถนั้นไปชนท้ายรถกระบะส่งของก่อนที่จะพุ่งตกร่องกลางถนนไปชนเสาไฟฟ้าหักทำให้สายไฟเหนี่ยวรั้งเสาไฟอีก7ต้นที่อยู่ตรงข้ามล้มลงมาดังกล่าวแต่อย่างไรก็ตามจะต้องทำการสอบปากคำคนเจ็บเพิ่มเติมอีกครั้งหลังจากอาการดีขึ้น .-011,https://www.naewna.com/local/605275,29_09_2021
