title,summary,link,published
อนุกมธ.ก.ตร.ปลุกผีดันฟื้น‘ก.ตช.’ค้านคนนอกร่วมโต๊ะโละทิ้งระบบอุปถัมภ์,"อนุกมธ.พิจารณาโครงสร้างตำรวจมีมติฟื้น ก.ตช. แยกงานบริหารบุคคล ออกจากนโยบาย สกัดบุคคลนอกสายนั่งเป็นกก.ต้นเหตุ ระบบอุปถัมภ์ เตรียมชงเข้าคณะใหญ่เคาะ

เมื่อวันที่ 30 กันยายน 2564 นายขจิตร ชัยนิคม ส.ส.อุดรธานี พรรคเพื่อไทย ในฐานะอนุกรรมาธิการ (กมธ.) พิจารณาโครงสร้างกรรมการข้าราชการตำรวจ (ก.ตร.) และคณะกรรมการนโยบายตำรวจแห่งชาติ (ก.ตช.) ในกมธ.วิสามัญพิจารณาร่างพระราชบัญญัติ (พ.ร.บ.) ตำรวจแห่งชาติ พ.ศ.... รัฐสภา เปิดเผยผลการหารือของอนุกมธ.ฯ ที่มีพล.ต.อ.ชัชวาลย์ สุขสมจิตร์ สมาชิกวุฒิสภา(ส.ว.) เป็นประธานอนุฯ ว่า อนุกมธ.มีมติให้ ก.ตร. และ ก.ตช. เป็นองค์กรที่แยกจากกัน เพื่อรับผิดชอบงานบริหารบุคคล และงานด้านนโยบายเหมือนกับปี 2547 ซึ่งไม่เป็นไปตามร่างพ.ร.บ.ตำรวจแห่งชาติ ฉบับที่รัฐสภารับหลักการ ที่กำหนดให้มีเฉพาะ ก.ตร. เท่านั้น ส่วนหนึ่งมองว่าตัวร่างที่เสนอนั้นทำแบบรวบๆ โดยกำหนดให้มีบุคคลภายนอกสายงานตำรวจที่ไม่เกี่ยวข้องเข้ามาร่วมเป็นก.ตร. เช่น ปลัดกระทรวงมหาดไทย ปลัดกระทรวงยุติธรรม เป็นต้น ทั้งที่งานบริหารงานบุคคลของตำรวจควรเป็นบุคคลในสายงานตำรวจ และอาจเป็นต้นเหตุที่ทำให้เกิดการฝากคนดำรงตำแหน่ง สร้างระบบอุปถัมภ์ขึ้นได้

เมื่อถามว่า หากคืนก.ตช. และปรับโครงสร้าง ก.ตร. ตามร่างกฎหมาย จะแก้ปัญหาที่ผ่านมาได้หรือไม่ นายขจิตร กล่าวว่า ต้องพิจารณาในหลายส่วนประกอบกันและต้องลงรายละเอียด ซึ่งอนุกมธ.ฯ พิจารณาเพียงแค่โครงการของก.ตร. และ ก.ตช. เท่านั้น จากนั้นจะนำเข้าให้ที่ประชุมกมธ.ฯ พิจารณา วันที่ 1 ต.ค.นี้ เวลา 09.30 น. อย่างไรก็ดีในปัญหาการแต่งตั้งโยกย้ายข้าราชการตำรวจนั้น อนุกมธ.ฯ มีข้อเสนอว่าควรให้ยึดโยงกับข้าราชการตำรวจด้วย โดยผู้ที่จะดำเนินการเป็นคณะพิจารณาควรมาจากการเลือกของข้าราชการตำรวจ เช่น เปิดให้ข้าราชการตำรวจสมัครเข้ารับการคัดเลือก ให้เหลือ 3 คน ทั้งนี้เพื่อให้เกิดความผูกพันกับข้าราชการตำรวจ และความรับผิดชอบ ไม่ใช่รับใช้ผู้มีอำนาจ

ข้อเสนอของอนุกมธ.ฯ ต้องไปพิจารณาในชั้นกมธ. อีกครั้งผมเชื่อว่ากมธ.ชุดใหญ่จะเห็นด้วย แต่หากไม่เห็นด้วยต้องถกแถลงรายละเอียดเพื่อให้เกิดความเห็นร่วม ส่วนตัวมองว่าหากกมธ.จะเติมข้อกฎหมายว่าด้วย ก.ตช. ที่ในร่างกฎหมายไม่มีนั้นสามารถทำได้ และไม่เกินหลักการ เพราะตามหลักการกำหนดว่าให้ปรับปรุงกฎหมาย เพื่อให้การแต่งตั้งโยกย้ายข้าราชการตำรวจมีหลักเกณฑ์ชัดเจนตามรัฐธรรมนูญ อีกทั้งร่างกฎหมายฉบับนี้คือกฎหมายปฏิรูป ดังนั้นจึงเชื่อวาจะสามารถปรับปรุงให้ดีขึ้นกว่าเดิมได้ นายขจิตร กล่าว

- 004",https://www.naewna.com/politic/605677,30_09_2021
รวบยกแผงแก๊งลักรถ แฉออกอุบายเช่าป้ายแดงจากกทม. ส่งขายเมียนมา,"ผบช.สตม. นำแถลง ตม.ตาก-ตม.เชียงใหม่-สืบ ตม.5 ติดตามจับกุมแก๊งลักรถ ทำอุบายเช่ารถยนต์ป้ายแดงจาก กทม. ส่งออกขายเมียนมา

30 กันยายน 2564 สำนักงานตรวจคนเข้าเมือง โดย พล.ต.ท.สมพงษ์ ชิงดวง ผบช.สตม. , พล.ต.ต.เดชา กัลยาวุฒิพงศ์ ผบก.ตม 5 , พ.ต.อ.เอกกร บุษบาบดินทร์ รอง ผบก.ตม.5 , พ.ต.อ.เศรษฐภัทร ณ สงขลา ผกก.สส.บก.ตม.5 , พ.ต.อ.สัมพันธ์ เหลืองสัจจกุล ผกก.ตม.จว.ตาก และ พ.ต.ท.สุชาติ เพ็ญภู่ รอง ผกก.ตม.จว.ตาก ร่วมแถลงข่าวจับกุมแก๊งลักรถส่งออกขายเมียนมา

สืบเนื่องจาก พล.ต.ท.สมพงษ์ ชิงดวง ผบช.สตม. สั่งการให้เจ้าหน้าที่ ตม.จว.ตาก ทำการสืบสวนพฤติการณ์ของกลุ่มคนมีลักษณะโจรกรรมนำรถยนต์ออกนอกราชอาณาจักร ซึ่งเป็นอาชญากรรมข้ามชาติ โดยให้ประสานกับเจ้าหน้าที่ตำรวจ สน.ทองหล่อ จึงทราบข้อเท็จจริงว่าเมื่อวันที่ 16 ก.ค.64 นายอภิวัฒน์ และ น.ส.ณัฏฐณิชา ได้เช่ารถยนต์กระบะ ยี่ห้อโตโยต้า ป้ายแดงหมายเลข ส36xx กรุงเทพฯ มูลค่า 1,249,000 บาท จากบริษัทไทย วีพี คอร์ปอร์เรชัน จำกัด ซึ่งเป็นผู้ให้บริการรถเช่า โดยทำสัญญาเช่าระยะยาว



ต่อมาบริษัท ติดตามระบบจีพีเอส ซึ่งติดไว้กับรถยนต์พบว่ารถยนต์คันดังกล่าวจอดอยู่ตรงข้าม อ.แม่สอด จ.ตาก ซึ่งเป็นบริเวณรอยต่อพรมแดนไทยกับประเทศเมียนมา เมื่อติดต่อกับผู้เช่าทั้งสองก็บ่ายเบี่ยงไม่ยอมนำรถมาคืน เจ้าหน้าที่ ตม.จว.ตาก จึงได้ทำการสืบสวน และทำรายงานการสืบสวนพร้อมส่งพยานหลักฐานให้ สน.ทองหล่อ จนนำไปสู่การออกหมายจับผู้ต้องหา 5 ราย ได้แก่ 1.นายอภิวัฒน์ ที่อยู่ อ.สันทราย จ.เชียงใหม่ 2.น.ส.ณัฏฐณิชา ที่อยู่ อ.สันทราย จ.เชียงใหม่ 3.นายเสถียรพงษ์ ที่อยู่ อ.ดอยสะเก็ด จ.เชียงใหม่ 4.นายอรุณรัตน์ ที่อยู่ อ.พระพุทธบาท จ.สระบุรี และ 5.นายวสันต์ ที่อยู่ อ.เมืองลำพูน จ.ลำพูน ในความผิดฐาน ร่วมกันลักทรัพย์โดยร่วมกระทำความผิดตั้งแต่สองคนขึ้นไป



นอกจากนี้พบไทม์ไลน์การเช่ารถ จากการสืบสวนจนนำไปสู่การจับกุม มีดังนี้ 1. วันที่ 16 ก.ค.64 นายอภิวัฒน์ , น.ส.ณัฎฐณิชา , นายเสถียรพงษ์ ไปเช่ารถ 2.วันที่ 16 ก.ค.64 ช่วงบ่าย รถอยู่กับนายอรุณรัตน์ ที่ จ.สระบุรี 3.วันที่ 18 ก.ค.64 ช่วงบ่าย รถอยู่กับนายอรุณรัตน์ ที่ จ.ตาก 4.วันที่ 18 ก.ค.64 เวลา 20.00 น. นายวสันต์ เข้าพักโรงแรมในอำเภอแม่สอด 5.วันที่ 18 ก.ค.64 เวลา 21.00 น. นายอรุณรัตน์ ขับรถยนต์เข้าพักห้องเดียวกับนายวสันต์ 6.วันที่ 19 ก.ค.64 GPS รถยนต์ขึ้นอยู่เขตเมียนมา 7.วันที่ 21 ก.ค.64 ติดต่อผู้เช่ารถยนต์แต่บ่ายเบี่ยง 8.วันที่ 23 ก.ค.64 ติดต่อผู้เช่ารถยนต์ไม่ได้ 9.วันที่ 9 ก.ย.64 ศาลอาญากรุงเทพใต้ ออกหมายจับทั้ง 5 คน



ต่อมาเจ้าหน้าที่ ตม.จว.ตาก , ตม.จว.เชียงใหม่ , กก.สส.บก.ตม.5 , ตม.จว.สระบุรี และชุดสืบสวน สน.ทองหล่อ ได้นำหมายจับศาลอาญากรุงเทพใต้ ไปทำการจับกุมตัวผู้ต้องหาได้ และส่งพนักงานสอบสวน สน.ทองหล่อ ดำเนินคดี โดย 1.วันที่ 13 ก.ย.64 จับกุมตัวนายอภิวัฒน์ และ น.ส.ณัฏฐณิชา ได้ที่บ้านพักใน จ.เชียงใหม่ 2.วันที่ 13 ก.ย.64 จับกุมตัวนายอรุณรัตน์ ได้ที่บ้านพักใน จ.สระบุรี 3.วันที่ 16 ก.ย.64 จับกุมตัวนายเสถียรพงษ์ ได้ที่กรุงเทพฯ ส่วนนายวสันต์ อยู่ระหว่างการสืบสวนติดตามจับกุม และยังอยู่ระหว่างการขยายผลถึงบุคคลที่เกี่ยวข้อง



ด้าน พล.ต.ต.อาชยน ไกรทอง รอง ผบช.สตม./โฆษก สตม. , พ.ต.อ.ภัคพงศ์ สายอุบล รอง ผบก.ตม.1/รองโฆษก สตม. ร่วมกันเปิดเผยว่า จากสถานการณ์การแพร่ระบาดของโรคโควิด-19 ในปัจจุบัน พล.อ.ประยุทธ์ จันทร์โอชา นายกรัฐมนตรี , พล.อ.ประวิตร วงษ์สุวรรณ รองนายกรัฐมนตรี สั่งการให้หน่วยงานที่เกี่ยวข้องทั้งหมดเฝ้าระวังและป้องกันการแพร่ระบาด ซึ่ง พล.ต.อ.สุวัฒน์ แจ้งยอดสุข ผบ.ตร. และ พล.ต.อ.ดำรงศักดิ์ กิตติประภัสร์ รอง ผบ.ตร. มอบหมายให้ สตม. โดย พล.ต.ท.สมพงษ์ ชิงดวง ผบช.สตม.ระดมกวาดล้างคนต่างด้าวที่ลักลอบเข้าเมืองอย่างผิดกฎหมาย ขบวนการขนคนต่างด้าวเข้าเมืองโดยผิดกฎหมาย ตลอดจนการขนแรงงานต่างด้าวเข้ ออกพื้นที่จังหวัดที่มีคำสั่งห้ามเคลื่อนย้ายแรงงานต่างด้าว เพื่อป้องกันการแพร่ระบาดของโรค โควิด-19 และรวมถึงการที่คนต่างชาติเข้ามาใช้ประเทศไทยเป็นฐานในการกระทำความผิด



ทั้งนี้ สตม. ขอเรียนว่า สตม. มีมาตรการในการตรวจสอบ กวดขัน และปราบปรามการกระทำความผิดต่างๆ รวมทั้งการดำเนินการตรวจสอบชาวต่างชาติที่มีพฤติกรรมไม่เหมาะสม กระทำผิดกฎหมาย ก่อเหตุอันตรายต่อความสงบสุขและความปลอดภัยในชีวิตและทรัพย์สินของประชาชนหรือ ทำให้เกิดความเสียหายต่อภาพลักษณ์ของประเทศชาติ หากประชาชนท่านใดพบเบาะแสในการกระทำความผิด กรุณาแจ้งมายัง สำนักงานตรวจคนเข้าเมือง เลขที่ 507 ซ.สวนพลู แขวงทุ่งมหาเมฆ เขตสาทร กรุงเทพมหานคร 10120 หรือที่หมายเลขโทรศัพท์ 1178 หรือที่ www.immigration.go.th



-005",https://www.naewna.com/local/605683,30_09_2021
