title,summary,link,published
รวบหนุ่มแอบอ้างใช้ชื่อ'เลขาธิการพระราชวัง'  หลอกโอนเงินเสียหายกว่า1.4ล้านบาท,"30 กันยายน 2564ตามการสั่งการของ พล.ต.ท.ต่อศักดิ์ สุขวิมล ผู้บัญชาการตำรวจสอบสวนกลาง ให้ทำการสืบสวนจับกุมผู้แอบอ้าง ใช้ชื่อ เลขาธิการพระราชวัง ผ่านทางแอพพลิเคชั่น ไลน์ หลอกหลวงเงินผู้อื่น เป็นเหตุให้ได้รับความเสียหาย มาดำเนินคดีตามกฎหมาย โดย พล.ต.ต.วิวัฒน์ คำชำนาญ ผบก.ประจำ บช.ก., พ.ต.ท.สุทธิชัย เทียนโพธิ์ รอง ผกก.8 บก.รน., พ.ต.ท.ธนวัฒน์ แจ้งสว่าง, พ.ต.ต.สมหมาย เรืองแก้ว สว.กก.. บก.ปอศ ร่วมกับ พล.ต.ต.อุทัย กวินเดชาธร ผบก.ภ.จว.เพชรบุรี พร้อมด้วยพ.ต.อ.กานต์ ธรรมเกษม รองผบก.ก.จว.เพชรบุรี พ.ต.อ.ปัญญา กุลไทย ผกก.สภ.ชะอำ พ.ต.ท.อภิเชษฐ์ ทรัพย์ส่งเสริม รอง ผกก.สส.สภ.ชะอำ พ.ต.ต.ทวีเดช เทียนทอง สว.สส.สภ.ชะอำ และชุดสืบสวน สภ.ชะอำ ทำการกันจับกุมนายสิทธิภัททิก์ ขวัญบัว อายุ 40 ปี ที่อยู่ 24 ซอยพุทธบูชา33/2 แขวงบางมด เขตทุ่งครุ กรุงเทพมหานคร ผู้ต้องหาตามหมายจับของศาลจังหวัดเพชรบุรี 239/2564 ลงวันที่ 27 กันยายน 2564 ในความผิดฐาน ฉ้อโกงทรัพย์,นำข้อมูลเท็จเข้าสู่ระบบคอมพิวเตอร์ที่ประชาชนทั่วไปไม่สามารถเข้าถึงได้ โดยจับกุมได้บริเวณ อพาร์ทเม้นแห่งหนึ่ง ซอยพระรามที่2 ซอย33 แขวงบางมค เขตจอมทอง กรุงเทพมหานคร

การจับกุมครั่งนี้สืบเนื่องจาก เมื่อวันที่ 6 สิงหาคม 2564 นายสิทธิภัททิก์ ขวัญบัว ผู้ต้องหา ได้ใช้แอพพลิเคชั่นไลน์ โดยใช้ชื่อเลขาธิการพระราชวัง และเอารูปจากในอินเตอร์เน็ต มาใช้เป็นโปรไฟล์ สำหรับพูดคุย หลอกผู้เสียหายให้โอนเงินเข้าบัญชีตนเอง โดยจะอ้างว่าเป็นค่าใช้ง่ายต่างๆ และจะได้เงินส่วนแบ่ง ผู้เสียหายจึงโอนเงินเข้าบัญชีของผู้ต้องหา ในระยะห้วงเวลา 19 มิ.ย.- 6 ส.ค.64 ซึ่งมีรายการโอนทั้งหมด 20 ครั้ง รวมเป็นเงิน 1,439,500 บาท ต่อมาพนักงานสอบสวน สภ.ชะอำ ได้รวบรวมพยานหลักฐานเพื่อร้องขอต่อศาลจังหวัดเพชรบุรีให้อนุมัติหมายจับ

โดยพฤติกรรมของคนร้ายรายนี้จะเล่นหลายบทบาท เป็นหลายตัวละคร โดยเริ่มต้นจะไปติดต่อกลุ่มผู้เสียหายซึ่งส่วนใหญ่เป็นเจ้าของกิจการ หรือร้านค้าในพื้นที่ที่ดูแล้วน่าจะมีเงิน

ซึ่งหนึ่งในผู้เสียหายเป็นจำหน่ายอุปกรณ์คอมพิวเตอร์ในจังหวัดเพชรบุรี โดยทำทีเข้าไปพูดคุยว่ามีคนที่รู้จักจะนำเงินจากต่างประเทศเข้าไทยไม่ต่ำกว่า 200 ล้านบาทแต่ไม่อยากเสียภาษีและไม่อยากให้ถูกตรวจสอบ โดยเพื่อนยินดีจะจ่ายค่าดำเนินการให้หากนำเงินเข้ามาได้ ซึ่งผู้ต้องหาจะอ้างว่ารู้จักกับราชเลขาสำนักพระราชวัง ซึ่งเป็นคนจังหวัดเพชรบุรี เหมือนกัน จะขอให้ท่านช่วยในการนำเงินดังกล่าวเข้ามา

ก่อนที่ผู้ต้องหาจะนำรูปราชเลขาฯที่หาได้จากอินเตอร์เน็ตมาทำเป็นโปรไฟล์ในแอพพลิเคชั่น LINE ทำทีเป็นสนทนากับผู้ต้องหาเองเพื่อสร้างความน่าเชื่อถือ อีกทั้งยังมีการตกแต่งสลิปการโอนเงินโดยโอนเงิน 100 บาท แต่ตกแต่งตัวเลขให้เป็นหนึ่งล้านบาทเพื่อใช้หลอกเหยื่อตายใจด้วย

จากการตรวจสอบพฤติกรรม และเส้นทางการเงินพบว่าในแต่ละเดือนจะมีเงินหมุนเวียนเข้าบัญชีของผู้ต้องหาไม่ต่ำกว่า 3-4 ล้านบาท ตำรวจจึงเชื่อว่าผู้ต้องหารายนี้น่าจะก่อเหตุในลักษณะนี้มาแล้วหลายครั้ง

กระทั่ง เมื่อวันที่ 29 กันยายน 2564 เวลาประมาณ 11.30 น.ชุดสืบสวน สภ.ชะอำ พร้อมกับเจ้าหน้าที่ตำรวจกองบัญชาการสอบสวนกลาง ได้ทำการจับกุม นายสิทธิภัททิก์ ขวัญบัว ได้ที่อพาร์ทเม้น ในซอยพระรามที่2 ซอย33 แขวงบางมด เขตจอมทอง กรุงเทพมหานคร จากการตรวจสอบพบว่านายสิทธิภัททิก์ ขวัญบัว ยังเป็นผู้ต้องหา ตามหมายจับศาลจังหวัดสีคิ้ว(ปากช่อง) ที่จ.55/2564 ลงวันที่ 15 กันยายน 2564 ในข้อหา ร่วมกันปลอมเอกสารสิทธิอันเป็นเอกสารราชการและร่วมกันใช้หรืออ้างเอกสารสิทธิอันเป็นเอกสารราชการปลอมในประการที่น่าจะเกิดความเสียหายแก่ผู้อื่นหรือประชาชน และร่วมกันฉ้อโกงทรัพย์ผู้อื่น และจากการตรวจสอบยังพบว่าเมื่อ 28 มี.ค.2561 ถูกเจ้าหน้าที่ตำรวจ สน.รายฎร์บูรณะจับกุมและดำเนินคดีในความผิดฐานลักทรัพย์ ต่อมาเจ้าหน้าที่ตำรวจได้นำตัวนายสิทธิภัททิก์ ขวัญบัว ผู้ต้องหา ส่งพนักงานสอบสวน สภ.ชะอำเพื่อดำเนินการตามขั้นตอนของกฎหมายต่อไป",https://www.naewna.com/local/605635,30_09_2021
ครอบครัว 4 ชีวิตบ้านเช่าเคว้ง ต้องไปอาศัยที่ว่าการอำเภอ หลังน้ำท่วมไร้ที่อยู่,"ครอบครัวบ้านเช่า 4 ชีวิต สุดเคว้งไร้ที่อยู่ เก็บข้าวของที่นอนหมอนมุ้งมานอน ว่าการอำเภอ พร้อมด้วยสุนัข 4 ตัว แมว 3 ตัว

30 ก.ย.64 ที่บริเวณชั้นล่างที่ว่าการอำเภอป่าโมก จ.อ่างทอง พบชาวบ้านผู้ได้รับผลกระทบน้ำท่วมในพื้นที่ตำบลบางปลากด เก็บข้าวของมาอาศัยนอนที่บริเวณที่ว่าการอำเภอจำนวน 4 ชีวิต พร้อมด้วย สุนัข 4 ตัว และแมว 3 ตัว ซึ่งเป็นครอบครัวชาวบ้านที่ได้เช่าห้องพักอาศัยอยู่ในพื้นที่หมู่ 6 ต.บางปลากด หลังน้ำไหลทะลักเข้ามาในพื้นที่เก็บข้าวของหนีน้ำมาได้บางส่วน แต่ยังคงเคว้งเพราะหาที่อยู่ไม่ได้

นางสาย นพศรี อายุ 64ปี เล่าให้ฟังว่า ครอบครัวของตนอยู่รวมกัน 4 ชีวิต ได้เช่าบ้านอยู่ในพื้นที่หมู่ 6 ต.บางปลากด นานหลายปีแล้ว และเมื่อวันที่ 29 ก.ย.ที่ผ่านมา น้ำเจ้าพระยาไหลทะลักเข้าท่วมพื้นที่ ต.บางปลากด ตนและครอบครัวได้ช่วยกันเก็บข้าวของหนีน้ำมาบางส่วนไว้ที่บริเวณที่ว่าการอำเภอป่าโมก และได้พักค้างคืน เนื่องจากยังหาที่ไปไม่ได้อยากจะหาที่เช่าอยู่อาศัย เนื่องจากมีอยู่กันหลายคน ยังมีสัตว์เลี้ยงสุนัขและแมวอีกด้วย

นางสาวไอรดาถนอมวงษ์ อายุ 18 ปี เล่าให้ฟังว่า ตอนที่น้ำไหลทะลักขึ้นมาก็ช่วยกันเก็บของขึ้นไว้ที่สูงแต่เนื่องจากระดับน้ำเพิ่มขึ้นอย่างต่อเนื่องจึงเก็บข้าวของออกมาได้บางส่วน มีอีกหลายอย่างจมอยู่ภายในน้ำ และไม่รู้จะไปเอามาได้อย่างไร ตอนนี้ก็มีสิ่งของบางส่วนที่นำติดตัวมาได้ก็ไม่รู้จะทำอย่างไรก็ตั้งหลักอยู่ที่บริเวณที่ว่าการอำเภอป่าโมกไปก่อนคอยหาทางขยับขยายหาบ้านเช่าต่อไป

ด้านสถานการณ์น้ำเจ้าพระยายังไหลเพิ่มขึ้นอย่างต่อเนื่องมีหลายพื้นที่ได้รับผลกระทบแล้ว หลายร้อยครอบครัว ที่หมู่1-2-3-5 ต.โผงเผง อ.ป่าโมก ที่บริเวณ ต.บางปลากด อ.ป่าโมก พื้นที่หมู่ 1 ต.จำปาหล่อ อ.เมือง พื้นที่หมู่ 1-2 ต.โพสะ อ.เมือง และพื้นที่หมู่9 ต.บางจักร อ.วิเศษชัยชาญ ส่วนถนนเส้น 309 ป่าโมก อยุธยา ยังมีน้ำไหลบ่าเข้าท่วม รถยนต์ขนาดใหญ่ผ่านได้ ส่วนรถจักรยานยนต์ต้องใช้ความระมัดระวัง ส่วนน้ำที่บริเวณหน้าศาลากกลาง จ.อ่างทอง เพิ่มสูงขึ้นอยู่ที่ 9.09 เมตร จากระดับกำแพงกั้น 10เมตร เหลือไม่ถึง 1 เมตร ก็จะเลยกำแพงกั้นน้ำแล้ว มีปริมาณน้ำไหลผ่าน 2487 ลบ.ม/วินาที. -008",https://www.naewna.com/likesara/605631,30_09_2021
เขื่อนป่าสักเร่งระบายน้ำออกจากเขื่อน 4 ล้านลูกบาศก์เมตรต่อชั่วโมง,"นายสุรัช ธนูศิลป์ ผู้อำนวยการสำนักงานชลประทานที่ 10 จังหวัดลพบุรี เปิดเผยถึงสถานการณ์น้ำในอ่างเก็บน้ำเขื่อนป่าสักชลสิทธิ์ ว่า สำหรับปริมาณน้ำที่ไหลลงสู่อ่างเก็บน้ำของเขื่อนป่าสักชลสิทธิ์วันนี้เริ่มดีขึ้นหลังมีน้ำไหลลงสู่เขื่อนป่าสักอยู่ที่ชั่วโมงละ 5,000,000 ลูกบาศก์เมตรต่อชั่วโมง ทำให้ปริมาณน้ำสะสมอยู่ในอ่างเก็บน้ำของเขื่อนป่าสักชลสิทธิ์อยู่ที่ 1,014,000,000 ลูกบาศก์เมตรหรือคิดเป็น 105% ของความจุเขื่อนป่าสักทำให้ระดับการระบายน้ำ ลงสู่ท้ายเขื่อนป่าสักชลสิทธิ์วันนี้อยู่ที่ 1200 ลูกบาศก์เมตรต่อวินาที หรือวันละ 4 ล้านลูกบาร์ศเมตรต่อชั่วโมง ซึ่งทางเขื่อนจะยังไม่มีการเพิ่มการระบายน้ำลงสู่ท้ายเขื่อนไปมากกว่านี้ เพื่อลดความเดือดร้อนให้กับประชาชนเนื่องจาก ทางเขื่อนยังสามารถรองรับการเก็บกักน้ำในอ่างเก็บน้ำของเขื่อนได้อีกนิดหน่อยในระดับเก็บกักสูงสุดที่บวก 44 เมตร

แต่ปัจจุบันน้ำในอ่างอยู่ที่บวก 43.33 เมตรโดยระดับน้ำในอ่างยังต่ำกว่าสันเขื่อนอยู่อีก 3 เมตร ซึ่งก็น่าจะสามารถหน่วงน้ำไว้ได้อีกสักระยะ ซึ่งทางเขื่อนคาดว่า มวลน้ำจากวิเชียรบุรีจังหวัดเพชรบูรณ์และน้ำจากอำเภอชัยบาดาลจังหวัดลพบุรีเริ่มมีปริมาณลดลงซึ่งจะทำให้สถานการณ์น้ำที่ไหลลงเขื่อนมีปริมาณลดลงอย่างต่อเนื่องและจะทำให้ทางเขื่อนสามารถปรับลดการระบายน้ำลงสู่ท้ายเขื่อนได้ในเร็วเร็วนี้ - 003",https://www.naewna.com/local/605638,30_09_2021
ฮือฮา! คอหวยแห่ส่องเลข 'หัวหมู' เสี่ยงโชคตามความเชื่อ,"30 ก.ย.64 นายสินอานนท์เลื้อมใส อายุ66ปี ชาวบ้านฉลีก ต.ตรวจ อ.ศรีณรงค์ จ.สุรินทร์ เปิดเผยว่า งานวันนี้เกิดจากคณะกรรมการหมู่บ้านฉลีก ได้มีมติเปิดหมู่บ้านแห่งใหม่ ซึ่งแยกออกจากหมู่บ้านฉลีก โดยตั้งชื่อหมู่บ้านแห่งใหม่ชื่อว่า บ้านโพธิ์ทองและวันนี้ตนได้ปรึกษาคณะกรรมการและผู้นำว่าอย่ากจะทำบุญหมู่บ้านแห่งใหม่ เพราะหมู่บ้านเพิ่งจะได้ถนนคอนกรีต และไฟฟ้าเข้ามาทำให้ชาวบ้านในพื้นที่รู้สึกดีใจเป็นอย่างมาก และก็เป็นตามความเชื่อที่คนสมัยโบราณตั้งแต่รุ่นปู่ย่าตายายเคยบอกกล่าวเอาไว้ และสถานที่แห่งนี้ยังมีศาลปู่ตา อายะออง ที่ชาวบ้านเคารพนับถือตั้งแต่โบราณ ชาวบ้านเชื่อว่ามีความศักดิ์สิทธิ์ตนก็เคยได้โชคมาแล้ว

ผู้สื่อข่าวรายงานว่า แต่ที่สร้างความฮือฮาอย่างมากนั้น บรรดาคอหวยและชาวบ้านมุงดูหัวหมู และของเซ่นไหว้ที่อยู่หลังรถกระบะ จึงเข้าไปสอบถามชาวบ้านที่มุงดูเล่าว่า ตนเองมองเห็นตัวเลขที่อยู่บนหัวหมูมองเห็นเป็นตัวเลข421,85และยอดทำบุญได้ยอดเงินคือ4,695บาท และผู้สื่อข่าวก็สังเกตเห็นว่าตัวเลขที่ชาวบ้านเห็นนี้หมดเกลี้ยงแผงไปในพริบตา. -008",https://www.naewna.com/likesara/605642,30_09_2021
ปภ.4 นำเรือไซต์สแกนโซน่าค้นหาเรือจมที่กรุงเก่า,"เมื่อช่วงเช้าวันที่ 30 ก.ย.64 ที่ผ่านมา นายพิษณุ สัตะปัน หัวหน้ากลุ่มปฏิบัติงานใต้น้ำ เรือเอก ฐาพล สมสกุล ประจำสำนักงานประสานภารกิจด้านความมั่นคง กับ กอ.รมน. กองทัพเรือ ชวยราชการศูนย์ ปภ.เขต 4 ประจวบฯ กรมเจ้าท่า พร้อมเจ้าหน้าที่จากเจ้าท่าจังหวัดพระนครศรีอยุธยา เดินทางมาร่วมหารือและวางแผนในการนำเรือไซต์สแกนโซน่า ซึ่งเป็นเรื่อติดตั้งอุปกรณ์ระบบสำรวจใต้ท้องน้ำมาใช้สแกนหาซากเรือที่จมลงไปตั้งแต่เมื่อวันที่ผ่านมา ซึ่งเรือสแกนดังกล่าวจะสามารถมองเห็นวัตถุใต้น้ำหรือซากเรือที่จมอยู่ในรูปแบบของภาพ 3 มิติ และบอกถึงระดับความลึกในจุดที่พบได้

โดยนายพิษณุ เปิดเผยว่า บริเวณจุดเกิดเหตุขณะนี้เป็นช่วงน้ำวนและเป็นแยกน้ำส่งออกทั้งหมด จุดที่คาดว่าเรือจมลงน่าจะเป็นจุดที่น้ำวน ลึกไม่น้อยกว่า 20 เมตรจึงเป็นอุปสรรคต่อการลงไปค้นหาด้วยประดาน้ำ ซึ่งจากการประเมินคาดว่ากระแสน้ำด้านล่างอาจจะพัดร่างผู้ที่ติดอยู่ออกจากตัวเรือ หรืออาจจะติดอยู่จากแรงดันในห้องคนขับ อย่างไรก็ตาม หากพบซากเรือก็จะต้องรอให้น้ำนิ่งกว่านี้ จึงจะนำเรือขึ้นมาได้ - 003",https://www.naewna.com/local/605641,30_09_2021
ราชกิจจาฯ ประกาศขึ้นภาษีบุหรี่ มีผล 1 ต.ค.นี้,"เมื่อวันที่ 30 กันยายน 2564เว็บไซต์ราชกิจจานุเบกษาได้เผยแพร่ กฎกระทรวง กำหนดพิกัดอัตราภาษีสรรพสามิต (ฉบับที่ 17 ) พ.ศ.2564 อาศัยอำนาจตามความในมาตรา 5วรรคหนึ่ง แห่งพระราชบัญญัติภาษีสรรพสามิต พ.ศ.2560รัฐมนตรีว่าการกระทรวงการคลังออกกฎกระทรวงไว้ ดังต่อไปนี้ ข้อ 1กฎกระทรวงนี้ให้ใช้บังคับตั้งแต่วันที่ 1ตุลาคม 2564เป็นต้นไป ข้อ 2ให้ยกเลิกความใน (1) ในประเภทที่ 14.01ยาสูบ ตอนที่ 14สินค้ายาสูบ ตามบัญชีท้ายกฎกระทรวงกำหนดพิกัดอัตราภาษีสรรพสามิต พ.ศ.2560ซึ่งแก้ไขเพิ่มเติม โดยกฎกระทรวงกำหนดพิกัดอัตราภาษีสรรพสามิต (ฉบับที่ 12) พ.ศ.2563และให้ใช้ ความต่อไปนี้แทน

รายละเอียดดังต่อไปนี้







- 006",https://www.naewna.com/business/605645,30_09_2021
