title,summary,link,published
‘สลัม4ภาค’บุก‘พม.’ค้านจ่ายเบี้ยสูงวัยเฉพาะคนจน ย้ำต้องให้ถ้วนหน้า-ยกระดับเป็นบำนาญพื้นฐาน,"30 กันยายน 2564เครือข่ายสลัม 4 ภาค รวมตัวกันที่ กระทรวงการพัฒนาสังคมและความมั่นคงของมนุษย์ (พม.) โดยมีการอ่านแถลงการณ์ ระบุว่า ด้วยคณะกรรมการผู้สูงอายุแห่งชาติ ได้มอบหมายให้คณะอนุกรรมการกำหนดนโยบายผู้สูงอายุ (ใหม่) ศึกษาพิจารณา แนวทางการกำหนดนโยบายเบี้ยยังชีพผู้สูงอายุ เพื่อลดปัญหาการรับเงินซ้ำซ้อนจากสวัสดิการอื่นของรัฐ และดำเนินการตามข้อเสนอแนะของคณะกรรมการกฤษฎีกาที่ต้องการกำหนดเกณฑ์ การไม่มีรายได้เพียงพอแก่การยังชีพ ในการจ่ายเบี้ยยังชีพผู้สูงอายุนั้น

เครือข่ายสลัม 4 ภาค ในฐานะเครือข่ายภาคประชาชนที่ติดตามนโยบายสวัสดิการสังคมของภาครัฐ และตระหนักถึงความสำคัญในการพัฒนาบำนาญประชาชน มีข้อเสนอดังต่อไปนี้

1.ให้รัฐบาลยกระดับและพัฒนานโยบายเบี้ยยังชีพผู้สูงอายุเป็นระบบบำนาญประชาชน เพื่อเป็นหลักประกันรายได้พื้นฐานและเป็นสวัสดิการถ้วนหน้าพื้นฐานของประชาชนอายุ 60 ปี โดยใช้อัตราไม่ต่ำกว่าเส้นความยากจน ผู้สูงอายุจะมีความเสี่ยงน้อยจากการตกหล่นจากระบบคัดกรองความยากจน ประชาชนทุกคนเข้าถึงสวัสดิการที่รัฐจัดให้ ไม่ว่าจะรวยหรือจนทุกคนเป็นผู้จ่ายภาษี ต้องได้รับการกระจายทรัพยากรจากรัฐอย่างเท่าเทียม ไม่เกิดการเลือกปฏิบัติเฉพาะคนบางกลุ่ม

2.อัตราเบี้ยยังชีพผู้สูงอายุในปัจจุบัน ไม่สอดคล้องกับเกณฑ์รายได้ที่เพียงพอแก่การยังชีพ ต่ำกว่าเส้นความยากจน 3-5 เท่า จากข้อมูลเฉลี่ยทั่วประเทศ 2,763 บาทต่อคนต่อเดือน ปี 2562 และอัตราเบี้ยยังชีพผู้สูงอายุไม่มีการปรับขึ้นมานับตั้งแต่รัฐบาล น.ส.ยิ่งลักษณ์ ชินวัตร ในปี 2554

3.ให้คณะกรรมการผู้สูงอายุ นำร่าง พ.ร.บ.บำนาญแห่งชาติ พ.ศ. ... ฉบับประชาชนและผู้สูงอายุ และร่าง พ.ร.บ.บำนาญพื้นฐานแห่งชาติ (ฉบับที่..) พ.ศ. ... ของคณะกรรมาธิการสวัสดิการสังคม สภาผุ้แทนราษฎร มาพิจารณา เพื่อให้เกิดการพัฒนานโยบายเบี้ยยังชีพผู้สูงอายุเป็นกฎหมายบำนาญประชาชน

4.ให้คณะอนุกรรมการกำหนดนโยบายเบี้่ยยังชีพผู้สูงอายุ (ใหม่) ยกเลิกแนวทางการกำหนดการจ่ายเบี้ยยังชีพผู้สูงอายุแบบกำหนดกลุ่มเป้าหมาย ซึ่งมีแนวโน้มว่าจะให้จัดสรรเบี้ยยังชีพเฉพาะกลุ่มคนยากจน หรือพิจารณาจากเกณฑ์รายได้ขั้นต่ำ ผู้ที่ได้รับต้องแสดงตัวตนและรายได้ และประกาศรายชื่อให้สาธารณชนรับรู้ และ

5.ให้เปิดเผยการประชุมคณะกรรมการผู้สูงอายุแห่งชาติ แลพะคณะอนุกรรมการที่เกี่ยวข้อง ให้สาธารณชนได้ทราบ เพื่อให้ประชาชนในฐานะที่เป็นผู้มีส่วนได้ส่วนเสียโดยตรงกับนโยบายของภาครัฐ สามารถติดตามข้อมูลเชิงนโยบายได้เท่าทันสถานการณ์

ชมคลิปได้ที่นี่ : https://www.youtube.com/watch?v=d6x8tTd_xXE



ข่าวที่เกี่ยวข้อง

นายกฯย้ำเบี้ยผู้สูงอายุยังเหมือนเดิม กำชับพม.รักษาสิทธิผู้รับสิทธิเดิมไปจนเสียชีวิต

เทพไทแนะรัฐจัดงบเพิ่มเบี้ยยังชีพผู้สูงอายุ ดีกว่าแจกเงินโครงการประชานิยม",https://www.naewna.com/local/605626,30_09_2021
ดาบตำรวจเครียดคว้าปืนยิงตัวตายต่อหน้าเมีย,"เมื่อเวลา 08.00 น.วันที่ 30 ก.ย.64 ร.ต.อ.อดิศักดิ์ คชศักดิ์ ร้อยเวรสอบสวน สภ.คลองหลวง ได้รับแจ้งเหตุมีเจ้าหน้าที่ตำรวจยิงตัวตายภายในบ้านพักภายในซอยคลองหลวง 33 (ซอยเรืองผึ้ง) ต.คลองหนึ่ง อ.คลองหลวง จ.ปทุมธานี จึงไปที่เกิดเหตุพร้อมด้วย พ.ต.อ.เกียรติศักดิ์ มิตรปราสาท ผกก.สภ.คลองหลวง พ.ต.ต.สิรภพ บัวหลวง สว.สส.สภ.คลองหลวง เจ้าหน้าที่ตำรวจสายตรวจ เจ้าหน้าที่ตำรวจพิสูจน์หลักฐาน 1 แพทย์นิติเวชโรงพยาบาลธรรมศาสตร์ เฉลิมพระเกียรติ และเจ้าหน้าที่มูลนิธิป่อเต็กตึ๊ง

ที่เกิดเหตุเป็นอาคารพาณิชย์สูง 4ชั้น เลขที่ 95/4 บริเวณชั้นล่างพบผู้เสียชีวิตเป็นชาย 1 ราย ทราบชื่อด.ต.ศักดิ์สิทธิ์ อินทรสวัสดิ์ อายุ 53 ปี สังกัดผบ.หมู่ ฝอ.7บก.อก.บช.ก. สภาพศพสวมเสื้อยืดแขนสั้น สวมกางเกงขาสั้นที่ขมับด้านขวาถูกยิงด้วยอาวุธปืนขนาด 9 มม. จำนวน 1 นัด ปลายเท้าด้านซ้ายพบอาวุธปืนสั้นขนาด9 มม.ตกอยู่ 1 กระบอก เจ้าหน้าที่ตำรวจจึงเก็บไว้เป็นหลักฐาน

จากการสอบถามนายกลวัชร อินทรสวัสดิ์ อายุ 22 ปี ลูกชายคนโตบอกว่า พ่อมีเรื่องกับที่ทำงานและยิ่งโรคระบาดโควิดด้วยก็หวาดระแวงว่าจะตกงาน ซึ่งเจอพ่อครั้งสุดท้ายเมื่อวานนี้เมื่อเช้าตนเองก็ได้ยินเสียงปืน 1 นัดเพราะตนเองนอนอยู่ชั้นบนของบ้าน พ่อไม่เคยเล่าเรื่องส่วนตัวให้ฟังเลยมีแต่เล่าให้แม่ฟังเท่านั้น ส่วนนางเหรียญ เรืองผึ้ง อายุ 85 ปี แม่ยายผู้เสียชีวิตบอกว่าเมื่อเช้าตนก็นั่งใกล้กับผู้ตายซึ่งลูกเขยบอกว่าเครียดเพราะออกจากงาน แต่จริงๆแล้วงานก็ยังไม่ได้ออกหรอกซึ่งลูกเขยร่างกายไม่ค่อยแข็งแรงและลูกเขยก็เป็นตำรวจ

ด้านนางสุมาลี อินทรสวัสดิ์ อายุ 53 ปี ภรรยาผู้เสียชีวิตบอกว่า ซึ่งสามีกินเหล้าเยอะและเคยพาไปรักษาซึ่งเจ้านายเขาบอกว่าช่วงที่ฉีดวัคซีนกันแต่สามีฉีดวัคซีนไม่ได้ ขาอ่อนแรงและติดเหล้าซึ่งสามีก็เลิกเหล้าเด็ดขาดเพราะกลัวว่าจะไม่ได้ฉีดวัคซีนและไปลงทะเบียน จากนั้นผู้บังคับบัญชาให้พักรักษาตัว แต่สามีกลัวถูกไล่ออกตัวก่อนให้ดีขึ้นเสร็จแล้วค่อยไปฉีดวัคซีนและค่อยมาทำงาน โดยไม่ได้มีการหักเงินเดือนแม้แต่บาดเดียว ยังคงได้เงินเดือนทุกเดือน ซึ่งผู้ตายได้อยู่บ้านมาประมาณ 2 เดือนกว่า และมักพูดว่า ตนเองถูกไล่ออกแล้ว ไม่ได้ไปทำงานซักทีคงโดนไล่ออกแล้วแน่ๆ และวันพรุ่งนี้ตนก็จะพาผู้ตายไปหาหมอเพื่อรักษา แต่ก็ไม่ทัน

ด้านร.ต.อ.อดิศักดิ์ คชศักดิ์ ร้อยเวรสอบสวนสภ.คลองหลวง หลังจากตรวจสอบที่เกิดเหตุจึงบันทึกภาพไว้เป็นหลักฐานและได้ให้เจ้าหน้าที่มูลนิธิป่อเต็กตึ๊งนำผู้เสียชีวิตส่งนิติเวชโรงพยาบาลธรรมศาสตร์ เฉลิมพระเกียรติ เพื่อตรวจสอบอีกครั้ง. -008",https://www.naewna.com/local/605625,30_09_2021
น้ำในอ่างลำเชียงไกรลดฮวบเหลือ 24% จนท.เร่งนำเครื่องจักรปิดช่องโหว่ที่ชำรุด,"น้ำในอ่างเก็บน้ำลำเชียงไกร (ตอนล่าง) ลดฮวบเหลือน้ำเพียง 24% ชลประทานจังหวัดนครราชสีมาเร่งนำเครื่องจักรหนักปิดช่องโหว่ที่ชำรุด ขณะที่ทหารนำรถบรรทุกช่วยขนย้ายชาวบ้านผู้ประสบภัย

เช้าวันนี้ (30 ก.ย.64) ผู้สื่อข่าวรายงานปริมาณน้ำในอ่างเก็บน้ำลำเชียงไกร (ตอนล่าง) อำเภอโนนไทย จังหวัดนครราชสีมาว่า ขณะนี้ปริมาณน้ำเหนือสันอ่างได้ลดลงอย่างมากแล้วจนมองเห็นสันดินโผล่ขึ้นมาให้เห็นเป็นบางจุด ล่าสุดปริมาณน้ำลดลงเหลือน้ำในอ่างแค่ 6.8 ล้านลูกบาศก์เมตร หรือคิดเป็น 24% ของความจุอ่างทั้งหมด 27.7 ล้านลูกบาศก์เมตร โดยลดลงจากระดับน้ำที่เคยสูงสุดเมื่อวันที่ 27 ก.ย.ที่ผ่านมา ซึ่งมีปริมาณน้ำอยู่ที่ 45.4 ล้านลูกบาศก์เมตร หรือคิดเป็น 164%

โดยหลังจากช่วง 3 วันที่ผ่านมาที่คันดินของอ่างเกิดแตกชำรุดกว้างเป็นช่องโหว่ทำให้มีมวลน้ำมหาศาลมากกว่า 100 ล้านลูกบาศก์เมตรถูกระบายลงพื้นที่ด้านท้ายอ่างและส่งผลกระทบทำให้เกิดน้ำท่วมในพื้นที่อำเภอโนนไทย อำเภอโนนสูง และอำเภอพิมาย

ล่าสุดโครงการชลประทานจังหวัดนครราชสีมาได้นำเครื่องจักรหนัก ทั้งรถเครน รถบรรทุก และรถแบ็คโฮ เข้าไปดำเนินการเร่งซ่อมแซมจุดที่คันดินแตกชำรุดโดยบรรจุก้อนหินขนาดใหญ่ทำบิ๊กแบ็กนำไปวางอุดเสริมคันดินที่ชำรุด โดยเร่งทำงานตลอดทั้งวันทั้งคืนเพื่อดำเนินการให้แล้วเสร็จภายใน 7 วัน

ขณะเดียวกันทหารกองทัพภาคที่ 2 ได้นำรถบรรทุกยีเอ็มซีจำนวน 5 คันเข้าไปดำเนินการช่วยเหลือขนย้ายประชาชนผู้ประสบอุทกภัยน้ำท่วมพื้นที่อำเภอโนนสูง ซึ่งเป็นพื้นที่รับน้ำจากอ่างแก็บน้ำลำเชียงไกร และขณะนี้ระดับน้ำท่วมยังคงสูงอยู่กว่า 1 เมตร ชาวบ้านกว่า 100 หลังคาเรือนกำลังได้รับความเดือดร้อน",https://www.naewna.com/local/605624,30_09_2021
