title,summary,link,published
เกาหลีเหนือเผยทดสอบขีปนาวุธต่อต้านอากาศยานสำเร็จแล้ว,สำนักข่าวกลางเกาหลี (KCN) เปิดเผยวันนี้ว่า เกาหลีเหนือทดสอบยิงขีปนาวุธต่อต้านอากาศยานที่พัฒนาขึ้นใหม่เมื่อวานนี้ (30 ก.ย.) เพื่อยืนยันการใช้งานเครื่องยิงจรวดและอุปกรณ์อื่น ๆ ของระบบ สถาบันด้านศาสตร์การป้องกันประเทศ (Academy of Defense Science) ของเกาหลีหนือเผยว่า การทดสอบยิงขีปนาวุธซึ่งดำเนินมาเป็นครั้งที่ 4 ในเดือนก.ย. เป็นการแสดงถึงความคืบหน้าที่สำคัญยิ่งในด้านการศึกษาและพัฒนาระบบขีปนาวุธต่อต้านอากาศยานหลากหลายรูปแบบ อย่างไรก็ดี รายงานไม่ได้ระบุถึงสถานที่ทดสอบยิงขีปนาวุธและพิสัยในการยิง นายพลปัก จอง ชอน หัวหน้าเสนาธิการแห่งกองทัพประชาชนเกาหลีเหนือและผู้ช่วยคนสนิทของผู้นำเกาหลีเหนือได้เข้าร่วมสังเกตการณ์การทดสอบยิงขีปนาวุธในครั้งนี้ด้วย รายงานดังกล่าวมีขึ้นหลังจากที่นายคิม จอง อึน ผู้นำเกาหลีเหนือกล่าวสุนทรพจน์ในระหว่างการประชุมสภาประชาชนสูงสุด โดยระบุว่า การพัฒนาขีปนาวุธในเกาหลีเหนือดำเนินไปอย่างรวดเร็วมาก สำนักข่าวเกียวโดรายงานว่า นายคิมเคยกล่าวในที่ประชุมพรรคแรงงานแห่งเกาหลีเมื่อเดือนม.ค.ที่ผ่านมาว่า ตนเองต้องการเสริมความแข็งแกร่งให้กับกองทัพของประเทศ และเสริมสมรรถนะอาวุธนิวเคลียร์ พร้อมกับระบุว่า เกาหลีเหนือได้พัฒนาขีปนาวุธต่อต้านอากาศยานแล้ว โดย สำนักข่าวอินโฟเควสท์ (01 ต.ค. 64) The post เกาหลีเหนือเผยทดสอบขีปนาวุธต่อต้านอากาศยานสำเร็จแล้ว appeared first on สำนักข่าวอินโฟเควสท์.,https://www.infoquest.co.th/2021/131572,01_10_2021
ML ออกหุ้น 800 ลบ.ดอกเบี้ย 6.35% ขายสถาบัน-รายใหญ่ 18-20 ต.ค.,บมจ.ไมด้า ลิสซิ่ง (ML) ยื่นแบบแสดงรายการข้อมูลต่อสำนักงานคณะกรรมการกำกับหลักทรัพย์และตลาดหลักทรัพย์ (ก.ล.ต.) เพื่อออกและเสนอขายหุ้นกู้ของบริษัท ครั้งที่ 1/2564 มูลค่าไม่เกิน 800 ล้านบาท อายุ 1 ปี 6 เดือน ครบกำหนดไถ่ถอนปี 2566 มีอัตราดอกเบี้ยคงที่ร้อยละ 6.35 ต่อปี จ่ายดอกเบี้ยทุก 3 เดือนตลอดอายุหุ้นกู้ โดยเสนอขายให้แก่ผู้ลงทุนสถาบัน และ/หรือผู้ลงทุนรายใหญ่ ในวันที่ 18-20 ตุลาคม 2564 ผู้จัดการการจัดจำหน่ายหุ้นกู้ ได้แก่ บล.เอเซีย พลัส บล.กรุงไทย ซีมีโก้ บล.คันทรี่ กรุ๊ป บล.คิงส์ฟอร์ด บล.เคทีบีเอสที บล.เอเอสแอล และบล.บียอนด์ อันดับความน่าเชื่อถือของบริษัท อยู่ที่ “BB” แนวโน้มอันดับเครดิต “Negative” โดยบริษัท ทริสเรทติ้ง จำกัด เมื่อวันที่ 31 สิงหาคม 2564 บริษัทจะนำเงินที่ได้จากการเสนอขายหุ้นกู้ครั้งนี้ […] The post ML ออกหุ้น 800 ลบ.ดอกเบี้ย 6.35% ขายสถาบัน-รายใหญ่ 18-20 ต.ค. appeared first on สำนักข่าวอินโฟเควสท์.,https://www.infoquest.co.th/2021/131581,01_10_2021
"BAY, CIMBT พร้อมบริการชำระเงินผ่าน QR Code ระหว่างไทย-อินโดฯ ตั้งแต่ 1 ต.ค.","น.ส.สิริธิดา พนมวัน ณ อยุธยา ผู้ช่วยผู้ว่าการ สายนโยบายระบบการชำระเงินและเทคโนโลยีทางการเงิน ธนาคารแห่งประเทศไทย (ธปท.) เปิดเผยว่า ตามที่ ธปท. ร่วมกับธนาคารกลางอินโดนีเซีย (Bank Indonesia: BI) ได้เปิดตัวบริการชำระเงินระหว่างประเทศไทยและประเทศอินโดนีเซียด้วย QR Code มาตรฐาน เมื่อวันที่ 17 สิงหาคม 2564 ทำให้ลูกค้าและร้านค้าของทั้งสองประเทศ สามารถทำรายการชำระเงินและรับชำระเงินระหว่างกันได้แบบทันที โดยมีธนาคารกรุงเทพเริ่มให้บริการไปแล้ว นั้น ในวันนี้ มีธนาคารพาณิชย์ขยายการให้บริการเพิ่มอีก 2 ราย คือ ธนาคารกรุงศรีอยุธยา และธนาคารซีไอเอ็มบีไทย โดยลูกค้าสามารถใช้แอปพลิเคชันของ 2 ธนาคารดังกล่าว สแกน QR Code ชำระค่าสินค้าและบริการที่ร้านค้าในประเทศอินโดนีเซีย ได้ตั้งแต่วันที่ 1 ตุลาคม 2564 เป็นต้นไป “ต่อไปจะมีการเพิ่มจำนวนผู้ให้บริการมากขึ้น เพื่อรองรับการท่องเที่ยว ภายหลังสถานการณ์การแพร่ระบาดของเชื้อไวรัสโควิด 19 คลี่คลายลง รวมทั้งจะมีการต่อยอดไปสู่การให้บริการโอนเงินระหว่างสองประเทศแบบทันทีผ่านบริการพร้อมเพย์ โดยใช้เพียงหมายเลขโทรศัพท์มือถือของผู้รับเงินด้วย” น.ส.สิริธิดา ระบุ […] The post BAY, CIMBT พร้อมบริการชำระเงินผ่าน QR Code ระหว่างไทย-อินโดฯ ตั้งแต่ 1 ต.ค. appeared first on สำนักข่าวอินโฟเควสท์.",https://www.infoquest.co.th/2021/131575,01_10_2021
จีนเริ่มต้นหยุดยาว 7 วันเนื่องในวันชาติ ท่ามกลางวิกฤตพลังงานรุนแรง,จีนเริ่มต้นช่วงหยุดยาวเนื่องในวันชาติเป็นวันแรกในวันนี้ (1 ต.ค.) ขณะหลายพื้นที่ทั่วประเทศกำลังเผชิญกับปัญหาขาดแคลนไฟฟ้าอย่างหนัก โดยปธน.สี จิ้นผิงของจีน ได้สนับสนุนมาตรการควบคุมพลังงานเพื่อป้องกันปัญหาการเปลี่ยนแปลงของสภาพภูมิอากาศ ทั้งนี้ คาดการณ์กันว่าจะมีการเดินทางท่องเที่ยวมากกว่า 650 ล้านครั้งในจีนตลอดช่วงวันหยุดยาวนี้ เนื่องจากความกังวลเกี่ยวกับการระบาดของโรคโควิด-19 เริ่มผ่อนคลายลง อย่างไรก็ตาม ปัญหาที่น่าหวั่นวิตกเกี่ยวกับการขาดแคลนไฟฟ้าได้ทวีความรุนแรงขึ้นเรื่อย ๆ ซึ่งจะส่งผลกระทบอย่างหนักต่อเศรษฐกิจที่กำลังฟื้นตัว หนังสือพิมพ์โกลบอลไทม์ของพรรคคอมมิวนิสต์จีนรายงานว่า หลายภูมิภาคในประเทศจีนรวมถึงเขตเศรษฐกิจพิเศษเซินเจิ้นได้แนะนำขั้นตอนในการประหยัดพลังงานไฟฟ้าในช่วงเทศกาลวันหยุดยาวนี้ ซึ่งจะสิ้นสุดในวันพฤหัสบดีหน้า (7 ต.ค.) ปธน.สีประกาศว่า จีนตั้งเป้าจะปล่อยก๊าซคาร์บอนไดออกไซด์ (CO2) ในปริมาณสูงสุดก่อนถึงปี 2573 และจะบรรลุเป้าหมายในการสร้างสมดุลคาร์บอน (carbon neutrality) โดยจะลดการปล่อย CO2 ลงเป็นศูนย์ให้ได้ก่อนปี 2603 อย่างไรก็ตาม กฎระเบียบของรัฐบาลจีนเกี่ยวกับการใช้พลังงาน รวมถึงราคาถ่านหินที่พุ่งขึ้นนั้นได้บีบบังคับให้โรงงานหลายแห่งต้องระงับการดำเนินงาน ส่งผลให้ประสิทธิภาพการทำงานของบริษัทขนาดเล็กในประเทศลดลงตามไปด้วย ด้านองค์กรธุรกิจในจีนได้ออกมาเรียกร้องให้รัฐบาลที่ดำเนินมาตรการต่าง ๆ ที่จำเป็น เพื่อรักษาเสถียรภาพของราคาวัตถุดิบและจัดหาไฟฟ้าได้อย่างต่อเนื่อง โดย สำนักข่าวอินโฟเควสท์ (01 ต.ค. 64) The post จีนเริ่มต้นหยุดยาว 7 วันเนื่องในวันชาติ ท่ามกลางวิกฤตพลังงานรุนแรง appeared first on สำนักข่าวอินโฟเควสท์.,https://www.infoquest.co.th/2021/131560,01_10_2021
MICRO ออกหุ้นกู้ 1 พันลบ.ดอกเบี้ย 5.25 -5.50% ขายสถาบัน-รายใหญ่ 26-28 ต.ค.,"บมจ.ไมโครลิสซิ่ง (MICRO) ยื่นแบบแสดงรายการข้อมูลต่อสำนักงานคณะกรรมการกำกับหลักทรัพย์และตลาดหลักทรัพย์ (ก.ล.ต.) เพื่อออกและเสนอขายหุ้นกู้ของบริษัท ครั้งที่ 2/2564 จำนวน 2 ชุด รวมมูลค่าไม่เกิน 1,000 ล้านบาท ชุดที่ 1 เสนอขายไม่เกิน 1,000 ล้านบาท อายุ 2 ปี ครบกำหนดไถ่ถอนปี 2566 มีอัตราดอกเบี้ยคงที่ร้อยละ 5.25 ต่อปี ชุดที่ 2 เสนอขายไม่เกิน 1,000 ล้านบาท อายุ 3 ปี ครบกำหนดไถ่ถอนปี 2567 มีอัตราดอกเบี้ยคงที่ร้อยละ 5.50 ต่อปี หุ้นกู้ทั้ง 2 ชุดจะจ่ายดอกเบี้ยทุก 3 เดือนตลอดอายุหุ้นกู้ ทั้งนี้ บริษัทจะเสนอขายหุ้นกู้ดังกล่าวให้แก่ ผู้ลงทุนสถาบัน และ/หรือผู้ลงทุนรายใหญ่ ในระหว่างวันที่ 26-28 ตุลาคม 2564 ผ่านบล.เอเซีย พลัส บล.กรุงไทย […] The post MICRO ออกหุ้นกู้ 1 พันลบ.ดอกเบี้ย 5.25 -5.50% ขายสถาบัน-รายใหญ่ 26-28 ต.ค. appeared first on สำนักข่าวอินโฟเควสท์.",https://www.infoquest.co.th/2021/131595,01_10_2021
ตลาดหุ้นยุโรปเปิดลบหลังนักลงทุนเทขาย เหตุกังวลเศรษฐกิจโลกชะลอตัว,"หุ้นยุโรปเปิดตลาดปรับตัวลงแตะระดับต่ำที่สุดในรอบ 2 เดือน หลังนักลงทุนเทขายหุ้น เนื่องจากมีความวิตกกังวลเกี่ยวกับสภาพเศรษฐกิจโลกที่ชะลอตัวลง รวมถึงเงินเฟ้อที่พุ่งสูงขึ้น โดยหุ้นกลุ่มท่องเที่ยวและสันทนาการ, ธนาคาร และยานยนต์ดิ่งลงฉุดตลาด ดัชนี STOXX 600 เปิดที่ระดับ 451.73 จุด ลดลง 3.08 จุด หรือ -0.68% ดัชนี DAX ตลาดหุ้นเยอรมนีเปิดตลาดวันนี้ที่ 15,041.60 จุด ลดลง 219.09 จุด หรือ -1.44% และ ดัชนี CAC-40 ตลาดหุ้นฝรั่งเศสเปิดตลาดวันนี้ที่ 6,421.10 จุด ลดลง 98.91 จุด หรือ -1.52% โดย สำนักข่าวอินโฟเควสท์ (01 ต.ค. 64) The post ตลาดหุ้นยุโรปเปิดลบหลังนักลงทุนเทขาย เหตุกังวลเศรษฐกิจโลกชะลอตัว appeared first on สำนักข่าวอินโฟเควสท์.",https://www.infoquest.co.th/2021/131590,01_10_2021
ที่ปรึกษาไบเดนเจรจาซาอุฯ หวังสกัดราคาน้ำมันพุ่ง-ฟื้นฟูเศรษฐกิจโลก,"ทำเนียบขาวแถลงว่า ที่ปรึกษาอาวุโสของประธานาธิบดีโจ ไบเดน ได้หยิบยกประเด็นราคาน้ำมันขึ้นมาหารือในการเจรจากับผู้นำของซาอุดีอาระเบียซึ่งเป็นผู้ผลิตน้ำมันรายใหญ่ในสัปดาห์นี้ นายเจค ซัลลิแวน ที่ปรึกษาด้านความมั่นคงแห่งชาติของปธน.ไบเดน ได้เข้าพบกับเจ้าชายโมฮัมเหม็ด บิน ซัลมาน มกุฎราชกุมารของซาอุดีอาระเบียเมื่อวันอังคารที่ผ่านมา (28 ก.ย.) เพื่อหารือเกี่ยวกับสงครามในเยเมน แต่นางเจน ซากี โฆษกทำเนียบขาวกล่าวว่า เรื่องน้ำมันยังคงเป็น “ข้อกังวล” และอยู่ในวาระการประชุมด้วย “ทีมที่ปรึกษาด้านความมั่นคงแห่งชาติย้ำถึงความจำเป็นในการสร้างเงื่อนไขเพื่อรองรับการฟื้นตัวของเศรษฐกิจโลกในการประชุมเมื่อต้นสัปดาห์นี้” นางซากีกล่าวเมื่อวานนี้ (30 ก.ย.) ก่อนหน้านี้ ฝ่ายบริหารของปธน.ไบเดนเปิดเผยว่าเงื่อนไขดังกล่าวจะรวมถึงการมีน้ำมันในตลาดมากขึ้นเพื่อสกัดราคาพลังงานที่กำลังพุ่งขึ้นและช่วยให้เกิดการฟื้นตัวทางเศรษฐกิจจากผลกระทบของโรคโควิด-19 “สหรัฐยังคงเจรจากับชาติพันธมิตร รวมถึงโอเปกเกี่ยวกับความสำคัญของการให้ตลาดที่มีการแข่งขันกันสามารถกำหนดราคาพลังงาน และต้องดำเนินการมากขึ้นเพื่อสนับสนุนการฟื้นตัวของเศรษฐกิจ” นางซากีกล่าว ในการประชุมวันจันทร์ (4 ต.ค.) กลุ่มประเทศผู้ส่งออกน้ำมันและชาติพันธมิตรรวมถึงรัสเซีย หรือโอเปกพลัส คาดว่าจะยึดตามข้อตกลงในสัปดาห์หน้าในการเพิ่มกำลังการผลิตน้ำมัน 400,000 บาร์เรล/วันในเดือนพ.ย. โดย สำนักข่าวอินโฟเควสท์ (01 ต.ค. 64) The post ที่ปรึกษาไบเดนเจรจาซาอุฯ หวังสกัดราคาน้ำมันพุ่ง-ฟื้นฟูเศรษฐกิจโลก appeared first on สำนักข่าวอินโฟเควสท์.",https://www.infoquest.co.th/2021/131586,01_10_2021
SA ออกหุ้นกู้ 400 ลบ.ดอกเบี้ย 6.80% ขายสถาบัน-รายใหญ่ 26-28 ต.ค.,"บมจ.ไซมิส แอสเสท (SA) ยื่นแบบแสดงรายการข้อมูลต่อสำนักงานคณะกรรมการกำกับหลักทรัพย์และตลาดหลักทรัพย์ (ก.ล.ต.) เพื่อออกและเสนอขายหุ้นกู้ของบริษัท ครั้งที่ 4/2564 มูลค่าไม่เกิน 400 ล้านบาท อายุ 2 ปี ครบกำหนดไถ่ถอนปี 2566 มีอัตราดอกเบี้ยคงที่ร้อยละ 6.80 ต่อปี ชำระดอกเบี้ยทุก 3 เดือนตลอดอายุหุ้นกู้ ทั้งนี้ บริษัทมีสิทธิไถ่ถอนเงินต้นหุ้นกู้ทั้งจำนวน หรือบางส่วน บริษัทเสนอขายหุ้นกู้ดังกล่าวให้แก่ผู้ลงทุนสถาบัน และ/หรือ ผู้ลงทุนรายใหญ่ ในวันที่ 26-28 ตุลาคม 2564 มีบล.หยวนต้า (ประเทศไทย) และบล.เคทีบีเอสที เป็นผู้จัดการการจัดจำหน่ายหุ้นกู้ บริษัท ทริสเรทติ้ง จำกัด จัดอันดับเครดิตหุ้นกู้ที่ “BB+” แนวโน้มอันดับเครดิต “Stable” เมื่อวันที่ 27 กรกฎาคม 2564 บริษัทมีวัตถุประสงค์จะนำเงินที่ได้จากการเสนอขายหุ้นกู้ครั้งนี้ ไปชำระคืนหุ้นกู้ที่ครบกำหนด จำนวน 85 ล้านบาท ,ใช้พัฒนาโครงการอสังหาริมทรัพย์ จำนวน 250 […] The post SA ออกหุ้นกู้ 400 ลบ.ดอกเบี้ย 6.80% ขายสถาบัน-รายใหญ่ 26-28 ต.ค. appeared first on สำนักข่าวอินโฟเควสท์.",https://www.infoquest.co.th/2021/131610,01_10_2021
