title,summary,link,published
ฝ่ายค้านเตรียมเปิดอภิปรายไม่ไว้วางใจรมต.รายบุคคลแบบไม่ลงมติในสมัยประชุมหน้า,นายจิรายุ ห่วงทรัพย์ ส.ส.กทม. พรรคเพื่อไทย (พท.) กล่าวถึงการอภิปรายไม่ไว้วางใจรัฐมนตรีเป็นรายบุคคล แบบไม่ลงมติ มาตรา 152 ในสมัยประชุมหน้า ว่า เนื่องจากการอภิปรายไม่ไว้วางใจที่ผ่านมารัฐบาล ไม่ได้แก้ไขอะไรนอกจากแก้ต่าง พูดเอาดีใส่ตัวแล้วโยนให้ข้าราชการประจำบ้าง ซึ่งในส่วนของตน โดยเฉพาะ 2 กระทรวงที่ได้อภิปรายไป คือ กระทรวงพัฒนาสังคมและความมั่งคงของมนุษย์ (พม.) และกระทรวงทรัพยากรธรรมชาติและสิ่งแวดล้อมนั้น ซึ่งได้ทำหนังสือเชิญหน่วยงานที่เกี่ยวข้องมาชี้แจงแล้วถึง 3 ครั้ง แต่ก็ไม่ได้รับความร่วมมือ “จะรอถึงวันที่ 5 ตุลาคม ซึ่งได้ส่งหนังสือถึงนายวราวุธ ศิลปอาชา ส.ส.บัญชีรายชื่อ พรรคชาติไทยพัฒนา (ชทพ.) ในฐานะรัฐมนตรีว่าการกระทรวงทรัพย์ฯ และหน่วยงานต่างๆ ที่เกี่ยวข้องเป็นครั้งที่ 3 ซึ่งหาก 3 ครั้งไม่มา ก็ขออนุญาตใช้อำนาจหน้าที่ตามกฎหมายของฝ่ายนิติบัญญัติ เนื่องจากเป็นเรื่องสาธารณะ และเป็นเรื่องที่ประชาชนสนใจ ฉะนั้นทั้งหมดที่เราทำงานกันช่วงปิดสมัยประชุมจะนำไปสู่การเปิดอภิปรายไม่ไว้วางใจแบบไม่ลงมติ ในสมัยประชุมหน้า” นายจิรายุ กล่าว ดังนั้น จึงขอฝากไปยังส่วนราชการว่า อย่าคิดว่ากรณีที่นายไพบูลย์ นิติตะวัน ส.ส.บัญชีรายชื่อ และรองหัวหน้าพรรคพลังประชารัฐ (พปชร.) […] The post ฝ่ายค้านเตรียมเปิดอภิปรายไม่ไว้วางใจรมต.รายบุคคลแบบไม่ลงมติในสมัยประชุมหน้า appeared first on สำนักข่าวอินโฟเควสท์.,https://www.infoquest.co.th/2021/131542,01_10_2021
AQ แจกวอร์แรนต์ ผถห.เดิม 2:1 เผยกำลังศึกษาโครงการพลังงาน-ธุรกิจอื่น,"บมจ.เอคิว เอสเตท (AQ) เปิดเผยว่า ที่ประชุมคณะกรรมการบริษัทครั้งที่ 6/2564 เมื่อวันที่ 30 ก.ย.2564 มีมติให้ลดทุนจดทะเบียนของบริษัทฯ จำนวน 104,343,606,929.50 บาท จาก 147,006.012,651.50 บาท เป็น 42,662,405,722 บาท โดยตัดหุ้นสามัญที่ยังไม่ได้ออกจำหน่ายจำนวน 208,687,213,859 หุ้น มูลค่าที่ตราไว้หุ้นละ 0.50 บาท จากนั้นให้เพิ่มทุนจดทะเบียน จำนวน 38,396,165,150 บาท เป็น 81,058,570,872 บาท โดยการออกหุ้นสามัญเพิ่มทุนจำนวน 76,792,330,300 หุ้น มูลค่าหุ้นที่ตราไว้หุ้นละ 0.50 บาท เพื่อรองรับการใช้สิทธิของผู้ถือใบสำคัญแสดงสิทธิที่จะซื้อหุ้นสามัญของบริษัทฯ ครั้งที่ 5 (AQ-W5) และรองรับการออกและเสนอขายหุ้นสามัญเพิ่มทุนแบบมอบอำนาจทั่วไป (General Mandate) สำหรับ AQ-W5 จำนวนไม่เกิน 42,662,405,722 หน่วย จะจัดสรรให้แก่ผู้ถือหุ้นเดิมตามสัดส่วนการถือหุ้นโดยไม่คิดมูลค่า สัดส่วน 2 หุ้นเดิมต่อ 1 […] The post AQ แจกวอร์แรนต์ ผถห.เดิม 2:1 เผยกำลังศึกษาโครงการพลังงาน-ธุรกิจอื่น appeared first on สำนักข่าวอินโฟเควสท์.",https://www.infoquest.co.th/2021/131537,01_10_2021
ที่ปรึกษานายกฯ ปัดข่าวเตรียมห้องทำงานตึกบัญชาการ 1 รองรับปรับ ครม.ใหม่,ตามที่มีรายงานข่าวว่า เจ้าหน้าที่ได้มีการสำรวจห้องต่างๆ ภายในตึกบัญชาการ 1 ทำเนียบรัฐบาล โดยมีรายงานว่า พล.อ.ประยุทธ์ จันทร์โอชา นายกรัฐมนตรี และ รมว.กลาโหม สั่งการให้นายประทีป กีรติเรขา รองเลขาธิการนายกรัฐมนตรี ฝ่ายการเมืองจัดเตรียมห้องบนตึกบัญชาการ 1 เพื่อรองรับบุคคลที่จะมาดำรงตำแหน่งรองนายกรัฐมนตรี หลังจากที่มีตำแหน่งรัฐมนตรีช่วยว่าการ ว่าง 2 ตำแหน่งนั้น ล่าสุด น.ส.นัทรียา ทวีวงศ์ ผู้อำนวยการสำนักโฆษก สำนักเลขาธิการนายกรัฐมนตรี และที่ปรึกษานายกรัฐมนตรี ฝ่ายข้าราชการประจำด้านประสานกิจการภายในประเทศ ชี้แจงกรณีดังกล่าวว่า เนื่องจากวันที่ 30 กันยายนที่ผ่านมา มีผู้เกษียณอายุราชการ และมีการเปลี่ยนย้ายตำแหน่ง ผู้รับผิดชอบด้านสถานที่จึงต้องเข้าทำความสะอาดห้องที่ย้ายออกไป และสำหรับผู้ที่ได้รับการแต่งตั้งเข้ามาใหม่ เช่น ที่ปรึกษานายกรัฐมนตรี ตามการหมุนเวียนปกติ ทั้งนี้ ไม่ได้รับแจ้งให้ทำการจัดเตรียมรองรับการปรับคณะรัฐมนตรีแต่อย่างใด โดย สำนักข่าวอินโฟเควสท์ (01 ต.ค. 64) The post ที่ปรึกษานายกฯ ปัดข่าวเตรียมห้องทำงานตึกบัญชาการ 1 รองรับปรับ ครม.ใหม่ appeared first on สำนักข่าวอินโฟเควสท์.,https://www.infoquest.co.th/2021/131530,01_10_2021
IEA มั่นใจจีนเปลี่ยนผ่านสู่การใช้พลังงานสะอาดเอื้อประโยชน์ต่อทั่วโลก,นายฟาตีห์ ไบรอล ผู้อำนวยการบริหารของสำนักงานพลังงานสากล (IEA) ได้แสดงมุมมองที่เป็นบวกว่า การที่จีนเปลี่ยนผ่านไปสู่การใช้พลังงานสะอาดนั้น จะนำประโยชน์มาสู่สังคมและเศรษฐกิจ และจะช่วยสนับสนุนความพยายามของประเทศทั่วโลกในการลดโลกร้อน “การที่จีนตัดสินใจใช้มาตรการรับมือกับปัญหาโลกร้อนนั้น ไม่ได้มีผลกระทบด้านบวกต่อจีนเท่านั้น แต่ยังรวมถึงทุกประเทศทั่วโลกด้วย” นายไบรอลกล่าวให้สัมภาษณ์กับสำนักข่าวซินหัวหลังจากที่ IEA เปิดเผยรายงานฉบับใหม่เมื่อวันพุธที่ผ่านมา ทั้งนี้ IEA เผยแพร่รายงานหัวข้อ “An Energy Sector Roadmap to Carbon Neutrality in China” เพื่อทำการสำรวจแนวทางที่จีนจะสามารถบรรลุเป้าหมายในการลดการปล่อยก๊าซคาร์บอนลงเหลือศูนย์ ควบคู่ไปกับการสร้างความมั่นคงด้านพลังงาน และช่วยเหลือประชาชนให้มีพลังงานใช้อย่างเพียงพอ “โรดแมปนี้แสดงให้เห็นถึงความเป็นไปได้ที่ว่า จีนสามารถปูทางไปสู่การสร้างอนาคตด้านพลังงานที่มีความยั่งยืน มั่นคง และครอบคลุมมากขึ้น เรามองว่าจีนเป็นโรงไฟฟ้าพลังงานสะอาดและมีบทบาทเป็นผู้นำในความสำเร็จของโลก ตั้งแต่พลังงานแสงอาทิตย์ไปจนถึงรถยนต์ไฟฟ้า” ผู้อำนวยการ IEA กล่าว รายงานของ IEA ระบุว่า ภาคพลังงานเป็นหนึ่งในแหล่งสำคัญของการปล่อยก๊าซเรือนกระจกของจีน ซึ่งทำให้นโยบายด้านพลังงานได้กลายมาเป็นหัวใจสำคัญของการเปลี่ยนผ่านไปสู่การลดคาร์บอนลงเหลือศูนย์ โดยจีนตั้งเป้าว่าจะปล่อยก๊าซคาร์บอนไดอ็อกไซด์ในปริมาณสูงสุดก่อนถึงปี 2573 และจะบรรลุเป้าหมายในการสร้างสมดุลคาร์บอน (carbon neutrality) โดยจะลดการปล่อย CO2 ลงเป็นศูนย์ให้ได้ก่อนปี 2603 “เป้าหมายดังกล่าวจะสร้างโอกาสครั้งใหญ่ในตลาดพลังงานของจีน อีกทั้งจะทำให้การใช้เชื้อเพลิงฟอสซิลลดลง และส่งเสริมเทคโนโลยีพลังงานสะอาดให้ขยายตัวอย่างแข็งแกร่ง” […] The post IEA มั่นใจจีนเปลี่ยนผ่านสู่การใช้พลังงานสะอาดเอื้อประโยชน์ต่อทั่วโลก appeared first on สำนักข่าวอินโฟเควสท์.,https://www.infoquest.co.th/2021/131528,01_10_2021
ญี่ปุ่นเผยอัตราว่างงานเดือนส.ค.เพิ่มขึ้นในรอบ 4 เดือน เหตุประกาศภาวะฉุกเฉินคุมโควิด,รัฐบาลญี่ปุ่นเปิดเผยในวันนี้ว่า อัตราการว่างงานของญี่ปุ่นในเดือนส.ค. เพิ่มขึ้นเป็นครั้งแรกในรอบ 4 เดือน เนื่องจากรัฐบาลขยายการประกาศภาวะฉุกเฉินเพื่อป้องกันโควิด-19 ข้อมูลจากกระทรวงสาธารณสุข แรงงาน และสวัสดิการของญี่ปุ่นระบุว่า สัดส่วนตำแหน่งงานว่างต่อผู้สมัครงานในเดือนส.ค. ลดลงมาอยู่ที่ 1.14 จุด จากระดับ 1.15 จุดในเดือนก.ค. โดยตัวเลขดังกล่าวหมายความว่า มีตำแหน่งงานว่าง 114 อัตราสำหรับผู้หางานทุก ๆ 100 คน ขณะที่ข้อมูลจากกระทรวงกิจการภายในและการสื่อสารเผยว่า อัตราการว่างงานในเดือนส.ค.นั้นยังคงทรงตัวอยู่ในระดับเดียวกับเดือนก.ค. โดยอยู่ที่ 2.8% ซึ่งลดลงจากระดับของเดือนมิ.ย. 0.1% สำนักข่าวเกียวโดรายงานว่า ญี่ปุ่นได้ประกาศภาวะฉุกเฉินเพื่อควบคุมโควิด-19 ในพื้นที่กรุงโตเกียวเมื่อช่วงกลางเดือนก.ค. และจังหวะโอกินาวะเมื่อปลายเดือนพ.ค.ที่ผ่านมา โดยมาตรการดังกล่าวได้บังคับใช้ตลอดเดือนส.ค.ที่ผ่านมา การประกาศภาวะฉุกเฉินส่งผลให้การบริโภคลดลงและส่งผลกระทบอย่างรุนแรงต่อเศรษฐกิจ เนื่องจากรัฐบาลได้ขอความร่วมมือให้ประชาชนงดออกนอกบ้านโดยไม่มีเหตุอันจำเป็น รวมถึงได้ขอให้ร้านอาหารและผับบาร์งดจำหน่ายเครื่องดื่มแอลกอฮอล์และปิดก่อนเวลา 20.00 น. โดย สำนักข่าวอินโฟเควสท์ (01 ต.ค. 64) The post ญี่ปุ่นเผยอัตราว่างงานเดือนส.ค.เพิ่มขึ้นในรอบ 4 เดือน เหตุประกาศภาวะฉุกเฉินคุมโควิด appeared first on สำนักข่าวอินโฟเควสท์.,https://www.infoquest.co.th/2021/131523,01_10_2021
"ศบค.เผยยอดฉีดวัคซีน 30 ก.ย.64 เพิ่มขึ้น 2,288,728 โดส","ศูนย์บริหารสถานการณ์โควิด-19 (ศบค.) รายงานยอดการฉีดวัคซีนโควิด-19 ให้แก่ประชาชนในวันที่ 30 ก.ย.64 เวลา 18.00 น. มีจำนวนผู้ได้รับวัคซีน 2,288,728 โดส รายละเอียดดังนี้ สำหรับเป้าหมายการฉีดวัคซีนในเดือนต.ค. 64 – ครอบคลุมประชากรทั้งหมด (ไทยและต่างด้าว) อย่างน้อย 50% ทุกจังหวัดอย่างน้อย 1 อำเภอ มีความครอบคลุม 70% มีต้นแบบ COVID free Area อย่างน้อย 1 พื้นที่ซึ่งมีความครอบคลุม 80% – เพิ่มความครอบคลุมอย่างน้อย 80% ในกลุ่มสูงอายุ,ผู้มีโรคเรื้อรัง 7 กลุ่มโรค และหญิงมีครรภ์ – ความครอบคลุมของกลุ่มนักเรียน/นักศึกษาชั้นมัธยมหรือเทียบเท่า ได้รับวัคซีนเข็มที่ 1 อย่างน้อย 70% โดย สำนักข่าวอินโฟเควสท์ (01 ต.ค. 64) The post ศบค.เผยยอดฉีดวัคซีน 30 ก.ย.64 เพิ่มขึ้น 2,288,728 โดส appeared first on สำนักข่าวอินโฟเควสท์.",https://www.infoquest.co.th/2021/131519,01_10_2021
เกาหลีใต้จ่อขยายมาตรการเว้นระยะห่างอีก 2 สัปดาห์ รับมือผู้ติดเชื้อเพิ่ม,รัฐบาลเกาหลีใต้จะขยายเวลาบังคับใช้มาตรการเว้นระยะห่างทางสังคมต่อไปอีก 2 สัปดาห์ ขณะที่ประเทศเตรียมพร้อมรับมือกับยอดผู้ติดเชื้อโควิด-19 รายใหม่ที่มีแนวโน้มเพิ่มขึ้นหลังวันหยุดยาวสุดสัปดาห์นี้และสุดสัปดาห์หน้า นายคิม บู-คยอม นายกรัฐมนตรีเกาหลีใต้กล่าวในระหว่างการประชุมกับหน่วยงานต่างๆ เกี่ยวกับการรับมือโรคระบาดว่า ภายใต้แผนการดังกล่าวที่จะมีผลบังคับใช้ในวันจันทร์ (4 ต.ค) เกาหลีใต้จะยังคงบังคับใช้มาตรการจำกัดระดับ 4 ที่เข้มงวดที่สุดในกรุงโซล และมาตรการจำกัดระดับ 3 ในพื้นที่อื่นๆ ของประเทศ ร้านอาหารและคาเฟ่ในพื้นที่กรุงโซลจะสามารถเปิดให้บริการจนถึงเวลา 22:00 น. และอนุญาตให้ประชาชนรวมตัวไม่เกิน 6 คน หลังเวลา 18.00 น. หาก 4 ใน 6 คนได้รับการฉีดวัคซีนครบโดสแล้ว อย่างไรก็ตาม นายคิมระบุเสริมว่า กฎเกณฑ์สำหรับงานแต่งงาน งานวันเกิดปีแรก และสถานบริการด้านกีฬากลางแจ้งจะถูกปรับเปลี่ยนบางส่วนโดยอิงกับบุคคลที่ได้รับการฉีดวัคซีนครบโดสแล้ว ท่ามกลางการร้องเรียนอย่างต่อเนื่องเกี่ยวกับข้อจำกัดด้านการรวมตัว โดย สำนักข่าวอินโฟเควสท์ (01 ต.ค. 64) The post เกาหลีใต้จ่อขยายมาตรการเว้นระยะห่างอีก 2 สัปดาห์ รับมือผู้ติดเชื้อเพิ่ม appeared first on สำนักข่าวอินโฟเควสท์.,https://www.infoquest.co.th/2021/131516,01_10_2021
META ทุ่ม 205.70 ลบ.ซื้อ Pico เงินด่วน รุกธุรกิจพิโกไฟแนนซ์-พัฒนาสู่ Fintech,"บมจ.เมตะ คอร์ปอเรชั่น จำกัด (META) เปิดเผยว่า คณะกรรมการบริหารอนุมัติให้บริษัท โนว่า เอเชีย จำกัด ซึ่งเป็นบริษัทย่อยเข้าซื้อหุ้น บริษัท พิโก โซลูชั่นส์ (ไทยแลนด์) จำกัด จำนวน 850,000 หุ้น หรือ 85% ที่ราคาหุ้นละ 242 บาท มูลค่าเงินลงทุนรวม 205,700,000 บาท ตามนโยบายดำเนินธุรกิจด้านการเงิน เสริมความแข็งแกร่งให้ผลประกอบการของบริษัท โดยได้ลงนามในสัญญาซื้อขายหุ้นในวันนี้ สำหรับบริษัท พิโก โซลูชั่นส์ (ไทยแลนด์) จำกัด เป็นเจ้าของและผู้ให้บริการธุรกิจพิโกไฟแนนซ์ (PICO Finance) ในชื่อ “Pico เงินด่วน” ให้บริการปล่อยสินเชื่อรายบุคคลแบบไม่มีหลักประกัน ได้รับการสนับสนุนจากภาครัฐเพราะเป็นการช่วยแก้ไขปัญหาหนี้นอกระบบ ยิ่งในสภาพเศรษฐกิจปัจจุบันที่ส่งผลกระทบต่อสภาพคล่องทางการเงิน บริการ “Pico เงินด่วน” ที่สามารถเข้าถึงได้ง่าย จึงเป็นธุรกิจทางเลือกที่อยู่ในอันดับต้นๆของคนที่สนใจขอสินเชื่อ นายศุภศิษฏ์ โภคินจารุรัศมิ์ ประธานกรรมการบริหาร META กล่าวว่า บริษัทมีนโยบายขยายสู่ธุรกิจที่มีความหลากหลาย เพื่อลดความเสี่ยงจากการดำเนินธุรกิจเพียงประเภทเดียว […] The post META ทุ่ม 205.70 ลบ.ซื้อ Pico เงินด่วน รุกธุรกิจพิโกไฟแนนซ์-พัฒนาสู่ Fintech appeared first on สำนักข่าวอินโฟเควสท์.",https://www.infoquest.co.th/2021/131513,01_10_2021
