title,summary,link,published
“เกรต้า ธุนเบิร์ก” จ่อเป็นตัวเต็งชิงรางวัลโนเบลสาขาสันติภาพปีนี้,บรรดาผู้ติดตามความเคลื่อนไหวของรางวัลโนเบลสาขาสันติภาพต่างแสดงความคิดเห็นว่า ผู้ที่คว้ารางวัลโนเบลในปีนี้อาจเป็นเกรต้า ธุนเบิร์ก นักเคลื่อนไหวด้านสิ่งแวดล้อมวัย 18 ปี โดยแม้ว่าที่ผ่านมา ผู้ชนะรางวัลโนเบลสาขาสันติภาพมักเป็นผู้ที่ไม่มีใครคาดคิด แต่เหล่าผู้ติดตามผลรางวัลโนเบลอย่างใกล้ชิดระบุว่า วิธีในการคาดเดาชื่อผู้ชนะที่ดีที่สุดก็คือการพิจารณาถึงประเด็นระดับโลกที่สมาชิกทั้ง 5 รายของคณะกรรมการโนเบลให้ความสนใจ การประกาศชื่อผู้ชนะรางวัลโนเบลสาขาสันติภาพ จะมีขึ้นในช่วง 3 สัปดาห์ก่อนการประชุมสหประชาชาติ (UN) ว่าด้วยการเปลี่ยนแปลงสภาพภูมิอากาศครั้งที่ 26 (COP26) ซึ่งจะมีผู้นำประเทศต่าง ๆ เข้าร่วม และเป็นการประชุมที่มีนักวิทยาศาสตร์จำนวนมากมองว่า อาจกำหนดอนาคตของสิ่งแวดล้อมโลก เนื่องจากการประชุม COP26 ครั้งนี้ ซึ่งมีอิตาลีเป็นเจ้าภาพร่วมกับอังกฤษ จะจัดขึ้นตั้งแต่วันที่ 31 ต.ค. ถึง 12 พ.ย. ในเมืองกลาสโกว์ จึงมีหลายฝ่ายคาดว่า ประเด็นการเปลี่ยนแปลงของสภาพภูมิอากาศ น่าจะเป็นประเด็นที่ได้รับความสนใจอย่างมาก โดยนักวิทยาศาสตร์หลายรายกล่าวว่า การประชุมครั้งนี้เป็นโอกาสสุดท้ายในการตั้งเป้าหมายอย่างจริงจัง เพื่อลดระดับการปล่อยก๊าซเรือนกระจกในช่วง 10 ปีข้างหน้า ซึ่งสำคัญอย่างยิ่งยวดในการรักษาอุณหภูมิทั่วโลกให้เพิ่มขึ้นน้อยกว่า 1.5 องศาเซลเซียส เพื่อป้องกันไม่ให้เกิดภัยพิบัติครั้งใหญ่ ทั้งนี้ หากเกรต้า ธุนเบิร์กได้รับรางวัลโนเบลสาขาสันติภาพ ก็จะทำให้เธอเป็นเจ้าของรางวัลโนเบลที่อายุน้อยเป็นอันดับ 2 ในประวัติศาสตร์ ต่อจาก […] The post “เกรต้า ธุนเบิร์ก” จ่อเป็นตัวเต็งชิงรางวัลโนเบลสาขาสันติภาพปีนี้ appeared first on สำนักข่าวอินโฟเควสท์.,https://www.infoquest.co.th/2021/131618,01_10_2021
SST ออกหุ้นกู้ 250 ลบ.ดอกเบี้ย 5.75% ขายสถาบัน-รายใหญ่ 26-28 ต.ค.,บมจ.ทรัพย์ศรีไทย (SST) ยื่นแบบแสดงรายการข้อมูลต่อสำนักงานคณะกรรมการกำกับหลักทรัพย์และตลาดหลักทรัพย์ (ก.ล.ต.) เพื่อออกและเสนอขายหุ้นกู้ของบริษัท ครั้งที่ 1/2564 มูลค่าไม่เกิน 250 ล้านบาท อายุ 2 ปี 9 เดือน ครบกำหนดไถ่ถอนปี 2567 มีอัตราดอกเบี้ยคงที่ร้อยละ 5.75 ต่อปี ชำระดอกเบี้ยทุก 3 เดือน ตลอดอายุหุ้นกู้ เสนอขายให้แก่ผู้ลงทุนสถาบัน และ/หรือผู้ลงทุนรายใหญ่ ระหว่างวันที่ 26-28 ตุลาคม 2564 มีบล.เอเซีย พลัส และ บล.โกลเบล็ก เป็นผู้จัดการการจัดจำหน่ายหุ้นกู้ บริษัท ทริสเรทติ้ง จำกัด จัดอันดับความน่าเชื่อถือบริษัทที่ระดับ “BBB-” แนวโน้ม negative เมื่อวันที่ 22 มีนาคม 2564 SST จะนำเงินที่ได้จากการเสนอขายหุ้นกู้ในครั้งนี้ไปชำระคืนหุ้นกู้ที่ครบกำหนดในเดือนพฤศจิกายน 2564 และใช้เป็นเงินทุนหมุนเวียน โดย สำนักข่าวอินโฟเควสท์ (01 ต.ค. […] The post SST ออกหุ้นกู้ 250 ลบ.ดอกเบี้ย 5.75% ขายสถาบัน-รายใหญ่ 26-28 ต.ค. appeared first on สำนักข่าวอินโฟเควสท์.,https://www.infoquest.co.th/2021/131648,01_10_2021
ผลสลากกินแบ่งรัฐบาล งวดประจำวันที่ 1 ตุลาคม 2564,รางวัลที่หนึ่ง คือ 578171 รางวัลเลขหน้าสามตัว คือ 285 และ 361 รางวัลเลขท้ายสามตัว คือ 379 และ 449 รางวัลเลขท้ายสองตัว คือ 83 ตรวจรางวัลอื่นๆ จาก LINE TODAY: คลิกที่นี่ โดย สำนักข่าวอินโฟเควสท์ (01 ต.ค. 64) The post ผลสลากกินแบ่งรัฐบาล งวดประจำวันที่ 1 ตุลาคม 2564 appeared first on สำนักข่าวอินโฟเควสท์.,https://www.infoquest.co.th/2021/131641,01_10_2021
“ปูติน” เผยรัสเซียมุ่งลดปล่อยก๊าซเรือนกระจก สร้างภาวะเศรษฐกิจคาร์บอนต่ำ,สำนักข่าวซินหัวรายงานว่า วลาดิเมียร์ ปูติน ประธานาธิบดีรัสเซียเปิดเผยว่า รัสเซียกำลังเร่งดำเนินงานเพื่อสร้างสภาพแวดล้อมที่เอื้อต่อการเปลี่ยนผ่านไปสู่เศรษฐกิจคาร์บอนต่ำ ปธน.ปูตินกล่าวในระหว่างการประชุมทางออนไลน์ว่า รัสเซียบังคับใช้กฎหมายของรัฐบาลกลางว่าด้วยการกำหนดกลไกพื้นฐานของข้อบังคับด้านสภาพอากาศ อีกทั้งกำลังจัดทำแผนการ “ลดคาร์บอน” ในภาคเศรษฐกิจ ปธน.ปูตินระบุว่า “เราส่งเสริมหน่วยงานและภาคธุรกิจท้องถิ่นเพิ่มสัดส่วนพลังงานคาร์บอนต่ำ ประยุกต์ใช้เทคโนโลยีที่ลดการปล่อยก๊าซเรือนกระจก รวมถึงปรับปรุงประสิทธิภาพการใช้พลังงานในที่อยู่อาศัยและบริการชุมชน” นอกจากนี้ ปธน.ปูตินระบุเสริมว่า รัสเซียกำลังดำเนินมาตรการที่หลากหลายเพื่อควบคุมมลพิษทางอากาศในขั้นตอนการผลิตและการขนส่งเชื้อเพลิงฟอสซิล โดย สำนักข่าวอินโฟเควสท์ (01 ต.ค. 64) The post “ปูติน” เผยรัสเซียมุ่งลดปล่อยก๊าซเรือนกระจก สร้างภาวะเศรษฐกิจคาร์บอนต่ำ appeared first on สำนักข่าวอินโฟเควสท์.,https://www.infoquest.co.th/2021/131624,01_10_2021
“มูน แจอิน” ให้คำมั่นสร้างสันติภาพที่ยั่งยืนบนคาบสมุทรเกาหลี,ทำเนียบประธานาธิบดีเกาหลีใต้เปิดเผยว่า ประธานาธิบดีมูน แจอินของเกาหลีใต้ให้คำมั่นว่าจะสร้างสันติภาพที่ยั่งยืนบนคาบสมุทรเกาหลี ถ้อยแถลงดังกล่าวของปธน.มูนมีขึ้นในระหว่างกล่าวสุนทรพจน์ครบรอบ 73 ปีวันกองทัพเกาหลีใต้ โดยเขาระบุว่า ความรับผิดชอบที่สำคัญและยิ่งใหญ่ที่สุดของตนเองในฐานะผู้บัญชาการทหารสูงสุดของประเทศคือการสร้างและรักษาสันติภาพในคาบสมุทรเกาหลีให้คงอยู่อย่างถาวร ปธน.มูนระบุว่า จากความเชื่อมั่นและภาคภูมิใจในท่าทีด้านความมั่นคงที่แข็งแกร่งของกองทัพ ตนจึงได้ยื่นขอเสนอต่อชุมชนสากลให้ประกาศยุติสงครามเกาหลี 2493-2496 อย่างเป็นทางการ และเปิดทางสู่ยุคใหม่แห่งความปรองดองและความร่วมมือบนคาบสมุทรเกาหลี ในระหว่างการกล่าวสุนทรพจน์ที่การประชุมสมัชชาใหญ่แห่งสหประชาชาติ (UNGA) ครั้งที่ 76 เมื่อสัปดาห์ที่แล้ว ปธน.มูนได้เสนอการประกาศทางการเมืองเพื่อยุติสงครามเกาหลี สำนักข่าวซินหัวรายงานว่า ในทางเทคนิคแล้ว ทั้งเกาหลีเหนือและเกาหลีใต้ยังคงอยู่ในภาวะสงคราม เนื่องจากสงครามสิ้นสุดด้วยการสงบศึก ไม่ใช่การทำสนธิสัญญาสันติภาพ ปธน.มูนได้กล่าวยกย่องอำนาจทางทหารของเกาหลีใต้ โดยอ้างถึงการทดสอบยิงขีปนาวุธจากเรือดำน้ำล่าสุด และความสำเร็จในการพัฒนาต้นแบบสำหรับเครื่องบินขับไล่ KF-21 รุ่นใหม่ของประเทศ นอกจากนี้ ปธน.มูนยังเสริมด้วยว่า กองทัพเกาหลีใต้จะจัดการกับการกระทำใด ๆ ที่คุกคามชีวิตและความปลอดภัยของชาวเกาหลีใต้อย่างจริงจัง โดย สำนักข่าวอินโฟเควสท์ (01 ต.ค. 64) The post “มูน แจอิน” ให้คำมั่นสร้างสันติภาพที่ยั่งยืนบนคาบสมุทรเกาหลี appeared first on สำนักข่าวอินโฟเควสท์.,https://www.infoquest.co.th/2021/131646,01_10_2021
SQ ออกหุ้นกู้ 300 ลบ.อายุ 3 ปี ดอกเบี้ย 4.90% เสนอขายสถาบัน 2-4 พ.ย.,บมจ.สหกล อิควิปเมนท์ (SQ) ยื่นแบบแสดงรายการข้อมูลต่อสำนักงานคณะกรรมการกำกับหลักทรัพย์และตลาดหลักทรัพย์ (ก.ล.ต.) เพื่อออกและเสนอขายหุ้นกู้ของบริษัท ครั้งที่ 2/2564 มูลค่าไม่เกิน 300 ล้านบาท อายุ 3 ปี ครบกำหนดไถ่ถอนปี 2568 มีอัตราดอกเบี้ยคงที่ร้อยละ 4.90 ต่อปี จ่ายดอกเบี้ยทุก 6 เดือนตลอดอายุหุ้นกู้ โดยเสนอขายต่อผู้ลงทุนสถาบัน คาดว่าจะเปิดขายวันที่ 2-4 พฤศจิกายน 2564 โดยมี บล.ธนชาต เป็นผู้จัดการการจัดจำหน่าย บริษัท ทริสเรทติ้ง จำกัด จัดอันดับความน่าเชื่อถือของบริษัทอยู่ที “BBB-” แนวโน้มอันดับเครดิต “คงที่” เมื่อวันที่ 11 มิถุนายน 2564 บริษัทจะนำเงินที่ได้จากการเสนอขายหุ้นกู้ครั้งนี้ไปใช้ชำระคืนหนี้เดิม จำนวนประมาณ 100-150 ล้านบาท และใช้ลงทุนในโครงการใหม่อีกประมาณ 150-200 ล้านบาท คาดว่าจะใช้ภายใน 30 มิถุนายน 2565 โดย สำนักข่าวอินโฟเควสท์ (01 […] The post SQ ออกหุ้นกู้ 300 ลบ.อายุ 3 ปี ดอกเบี้ย 4.90% เสนอขายสถาบัน 2-4 พ.ย. appeared first on สำนักข่าวอินโฟเควสท์.,https://www.infoquest.co.th/2021/131657,01_10_2021
"สธ.ระบุเด็ก 12 ปีเสียชีวิตไม่เกี่ยวฉีดวัคซีนไฟเซอร์ พบภาวะแทรกซ้อน, ย้ำเฝ้าระวังอาการ","นพ.เฉวตสรร นามวาท ผู้อำนวยการกองควบคุมโรคและภัยสุขภาพในภาวะฉุกเฉิน กรมควบคุมโรค กระทรวงสาธารณสุข (สธ.) เปิดเผยกรณีที่มีเด็กชายอายุ 12 ปี เสียชีวิตหลังจากการฉีดวัคซีนไฟเซอร์ว่า ไม่ได้เป็นการเสียชีวิตจากการฉีดวัคซีน โดยหลังการตรวจชิ้นเนื้อไม่พบการอักเสบที่กล้ามเนื้อหัวใจ แต่พบระดับน้ำตาลในสารน้ำในลูกตาสูง จึงสันนิษฐานว่าเป็นการเสียชีวิตจากภาวะแทรกซ้อนจากโรคเบาหวานเรื้อรัง สำหรับการฉีดวัคซีนในเด็กนักเรียนจากเดิมมีการตั้งเป้าไว้ที่ 4,600,000 คน แต่จากการรวบรวมจำนวนนักเรียนทั่วประเทศใหม่อยู่ที่ 5,048,000 คน โดยมีความประสงค์จากผู้ปกครองอยู่ที่ประมาณ 3,618,000 คน หรือคิดเป็น 71% โดยวัคซีนที่ใช้ฉีดตั้งแต่วันที่ 4 ต.ค. นี้เป็นต้นไป ยังมีเพียงวัคซีนไฟเซอร์ชนิดเดียวที่ได้รับการขึ้นทะเบียนจากองค์การอาหารและยา (อย.) โดยจะฉีดให้นักเรียนคนละ 2 โดส ระยะเวลาห่างกัน 3-4 สัปดาห์ ทั้งนี้ยังไม่มีการลดจำนวนเข็ม และยังไม่มีการแยกความเสี่ยงระหว่างเพศชาย และเพศหญิง โดยสธ. อยู่ระหว่างการติดตามข้อมูลทางวิชาการเรื่องดังกล่าวเพิ่มเติม นักเรียนที่ได้รับวัคซีนแล้ว หลังการฉีดวัคซีนต้องเข้าระบบเฝ้าระวังอาการผ่านแอปพลิเคชัน “หมอพร้อม” เช่นเดียวกับผู้ใหญ่ อย่างไรก็ดีเพื่อให้เกิดความมั่นใจ และความปลอดภัยมากขึ้น สธ. และเครือข่ายโรงพยาบาลต่างๆ จะมีหนังสือชี้แจงเพิ่มเติม ย้ำความสำคัญแก่โรงพยาบาลเรื่องอาการหลังฉีดวัคซีน เพื่อให้เกิดการรักษาที่ถูกต้อง และไม่คลาดเคลื่อน ส่วนอาการที่ต้องเฝ้าระวังหลังจากฉีดวัคซีนชนิด […] The post สธ.ระบุเด็ก 12 ปีเสียชีวิตไม่เกี่ยวฉีดวัคซีนไฟเซอร์ พบภาวะแทรกซ้อน, ย้ำเฝ้าระวังอาการ appeared first on สำนักข่าวอินโฟเควสท์.",https://www.infoquest.co.th/2021/131653,01_10_2021
“ทาเดดา” เผยสารปนเปื้อนในวัคซีนโมเดอร์นาเกิดจากความผิดพลาดของเจ้าหน้าที่,บริษัททาเคดา ฟาร์มาซูติคอล เปิดเผยว่า สารปนเปื้อนโลหะในวัคซีนโมเดอร์นาเกิดจากความผิดพลาดระหว่างขั้นตอนการบรรจุของเจ้าหน้าที่ ซึ่งนำไปสู่การเรียกคืนวัคซีนในช่วงเดือนส.ค.ที่ผ่านมา รายงานล่าสุดชี้ว่า ปัญหาดังกล่าวเกิดขึ้นจากการประกอบที่ไม่ถูกต้องและความผิดพลาดของเจ้าหน้าที่ ซึ่งไม่ได้ตรวจสอบให้ดีว่าจะต้องเว้นระยะห่าง 1 มิลลิเมตรระหว่างจานของเครื่องป้อนบรรจุภัณฑ์ (star-wheel) กับจุกยางของเครื่องจักร ซึ่งทำหน้าที่ปิดผนึกฝาขวดวัคซีน บริษัททาเคดา ซึ่งนำเข้าและจัดจำหน่ายวัคซีนโมเดอร์นาในประเทศญี่ปุ่น และบริษัทโมเดอร์นา ระบุในรายงานฉบับใหม่ว่า ผู้ผลิตชาวสเปนค้นพบสารปนเปื้อนในวัคซีนบางขวดในเดือนก.ค. แต่วัคซีนจากการผลิตล็อตเดียวกันได้รับอนุญาตให้จัดส่งไปยังญี่ปุ่นแล้ว อนึ่ง เมื่อเดือนส.ค. ทางการญี่ปุ่นได้สั่งระงับการใช้วัคซีนโมเดอร์นาจำนวน 3 ล็อต ซึ่งมีปริมาณ 1.63 ล้านโดส หลังจากได้รับแจ้งถึงการปนเปื้อน บริษัทโมเดอร์นาได้ทำการตรวจสอบกรณีดังกล่าวร่วมกับทาเคดา และ Rovi ซึ่งเป็นบริษัทเวชภัณฑ์ของสเปนและเป็นผู้ผลิตขวดวัคซีนให้กับโมเดอร์นา โดย สำนักข่าวอินโฟเควสท์ (01 ต.ค. 64) The post “ทาเดดา” เผยสารปนเปื้อนในวัคซีนโมเดอร์นาเกิดจากความผิดพลาดของเจ้าหน้าที่ appeared first on สำนักข่าวอินโฟเควสท์.,https://www.infoquest.co.th/2021/131667,01_10_2021
