title,summary,link,published
หุ้นไทยปิดเช้าลบ 6.80 จุด ตามตลาดต่างประเทศหลังหลายปัจจัยสร้างความผันผวน,"SET ช่วงเช้าปิดที่ระดับ 1,598.88 จุด ลดลง 6.80 จุด (-0.42%) มูลค่าการซื้อขายราว 40,470 ล้านบาท นักวิเคราะห์ฯเผยตลาดหุ้นไทยเช้านี้รับผลกระทบจากปัจจัยนอกประเทศ โดยดัชนีหุ้นดาวโจนส์ร่วงเกือบ 1.6% ส่งผลให้ตลาดภูมิภาคาปรับลงถ้วนหน้า ทั้งกังวลเงินเฟ้อ-ลด QE-เพดานหนี้สหรัฐฯ สร้างความผันผวนให้ตลาดบ้านเราบ้าง แต่มองดัชนีโซน 1,596 ซึ่งเป็นค่าเฉลี่ย 3 เดือนเป็นโอกาสเข้าซื้อหลังผ่านจุดต่ำสุดไปแล้ว และมีโอกาสรัฐบาลฯจะออกมาตรการกระตุ้นเศรษฐกิจเพิ่ม ทำให้การบริโภคในประเทศดีขึ้น เล็งกลุ่มธนาคารได้รับประโยชน์ ส่วนกลุ่มพลังงานก็ได้รับผลดีจากราคาพลังงานปรับขึ้น ส่วนสถานการณ์น้ำท่วมมองเป็นผลกระทบแค่ระยะสั้น บ่ายนี้ตลาดฯคงจะแกว่งตัวในกรอบแนวรับ 1,596-1,590 แนวต้าน 1,610 จุด ตลาดหลักทรัพย์ฯ ปิดช่วงเช้าวันนี้ที่ระดับ 1,598.88 จุด ลดลง 6.80 จุด (-0.42%) มูลค่าการซื้อขายราว 40,470 ล้านบาท การซื้อขายหุ้นช่วงเช้าวันนี้ ดัชนีหุ้นไทยเคลื่อนไหวในแดนลบตลอดช่วงเช้า โดยทำระดับสูงสุด 1,605.20 จุด และระดับต่ำสุด 1,593.32 จุด นายพิชัย เลิศสุพงศ์กิจ รองกรรมการผู้จัดการฝ่ายการตลาด […] The post หุ้นไทยปิดเช้าลบ 6.80 จุด ตามตลาดต่างประเทศหลังหลายปัจจัยสร้างความผันผวน appeared first on สำนักข่าวอินโฟเควสท์.",https://www.infoquest.co.th/2021/131510,01_10_2021
บิ๊กป้อม เชื่อน้ำไม่ท่วมกรุง เตรียมแผนพร้อม 24 ชม.-ปัดตอบ พปชร.ชู “บิ๊กตู่” นั่งนายกฯ ต่อ,"พล.อ.ประวิตร วงษ์สุวรรณ รองนายกรัฐมตรี กล่าวถึงกรณีกรุงเทพมหานคร (กทม.) แจ้งเตือนประชาชนให้เตรียมยกของขึ้นที่สูง เนื่องจากในวันเดียวกันนี้ ระดับน้ำเจ้าพระยาจะสูงขึ้นอีก 20 เซนติเมตรว่า คาดว่าน้ำจะไม่ท่วมกรุงเทพฯ แต่ก็ถือว่าทำเต็มที่ และจากการลงพื้นที่ไปดูสถานการณ์น้ำ พบว่ามีการระบายน้ำอยู่ที่ 2,700-2,800 ลูกบาศก์เมตรต่อวินาที ซึ่งเจ้าหน้าที่ได้เตรียมเครื่องสูบน้ำและเตรียมไว้ระบายน้ำตลอด 24 ชั่วโมงแล้ว เพื่อป้องกันไม่ให้กรุงเทพฯ น้ำท่วม ยืนยันว่าทำทุกอย่างอยู่แล้ว ทั้งนี้ พล.อ.ประวิตร ปฏิเสธที่จะตอบคำถามถึงกรณีวานนี้ (30 ก.ย.) เรียกประชุมหัวหน้าภาคทั้ง 9 ภาค ของพรรคพลังประชารัฐ ว่า ยังคงจะชู พล.อ.ประยุทธ์ จันทร์โอชา เป็นนายกรัฐมนตรีหรือไม่ รวมถึงกรณีที่ พ.อ.สุชาติ จันทรโชติกุล อดีตประธานยุทธศาสตร์ภาคใต้ พรรคพลังประชารัฐ (พปชร.) ระบุว่า ส.ส.ภาคใต้กว่า 10 คน จะไปอยู่พรรคใหม่ของนายฉัตรชัย พรหมเลิศ อดีตปลัดกระทรวงมหาดไทย โดย สำนักข่าวอินโฟเควสท์ (01 ต.ค. 64) The post บิ๊กป้อม เชื่อน้ำไม่ท่วมกรุง เตรียมแผนพร้อม 24 ชม.-ปัดตอบ พปชร.ชู “บิ๊กตู่” นั่งนายกฯ ต่อ appeared first on สำนักข่าวอินโฟเควสท์.",https://www.infoquest.co.th/2021/131505,01_10_2021
KBANK แนะทยอยสะสมหุ้นเน้นสหรัฐ-ยุโรป-ญี่ปุ่น-จีน รับมาตรการกระตุ้นศก.หลังโควิดคลาย,นายจิรวัฒน์ สุภรณ์ไพบูลย์ Private Banking Group Head ธนาคารกสิกรไทย (KBANK) เปิดเผยว่า ตลอดปี 64 มีหลายเหตุการณ์และความเคลื่อนไหวสำคัญที่ส่งผลกระทบต่อการเติบโตของดัชนี MSCI All Country World Index ไม่ว่าจะเป็น ปรากฏการณ์ GameStop ที่ราคาหุ้นของบริษัทปรับตัวเพิ่มขึ้นเกือบ 900% ภายในช่วงเวลาไม่เกิน 2 สัปดาห์ จากการที่นักลงทุนรายย่อยผนึกกำลังต่อสู้กับสถานะการลงทุนของกองทุนเฮดจ์ฟันด์ จนบรรดาเฮดจ์ฟันด์ยักษ์ใหญ่ต้องเสียหายกันอย่างหนัก รวมทั้งอัตราเงินเฟ้อที่เร่งตัวขึ้นกดดันให้อัตราผลตอบแทนพันธบัตร (Bond Yield) เพิ่มขึ้นอย่างต่อเนื่องในไตรมาส 1 ที่ผ่านมา จนตลาดเกิดความกังวลว่าธนาคารกลางสหรัฐ (เฟด) ต้องเข้มงวดนโยบายเร็วกว่าที่คาด กดดันแนวโน้มการฟื้นตัวของเศรษฐกิจ ก่อนที่ประเด็นดังกล่าวจะผ่อนคลายลงหลังตลาดรับรู่ว่าเงินเฟ้อที่เร่งขึ้นเป็นเพียงชั่วคราว และจะค่อยๆ หายไปต่อจากนี้ Archegos Capital กับการกู้ลงทุนจนเกินตัว โดยเฮดจ์ฟันด์ดังกล่าวที่ได้ทำการกู้ยืมเงินเพื่อใช้ในการเก็งกำไรในระดับที่สูงผิดปกติ และเมื่อขาดทุนจนต้องถูกบังคับขายหุ้นล็อตใหญ่ออกมา ส่งผลให้หลายๆ ธนาคารที่ทำธุรกรรมให้ Archegos Capital เจ็บตัวกันหนัก ประกอบกับการแพร่ระบาดของเชื้อไวรัสโควิด-19 สายพันธ์เดลต้าส่งผลให้จำนวนผู้ติดเชื้อกลับมาเร่งตัวขึ้นอีกครั้ง กดดันการฟื้นตัวของเศรษฐกิจ สะท้อนในตัวเลขเศรษฐกิจ เช่น […] The post KBANK แนะทยอยสะสมหุ้นเน้นสหรัฐ-ยุโรป-ญี่ปุ่น-จีน รับมาตรการกระตุ้นศก.หลังโควิดคลาย appeared first on สำนักข่าวอินโฟเควสท์.,https://www.infoquest.co.th/2021/131550,01_10_2021
"หอการค้า คาดน้ำท่วมรอบนี้เสียหายกว่า 15,000 ลบ.กระทบ GDP ราว 0.1-0.2%","นายวชิร คูณทวีเทพ ผู้อำนวยการสถาบันยุทธศาสตร์การค้า มหาวิทยาลัยหอการค้าไทย กล่าวว่า จากสถานการณ์น้ำท่วมปี 64 ที่มีพื้นที่ประสบน้ำท่วมทั้งหมด 31 จังหวัด คาดสร้างมูลค่าความเสียหาย 15,036.11 ล้านบาท โดยกว่า 7,000 ล้านบาทเป็นความเสียหายด้านเกษตร ทั้งนี้ส่งผลกระทบต่อจีดีพีทั้งปี ให้ลดลง 0.1-0.2% หรือในไตรมาส 4/64 จีดีพีจะลดลง 0.3-0.5% กการสำรวจจากหอการค้าจังหวัดในภาคเหนือ ภาคกลาง และภาคตะวันออกเฉียงเหนือ พบว่า พื้นที่ที่ได้รับความเสียหาย 65.9% เป็นพื้นที่เพาะปลูก อีก 22% เป็นพื้นที่เศรษฐกิจของจังหวัด และ 12.1% ได้รับผลกระทบทั้งสองพื้นที่ สำหรับผลกระทบจากน้ำท่วมพบว่า ผลกระทบที่ได้รับส่วนใหญ่ คือ บ้านและคมนาคมเสียหาย รองลงมาคือผลผลิตทางเกษตร และข้าวของเสียหาย ทั้งนี้จากการสอบถามถึงผลกระทบต่อเศรษฐกิจประเทศ พบว่า 39.5% มีผลกระทบในระดับมาก อย่างไรก็ดีพบว่า 83.38% ระบุว่าสถานการณ์น้ำท่วมในครั้งนี้มีความรุนแรง และสร้างความเสียหายน้อยกว่าน้ำท่วมในปี 54 รวมทั้งคาดว่าสถานการณ์น้ำท่วมจะลดลง และกลับสู่ภาวะปกติเฉลี่ย 9 วัน […] The post หอการค้า คาดน้ำท่วมรอบนี้เสียหายกว่า 15,000 ลบ.กระทบ GDP ราว 0.1-0.2% appeared first on สำนักข่าวอินโฟเควสท์.",https://www.infoquest.co.th/2021/131545,01_10_2021
MK ออกหุ้นกู้ระยะสั้น 500 ลบ.ดอกเบี้ย 3.90% ขายผู้ลงทุนทั่วไป 11-18 ต.ค.,บมจ.มั่นคงเคหะการ (MK) ยื่นแบบแสดงรายการข้อมูลต่อสำนักงานคณะกรรมการกำกับหลักทรัพย์และตลาดหลักทรัพย์ (ก.ล.ต.) เพื่อออกและเสนอขายหุ้นกู้iระยะสั้นของบริษัท ครั้งที่ 3/2564 มูลค่าไม่เกิน 500 ล้านบาท อัตราดอกเบี้ยคงที่ร้อยละ 3.90 ต่อปี อายุ 269 วันครบกำหนดไถ่ถอนในวันที่ 15 กรกฎาคม 2565 โดยเสนอขายให้แก่ผู้ลงทุนทั่วไป ระหว่างวันที่ 11-18 ตุลาคม 2564 ผ่าน บล.ฟินันซ่า และ บล.ฟินันเซีย ไซรัส ซึ่งเป็นผู้จัดการการจำหน่ายหุ้นกู้ บริษัท ทริสเรทติ้ง จำกัด จัดอันดับเครดิตของบริษัท อยู่ที่ “BBB-” แนวโน้มอันดับเครดิต “คงที่” เมื่อวันที่ 21 เมษายน 2564 ทั้งนี้บริษัทจะนำเงินที่เสนอขายหุ้นกู้ครั้งนี้ไปใช้ชำระหนี้เดิม และใช้เป็นเงินทุนหมุนเวียน โดย สำนักข่าวอินโฟเควสท์ (01 ต.ค. 64) The post MK ออกหุ้นกู้ระยะสั้น 500 ลบ.ดอกเบี้ย 3.90% ขายผู้ลงทุนทั่วไป 11-18 ต.ค. appeared first on สำนักข่าวอินโฟเควสท์.,https://www.infoquest.co.th/2021/131568,01_10_2021
ASK ออกหุ้นกู้ 2 พันลบ.ดอกเบี้ย 2.50-2.85% ขายสถาบัน 5-6 ต.ค.,"บมจ.เอเซียเสริมกิจลีสซิ่ง (ASK) ยื่นแบบแสดงรายการข้อมูลต่อสำนักงานคณะกรรมการกำกับหลักทรัพย์และตลาดหลักทรัพย์ (ก.ล.ต.) เพื่อออกและเสนอขายหุ้นกู้ของบริษัท ครั้งที่ 9/2564 มูลค่าไม่เกิน 2,000 ล้านบาท จำนวน 2 ชุด ได้แก่ ชุดที่ 1 ไม่เกิน 500 ล้านบาท อายุ 2 ปี 10 วัน ครบกำหนดไถ่ถอนปี 2566 อัตราดอกเบี้ยคงที่ร้อยละ 2.50 ต่อปี ชุดที่ 2 ไม่เกิน 1,500 ล้านบาท อายุ 3 ปี ครบกำหนดไถ่ถอนปี 2567 อัตราดอกเบี้ยคงที่ร้อยละ 2.85 ต่อปี ทั้ง 2 ชุดจ่ายดอกเบี้ยทุก 6 เดือนตลอดอายุหุ้นกู้ บริษัทเสนอขายหุ้นกู้ดังกล่าวให้แก่ผู้ลงทุนสถาบันระหว่างวันที่ 5-6 ต.ค. 64 ผ่านธนาคารยูโอบี ซึ่งเป็นผู้จัดการการจัดจำหน่ายหุ้นกู้ ASK ได้รับการจัดอันดับเครดิตที่ […] The post ASK ออกหุ้นกู้ 2 พันลบ.ดอกเบี้ย 2.50-2.85% ขายสถาบัน 5-6 ต.ค. appeared first on สำนักข่าวอินโฟเควสท์.",https://www.infoquest.co.th/2021/131562,01_10_2021
โพล ม.หอการค้าฯชี้กินเจปีนี้เงินสะพัดราว 4 หมื่นลบ. หดตัวต่ำสุดรอบ 14 ปี,"นางอุมากมล สุนทรสุรัติ ผู้ช่วยผู้อำนวยการ ศูนย์พยากรณ์เศรษฐกิจและธุรกิจมหาวิทยาลัยหอการค้าไทย เปิดเผยถึงผลการสำรวจพฤติกรรมการใช้จ่ายในช่วงเทศกาลกินเจปี 64 โดยคาดว่าเทศกาลกินเจในปีนี้จะมีเงินสะพัดราว 40,147 ล้านบาท หดตัวจากปีก่อน -14.5% ซึ่งมีเงินสะพัดราว 46,967 ล้านบาท โดยปีนี้ถือเป็นการติดลบครั้งแรกในรอบ 14 ปี ตั้งแต่ปี 51 ทั้งนี้ จากการสำรวจความคิดเห็นจากกลุ่มตัวอย่างทั่วประเทศ 1,208 ตัวอย่างว่า ในปี 64 นี้จะกินเจในช่วงเทศกาลกินเจหรือไม่พบว่า ประชาชน 60.9% ระบุว่า จะไม่กินเจ สาเหตุคือ เศรษฐกิจไม่ดี, ไม่ตั้งใจจะกิน และที่บ้านไม่มีใครกินเจ ขณะที่ประชาชนอีก 39.1% ระบุว่าจะกินเจ เพราะกินเฉพาะเทศกาล, ตั้งใจทำบุญ และกินตามคนที่บ้าน หรือคนรอบข้าง ส่วนพฤติกรรมการกินเจในครั้งนี้ ประชาชน 62.9% ระบุว่าจะกินตลอดช่วงเทศกาลคือตั้งแต่ 4 ต.ค.-13 ต.ค. 64 ขณะที่ประชาชนอีก 37.1% ระบุว่าจะกินเจเฉพาะบางมื้อ โดยช่องทางในการเลือกซื้ออาหารเจ ส่วนใหญ่ตอบว่าเป็นการซื้อด้วยตนเอง 87.8% […] The post โพล ม.หอการค้าฯชี้กินเจปีนี้เงินสะพัดราว 4 หมื่นลบ. หดตัวต่ำสุดรอบ 14 ปี appeared first on สำนักข่าวอินโฟเควสท์.",https://www.infoquest.co.th/2021/131558,01_10_2021
โบรกฯเชียร์ ซื้อ MAJOR เล็งผลงาน Q4/64 พลิกมีกำไรหลังคลายล็อกดาวน์-ลุ้นปันผลพิเศษ,โบรกเกอร์ฯต่างเชียร์ “ซื้อ” หุ้น บมจ.เมเจอร์ ซีนีเพล็กซ์ กรุ้ป (MAJOR) เล็งผลงานไตรมาส 4/64 พลิกเป็นกำไร รับอานิสงส์ผ่อนคลายล็อกดาวน์ กลับมาเปิดให้บริการโรงภาพยนตร์ได้ และมีหนังใหญ่เตรียมเข้าฉายต่อเนื่องตลอดไตรมาส 4/64 จึงเล็งคนเตรียมกลับมาดูหนังในโรงภาพยนตร์คึกคักหนุนรายได้ค่าตั๋วกลับมาอีกครั้ง นอกจากนี้ ยังเริ่มมีรายได้ค่าโฆษณาในโรงภาพยนตร์เข้ามาเสริม หลังจากกลับมาเปิดให้บริการ หนุนภาพการฟื้นตัวต่อเนื่องตั้งแต่ไตรมาส 4/64 และผู้ถือหุ้นเตรียมลุ้นรับปันผลพิเศษหลังปิดงบไตรมาส 3/64 จากการขายหุ้นบมจ.สยามฟิวเจอร์ดีเวลอปเมนท์ (SF) ให้กับบมจ. เซ็นทรัลพัฒนา (CPN) คาดว่าจะจ่ายในอัตรา 1 บาท/หุ้น หรือคิดเป็นผลตอบแทนราว 4% หุ้น MAJOR ปิดเช้าที่ 21.60 บาท ราคาไม่เปลี่ยนแปลง ขณะที่ดัชนี SET ลบ 0.42% โบรกเกอร์ คำแนะนำ ราคาเป้าหมาย (บาท/หุ้น) เมย์แบงก์ กิมเอ็ง ซื้อ 28.00 กรุงศรี ซื้อ 28.00 ทิสโก้ ซื้อ […] The post โบรกฯเชียร์ ซื้อ MAJOR เล็งผลงาน Q4/64 พลิกมีกำไรหลังคลายล็อกดาวน์-ลุ้นปันผลพิเศษ appeared first on สำนักข่าวอินโฟเควสท์.,https://www.infoquest.co.th/2021/131552,01_10_2021
