title,summary,link,published
“บิ๊กตู่” บินดูน้ำท่วมสุโขทัย​ ขึ้นรถ “สวัสดีนะจ๊ะ” ทักทายชาวบ้าน – “สมศักดิ์”​ ขน​ขบวน ส.ส.กลุ่มสามมิตรรอต้อนรับ,พลเอกประยุทธ์​ จันทร์​โอชา​ นายกรัฐมนตรี​ และ​รัฐมนตรี​ว่าการ​กระทรวง​กลาโหม​ พร้อมด้วย พลเอกอนุ​พงษ์​ เผ่า​จินดา​รัฐมนตรี​ว่าการ​กระทรวง​มหาดไทย​ นายเฉลิมชัย​ ศรีอ่อน รัฐมนตรี​ว่าการ​กระทรวง​เกษตรและสหกรณ์ เดินทางลงพื้นที่ตรวจเยี่ยมสถานการณ์น้ำท่วมจังหวัดสุโขทัย​ โดยมีนายสมศักดิ์​ เทพสุทิน​ รัฐมนตรี​ว่าการ​กระทรวง​ยุติธรรม​ นายสุริยะ​ จึงรุ่งเรืองกิจรัฐมนตรีว่าการกระทรวงอุตสาหกรรม นายอนุชา​นาคาศัย​ รัฐมนตรีประจำสำนักนายกรัฐมนตรีและส.ส.พรรคพลังประชารัฐ​ จ.สุโขทัย พิษณุโลก กำแพงเพชร ตาก ลำปาง นครสวรรค์ และพิจิตร มารอต้อนรับประมาณ​ 20 คน​ ทั้งนี้​ ระหว่างอยู่บนเครื่องบิน นายกรัฐมนตรี​ และพลเอกอนุพงษ์ ได้มีการดูแผนที่​จังหวัด​ พร้อมได้สำรวจสถานการณ์​น้ำท่วมที่ขยายเป็นวงกว้างอย่างชัดเจนทางอากาศ​ยาน​ และเมื่อนายกรัฐมนตรี​ เดินทางมาถึงได้มีการพูดคุยกับส.ส.ในพื้นที่​ ที่มารอต้อนรับ​ ก่อนตรวจเยี่ยมให้กำลังใจและมอบถุงยังชีพให้แก่ประชาชนผู้ประสบอุทกภัยอำเภอศรีสำโรง จำนวน 2 จุด ได้แก่ บ้านคลองชัด หมู่ ที่ 8 ตำบลวังใหญ่ และวัดดอนจันทร์ หมู่ที่ 4 ตำบลบ้านไร่ อำเภอศรีสำโรง จังหวัดสุโขทัย นอกจากนี้ในส่วนของรถที่นายกฯ ใช้ในการเดินทางลงพื้นที่จังหวัดสุโขทัยครั้งนี้ […] The post “บิ๊กตู่” บินดูน้ำท่วมสุโขทัย​ ขึ้นรถ “สวัสดีนะจ๊ะ” ทักทายชาวบ้าน – “สมศักดิ์”​ ขน​ขบวน ส.ส.กลุ่มสามมิตรรอต้อนรับ appeared first on MONO29 TV Official Site.,https://mono29.com/news/344756.html,26_09_2021
พรุ่งนี้รอลุ้น! นายกฯ ถก ศบค.ชุดใหญ่ พิจารณาต่อพรก.ฉุกเฉิน​ ขยับเวลาเคอร์ฟิว ​ผ่อนคลายกิจการ- กิจกรรมหลายประเภท,"ผู้สื่อข่าวรายงานจากทำเนียบรัฐบาล ว่า ในการประชุมคณะกรรมการบริหารสถานการณ์การแพร่ระบาดของโรคติดเชื้อไวรัสโคโรนา 2019 หรือ โควิด-19 หรือ​ ศบค.ชุดใหญ่ ครั้งที่ 15 / 2564 ที่มีพลเอกประยุทธ์ จันทร์โอชา นายกรัฐมนตรี และรัฐมนตรีว่าการกระทรวงกลาโหม ในฐานะผอ.ศบค. เป็นประธานการประชุมในเวลา 10.30 น. ผ่านระบบการประชุมทางไกล หรือ วีดีโอคอนเฟอเรนซ์ โดยจะเริ่มด้วยเรื่องที่ประธานแจ้งให้ที่ประชุมทราบ และรับรองรายงานการประชุมศบค.ครั้งที่ 14 / 2564 เมื่อวันที่ 10 กันยายน 2564 ที่ผ่านมา จากนั้นศูนย์ปฏิบัติการฉุกเฉินด้านการแพทย์และสาธารณสุขกรณีโรคติดเชื้อ โควิด-19 (ศปก.สธ.) จะรายงานสถานการณ์และคาดการณ์แนวโน้มการแพร่ระบาดและผู้ติดเชื้อ, กระทรวงแรงงานรายงานเรื่องการปรับรายละเอียดของโครงการแฟ็คทอรี่แซนด์บ็อกซ์ Factory sandbox ระยะที่2 , กระทรวงพลังงานรายงานเรื่องการแก้ไขผลกระทบที่เกิดจากการปฎิบัติตามคำสั่ง ศบค. ฉบับที่ 12 / 2564 กรณีผู้เดินทางเข้าออกราชอาณาจักรทางน้ำเพื่อปฏิบัติภารกิจที่เกี่ยวข้องกับกิจการปิโตรเลียม นอกจากนี้​ ศบค.จะพิจารณาความเหมาะสมในการขยายระยะเวลาประกาศสถานการณ์ฉุกเฉินในทุกเขตท้องที่ทั่วราชอาณาจักร ครั้งที่ 14 โดยศูนย์ปฏิบัติการศูนย์บริหารสถานการณ์ โควิด-19​ […] The post พรุ่งนี้รอลุ้น! นายกฯ ถก ศบค.ชุดใหญ่ พิจารณาต่อพรก.ฉุกเฉิน​ ขยับเวลาเคอร์ฟิว ​ผ่อนคลายกิจการ- กิจกรรมหลายประเภท appeared first on MONO29 TV Official Site.",https://mono29.com/news/344753.html,26_09_2021
บขส.แจ้งหยุดเดินรถเส้นทาง กรุงเทพฯ – หล่มสัก ชั่วคราว หลังน้ำท่วมทางไม่สามารถสัญจรได้,ดร.สัญลักข์ ปัญวัฒนลิขิต กรรมการผู้จัดการใหญ่ บริษัท ขนส่ง จำกัด (บขส.) เปิดเผยว่า จากอิทธิพลของ พายุดีเปรสชั่น “เตี้ยนหมู่” ทำให้ประเทศไทยตอนบนยังคงมีฝนตกหนักถึงหนักมากในบางพื้นที่ของภาคเหนือ ภาคตะวันออกเฉียงเหนือ (ภาคอีสาน) ภาคกลางและภาคตะวันออก รวมทั้งกรุงเทพมหานครและปริมณฑล ตนเองจึงได้สั่งกำชับไปยังทุกฝ่าย โดยเฉพาะนายสถานีเดินรถในส่วนภูมิภาคให้เฝ้าระวังสถานการณ์น้ำท่วมอย่างใกล้ชิด พร้อมทั้งเฝ้าระวังตลอด 24 ชั่วโมง.โดยล่าสุดช่วงเช้าวันนี้ (26 ก.ย. 64) ได้รับแจ้งจากสถานีเดินรถหล่มสัก และสถานีเดินรถเพชรบูรณ์ว่า เส้นทางช่วงพุขาม-พุเตย ทั้งขาขึ้น และขาล่อง น้ำท่วมสูงรถทุกชนิดไม่สามารถผ่านได้ จึงต้องหยุดวิ่งให้บริการในเส้นทางกรุงเทพฯ – หล่มสัก (เที่ยวไป-กลับ) จำนวน 4 เที่ยว ชั่วคราว และให้ผู้โดยสารที่จองตั๋วล่วงหน้าไว้แล้ว สามารถเลื่อนการเดินทาง หรือคืนตั๋วโดยสารได้.ขณะเดียวกันทางสถานีเดินรถสุโขทัย ได้รายงานว่า ระดับน้ำในจังหวัดสุโขทัย และเส้นทางเข้า-ออกสถานีขนส่งฯ มีน้ำท่วมสูง รถโดยสารไม่สามารถเข้าใช้สถานีขนส่งฯได้ จึงให้รถโดยสารสายอุตรดิตถ์ สาย 100 ใช้เส้นทางนครสวรรค์ – พิษณุโลก – อำเภอกงไกรลาศ – […] The post บขส.แจ้งหยุดเดินรถเส้นทาง กรุงเทพฯ – หล่มสัก ชั่วคราว หลังน้ำท่วมทางไม่สามารถสัญจรได้ appeared first on MONO29 TV Official Site.,https://mono29.com/news/344751.html,26_09_2021
“เขี้ยวสมุทร” บุกแบ่งแต้ม “มังกรโล่เงิน” 1-1,ศึกฟุตบอล รีโว่ ไทยลีก 2021/22 นัดที่ 4 ประจำวันอาทิตย์ที่ 26 กันยายน 2564 ระหว่าง โปลิศ เทโร เอฟซี พบกับ สมุทรปราการซิตี้ ที่ สนามบุณยะจินดา นาที 19 โปลิศ เทโรฯ ได้ทักทายก่อนจากจังหวะสับไกด้วยขวาในกรอบเขตโทษของ เอกชัย สำเร แต่บอลยังไม่ตรงกรอบ นาที 40 เจ้าบ้านได้ประตูออกนำ 1-0 จาก ไอแซค ฮอนนี จบครึ่งเวลาแรก โปลิศ เทโร เอฟซี 0-0 สมุทรปราการซิตี้ เข้าสู่ช่วงครึ่งเวลาหลัง นาที 51 เจริญศักดิ์ วงษ์กรณ์ ได้เปิดฟรีคิกทางริมเส้นฝั่งขวา ก่อนบอลมาตกตรงหน้า ศุภนันท์ บุรีรัตน์ ยิงเข้าไปไม่เหลือ สมุทรปราการซิตี้ ตามตีเสมอ 1-1 นาที 71 เจริญศักดิ์ […] The post “เขี้ยวสมุทร” บุกแบ่งแต้ม “มังกรโล่เงิน” 1-1 appeared first on MONO29 TV Official Site.,https://mono29.com/news/344776.html,26_09_2021
เชียร์สนั่น แน่นสนาม! “3BB GIGATV” ยิงสดมวยปล้ำ WWE ตลอดเดือน ต.ค.,คอมวยปล้ำมีเฮ! กับการรับชมศึกมวยปล้ำ 2 รายการสำคัญ SMACKDOWN และ RAW พร้อมทัวร์อีก 25 เมืองในอเมริกาแบบติดขอบสนามให้คนดูได้สัมผัสลุ้นมันส์ครบทุกอารมณ์ กับรายการ “ศึกมวยปล้ำ WWE” (World Wrestling Entertainment) ที่บริการ “3BB GIGATV” ได้คว้าสิทธิ์ถ่ายทอดสด ที่มาพร้อมภาพและเสียงคมชัดแบบ FULL HD ความสนุกเต็มอิ่มทะลุจอ ตื่นตาตื่นใจกับแสง สี เสียง อรรถรสเหมือนนั่งชมอยู่ขอบเวทีเวลาเดียวกับสหรัฐอเมริกา ภายหลังจากสถานการณ์โควิดในอเมริกาเริ่มคลี่คลายไปในทางที่ดีขึ้น สมาคมมวยปล้ำ WWE ได้ปรับให้มีการเปิดให้มีการจองบัตรที่นั่ง เพื่อให้แฟนมวยปล้ำชาวอเมริกัน ได้กลับมาเข้าชมแบบติดขอบสนามอีกครั้ง ประเดิมเปิดเวทีกับสองรายการสุดฮิตที่คอมวยปล้ำชื่นชอบ รายการ SMACKDOWN และ รายการ RAW โดยโปรแกรมรายการเด็ดในเดือนตุลาคมนี้ แฟนๆจะได้รับชมนักมวยปล้ำระดับซูเปอร์สตาร์อัดแน่นเต็มรายการ กับการต่อสู้ที่เข้มข้น พร้อมรอลุ้นความหฤโหด และมันส์ไปกับเกมส์การแข่งขันที่ดุเดือดสะเทือนเวที สำหรับแฟนมวยปล้ำชาวไทย สามารถติดตามรับชมความมันส์แบบไร้ขีดจำกัด เสมือนนั่งดูติดขอบสนาม ที่สนุกทุกคู่ เลือดสาดทุกแมตช์ เกรี้ยวกราดทุกช็อต เหงื่อไหลย้อยทุกซีน ชั้นเชิงขั้นเทพแบบโหด-เลว-ดี ไม่มีสิ้นสุด รับชมความสนุกเร้าใจที่เรียกความสะใจจากแฟนมวยปล้ำทั่วโลกชมกันแบบเต็มอิ่มได้ […] The post เชียร์สนั่น แน่นสนาม! “3BB GIGATV” ยิงสดมวยปล้ำ WWE ตลอดเดือน ต.ค. appeared first on MONO29 TV Official Site.,https://mono29.com/news/344780.html,26_09_2021
โคราช สั่งอพอพประชาชนริมน้ำท้ายอ่างเก็บน้ำลำเชียงไกร 8 อำเภอ,คันดินผนังกั้นอ่างเก็บน้ำลำเชียงไกร (ตอนล่าง) ตำบลบัลลังก์ อำเภอโนนไทย จังหวัดนครราชสีมา ได้พังทลายลง ความกว้างประมาณ 10 เมตร เนื่องจากปริมาณน้ำภายในอ่างมีมากจนเกินความจุ โดยล่าสุดก่อนที่คันดินจะพังทลาย อ่างเก็บน้ำลำเชียงไกร (ตอนล่าง) มีปริมาณน้ำกักเก็บอยู่ที่ 41 ล้านลูกบาศก์เมตร หรือคิดเป็น 151% จากความจุอ่างทั้งหมดที่ 27.7 ล้านลูกบาศก์เมตร โดยอ่างเก็บน้ำลำเชียงไกร (ตอนล่าง) เป็นอ่างเก็บน้ำที่รับน้ำมาจากพื้นที่จังหวัดชัยภูมิ และพื้นที่อำเภอด่านขุนทด จังหวัดนครราชสีมา นายกิตติกุล เสภาศีราภรณ์ ผู้อำนวยการชลประทานจังหวัดนครราชสีมา ได้เดินทางลงพื้นที่ไปตรวจดูพื้นที่เบื้องต้นพบว่า ปริมาณน้ำจากพื้นที่อำเภอด่านขุนทดได้ไหลลงมายังอ่างเก็บน้ำลำเชียงไกร (ตอนล่าง) มีปริมาณมากจนเกินกว่าที่อ่างจะรับไหว ทำให้มวลน้ำได้กัดเซาะคันดินผนังกันน้ำจนพังลง ซึ่งมวลน้ำได้ไหลลงไปพื้นที่ด้านล่าง นอกจากนี้มวลน้ำบางส่วนยังล้นออกทางสปิลเวย์ประตูระบายน้ำฉุกเฉินของอ่างด้วย โดยทางขณะนี้ทางจังหวัดได้ประกาศแจ้งเตือนประชาชนที่อยู่บริเวณพื้นที่ด้านท้ายอ่าง 8 อำเภอ ประกอบด้วย อำเภอโนนไทย อำเภอพระทองคำ อำเภอเมืองนครราชสีมา อำเภอโนนสูง อำเภอพิมาย อำเภอชุมพวง อำเภอลำทะเมนชัย และอำเภอเมืองยาง โดยแจ้งเตือนประชาชนอยู่ในภาวะเสี่ยงอันตรายสูง ให้อพยพไปอยู่ในพื้นที่ปลอดภัย ในระดับสีส้ม โดยเฉพาะประชาชนที่อยู่ในพื้นที่ลุ่มต่ำให้เก็บสิ่งของขึ้นไว้บนที่สูง นายกิตติกุล เสภาศีราภรณ์ ผู้อำนวยการชลประทานจังหวัดนครราชสีมา เปิดเผยว่า ขณะนี้ทางชลประทานได้พยายามเร่งระบายน้ำออกจากอ่างเก็บน้ำลำเชียงไกร (ตอนล่าง) ในอัตรา 350 ลูกบาศก์เมตรต่อวินาที เพราะยังต้องรักษาสันเขื่อนของอ่างเก็บน้ำ เพื่อป้องกันไม่ให้น้ำล้นออกมาทางสันเขื่อน เนื่องจากทางชลประทานยังสามารถควบคุมมวลน้ำที่ทะลักออกมาทางคันดินผนังกั้นน้ำได้ แต่หากปริมาณน้ำล้นสันเขื่อนเราจะไม่สามารถควบคุมปริมาณน้ำได้เลย ทั้งนี้ชลประทานยังต้องเร่งระบายน้ำออกจากอ่างเก็บน้ำลำเชียงไกร (ตอนล่าง) เนื่องจากคาดการณ์ว่ายังคงมีมวลน้ำจากพื้นที่ด้านบนที่กำลังไหลลงมาที่อ่างอีกจำนวนมากกว่า 100 ล้านลูกบาศก์เมตร […] The post โคราช สั่งอพอพประชาชนริมน้ำท้ายอ่างเก็บน้ำลำเชียงไกร 8 อำเภอ appeared first on MONO29 TV Official Site.,https://mono29.com/news/344782.html,26_09_2021
ทายาทหัวเว่ย เดินทางถึงจีนแล้ว ขอบคุณผู้นำจีน,"น.ส.เมิ่ง หว่านโจว ประธานคณะเจ้าหน้าที่บริหารฝ่ายการเงิน หรือ CFO ของ บริษัท หัวเว่ย กล่าวขอบคุณประธานาธิบดีสี จิ้นผิง และพรรคคอมมิวนิสต์ ที่สนับสนุนให้แก่เธอ ตลอดระยะเวลากว่า 1,000 วัน ที่ต้องถูกกักตัวอยู่ในแคนาดา บรรยากาศ ที่ท่าอากาศยานนานาชาติเซินเจื้น เป่าอัน ผู้คนมารวมตัวกันให้กำลังใจและ ต้อนรับ น.ส.เมิ่ง เป็นจำนวนมาก รายงานระบุว่า อิสรภาพของเมิ่ง เกิดขึ้น หลังมีรายงานออกมากว่า เธอได้บรรลุข้อตกลงกับพนักงานสอบสวนของสหรัฐ ภายใต้เงื่อนไขสำคัญ รวมถึงการที่เธอยอมรับความผิดพลาดต่อการนำเสนอเนื้อหาทางธุรกิจ ที่ทำให้เกิดความเข้าใจว่า มีการจัดตั้งบริษัทบังหน้าในการทำธุรกิจกับอิหร่าน The post ทายาทหัวเว่ย เดินทางถึงจีนแล้ว ขอบคุณผู้นำจีน appeared first on MONO29 TV Official Site.",https://mono29.com/news/344784.html,26_09_2021
