title,summary,link,published
ปภ.เตือน 12 จังหวัดลุ่มเจ้าพระยาและกรุงเทพฯ ระวังผลกระทบน้ำหลาก,"กรมป้องกันและบรรเทาสาธารณภัย(ปภ.) แจ้งเตือน 12 จังหวัดลุ่มน้ำเจ้าพระยาและกรุงเทพมหานคร เฝ้าระวังผลกระทบจากน้ำหลากจากพื้นที่ตอนบนของลุ่มแม่น้ำเจ้าพระยาไหลลงเหนือเขื่อนเจ้าพระยา นายบุญธรรม เลิศสุขีเกษม อธิบดีกรมป้องกันและบรรเทาสาธารณภัย (ปภ.) ในฐานะผู้อำนวยการกลาง กองอำนวยการป้องกันและบรรเทาสาธารณภัยกลาง (กอปภ.ก.) เปิดเผยว่า จากการติดตามสถานการณ์น้ำกับกรมชลประทาน พบว่า ในห้วงเวลาที่ผ่านมาประเทศไทยมีฝนตกสะสมอย่างต่อเนื่องบริเวณประเทศไทยตอนบน และคาดการณ์ว่า ในช่วงวันที่ 26-30 กันยายน 2564 ร่องมรสุมจะเลื่อนลงไปพาดผ่านภาคกลางตอนล่าง ทำให้ยังคงมีฝนตกหนักบางพื้นที่บริเวณภาคกลาง ส่งผลให้มีปริมาณน้ำไหลลงเหนือเขื่อนเจ้าพระยาในอัตราเพิ่มมากขึ้น โดยคาดการณ์ปริมาณน้ำไหลผ่านสถานีวัดน้ำ มีแนวโน้มเพิ่มขึ้นอยู่ในเกณฑ์ประมาณ 2,400-2,500 ลูกบาศก์เมตรต่อวินาที กรมชลประทานได้ใช้การบริหารจัดการน้ำ รวมทั้งตัดยอดน้ำเข้าพื้นที่ลุ่มต่ำทั้งสองฝั่ง แต่ยังจำเป็นต้องปรับเพิ่มปริมาณน้ำไหลผ่านเขื่อนเจ้าพระยาอยู่ระหว่าง 2,400-2,500 ลูกบาศก์เมตรต่อวินาที ซึ่งจะส่งผลให้ระดับน้ำท้ายเขื่อนเจ้าพระยาสูงเพิ่มสูงขึ้นประมาณ 0.30-1.00 เมตร ระหว่างวันที่ 26-29 กันยายน 2564 ในบริเวณลุ่มต่ำนอกคันกั้นน้ำ กรมป้องกันและบรรเทาสาธารณภัย (ปภ.) จึงได้ประสาน 12 จังหวัดลุ่มน้ำเจ้าพระยา ได้แก่ อุทัยธานี ชัยนาท สิงห์บุรี อ่างทอง สุพรรณบุรี พระนครศรีอยุธยา ลพบุรี ปทุมธานี […] The post ปภ.เตือน 12 จังหวัดลุ่มเจ้าพระยาและกรุงเทพฯ ระวังผลกระทบน้ำหลาก appeared first on MONO29 TV Official Site.",https://mono29.com/news/344772.html,26_09_2021
นครเซี่ยงไฮ้ ของจีน เตรียมเปิดบริการรถไฟสินค้า จากเซี่ยงไฮ้ ไปยังนครฮัมบวร์ก ของเยอรมนี,สำนักข่าวซินหัว รายงานว่า นครเซี่ยงไฮ้ ศูนย์กลางเศรษฐกิจทางตะวันออกของจีน เตรียมเปิดบริการรถไฟสินค้าสู่นครฮัมบวร์ก ของเยอรมนี ซึ่งถือเป็นบริการรถไฟข้ามพรมแดนระหว่างเซี่ยงไฮ้-ยุโรป สายแรกในวันอังคารนี้ รถไฟสินค้า เซี่ยงไฮ้ เอ็กซ์เพรส จะให้บริการขนส่งสินค้าเสื้อผ้า ชิ้นส่วนยานยนต์ ตลอดจนสิ่งของจำเป็น และ อื่นๆ อีกมาก โดยจะออกจากจีน ทางด่าน อาลาซานโข่วในเขตปกครองตนเองซินเจียงอุยกูร์ทางตะวันตกเฉียงเหนือ และเดินทางถึงฮัมบวร์ก ในอีก 2 สัปดาห์ ศุลกากรของเซียงไฮ้ ระบุว่า ขบวนรถของเส้นทางนี้ จะวิ่งให้บริการประจำทุกสัปดาห์ และ จะช่วยเพิ่มทางเลือกด้านโลจิสติกส์ แก่บรรดาผู้ประกอบการทั้งในประเทศและต่างประเทศให้มากยิ่งขึ้น The post นครเซี่ยงไฮ้ ของจีน เตรียมเปิดบริการรถไฟสินค้า จากเซี่ยงไฮ้ ไปยังนครฮัมบวร์ก ของเยอรมนี appeared first on MONO29 TV Official Site.,https://mono29.com/news/344770.html,26_09_2021
ชัยภูมิวิกฤต!  น้ำทะลักเข้ารพ. – น้ำท่วมหนักในรอบ 50 ปี อ่วมสุด 3 อำเภอ บ้านจมมิดหลังคา อพยพชาวบ้านหลายพันคน,สถานการณ์น้ำท่วมในพื้นที่จ.ชัยภูมิ จากอิทธิพลพายุ “เตี้ยนหมู่” พัดถล่มเกิดฝนตกหนักมาต่อเนื่องในช่วง 2-3 วันที่ผ่านมาตลอดทั้งวันทั้งคืน ล่าสุดเกิดสถานการณ์น้ำท่วมใหญ่หนักสุดเป็นประวัติการณ์เท่าที่เคยมีมาใน จ.ชัยภูมิ ในรอบกว่า 50 ปี ทำให้มีระดับน้ำป่าทะลักท่วมหนักมาต่อเนื่องในทั่วทั้งจังหวัดชัยภูมิ ได้รับความเดือดร้อนหนักที่สุดในขณะนี้อีกกว่า 3 อำเภอ มีน้ำป่าหลากและทะลักล้นสันเขื่อนลำคันฉู ในพื้นที่ อ.บำเหน็จณรงค์ เกิดน้ำป่าไหลหลากน้ำท่วมฉับพลันเข้ามาในพื้นที่โรงพยาบาลประจำอำเภอบำเหน็จณรงค์ และในทั่วตัวอำเภอโซนเศรษฐกิจซึ่งมีระดับน้ำท่วมสูงอย่างรวดเร็วขณะนี้สูงกว่า 5 เมตรแล้ว และยังมีระดับน้ำไหลเชี่ยวรุนแรงสูงเพิ่มขึ้นอีกต่อเนื่องไม่หยุด ซึ่งตั้งแต่กลางดึกวานนี้( 25 ก.ย.64)ที่ผ่านมาทางเจ้าหน้าที่เกี่ยวข้องต้องเร่งอพยพคนไข้ผู้ป่วย แพทย์หมอพยาบาลออกจากพื้นที่กันอย่างอลหม่านมาต่อเนื่องยันช่วงสายที่ผ่านมา(2ว ก.ย.64) ซึ่งมีผู้ป่วยโควิด-19 รักษาตัวอยู่ภายในโรงพยาบาลรวม 10 ราย ผู้ป่วยทั่วไป 30 ราย พร้อมเจ้าหน้าที่แพทย์หมอพยาบาลรวมอีกกว่า 120 คนได้อพยพไปอยู่ที่บริเวณภายใน ปตท.ตลาดคำปิง อ.บำเหน็จณรงค์ และได้ใช้เรือกู้ชีพมารับผู้ป่วยอาการหนัก 3 รายเพื่อเร่งนำส่ง รพ.พระทองคำ จ.นครราชสีมา เป็นการชั่วคราวไปก่อนแล้ว ซึ่งขณะนี้ด้านการเข้าไปช่วยเหลือประชาชนที่ประสบภัยในพื้นที่ อ.บำเหน็จณรงค์ ทั้งหมด ไม่สามารถเข้าไปภายในได้ทั้งหมด ซึ่งระดับน้ำยังหลากท่วมขยายวงกว้างต่อเนื่องจมบาลบ้านบ้านเรือนประชาชนในพื้นที่ถูกน้ำท่วมสูงจมมิดหลังคาเกือบทั้งหมดแล้ว ซึ่งล่าสุดทางชาวบ้าน เจ้าหน้าที่แพทย์พยาบาล ที่พากันอพยพหนีน้ำมาอาศัยอยู่ที่ปั้ม ปตท.คำปิง […] The post ชัยภูมิวิกฤต! น้ำทะลักเข้ารพ. – น้ำท่วมหนักในรอบ 50 ปี อ่วมสุด 3 อำเภอ บ้านจมมิดหลังคา อพยพชาวบ้านหลายพันคน appeared first on MONO29 TV Official Site.,https://mono29.com/news/344767.html,26_09_2021
“บิ๊กตู่” ตรวจน้ำท่วม จ.สุโขทัย ลั่น “ไม่ว่าใคร หากโทษน้ำท่วมเพราะนายกฯ” ชี้ตัวเองทำงานมากสุดในหลายปีที่ผ่านมา,พล.อ.ประยุทธ์​ จันทร์​โอชา​ นายก​รัฐมนตรี​และ​รัฐมนตรี​ว่าการ​กระทรวง​กลาโหม​ เข้าสักการะหลวงพ่อสามพี่น้องและหลวงพ่อขาว​ ที่​ วัดบ้านซ่าน​ ต.บ้านซ่าน​อ.ศรีสำโรง​ จ.สุโขทัย​ ซึ่งเป็นพระพุทธรูปสำริดปางมารวิชัยสมัยสุโขทัยมีอายุกว่า 700 ปี ถือเป็นสิ่งศักดิ์สิทธิ์ที่ประชาชนให้ความเคารพ ก่อนเข้ารับการบรรยายสรุปแผนการบริหารจัดการน้ำในพื้นที่​ และทักทายประชาชนที่มาให้การต้อนรับ ทั้งนี้​ นายกรัฐมนตรี​ กล่าวว่า​ ขอกระแอมหน่อย​ วันนี้เดินทางกรุงเทพ​ฯ​ มาแต่เช้า​ ต้องขอโทษส่วนข้าราชการต่างๆ​​ แม้จะเป็นช่วงวันหยุด​ แต่เมื่อใดก็ตามที่ประชาชน ได้รับความเดือดร้อน เราก็หยุดไม่ได้ วันนี้นายกฯ นำพาหัวใจคนกรุงเทพฯ​ หัวใจคนต่างจังหวัดมาช่วย​ ด้วยความห่วงใยเราเป็นพี่น้องกันเราเป็นคนไทยด้วยกัน เราจึงต้องห่วงใยกันซึ่งไม่ใช่เพียงแค่จังหวัดนี้เดือดร้อน​ แต่จังหวัดอื่นก็เดือดร้อน​ จากพายุที่เข้ามาเป็นระยะ ซึ่งรัฐบาลจำเป็นต้องมีแผนการบริหารจัดการน้ำทั้งประเทศในภาพรวม​ และอีกเรื่องจะต้องดูว่าประเทศไทยจะเดินหน้าไปอย่างไรเพื่อพลิกโฉมคนไทย​ ให้ประชาชนมีรายได้ที่เพียงพอ​ เพียงพอต่อการใช้จ่ายและเพียงพอเพื่อให้ลูกหลานได้เรียนหนังสือ​ ที่รัฐบาลต้องเร่งคิด​ ต้องพยายามแก้ปัญหาติดขัดที่มีมากพอสมควร ซึ่งเราเดินได้มาขนาดนี้แล้ว ก็ต้องเดินต่อไปเพราะนี่คืออนาคต ซึ่งเป็นอนาคตที่ทุกคนจำเป็นต้องมีส่วนร่วมรัฐบาล​และนายกรัฐมนตรี​ในการเดินหน้าประเทศ​ ที่ทุกคนต้องช่วยกันเดินตามถนนที่รัฐบาลทำไว้ให้​ หาประโยชน์​จากถนนเหล่านั้น ทั้งนี้​ นายกรัฐมนตรี​ กล่าวว่า ในเรื่องของการแก้ไขปัญหาน้ำท่วมไม่สามารถแก้ได้ ร้อยเปอร์เซ็นต์เพราะประเทศเราเป็นที่สูงมาที่ต่ำ​ จากเหนือมาใต้​ ซึ่งน้ำไม่ได้ไหลจากภาคใต้ไปภาคเหนือได้​ จึงต้องไหลมาตรงกลาง​มารวมในแม่น้ำต่างๆ​ โดยท่วมพื้นที่ซ้ำๆ​ จึงต้องมีการบริหารจัดการเป็นพื้นที่ไป​ พร้อมเตรียมพื้นที่เก็บน้ำไว้เพื่อให้มีน้ำใช้อย่างเพียงพอ​ และ […] The post “บิ๊กตู่” ตรวจน้ำท่วม จ.สุโขทัย ลั่น “ไม่ว่าใคร หากโทษน้ำท่วมเพราะนายกฯ” ชี้ตัวเองทำงานมากสุดในหลายปีที่ผ่านมา appeared first on MONO29 TV Official Site.,https://mono29.com/news/344765.html,26_09_2021
พบกระทิงป่าอุทยานฯเขาใหญ่ ถูกไฟช็อตตายติดเสาไฟฟ้าข้างถนน,เมื่อช่วงเช้าที่ผ่านมา บริเวณเสาไฟฟ้าข้างทางถนนสาย 304 กบินทร์ – นครราชสีมา ในเขตตำบลบุพราหมณ์ อำเภอนาดี จังหวัดปราจีนบุรี พบกระทิงเพศผู้ น้ำหนักกว่า 800 กิโลกรัมนอนตายอยู่กับเสาไฟฟ้า เบื้องต้นคาดว่า กระทิงน่าจะออกมาหากินข้างทางและถูกกระแสไฟฟ้าที่เสาไฟช็อตเสียชีวิต เนื่องจากตั้งแต่ช่วงค่ำวานนี้ มีฝนตกในพื้นที่อุทยานแห่งชาติเขาใหญ่ตลอดทั้งคืน อาจทำให้กระแสไฟฟ้าที่เสาไฟเกิดรั่วและช็อตกระทิงดังกล่าว หลังเกิดเหตุเจ้าหน้าที่อุทยานแห่งชาติเขาใหญ่ ได้ประสานไปยังเจ้าหน้าที่ไฟฟ้าทำการตัดกระแสไฟ ก่อนจะนำรถเครนมาทำการเคลื่อนย้ายกระทิง ให้สัตวแพทย์ทำการผ่าพิสูจน์หาสาเหตุการตายที่แท้จริงอีกครั้ง The post พบกระทิงป่าอุทยานฯเขาใหญ่ ถูกไฟช็อตตายติดเสาไฟฟ้าข้างถนน appeared first on MONO29 TV Official Site.,https://mono29.com/news/344763.html,26_09_2021
“ราชกิจจาฯ” ประกาศให้สำนักงานประกันสังคม “จ่ายค่าตรวจโควิด แบบ RT-PCR ให้โรงงาน” ที่ร่วม Factory sandbox นำร่อง 7 จังหวัดสีแดงเข้ม,เว็บไซต์ราชกิจจานุเบกษา เผยแพร่ ประกาศคณะกรรมการการแพทย์ตามพระราชบัญญัติประกันสังคม เรื่อง หลักเกณฑ์ และอัตราค่าบริการทางการแพทย์กรณีคัดกรองการติดเชื้อไวรัสโคโรนา 2019 หรือโรคโควิด-19 (Coronavirus Disease 2019 (COVID-19)) ตามแนวทางโครงการ Factory sandbox ลงนาม โดย ศาสตราจารย์คลินิกเกียรติคุณเหลือพร ปุณณกันต์ ประธานกรรมการการแพทย์.สาระสำคัญของประกาศ ระบุว่า เห็นชอบตามที่กระทรวงแรงงานได้จัดทำข้อเสนอโครงการนำร่องเกี่ยวกับแรงงานในสถานประกอบกิจการและโรงงานตามโครงการ Factory sandbox เพื่อจัดการโครงสร้างและกระบวนการในลักษณะ “เศรษฐศาสตร์สาธารณสุข” ที่ดำเนินการควบคู่กันระหว่างสาธารณสุขและเศรษฐกิจ โดยเฉพาะภาคการผลิตและอุตสาหกรรมการส่งออกขนาดใหญ่.อันประกอบด้วย 4 ภาคส่วน คือ ภาคส่วนยานยนต์ ภาคส่วนชิ้นส่วนอิเล็กทรอนิกส์ ภาคส่วนอาหาร และภาคส่วนอุปกรณ์ทางการแพทย์ ซึ่งถือเป็นกลไกหลักที่ช่วยพยุงเศรษฐกิจของประเทศในปัจจุบัน.โดยมีหลักการสำคัญ คือตรวจ รักษา ควบคุม ดูแล เพื่อให้การบริหารทรัพยากรที่มีอยู่อย่างจำกัดเกิดประโยชน์สูงสุดและตรงกลุ่มเป้าหมาย ให้ผู้ประกันตนในสถานประกอบการที่ดำเนินกิจการผลิตเพื่อการส่งออกสินค้าทั้ง 4 ภาคส่วนดังกล่าว ซึ่งมีลูกจ้างตั้งแต่ 500 คนขึ้นไป ในพื้นที่ 7 จังหวัดนำร่องที่เป็นพื้นที่ควบคุมสูงสุดและเข้มงวด. ระยะที่ 1 ได้แก่จังหวัดชลบุรี จังหวัดนนทบุรี จังหวัดสมุทรสาคร […] The post “ราชกิจจาฯ” ประกาศให้สำนักงานประกันสังคม “จ่ายค่าตรวจโควิด แบบ RT-PCR ให้โรงงาน” ที่ร่วม Factory sandbox นำร่อง 7 จังหวัดสีแดงเข้ม appeared first on MONO29 TV Official Site.,https://mono29.com/news/344758.html,26_09_2021
